url,title,description,content
https://tuoitre.vn/lam-the-nao-cho-con-tuoi-tho-hanh-phuc-ky-2-chuyen-nha-cho-con-ve-que-20251018221014622.htm,Làm thế nào cho con tuổi thơ hạnh phúc? - Kỳ 2: Chuyển nhà cho con về quê,"Đang có cuộc sống, công việc ở Hà Nội, chị Mai Trần Linh Giang (hiện phụ trách điều hành một trường mầm non ở Đồng Hới, Quảng Trị) bàn với chồng chuyển về quê vì muốn theo đuổi những giá trị cần cho con.","Các con chị Giang trong những buổi chiều lang thang trên đồng quê - Ảnh: NVCC
Chị Giang kể: ""Nơi chúng tôi chuyển đến là một làng chài trong khu vực bán đảo thuộc Đồng Hới. Nhiều người thắc mắc sao dọn về quê, nơi có khí hậu khắc nghiệt, lại khó có điều kiện sống tốt như ở Hà Nội.
Nhưng tôi đã sống cả ở phố và quê nên tôi thích sự khoáng đạt, gần gũi với thiên nhiên hơn so với đô thị đông đúc đang được bê tông hóa.
Điều tôi mong muốn hơn khi chuyển về quê sống là các con có thể ""lắng nghe"" cuộc sống tự nhiên thật nhiều và bố mẹ cũng có thể lắng nghe những thay đổi trong tâm hồn.
Sau này các con tôi sẽ không ở đây mà bước ra thế giới rộng lớn, thậm chí có thể ra nước ngoài. Nhưng trước khi như thế, tôi muốn các con có một tâm hồn đẹp và một tuổi thơ bình yên để làm điểm tựa"".
Thời gian đầu mới chuyển về quê, vợ chồng chị Giang quyết định xin học cho con lớn ở một trường làng, còn bạn nhỏ thì ở nhà với mẹ. Trường làng đúng nghĩa vì không có học thêm nhiều thứ như ở TP. Con học một buổi, tầm trưa là tan học.
""Chiều nào tôi cũng dắt bọn trẻ đi chơi. Chúng tôi tham quan làng chài, ngắm nhịp sống diễn ra ở đây rồi khám phá những ngọn đồi, sông, suối xung quanh. Bọn trẻ không nhanh chán như nhiều người hình dung, vì ngày nào chúng cũng có lý do... để yêu thích một thứ gì đó.
Niềm yêu thích có thể chỉ là cùng nhau đạp xe dọc bờ biển hay những cánh đồng đầy gió.
Ở quê, chúng tôi có những cơ hội lắng nghe được những âm thanh tự nhiên nhất, như tiếng hàng dương reo vi vu, tiếng sóng biển, tiếng nước suối chảy, tiếng con dế, con ếch kêu. Hay những mùi tự nhiên của đời sống như mùi quả chín trong vườn, vị mặn của gió biển, mùi nồng nồng của tôm cá làng chài...
Có những ngày chúng tôi ngồi hàng giờ chỉ để xem một dòng suối chảy. Với người lớn từng phải sống trong môi trường nhiều áp lực thì không gian sống đó giúp ta tĩnh tâm. Còn với con trẻ, tôi nghĩ là cách bồi đắp để bọn trẻ lắng nghe được những âm thanh nguyên bản, nhìn thấy những vẻ đẹp nguyên sơ trước khi trưởng thành"" - chị Giang chia sẻ.
Người mẹ trẻ cho rằng sự yên bình của thiên nhiên và môi trường sống có thể khiến tâm hồn đứa trẻ hiền hòa. ""Các con tôi ít có những cảm xúc tiêu cực, đặc biệt là không cáu giận, bực bội như biểu hiện của nhiều đứa trẻ chịu những áp lực khác nhau. Bọn trẻ cũng có lúc cãi cọ nhưng đều kết thúc với sự vui vẻ. Nếu nói ngắn gọn về không khí giữa chúng tôi là lắng nghe, hợp tác và hòa bình"" - chị Giang nói.
Các con của chị Giang đều thích nhạc và vẽ. Chị kể những cuộc đi lang thang của mẹ con rất ấn tượng với bọn trẻ. Chúng đã vẽ lại những gì được ngắm, được xem sau mỗi lần đi chơi về. Tình yêu với nghệ thuật có lẽ cũng được khơi gợi từ cuộc sống yên bình và những kỷ niệm tuổi thơ.
""Con lớn tôi đã bước vào những năm cuối phổ thông, khi bàn với con về định hướng nghề nghiệp tôi cũng gợi ý con có thể theo đuổi nghệ thuật. Nhưng con không muốn chọn hội họa để theo đuổi như một nghề. Con nói chỉ giữ hội họa bên mình vì yêu thích.
Chúng tôi tôn trọng điều đó vì hiểu con muốn giữ những cảm xúc thuần khiết với hội họa như những gì con được sống, trải nghiệm ở nơi này"".
Chị Giang và chồng không đặt nặng việc học thêm và điểm số ở trường. Về điều này chị chia sẻ: ""Tôi luôn quan niệm trường học giống một xã hội thu nhỏ, ở đó con học cách làm bạn, học ứng xử với những vấn đề xung quanh chứ không đơn thuần chỉ để học lấy kiến thức. Tôi không gây áp lực điểm số cho con nhưng tôi quan tâm tới mọi thứ diễn ra xung quanh con ở trường, chúng tác động đến các con như thế nào.
Tôi nghĩ thay vì đạt điểm 9, 10 con có thể chỉ đạt 7, 8 điểm nhưng đó là cố gắng và thực lực của con là vui rồi. Nhưng quan sát từ con tôi nhận ra khi ta không tạo áp lực, bọn trẻ có tâm lý thoải mái, vui vẻ thì chúng lại thích sự học và học tốt. So với các mục tiêu mà nhiều cha mẹ đặt ra cho con thì tôi chỉ muốn đồng hành cùng con để tạo ra và nuôi dưỡng những điều con thực sự yêu thích"".
Trẻ được đọc sách giữa thiên nhiên yên bình - Ảnh: NVCC
Hiện là người điều hành một trường mầm non, chị Giang chia sẻ mình có thêm trải nghiệm về việc ""làmphụ huynh"" qua câu chuyện của những phụ huynh khác, những đứa trẻ khác ở trường mầm non.
""Khi thấy con trai tôi tới tuổi nên đến trường và nên có bạn bè cùng trang lứa xung quanh chứ không chỉ lang thang cùng mẹ, tôi bắt đầu suy nghĩ về việc mở trường. Và con chính là động lực để tôi mở ngôi trường bây giờ. Việc mở trường cũng có nhiều khó khăn, vất vả và phức tạp như tất cả những người mở trường tư thục khác. Nhưng tôi vẫn cố gắng duy trì những mục tiêu ban đầu đặt ra"" - chị Giang kể lại.
Ngoài công việc bận rộn của người quản lý, chị Giang quan sát những đứa trẻ và viết. Chị kể: ""Ở trường tôi có những đứa trẻ khá khác biệt so với nhiều đứa trẻ xung quanh. Ví dụ có một bé khiến tôi chú ý khi có thể tự chơi một mình với những đồ vật xung quanh bằng sự tưởng tượng. Thoạt nhìn thì thấy bé hơi tách biệt với các bạn nhưng khi trong lớp có bạn bị đau, lập tức bé đó thể hiện sự quan tâm và có kỹ năng chăm sóc bạn.
Cháu cũng đối xử với đồ vật, cây cỏ như với người. Khi có bạn giẫm lên cỏ, bé liền nhắc ""đừng làm thế, cỏ sẽ bị đau đấy"". Vì chú ý nên tôi tìm hiểu và biết bố mẹ bé đó là bác sĩ.
Họ bận rộn, ít thời gian cho con hơn người khác nhưng chú ý rèn con tự chơi, tự học, tự chăm sóc mình.
Ý thức chăm sóc người khác của bé tôi nghĩ có thể đã được di truyền từ nghề nghiệp bố mẹ, từ các câu chuyện, tình huống bố mẹ trò chuyện thường ngày. Quan sát về trẻ rồi hiểu về gia đình trẻ càng khiến tôi thấy môi trường giáo dục gia đình quan trọng"".
Một quan sát khác của chị Giang sau thời kỳ COVID-19 là thấy rõ có khá nhiều trẻ cáu kỉnh, mất kiểm soát cảm xúc. Lại có một số bé phản ứng rất chậm chạp, có biểu hiện lệ thuộc vào ti vi. Có trẻ thì tỏ ra ích kỷ chiếm ti vi xem không muốn cho các bạn khác cùng xem.
Chị mang việc này trao đổi với phụ huynh, nhiều người cũng thừa nhận việc cho con tiếp xúc nhiều với thiết bị điện tử, nhất là thời gian dịch bệnh. Nhưng nhiều phụ huynh trẻ cho rằng họ bận rộn nên không có thời gian dành cho con cũng không có khả năng xử lý được các vấn đề như giáo viên ở trường.
""Tôi không nghĩ như vậy, không có trường học nào cho phụ huynh từ trước khi chúng ta bước vào cuộc sống làm cha mẹ. Thế nên để làm phụ huynh tốt là một khó khăn với bất cứ ai.
Có nhiều người sẵn sàng đóng nhiều tiền cho con học ở trường tốt nhưng không sẵn sàng từ bỏ thói quen, sở thích của mình để dành thời gian cho con nhiều hơn.
Tôi đã nghĩ về điều này rất nhiều để luôn nhắc bản thân giữ một nguyên tắc dù bận rộn và có lúc phải ưu tiên cho công việc nhưng nếu con cần mình thì tôi luôn thu xếp để có mặt bên cạnh con"", chị Giang chia sẻ.
__________________________________________
""Điều tôi thấy mừng là bọn trẻ có khả năng thích ứng và cũng dần có thói quen tự lập. Nhưng điều thú vị hơn cả là chúng tôi có những niềm vui cùng nhau"".
Kỳ tới:Cùng con ra đảo
Những cha mẹ ở lứa tuổi cuối 8X đầu 9X, thế hệ phụ huynh trẻ bối rối giữa các xu hướng giáo dục khác nhau, sức tác động của thời đại công nghệ, cả những bất an từ nhiều hiện trạng tiêu cực.
Tối đa:1500 ký tự
Hiện chưa có bình luận nào, hãy là người đầu tiên bình luận"
https://tuoitre.vn/lam-the-nao-cho-con-tuoi-tho-hanh-phuc-ky-1-buoi-toi-ben-nhau-khong-thiet-bi-dien-tu-20251017215246789.htm,Làm thế nào cho con tuổi thơ hạnh phúc? - Kỳ 1: Buổi tối bên nhau không thiết bị điện tử,"Những cha mẹ ở lứa tuổi cuối 8X đầu 9X, thế hệ phụ huynh trẻ bối rối giữa các xu hướng giáo dục khác nhau, sức tác động của thời đại công nghệ, cả những bất an từ nhiều hiện trạng tiêu cực.","Chị Ngọc dành thời gian chơi cùng con để hạn chế con tiếp xúc thiết bị điện tử - Ảnh: NVCC
Một số người đã quyết định tìm cho con một không gian sống mới mà ở đó họ cảm nhận con mình được hạnh phúc.
""Tôi và chồng rất hạn chế dùng điện thoại hay lướt mạng buổi tối khi các con ở nhà"" - chị Nguyễn Thị Ngọc, nhân viên truyền thông ở một trường tư thục tại Hà Nội, có hai con độ tuổi tiểu học và THCS chia sẻ.
Tự nhận không làm được gì to tát cho các con mà chỉ cố gắng những chuyện nhỏ nhặt, chị Ngọc chia sẻ: ""Tôi không cho con học thêm vì các con đã học ở trường cả ngày và đã học quá nhiều rồi. Chúng tôi dành tối đa thời gian buổi tối hay ngày nghỉ để bố mẹ và các con bên nhau. Buổi tối sau bữa ăn thì contự học. Rồi chúng tôi có một khoảng thời gian trò chuyện, chơi cùng nhau. Tôi và chồng cũng ít dùng điện thoại hay vào mạng buổi tối khi có các con ở nhà, ngoại trừ có việc đặc biệt.
Thường mỗi tối tôi có một cuộc gọi cho bố mẹ và có thể kết nối để ông bà nói chuyện với các cháu. Sau đó thì sẽ không dùng đến điện thoại. Những trao đổi về công việc hay nhu cầu cá nhân tôi làm vào ban ngày, lúc các con đã đi học"".
Chị Ngọc cho rằng khi không dùng điện thoại hay lướt mạng chỉ để xem tin, tán gẫu thì bố mẹ cũng có khá nhiều thời gian để trò chuyện, chơi hay làm gì đó cùng các con. Buổi tối của gia đình chị là cùng nấu nướng, dọn dẹp nhà cửa, đọc sách hay đơn giản là nói chuyện.
""Các con có rất nhiều chuyện ở trường để kể cho bố mẹ, chỉ là bố mẹ có thời gian để nghe không và có đủ kiên nhẫn. Ví dụ việc thầy giáo thu hồi một con gấu bông vào giờ nghỉ trưa, việc bạn A ở lớp được cô khen, cả những chuyện cãi cọ, vui vẻ hay buồn phiền giữa con và các bạn.
Con trai tôi thì còn rất ""nguyên tắc"" với combo sau bữa tối gồm đánh răng, uống nước ấm trước khi lên giường, trò chuyện, nghe bố, mẹ đọc sách. Đó là những buổi tối nói không với thiết bị điện tử của chúng tôi"", chị Ngọc kể lại.
Combo buổi tối của gia đình chị Ngọc thực sự không phải là ""chuyện nhỏ"" mà sẽ khó có nhiều phụ huynh thời nay làm được. Người lớn sẽ có nhiều lý do từ giải quyết công việc đến duy trì quan hệ với đối tác, cả việc xả stress. Và đương nhiên với con trẻ, họ cũng có lý do như ""thế hệ gen Z phải giỏi công nghệ"", ""ngăn con tiếp xúc với công nghệ là con tụt hậu"".
Nói về điều này, chị Ngọc cho rằng: ""Tôi chỉ tạo không gian không thiết bị điện tử khi ở nhà, khi bố mẹ và các con ở cùng nhau"".
Chị kể: ""Tôi từng chuyển trường cho con một lần vì con về nhà khóc khi cảm thấy lạc lõng với bạn học. Các bạn thường nói về TikTok trong khi con chỉ hay đọc sách. Chuyện trở nên đáng lo hơn khi con còn stress đến đau dạ dày.
May sao ở nơi mới, trường chú trọng văn hóa đọc. Con có các bạn cùng sở thích đọc sách. Nhưng bên cạnh đó các con cũng được học về công nghệ. Các con có các giờ học sử dụng trí tuệ nhân tạo (AI) cho học tập, được thiết kế game. Và vì được thiết kế nên con hiểu cả ưu, nhược điểm của game.
Hằng ngày khi ở trường, con dùng Microsoft Teams theo hướng dẫn của thầy cô để học tập. Tôi biết với con trẻ không thể cấm các con dùng thiết bị điện tử nói chung hay chơi game, vào mạng nói riêng.
Nhưng tôi muốn hướng các con đến sự vừa đủ và hiệu quả. Để đồng hành với con, tôi cùng các con dự các buổi nói chuyện hay xem các chương trình hướng dẫn sử dụng Internet tích cực. Tôi nhờ con dạy tôi cách dùng AI trong lúc học mẹ con cùng thảo luận về việc dùng nó như thế nào thì tích cực"".
Cho con gần gũi thiên nhiên - Ảnh: NVCC
Điểm đặc biệt mà chị Ngọc mô tả về không gian gia đình mình là tận dụng đồ cũ, đồ tái chế. Không phải chỉ có quần áo mà cả đồ gia dụng. Ví như xoong nồi cũ không dùng nữa thì chế thành hộp đựng đồ chơi.
""Không phải chúng tôi không có tiền mua đồ mới mà thấy thế là vừa đủ, không muốn mua mới quá nhiều, thừa thãi. Vừa lãng phí tiền vừa làm không gian nhà chật chội. Sự thừa thãi cũng gây hại cho môi trường sống khi chất thải xả ra nhiều nữa. Và chúng tôi muốn thói quen sinh hoạt, những gì chúng tôi làm tác động đến các con. Bọn trẻ theo bố mẹ nên luôn có thói quen tắt điện khi không cần thiết, tiết kiệm nước.
Những vỏ đồ hộp bỏ đi, mẹ con tôi thường tìm địa chỉ nhận tái sử dụng để gửi, có khi đổi vỏ đồ hộp lấy cây xanh về bày ở ban công"" - chị Ngọc giải thích và kể còn đang định làm một ""mảnh vườn"" trong nhà được chế từ cái lều cũ. ""Chúng tôi sẽ mua những cây có thể để được trong không gian phòng và để bọn trẻ chăm sóc hằng ngày"".
Đi chơi cùng nhaucũng là một cố gắng nho nhỏ - chị Ngọc chia sẻ. Bố bận thì mấy mẹ con có thể đón xe buýt, đi xe đạp đâu đó hay đơn giản chỉ là hò nhau dậy sớm để ra công viên và mẹ con cùng thích thú khi xem ve lột xác như thế nào. Nhưng theo chị Ngọc, những chuyến về quê vào dịp hè mới thực sự là một món quà mà chị luôn cố gắng dành cho các con.
Chị kể: ""Về quê thường bọn trẻ cũng chỉ được xem tivi một tiếng trong ngày. Thời gian còn lại có thể đọc sách, chạy nhảy, thử nghiệm nấu những món ăn với sự trợ giúp của người lớn và vui nhất là khám phá ""thế giới"" xung quanh.
Để bọn trẻ không dán mắt vào tivi, tôi dắt chúng ra vườn. Xem cây lên mầm, xem những con sâu, con nhện, con sên chui ra khỏi vỏ và di chuyển như thế nào. Có những hôm chỉ theo dõi đường đi của con cuốn chiếu cũng là một niềm vui.
Tôi cũng không sợ trẻ nghịch đất thì bẩn. Tôi thấy đất còn sạch hơn những thứ trong môi trường nhiều hóa chất ở TP nên nhiều khi bọn trẻ được ra vườn trồng cây, xếp gạch làm rào...
Bọn trẻ cũng có nhiều trải nghiệm vui khác trong những ngày hè. Có lần chúng muốn kiếm tiền để mua vé xem một ca sĩ thần tượng có buổi biểu diễn gần đó. Chúng nghĩ ra việc bán sữa chua túi tự làm.
Ngày đầu đi bán bị ế vì sữa chua không nhãn mác lại không biết bảo quản nên chảy ra nhão nhoét. Tôi hướng dẫn bọn trẻ cách bảo quản và cả cách ""tiếp thị"" nữa. Ngày thứ hai bán được hẳn 100 túi. Việc đó khiến bọn trẻ rất hào hứng. Tuy tới lúc chương trình của ca sĩ kia diễn ra bọn trẻ vẫn chưa kiếm đủ tiền vé nhưng chúng rất vui vì tự mình làm gần đạt được mục tiêu"".
Chị Ngọc đang dự định cùng bọn trẻ làm sân chơi ở quê. Chị chia sẻ quê mình không nghèo nên nhiều gia đình cũng sắm sửa nhiều thiết bị điện tử, không chỉ người lớn mà trẻ con cũng dùng điện thoại có game hay kết nối mạng nhưng lại thiếu những sân chơi để bọn trẻ chơi chung.
""Tôi đã thử liên hệ với vài nơi làm sân chơi cộng đồng nhưng chi phí lớn quá nên dự định phải lùi lại. Tôi quyết định chọn cách tự làm theo hướng tận dụng đồ tái chế, hạn chế mua mới và điều quan trọng là sẽ hướng dẫn để bọn trẻ được tham gia để làm sân chơi cho mình.
Hiện tôi đã tính mua những cái lốp ô tô cũ với giá 2.000-2.500 đồng/cái rồi xin sơn về tự vẽ trang trí thiết kế làm xích đu, ghế ngồi, chỗ để trẻ leo trèo. Làm sao để bọn trẻ vận động nhiều, chơi với nhau nhiều hơn là chơi với máy móc vẫn là điều ta nên nghĩ"", chị Ngọc nói.
_______________________________________
Đang có cuộc sống, công việc ở Hà Nội, chị Giang bàn với chồng chuyển về quê vì muốn theo đuổi những giá trị cần cho con.
Kỳ tới:Chuyển nhà về quê
Mỗi khi hè về, điện thoại lại trở thành ""người bạn thân"" của nhiều trẻ khi thời gian rảnh rỗi kéo dài nhưng lại thiếu các hoạt động thay thế lành mạnh.
Tối đa:1500 ký tự
Hiện chưa có bình luận nào, hãy là người đầu tiên bình luận"
https://tuoitre.vn/tu-vu-ga-loi-trang-bai-hoc-ve-xay-dung-va-ap-dung-luat-20251018080155276.htm,Từ vụ gà lôi trắng: Bài học về xây dựng và áp dụng luật,Vụ một người nuôi gà lôi nhân giống để bán bị phạt 6 năm tù giam nay được đưa ra xử phúc thẩm và được miễn trách nhiệm hình sự vào ngày 17-10.,"Gà lôi trắng - Ảnh: Vinwonder
Thủ tục phúc thẩm được kích hoạt do có kháng cáo của người bị tuyên án và đặc biệt là có kháng nghị của viện kiểm sát đối với toàn bộ nội dung bản án.
Kháng nghị của viện kiểm sát dựa trên nhận định người bị tuyên án đã bị truy cứu trách nhiệm về tội danh không tương thích với hành vi.
Ở thời điểm bản án được tuyên, hành vi đó không bị coi là phạm tội theo điều 244 Bộ luật Hình sự, cũng không mang đầy đủ dấu hiệu của bất kỳ tội danh nào khác. Viện kiểm sát đề nghị miễn truy cứutrách nhiệm hình sựđối với bị cáo. Tòa phúc thẩm cũng đã tuyên án theo đề nghị của viện kiểm sát.
Ngay sau khi án sơ thẩm được tuyên, viện kiểm sát đã kháng nghị hủy toàn bộ án sơ thẩm nhưng kèm theo đó là đề nghịđiều tralại vụ án.
Lý do được cho là dù hành vi không phạm tội danh được ghi nhận trong bản án sơ thẩm vẫn cần xem xét các khả năng khác, đặc biệt là khả năng khép hành vi vào một tội danh khác với mức hình phạt nhẹ hơn, cụ thể là theo điều 234 Bộ luật Hình sự.
Nút thắt của câu chuyện là vấn đề định giá số tài sản, tức là giá của mấy con gà lôi được đem bán: nếu giá này thấp hơn mức phải chịu trách nhiệm hình sự thì thôi, miễn trách nhiệm; còn nếu cao hơn thì phải xem xét tiếp về việc truy cứu trách nhiệm hình sự theo tội danh mới.
Tuy nhiên ở góc nhìn thực tiễn, ai cũng nhận thấy có định giá kiểu gì và gà lôi có to lớn cỡ nào thì tổng giá trị của mấy con gà ấy không thể lên đến mức mà luật cho phép truy cứu trách nhiệm hình sự đối với người trong cuộc.
Rõ hơn, việc hủy án sơ thẩm để điều tra lại là không cần thiết, chỉ gây mất thời gian và tốn kém tiền bạc. Bởi vậy trước khi tòa án mở phiên xử phúc thẩm, viện kiểm sát đã điều chỉnh nội dung kháng nghị: đề nghị miễn trách nhiệm hình sự. Và tòa đã miễn.
Tòa đáng lý ra đã không phải xử phúc thẩm nếu án sơ thẩm không tuyên bị cáo phạm tội. Việc tòa xác định bị cáo có tội ở cấp sơ thẩm được cho là do lúc xét xử tòa chưa cập nhật những thay đổi trong các quy định của pháp luật liên quan đến tiêu chí nhận diện hành vi phạm tội.
Các tiêu chí này lúc ban đầu được ghi nhận trong một nghị định chính phủ nhưng quy định sửa đổi nội dung tiêu chí thì lại được ghi nhận trong một thông tư cấp bộ.
Thông tư này được ban hành đúng thẩm quyền của cấp bộ, được khẳng định tại một nghị định mới về phân quyền ban hành văn bản quy phạm pháp luật trong khung cảnh cải cách thể chế.
Bài học rút ra từ câu chuyện phải thận trọng, chặt chẽ và nhất là tường minh trong việc xây dựng các quy tắc có tác dụng hạn chế các quyền của chủ thể đã được hiến định và luật định.
Tư tưởng chủ đạo là người dân có quyền làm tất cả những gì phù hợp với đạo đức xã hội và không bị luật cấm.
Sự cấm đoán, hạn chế đối với các quyền của người dân phải được minh định trong văn bản luật, bằng các quy tắc dễ hiểu và chỉ được hiểu theo một nghĩa, đồng thời không có nội dung mâu thuẫn với các quy tắc khác.
Một bài học nữa là một khi đã có thể đánh giá định tính và định lượng một hành vi hoặc một sự kiện theo cách thông thường, nghĩa là chỉ cần dựa vào sự hiểu biết phổ thông, không cần ý kiến chuyên gia thì cơ quan có thẩm quyền có thể mạnh dạn quyết định vào sự đánh giá đó.
Trong chuyện gà lôi kể trên chắc chắn có trưng cầu giám định giá đối với mấy con gà thì kết quả không khác so với khảo giá bằng cách thông dụng, dân gian. Bởi vậy không cần điều tra lại vẫn có đủ căn cứ thuyết phục để đề nghị miễn trách nhiệm hình sự cho người thực hiện hành vi.
Để nuôi và buôn bán các loài động vật nguy cấp, quý hiếm như gà lôi trắng, người dân cần tuân thủ các quy định về điều kiện cơ sở nuôi, đăng ký cấp mã số cơ sở nuôi,...
Tối đa:1500 ký tự
Hiện chưa có bình luận nào, hãy là người đầu tiên bình luận"
