url,title,description,content
https://tuoitre.vn/chuyen-doi-cua-sac-20251016084546405.htm,Chuyện đời của sác,"Nước biển nóng lên, thức ăn giảm dần, đàn cá tìm cách vào bờ kiếm ăn.","Nhưng kiếm ăn với loài người đâu có dễ, vậy là đàn cá tìm ""mồi"" là những người cả tin.
Trước hết đàn cá tự xưng mình là cá mập, mà gọi là shark tiếng Tây cho oai, nhiều người hay sính ngoại mà. Vậy là ra đời sác A, sác B, đủ thứ sác.
Các sác tìm cách lên sóng truyền hình, lên báo: bày cách kinh doanh, bày cách làm giàu, kêu gọi mua hàng, huy động vốn.
Khi đã có đàn gà mập bị lùa vào lưới của sác thì sác ta giờ đây trở thành tỉ phú, thành ai đồ (idol) với nhiều người, truyền cảm hứng đủ loại.
Nhưng rồi cây kim trong bọc cũng tới ngày lòi ra, sác bị sa lưới vì lừa đảo.
Sác ân hận, giá như năm nào vẫn cứ ở biển khơi làm cá vẫy vùng, lên bờ hóa sác làm gì để giờ này… ngoi ngóp.
'Ông nói mặt mo nào? Mấy tay làm thiệt hại hàng ngàn tỉ đồng của Nhà nước hả?'.
Tối đa:1500 ký tự
Hiện chưa có bình luận nào, hãy là người đầu tiên bình luận"
https://tuoitre.vn/tranh-ra-mat-mo-20251004074444138.htm,"Tránh ra, mặt mo!",'Ông nói mặt mo nào? Mấy tay làm thiệt hại hàng ngàn tỉ đồng của Nhà nước hả?'.,"- Thôi nhe mặt mo! Đừng làm khổ bà con nữa!
- Ông nói mặt mo nào? Mấy tay làm thiệt hại hàng ngàn tỉ đồng của Nhà nước hả?
- Mấy chuyện to tát đó để lãnh đạo xử lý, tui xe ôm chỉ lo chuyện của giới cần lao thôi.
- Hay mấy tay nào làm khó ông hả?
- Không, là mấy cơn bão, hết bão này đến bão nọ gây thiệt hại cho bà con, thêm cơn bão mặt mo nữa kìa!
- À Matmo!
- Tui xe ôm tiếng Tây tiếng u đâu biết, đọc là mặt mo. Cứ ai làm khổ dân lành thì là mặt mo. Bà con sau hai cơn bão khổ quá rồi, tránh xa ra, mặt mo nghen!
- Ông ơi, tui không ngờ cơn bão Bualoi mang tên một loại chè trôi nước của Thái Lan ngọt ngào, thanh tao vậy mà gây ra thiệt hại quá lớn cho dân lành. Từ nay tui thiệt không ăn chè Thái nữa.
Tối đa:1500 ký tự
Hiện chưa có bình luận nào, hãy là người đầu tiên bình luận"
https://tuoitre.vn/quan-chung-hai-quan-canh-sat-bien-san-sang-cuu-nan-khi-co-tinh-huong-xay-ra-tren-bien-dao-20251019213439379.htm,"Quân chủng Hải quân, Cảnh sát biển sẵn sàng cứu nạn khi có tình huống xảy ra trên biển, đảo","Bộ Tổng Tham mưu Quân đội nhân dân Việt Nam vừa ban hành công điện hỏa tốc gửi các đơn vị toàn quân, yêu cầu chủ động triển khai các biện pháp ứng phó với bão số 12 (Fengshen) trên Biển Đông.","Lực lượng biên phòng Hà Tĩnh hỗ trợ ngư dân chằng chống tàu, thuyền để phòng tránh bão hồi đầu tháng 10-2025 - Ảnh minh họa: LÊ MINH
Cụ thể, Bộ Tổng Tham mưu yêu cầu các đơn vị duy trì nghiêm chế độ ứng trực, chủ động theo dõi, nắm chắc diễn biến bão và mưa lũ sau bão; triển khai các biện pháp phòng, chống, bảo đảm an toàn doanh trại, kho tàng, công trình đang thi công.
Đồng thời, chuẩn bị đầy đủ lực lượng, phương tiện, sẵn sàng ứng phó kịp thời, hiệu quả, bảo đảm tuyệt đối an toàn về người và phương tiện khi thực hiện nhiệm vụ.
Bộ Tổng Tham mưu yêu cầu Quân khu 3, 4, 5, 7 chỉ đạo Bộ Chỉ huy quân sự các tỉnh, thành phối hợp với Sở Nông nghiệp và Môi trường cùng các cơ quan liên quan tham mưu cho cấp ủy, chính quyền địa phương kiểm tra, rà soát kế hoạch, phương án ứng phó phù hợp thực tế.
Các đơn vị cần xác định khu vực trọng điểm thiên tai, những nơi có nguy cơ lũ quét, sạt lở đất, tuyến đê, kè, hồ, đập xung yếu, vùng ngập lụt, chia cắt; huy động lực lượng hỗ trợ sơ tán người dân ra khỏi vùng nguy hiểm, chằng chống nhà cửa, thu hoạch thủy sản, hoa màu, không để xảy ra thiệt hại đáng tiếc do chủ quan, bất cẩn.
Bộ Tư lệnh Bộ đội biên phòngđược giao chỉ đạo Bộ Chỉ huy Bộ đội biên phòng các tỉnh, thành ven biển từ Quảng Ninh - Lâm Đồng phối hợp với cơ quan chức năng địa phương, thông tin kịp thời về diễn biến bão; tiếp tục rà soát, hướng dẫn tàu, thuyền, phương tiện hoạt động trên biển hoặc neo đậu di chuyển khỏi vùng nguy hiểm, vào nơi tránh trú an toàn.
Quân chủng Hải quân và Cảnh sát biển Việt Nam chỉ đạo các cơ quan, đơn vị triển khai biện pháp bảo đảm an toàn, duy trì lực lượng, phương tiện sẵn sàng tìm kiếm cứu nạn khi có tình huống xảy ra trên biển, đảo.
Quân chủng Phòng không - Không quân và Binh đoàn 18 kiểm tra, rà soát kế hoạch, tổ chức lực lượng, phương tiện sẵn sàng thực hiện bay tìm kiếm cứu hộ, cứu nạn, vận chuyển lương thực, nhu yếu phẩm đến vùng ngập lụt, chia cắt khi có lệnh củaBộ Quốc phòng.
Đối với Quân đoàn 12, 34; Bộ Tư lệnh Thủ đô; Binh chủng Pháo binh - Tên lửa và các binh đoàn, binh chủng khác, Bộ Tổng Tham mưu yêu cầu rà soát, bổ sung kế hoạch phù hợp tình hình thực tế; phối hợp chặt với chính quyền nơi đóng quân và nơi thực hiện nhiệm vụ; chuẩn bị lực lượng tham gia cứu hộ, cứu nạn khi có yêu cầu của địa phương.
Binh chủng Thông tin liên lạc chỉ đạo các đơn vị bảo đảm thông tin thông suốt để thủ trưởng Bộ Quốc phòng chỉ đạo, điều hành công tác cứu hộ, cứu nạn, nhất là tại các khu vực bị chia cắt, cô lập.
Tập đoàn Viettel phối hợp với các cơ quan, đơn vị bảo đảm đường truyền và các điều kiện cần thiết phục vụ Chính phủ, Thủ tướng Chính phủ trong chỉ đạo, điều hành công tác phòng thủ dân sự.
Đồng thời, sẵn sàng huy động lực lượng, phương tiện (flycam) phối hợp với Quân khu 3, 4, 5, 7 hỗ trợ địa phương khảo sát các khu vực xung yếu, phát hiện sớm nguy cơ sạt lở, lũ quét, chia cắt để cảnh báo và có biện pháp phòng ngừa kịp thời.
Các Tổng cục Hậu cần - Kỹ thuật, Công nghiệp Quốc phòng, Tài chính II được giao theo chức năng, nhiệm vụ, tăng cường chỉ đạo, đôn đốc, kiểm tra các đơn vị thuộc quyền, bảo đảm tốt công tác ứng phó bão số 12, khắc phục hậu quả mưa lũ, ngập lụt, sạt lở đất, đá.
Giữ an toàn kho xưởng, nhà máy, vũ khí trang bị; chủ động xuất cấp, vận chuyển kịp thời vật tư, phương tiện cứu hộ, cứu nạn hỗ trợ địa phương khắc phục hậu quả thiên tai.
Ngày 18-10, hàng nghìn cư dân trên đảo Catanduanes đã sơ tán khẩn cấp trong bối cảnh bão nhiệt đới Fengshen (Phong Thần) đang áp sát mang theo mưa lớn và nguy cơ ngập lụt ven bờ.
Tối đa:1500 ký tự
Hiện chưa có bình luận nào, hãy là người đầu tiên bình luận"
https://tuoitre.vn/sat-lo-de-doa-nghia-trang-lon-nhat-da-nang-20251019165620905.htm,Sạt lở đe dọa nghĩa trang lớn nhất Đà Nẵng,"Sau nhiều đợt mưa lớn những ngày qua, tại nghĩa trang Hòa Sơn (phường Hòa Khánh, TP Đà Nẵng) xuất hiện các điểm sạt lở, đất đá tràn xuống mặt đường, tiềm ẩn nguy cơ ảnh hưởng hàng trăm ngôi mộ.","Sau nhiều đợt mưa lớn những ngày qua, nghĩa trang Hòa Sơn (phường Hòa Khánh, TP Đà Nẵng) xuất hiện nhiều điểm sạt lở, đất đá tràn xuống mặt đường - Ảnh: THANH NGUYÊN
Ghi nhận ngày 19-10, nhiều khu vực tại nghĩa trang lớn nhấtĐà Nẵng- nghĩa trang Hòa Sơn (phường Hòa Khánh, TP Đà Nẵng), xuất hiện nhiều vết nứt sát khu vực lăng mộ.
Nhiều đoạn đường trong khu nghĩa trang bị bao phủ bởi lớp bùn non, đất đá, khiến việc đi lại khó khăn. Tại các vị trí có độ dốc cao, nước mưa từ sườn đồi tiếp tục chảy xuống tạo thành các rãnh sát mép khu mộ. Một số khu vực xuất hiện vết nứt kéo dài, có khả năng tiếp tục sạt xuống nếu thời tiết cònmưa lớn.
Anh Võ Văn Siêu, người dân địa phương, cho biết:“Nhiều ngày qua, đất đá thường xuyên tràn xuống đường. Từ sau trận sạt lở năm 2022, đến nay người dân vẫn lo lắng cho lăng mộ của thân nhân mỗi mùa mưa bão”.
Nhiều đoạn đường trong khu nghĩa trang bị bao phủ bởi lớp bùn non, đất đá, khiến việc đi lại khó khăn - Ảnh: THANH NGUYÊN
Nghĩa trang Hòa Sơn là nơi an táng hàng chục ngàn ngôi mộ, trong đó có khu vực riêng dành cho liệt sĩ của thành phố.
Tháng 10-2022, nơi đây từng xảy ra sạt lở trên diện tích hơn 2,2ha, hơn 600 phần mộ bị đất đá vùi lấp. Công tác khắc phục khi đó kéo dài nhiều tháng do đường nhỏ hẹp, phương tiện cơ giới khó tiếp cận.
Lo ngại tình trạng tương tự tái diễn, Ban Chỉ huy quân sự phường Hòa Khánh đã kiểm tra toàn bộ các điểm xung yếu.
Theo Ban Chỉ huy quân sự phường Hòa Khánh, đơn vị đã theo dõi sát diễn biến mưa lớn kéo dài nhiều ngày qua, đồng thời tham mưu phương án sơ tán người dân ở những khu vực có nguy cơ bị ảnh hưởng.
Ghi nhận vào ngày 19-10, nhiều khu vực tại nghĩa trang lớn nhất Đà Nẵng - nghĩa trang Hòa Sơn (phường Hòa Khánh, TP Đà Nẵng), xuất hiện nhiều vết nứt gần khu vực lăng mộ - Ảnh: THANH NGUYÊN
Nhiều người dân lo lắng tình trạng sạt lở sẽ tái diễn gây ảnh hưởng đến lăng mộ của thân nhân - Ảnh: THANH NGUYÊN
Tháng 10-2022, nơi đây từng xảy ra sạt lở trên diện tích hơn 2,2ha, hơn 600 phần mộ bị đất đá vùi lấp - Ảnh: THANH NGUYÊN
Do ảnh hưởng của mưa lớn từ ngày 17 đến 18-10, nhiều khu vực miền núi phía tây bắc TP Đà Nẵng ngập lụt, nhiều đoạn đường bị đất đá tràn xuống, gây cản trở giao thông.
Tối đa:1500 ký tự
Hiện chưa có bình luận nào, hãy là người đầu tiên bình luận"
https://tuoitre.vn/sang-chieu-deu-hoi-o-lop-co-giao-co-danh-con-khong-20250917150943207.htm,"Sáng, chiều đều hỏi 'ở lớp, cô giáo có đánh con không?'","'Ở lớp, cô giáo có đánh con không?', câu hỏi tưởng chừng như vô hại đã vô tình gieo vào đầu trẻ những hoài nghi về niềm vui được đến trường mỗi ngày.","Cô giáo và học trò vui vẻ trong giờ ra chơi ở trường tiểu học nơi tác giả từng làm việc - Ảnh: T.V.T.
Năm học 2021-2022, tôi là phó hiệu trưởng của một trường tiểu học, có nhận đơn của người mẹ xin cho con đang học lớp 1 nghỉ học một ngày để đi khám bệnh.
Lý do xinnghỉ họclàm tôi choáng váng: khám bệnh vì bị cô giáo đánh tát vào tai, bây giờ con than đau đầu, không đi học được.
Một lý do nữa khiến tôi choáng váng vì tôi biết cô giáo chủ nhiệm lớp con chị vốn dĩ tính tình hiền lành, nói năng nhỏ nhẹ, rất tận tụy thương yêu học sinh.
Chị còn nhờ tôi trao đổi lại cô giáo nếu có đánh để dọa học sinh thì nên lấy thước kẻ khẻ nhẹ vào tay, chứ đừng tát tai như vậy.
Tôi an ủi, khuyên chị và mời giáo viên chủ nhiệm lên văn phòng cho chị gặp trực tiếp trao đổi cho rõ sự tình.
Khi có ba mặt một lời, phụ huynh kể lúc tan trường buổi sáng chị có hỏi con mình hôm nay đi học, cô giáo có đánh con không. Con trả lời là không. Đón con ca chiều chị hỏi lại câu này. Lần này con trả lời là có.
Nghe xong, cô giáochủ nhiệmthưa lại với phụ huynh rằng trong lúc các em học sinh viết bài, quan sát thấy cháu viết không đúng cỡ chữ nên có lấy tay mình gõ lên vai em bảo em viết lại cho đúng. Trước mặt tôi và phụ huynh, cô giáo khẳng định không dùng tay đánh vào đầu em hay bất kỳ học sinh nào trong lớp.
Tôi hiểu ra sự việc và nói với chị phụ huynh rằng cháu đang bị sốt, ói thì chị nên đưa đi bệnh viện để bác sĩ khám điều trị cho hết bệnh để về đi học tiếp, và tôi tin chắc con chị cũng không bị cô giáo đánh như lời em kể với chị.
Trong trường hợp trên có lẽ vì nghe thông tin từ đâu đó, quá lo lắng cho con... nên chị kia cứ gặp con là hỏi có bị đánh không, có bị phạt không. Nếu trẻ đi học về ngày nào cũng nghe hỏi như vậy sẽ có ấn tượng không tốt về cô, sợ cô giáo. Và có trẻ sẽ nói dối ""có bị đánh"" cho xong chuyện.
Qua chuyện mình chứng kiến, tôi có lời chia sẻ cùng các vị phụ huynh khác rằng mỗi khi đón con tan trường hay con đi học chúng ta nên hỏi thăm con thêm những câu vui vẻ, yêu thương như:
Hôm nay ở trường con học vui không? Chắc môn học đánh vần con đọc trôi chảy, thuộc bài, cô khen trước lớp phải không? Hình như môn toán được điểm cao, mẹ thấy trên khuôn mặt con vui tươi, hớn hở như muốn khoe với mẹ chứ gì.
Bậc cha mẹ tạo ra không khí phấn chấn, vui vẻ khi đón con đi học về chắc chắn trẻ sẽ cảm nhận trọn vẹn không khí ""mỗi ngày đến trường là một ngày vui"".
Từ đề xuất của Sở Giáo dục và Đào tạo TP.HCM về việc cấm học sinh sử dụng điện thoại trong giờ học và cả giờ ra chơi, nhiều ý kiến mong muốn nhân rộng ra tại tất cả trường học trong cả nước.
Tối đa:1500 ký tự
Hiện chưa có bình luận nào, hãy là người đầu tiên bình luận"
https://tuoitre.vn/phi-doi-drone-vao-tam-lu-20251019104146574.htm,Phi đội drone vào tâm lũ,Xuồng máy khó ngược dòng lũ xoáy thì drone (máy bay không người lái) có thể đưa hàng cứu trợ đến bà con đang bị cô lập ngặt nghèo. Những chiếc drone như chú bọ khổng lồ bay thả hàng chỉ trong vài phút.,"Drone thay nhau tải hàng vào vùng cô lập cho bà con chỉ mất vài phút - Ảnh: TÂM LÊ
Nhóm ""phi công""dronethiện nguyện đang về điểm cô lập Mỹ Thái, tỉnh Bắc Giang cũ (nay là xã Mỹ Thái, tỉnh Bắc Ninh). Chúng tôi tận mắt chứng kiến nhiều tấm lòng nhiệt huyết đưa hàng bay vào tâm lũ giúp bà con.
Trời nắng chang chang trên đầu, trước mặt một vùng nước ngập trắng xóa. Bên trong hàng chục hộ dân cần hỗ trợ nước uống, đồ ăn. Anh Lê Mạnh Linh họp anh em khảo sát địa bàn. Những flycam nhỏ bay khảo sát vùng ngập và đo đường bay, vị trí cho drone thả hàng
Nguyễn Tiến Đạt, sinh năm 2006 ở Hà Nội, điều khiển flycam, đọc chỉ số trên màn hình để nhóm cùng xem xét, quyết định bay drone hay dùng ca nô. ""Khoảng cách bay tốt của drone là đường kính 2km, bán kính 1km"", Nguyễn Hữu Thiện Trí - sinh năm 1991 ở Quảng Nam (nay là TP Đà Nẵng), một ""phi công"" drone lâu năm - cho biết. Nước khu vực này không chảy xiết, nhóm chuyển sang ca nô chở hàng cho bà con...
Nghe tin tức lũ về quá lớn cô lập nhiều vùng dân cư ở các tỉnh miền Bắc, các ""phi công"" Nguyễn Huy, Quang Vịnh, Hồng Khánh... kết nối nhau lập nhóm drone bay cứu tải hàng giúp bà con.
Họ kết nối được 12 thành viên ban đầu có drone hoặc biết lái drone ở các vùng miền. Hơn 10 chiếc drone và nhiều flycam được huy động. Sau lũ về một hôm, sang mùng 9-10 nhóm drone bay thiện nguyện được lập chỉ trong vài giờ.
Người mang drone, người hỗ trợ máy phát điện để sạc pin, người dùng ô tô cá nhân chở thành viên và thiết bị tới vùng ngập nặng.
Các thành viên từ miền Nam, miền Trung ra, Tây Bắc về cùng thiết bị. Nhóm ""phi công"" thẳng lên xã Bố Hạ (nay thuộc Bắc Ninh) lúc nước đang ngập mái nhà dân. Nhóm anh Linh gặp nhóm ca nô của anh Trần Quyết Thắng từ Hà Tĩnh ra và thành đội ""trên trời dưới nước"" hoàn hảo.
Ngày 12-10, trước khi về điểm ngập Mỹ Thái họ đã hỗ trợ người dân các điểm ngập cầu sông Thương, Hợp Thịnh, Hoàng Vân, cầu Đầm (Bắc Ninh) và An Lạng (Sóc Sơn, Hà Nội). Có ngày nhóm chia drone ba hướng tới những điểm ngập nặng để hỗ trợ bà con kịp thời. Sau đó nhóm về hỗ trợ khu vực Quế Nham (phường Đa Mai), xã Tân Yên...
Đội drone sau buổi chuyển hàng thành công ở khu vực Quế Nham, Bắc Ninh
Chuẩn bị cho drone bay tải hàng cứu trợ - Ảnh: NVCC
Trên đường đi, nhóm drone ghé TP Bắc Giang nhận thêm hàng cứu trợ rồi vào thẳng Quế Nham. Năm xe ô tô chở máy móc, hàng hóa và các thành viên xuyên trưa đến điểm ngập.
Chúng tôi đi cùng xe. Nhóm không dừng ăn trưa, chỉ đùm bánh mì, nước lọc trên xe ai đói tự ăn uống. Nhưng điều đặc biệt, họ đi tới đâu bà con cũng mời vào nhà ăn trưa, nghỉ chân. Như người mẹ trẻ đèo con nhỏ ở Yên Mỹ nhiệt tình mời vào nhà nấu mì tiếp đãi. Anh chủ cửa hàng nội thất bị nước ngập tới sàn vừa rút cũng mời nhóm vào nhà uống nước. Có người khuân hai thùng cháo ăn liền tặng nhóm và dặn phải bền sức...
Ở Quế Nham, chúng tôi chứng kiến drone bay lượn, thay nhau thả hàng cho bà con vùng ngập lụt nhanh chóng, hiệu quả. Những flycam lại bay tiền trạm, kiểm tra tình trạng ngập lụt, đo khoảng cách, vị trí nhận hàng. Trên màn hình flycam, xóm nhỏ như ốc đảo giữa biển nước, gần 40 hộ đang bị ngập sâu.
Chọn được điểm mặt đê, mỗi người một tay, hai drone T50 được chuẩn bị bay. Mỗi drone nặng 40kg, pin nặng 12kg, tải được 40-50kg hàng. Đường bay được thiết lập, đường kính khoảng 2km. Máy phát điện được bật suốt để kịp nạp pin. Mỗi drone thường bay hai vòng phải thay pin. Người lắp pin phải luôn sẵn sàng.
Nhóm kỹ thuật, anh Nguyễn Hữu Thiện Trí cùng anh em kiểm tra ốc vít, cánh quạt và buộc dây tải hàng. Thành viên còn lại phân chia hàng cứu trợ vào từng bao, có quai xách để móc lên drone. Dây tải hàng dài khoảng 30m, phải luôn đảm bảo không rối.
Hàng hóa lần này chủ yếu nước lọc, đồ ăn và pin sạc dự phòng. Mỗi chuyến bay 5-6 phút, người dân dễ dàng đón được hàng drone đưa vào. 50 túi hàng được drone cẩu vào nhanh chóng, không gặp sự cố nào.
Drone bay thả hàng ở điểm ngập nặng Hợp Thịnh (Bắc Ninh) - Ảnh: NVCC
Nhớ lần bay đêm khó quên, anh Trí kể đó là điểm ngập không điện, không hoa tiêu, người dân phải nháy đèn pin làm tín hiệu để drone bay đúng chỗ: ""Đèn nhấp nháy nhiều nơi trong điểm ngập, chúng tôi nhìn màn hình xúc động lắm vì bà con đang trông đợi mình"".
Anh Linh kể thêm tại điểm ngập sâu ở cầu sông Thương, 6h tối nhóm đang khảo sát bay. Trời mưa mịt mùng. Thấy bóng người đang chới với trong nước, họ điều ca nô ra kiểm tra. Phát hiện hai người trên thuyền nhỏ đang mất phương hướng, không có đèn hay thiết bị hỗ trợ nào. Lập tức ca nô đến ứng cứu, đưa được họ vào nơi an toàn.
Hành trình đưa drone đi cứu trợ bà con vùng lũ mỗi thành viên đã trải qua nhiều cung bậc cảm xúc, ai cũng có câu chuyện riêng để kể. Và chúng tôi được biết họ tới từ Kiên Giang, Long An, Đắk Lắk, Kon Tum, Quảng Nam, Hà Tĩnh, Nghệ An, Hà Nội...
Các ""phi công"" điều khiển drone bay vào tâm lũ giúp bà con  - Ảnh: TÂM LÊ
Những chiếc drone thường ngày dùng trong nông nghiệp để bón phân, phun thuốc, gieo mạ và sử dụng nhiều ở phía Nam, nay ra Bắc cứu trợ bà con bị lũ lụt.
""Chi phí bay quá rẻ! Mỗi chuyến chỉ vài phút, vận chuyển 50kg hàng hóa, chi phí khoảng 50.000 đồng. Nước lũ sâu, chảy xiết thì chuyển hàng bằng drone là lựa chọn tốt nhất"" - anh Nguyễn Xuân Huy, kỹ sư hàng không ở TP.HCM, cho biết.
Huy là thành viên tích cực đầu tiên của nhóm sau khi đọc tin kêu gọi drone cứu hộ của anh Quang Vịnh, người mà anh tin tưởng vì đã làm cứu trợ cùng nhau thời Covid-19. ""Thấy anh Vịnh đăng tin, tôi nhắn liền, nói em có ba drone. Anh hỏi có người lái không, tôi nói có. Anh bảo chuẩn bị cho anh con người và số lượng máy, rồi báo rõ. Tôi OK!"" - Huy nhớ lại.
Biết Lê Long, sinh năm 2000 ở Hà Tĩnh, cũng tham gia nên anh Huy chat: ""Có anh Vịnh ở Hà Nội đón rồi, em có máy ra trước đi, anh ở Sài Gòn sẽ mang máy ra cùng các bạn"". Huy gọi thêm các bạn trẻ ở miền Tây Nam Bộ ra, họ đều lái drone đã 5-8 năm.
Theo anh Huy, một chiếc drone T50 phổ biến hiện có giá 400 triệu đồng, nếu mua máy cũ rẻ hơn. Nếu là T70- T100 đời mới sẽ đa năng hơn, có chức năng vận chuyển hàng và cũng có thể dùng cứu người.
""Tôi có ý tưởng dùng drone cứu người mấy năm rồi. Một tình huống mà tôi nhớ khi xem tin tức là một người mẹ có con 4 tháng tuổi, con bị sốt, bạn ấy phải lội xuồng đi mua thuốc nhưng bị lật xuồng. Trong đầu tôi nghĩ có những cách khác tốt hơn, rẻ và an toàn hơn nhiều. Trong các vụ lũ lụt trước đây, đội cứu trợ nào cũng dùng xuồng, hay có tai nạn đáng tiếc do nước xoáy, có khi thiệt mạng. Cứu trợ bằng drone an toàn hơn nhiều, nếu rơi máy bay mình chỉ mất tiền"" - anh Huy bày tỏ.
Và theo anh Huy, nếu miền Bắc dùng drone trong nông nghiệp nhiều thì sẽ có máy cứu trợ nhiều hơn, nhanh hơn. Giá drone ngày càng rẻ, chỉ cần thêm thiết bị kích sóng có thể tăng đường kính bay lên tới 5km. Việc cứu hộ, cứu nạn sẽ nhanh chóng và tiết kiệm hơn nhiều.
Chia các túi hàng hóa khoảng 40-50kg cho một lần bay của drone
Hiện nhóm drone và ca nô thiện nguyện này khoảng 20 thành viên, có những bạn rất trẻ, sinh năm 2000, 2006. Có bạn lần đầu ra Bắc, phối hợp rất ăn ý và hiệu quả.
Phan Văn Trường Phát, sinh năm 2005, đến từ Kiên Giang (nay là An Giang), có lúc ôm bảng điều khiển drone đứng lên nóc xe để tầm nhìn xa hơn. Kiên Giang có tới ba bạn trẻ lái drone xung phong ra làm ""phi công"". Dù lạ người, lạ đất nhưng tinh thần họ chưa hết lũ thì nhất định chưa về. Lê Long là bạn trẻ cũng đưa combo hai drone với đầy đủ thiết bị từ Hà Tĩnh ra. 4h chiều Long có mặt ở Hoàng Vân (Bắc Ninh) và bay cứu trợ ngay trong chiều tối.
Những ngày đầu tháng 10, miền Bắc chìm trong lũ dữ, xóm làng cô lập, thiếu thốn lương thực. Thương đồng bào, các bạn trẻ đã sử dụng máy bay không người lái (drone) thả hàng cứu trợ.
Tối đa:1500 ký tự
Hiện chưa có bình luận nào, hãy là người đầu tiên bình luận"
