url,title,description,content
https://tuoitre.vn/gop-y-van-kien-dai-hoi-dang-xiv-doi-moi-manh-me-trong-to-chuc-thuc-hien-20251019094101638.htm,Góp ý văn kiện Đại hội Đảng XIV: Đổi mới mạnh mẽ trong tổ chức thực hiện,"Tuổi Trẻ Online giới thiệu ý kiến góp ý văn kiện Đại hội Đảng XIV của PGS.TS Nguyễn Trọng Phúc, nguyên Viện trưởng Viện Lịch sử Đảng.","Cán bộ phường Bình Lợi Trung (TP.HCM) giải quyết thủ tục hành chính cho người dân - Ảnh: THANH HIỆP
Các nhiệm kỳ trước đây thường có 3 báo cáo là báo cáo chính trị, báo cáo kinh tế xã hội và báo cáo xây dựng Đảng. Tuy nhiên, tại nhiệm kỳ này,Bộ Chính trịthống nhất tích hợp 3 báo cáo thành báo cáo chính trị, đi kèm các phụ lục.
PGS.TS NGUYỄN TRỌNG PHÚC
Đây không phải là sự lắp ghép mà báo cáo chính trị chung này thể hiện rõ nội dung, sâu sắc, có hệ thống trên cả 3 phương diện chính trị, kinh tế - xã hội và xây dựng Đảng.
Tích hợp như vậy cũng giúp khi theo dõi có thể hình dung tổng thể, có hệ thống, xuyên suốt tại một báo cáo thay cho việc đọc ở báo cáo này có khi phải tìm ở báo cáo kia.
Đồng thời, tránh sự trùng lặp có thể xảy ra giữa các báo cáo như trước đây.
Quan trọng hơn, thời gian qua có thực tế là không ít cán bộ, thậm chí cán bộ lãnh đạo, rất ngại đọc văn kiện, thậm chí đọc nhưng không thấm nhuần sâu sắc lắm.
Vì vậy, với quan điểm của Bộ Chính trị ở văn kiện nhiệm kỳ này là viết ngắn gọn, súc tích, dễ hiểu, dễ nhớ, dễ thực hiện sẽ tạo thuận lợi cho cán bộ lãnh đạo quản lý từ các ngành trung ương đến các tỉnh, các xã và đặc biệt là người dân trong việc tiếp     cận và thực hiện.
Cần thấy rõ đích cuối cùng của văn kiện là thực hiện, thực thi nên việc hợp nhất các báo cáo là chủ trương rất đúng nhằm thể hiện rõ quan điểm, chủ trương, đường lối của Đảng tập trung, thống nhất và thực hiện...
Một điểm mới đáng chú ý nữa là lần này đã có sự đổi mới, cải tiến mạnh mẽ trong tổ chức thực hiện - một khâu trước đây thường được đánh giá là hạn chế, yếu.
Theo đó, lần này, cùng với dự thảo báo cáo chính trị, dự thảo nghị quyết đại hội có kèm theo cả dự thảo chương trình hành động củaBan Chấp hành Trung ươngđể thực hiện nghị quyết đại hội.
Trong chương trình hành động đề ra những nhiệm vụ, đề án, công trình, dự án quan trọng, có tính chiến lược trong giai đoạn 2026 - 2030. Đồng thời, phân công trách nhiệm cụ thể, rõ nguồn lực, tiến độ và các điều kiện cần thiết để thực hiện.
Chẳng hạn trong xác lập mô hình tăng trưởng kinh tế mới, cơ cấu lại nền kinh tế, đẩy mạnh công nghiệp hóa - hiện đại hóa, dự thảo chương trình hành động đã nêu ra nhiều nhiệm vụ quan trọng.
Như xây dựng, triển khai đề án tổng thể xác lập mô hình tăng trưởng mới, cơ cấu lại nền kinh tế, lấy khoa học công nghệ, đổi mới sáng tạo và chuyển đổi số làm động lực chính.
Xây dựng, triển khai Đề án xây dựng nền kinh tế độc lập, tự chủ gắn với chủ động hội nhập quốc tế; tập trung nâng cao năng lực sản xuất một số ngành công nghiệp chiến lược, tiến tới tự lực, tự chủ, tự cường về khoa học công nghệ...
Hay trong quản lý và sử dụng hiệu quả tài nguyên, bảo vệ môi trường, chủ động thích ứng với biến đổi khí hậu cũng đưa ra nhiều yêu cầu. Như xây dựng, triển khai Đề án xử lý cơ bản tình trạng ô nhiễm môi trường không khí tại Hà Nội và TP.HCM...
Còn với phát huy mạnh mẽ vai trò chủ thể của nhân dân, dân chủ xã hội chủ nghĩa và sức mạnh đại đoàn kết toàn dân tộc, chương trình hành động cũng nêu rõ các nhiệm vụ cần thực hiện rất rõ ràng.
Trong đó, có xây dựng cơ chế, chính sách để thực hiện hiệu quả phương châm dân biết, dân bàn, dân làm, dân kiểm tra, dân giám sát, dân thụ hưởng...
Tổng Bí thư đã nhiều lần nhấn mạnh đến việc phải lấy kết quả làm thước đo và phải cụ thể, thực chất, cân - đo - đong - đếm được, chứ không phải bằng những báo cáo hình thức.
Do vậy, với chương trình hành động cụ thể, rõ ràng như vậy là căn cứ rất quan trọng để các cấp ủy, các ngành, địa phương thực hiện theo chức năng, nhiệm vụ, quyền hạn được giao, góp phần hoàn thành thắng lợi các mục tiêu Đại hội XIV đề ra.
Một nội dung quan trọng khác là Đảng đã xác định Đại hội XIV sẽ đánh dấu mốc lịch sử bước vàokỷ nguyên mới.             Do vậy, trong dự thảo Báo cáo chính trị và các văn kiện trình Đại hội XIV của Đảng được lấy ý kiến nhân dân đã làm rõ được mục tiêu của kỷ nguyên mới.
Đặc biệt, dự thảo đặt ra mục tiêu để hướng tới hai mục tiêu 100 năm vào năm 2030 là 100 năm thành lập Đảng và năm 2045 là 100 năm thành lập nước.
Cụ thể là giữ vững môi trường hòa bình, ổn định; phát triển nhanh, bền vững đất nước và bảo vệ vững chắc Tổ quốc; cải thiện và nâng cao toàn diện đời sống nhân dân; tự chủ chiến lược, tự cường, tự tin, tiến mạnh trong kỷ nguyên mới của dân tộc;             thực hiện thắng lợi mục tiêu đến năm 2030 trở thành nước đang phát triển có công nghiệp hiện đại, thu nhập trung bình cao.
Hiện thực hóa tầm nhìn đến năm 2045 trở thành nước phát triển, thu nhập cao vì một nước Việt Nam hòa bình, độc lập, dân chủ, giàu mạnh, phồn vinh, văn minh, hạnh phúc, vững bước đi lên chủ nghĩa xã hội.
Trong đó đưa ra mục tiêu cụ thể, phấn đấu đạt tốc độ tăng trưởng tổng sản phẩm trong nước (GDP) bình quân cho giai đoạn 2026 - 2030 từ 10%/năm trở lên, GDP bình quân đầu người đến năm 2030 đạt khoảng 8.500 USD…
Để đạt mục tiêu ấy cần một loạt đổi mới, đặc biệt là cải cách về thể chế. Vậy nên, trong văn kiện lần này có mục riêng là hoàn thiện thể chế để phục vụ mục tiêu phát triển.
Đồng thời, dự thảo nhấn mạnh tiếp tục đổi mới mạnh mẽ, tạo đột phá để sớm hoàn thiện đồng bộ thể chế phát triển kinh tế thị trường định hướng xã hội chủ nghĩa, có sự quản lý của Nhà nước, dưới sự lãnh đạo của Đảng.
Xây dựng và hoàn thiện thể chế phù hợp để xác lập mô hình tăng trưởng mới, cơ cấu lại nền kinh tế, đẩy mạnh công nghiệp hóa, hiện đại hóa, lấy khoa học, công nghệ, đổi mới sáng tạo và chuyển đổi số làm động lực chính.
Phát triển kinh tế nhà nước hiệu quả, thật sự giữ vai trò chủ đạo trong việc bảo đảm các cân đối lớn, dẫn dắt và định hướng chiến lược; phát triển kinh tế tư nhân là một động lực quan trọng nhất của nền kinh tế...
Đáng chú ý, dự thảo cũng bổ sung nội dung bảo vệ môi trường là một nội dung trọng yếu, sống còn, trung tâm gắn với phát triển kinh tế xã hội.
Bên cạnh đó, yêu cầu phát triển văn hóa con người là nền tảng, tăng cường quốc phòng an ninh và bổ sung thêm nội dung đối ngoại là trọng yếu, thường xuyên...
Mời bạn đọc xem toàn văn nội dung dự thảo các văn kiện Đại hội Đảng XIV tại các link dưới đây và gửi ý kiến góp ý vềTuổi Trẻ Online.
Các dự thảo văn kiện được Ban Chấp hành Trung ương Đảng khóa XIII công bố lấy ý kiến gồm có:
- Dự thảo Báo cáo chính trị của Ban Chấp hành Trung ương Đảng khóa XIII tại Đại hội Đảng XIV.
Mời xem toàn văntại đây.
- Dự thảo Chương trình hành động của Ban Chấp hành Trung ương Đảng thực hiện Nghị quyết Đại hội đại biểu toàn quốc lần thứ XIV của Đảng (kèm theo Báo cáo chính trị).
Mời xem toàn văntại đây.
- Phụ lục 4: Đánh giá 5 năm thực hiện Chiến lược phát triển kinh tế - xã hội 10 năm 2021-2030.
Mời xem toàn văntại đây.
- Phụ lục 5: Về tổng kết công tác xây dựng Đảng nhiệm kỳ Đại hội XIII và phương hướng, nhiệm vụ, giải pháp công tác xây dựng Đảng nhiệm kỳ Đại hội XIV.
Mời xem toàn văntại đây.
- Dự thảo Báo cáo tổng kết một số vấn đề lý luận và thực tiễn về công cuộc đổi mới theo định hướng xã hội chủ nghĩa trong 40 năm qua ở Việt Nam.
Mời xem toàn văntại đây.
- Dự thảo Báo cáo tổng kết 15 năm thi hành Điều lệ Đảng (2011-2025) và đề xuất, định hướng bổ sung, sửa đổi Điều lệ Đảng.
Mời xem toàn văntại đây.
Những ý kiến tâm huyết, tòa soạn sẽ chọn đăng trên báo giấy và trên Tuổi Trẻ Online.
Các ý kiến góp ý, mời bạn đọc gửi về địa chỉ email: gopyvankien@tuoitre.com.vn.

Tuổi Trẻ Online đăng hai ý kiến góp ý văn kiện Đại hội Đảng XIV về bảo vệ môi trường và mong mỏi hết cảnh kẹt xe, ngập nước của người dân TP.HCM.
Tối đa:1500 ký tự
Hiện chưa có bình luận nào, hãy là người đầu tiên bình luận"
https://tuoitre.vn/cao-diem-kiem-tra-nong-do-con-phat-hien-nhieu-vi-pham-o-quoc-lo-1-ca-tren-cao-toc-20251019071354457.htm,"Cao điểm kiểm tra nồng độ cồn: Phát hiện nhiều vi phạm ở quốc lộ 1, cả trên cao tốc",Đội cảnh sát giao thông đường bộ cao tốc số 6 vừa phát hiện 1 tài xế vi phạm nồng độ cồn vẫn lái xe trên cao tốc Nha Trang - Cam Lâm.,"Cảnh sát giao thông phát hiện tài xế vi phạm nồng độ cồn trên tuyến cao tốc Nha Trang - Cam Lâm - Ảnh: Đội cảnh sát giao thông đường bộ cao tốc số 6
Ngày 19-10, trao đổi vớiTuổi Trẻ Online, đại diện Độicảnh sát giao thôngđường bộ cao tốc số 6 (Phòng 6 - Cục Cảnh sát giao thông, Bộ Công an) xác nhận vừa phát hiện 1 tài xế vi phạm nồng độ cồn trên tuyến cao tốc Nha Trang - Cam Lâm.
Khoảng 19h53 ngày 18-10, tổ cảnh sát giao thông làm nhiệm vụ tại km15 đường cao tốc Nha Trang - Cam Lâm phát hiện tài xế C.Q.A.T. (28 tuổi, trú TP Đà Nẵng) lái xe hơi trên đường mà trong hơi thở cónồng độ cồn.
Kết quả đo cồn của tài xế T. là 0,469 miligam/1 lít khí thở.
Theo Đội cảnh sát giao thông đường bộ cao tốc số 6, anh T. sẽ bị phạt 30 - 40 triệu đồng, tước giấy phép lái xe 22 - 24 tháng, tạm giữ phương tiện.
Trước đó, trong ngày 18-10, Cục trưởng Cục Cảnh sát giao thông đã phát lệnh đợt cao điểm kiểm tra nồng độ cồn đối với tài xế trên cả nước.
Đội cảnh sát giao thông đường bộ cao tốc số 6 đã đồng loạt triển khai lực lượng kiểm tra nồng độ cồn của người điều khiển phương tiện trên tuyến cao tốc TP.HCM - Long Thành - Dầu Giây; Phan Thiết - Vĩnh Hảo; Cam Lâm - Nha Trang.
Ngày 19-10, trao đổi vớiTuổi Trẻ Online, lãnh đạo Trạm cảnh sát giao thông Ninh Hòa, Phòng Cảnh sát giao thông Công an tỉnh Khánh Hòa cho biết trong ngày 18-10, đơn vị này đã phát hiện nhiều trường hợp vi phạm nồng độ cồn trên tuyến quốc lộ 1 (đoạn qua tỉnh Khánh Hòa) và các tuyến đường trên địa bàn.
Theo vị này, sau khi Cục trưởng Cục Cảnh sát giao thông phát lệnh đợt cao điểm kiểm tra nồng độ cồn đối với tài xế trên cả nước, Trạm cảnh sát giao thông Ninh Hòa sẽ tăng cường bố trí cán bộ kiểm tra vi phạm nồng độ cồn trên tuyến quốc lộ 1 để đảm bảo an toàn giao thông.
Cảnh sát giao thông kiểm tra nồng độ cồn đối với tài xế lưu thông phương tiện trên tuyến quốc lộ 1 (đoạn qua tỉnh Khánh Hòa) - Ảnh: Trạm cảnh sát giao thông Ninh Hòa
Lực lượng chức năng đang tiếp tục điều tra nguyên nhân vụ cháy xe khách trên tuyến cao tốc Nha Trang - Cam Lâm, may mắn vụ cháy không gây thương vong về người.
Tối đa:1500 ký tự
Hiện chưa có bình luận nào, hãy là người đầu tiên bình luận"
https://tuoitre.vn/to-pho-mo-dau-cau-chuyen-20251019081837351.htm,Tô phở mở đầu câu chuyện,"Nhắc đến Lễ hội Phở Việt Nam được tổ chức tại Singapore, hầu hết từ ngoại giao đoàn tới đại sứ các nước cũng như người dân Singapore và các doanh nghiệp, tổ chức quốc tế đều rất hào hứng và quan tâm.","Người dân thưởng thức phở Việt Nam tại Lễ hội Phở Việt Nam được tổ chức tại Singapore - Ảnh: HỮU HẠNH
Họ nói ""Ồ!Phở Việt Nam. I love it"" và hỏi thêm thông tin, cho thấy sự yêu mến, quan tâm của họ tới ẩm thực Việt Nam, đặc biệt là phở và bánh mì.
Hy vọng lễ hội lần này không chỉ có sự hiện diện của cộng đồng người Việt tạiSingaporemà còn đông đảo bạn bè quốc tế. Điều này sẽ mở ra cơ hội xúc tiến đầu tư của Singapore tại Việt Nam cũng như Việt Nam tại Singapore.
Khi nói về phở có nghĩa ta đang nói cả một hệ sinh thái với rất nhiều sản phẩm và dịch vụ đi kèm xung quanh nên câu chuyện chuỗi cung ứng như thế nào, việc phân phối ra sao để người tiêu dùng Singapore và khách nước ngoài cũng có thể nấu phở của người Việt Nam cần được đặt ra.
Chúng ta có tiềm năng rất lớn và tương lai có thể mở rộng chuỗi cung ứng đó. Qua đó nâng tầm vị thế của phở Việt ở Singapore, từ Singapore ra các nước.
Nói về Singapore, có những người nghĩ đó là một quốc gia rất nhỏ với 6 triệu dân. Nhưng nếu nhìn lượng khách quốc tế đến Singapore và người nước ngoài sinh sống, làm việc tại đây thì thấy đó là một thị trường rất tiềm năng.
Năm 2025 này, Singapore kỳ vọng đón hơn 18 triệu lượt khách quốc tế. Điều này biến Singapore thành một thị trường không dừng lại ở 6 triệu dân nữa.
Bởi từ đây, các công ty, tập đoàn thương mại đang làm việc tại Singapore cũng sẽ đưa các sản phẩm của Việt Nam về thị trường của đất nước họ. Chúng ta phải chú ý khai thác những thế mạnh đang có sẵn tại Singapore.
Hàng dài người kiên nhẫn xếp hàng chờ mua phở ngay từ sáng sớm ngày 19-10, ngày thứ hai Lễ hội Phở Việt Nam được tổ chức tại Singapore
Thứ nhất, cộng đồng người Việt tại Singapore khá đông đảo và nhiều người đang hoạt động trong lĩnh vực ẩm thực.
Họ là những đầu mối quan trọng, am hiểu nhu cầu của thị trường địa phương, hiểu các quy định về nhập khẩu, phân phối thực phẩm cũng như những cách thức đưa sản phẩm vào thị trường một cách hiệu quả nhất.
Thứ hai, người Singapore và khách quốc tế đã có thiện cảm sâu sắc với ẩm thực Việt tại đây. Đây là một lợi thế mà không phải quốc gia nào cũng may mắn có được.
Singapore là một thị trường cao cấp với mức thu nhập thuộc hàng đầu thế giới. Nhu cầu cũng như yêu cầu về ẩm thực rất cao.
Ở đây có nhiều nhà hàng được xếp hạng sao Michelin cũng như các nhà hàng fine dining (ẩm thực cao cấp, dịch vụ hoàn hảo, không gian sang trọng, trải nghiệm nghệ thuật - PV).
Tuy nhiên, Việt Nam hiện thiếu vắng những chuỗi nhà hàng đáp ứng được tiêu chuẩn này tại Singapore. Đây vừa là một điểm yếu, khoảng trống, vừa là một cơ hội lớn chưa được khai thác. Nếu có một đơn vị Việt Nam đầu tư một cách đúng chuẩn quốc tế và fine dining, chúng ta sẽ thắng.
Nếu nhìn vào một số nước làm rất tốt như Thái Lan, Hàn Quốc, Nhật Bản và Trung Quốc, có thể thấy giai đoạn đầu đều nhận được sự ủng hộ và đầu tư rất lớn từ nhà nước không chỉ chính sách mà còn cơ chế, vốn và nhiều nguồn lực khác nữa.
Việc xây dựng thương hiệu quốc gia cần sự quan tâm và đầu tư đúng mức từ các cơ quan nhà nước. Tại sao ta chưa có nhà hàng fine dining ở đây? Bởi các nguồn lực của cá nhân còn nhiều hạn chế; còn các công ty, doanh nghiệp có nguồn lực lại chưa quan tâm tới thị trường này. Họ đang mải miết khai thác và cày xới thị trường trong nước.
Chúng ta nên nghĩ lại câu chuyện này một cách toàn diện để đưa ra một chiến lược toàn diện. Ví dụ Hàn Quốc họ làm rất tốt về văn hóa, ẩm thực, nghệ thuật, âm nhạc...
Thời gian gần đây Việt Nam bắt đầu quan tâm nhiều hơn đến công nghiệp văn hóa. Ẩm thực là một trụ cột quan trọng trong đó. Chúng ta đang đi đúng hướng nhưng cần được đầu tư nhiều hơn.
Việt Nam có nhiều lợi thế nhưng sự đoàn kết, hợp lực để cùng đi và đi một cách vững chắc, có tầm chưa thực sự rõ rệt.
Ví dụ điển hình gần đây là thương hiệu Bánh mì Society của Việt Nam nhưng đi rất bài bản, chuyên nghiệp, dù mới hoạt động ở Singapore vài tháng nhưng cho thấy tiềm năng và cách đi rất đúng hướng. Nên học tập những mô hình như vậy và đầu tư vào, thay vì đi riêng lẻ, đi một mình.
Xưa ông bà thường nói ""miếng trầu là đầu câu chuyện"". Giờ với tô phở, có thể bắt đầu tất cả những câu chuyện bởi phở không chỉ phổ biến ở trong nước, khu vực châu Á mà còn khắp thế giới.
Khi nhắc đến phở thì họ biết đó là Việt Nam. Phải làm sao để khai thác lợi thế có sẵn đó. Nhiều quốc gia khác mong muốn thế mạnh đó mà không được. Vấn đề là cần có đầu tư và chiến lược hẳn hoi.
Sau ngày đầu tiên bán phở luôn tay ở Our Tampines Hub, các bếp chung của Vietnam Phở Festival lại đỏ lửa với những nồi nước dùng mới. Dự kiến lượng phở phục vụ ngày mai sẽ phải nhiều hơn ngày đầu.
Tối đa:1500 ký tự
Hiện chưa có bình luận nào, hãy là người đầu tiên bình luận"
https://tuoitre.vn/cuc-csgt-phat-hien-3-829-lai-xe-co-con-trong-ngay-dau-cao-diem-se-lam-lien-tuc-ke-ca-ngay-nghi-20251019092324158.htm,"Cục CSGT: Phát hiện 3.829 lái xe có cồn trong ngày đầu cao điểm, sẽ làm liên tục kể cả ngày nghỉ","Trong ngày đầu thực hiện đợt kiểm soát nồng độ cồn một thời điểm trên toàn quốc, cảnh sát phát hiện 3.829 trường hợp vi phạm. Cục trưởng Cục Cảnh sát giao thông nhận định đây là con số đáng báo động.","Hàng trăm ô tô được kiểm soát ngay tại đầu vào cao tốc Bắc - Nam trong đêm 18-10 - Ảnh: HỒNG QUANG
Sáng 19-10, thông tin từ Cục Cảnh sát giao thông (Bộ Công an) cho biết trong đêm 18-10, lực lượng cảnh sát giao thông tiếp tục kế hoạch xử lý chuyên đề nồng độ cồn trên toàn quốc.
Trong khung giờ 19h-22h,  các tổ công tác trên toàn quốc đã kiểm soát 63.240 lái xe (1.860 xe khách, 3.128 xe tải, 16.051 xe con, 41.067 xe mô tô, 1.131 xe thô sơ).
Qua đó phát hiện 2.523 trường hợp vi phạm (2 xe khách, 10 xe tải, 82 xe con, 2.401 xe mô tô, 28 xe thô sơ).
Trong đó,  địa phương phát hiện vi phạm nhiều là: Bắc Ninh (259 trường hợp), Hải Phòng (207 trường hợp), Phú Thọ (198 trường hợp), An Giang (187 trường hợp), Lào Cai (179 trường hợp), Thái Nguyên (174 trường hợp)…
Tính chung trong ngày đầu cao điểm, cảnh sát giao thông đã kiểm soát 111.542 lái xe (3.663 xe khách, 6.675 xe tải, 26.348 xe con, 72.879 xe mô tô, 1.974 xe thô sơ).
Qua đó lập biên bản xử lý 3.829 trường hợp vi phạm nồng độ cồn (4 xe khách, 18 xe tải, 147 xe con, 3.615 xe mô tô, 45 xe thô sơ).
Thiếu tướng Đỗ Thanh Bình -  Cục trưởng Cục Cảnh sát giao thông, đánh giá kết quả này đã phản ánh thói quen của một bộ phận người tham gia giao thông chưa chấp hành nghiêm quy định về nồng độ cồn khi lái xe.
""Tại các thành phố lớn có kết quả xử lý cao, nhưng chưa tương xứng với tình hình thực tế trên tuyến, địa bàn"", theo đánh giá của thiếu tướng Đỗ Thanh Bình.
Đồng thời, lãnh đạo Cục Cảnh sát giao thông đánh giá hơn 3.800 trường hợp lái xe có nồng độ cồn bị phát hiện trong ngày 18-10 là con số đáng báo động.
Việc kiểm soát một chuyên đề vi phạm trong cùng một thời điểm trên toàn quốc được Cục Cảnh sát giao thông cho biết sẽ làm thường xuyên, liên tục không ngừng nghỉ, ngay cả trong những ngày nghỉ, Tết.
Mục tiêu đặt ra là thiết lập được thói quen ""đã uống rượu bia thì không lái xe"".
Trong gần một giờ, hàng trăm tài xế được kiểm tra nồng độ cồn trước khi tiếp tục hành trình trên cao tốc Pháp Vân - Cầu Giẽ. Mức phạt răn đe và rủi ro tiềm ẩn tai nạn khiến các lái xe đều chấp hành nghiêm quy định.
Tối đa:1500 ký tự
Hiện chưa có bình luận nào, hãy là người đầu tiên bình luận"
https://tuoitre.vn/dong-so-do-va-tan-xac-20251018103008807.htm,Đống sổ đỏ và 'tan xác',- Tui nhìn đống sổ đỏ thấy họ giàu quá ông à!,"- Đống sổ nào vậy?
- Khám nhà ông này phát hiện cả đốngsổ đỏ, nhà cô kia cũng cả đống. Trong khi tui cả đời kiếm một cái sổ cũng chật vật.
- Cái gì cũng có giá của nó, tui thấy ông sống vui mà. Ông có muốn đống đó không?
- Muốn thì ai cũng muốn, nhưng phải là cái của mình, làm ăn đàng hoàng mà có. Tui chỉ cần vừa đủ để sống vui là được.
- Biết vậy thì cứ sống vui đi, chưa chắc mấy người ôm đống sổ đó đã sống vui bằng ông, ông không thấy sao.
- Thấy sao là thấy sao?
- Đảm bảo là giờ nếu được chọn lại, mấy người đó sẽ chọn cuộc sống vui của ông chứ không chọn đống sổ đỏ hay ""tan xác"", à quên ""sharktank"", đâu!
- !!!
Ngân 98 và người nhà không cung cấp mật khẩu két sắt nên cơ quan điều tra cưỡng chế mở khóa theo quy định. Kết quả đã thu giữ 80 sổ đỏ, hơn 8.000 USD, 4 sổ tiết kiệm ngân hàng. Ngoài ra công an tạm giữ 2 ô tô.
Tối đa:1500 ký tự
Hiện chưa có bình luận nào, hãy là người đầu tiên bình luận"
