url,title,description,content
https://tuoitre.vn/am-luat-cua-laszlo-krasznahorkai-20251019101049368.htm,Âm luật của László Krasznahorkai,"Ở đoạn kết cuốn tiểu thuyết Az ellenállás melankóliája (tạm dịch: Nỗi buồn kháng cự), László Krasznahorkai đã để cho một trong những nhân vật chính của mình lên dây lại cây đàn piano đã lâu không ai chơi...","Tác gia Nobel Văn chương 2025 László Krasznahorkai bên cây đàn piano  - Ảnh: Jean-Luc Bertini
Và bất chấp tất cả những loạn lạc đang diễn ra ngay trước cửa nhà mình, ông đặt tay lên ""phím đàn thanh khiết và an ủi"", dạo bản Prelude cung Si thứ của Johann Sebastian Bach.
Trước đó ông đã trải qua một cuộc khủng hoảng niềm tin vào âm nhạc, thứ László Krasznahorkai luôn tin rằng chứa đựng trật tự và cái đẹp, hóa ra chỉ là một ảo tưởng và những thang âm hoàn hảo của nhà lý thuyết âm nhạc Werckmeister rốt cuộc chỉ đánh đổi những hòa âm đích thực để lấy sự tiện lợi.
Sau này khi nhà làm phim đồng hương Béla Tarr chuyển thể tác phẩm của Krasznahorkai thành phim, đã lấy tựa đề điện ảnh chính là Werckmeister Harmonies (Những hòa âm của Werckmeister).
Nhắc đến văn chương Krasznahorkai là nhắc tới tận thế, tới những nhà tiên tri giả, là nhắc tới những chuyến du hành tới Nhật Bản, tới Trung Hoa nhưng cũng là nhắc tới âm nhạc.
Nếu như trong âm nhạc, ông tiết lộ từng học 10 năm cổ điển nhưng vì chán ghét trường phái cổ điển Vienna, ông đã chống lại truyền thống châu Âu bằng cách chơi trong những ban nhạc jazz, những ban nhạc beat và đặc biệt ca ngợi tài ứng tác không thể bắt chước của nghệ sĩ piano jazz Theolonious Monk.
Thậm chí trong tiểu thuyếtSeiobo járt odalent(Tây Vương Mẫu giáng trần), ông dành nguyên một thiên gần 7.000 từ để một nhân vật độc thoại về âm nhạc về việc thời kỳ âm nhạc Baroque với những Monteverdi, Purcell, Bach đã gần như vươn tới ""mái vòm của đỉnh trời dường như vô tận, một ranh giới cụ thể của thiên đường"" nhưng sau đó đã suy vong, báng bổ - ông thậm chí còn cho rằng cổ điển phương Tây nên kết thúc ở đỉnh cao ngay sau Bach chứ không phải cố gắng tiếp nối với những Mozart, Beethoven hay Wagner.
Ông không ngại chê cả những kinh điển của kinh điển: Bản giao hưởng số 5, số 9 thì khiếp đảm, Faust thì kinh hoàng, Fantastique thì lòe loẹt, Cây sáo thần có vậy mà cũng được tung hô. Vậy thì trong văn chương, Krasznahorkai cũng là người tiên tri buổi lụi tàn của châu Âu, những đầm lầy, rác rến ứ đọng của châu Âu, thậm chí cách ông viết về cách tử thi một con người phân hủy dường như cũng là đang ám chỉ một sự phân hủy của lục địa già.
Ngán châu Âu, László Krasznahorkai đi đâu? Trong âm nhạc, Krasznahorkai học đủ các nhạc cụ: đàn lyre của đảo Crete (Hy Lạp) như một sự quay về với khoảnh khắc đỉnh cao của văn minh châu Âu buổi đầu, khèn shō của Nhật Bản và cả nhị hồ Trung Hoa. Trong văn chương, sau loạt tiểu thuyết về tận thế, ông đạt tới đỉnh cao lần thứ hai trong nghiệp viết với những tác phẩm về Đông Á.
Khi ông mô tả cảm thức mà âm nhạc Baroque thời Bach tạo ra, ông cũng so sánh với niềm hạnh phúc không thể thốt nên lời như khi một thiền sư Nhật Bản tập cung đạo giương mũi tên lên, buông xuống với tất cả sự chân thành, không chút khoa trương. Châu Âu đã đánh mất sự minh triết của nó, những bậc thầy của nó và từ vùng đất đã mất kết nối thánh thần và chỉ còn lại những nhà tiên tri giả ấy, Krasznahorkai buộc phải hành hương về phương Đông để tìm lại một giá trị còn nguyên vẹn, chưa tạp nhiễm.
Bởi vậy, khi Béla Tarr làm phim chuyển thể các tác phẩm của Krasznahorkai, ông vẫn thường đan cài giữa im lặng và âm nhạc. Có những cảnh phim trống trơn âm thanh và rồi lại có những cảnh phim âm nhạc vang dội, da diết, thứ âm nhạc không để bổ sung cho hình ảnh mà ngược lại, kéo ta ra xa khỏi hình ảnh.
Chẳng hạn, trong Damnation (1988), tác phẩm khởi đầu cho sự hợp tác giữa Tarr và Krasznahorkai, có một cảnh nơi những con người trong một quán bar cùng nối đuôi nhau thành một vòng tròn lớn để cùng nhảy theo điệu nhạc. Bên ngoài trời mưa. Ngữ cảnh là: mọi thứ lúc đó đã đổ vỡ, con người đã phản bội lẫn nhau, không còn gì để tin, tận thế đang diễn ra.
Và người ta chậm rãi nối đuôi nhau cùng nhảy múa. Âm nhạc rất rộn ràng. Nhưng ta không thấy sự vui tươi. Đúng hơn, ngay cả niềm vui cũng rã rời. Bởi niềm vui ấy đến từ sự nhận thức về cảnh xám buồn của thế giới.
Người ta nhảy múa để đón buổi tận thế. Có lẽ đó là âm luật của Krasznahorkai?
Trong một bộ phim tài liệu về cuộc đời của nhà văn này trước khi ông đoạt giải Nobel Văn chương có cảnh ông chơi piano. Nhưng ông không chỉ chơi piano. Khi nhìn vào ""lịch sử"" học nhạc của Krasznahorkai ta sẽ thấy lịch sử ấy song song với lịch sử viết văn của ông, như hai tấm gương phản chiếu lẫn nhau.
Gia tài văn chương của László Krasznahorkai là hành trình dài đi qua bóng tối, nơi mỗi tác phẩm đều vang vọng nỗi cô độc của nhân loại.
Tối đa:1500 ký tự
Hiện chưa có bình luận nào, hãy là người đầu tiên bình luận"
https://tuoitre.vn/phung-khanh-linh-toi-da-thoi-cau-xin-dam-dong-hay-nhin-thay-minh-20251019114859125.htm,Phùng Khánh Linh: 'Tôi đã thôi cầu xin đám đông hãy nhìn thấy mình',"Ra mắt album mới 'Giữa một vạn người', ca sĩ Phùng Khánh Linh chọn đối diện với chính mình, thôi cầu xin đám đông hãy nhìn thấy mình.","Album Giữa một vạn người của Phùng Khánh Linh lên số 1 iTunes Việt Nam sau một ngày ra mắt - Ảnh: NVCC
Sáng 19-10, chỉ sau một ngày phát hành, album mớiGiữa một vạn ngườicủa ca sĩPhùng Khánh Linhvượt lên đứng thứ 1 iTunes Việt Nam. Nhiều bài hát trong album cũng vào top 100 bài hát ở thị trường Việt Nam trên iTunes.
Với một ca sĩ luôn theo con đường riêng như Phùng Khánh Linh, đây là thành công bước đầu cho thấy khán giả đón nhận những tâm sự chân thành của cô.
Trong bức thư gửi khán giả vào hôm 18-10, ngày ra mắt album, Phùng Khánh Linh bộc bạch: ""Tôi đã từng mơ mình trở thành một nàng thiên nga xinh đẹp và tỏa sáng rực rỡ dưới ánh đèn sân khấu. Nhưng đó là một lời nguyền. Trăng rồi cũng sẽ tàn, và khi bình minh dần ló dạng, tôi trở lại với cuộc sống thường nhật"".
Khi những tiếng hò reo mờ dần để lại khoảng không vắng lặng, cô đã nghĩ đó là hiện thực phũ phàng. Tình yêu từng xuất hiện và ôm lấy cô nhưng hóa ra đó lại là một lời nguyền khác.
Phùng Khánh Linh đối diện những góc tối trong tâm hồn trong album Giữa một vạn người - Ảnh: NVCC
Cô trải lòng: ""Tôi đã từng muốn biến mất, đi thật xa. Nhưng trên chuyến xe tang tĩnh mịch ngày hôm ấy, khi tôi thả từng cánh hoa nói lời tiễn biệt bố về với hư vô, tôi bỗng hiểu ra rằng chúng ta rốt cuộc chỉ là những vệ tinh đơn độc trôi lững lờ theo quỹ đạo của riêng mình giữa không gian vô định"".
Cô trích câu văn củaHaruki Murakamitrong cuốnTôi nói gì khi nói về chạy bộ: ""Khổ đau, thực tế, là điều không thể tránh khỏi trong cuộc sống. Tuy nhiên, chìm đắm trong nỗi đau lại là một lựa chọn"".
Từ đó, Phùng Khánh Linh nhận ra rằng đôi khi nỗi đau là kết quả của những điều cô đã tạo ra. Cô viết: ""Giờ đây tôi đã thôi cầu xin đám đông hãy nhìn thấy mình, tôi học cách lắng nghe bản thân một cách trực diện và trung thực hơn"".
Với albumGiữa một vạn người, cô chọn buông bỏ những hỗn loạn, đối diện với chính mình và với những góc tối trong tâm hồn. Cô cúi đầu biết ơn âm nhạc vì đã là ngọn đèn dẫn lối giữa đêm phủ kín sương mờ.
Trước khi ra mắt album, Phùng Khánh Linh lần lượt ra 4 đĩa đơn gồm:Ước anh tan nát con tim, Em đau, Khóc Blóck, Tâm sự với đêm một mình.Cô lưu diễn xuyên Việt với 5 đêm nhạc cùng live band tại TP.HCM, Đà Nẵng và Hà Nội.
Trong đoạn phim giới thiệu albumGiữa một vạn người, Phùng Khánh Linh hóa thân nhân vật lấy cảm hứng từ nàng Odette trong vở ballet kinh điểnHồ Thiên Nga(Swan Lake)của Tchaikovsky.
Đoạn phim giới thiệu album Giữa một vạn người - Phùng Khánh Linh
Cô mượn hình ảnh nàng Odette để kể lại hành trình của mình. Khi ngồi trong căn phòng gương, cô nhìn thấy vô số phiên bản của mình: đẹp đẽ, yếu đuối, tổn thương và kiêu hãnh. ""Đó là lúc tôi hiểu mình không cần tìm kiếm ánh sáng ở bên ngoài, vì tôi chính là nguồn sáng của chính mình"" - cô chia sẻ.
AlbumGiữa một vạn ngườilà sự pha trộn giữa alternative pop, dream pop, punk và indie rock, tạo nên không gian vừa mơ màng, vừa dữ dội. Album gồm 12 ca khúc, trong đó có 8 ca khúc hoàn toàn mới. Cô kết hợp cùng các nhà sản xuất âm nhạc Đại Lâm, Phú Phạm, blossom...
Phần mixing do Josh Frigo thực hiện. Đây là nhà sản xuất chính của albumCITOPIAvàyesteryear- 2 album đều từng được đề cử hạng mục Album của năm tại giải âm nhạc Cống hiến. Phần mastering được đảm nhiệm bởi Chris Gehringer, kỹ sư âm thanh từng cộng tác vớiAriana Grande, Lady Gaga, Dua Lipa, Ed Sheeran...
Trong đêm nhạc ở TP.HCM vừa qua, giữa hàng trăm khán giả đồng thanh hát theo, Phùng Khánh Linh nói âm nhạc của cô viết về 'nỗi buồn của đô thị'.
Tối đa:1500 ký tự
Hiện chưa có bình luận nào, hãy là người đầu tiên bình luận"
https://tuoitre.vn/jack-sang-tac-ca-tu-tuc-tiu-va-phan-cam-cu-tuong-the-la-ngau-can-cam-dien-20251019111509166.htm,"Jack sáng tác ca từ tục tĩu và phản cảm, cứ tưởng thế là ngầu: Cần cấm diễn?","Nghệ thuật phải có sáng tạo nhưng Jack đừng lợi dụng mà sáng tạo quá đà, nhố nhăng, tạo nên sản phẩm kém văn hóa.","Jack trình diễn một ca khúc mới chưa công bố tại Hà Nội với những câu từ gây tranh cãi - Ảnh: FBNV
Bài viết'Lào gì cũng tôn' và những ca từ phản cảm, ngạo mạnđăng trênTuổi Trẻ Onlinenhận được nhiều bình luận trái chiều.
Đa số ý kiến cho rằng ca từ trong ca khúc mới củaJackthô tục, phản cảm, đồng thời kêu gọi cộng đồng mạng tẩy chay, cấm biểu diễn.
Độc giả T.N.V. đề nghị “cần cắt sóng vĩnh viễn những ca sĩ biểu diễn ca khúc có ca từ nhố nhăng, thô tục, phản cảm”.
Bạn đọc Thanh Hùng đồng quan điểm, người nổi tiếng càng phải cẩn trọng trong từng lời ăn tiếng nói, để giữ hình ảnh, là tấm gương cho các bạn trẻ.
“Tôi tin rằng cơ quan chức năng sẽ có “thuốc” trị những ca sĩ hát ca từ độc hại trong thời gian tới, sớm thôi!” - bạn đọc Thanh Tâm bình luận.
Một số ý kiến độc giả cho rằng đã đến lúc “siết chặt” những nghệ sĩ ăn nóithô tục, kém văn hóa , kinh doanh thực phẩm chức năng giả, quảng cáo lố.
Nhiều phụ huynh cũng không khỏi lo ngại việc xấu của thần tượng con mình có thể ảnh hưởng đến nhận thức, quan điểm của chúng.
“Ca khúc phục vụ công chúng mà ca từ không được chọn lọc kỹ càng thật đáng lo ngại, đặc biệt là ảnh hưởng tới trẻ em”; “Bài học xấu cho giới trẻ về lối sống”; “Những thành phần lố lăng, ảnh hưởng cả một thế hệ”; “Giới trẻ sẽ đi về đâu khi mà tư tưởng bị đầu độc bởi ca từ dung tục như vậy”… bạn đọc bình luận dưới bài viết.
“Fan toàn mấy bé học sinh là chính, vậy mà đi hát câu từ thô tục, bẩn thỉu thế này. Từ nay ba mẹ phải lo lắng, kiểm tra con mình nghe nhạc nào, bài nào nữa” - một phụ huynh chia sẻ.
Tuy nhiên vẫn có ý kiến ủng hộ, đứng về phía ca sĩ Jack: “Vậy mấy người hát rap diss rap (thể loại rap dùng lời lẽ công kích, chỉ trích - PV) thì sao?”; “Nhạc nghe quá hay chứ?”; ""Mình thích Jack của ngày xưa hơn”; “Nói chung antifan thì sẽ tìm mọi cách thôi”…
Trước những tranh luận tràn ngập trên mạng xã hội, nhiều người chỉ biết cảm thán: “Văn hóa chỉ đến thế thôi sao?”; “Sáng tác ra những ngôn từ như vậy mà cũng đi biểu diễn?”; “Ca sĩ thần tượng của bọn trẻ đây hả, không tưởng tượng nổi? Con cái của các bạn là fan của ca sĩ này, bạn nghĩ thế nào?”; “Cứ tưởng thế là ngầu”…
""Dù biết rằng âm nhạc không có quy chuẩn cụ thể để đánh giá nhưng tôi nghĩvăn hóa hip - hopvà bản sắc dù lớn đến đâu thì khi du nhập vào một đất nước cũng phải tuân theo pháp luật và văn hóa của đất nước đó. Âm nhạc cũng cần có thông điệp xây dựng xã hội chứ không phải chà đạp người khác, để tôn vinh bản thân” - độc giả T.B. bộc bạch.
Bạn đọc Khai Phong nhận định: “Đây là biểu hiện của văn hóa kém của ca sĩ lẫn fan của ca sĩ này. Nghệ thuật phải có sáng tạo nhưng đừng lợi dụng mà sáng tạo quá đà, quá lố và vô văn hóa. Cơ quan chức năng cần phải kiểm tra gắt gao hơn, xử để làm gương, không thể để những “ung nhọt văn hóa” làm ô nhiễm môi trường văn hóa nghệ thuật”.
Jack liên tục gây tranh cãi trên mạng xã hội - Ảnh: FBNV
Một độc giả bày tỏ thẳng thắn: “Không tôn trọng khán giả thì nghệ sĩ lấy tiền đâu ra mà dám phát ngôn ""anh hát chơi chơi hơn một kiếp nó đi làm"". Chắc bạn này kiếm tiền dễ quá nên quên mất đạo đức của người làm nghệ sĩ. Chúng ta đang quá dễ dãi, thấy trend thì lao vào mà không có sự chọn lọc” .
Từ sự việc trên, không ít độc giả yêu cầu cơ quan chức năng vào cuộc.
“Cần lắm sự tuýt còi và cấm sóng vĩnh viễn từBộ Văn hóa, Thể thao và Du lịchvới những ca sĩ, những bài hát như thế này”; “Thật buồn cho thị hiếu âm nhạc của giới trẻ ngày nay khi có một số người lại yêu thích ca từ lố bịch, thô tục, thiếu văn hóa. Sở Văn hóa và Thể thao cần có biện pháp răn đe, chấn chỉnh những nghệ sĩ dạng này” - bạn đọc bày tỏ quan điểm.
Độc giả Vĩnh Hải nhấn mạnh “cần xử lý mạnh tay với những ca sĩ xem thường khán giả”.
Tuổi Trẻ Onlineđang liên hệ vớiSở Văn hóa và Thể thao TP.HCMđể thông tin thêm về hướng xử lý vụ việc này.
Công ty J97 Promotion bị phạt 4 triệu đồng do tổ chức họp báo có nội dung không đúng với nội dung đã được cơ quan quản lý chấp thuận.
Tối đa:1500 ký tự
Hiện chưa có bình luận nào, hãy là người đầu tiên bình luận"
