url,title,description,content
https://tuoitre.vn/tung-bung-khai-mac-nhung-ngay-van-hoc-nghe-thuat-tp-hcm-20251018150848179.htm,Tưng bừng khai mạc Những ngày Văn học - Nghệ thuật TP.HCM,"Tối 18-10, lễ khai mạc Những ngày Văn học - Nghệ thuật TP.HCM diễn ra tại Nhà văn hóa Thanh niên. Trong chương trình, ban tổ chức tuyên dương 50 tác phẩm văn học nghệ thuật tiêu biểu TP.HCM.","Ca sĩ Thanh Ngọc biểu diễn bài Mùa xuân đầu tiên
Sự kiện Những ngày Văn học -Nghệ thuậtTP.HCMlần đầu tiên được tổ chức với quy mô lớn, tổng hợp các lĩnh vực nghệ thuật từ truyền thống đến hiện đại.
Đây là một trong những hoạt động chào mừng Đại hội Đảng bộ TP.HCM lần thứ I, nhiệm kỳ 2025 - 2030 thành công tốt đẹp, đánh dấu 50 năm hình thành và phát triển của văn học - nghệ thuật TP.HCM sau ngày đất nước thống nhất.
Phó chủ tịch UBND TP.HCM Trần Thị Diệu Thúy phát biểu trong lễ khai mạc rằng thành phố luôn trân trọng và biết ơn các thế hệ văn nghệ sĩ, những người đã biến nghệ thuật thành sức mạnh tinh thần, đồng hành cùng thành phố trong suốt hành trình đấu tranh, xây dựng và phát triển.

Bà Trần Thị Diệu Thúy, Phó chủ tịch UBND TP.HCM, phát biểu khai mạc - Ảnh: T.T.D.

Tất cả thể hiện bản lĩnh và trách nhiệm của người nghệ sĩ - những chiến sĩ tiên phong trên mặt trận văn hóa - nghệ thuật.
""Với tinh thần ""Thành phố của sáng tạo, nghĩa tình và khát vọng vươn lên"", tôi tin tưởng rằng Những ngày Văn học - Nghệ thuật TP.HCM trở thành nơi tôn vinh, kết nối và truyền cảm hứng sáng tạo cho các thế hệ văn nghệ sĩ và công chúng yêu nghệ thuật"", bà Diệu Thúy nói.
Đan xen buổi lễ tuyên dương 50 tác phẩmvăn học nghệ thuậttiêu biểu TP.HCM là những tiết mục văn nghệ đặc sắc.
Những ca khúc hào hùng quen thuộc nhưTiếng hát từ thành phố mang tên Người, Đất nước trọn niềm vui, Như có Bác trong ngày vui đại thắng, Mùa xuân đầu tiên, Mùa xuân trên TP.HCMđược thể hiện qua giọng hát ca sĩ Tạ Minh Tâm, Quốc Đại, Thanh Ngọc, rapper T.Won, nhóm Mắt Ngọc, nhóm 135.
Trong chương trình, nghệ sĩ xiếc Trung tâm nghệ thuật TP.HCM, Nhà hát Nghệ thuật hát bội biểu diễn nhiều tiết mục đặc sắc.
Các tác giả nhận kỷ niệm chương vinh danh các tác phẩm lĩnh vực sân khấu - Ảnh: T.T.D.
Chương trình khép lại khi MC kết luận: ""Suốt 50 năm,văn học và nghệ thuậtTP.HCM như dòng sông bền bỉ, lặng lẽ chảy qua bao mùa dâu bể.
Từ trang sách, vần thơ, từ những giai điệu ngân vang, cho đến ánh đèn sân khấu, nghệ sĩ thành phố đã góp nhịp tim của mình để viết nên bản hùng ca của một đô thị anh hùng, nghĩa tình, sáng tạo.
Trong từng tác phẩm, ta nghe tiếng vọng phù sa Nam Bộ, ta thấy bóng dáng con người thành phố - bình dị mà kiên cường, chan chứa nghĩa tình, không ngừng vươn lên giữa nhịp sống mới.
Và hôm nay, từ trái tim thành phố mang tên Bác, văn học nghệ thuật lại tiếp tục sải cánh, như đàn chim bay về phía bình minh, mang theo khát vọng hội nhập, tỏa sáng cùng thời đại"".
Ông Nguyễn Phước Lộc, Phó bí thư Thảnh ủy TP.HCM và ông Đoàn Hoài Trung, Chủ tịch Hội Nhiếp ảnh TP.HCM, trao kỷ niệm chương vinh danh các tác giả trong lĩnh vực nhiếp ảnh - Ảnh: T.T.D.
Các nghệ sĩ hát bội trong tiết mục Xây chầu đại bội - Ảnh: T.T.D.
Các nghệ sĩ múa Âm vang linh thiêng - Ảnh: T.T.D.
Nhóm nghệ sĩ xiếc trong cảnh Xuôi dòng Phương Nam - Ảnh: T.T.D.
Nhiếp ảnh:
Mẹ con ngày gặp mặt (tác giả: Lâm Hồng Long), Ảnh thời chiến (Sách ảnh, Lâm Tấn Tài), Bí thư Võ Văn Kiệt trao cờ xuất quân cho tuổi trẻ TP.HCM (Thiên Điểu), Sài Gòn ngoan cường (Sách ảnh, Nguyễn Á), Vượt qua bóng tối (Sách ảnh, Trần Thế Phong).
Điện ảnh:
Cánh đồng hoang (1979) (đạo diễn: Nguyễn Hồng Sến), Ván bài lật ngửa (Lê Hoàng Hoa), Vị đắng tình yêu (Lê Xuân Hoàng), Mê Kông ký sự (tổng đạo diễn: NSND Phạm Khắc, đạo diễn: Dư Kim Hoàng, Lý Quang Trung, Nguyễn Hoàng), Ngọc trong đá (Trần Cảnh Đôn), Biệt động Sài Gòn (NSND Long Vân).
Mỹ thuật:
Tượng Bác Hồ với thiếu nhi (điêu khắc Diệp Minh Châu), Tượng đài Mẹ Tổ quốc và Chiến sĩ vô danh (điêu khắc Nguyễn Hải), tranh Thanh niên thành đồng (họa sĩ Nguyễn Sáng), Tượng Nguyễn Tất Thành (điêu khắc Phạm Mười), Bộ tranh gốm Đền Bến Dược (3 bộ): Dân khai hoang - mở đất; Nhân dân ta bị đô hộ áp bức -  Đoàn kết đấu tranh giành thắng lợi; Sức tiếp sức, chống xâm lăng (điêu khắc Phạm Mười, nhóm họa sĩ đồng tác giả: Nguyễn Trung Tín, Nguyễn Quang Cảnh, Nguyễn Đức Hòa, Hoàng Trầm, Nguyễn Quang Vinh, Nguyễn Huy Khôi, Nguyễn Xuân Đông, Phan Mai Trực,  Phan Hoài Phi, Đỗ Mạnh Cương, Lê Đàn).
Kiến trúc:
Đền Tưởng niệm Vua Hùng TP.HCM (kiến trúc sư Nguyễn Trường Lưu), Đền Tưởng niệm Bến Dược, Củ Chi (Khương Văn Mười), Nhà thiếu nhi và quần thể công trình Nhà thiếu nhi TP.HCM (Nguyễn Trường Lưu), Nhà hát Hòa Bình, quận 10 (Huỳnh Tấn Phát, Nguyễn Trung Kiên), Nhà văn hóa Sinh viên TP.HCM (Nguyễn Trung Kiên).
Văn học:
Quê hương Địa Đạo (truyện và ký, nhà văn Viễn Phương), Bàn thờ tổ của một cô đào (truyện ngắn, Nguyễn Quang Sáng), Ở R - chuyện kể sau 50 năm (Lê Văn Thảo), Mắt biếc (tiểu thuyết, Nguyễn Nhật Ánh), Thì thầm với dòng sông (tập thơ, nhà thơ Hoài Vũ).
Âm nhạc:
Mùa xuân trên TP.HCM (Xuân Hồng), Tiếng hát từ thành phố mang tên Người (nhạc: Cao Việt Bách, lời: Đăng Trung, Cao Việt Bách), Thành phố tình yêu và nỗi nhớ (nhạc: Phạm Minh Tuấn; Thơ: Nguyễn Nhật Ánh), Đất nước trọn niềm vui (nhạc và lời: Hoàng Hà),  Bên tượng đài Bác Hồ (nhạc: Lư Nhất Vũ, lời: Lê Giang), Một đời người một rừng cây (Trần Long Ẩn), Giao hưởng số 6 Sài Gòn 300 năm (tác giả: Nguyễn Văn Nam).
Văn học nghệ thuật các dân tộc thiểu số
Sách văn học Học tập tấm gương đạo đức và tư tưởng Hồ Chí Minh về chính sách đoàn kết dân tộc (chủ biên: Tiến sĩ Trần Thạch Pôn),  sách Người Chăm với Bác Hồ, (thực hiện: Chi hội văn học nghệ thuật dân tộc Chăm; chủ biên: tiến sĩ Phú Văn Hẳn (dân tộc Chăm)), Thư pháp Nhật ký trong tù (thực hiện: chi hội Thư pháp, chủ biên: Nghệ nhân thư pháp Trần Xuyên (dân tộc Hoa), Tuyển tập thư pháp Thực hiện Di chúc Bác Hồ 1969 - 2019 (thực hiện: Chi hội thư pháp, chủ biên: NSND Trương Lộ (dân tộc Hoa)), Nét đẹp văn hóa cộng đồng của Hội quán người Hoa tại TP.HCM (tác giả: Lưu Kim Hoa).
Múa:
Mâm vàng Cửu Long (NSND Thái Ly), Chuyện tình non sông (NSND Vũ Việt Cường, NSND Kim Quy), Huyền thoại Rừng Sác (kịch bản, biên đạo: Huỳnh Quang Trí, âm nhạc: Đức Trịnh), Trắng đen (ánh sáng và bóng tối) (kịch bản, biên đạo: NSND Tô Nguyệt Nga, âm nhạc: Ca Lê Thuần), Mùa sen nở (NSND Hoàng Phi Long).
Sân khấu:
Cải lương Người ven đô (tác giả: Minh Khoa, chuyển thể: Nguyễn Gia Nghiệm, đạo diễn: Minh Trị),  kịch Lá sầu riêng (tác giả: Hoàng Dũng, đạo diễn: NSND Ngô Y Linh, NSND Kim Cương), cải lương Tiếng trống Mê Linh (tác giả: Việt Dung - Vĩnh Điền, đạo diễn: NSND Ngô Y Linh), hát bội Lê Công kỳ án (tác giả: NSND Hữu Danh, đạo diễn: Nguyễn Hoàn), cải lương Rồng Phượng (tác giả: Lê Duy Hạnh, chuyển thể: Hoàng Song Việt, đạo diễn: NSND Trần Ngọc Giàu), À Ố show (tác giả: Lune Production), kịch Dạ cổ hoài lang (tác giả: NSƯT Thanh Hoàng, đạo diễn: Nguyễn Công Ninh).

Bí thư Thành ủy TP.HCM Trần Lưu Quang trò chuyện, lắng nghe văn nghệ sĩ TP.HCM bày tỏ nỗi niềm tại Hội nghị tổng kết 50 năm văn học, nghệ thuật TP.HCM.
Tối đa:1500 ký tự
Hiện chưa có bình luận nào, hãy là người đầu tiên bình luận"
https://tuoitre.vn/nghe-nhac-xem-vo-thuat-kich-hat-boi-o-nhung-ngay-van-hoc-nghe-thuat-tp-hcm-20251019065823014.htm,"Nghe nhạc, xem võ thuật, kịch, hát bội ở Những ngày văn học nghệ thuật TP.HCM","Chuỗi chương trình Những ngày văn học nghệ thuật TP.HCM diễn ra từ ngày 18 đến 21-10 tại Nhà văn hóa Thanh niên (phường Sài Gòn) với nhiều hoạt động văn hóa, giải trí đặc sắc.","Biểu diễn nhạc kèn thiếu nhi Việt Nam marching band  tại buổi khai mạc 18-10 - Ảnh: T.T.D.
Sau ngày khai mạc 18-10,  Những ngày văn họcnghệ thuậtTP.HCM tiếp tục có những hoạt động sôi nổi như: biểu diễn các ban nhạc, võ thuật cổ truyền, kịchĐức Thượng công Tả quân Lê Văn Duyệt.
Tại Nhà văn hóa Thanh niên, lúc 9h30 ngày 19-10, không gian phía trước mặt tiền có các tiết mục biểu diễn của các  band nhạc.
Ngày 20, 21-10, lúc 17h đến 18h nơi đây dành cho  ban nhạc Acoustic.
Biểu diễn võ nhạc Vovinam - Ảnh: T.T.D.
Khán giả muốn xem các chương trình nhạc truyền thống thì ngày 19, 20-10 tại không gian biểu diễnĐờn ca tài tửvà biểu diễn văn học nghệ thuật các dân tộc thiểu số tại sân 37A.
Ngày 19-10, lúc 19h30 là chương trình biểu diễn, quảng bá nghệ thuật truyền thống hát bội tại sân khấu khu vực sân 4A.
18h ngày 20-10 là chương trình biểu diễn, quảng bá nghệ thuật cải lương tại sân khấu khu vực sân 4A.
Bà Trần Thị Diệu Thúy, Phó chủ tịch UBND TP.HCM, tham quan và thăm hỏi các nghệ nhân - Ảnh: T.T.D.
Sân khấu khu vực sân 4A biểu diễn võ thuật cổ truyền trong 2 ngày 20 và 21-10.
Tại hội trường, lúc 14h ngày 19-10 diễn vở kịchĐức Thượng công Tả quân Lê Văn Duyệt.
19h30 ngày 20-10, chương trình giao lưu, trình diễnGiai điệu từ những vần thơtại Hội trường biểu diễn nghệ thuật, Nhà văn hóa Thanh niên.
Từ 19h30 ngày 21-10 chương trình nghệ thuật bế mạc Những ngày văn học nghệ thuật TP.HCM với chủ đềNơi hội tụ những dòng sôngtại Hội trường biểu diễn nghệ thuật.
Bên trong Nhà văn hóa Thanh niên, có không gian trưng bày thành tựu 50 năm văn học nghệ thuật của thành phố,  nghệ thuật truyền thống.
Ông Nguyễn Phước Lộc, Phó bí thư Thảnh ủy TP.HCM và các đại biểu tham quan Không gian trưng bày giới thiệu các thành tựu văn học nghệ thuật tại ngày khai mạc - Ảnh: T.T.D.
Từ 14h đến 15h30  ngày 19-10, tại khu vực sảnh trưng bày diễn ra chương trình giao lưu với  nhà văn Trình Quang Phủ về truyện kýTheo dấu chân Người.
Ngày 21-10 lúc 10h diễn ra tọa đàmSức trẻ văn chương Phương Namtại khu vực sảnh trưng bày, triển lãm.
17h cùng ngày diễn ra giao lưu với nhà thiết kế áo dài Trung Đinh.
Từ 18h đến 19h15 là chương trình biểu diễn Trung tâm Văn hóa, Nghệ thuật Bà Rịa - Vũng Tàu tại sân khấu khu vực sân 4A.
Khách xem biểu diễn đờn ca tài tử ở không gian sân 37A - Ảnh: T.T.D.
Lãnh đạo TP.HCM và các đại biểu chụp ảnh chung với các nghệ sĩ, diễn viên sau khi thưởng thức các hoạt động biểu diễn nghệ thuật đường phố tại đêm khai mạc - Ảnh: T.T.D.
Màn đồng diễn quy tụ chừng 700 người - Ảnh: T.T.D.
Tối 18-10, lễ khai mạc Những ngày Văn học - Nghệ thuật TP.HCM diễn ra tại Nhà văn hóa Thanh niên. Trong chương trình, ban tổ chức tuyên dương 50 tác phẩm văn học nghệ thuật tiêu biểu TP.HCM.
Tối đa:1500 ký tự
Hiện chưa có bình luận nào, hãy là người đầu tiên bình luận"
https://tuoitre.vn/tap-chi-han-quoc-xin-loi-ve-tranh-cai-loi-dung-benh-ung-thu-vu-de-lam-mau-20251019104737749.htm,Tạp chí Hàn Quốc xin lỗi về tranh cãi lợi dụng bệnh ung thư vú để 'làm màu',"Sau 4 ngày im lặng, tạp chí thời trang Hàn Quốc W Korea chính thức đưa ra lời xin lỗi về những tranh cãi trong khuôn khổ chiến dịch nâng cao nhận thức về ung thư vú.","Tại bữa tiệc của W Korea, Jay Park bị phản ứng dữ dội vì có hành động nhảy gợi dục - Ảnh: Chosun
Những ngày qua, công chúng Hàn Quốc dậy sóng trước sự kiệnLove Your W 2025doW Koreatổ chức. Dù được quảng bá là chiến dịch nâng cao nhận thức về ung thư vú, sự kiện này lại gây tranh cãi khi tập trung vào những bữa tiệc rượu xa hoa của các ngôi sao.
Trước làn sóng chỉ trích dữ dội, ngày 19-10, tạp chíW Koreachính thức lên tiếng. Họ cho biết: ""Chiến dịch 'Nâng cao nhận thức về ung thư vú: Love Your W' bắt đầu từ năm 2006 đã nỗ lực trong suốt 20 năm qua để tuyên truyền tầm quan trọng của việc phát hiện sớm ung thư vú.
Tuy nhiên, sự kiện ngày 15-10 vừa qua đã bị đánh giá là có cách tổ chức và nội dung không phù hợp với mục đích ban đầu của chiến dịch. Chúng tôi nhận thức sâu sắc về những phản hồi này và rất lấy làm tiếc"".
Bên cạnh đó, đại diện W Korea cũng gửi lời xin lỗi chân thành đến các bệnh nhân ung thư vú và gia đình họ vì đã không đủ tinh tế, gây tổn thương và bất tiện trong quá trình tổ chức sự kiện.
Buổi tiệc xa hoa của các nghệ sĩ được đăng tải lên trang chủ W Korea - Ảnh chụp màn hình
W Koreacam kết sẽ nghiêm túc xem xét lại toàn bộ quá trình lên kế hoạch và tổ chức sự kiện trong tương lai, đồng thời khẳng định chiến dịch luôn đồng hành cùng Quỹ Sức khỏe vú Hàn Quốc để hỗ trợ chi phí điều trị cho những bệnh nhân có hoàn cảnh khó khăn.
Tạp chísẽ tiếp tục lắng nghe những phê bình để không làm lu mờ đi giá trị cốt lõi mà chiến dịch này hướng tới.
Trước đó, sự kiện kỷ niệm lần thứ 20 của chiến dịch ""Love Your W 2025"" được tổ chức tại khách sạn Four Seasons ởSeoulđã gây phản ứng dữ dội khi gần như không có bất kỳ nội dung nào liên quan đến ung thư vú được truyền tải.
Trái lại, hình ảnh các ngôi sao nổi tiếng dự tiệc, nâng ly rượu và thưởng thức âm nhạc trong không gian xa hoa lại tràn ngập truyền thông và mạng xã hội, khiến dư luận cho rằng sự kiện đã hoàn toàn lệch hướng.
Năm nay, sự kiện còn gây tranh cãi khi mờiJay Parkbiểu diễn với những lời hát bị đánh giá là thiếu nhạy cảm, thậm chí có phần xúc phạm đối với các bệnh nhân ung thư vú đã trải qua phẫu thuật cắt bỏ ngực.
RM (BTS) và các thành viên Aespa tại bữa tiệc của W Korea - Ảnh: W Korea
Hành động này, cùng với việc nhóm nhạcAespabị yêu cầu thực hiện thử thách vũ đạo có nội dung gợi dục, đã khiến dư luận dậy sóng.
Không dừng lại ở đó, nghi vấn về việc minh bạch tài chính cũng nhanh chóng nổ ra.
Theo một báo cáo do tờWomen's Newstrích dẫn từ tài liệu nghị sĩ Lee Soo Jin (thuộc Ủy ban Y tế và Phúc lợi Quốc hội) nhận từ Bộ Y tế, tổng số tiền màW Koreachuyển cho Quỹ Sức khỏe vú Hàn Quốc từ năm 2007 đến tháng 11-2024 chỉ đạt khoảng 315 triệu won.
Đáng chú ý, từ năm 2017 đến 2023 không hề có khoản quyên góp nào được ghi nhận, ngoại trừ năm 2024 với khoản 125 triệu won.
Điều này hoàn toàn trái ngược với tuyên bố trước đó củaW Korearằng họ đã quyên góp tổng cộng 1,1 tỉ won trong 20 năm hoạt động.
Trước phản ứng gay gắt từ dư luận,W Korealên tiếng giải thích rằng những con số được công bố trên truyền thông chưa phản ánh đầy đủ.
Một trong những chiến dịch nâng cao nhận thức về ung thư vú lớn nhất Hàn Quốc quy tụ đông đảo ngôi sao đình đám đang bị chỉ trích gay gắt, vì biến sự kiện thành bữa tiệc uống rượu, tiệc tùng.
Tối đa:1500 ký tự
Hiện chưa có bình luận nào, hãy là người đầu tiên bình luận"
https://tuoitre.vn/lien-binh-phat-thanh-thi-de-kim-chung-truong-quan-ninh-va-nhieu-nghe-si-viet-chuc-mung-20251019103945003.htm,"Liên Bỉnh Phát thành 'Thị đế' Kim Chung, Trương Quân Ninh và nhiều nghệ sĩ Việt chúc mừng","Bạn diễn Trương Quân Ninh ôm chặt Liên Bỉnh Phát sau khoảnh khắc xướng tên, còn nhiều nghệ sĩ Việt chúc mừng anh vì giải thưởng tại Kim Chung.","Liên Bỉnh Phát và Trương Quân Ninh trước khi đi thảm đỏ giải Kim Chung tối 18-10 - Ảnh: NVCC
Sau khi đoạt giải Nam diễn viên chính xuất sắc trong phim truyền hình tại Giải Kim Chung (Đài Loan, Trung Quốc) tối 18-10,Liên Bỉnh Phátnhận được rất nhiều lời chúc mừng từ bạn bè đồng nghiệp. Tên anh cũng trở thành xu hướng tìm kiếm phổ biến ở Việt Nam.
Sáng 19-10, Liên Bỉnh Phát đăng lên trang cá nhân những bức ảnh cả đoàn phimThe Outlaw Doctor (Bác sĩ tha hương)cùng nhau ăn mừng sau chiến thắng tại Kim Chung (Golden Bell Awards). Anh cho biết mình chỉ ngủ được 45 phút trước khi về Việt Nam để tiếp tục ""ăn cơm đoàn phim"", nhưng rất phấn khích.
Tại bữa tiệc mừng, Liên Bỉnh Phát chụp ảnh cùng mỹ nhân nổi tiếng Trương Quân Ninh, người đóng vai nữ chính của bộ phim, Dương Nhất Triển - người thắng giải Nam diễn viên phụ xuất sắc, cùng các bạn diễn khác, nhà sản xuất, thành viên ê kíp...
Anh khoeTrương Quân Ninhtặng anh một món quà đặc biệt là chiếc bùa may mắn, và nó đã phát huy tác dụng.
Liên Bỉnh Phát ăn mừng cùng Trương Quân Ninh và đoàn phim. Anh được khen ngợi với chiếc áo truyền thống Việt - Ảnh: NVCC
Trong khoảnh khắc được xướng tên trở thành Thị đế Kim Chung, Liên Bỉnh Phát ôm mặt bất ngờ. Những người xung quanh vỗ tay khích lệ anh, trong đó bạn diễn Trương Quân Ninh là nhiệt tình nhất. Anh đứng dậy và ôm chặt lấy cô rồi mới lên sân khấu nhận giải.
Liên Bỉnh Phát không chỉ giành giải thưởng diễn xuất uy tín của truyền hình Đài Loan mà còn là diễn viên Việt Nam đầu tiên giành giải Nam diễn viên chính xuất sắc tại Kim Chung, điều này khiến nhiều nghệ sĩ Việt tự hào.
Các ""anh tài"" S.T Sơn Thạch, Thành Trung, Bằng Kiều, Tiến Luật, Duy Nhất, Phạm Khánh Hưng, ca sĩ Đan Trường, Phan Mạnh Quỳnh, diễn viên Quang Tuấn, Kiều Trinh, nhà sản xuất Hằng Trịnh... gửi lời chúc mừng, khen anh quá giỏi.
Liên Bỉnh Phát, Trương Quân Ninh cũng là hai trong số những nghệ sĩ được khen mặc đẹp trên thảm đỏ Kim Chung - Ảnh: Vogue Taiwan
Thông tin Liên Bỉnh Phát là diễn viên Việt đầu tiên đoạt giải Kim Chung được tạp chíVogue Taiwanđưa lên tít trong bài đăng về giải. Sáng 19-10, diễn viên khoe ảnh anh lên trang nhất một tờ báo. Chiến thắng của anh được nhiều tờ báo địa phương nhận xét là xứng đáng.
Trước lễ trao giải, Liên Bỉnh Phát đượcVogue Taiwangọi là ""Trương Chấn của Việt Nam"", điểm lại sự nghiệp diễn xuất của anh với vai diễn đầu tay ấn tượng trong phimSong Langcủa đạo diễn Leon Lê. Vai diễn đầu tay cũng giúp anh giành nhiều giải thưởng diễn xuất trong và ngoài nước.
Liên Bỉnh Phát được đề cử Nam diễn viên chính xuất sắc tại giải Kim Chung (Đài Loan), một trong những giải thưởng danh giá của điện ảnh châu Á.
Tối đa:1500 ký tự
Hiện chưa có bình luận nào, hãy là người đầu tiên bình luận"
