url,title,description,content
https://tuoitre.vn/tan-miss-grand-international-2025-bi-chi-trich-o-que-nha-vi-gay-chia-re-chinh-tri-20251019111349512.htm,Tân Miss Grand International 2025 bị chỉ trích ở quê nhà vì gây chia rẽ chính trị,Mỹ nhân vừa đăng quang Miss Grand International 2025 Emma Tiglao - đại diện đến từ Philippines - đang phải đối mặt với làn sóng phản đối dữ dội tại quê nhà vì có hoạt động chính trị gây tranh cãi.,"Khoảnh khắc đăng quang của tân Hoa hậu Hòa bình quốc tế 2025 - Ảnh: BTC
Tối 18-10, đêm chung kếtMiss Grand International2025 (Hoa hậu Hòa bình quốc tế) diễn ra tại Thái Lan. Vượt qua 77 người đẹp đến từ các quốc gia và vùng lãnh thổ, người đẹp Philippines Emma Tiglao giành ngôi vị cao nhất.
Chiến thắng của Emma Tiglao lẽ ra phải là một khoảnh khắc tự hào dân tộc khi Philippines là quốc gia đầu tiên giành chiến thắng 2 năm liên tiếp (back to back) trong lịch sử Miss Grand International.
Thế nhưng, theoIBT, với Emma Tiglao, niềm vui đăng quang nhanh chóng bị phủ bóng bởi cơn bão tranh cãi gay gắt đang dâng lên ngay tại quê hương mình.
Một lượng lớn khán giảPhilippinesđặt câu hỏi: ""Làm sao có thể tôn vinh một hoa hậu hòa bình khi quá khứ của cô lại gắn với giai đoạn chính trị gây chia rẽ sâu sắc nhất trong lịch sử Philippines?"".
Trọng tâm của làn sóng chỉ trích nhắm vào Emma Tiglao bắt nguồn từ một cáo buộc đầy sức nặng: cô bị cho là một ""DDS"" (Diehard Duterte Supporter), tức người ủng hộ trung thành của cựu Tổng thống Rodrigo Duterte.
Bởi trong thời gian cầm quyền của mình, ông Duterte có liên quan chiến dịch chống ma túy gây tranh cãi. Liên hợp quốc nhiều lần lên án các chính sách của ông Duterte vi phạm nhân quyền.
Trên mạng xã hội, các bình luận tiêu cực liên tục xuất hiện. Nhiều người tuyên bố rằng họ ""khó lòng ủng hộ một hoa hậu thuộc phe cựu Tổng thống Rodrigo Duterte"", thậm chí mỉa mai cô là ""nữ hoàng sắc đẹp bị thổi phồng, một DDS từ trái tim đến linh hồn"".
Khoảnh khắc Emma Tiglao được xướng tên ở ngôi vị cao nhất - Video: BTC
Nhiều nhà quan sát cho rằng đài truyền hình NET25 (nơi Emma Tiglao làm việc) có xu hướng ủng hộ hoặc đứng về phía cựu Tổng thống Duterte trong thời gian ông còn tại vị.
Điều đó khiến nàng hậu bị cáo buộc là người ủng hộ, truyền tải thông điệp chính trị mà người dân phản đối. Ngoài ra, Emma Tiglao còn bị tố phát tán tin giả trong một số bản tin chính trị khác.
Một người dùng X (Twitter) viết: ""Cô không thể vừa nói về hòa bình, vừa ủng hộ kẻ giết người và lan truyền tin giả với tư cách một nhà báo… thật vô lý"".
Philippines là quốc gia đầu tiên giành chiến thắng 2 năm liên tiếp (back to back) trong lịch sử Miss Grand International - Ảnh: BTC
Điều khiến nhiều người chỉ trích Emma Tiglao nhất chính là sự mâu thuẫn giữa hình ảnh cô thể hiện trên sân khấu và con người thật ngoài đời.
Trong đêm chung kết Miss Grand International, Emma Tiglao có bài phát biểu đầy cảm xúc về việc sống không sợ hãi, tầm quan trọng của lòng trắc ẩn và sự khiêm nhường ở người lãnh đạo. Cô khẳng định đầy mạnh mẽ: ""Hãy để tình yêu trở thành tiếng nói vĩ đại nhất của hòa bình"".
Tuy nhiên, với nhiều người Philippines, những lời ấy lại nghe có phần giả tạo và xa vời. Trên mạng xã hội, hàng loạt bình luận đối lập xuất hiện, trong đó một người viết: ""Bài phát biểu của Emma Tiglao khác xa với cách cô ấy hành xử trên sóng truyền hình"". Người khác lại nhắn nhủ cô: ""Hãy thực sự sống đúng với những gì cô nói"".
Hiện Emma Tiglao chưa lên tiếng về những cáo buộc này.
Top 5 Miss Grand International 2025. Danh hiệu á hậu 1, 2, 3, 4 lần lượt trao cho các người đẹp đến từ Thái Lan, Tây Ban Nha, Ghana, Venezuela - Ảnh: BTC
Emma Tiglao là một trong những ứng viên nổi bật nhất năm nay nhờ ngoại hình thu hút và khả năng giao tiếp ấn tượng.
Cô 31 tuổi, cao 1,75m, tốt nghiệp ngành quản lý du lịch và hiện hoạt động với vai trò MC, người mẫu. Trên Instagram, nàng hậu sở hữu hơn 280.000 người theo dõi.
Sau 20 ngày chinh chiến, đại diện Việt Nam - Nguyễn Thị Yến Nhi chính thức trượt top 22 Miss Grand International 2025. Ngôi vị cao nhất thuộc về người đẹp Emma Tiglao đến từ Philippines.
Tối đa:1500 ký tự
Hiện chưa có bình luận nào, hãy là người đầu tiên bình luận"
https://tuoitre.vn/anh-trai-say-hi-but-toc-kich-tinh-ghibli-cuc-vang-cua-ngoai-gay-sot-rap-viet-2025101719193042.htm,"Anh trai say hi bứt tốc kịch tính; Ghibli, Cục vàng của ngoại gây sốt rạp Việt","Một số tin tức xem nghe nổi bật: Anh trai say hi: nóng với lượt 2 Live stage 2; Rạp Việt sôi động với anime Ghibli, Cục vàng của ngoại; Xem đêm diễn Tâm hoa nghiệp tổ; 2 ngày 1 đêm với hành trình mới ở Bắc Ninh.","Các thành viên trong đội Karik - Ảnh: BTC
Tập 5Anh trai say hicó màn ""đấu khẩu"" giữa các nhóm và sự cạnh tranh khắc nghiệt. Các anh trai tiếp tục thể hiện bản lĩnh và màu sắc riêng của từng đội. Ở tập trước, hai đội đang tạm dẫn đầu là team Negav và B Ray.
Ryn Lee tuyên bố ""nhảy bung nóc"", GILL nói rằng đội mình im lặng nãy giờ chỉ để ""xem các đội khác diễn tuồng"".
Phúc Du tiết lộ nhóm quyết định dốc hơi sức vì team nhỏ thi lượt 1 đã có được ""một chân"" để đem cả đội vào vòng an toàn, nên muốn dồn hết sức để đạt được thứ hạng cao nhất. Karik bảo đội mình sẽ ""bẻ gãy"" chân đó.
Trailer bật mí về tiết mục đội RIO, Phúc Du, Thái Ngân và Jey B. Ca khúcYou can't get him outkể về cô gái không thoát khỏi chàng trai.
Sau nhiều lần thảo luận, nhóm thống nhất đảo chiều câu chuyện để nói về một chàng trai không thể thoát ra khỏi cô gái, dù biết sai nhưng vẫn chọn ở lại.
Jey B, là người viết phần mở đầu ca khúc, lấy cảm hứng từ khung cảnh bên bờ sông nơi người con gái khóc, còn chàng trai chỉ biết lặng lẽ đứng nhìn, thể hiện nỗi giằng xé giữa lý trí và con tim. Tập 5 phát sóng lúc 19h30 ngày 18-10 trên HTV2-Vie Channel.
Sau chuỗi phim hành động và kinh dị liên tiếp, phòng vé Việt tuần này (từ 17-10) trở nên nhẹ nhàng hơn với hai tác phẩm giàu cảm xúc-Gió vẫn thổivàCục vàng của ngoại.
Gió vẫn thổi-kiệt tác hoạt hình của Hayao Miyazaki-trở lại với khán giả Việt. Phim kể về Jirō Horikoshi, chàng kỹ sư hàng không mang trong mình ước mơ bay cao giữa thời kỳ biến động của nước Nhật.
The Wind Rises (tựa Việt: Gió vẫn thổi) là một trong những tác phẩm đẹp đẽ và mang đậm dấu ấn cá nhân nhất của cha đẻ Studio Ghibli - Ảnh: Studio Ghibli
Xen giữa giấc mơ và hiện thực, giữa lý tưởng và mất mát,Gió vẫn thổikhông chỉ là câu chuyện tình buồn mà còn là khúc chiêm nghiệm sâu sắc về con người, chiến tranh và giá trị của khát vọng sống.
Trong khi đó,Cục vàng của ngoại-phim Việt mới của đạo diễn Khương Ngọc-lại mang đến bức tranh ấm áp, chan chứa tình thân với sự xuất hiện của ""bà ngoại"" Hồng Đào.
Qua câu chuyện bà Hậu (Việt Hương) và đứa cháu nhỏ, bộ phim gợi nhắc ký ức tuổi thơ bình dị, tình làng nghĩa xóm và lòng bao dung của những người phụ nữ tảo tần.
Teaser trailer phim Cục vàng của ngoại
Bên cạnh hai phim nổi bật, rạp chiếu cuối tuần này còn có các phim như:Vận may(Keanu Reeves, Seth Rogen)-phim hài hành động vui nhộn,Năm của anh, ngày của em-bản tình ca xuyên không gian từng gây sốt Hàn Quốc vàTổ quốc trong tim: The Concert Film-phim tài liệu âm nhạc tái hiện ""concert quốc gia"" hút hơn 50.000 khán giả.
Tối 18-10, tạiNhà hát Trần Hữu Trang, đoàn 2 của nhà hát sẽ giới thiệu đến khán giả chương trìnhTâm hoa nghiệp tổ.
Đây là chương trình khắc họa chân dung nghệ sĩ trẻ Lê Thanh Thảo, mở màn cho chuỗi chương trình riêng dành cho các nghệ sĩ trong Nhà hát Trần Hữu Trang.
Nghệ sĩ Lê Thanh Thảo sẽ là nhân vật chính trong chương trình Tâm hoa nghiệp tổ - Ảnh: LINH ĐOAN
Lê Thanh Thảo là con của đôi nghệ sĩ cải lương tuồng cổ kỳ cựu Trường Sơn-Thanh Loan, là thế hệ thứ 5 của gia tộc Minh Tơ-Thanh Tòng.
Trong chương trình sẽ có sự góp mặt của nhiều nghệ sĩ thuộc gia tộc cải lương lừng lẫy. Đó là nghệ sĩ Trường Sơn, Công Minh, Bạch Long, Chí Bảo, Xuân Trúc, Trinh Trinh, Tú Sương, Quế Trân, Bình Tinh, Điền Trung, Trường Giang, Hồng Quyên, Tú Quyên, Kim Thư, Thảo Trâm, Thảo Trúc…
Bắt đầu từ tập 85,2 ngày 1 đêmcó hành trình mới ở Bắc Ninh. Với chủ đề Nét son Kinh Bắc, chương trình khai thác tinh hoa văn hóa Việt qua tranh dân gian Đông Hồ,dân ca quan họvà sự xuất hiện của một khách mời đặc biệt có thông tin siêu khủng gắn liền với lịch sử và địa danh nơi đây cùng đồng hành trong chặng ghi hình này.
6 thành viên với hành trình ở Bắc Ninh - Ảnh: BTC
Đông đảo người dân đến đón chào dàn cast2 ngày 1 đêmkhi chương trình ghi hình tháng 9 khiến cho đội giữ trật tự làm việc vất vả.
Khi có thông tin HIEUTHUHAI bị đau tay, có người cho rằng nguyên nhân vì chen lấn xô đẩy.
Tuy nhiên sau đó, Hiếu đã giải thích anh bị đau do ""huynh đệ tương tàn"" khi tham gia trò chơi thử thách trong chương trình.2 ngày 1 đêmphát sóng lúc 20h30 ngày 19-10 trên HTV7.
Nhà hát kịch Idecaf diễnMá ơi út dìangày 18-10, ngày 19-10 là vởTấm Cám đại chiến. Sân khấu kịch Thiên Đăng diễn vở13 đức thầyngày 18-10, ngày 19-10 là vởNgũ quý tương phùng.
Ngày 18-10,Sân khấu kịch Hồng Vândiễn vở3D Cung tâm kế, ngày 19-10 là vởCăn phòng câm lặng.
Sân khấu Thế Giới Trẻ diễn vởThần tiên cũng nổi điên,Bóng đàn ôngngày 18-10, ngày 19-10 là vởHồn ma cô đào hát.
Ngày 19-10, Sân khấu Hoàng Thái Thanh diễn vởTrái tim oan khuất.Ngày 18-10, Nhà hát kịch 5B diễn vởBiệt đội gà vịt.
Sân khấu Trương Hùng Minh diễn vởBa ơi, tía ơi con nhớ changày 18-10, ngày 19-10 là vởNgày mai người ta lấy chồng.
Ngày 26-9, CGV chính thức công bố bộ phim The Wind Rises (tựa Việt: Gió vẫn thổi) sẽ là tác phẩm tiếp theo của chuỗi phim Studio Ghibli trên màn ảnh rộng năm 2025 tại Việt Nam.
Tối đa:1500 ký tự
Hiện chưa có bình luận nào, hãy là người đầu tiên bình luận"
https://tuoitre.vn/bom-tan-kinh-di-thai-lan-tee-yod-quy-an-tang-3-ra-rap-soobin-nhac-nho-tan-binh-toan-nang-giu-lua-20251010170056891.htm,Bom tấn kinh dị Thái Lan Tee yod: Quỷ ăn tạng 3 ra rạp; Soobin nhắc nhở Tân binh toàn năng giữ lửa,Một số tin tức xem nghe nổi bật: Bom tấn kinh dị Thái Lan Tee yod: Quỷ ăn tạng 3 ra rạp; Tân binh toàn năng: SOOBIN nhắc nhở giữ lửa; Xem Tú Sương đóng vai nam trong Bức ngôn đồ Đại Việt; Running man: Cuộc chiến thượng lưu...,"Tee Yod: Quỷ ăn tạng 3 được kỳ vọng sẽ là mảnh ghép hoàn hảo khép lại hành trình rùng rợn kéo dài 3 năm - Ảnh: CGV
Cuối tuần này,Tee yod: Quỷ ăn tạng3, Trò chơi ảo giác: Ares, Chú thuật hồi chiến: Hoài ngọc/ Ngọc chiết - The Movie, Hành trình rực rỡ ta đã yêuvàNhững lá thư của Yeonra rạp vào ngày 10-10.
Nổi bật nhất làTee yod: Quỷ ăn tạng 3. Cốt truyện xoay quanh Yak và gia đình phải đối mặt với nỗi kinh hoàng mới khi cô em út Yee đột ngột mất tích bí ẩn. Yak buộc phải cùng Yos, Yod và Papan lên đường đến ""Bong Sa Noh Bian"" - khu rừng ma ám - để cứu Yee trước khi những linh hồn tà ác một lần nữa bị đánh thức.
Quỷ ăn tạng trailer
Hai phần đầu củaTee yodđều gặt hái thành công ấn tượng ở phòng vé Việt, với doanh thu lần lượt 54,7 tỉ đồng và 99,6 tỉ đồng.
Hơn nữa, Việt Nam là thị trường duy nhất dàn saoTee Yod: Quỷ ăn tạng 3đích thân đến để gặp gỡ và giao lưu cùng khán giả.
Dẫn đầu bởi ngôi sao hàng đầu Thái Lan là Nadech Kugimiya (Yak) và dàn ""anh chị em"" gồm: Junior Kajbhandit Jaidee (Yos), Friend Peerakrit Pacharabunyakiat (Yod), Denise Jelilcha Kapuan (Yad) và Nina Natcha Jessica Padovan (Yee).
Vì vậyTee yod: Quỷ ăn tạng 3đang được kỳ vọng sẽ gây sốt phòng vé Việt, và có thể vượt mốc 100 tỉ đồng.
Trong tập 1,Tân binh toàn năngViệt Nam hoàn thành vòng công diễn đầu tiên. Thua trước nhóm nhạc Hàn Quốc 8TURN khiến họ phải nhìn lại chiến lược và tinh thần thi đấu. Trailer tập 2 hé lộ không khí đầy căng thẳng khi các thành viên liên tục bộc lộ sự hoài nghi, mâu thuẫn và áp lực tâm lý.
Trong trailer tập 2, nhà sản xuất toàn năng Soobin đã nhắn nhủ: ""Dù công diễn 1 có kết quả thế nào, chúng ta vẫn phải giữ lửa"". Đó là thông điệp mạnh mẽ tiếp thêm tinh thần cho toàn đội.
Đội hình Tân binh thăng cấp - Ảnh: BTC
Các Tân binh thăng cấp sẽ bước vào vòng thi mới với mức độ thử thách được nâng cao, đòi hỏi sự phối hợp chặt chẽ và bản lĩnh cá nhân để vượt qua áp lực. Tập 2 là cột mốc quyết định hành trình trưởng thành của các tân binh.
Tập 2Tân binh toàn năngphát sóng vào lúc 20h trên VTV3 và 20h30 trên kênh YouTube.
Trong tập 2Running manmùa 3, 7 thành viên hóa thân thành anh em trong gia đình tài phiệt, chiến đấu để giành quyền thừa kế. Khi các thế hệ con cháu quy tụ về chung một ngày, liệu với phương châm ""7 phần may mắn, 3 phần thực lực"", ai sẽ trở thành người thừa kế?
Tập 2 có hai khách mời là Trang Pháp và Jsol. Trong đó Trang Pháp là Ba Trang hay còn gọi là Boss Ba Trang - nữ chủ tịch tài ba của tập đoàn thầu xây dựng toàn cầu nức tiếng. Sở hữu khí chất của một quý cô siêu cấp sang - xịn - mịn, cô Ba khiến người đối diện ""ba phần nể mặt, bảy phần như ba"".
Trang Pháp tham gia tập 2 Running man - Ảnh: BTC
R Bảy Sol không chỉ là người thành lập Tập đoàn truyền thông Trí Son Media lớn nhất nhì xứ này mà còn là thiếu gia thứ 7 của gia tộc R danh giá.
Với phương châm ""Chạy truyền thông ngay đi"", đam mê của cậu Bảy không nằm ở tập đoàn của gia tộc. Mọi thứ có vẻ đã khác vào ngày cậu Bảy được gọi về họp mặt cùng anh em để nghe di chúc thừa kế.
Tập 2Running manphát sóng lúc 19h30 ngày 11-10 trên HTV7.
Tối 11-10 tại Nhà hát Trần Hữu Trang, Sân khấu cải lương mới Đại Việt sẽ trình làng vở cải lương tuồng cổBức ngôn đồ Đại Việt(tác giả: Hà Văn Cầu, Loan Thảo, Thanh Tòng; đạo diễn: Hoa Hạ).
Trong vở diễn, điều khiến khán giả tò mò nhất là nghệ sĩTú Sươngsẽ đóng vai nam, nhân vật Nguyễn Phục.
Nghệ sĩ Tú Sương vai Nguyễn Phục trong vở Bức ngôn đồ Đại Việt - Ảnh: LINH ĐOAN
Đây là một trong những vai diễn quan trọng của vở. Nguyễn Phục vì muốn làm đẹp lòng nhạc phụ Trần Kiện nên đã dâng bức ngôn đồ Đại Việt, một bản vẽ như bí mật quốc gia dẫn đường cho giặc vào xâm chiếm nước ta.
Một nhân vật để Tú Sương thử thách bản thân. Ngoài Tú Sương, vở còn có sự tham gia của các nghệ sĩ Quế Trân, Võ Minh Lâm, Thanh Sơn, Điền Trung, Lê Thanh Thảo, Kim Ngân, Minh Trường, Nhã Thi, Lâm Minh Nghiêm…
Nhà hát kịch Idecaf diễn vởHồn ai nấy giữngày 11-10. Nhà hát kịch Thanh Niên diễn vởLạc lối ở Bangkokngày 11-10.
Sân khấu kịch Thiên Đăng diễn vởCuộc phiêu lưu vào vương quốc tâm hồnngày 11-10, ngày 12-10 là vởNhững con ma nhà hát.
Ngày 11-10, Sân khấu Hồng Vân diễn vởSuối linh hồn, ngày 12-10 là vởPhục diện pháp y.
Sân khấu Thế Giới Trẻ diễnXóm nghèo bá đạongày 12-10. Sân khấu Hoàng Thái Thanh diễn vởTrái tim oan khuấtngày 12-10.
Ngày 11-10, Sân khấu Trương Hùng Minh diễn vởRồi 30 năm sau, ngày 12-10 là vởLụa máu.
Một số tin tức xem nghe nổi bật: Tay anh giữ một vì sao đối đầu Chị ngã em nâng; Running man tung chiêu; Tân binh Việt Nam chạm trán 8TURN từ Hàn Quốc; Sân khấu Chí Linh - Vân Hà diễn Kỳ án Tần Hương Liên mùa giỗ tổ sân khấu.
Tối đa:1500 ký tự
Hiện chưa có bình luận nào, hãy là người đầu tiên bình luận"
https://tuoitre.vn/lien-binh-phat-la-dien-vien-viet-nam-dau-tien-chien-thang-o-giai-kim-chung-20251019060754956.htm,Liên Bỉnh Phát là diễn viên Việt Nam đầu tiên chiến thắng ở giải Kim Chung,"Tối 18-10, Liên Bỉnh Phát đoạt giải Nam diễn viên chính xuất sắc nhất tại Golden Bell Awards (Giải Kim Chung) tại Đài Loan, khiến khán giả Việt vỡ òa.","Liên Bỉnh Phát nhận giải Nam diễn viên chính xuất sắc tại Kim Chung - Ảnh: NVCC
Tối 18-10, thông tinLiên Bỉnh Phátđoạt giải Nam diễn viên chính xuất sắc nhất tại Giải Kim Chung (Đài Loan, Trung Quốc). Chiến thắng này đưa anh trở thành diễn viên Việt Nam đầu tiên đạt thành tích này tại một giải thưởng phim ảnh uy tín ở châu Á.
Liên Bỉnh Phát chia sẻ sau khi nhận giải: ""Tôi xem đây là phần thưởng cho cả một hành trình dài của mình và của những người đã đồng hành, tin tưởng tôi trên con đường nghệ thuật.
Nhưng hơn tất cả, tôi cảm nhận rõ hơn về trách nhiệm của một người nghệ sĩ Việt Nam khi mang câu chuyện và tinh thần Việt ra thế giới. Tôi xin dành một phần giải thưởng này để đóng góp vào quỹ hỗ trợ lao động nhập cư tại Đài Loan, như một lời động viên và chia sẻ đến những người vẫn đang ngày đêm nỗ lực mưu sinh nơi xứ người"".
Với hành động đóng góp này, anh muốn thể hiện sự trân trọng với con người và trách nhiệm xã hội của một nghệ sĩ.
Màn phát biểu song ngữ của Liên Bỉnh Phát
Bên cạnh đó, Liên Bỉnh Phát biết ơn ê kíp thực hiện bộ phim. Từng thành viên trong đoàn phim đều mang đến cho anh những bài học quý giá. Sự chân thành của họ đã tiếp thêm sức mạnh để anh đối diện với những thách thức và có được thành quả như hiện tại.
GiảiKim Chungđược ví như ""Emmy của Đài Loan"", tôn vinh những đóng góp nổi bật trong lĩnh vực truyền hình. Đây cũng là lần đầu tiên có nghệ sĩ nước ngoài đoạt danh hiệu Thị Đế (Nam diễn viên xuất sắc nhất) ngay trong lần đầu ra mắt tại thị trường này.
Với vai bác sĩ Phạm Văn Ninh trong phimBác sĩ tha hương (The Outlaw Doctor),Liên Bỉnh Phát đã mang đến màn trình diễn thuyết phục. Anh lột tả sự giằng xé nội tâm giữa lương y và những thách thức khắc nghiệt nơi đất khách.
Liên Bỉnh Phát và bạn diễn Trương Quân Ninh (giữa) trên thảm đỏ - Ảnh: NVCC
Hiện tại, Liên Bỉnh Phát còn có hai phim điện ảnh trong nước sắp ra mắt làQuán Kỳ NamvàBẫy tiền.Một phim thuộc thể loại tâm lý tình cảm và một phim ly kì, giật gân. Anh cho thấy khát vọng khám phá nhiều vai diễn đa dạng.
VớiQuán Kỳ Nam,Liên Bỉnh Phát tái hợp đạo diễn Leon Lê (Song Lang) trong bộ phim lấy bối cảnh Sài Gòn thập niên 1980. Anh vào vai Khang, một dịch giả trẻ tìm thấy sự đồng điệu với một người phụ nữ Kỳ Nam (Đỗ Thị Hải Yến).
Liên Bỉnh Phát mặc áo dài dự lễ trao giải Kim Chung - Ảnh: NVCC
VớiBẫy tiền, Liên Bỉnh Phát vào vai Đăng Thức, một chuyên viên tài chính rơi vào vòng xoáy của trò chơi tiền tài. Bộ phim khai thác một chủ đề nóng hổi của xã hội hiện đại: vấn nạn lừa đảo qua điện thoại và tội phạm công nghệ cao.
Chiến thắng tại giải Kim Chung là động lực để Liên Bỉnh Phát tiếp tục cống hiến những vai diễn có chiều sâu và giàu cảm xúc cho khán giả trong và ngoài nước.
Phim Quán Kỳ Nam của đạo diễn Leon Lê tung teaser đẹp từng khung hình, hé lộ mối tình chưa nói giữa nhân vật của Đỗ Thị Hải Yến và Liên Bỉnh Phát.
Tối đa:1500 ký tự
Hiện chưa có bình luận nào, hãy là người đầu tiên bình luận"
