url,title,description,content
https://tuoitre.vn/phong-cach-thoi-trang-mua-thu-cua-victoria-beckham-20251018111634972.htm,Phong cách thời trang mùa thu của Victoria Beckham,"Từ đầm hồng pastel dịu dàng, chân váy midi mềm mại đến bộ suit quyền lực, Victoria Beckham đang truyền cảm hứng cho xu hướng thời trang mùa thu.","Những bộ trang phục chỉn chu, chuyên nghiệp này hoàn toàn hợp lý nếu nghĩ đến khối lượng công việc khổng lồ của Victoria Beckham khi điều hành cả hai đế chế thời trang và làm đẹp - Ảnh: Marie Claire
Tưởng rằng mùa pastel đã qua? Victoria Beckham vừa chứng minh điều ngược lại khi diện trang phục hồng pastel - gam màu được dự đoán là ""tâm điểm"" của thời trang mùa thu 2025 - đến nhà hàng ăn tối sau khi gây sốt với những khoảnh khắc ngọt ngào trong phim tài liệu Netflix.
Dù tông pastel thường gắn liền với những tháng hè, nhưng sức hút của các gam màu nhẹ nhàng, bay bổng này vẫn chưa hề giảm nhiệt.
Xuất hiện tạiNew Yorktrong một chiếc đầm hồng dáng midaxi mềm mại, thiết kế mang đậm dấu ấn đặc trưng của thương hiệu Victoria Beckham với những đường rủ tinh tế và phần chân váy loe nhẹ nhàng.
Chiếc đầm có cổ chữ V cao, tay ngắn nhẹ nhàng, đủ tinh tế để diện được trong nhiều hoàn cảnh. Không cần đến chi tiết trang trí cầu kỳ, chỉ cần thay đổi phụ kiện là Victoria Beckham có thể biến hóa phong cách từ thanh lịch ban ngày đến sang trọng buổi tối - một lựa chọn hoàn hảo cho tủ đồ mùa thu.
Victoria và David Beckham có một buổi hẹn hò lãng mạn tại New York tối 15-10. Cặp đôi dùng bữa tại Balthazar - nhà hàng được nhiều ngôi sao hạng A yêu thích - Ảnh: Page Six
Tuy nhiên, điều khiến giới mộ điệu chú ý hơn cả là cách cô biến tông pastel vốn mang hơi hướng mùa hè trở nên phù hợp với tiết trời se lạnh bằng việc phối cùng phụ kiện màu rượu vang (burgundy), một trong những gam chủ đạo của mùa này.
Sự kết hợp giữa màu hồng pastel và rượu vang tạo nên bảng màu cân bằng: sắc đỏ trầm làm dịu độ tươi sáng của chiếc váy, mang lại cảm giác ấm áp và thời thượng.
Victoria Beckham chọn túi đeo vai và giày cùng tông, ""kẹp"" sắc hồng giữa hai mảng màu trầm, hoàn thiện set đồ với kính mát chuyển màu ombre đầy tinh tế.
Tạp chíHarper's Bazaarđưa tin ngày 17-10, Victoria Beckham ghé cửa hàng Balenciaga cho một ngày mua sắm thảnh thơi. Cô khiến mọi ánh nhìn đổ dồn với set đồ đen gồm áo blouse dáng rộng kết hợp chân váy bút chì cạp cao, tạo nên tổng thể vừa cổ điển vừa thanh lịch.
Điểm nhấn táo bạo nằm ở phần cổ áo chữ V sâu và đường xẻ cao ở chân váy, mang đến nét quyến rũ tinh tế - Ảnh: Harper's Bazaar
Cô hoàn thiện outfit bằng vòng tay tennis nạm kim cương, nhẫn bản lớn và kính râm oversized màu rượu vang, thêm chút sắc đỏ trầm cho tổng thể. Trên tay Victoria Beckham là chiếc túi Hermès Kelly en Desordre phiên bản giới hạn, nổi bật với thiết kế nắp bất đối xứng, mang lại chút phá cách thú vị.
Điểm nhấn đáng chú ý nhất chính là đôi giày cao gót hở mũi với phần gót cong độc đáo, giúp cô ""ăn gian"" chiều cao cùng dáng đứng kiêu kỳ chuẩn siêu mẫu.
Victoria Beckham xuất hiện tại sự kiện Forces of Fashion ở New York trong một chiếc đầm xanh lá cây - tông màu khiến người ta liên tưởng ngay đến bìa album của Charli XCX. Có thể nói, đây chính là cách Victoria Beckham diễn giải lại sắc “Brat Green” theo phong cách sang trọng, thanh lịch đặc trưng của mình - Ảnh: Harper's Bazaar
Victoria Beckham “khoe khéo” một món Hermès hiếm khác trong bộ sưu tập túi: Kelly Sellier 32 phiên bản ba tông màu - thân túi màu rượu vang và nâu, nắp đỏ rực. Cô phối chiếc túi này với váy midi đỏ mâm xôi mềm mại, giày cao gót hồng ballet mũi nhọn và kính phi công che gần kín gương mặt - Ảnh: VOGUE
Dùng bữa trưa tại nhà hàng Estiatorio Milos ở New York, Victoria Beckham mang theo một chiếc túi đen Hermès Kelly en Désordre phiên bản giới hạn. Để phối cùng món phụ kiện độc đáo này, cô chọn tông đen toàn tập: áo dài tay ôm sát, chân váy midi qua bắp chân và đôi guốc Saint Laurent thanh mảnh - Ảnh: VOGUE
Biệt danh ""Posh Spice"" mà Victoria Beckham nhận được từ thời Spice Girls không phải ngẫu nhiên. Cô luôn xuất hiện chỉn chu đến từng chi tiết, từ những chiếc váy Gucci đen nhỏ thập niên 1990 cho đến các thiết kế thanh lịch, hiện đại mà cô yêu thích ngày nay.
TheoVogue, mùa thu này, Victoria Beckham đang bước vào ""kỷ nguyên suit"" của riêng mình. Trong tuần lễ thời trang Paris - nơi trình làng bộ sưu tập Xuân 2026 - cô được bắt gặp 2 lần diện gần như cùng một bộ suit.
Tủ đồ của Beckham hiện lên rõ nét tinh thần ""nữ doanh nhân quyền lực"" - Ảnh: VOGUE
Lần đầu là bộ đồ đen hai mảnh với phom dáng mới mẻ: blazer dáng hộp kết hợp quần ống loe. Vài ngày sau, cô lại xuất hiện trong một thiết kế tương tự, chỉ khác ở màu xám nhạt, phối cùng áo thun trắng giản dị và đôi giày cao gót yêu thích.
Hay một lần khác gần đây cô diện blazer xám tro thắt eo bằng dải nơ dài phối cùng quần ống rộng đồng màu. Điều đáng chú ý là Victoria Beckham không cắt ngắn phần ống quần mà gập gấu to bản, vừa chạm nhẹ mặt đất.
Học hỏi Victoria Beckham phong cách gập gấu quần cực chất - Ảnh: VOGUE
Cô điểm xuyết cho bộ suit xám bằng những chi tiết màu sắc tinh tế: túi xách tay mini màu rượu vang đến từ chính thương hiệu Victoria Beckham, kết hợp cùng đôi giày đế cao màu đỏ sậm thấp thoáng dưới ống quần. Và tất nhiên, không thể thiếu chiếc kính râm oversized đặc trưng.
Đáng chú ý, đầu tháng 10Netflixvừa ra mắt loạt phim tài liệu về Victoria Beckham, đưa khán giả vào hậu trường xưởng thời trang tại London và theo dõi hành trình cô chuẩn bị cho Tuần lễ thời trang Paris - như một phần tiếp nối câu chuyện trongBeckham(2023) của chồng cô, hé lộ quá trình ""lột xác"" từ ngôi sao nhạc pop thành nhà thiết kế xa xỉ hàng đầu thế giới.
Khi Spice Girls tan rã, Victoria Beckham phải đối mặt với cú sốc lớn, cô chỉ còn được nhắc đến với danh xưng 'vợ của David Beckham' và mắc chứng rối loạn ăn uống vì giảm cân không lành mạnh.
Tối đa:1500 ký tự
Hiện chưa có bình luận nào, hãy là người đầu tiên bình luận"
https://tuoitre.vn/them-mot-mua-victorias-secret-day-tranh-cai-20251017171443759.htm,Thêm một mùa Victoria’s Secret đầy tranh cãi,"Buổi trình diễn nội y đình đám của Victoria’s Secret năm 2025 tiếp tục nhận về nhiều phản ứng trái chiều, bất chấp nỗ lực làm mới thương hiệu sau nhiều năm vắng bóng.","Dàn người mẫu của Victoria's Secret Fashion Show 2025 - Ảnh: REUTERS
Được tổ chức tại New York,Victoria's Secret Fashion Show2025 quy tụ dàn người mẫu nổi tiếng như Adriana Lima, Gigi và Bella Hadid, Candice Swanepoel, Emily Ratajkowski hay Jasmine Tookes.
Adriana Lima xuất hiện trong bộ bodysuit xuyên thấu, trong khiGigi Hadidgây chú ý với bộ nội y ren hồng kết hợp áo khoác hoa khổng lồ. Người mẫu đang mang thai Jasmine Tookes cũng tự tin khoe bụng bầu trong thiết kế lưới vàng gợi cảm.
Sau khi bị ""khai tử"" vào năm 2018 vì doanh số sụt giảm, lượng khán giả thấp và loạt chỉ trích về thiếu đa dạng, show diễn này khôi phục vào năm 2024.
TheoNews, phiên bản năm nay được cho là có bước tiến rõ rệt khi tôn vinh sự đa dạng về độ tuổi, màu da và hình thể. Tuy nhiên, phản ứng của công chúng vẫn chia rẽ: nhiều ý kiến cho rằng dù cố gắng thay đổi, Victoria's Secret vẫn ""không còn phù hợp với tinh thần của thập niên 2020"".
Bella Hadid vừa đeo đôi cánh thiên thần nặng 50 lbs (23kg) catwalk trên sàn diễn Victoria's Secret - Ảnh: REUTERS
Phần trình diễn của một số người mẫu nổi bật ở show Victoria's Secret 2025
Trên mạng xã hội, không ít người thất vọng, cho rằng chương trình ""nhàm chán"" và ""thiếu điểm nhấn"".
Một khán giả viết: ""Tôi mong đợi nhiều hơn thế"", trong khi người khác bình luận: ""Hãy xem lại show những năm 2000 - 2012, bạn sẽ hiểu tại sao khán giả bây giờ thất vọng"". Tuy nhiên, cũng có người bảo vệ: ""Show năm nay điên rồ thật sự, hay hơn năm ngoái nhiều"".
Dù có sự góp mặt của Emily Ratajkowski và phần trình diễn sôi động của ca sĩ Madison Beer, làn sóng bình luận tiêu cực vẫn chiếm ưu thế.
Trước những phản ứng trái chiều, giám đốc sáng tạo mới của Victoria's Secret - Adam Selman - lên tiếng: ""Cuối cùng thì đây vẫn chỉ là chuyện của những chiếc áo ngực và quần lót. Không thể khiến tất cả mọi người hài lòng và tôi chấp nhận điều đó"".
Siêu mẫu 30 tuổi Gigi Hadid khoe trọn thần thái rạng rỡ trong bộ nội y hai mảnh màu hồng ánh kim, gồm áo corset đính sequin và quần ren cao ngang hông - Ảnh: REUTERS
""Thiên thần"" Adriana Lima diện trang phục màu da. Cô từng đứng thứ hai trong danh sách siêu mẫu có thu nhập cao nhất thế giới với 10,5 triệu USD - Ảnh: REUTERS
Barbara Palvin từng cho biết cô trải qua các triệu chứng lạc nội mạc tử cung trong nhiều năm nhưng không hề nhận ra - Ảnh: REUTERS
Angel Reese, ngôi sao bóng rổ 23 tuổi của Chicago Sky, là vận động viên đầu tiên trình diễn tại Victoria’s Secret - Ảnh: ELLE
Nhóm nhạc nữ K-popTWICEcó màn trình diễn sôi động tại show Victoria's Secret với hai ca khúcStrategyvàThis is For.Tuy nhiên, bên cạnh lời khen ngợi về thần thái và năng lượng sân khấu, nhóm vấp phải làn sóng tranh cãi xoay quanh khả năng hát live.
Do nhiều thành viên vắng mặt, chỉ có Nayeon, Momo, Jihyo và Tzuyu biểu diễn. Phần đông khán giả cho rằng phần hát live của nhóm chưa đạt kỳ vọng, thậm chí ""làm phân tán sự chú ý khỏi dàn người mẫu"".
Trong đó, Tzuyu là người bị nhắc đến nhiều nhất vì giọng hát ""yếu"", khiến mạng xã hội dấy lên nhiều tranh luận.
Màn hát live của TWICE bị chê thậm tệ trên mạng xã hội - Ảnh: REUTERS
4 thành viên Nayeon, Jihyo, Momo và Tzuyu xuất hiện tại thảm đỏ trước thềm show diễn - Ảnh: Billboard
Trước phản ứng gay gắt, Tzuyu lên tiếng xin lỗi trên nền tảng Bubble, giải thích rằng cô gặp vấn đề về sức khỏe ngay trước buổi biểu diễn: ""ONCE à, mình xin lỗi… Trước khi sang New York, mình luyện tập rất kỹ với huấn luyện viên thanh nhạc, nhưng sau khi đến đây, cổ họng bắt đầu đau và ngày càng tệ hơn.
Khi tổng duyệt mình vẫn hát được, nhưng tới lúc biểu diễn chính thức thì giọng gần như khản đặc, không phát ra được tiếng nào. Mình đã uống trà mật ong và thử nhiều cách khác nhau, nhưng tình hình vẫn không cải thiện"".
Tranh cãi quanh TWICE khiến nhiều người nhớ lại trường hợp củaLisa(BlackPink), nghệ sĩ K-pop đầu tiên trình diễn tại Victoria's Secret Fashion Show 2024. Khi đó, Lisa cũng nhận về ý kiến trái chiều, được khen ngợi vì phong thái quyến rũ, nhưng đồng thời bị chỉ trích là ""quá gợi cảm"" so với hình tượng trước đây.
Victoria's Secret Fashion Show 2025 chính thức diễn ra, đánh dấu sự trở lại đầy hoành tráng của một trong những sự kiện thời trang được mong chờ nhất năm.
Tối đa:1500 ký tự
Hiện chưa có bình luận nào, hãy là người đầu tiên bình luận"
https://tuoitre.vn/con-sot-k-pop-demon-hunters-thong-tri-mua-halloween-2025-20251017102531055.htm,Cơn sốt K-pop Demon Hunters 'thống trị' mùa Halloween 2025,"Sau khi 'oanh tạc' các bảng xếp hạng toàn cầu, K-pop Demon Hunters tiếp tục dẫn đầu xu hướng hóa trang cho dịp Halloween, vượt mặt các nhân vật Hollywood quen thuộc.","K-pop Demon Hunters phủ sóng mùa Halloween năm nay - Ảnh: Netflix
Theo thống kê từ công cụ theo dõi xu hướng toàn cầu của Google Frightgeist, 6 trong số 10 trang phục Halloween được tìm kiếm nhiều nhất năm 2025 đến từ bộ phim hoạt hìnhK-pop Demon Hunters.
Các nhân vật Rumi, Zoey, Mira, Jinu và Baby Saja chiếm trọn top 5, Derpy the Tiger đứng ở vị trí thứ 8, giúp IP (tài sản trí tuệ) Hàn Quốc này thống trị tới 60% bảng xếp hạngHalloweentoàn cầu, một kỷ lục mà chưa một thương hiệu phương Tây nào từng đạt được.
TheoOsen, kiểu tóc ""rồng tím"" của Rumi trở thành trào lưu được bắt chước nhiều nhất mùa Halloween. Búi tóc không gian của Zoey gây sốt trên TikTok vàInstagramnhư một biểu tượng thời trang mới.
Bộ tóc giả hồng kết hợp váy vàng của Mira nhanh chóng trở thành lựa chọn yêu thích của gen Z. Trong khi đó, tạo hình ""Trending Demon"" của Jinu đứng đầu bảng tìm kiếm các nhân vật siêu nhiên.
Các em nhỏ hóa trang theo bộ 3 nhân vật Lumi, Mira và Joy - Ảnh: Instagram @primarydotcom
Áo len caro màu hồng của Baby Saja truyền cảm hứng cho hàng loạt lookbook do fan sáng tạo, còn phong cách mèo xanh siêu thực của Derpy mang lại chút hài hước cho mùa hóa trang năm nay.
Làn sóng này không chỉ dừng lại ở việc hóa trang. TrênTikTok, hashtag #KpopDemonHuntersChallenge thu hút hàng trăm triệu lượt xem.
Các kiểu tóc, trang điểm của Lumi và Joy truyền cảm hứng cho các xu hướng làm đẹp, thời trang và cả các bộ sưu tập hợp tác giữa thương hiệu mỹ phẩm với các nhà sản xuất.
Video hướng dẫn ""bắt trend"" hóa trang K-pop Demon Hunters thu hút gần 120.000 lượt thích - Video: Instagram @jeanwang
NBC News cho biết các buổi tiệc theo chủ đềK-pop Demon Huntersđang trở thành trào lưu, không chỉ dịp Halloween mà còn lan sang tiệc sinh nhật và các sự kiện gia đình khác.
Trang phục chính thức của các thành viên HUNTR/X hợp tác sản xuất giữa Netflix và thương hiệu Spirit Halloween đang cháy hàng trên mạng, đặc biệt ở cả phiên bản người lớn lẫn trẻ em.
Sức nóng còn lan sang Amazon và eBay, các bộ đồ DIY (tự thiết kế) và phiên bản ""dupe"" xuất hiện ngày một nhiều.
Người hâm mộ còn thi nhau chia sẻ các tác phẩm tự làm trên mạng xã hội, nổi bật là chiếc xô đựng kẹo hình Duffy do một fan vẽ tay đang gây ""bão"" mạng.
TờThe Korea Economic Dailycho rằng cơn sốt này gợi nhớ đến hiện tượngSquid Gamenăm 2021 khi những bộ đồ bảo vệ hồng và đồng phục xanh lá phủ sóng kệ hàng trên toàn nước Mỹ vào thời điểm đó.
TờUSA Todaynhận định: ""Không bất ngờ gì khiK-pop Demon Huntersđang dẫn đầu xu hướng hóa trang. Đây chính là một 'thế lực' định hình nên bức tranh giải trí toàn cầu hiện nay"".
K-pop Demon Hunters đang tạo nên cơn sốt tương tự Squid Game vào năm 2021 - Ảnh: Netflix
K-pop Demon Huntersphát hành vào ngày 22-6, và gần như ngay lập tức trở thành hiện tượng văn hóa toàn cầu. Phim xoay quanh nhóm nhạc nữ hư cấu HUNTR/X gồm các thành viên Lumi, Mira và Joy. Họ vừa là siêu sao K-pop, vừa là những chiến binh thầm lặng bảo vệ thế giới khỏi ác quỷ.
Không chỉ thu hút khán giả nhờ hình ảnh mãn nhãn và cốt truyện hiện đại, phim còn tạo nên một cơn sốt âm nhạc. Nhạc phim củaK-pop Demon Hunterslà sản phẩm đầu tiên có 4 ca khúc đồng thời lọt vào top 10 Billboard Hot 100.
Ngày 17-9, phim hoạt hìnhK-pop Demon Huntersvừa cán mốc 314,2 triệu lượt xem chỉ sau 3 tháng phát hành, trở thành phim đầu tiên trong lịch sử củaNetflixvượt qua con số 300 triệu lượt xem.
Chưa đầy ba tháng, K-pop Demon Hunters đã phá kỷ lục của Squid Game 1, trở thành phim có lượt xem cao nhất của Netflix, bao gồm cả phim điện ảnh, TV show và không phân biệt ngôn ngữ.
Tối đa:1500 ký tự
Hiện chưa có bình luận nào, hãy là người đầu tiên bình luận"
https://tuoitre.vn/nhat-ban-phan-no-khi-openai-ngang-nhien-sao-chep-anime-nhu-thanh-guom-diet-quy-pokemon-202510191451107.htm,"Nhật Bản phẫn nộ khi OpenAI ngang nhiên sao chép anime như Thanh gươm diệt quỷ, Pokémon","Chính phủ Nhật vừa chính thức gửi yêu cầu đến OpenAI, đề nghị không sử dụng nhân vật manga, game hay anime như Pokémon, Thanh gươm diệt quỷ, Bảy viên ngọc rồng... trong công cụ tạo video Sora 2.","Những thương hiệu hàng đầu Nhật Bản như Ghibli, Nintendo... chính là những nạn nhân đầu tiên của làn sóng này - Ảnh: The Pokémon Company/Crunchyroll
Ra mắt ngày 1-10, Sora 2 là phiên bản nâng cấp của công cụ tạo video bằng trí tuệ nhân tạo, cho phép người dùng dễ dàng tạo ra những clip với đồ họa giống hệt các thương hiệu nổi tiếng nhưThanh gươm diệt quỷ,One Piece...
Chỉ vài ngày sau khi ra mắt, mạng xã hội đã tràn ngập những video do Sora 2 tạo ra với hình ảnh các nhân vật nổi tiếng nhưLuffy (One Piece), Nezuko (Thanh gươm diệt quỷ), Pikachu (Pokémon) hay Mario - tất cả đều là nhân vật thuộc sở hữu của các studio Nhật Bản.
Theo thông cáo từ Chính phủ Nhật Bản, đây được xem là hành vi xâm phạm quyền sở hữu trí tuệ nghiêm trọng.
Trong cuộc họp báo của Văn phòng Nội các, Bộ trưởng phụ trách chiến lược sở hữu trí tuệ và AI Minoru Kiuchi khẳng định chính phủ đã gửi yêu cầu trực tuyến tới OpenAI, đề nghị hãng ""ngừng xâm phạm các tài sản trí tuệ của Nhật Bản"".
Ông Kiuchi nhấn mạnh: ""Manga và anime là những báu vật không thể thay thế, là niềm tự hào mà Nhật Bản mang đến với thế giới"".
Sora AI tạo ra một đoạn video ngắn sao chép từ hoạt họa của Thanh gươm diệt quỷ, tuy còn nhiều điểm thiếu tự nhiên nhưng với đà phát triển hiện tại, việc sao chép hoàn hảo là có thể xảy ra
Bộ trưởng Chuyển đổi kỹ thuật số Masaaki Taira cũng bày tỏ hy vọngOpenAIsẽ tự nguyện tuân thủ, song cảnh báo nếu tình hình không được cải thiện, các điều khoản trong Luật Thúc đẩy AI (AI Promotion Act) có thể được kích hoạt.
Luật này, có hiệu lực từ 1-9-2025, đặt mục tiêu biến Nhật Bản thành ""quốc gia thân thiện nhất với AI"", khuyến khích phát triển và ứng dụng công nghệ này cho tăng trưởng kinh tế - xã hội.
Tuy nhiên, luật cũng quy định nguyên tắc xử lý các hành vi sử dụng AI sai mục đích, trong đó có xâm phạm bản quyền.
Theo tờITMediatrích dẫn điều 16 của luật, chính phủ có thể ""phân tích các trường hợp quyền lợi công dân bị xâm phạm do việc nghiên cứu, phát triển hay ứng dụng AI không phù hợp và xem xét biện pháp đối phó"".
Song, văn bản hiện chưa quy định hình phạt cụ thể, thay vào đó kêu gọi các doanh nghiệp hợp tác với chính phủ để đảm bảo tính minh bạch.
Bộ trưởng Chuyển đổi kỹ thuật số Masaaki Taira cảnh báo Nhật sẽ xem xét lại các quyền lợi của OpenAI và các tập đoàn phát triển AI khác tại Nhật nếu quyền sở hữu trí tuệ của quốc gia bị đe dọa - Ảnh: The Japan Times
Theo Reuters, trước khi ra mắt, OpenAI đã liên hệ một số hãng phim và công ty quản lý nghệ sĩ để họ có thể chọn không cho phép sử dụng hình ảnh.
Hiện chưa rõ các hãng lớn của Nhật-nhưToei Animation, Shueisha hay Nintendo-có nằm trong danh sách đó hay không.
Việc Sora 2 dễ dàng tạo ra video chứa hình ảnh nhân vật Nhật Bản đã khiến dư luận nước này phản ứng dữ dội, cho rằng cả OpenAI lẫn Chính phủ Nhật chưa hành động đủ nhanh để bảo vệ quyền sở hữu trí tuệ.
Trong bài viết ngày 4-10, Giám đốc điều hành OpenAI Sam Altman thừa nhận vấn đề và hứa sẽ bổ sung tính năng kiểm soát chi tiết hơn cho các chủ sở hữu bản quyền.
Dù vậy, đến nay OpenAI vẫn chưa có phản hồi chính thức về yêu cầu mới nhất từ phía Tokyo.
Sam Altman từng bày tỏ sự trân trọng đặc biệt dành cho văn hóa Nhật, khẳng định: ""Chúng tôi hiểu được mối liên kết sâu sắc giữa người dùng toàn cầu và nội dung đến từ Nhật Bản"" - Ảnh: Reuters
Sự việc diễn ra trong bối cảnh các tập đoàn lớn như Disney, Universal hay The Pokémon Company đều đã hành động mạnh mẽ trước nguy cơ AI xâm phạm bản quyền.
Về phía Nhật Bản, The Pokémon Company gần đây phải lên tiếng khi hình ảnh Satoshi (Ash Ketchum) và nhạc phimPokémonbị cơ quan an ninh Mỹ sử dụng trong một video tuyên truyền.
Hãng khẳng định: ""Chúng tôi không tham gia và cũng không cho phép sử dụng tài sản trí tuệ của mình trong nội dung đó"".
Disney và Universal từng kiện công ty tạo ảnh Midjourney vì sử dụng trái phép hình ảnh nhân vật phim của họ, riêng Disney còn gửi thư cảnh cáo đến Character.AI vì dùng nhân vật mà không xin phép - Ảnh: Midjourney
Trước đó, nghị sĩ Satoshi Asano từng đăng bài cáo buộc Nintendo ""vận động chính phủ"" để hạn chế AI trong ngành game. Công ty lập tức phủ nhận và tuyên bố: ""Dù có liên quan đến AI hay không, Nintendo sẽ tiếp tục thực hiện các biện pháp cần thiết nhằm bảo vệ quyền sở hữu trí tuệ của mình"".
Với sức ảnh hưởng toàn cầu của anime và game Nhật Bản, động thái mạnh mẽ của Nhật được xem là lời cảnh báo sớm cho làn sóng tranh chấp bản quyền đang lan rộng trong kỷ nguyên AI.
Theo Box Office Mojo và The Numbers, phim Thanh gươm diệt quỷ: Vô hạn thành đã thu về 128,6 triệu USD tại thị trường Bắc Mỹ tính đến cuối tuần qua (12-10).
Tối đa:1500 ký tự
Hiện chưa có bình luận nào, hãy là người đầu tiên bình luận"
