url,title,description,content
https://tuoitre.vn/hien-trang-khu-dat-ben-nha-rong-va-nha-khach-chinh-phu-se-lam-cong-vien-20251019164251947.htm,Hiện trạng khu đất Bến Nhà Rồng và Nhà khách Chính phủ sẽ làm công viên,Chủ trương của Thường trực Thành ủy TP.HCM sẽ ưu tiên sử dụng khu đất Bến Nhà Rồng và khu đất Nhà khách Chính phủ hoang hóa nhiều năm làm công viên và công trình thiết chế văn hóa nghệ thuật.,"Sẽ tổ chức Không gian văn hóa Hồ Chí Minh tại khu vực Bến Nhà Rồng - Ảnh: PHƯƠNG NHI
Bí thư Thành ủy TP.HCM Trần Lưu Quang đã thông tin về chủ trương tổ chức Không gian văn hóa Hồ Chí Minh tại khu vực Bến Nhà Rồng, và sử dụng khu đất Nhà khách Chính phủ tại số 1 Lý Thái Tổ làm công viên tại Hội nghị tổng kết 50 năm văn học - nghệ thuật TP.HCM tổ chức ngày 18-10.
Tại hội nghị trên, nhiều văn nghệ sĩ, trí thức góp ý về việc chú trọng phát triển các thiết chế văn hóa, nghệ thuật tương xứng cho TP.HCM.
Bí thư Thành ủy Trần Lưu Quang thông tin Thường trực Thành ủy có chủ trương ngừng dự án nhà ở tại khu vực Bến Nhà Rồng để mở rộng Không gian văn hóa Hồ Chí Minh, phần diện tích còn lại, Thành ủy dự kiến làm công viên kết hợp mở rộng đường Nguyễn Tất Thành và phát triển các dịch vụ công cộng khác.
Khu đất cảng Nhà Rồng - Khánh Hội có diện tích khoảng hơn 31 héc ta, từng được đơn vị trực thuộc Bộ Giao thông vận tải (cũ) quản lý sử dụng.
Trên phần đất này, chủ yếu là các công trình nhà xưởng, văn phòng, kho bãi, cầu cảng và một số công trình do các đơn vị khác sử dụng.
Thực hiện chủ trương di dời cảng, TP.HCM đã cho phép chuyển đổi công năng cảng sang làm dự án nhà ở.
Đến năm 2017, UBND TP.HCM chấp thuận cho một doanh nghiệp triển khai dự án nhà ở tên khu phức hợp Nhà Rồng - Khánh Hội gồm trung tâm thương mại, 3.116 căn hộ, trường học và trạm y tế.
Tuy nhiên do các vướng mắc pháp lý và các dự án liên quan trên khu đất nên gần 10 năm qua dự án nhà ở vẫn chưa được triển khai, thực hiện.
Khu đất vàng số 1 Lý Thái Tổ là mảng xanh nổi bật giữa trung tâm TP.HCM - Ảnh: PHƯƠNG NHI
Bí thư Thành ủy Trần Lưu Quang cũng khẳng định khu đất số 1 Lý Thái Tổ sẽ thành công viên. Dự án này đã có nhà đầu tư chiến lược tham gia đầu tư.
Khu đất này sẽ làm công viên với không gian đa công năng, nơi các hoạt động văn hóa nghệ thuật có thể diễn ra. Tại công viên này sẽ bố trí tượng đài tưởng niệm người dân mất vì COVID-19 ở thành phố.
Khu đất số 1 Lý Thái Tổ từng là nơi ở của gia đình Chú Hỏa, người được mệnh danh là ""vua nhà đất"" Sài Gòn xưa.
Sau năm 1975, khu nhà đất trên được sử dụng làm Nhà khách Chính phủ do Bộ Ngoại giao quản lý sử dụng. Khu đất này từng được sử dụng để liên doanh, liên kết nhưng đã bị hủy bỏ.
Khu đất số 1 Lý Thái Tổ là khu đất “vàng” với 3 mặt tiền Lý Thái Tổ - Hùng Vương - Trần Bình Trọng. Khu đất này rộng khoảng 37.000m2bên trong có 7 ngôi biệt thự cũ bỏ hoang nhiều năm.
Khu đất số 1 Lý Thái Tổ được sử dụng làm Nhà khách Chính phủ - Ảnh: PHƯƠNG NHI
Khu đất này nhiều năm bị hoang hóa, xuống cấp. Các biệt thự bên trong, mặt tiền nhà khách, cổng rào, hàng rào… đều trong tình trạng xuống cấp, hư hỏng. Khuôn viên vỉa hè bên ngoài nhiều năm qua trở thành nơi đổ lén xà bần, rác thải, hàng rong, nơi phóng uế...
Xót xa trước khu đất ""vàng"" hoang hóa, nhiều năm qua người dân, cử tri TP.HCM đã nhiều lần gửi kiến nghị đến các cơ quan chức năng của TP.HCM và Trung ương đề nghị bán đấu giá khu đất thu ngân sách hoặc có phương án sử dụng hiệu quả hơn như xây trung tâm thương mại, công trình văn hóa.
Gần đây, Bộ Ngoại giao đã chuyển giao khu đất cho UBND TP.HCM quản lý.
TTO - Phản ảnh với tổ đại biểu Quốc hội ngày 5-10, cử tri quận 10 (TP.HCM) phản ảnh tình trạng xuống cấp, lãng phí ""đất vàng"" nhà khách Chính phủ (số 1 Lý Thái Tổ, phường 1, quận 10) và kiến nghị sớm có hướng sử dụng hiệu quả hoặc bán đấu giá.
Tối đa:1500 ký tự
Hiện chưa có bình luận nào, hãy là người đầu tiên bình luận"
https://tuoitre.vn/bien-dong-don-bao-so-12-khong-khi-lanh-cung-da-tran-ve-20251019172543346.htm,"Biển Đông đón bão số 12, không khí lạnh cũng đã tràn về",Chiều nay bão Fengshen đã vào Biển Đông thành cơn bão số 12 của mùa mưa bão năm nay.,"Dự báo đường đi bão số 12 - Ảnh: NCHMF
Trung tâm Dự báo khí tượng thủy văn quốc giacho biết chiều nay (19-10), bão Fengshen đã đi vào vùng biển phía đông của khu vực bắc Biển Đông thành cơn bão số 12 trong năm 2025.
Hồi 16h sức gió mạnh nhất vùng gần tâm bão mạnh cấp 9 (75-88km/h), giật cấp 11.Bão số 12di chuyển theo hướng tây bắc với tốc độ 20-25km/h.
Trong 24 giờ tới, bão vẫn giữ hướng di chuyển tây bắc với tốc độ 20-25km/h. Ngày mai bão hoạt động trên khu vực bắc Biển Đông, cách đặc khu Hoàng Sa khoảng 380km về phía đông đông bắc, và có khả năng mạnh thêm lên cấp 10, giật cấp 12.
Sau đó bão bị không khí lạnh tăng cường đẩy dần thay đổi hướng di chuyển thành tây và sau đó là tây nam. Tốc độ di chuyển cũng giảm dần xuống còn 10-15km.
Dự báo bão sẽ đạt cực đại vào ngày 21-10 với cường độ cấp 11, giật cấp 13, sau đó bão suy yếu dần.
Do ảnh hưởng của bão, vùng biển phía đông khu vực bắc Biển Đông có gió mạnh cấp 6-7; vùng gần tâm bão mạnh cấp 8-10, giật cấp 12, sóng biển cao 3-5m. Biển động rất mạnh.
Trong khoảng ngày 20 đến 22-10, khu vực bắc Biển Đông (bao gồm đặc khu Hoàng Sa) có khả năng chịu tác động của gió mạnh cấp 10-11, giật cấp 13, sóng biển cao 5-7m. Biển động dữ dội.
Toàn bộ tàu, thuyền hoạt động trong các vùng nguy hiểm nói trên đều có khả năng chịu tác động của dông, lốc, gió mạnh, sóng lớn.
Đặc biệt, tương tác giữa không khí lạnh và bão số 12 sẽ khiến thời tiết có nhiều diễn biến phức tạp.
Chính sự hoạt động cùng lúc của bão và không khí lạnh tạo nên nhiều kịch bản thời tiết cho nước ta trong những ngày tới.
Khi bão số 12 này di chuyển vào Biển Đông thì gặp không khí lạnh chắn ở phần phía tây, khiến cho bão ít khả năng di chuyển chính tây để đi vào Bắc Bộ hay đi lên khu vực Trung Quốc.
Theo phân tích, bão số 12 sẽ bị không khí lạnh xâm nhập và cường độ suy yếu dần. Cơ quan khí tượng đánh giá nhiều khả năng bão số 12 sẽ suy yếu thành áp thấp nhiệt đới, trước khi ảnh hưởng đến đất liền các tỉnh miền Trung.
Sáng nay 19-10, bão Fengshen đang quét qua miền Trung Philippines, dự báo hôm nay bão sẽ vào Biển Đông thành cơn bão số 12 của năm nay.
Tối đa:1500 ký tự
Hiện chưa có bình luận nào, hãy là người đầu tiên bình luận"
https://tuoitre.vn/gia-hoa-dan-so-nhanh-suc-khoe-rang-mieng-nguoi-cao-tuoi-tro-thanh-thach-thuc-20251019201855151.htm,"Già hóa dân số nhanh, sức khỏe răng miệng người cao tuổi trở thành thách thức","Tốc độ già hóa dân số diễn ra nhanh kéo theo gia tăng bệnh mạn tính không lây liên quan đến sức khỏe răng miệng ở người cao tuổi, trong khi Việt Nam vẫn chưa có mô hình chăm sóc chuyên biệt cho nhóm người này.","Để người cao tuổi Việt Nam sống vui khỏe, cần chú ý chăm sóc sức khỏe răng miệng ngay từ bây giờ - Ảnh: Bệnh viện cung cấp
Tối 19-10, Hội Răng hàm mặt TP.HCM tổ chức hội thảo ""Sức khỏe răng miệngngười cao tuổi"" kết hợp Đại hội đại biểu Hội Răng hàm mặt TP.HCM nhiệm kỳ XI (2025 - 2028).
Tại hội thảo, PGS.TS Hoàng Trọng Hùng, Phó chủ tịch Hội Răng hàm mặt TP.HCM, cho biết tỉ lệ người cao tuổi (trên 65 tuổi) đang tăng nhanh, đặc biệt khu vực châu Á có tốc độ già hóa dân số nhanh nhất thế giới. Dự báo đến năm 2050, người trên 60 tuổi chiếm 1/4 dân số toàn cầu, kéo theo nhiều tác động sâu rộng đến y tế, xã hội và kinh tế.
Theo PGS Hùng, trong 10 nguyên nhân gây tử vong hàng đầu ở người cao tuổi, có đến 8 nguyên nhân xuất phát từ cácbệnh mạn tínhkhông lây như tăng huyết áp, bệnh tim mạch, đái tháo đường...
Đáng chú ý, các bệnh lý răng miệng có cùng yếu tố nguy cơ với nhóm bệnh mạn tính này, cho thấy mối quan hệ hai chiều mật thiết giữa sức khỏe răng miệng và sức khỏe toàn thân.
Ông nhấn mạnh cải thiện sức khỏe răng hàm mặt không chỉ giúp người cao tuổi ăn uống tốt hơn, mà còn giảm nguy cơ biến chứng, giảm sự phụ thuộc vào hệ thống y tế, thu hẹp khoảng cách trung bình 9 năm giữa ""sống thọ"" và ""sống khỏe"".
Đối với người cao tuổi, mất răng là thách thức lớn nhất vì ảnh hưởng nghiêm trọng đến chức năng dinh dưỡng, chất lượng cuộc sống, đồng thời làm tăng nguy cơ mắc các bệnh mạn tính không lây.
Tuy nhiên hiện nay việc tiếp cận các dịch vụ chăm sóc răng miệng vẫn còn nhiều hạn chế, ngay cả tại TP.HCM là trung tâm y tế lớn nhất cả nước.
Khảo sát năm 2019 cho thấy, ở khu vực trung tâm TP.HCM, tỉ lệ bác sĩ răng hàm mặt đạt khoảng 6 người trên 10.000 dân, trong khi ở vùng cận trung tâm chỉ còn 1,6 người. Tại các khu vực ngoại thành, vùng xa con số này giảm xuống còn 0,9 người trên 10.000 dân, tức chưa đến một bác sĩ phục vụ cho 10.000 dân.
Thực trạng này phản ánh sự tập trung nguồn lực và dịch vụ tại khu vực trung tâm, trong khi nhu cầu chăm sóc răng miệng ở vùng ven và ngoại thành ngày càng tăng cao nhưng chưa được đáp ứng tương xứng.
Trong phần báo cáo về chiến lượcchăm sóc sức khỏerăng miệng cho người cao tuổi tại Việt Nam, BS.CKII Lê Trung Chánh - Giám đốc Bệnh viện Răng hàm mặt trung ương TP.HCM - nêu thực trạng hiện nay rất đáng lo ngại khi người trên 65 tuổi trung bình chỉ còn 10 - 12 răng chức năng, trong khi mục tiêu trong đề án quốc gia phải ít nhất 20 răng chức năng.
Bên cạnh đó, chỉ 15% người dân đi khám răng miệng định kỳ, có đến 80-90% mắc viêm nha chu mức độ vừa đến nặng.
""Tình trạng này phản ánh hạn chế trong công tác nha khoa dự phòng và khoảng trống trong hệ thống chăm sóc lão khoa tích hợp"", bác sĩ Chánh nói.
PGS Hùng cho biết thêm, Việt Nam hiện chưa có mô hình chăm sóc sức khỏe răng miệng chuyên biệt cho người cao tuổi, trong khi nhiều quốc gia châu Á đã triển khai hiệu quả. Vì vậy, việc nghiên cứu và học tập các mô hình thành công trong khu vực là hướng đi cần thiết trong thời gian tới.
""Để người cao tuổi Việt Nam có một cuộc sống vui và khỏe, việc đầu tư vào chăm sóc sức khỏe răng miệng ngay từ bây giờ là một yêu cầu tất yếu. Công việc quan trọng nhất là cần có sự hợp tác đa ngành và kết nối chặt chẽ giữa chăm sóc sức khỏe răng miệng với chăm sóc sức khỏe chung"", PGS Hùng nêu ý kiến.
Bác sĩ Nguyễn Thanh Huân, khoa nội tim mạch Bệnh viện Thống Nhất, cho biếtlão hóa là một quá trình sinh lý tự nhiên, diễn ra ở tất cả các cơ quan trong cơ thể vàkhông ai tránh khỏi. Quá trình này khiến chức năng các cơ quan dần suy giảm, đồng thờilàm tăng nguy cơ mắc các bệnh lý mạn tính.
Theo bác sĩ Huân,mục tiêu quan trọng là hướng đến ""lão hóa thành công"",tức là biếtđối diện với bệnh tật (nếu có),kiểm soát hiệu quả các yếu tố nguy cơđểngăn ngừa biến cố và duy trì chất lượng sống.
Để đạt được điều đó, người cao tuổi cầnduy trì lối sống vui vẻ, lạc quan, rèn luyện thể dục thường xuyên và có chế độ dinh dưỡng phù hợp.
Vừa qua Lotte Việt Nam đã tổ chức chương hội thảo khoa học “Tăng cường chăm sóc sức khỏe răng miệng cho thanh niên Việt Nam” tại Hà Nội.


Tối đa:1500 ký tự
Hiện chưa có bình luận nào, hãy là người đầu tiên bình luận"
https://tuoitre.vn/lan-dau-tien-mot-tong-bi-thu-viet-nam-den-phan-lan-20251019194740209.htm,Lần đầu tiên một Tổng Bí thư Việt Nam đến Phần Lan,Chuyến thăm Phần Lan của Tổng Bí thư Tô Lâm đánh dấu lần đầu tiên một người đứng đầu Đảng Cộng sản Việt Nam đến nước Bắc Âu này sau hơn 50 năm thiết lập quan hệ.,"Thứ trưởng Ngoại giao Lê Thị Thu Hằng trả lời phỏng vấn trước chuyến thăm Phần Lan của Tổng Bí thư Tô Lâm - Ảnh: Bộ Ngoại giao cung cấp
Nhận lời mời của Tổng thống Phần Lan Alexander Stubb,Tổng Bí thư Tô Lâmvà Phu nhân cùng đoàn đại biểu cấp cao Việt Nam sẽ thăm chính thức Phần Lan từ ngày 20 đến 22-10.
Trả lời báo chí, Thứ trưởng Ngoại giao Lê Thị Thu Hằng cho biết đây là chuyến thăm đầu tiên của một Tổng Bí thư Đảng Cộng sản Việt Nam đến Phần Lan kể từ khi hai nước thiết lập quan hệ ngoại giao vào năm 1973.
""Chuyến thăm mang thông điệp về tình cảm chân thành, sự coi trọng của Đảng, Nhà nước và nhân dân Việt Nam đối với Phần Lan, nước đã tích cực giúp đỡ Việt Nam trong sự nghiệp đấu tranh bảo vệ Tổ quốc trước đây và công cuộc xây dựng và phát triển đất nước hiện nay"", bà Hằng chia sẻ.
Nhìn lại lịch sử, Phần Lan là một trong những nước Bắc Âu đầu tiên công nhận và thiết lập quan hệ ngoại giao với Việt Nam.
Trong nhiều thập kỷ, Phần Lan là đối tác viện trợ phát triển quan trọng của Việt Nam, tập trung vào các lĩnh vực như cấp - thoát nước, xóa đói giảm nghèo,biến đổi khí hậu, lâm nghiệp… góp phần quan trọng vào quá trình phát triển kinh tế, xã hội ở Việt Nam.
Cho tới nay, ""nước sạch Phần Lan"" vẫn được người dân Việt Nam nhắc đến như một biểu tượng của tình hữu nghị và sự giúp đỡ hiệu quả, bền bỉ từ bạn bè Phần Lan. Nhiều dự án ở các vùng sâu, vùng xa đã góp phần cải thiện và nâng cao đời sống cho nhân dân Việt Nam.
Ngoài ý nghĩa trên, theo bà Hằng, chuyến thăm cũng là cơ hội quan trọng để hai bên cùng đề ra những định hướng lớn, làm mới quan hệ, tạo xung lực, đưa quan hệ hữu nghị truyền thống và hợp tác nhiều mặt lên tầm cao mới.
Bên cạnh việc tăng cường tin cậy chính trị giữa Việt Nam và Phần Lan, chuyến công tác lần này của Tổng Bí thư sẽ tạo ra cơ hội hợp tác toàn diện sâu rộng hơn trên nhiều lĩnh vực.
Trong đó nhất là trong các lĩnh vực tiềm năng như kinh tế số, kinh tế xanh, kinh tế tuần hoàn, khoa học - công nghệ, hàng hải, năng lượng tái tạo, nông nghiệp công nghệ cao - những lĩnh vực Việt Nam ưu tiên còn Phần Lan có thế mạnh và kinh nghiệm.
Nhìn rộng ra, chuyến thăm còn là cơ hội quan trọng để Việt Nam thúc đẩy hợp tác với khu vực Bắc Âu, đồng thời phát huy vai trò cầu nối của Việt Nam trong việc gắn kết Phần Lan với ASEAN, EU với ASEAN.
Qua đó góp phần tăng cường liên kết khu vực trong bối cảnh thế giới có nhiều thay đổi nhanh chóng với nhiều thách thức cần chung tay giải quyết, ứng phó như hiện nay.
Với nền tảng quan hệ truyền thống tốt đẹp, Thứ trưởng Bộ Ngoại giao tin tưởng chuyến thăm của Tổng Bí thư Tô Lâm sẽ mở ra giai đoạn mới, tạo sự chuyển biến mạnh mẽ, đột phá trong hợp tác với Phần Lan.
Sau hơn 50 năm thiết lập quan hệ ngoại giao, Phần Lan tiếp tục là đối tác quan trọng của Việt Nam tại khu vực Bắc Âu. Quan hệ Việt Nam - Phần Lan chuyển từ hợp tác phát triển sang hợp tác cùng có lợi.
Kim ngạch thương mại hai chiều tăng trưởng liên tục trong những năm trở lại đây, đạt 422,5 triệu USD năm 2024, và đạt hơn 279 triệu USD 9 tháng đầu năm 2025.
Hợp tác trong lĩnh vực giáo dục - đào tạo được mở rộng, hiện có gần 20 cơ sở giáo dục đại học Việt Nam đang hợp tác hiệu quả với các đối tác Phần Lan. Hơn 2.500 du học sinh Việt Nam đang học tập tại đất nước Bắc Âu trong các ngành kinh tế, công nghệ thông tin, du lịch...
Hợp tác trong các lĩnh vực khác như khoa học - công nghệ, văn hóa - thể thao, du lịch, lao động... phát triển tích cực. Hợp tác trong các lĩnh vực mới như kinh tế tuần hoàn, nông nghiệp công nghệ cao, chuyển đổi xanh, năng lượng tái tạo… hứa hẹn mang đến những khuôn khổ hợp tác mới phù hợp với tiềm năng và nhu cầu của mỗi bên.
Tổng Bí thư Tô Lâm và Phu nhân sẽ thăm Phần Lan từ ngày 20 đến 22-10.
Tối đa:1500 ký tự
Hiện chưa có bình luận nào, hãy là người đầu tiên bình luận"
