url,title,description,content
https://dantri.com.vn/the-gioi/nguoi-my-lo-lang-khi-chinh-phu-dong-cua-keo-dai-20251109172756814.htm,Người Mỹ lo lắng khi Chính phủ đóng cửa kéo dài,"(Dân trí) - Việc đóng cửa Chính phủ Mỹ dài ngày không chỉ dừng lại ở các dịch vụ hàng ngày, mà còn đang làm gián đoạn các lĩnh vực dài hạn như khoa học và giáo dục.","Người dân phân phát hàng cứu trợ tại một địa điểm ở Colorado Springs, Colorado ngày 7/11 (Ảnh: Reuters).
Khi mặt trời mọc lên trên các tòa nhà quốc hội Mỹ, hàng triệu người dân nước này thức dậy với nỗi bất an ngày càng lớn. Hôm nay đánh dấu ngày thứ 39 của cuộc đóng cửa chính phủ liên bang - một kỷ lục đáng buồn, vượt qua mốc 35 ngày được thiết lập trong nhiệm kỳ đầu của Tổng thống Donald Trump.
Không chỉ là con số khô khan trên lịch sử chính trị, cuộc khủng hoảng này đang len lỏi vào từng ngóc ngách cuộc sống hàng ngày của người Mỹ, từ những gia đình trung lưu loay hoay với hóa đơn đến các doanh nghiệp nhỏ chật vật duy trì hoạt động. Bế tắc giữa phe Dân chủ và Cộng hòa tại Quốc hội xoay quanh việc gia hạn khoản trợ cấp y tế theo Đạo luật Chăm sóc Sức khỏe Giá cả phải chăng (ACA, Obamacare), khiến các dịch vụ thiết yếu bị đình trệ và nỗi sợ hãi về mùalễ hộihỗn loạn lan rộng.
Cuộc đóng cửa bắt đầu từ 1/10, khi Quốc hội thất bại trong việc thông qua dự luật ngân sách tạm thời. Phe Dân chủ kiểm soát Hạ viện, kiên quyết đòi gia hạn các khoản trợ cấp thuế cao hơn cho bảo hiểm y tế ACA trước khi hết hạn vào 1/2026, trong khi phe Cộng hòa tại Thượng viện, dưới sự lãnh đạo của Đa số viên John Thune, cho rằng bất kỳ thỏa thuận nào cũng cần 60 phiếu ủng hộ để vượt qua rào cản ""câu giờ"" (filibuster).
Kết quả là, hơn 1,4 triệu nhân viên liên bang, từ kiểm soát viên không lưu đến nhân viên Sở Thuế vụ Mỹ (IRS), đang làm việc không lương, trong khi hàng chục triệu người khác chờ đợi trợ cấp thực phẩm và y tế. Theo ước tính của Văn phòng Ngân sách Quốc hội (CBO), mỗi tuần đóng cửa có thể làm giảm 0,1-0,2% tăng trưởng GDP hàng năm, đẩy nền kinh tế Mỹ vào tình trạng mong manh.
Trong bối cảnh này, nỗi lo của người dân Mỹ không còn là những con số thống kê trừu tượng. Nó là những cuộc trò chuyện muộn màng bên bàn ăn về việc liệu có đủ tiền mua quà Giáng sinh hay những hàng dài tại các ngân hàng thực phẩm ở Washington D.C. và New York.
Nguồn gốc của bế tắc
Để hiểu nỗi lo bao trùm nước Mỹ, cần nhìn lại nguyên nhân gốc rễ cuộc đóng cửa này. Không giống các lần đóng cửa trước đây chủ yếu xoay quanh ngân sách quốc phòng hay biên giới, lần này mấu chốt nằm ở các khoản trợ cấp thuế cho bảo hiểm y tế ACA. Được mở rộng mạnh mẽ qua “Đạo luật Cứu trợ Mỹ” năm 2021, các khoản trợ cấp này đã giúp 21 triệu người Mỹ mua bảo hiểm với giá rẻ hơn, giảm tỷ lệ không có bảo hiểm xuống mức thấp kỷ lục 7,7% năm 2024. Tuy nhiên, chúng sẽ hết hạn vào cuối 2025, dẫn đến tình trạng phí bảo hiểm trung bình tăng gấp đôi - từ 456 USD/tháng lên hơn 900 USD cho một gia đình bốn người ở các bang như Texas hay Florida.
Phe Dân chủ, dẫn dắt bởi Chủ tịch Hạ viện Hakeem Jeffries, coi việc gia hạn là “lằn ranh đỏ”, lập luận rằng không hành động sẽ đẩy hàng triệu người vào khủng hoảng y tế. “Đây không phải là chính trị, đây là vấn đề sinh tử”, Jeffries phát biểu trong phiên họp 4/11.
Ngược lại, phe Cộng hòa, lo ngại chi phí ngân sách lên đến 300 tỷ USD cho việc gia hạn, đề xuất các cải cách như giới hạn trợ cấp theo thu nhập hoặc chuyển sang mô hình thị trường tự do. “Chúng tôi sẵn sàng đàm phán nhưng không phải bằng cách cầm con tin toàn bộ chính phủ”, Thượng nghị sĩ Thune nhấn mạnh.
Sự chia rẽ này phản ánh sâu sắc hơn sự phân cực chính trị ở Mỹ hậu bầu cử 2024, nơi Đảng Cộng hòa giành lại Thượng viện nhưng vẫn bị chỉ trích vì “chơi trò chính trị” với các dịch vụ thiết yếu. Theo khảo sát của AP-NORC ngày 16/10, 44% người Mỹ đổ lỗi cho phe Cộng hòa về cuộc đóng cửa, so với 35% cho phe Dân chủ, trong khi 69% cử tri Dân chủ coi đây là “vấn đề lớn” so với chỉ 37% cử tri Cộng hòa.
Giáo sư Linda Bilmes, chuyên gia về ngân sách chính phủ nhận định: “Các cuộc đóng cửa không chỉ làm tê liệt dịch vụ mà còn làm suy yếu lòng tin vào hệ thống dân chủ Mỹ. Ở cấp độ quốc tế, nó gửi tín hiệu rằng siêu cường này tự làm suy yếu chính mình giữa lúcthế giớicần sự lãnh đạo ổn định”. Bilmes, từng cố vấn cho chính quyền Obama, cảnh báo rằng nếu kéo dài, cuộc khủng hoảng có thể lan sang các đồng minh châu Âu, nơi các nhà đầu tư đang theo dõi sát sao tác động đến thị trường toàn cầu.
Tác động kinh tế
Không gì làm nổi bật nỗi lo của người dân Mỹ hơn là “cú sốc tài chính” trực tiếp từ việc đóng cửa Chính phủ. Khoảng 800.000 nhân viên liên bang “thiết yếu”, bao gồm nhân viên FBI, Cục Quản lý An ninh Vận tải (TSA) và kiểm soát không lưu, đang làm việc mà không lương, trong khi 600.000 người khác bị nghỉ phép không lương. Đối với họ, mỗi ngày trôi qua là một trận chiến sinh tồn.
Tại Virginia, ngoại ô thủ đô Washington, nơi tập trung hàng nghìn nhân viên chính phủ, các ngân hàng thực phẩm báo cáo lượng người xếp hàng tăng gấp đôi so với tuần trước. Cô Maria Gonzalez, một nhân viên IRS 42 tuổi với hai con nhỏ, chia sẻ với truyền thông: “Tôi đã phải vay mượn tiền từ bạn bè để mua sữa cho con. Lương sẽ được trả bù sau, nhưng hóa đơn thế chấp không chờ đợi”.
Tác động lan rộng hơn dự đoán. Chương trình SNAP (trợ cấp thực phẩm) hỗ trợ 42 triệu người Mỹ thu nhập thấp bị gián đoạn, các khoản thanh toán mới bị trì hoãn từ 1/11. Ở các bang miền Nam như Mississippi, nơi tỷ lệ nghèo đói cao, hàng nghìn gia đình đối mặt nguy cơ thiếu ăn. Nếu đóng cửa kéo dài đến cuối năm, gần 340.000việc làmở cấp tiểu bang có thể biến mất vào 2026 do chuỗi cung ứng bị gián đoạn.
Cácdoanh nghiệpnhỏ cũng chịu ảnh hưởng. Ngành du lịch, dự kiến đón 55 triệu lượt khách nội địa dịp Lễ Tạ Ơn, lo ngại về sự sụt giảm doanh thu do nhân viên sân bay thiếu động lực. Hàng trăm hiệp hội du lịch, từ khách sạn Las Vegas đến các trung tâm hội nghị Chicago, gửi điện khẩn đến Quốc hội, cảnh báo “mùa lễ hội thảm họa”.
Chuyên gia kinh tế Mark Zandi từ Moody's Analytics ước tính nếu kéo dài thêm hai tuần, GDP quý IV/2025 có thể giảm 2%, đẩy Mỹ sát bờ vực suy thoái. “Người dân Mỹ không chỉ lo về ví tiền cá nhân; họ lo về ổn định kinh tế quốc gia, đặc biệt khi lạm phát vẫn ở mức 3,2%”, Zandi viết.
Nhà kinh tế học người Anh Paul Krugman, giành giải Nobel Kinh tế 2008, bình luận trên Guardian: “Cuộc đóng cửa này là minh chứng cho sự thất bại của hệ thống chính trị Mỹ, nơi lợi ích đảng phái lấn át nhu cầu của hàng triệu cử tri. Nó có thể làm lung lay niềm tin toàn cầu vào đồng USD”.
Khủng hoảng y tế
Một trong những nỗi lo lớn nhất là tương lai của hệ thống y tế, nơi ACA đóng vai trò trung tâm. Nếu không gia hạn trợ cấp, khoảng 5 triệu người có thể mất bảo hiểm vào năm 2026. Ở các bang không mở rộng Medicaid như Georgia hay Tennessee, phí bảo hiểm trung bình sẽ tăng 87% cho cá nhân và 104% cho gia đình, đẩy nhiều hộ gia đình trung lưu vào tình trạng “bảo hiểm quá đắt đỏ”.
Người dân đang cảm nhận rõ rệt sức ảnh hưởng từ việc đóng cửa Chính phủ quá lâu. Tại bang Florida, anh David Ramirez, 35 tuổi, tài xế Uber phụ thuộc vào ACA, lo lắng: “Tôi đã chọn kế hoạch 300 USD/tháng nhờ trợ cấp. Giờ nếu tăng gấp đôi, tôi phải chọn giữa bảo hiểm và ăn uống”.
Câu chuyện của anh Ramirez phản ánh hàng triệu trường hợp khác, đặc biệt ở nông thôn, nơi bệnh viện địa phương đang quá tải. NPR báo cáo rằng, các trung tâm y tế cộng đồng, vốn nhận 40% kinh phí từ liên bang, đã cắt giảm giờ làm, ảnh hưởng đến 10 triệu lượt khám chữa bệnh hàng tháng.
An ninh và hàng không
Khi Lễ Tạ Ơn còn 3 tuần nữa, nỗi sợ hỗn loạn tại sân bay trở thành cơn ác mộng thực sự. Hơn 50.000 nhân viên TSA và kiểm soát không lưu làm việc không lương, dẫn đến tình trạng thiếu nhân sự nghiêm trọng. FAA báo cáo hơn 1.200 chuyến bay bị chậm trễ chỉ trong ngày 4/11 vừa qua, chủ yếu tại các sân bay lớn như John F. Kennedy (JFK) và Los Angeles (LAX). Nhà Trắng cảnh báo rằng, nếu kéo dài đến tuần thứ sáu, một số vùng không phận có thể phải đóng cửa tạm thời, gây ra “hỗn loạn quốc gia”.
Người dân Mỹ như bà Linda Thompson, 58 tuổi từ bang Ohio, dự định bay về thăm con cái, đang cân nhắc hủy vé: “Tôi không muốn mạo hiểm với an toàn. Đã có quá nhiều câu chuyện về nhân viên mệt mỏi gây lỗi”. Báo Al Jazeera ghi nhận rằng, ngành hàng không Mỹ mất 500 triệu USD mỗi tuần do chậm trễ, ảnh hưởng đến 2 triệu hành khách hàng ngày.
Chuyên gia an ninh hàng không từ Đại học Michigan, Justin Cox, nhận định: “Cuộc đóng cửa này không chỉ là kinh tế; nó đe dọa an ninh quốc gia. Nhân viên không lương có nguy cơ giảm hiệu suất, tương tự như các sự cố năm 2019”. Từ châu Âu, cựu Bộ trưởng Giao thông Anh Grant Shapps bình luận trên BBC: “Mỹ đang tự làm suy yếu vị thế lãnh đạo toàn cầu trong hàng không. Nếu khủng hoảng lan sang các tuyến bay quốc tế, nó sẽ ảnh hưởng đếndu lịchtoàn cầu”.
Theo giới chuyên gia, việc đóng cửa Chính phủ Mỹ không chỉ dừng lại ở các dịch vụ hàng ngày; nó đang làm gián đoạn các lĩnh vực dài hạn như khoa học và giáo dục. Các viện nghiên cứu quốc gia như NIH và NSF đã đóng cửa phòng thí nghiệm, trì hoãn 12.000 dự án nghiên cứu, bao gồm các nghiên cứu về ung thư và biến đổi khí hậu. Nhà khoa học Maria Rodriguez tại Đại học Johns Hopkins than vãn: “Chúng tôi mất dữ liệu quý giá mỗi ngày. Điều này có thể làm chậm tiến bộ y tế hàng thập kỷ”.
Về giáo dục, các khoản vay sinh viên bị trì hoãn, ảnh hưởng đến 7 triệu sinh viên. Vườn quốc gia và công viên đóng cửa một phần, mất 300 triệu USD doanh thu du lịch. Chuyên gia môi trường từ Tổ chức Bảo tồn Thiên nhiên Quốc tế (IUCN), Inger Andersen, cảnh báo: “Sự gián đoạn theo dõi môi trường có thể làm Mỹ bỏ lỡ dữ liệu quan trọng về biến đổi khí hậu, ảnh hưởng đến các nỗ lực toàn cầu tại COP30”.
Khi ngày thứ 36 khép lại, hy vọng về thỏa thuận vẫn le lói với các cuộc đàm phán khẩn cấp tại Capitol Hill. Nhưng nỗi lo của người dân Mỹ, từ hóa đơn y tế đến chuyến bay Giáng sinh, nhắc nhở rằng chính trị không thể là “trò chơi có tổng bằng 0”. Chuyên gia Bilmes nhấn mạnh: “Mỹ cần nghiêm túc nghiên cứu vấn đề này từ lịch sử để tránh lặp lại sai lầm”. Trong khi chờ đợi, hàng triệu người dân Mỹ tiếp tục hy vọng rằng, từ đống tro tàn của bế tắc, một hệ thống bền vững hơn sẽ nổi lên."
https://dantri.com.vn/the-gioi/ngoai-truong-nga-tuyen-bo-san-sang-gap-nguoi-dong-cap-my-20251109185656333.htm,Ngoại trưởng Nga tuyên bố sẵn sàng gặp người đồng cấp Mỹ,"(Dân trí) - Ngoại trưởng Nga Sergei Lavrov hôm 9/11 cho biết ông sẵn sàng gặp Ngoại trưởng Mỹ Marco Rubio, nhưng khẳng định Moscow sẽ không từ bỏ những điều kiện cốt lõi để chấm dứt chiến sự Ukraine.","Ngoại trưởng Nga Sergei Lavrov (Ảnh: Reuters).
Nỗ lực của Tổng thống Mỹ Donald Trump nhằm làm trung gian kết thúc cuộc chiến tại Ukraine cho đến nay vẫn chưa thành công, và tháng trước ông đã tạm hoãn hội nghị thượng đỉnh dự kiến với Tổng thống Vladimir Putin tại Budapest, Hungary.
Điện Kremlin ngày 7/11 đã bác bỏ các tin đồn từ truyền thông phương Tây cho rằng ông Lavrov bị mất lòng tin từ ông Putin sau khi kế hoạch hội nghị bất thành, do Bộ Ngoại giao Nga gửi một thông điệp cho thấy Moscow không sẵn sàng nhượng bộ trong các yêu cầu liên quan đến Ukraine.
“Ngoại trưởng Marco Rubio và tôi đều hiểu tầm quan trọng của việc duy trì liên lạc thường xuyên”, ông Lavrov, người giữ chức ngoại trưởng từ năm 2004, nói với hãng tin nhà nước RIA Novosti. Ông khẳng định sẵn sàng gặp người đồng cấp Mỹ.
“Điều đó là cần thiết để thảo luận vấn đề Ukraine và thúc đẩy chương trình nghị sự song phương. Vì vậy, chúng tôi thường liên lạc qua điện thoại và sẵn sàng gặp mặt trực tiếp khi cần thiết”, ông Lavrov nói.
Gần 4 năm kể từ khi xung đột nổ ra, quân đội Nga đang dần tiến lên và hiện kiểm soát khoảng 19% lãnh thổ Ukraine, vùng đất mà Moscow tuyên bố đã sáp nhập hợp pháp vào Nga, dù Ukraine và phương Tây tuyên bố sẽ không công nhận.
Ông Lavrov nhắc về các “thỏa thuận” đạt được giữa ông Putin và ông Trump tại hội nghị thượng đỉnh ngày 15/8 ở căn cứquân sựAnchorage (Alaska).
Ông Putin đã nêu các điều kiện cốt lõi hồi tháng 6/2024, yêu cầu Kiev từ bỏ kế hoạch gia nhập NATO và rút quân khỏi toàn bộ 4 tỉnh mà Moscow tuyên bố sáp nhập: Donetsk và Lugansk, cùng Kherson và Zaporizhia ở miền nam.
Trong khi đó, Tổng thống Ukraine Volodymyr Zelensky kiên quyết bác bỏ việc công nhận sự hợp pháp của vùng lãnh thổ do Nga kiểm soát.
Khi được hỏi về kế hoạch của châu Âu nhằm sử dụng phần lớn 210 tỷ euro tài sản nhà nước Nga đang bị phong tỏa ở phương Tây để tài trợ cho Ukraine, ông Lavrov khẳng định không có cơ sở pháp lý nào cho việc tịch thu, và Nga sẽ trả đũa nếu điều đó xảy ra.
Ông cũng cho biết Mỹ đã thông báo qua kênh ngoại giao rằng Washington đang xem xét đề xuất của ông Putin về việc duy trì các giới hạn của Hiệp ước Cắt giảm Vũ khí Chiến lược Mới (New START) sau khi hiệp ước này hết hạn vào tháng 2/2026."
https://dantri.com.vn/the-gioi/trung-quoc-dinh-chi-lenh-cam-xuat-khau-kim-loai-quan-trong-sang-my-20251109184126565.htm,Trung Quốc đình chỉ lệnh cấm xuất khẩu kim loại quan trọng sang Mỹ,(Dân trí) - Trung Quốc thông báo tạm dừng lệnh cấm xuất khẩu sang Mỹ với những kim loại quan trọng.,"Trung Quốc tạm hoãn lệnh cấm xuất khẩu một số kim loại quan trọng sang Mỹ (Ảnh: AFP).
Trung Quốc đình chỉ lệnh cấm xuất khẩu sang Mỹ đối với gallium (gali), germanium (gemani) và antimony (antimon), những kim loại quan trọng cho công nghệ hiện đại, Bộ Thương mại Trung Quốc thông báo ngày 9/11, trong một bước hạ nhiệt thêm của cuộc chiến thương mại với Washington.
Các hạn chế này trước đó cấm xuất khẩu các hàng hóa “lưỡng dụng”, tức các vật liệu có thể được dùng cho cả mục đích dân sự lẫn quân sự.
Lệnh cấm, được áp đặt từ tháng 12/2024, nay được đình chỉ cho đến ngày 27/11/2026.
Thông báo được đưa ra sau cuộc gặp giữa Chủ tịch Trung Quốc Tập Cận Bình và Tổng thống Mỹ Donald Trump tại Hàn Quốc ngày 30/10, trong đó 2 bên đồng ý thu hồi một số biện pháp trừng phạt đã được áp dụng trong giai đoạn leo thang thuế quan.
Trước đó, mức thuế quan giữa hai nước đã lên tới 3 chữ số, làm đình trệ thương mại giữa hai nền kinh tế lớn nhấtthế giớivà gây ảnh hưởng tới chuỗi cung ứng toàn cầu.
Trong suốt cuộc chiến thương mại, Trung Quốc đã tận dụng vị thế của mình đối với các khoáng sản chiến lược, nền tảng cho mọi thứ từ điện thoại thông minh đến công nghệquân sựtiên tiến.
Gallium, germanium và antimony tuy không thuộc nhóm đất hiếm, nhưng lại vô cùng thiết yếu cho nhiều lĩnh vực kinh tế.
Theo báo cáo của Liên minh châu Âu năm 2024, Trung Quốc chiếm 94% sản lượng gallium toàn cầu, được sử dụng trong mạch tích hợp, đèn LED và tấm pin quang điện.
Đối với germanium, nguyên liệu quan trọng cho cáp quang và công nghệ hồng ngoại, Trung Quốc chiếm 83% sản lượng thế giới.
Antimony được sử dụng trong công nghệ pin cũng như công nghiệp quốc phòng, để gia cố giáp xe và đạn dược.
Trong tuyên bố ngắn, Bộ Thương mại Trung Quốc cũng cho biết sẽ nới lỏng hạn chế xuất khẩu các sản phẩm liên quan đến than chì, vốn trước đó cũng bị kiểm soát theo quy định hàng hóa lưỡng dụng.
Đây là bước đi giảm căng thẳng mới nhất của Bắc Kinh kể từ sau cuộc gặp giữa 2 lãnh đạo.
Ngày 5/11, Trung Quốc thông báo gia hạn thêm một năm việc đình chỉ áp thuế bổ sung đối với hàng hóa Mỹ, giữ ở mức 10%, đồng thời ngừng áp thuế tăng thêm từ tháng 3 đối với đậu tương và một số nông sản khác của Mỹ.
Vào cuối tháng 10, ông Trump cũng thông báo rằng Trung Quốc đã đồng ý đình chỉ trong một năm các hạn chế áp đặt từ ngày 9/10 đối với xuất khẩu công nghệ đất hiếm.
Đất hiếm là một lĩnh vực chiến lược do Trung Quốc chi phối, có vai trò thiết yếu trong sản xuất quốc phòng, ô tô và thiết bị điện tử tiêu dùng."
https://dantri.com.vn/the-gioi/lat-tau-gan-bien-gioi-thai-lan-malaysia-hang-chuc-nguoi-mat-tich-20251109155302051.htm,"Lật tàu gần biên giới Thái Lan - Malaysia, hàng chục người mất tích","(Dân trí) - Hàng chục người mất tích sau khi một con tàu bị lật gần biên giới Thái Lan - Malaysia, ít nhất một người được xác nhận đã thiệt mạng.","Lực lượng hàng hải Malaysia tích cực hỗ trợ tìm kiếm, cứu nạn (Ảnh: Reuters).
Hãng thông tấn Bernama đưa tin ngày 9/11, một tàu chở khoảng 100 người di cư không giấy tờ đã bị lật ở khu vực gần biên giới trên biển giữa Malaysia và Thái Lan.
Vụ lật tàu được cho là xảy ra gần đảo Tarutao, nằm ngay phía bắc đảo nghỉ dưỡng nổi tiếng Langkawi của Malaysia.
Cảnh sát trưởng bang Kedah của Malaysia, ông Adzli Abu Shah, cho biết con tàu này là một phần của một tàu lớn hơn chở khoảng 300 người do một đường dây tổ chức.
Theo ông Adzli, khoảng 300 người di cư đã lên một con tàu lớn khoảng một tháng trước. Khi con tàu lớn đến gần biên giới hàng hải Malaysia, đường dây này đã chia số người di cư thành 3 thuyền nhỏ hơn để tránh bị nhà chức trách phát hiện.
Một con tàu chở khoảng 100 người đã bị lật cách đây 3 ngày, và tình trạng của 2 thuyền còn lại vẫn chưa rõ.
Chiến dịch tìm kiếm và cứu nạn với sự tham gia của cảnh sát biển và Cơ quan Thực thi Hàng hải Malaysia đang được tiến hành.
Cơ quan Hàng hải Malaysia cho biết, 10 người được tìm thấy sống sót và một thi thể được trục vớt. Trong số những người sống sót có 3 người đàn ông Myanmar, 2 người đàn ông Rohingya và một người Bangladesh, trong khi thi thể là của một phụ nữ Rohingya.
Nhiều nạn nhân khác có thể vẫn đang trên biển sau gần 3 ngày kể từ khi con tàu rời Buthidaung, Myanmar, với khoảng 300 người trên khoang, Chuẩn Đô đốc Romli Mustafa, giám đốc Cơ quan Hàng hải các bang phía Bắc Malaysia, cho hay."
https://dantri.com.vn/the-gioi/myanmar-tuyen-bo-danh-sap-gan-150-toa-nha-o-hang-o-lua-dao-20251109150004787.htm,Myanmar tuyên bố đánh sập gần 150 tòa nhà ở hang ổ lừa đảo,"(Dân trí) - Quân đội Myanmar tuyên bố phá hủy gần 150 tòa nhà trong chiến dịch trấn áp một khu phức hợp lừa đảo qua mạng khét tiếng giáp biên giới Thái Lan, bao gồm một phòng gym, một spa và một quán karaoke.","Myanmar cho nổ tung các cơ sở trong khu vực hang ổ lừa đảo KK Park (Ảnh: Bangkok Post).
Trong một bản cập nhật đăng trên báo Global New Light of Myanmar, chính quyềnquân sựMyanmar cho biết họ phát hiện và đang phá hủy 148 tòa nhà, bao gồm ký túc xá, một bệnh viện 4 tầng và một khu phức hợp karaoke 2 tầng ở khu phức hợp lừa đảo KK Park gần biên giới Thái Lan.
“Tổng cộng 101 tòa nhà đã bị phá hủy, và 47 tòa còn lại đang trong quá trình”, Global New Light of Myanmar viết.
AFP chưa thể xác minh ngay lập tức những tuyên bố này, nhưng người dân Myanmar và bên kia biên giới ở Thái Lan cho biết đã nghe thấy những tiếng nổ rải rác kể từ khi chiến dịch đột kích của quân đội bắt đầu.
Quân đội Myanmar thông báo các cuộc đột kích ban đầu tại KK Park vào ngày 19/10, sau khi một cuộc điều tra của AFP cho thấy các trung tâm, trong đó có KK Park, tiếp tục mở rộng bất chấp chiến dịch trấn áp, với các bộ thu Internet vệ tinh Starlink được lắp đặt hàng loạt để vượt qua lệnh cắt Internet từ phía Thái Lan.
Sau cuộc điều tra của AFP, công ty mẹ Starlink là SpaceX cho biết họ đã cắt tín hiệu của hơn 2.500 thiết bị Internet vệ tinh gần các khu vực bị nghi là trung tâm lừa đảo tại Myanmar.
Những “nhà máy” lừa đảo trải dài đã bùng nổ tại các khu vực biên giới quản lý lỏng lẻo của Myanmar, chứa các lao động chuyên nhắm vào những người dùng Internet mất cảnh giác bằng các trò lừa tình cảm và kinh doanh để thu về hàng chục tỷ USD mỗi năm.
Nhiều lao động bị bán vào các “xưởng” trực tuyến này, nhưng số khác tự nguyện vào làm trong các khu phức hợp vốn được trang bị tiện nghi xa xỉ dành cho các ông trùm tội phạm và nhân viên có thu nhập cao.
Tháng trước, quân đội Myanmar thông báo một cuộc đột kích vào trung tâm lừa đảo khét tiếng KK Park, phát hiện hơn 2.000 đối tượng lừa đảo và khiến 1.500 người bỏ chạy sang biên giới Thái Lan."
