url,title,description,content
https://dantri.com.vn/noi-vu/bo-noi-vu-huong-dan-quy-trinh-bau-truong-thon-to-truong-to-dan-pho-moi-20251020104018731.htm,"Bộ Nội vụ hướng dẫn quy trình bầu trưởng thôn, tổ trưởng tổ dân phố mới","(Dân trí) - Bộ Nội vụ hướng dẫn các nội dung liên quan đến quy trình bầu cử trưởng thôn, tổ trưởng tổ dân phố khi triển khai mô hình chính quyền địa phương 2 cấp.","Về tổ chức, hoạt động của thôn, tổ dân phố khi vận hành chính quyền địa phương 2 cấp, Bộ Nội vụ cho biết, quy trình bầu cử trưởng thôn, tổ trưởng tổ dân phố được quy định tại Luật thực hiện dân chủ ở cơ sở và Nghị định số 59/2023/NĐ-CP ngày 14/8/2023 của Chính phủ quy định chi tiết một số điều của Luật thực hiện dân chủ ở cơ sở.
Nghị định số 59/2023/NĐ-CP nêu rõ công tác chuẩn bị bầutrưởng thôn, tổ trưởng tổ dân phố.
Theo đó, chủ tịch UBND cấp xã có trách nhiệm ban hành quyết định tổ chức bầu trưởng thôn, tổ trưởng tổ dân phố.
Cơ quan này cũng chủ trì, phối hợp với Ban Thường trực Ủy ban Mặt trận Tổ quốc Việt Nam cấp xã xây dựng kế hoạch, hướng dẫn nghiệp vụ và tổ chức triển khai kế hoạch chậm nhất 20 ngày trước ngày tổ chức cuộc họp của cộng đồng dân cư để bầu trưởng thôn, tổ trưởng tổ dân phố.
UBND xã sẽ ban hành quyết định thành lập tổ bầu cử chậm nhất 10 ngày trước ngày tổ chức cuộc họp của cộng đồng dân cư để bầu trưởng thôn, tổ trưởng tổ dân phố sau khi thống nhất với Ủy ban Mặt trận Tổ quốc Việt Nam cấp xã.
Tổ bầu cử gồm: Đại diện Ban công tác Mặt trận ở thôn, tổ dân phố làm tổ trưởng; thành viên là đại diện các tổ chức đoàn thể, chính trị - xã hội và đại diện hộ gia đình ở thôn, tổ dân phố (không phải là người ứng cử trưởng thôn, tổ trưởng tổ dân phố).
Các quyết định phải được thông báo đến nhân dân ở thôn, tổ dân phố, niêm yết tại nhà văn hóa, nhà sinh hoạt cộng đồng của thôn, tổ dân phố và thông báo trên hệ thống truyền thanh hoặc bằng hình thức khác phù hợp với điều kiện của địa phương chậm nhất 7 ngày trước ngày bầu cử.
Trưởng Ban Công tác Mặt trận ở thôn, tổ dân phố tổ chức cuộc họp Ban công tác Mặt trận ở thôn, tổ dân phố dự kiến danh sách người ứng cử trưởng thôn, tổ trưởng tổ dân phố.
Cơ quan này cũng báo cáo cấp ủy chi bộ thôn, tổ dân phố để thống nhất giới thiệu ít nhất 1 người ra ứng cử trưởng thôn, tổ trưởng tổ dân phố; tổ chức cuộc họp Ban công tác Mặt trận ở thôn, tổ dân phố sau khi có ý kiến của chi ủy chi bộ thôn, tổ dân phố để quyết định danh sách chính thức những người ứng cử (ít nhất 1 người).
Nội dung cuộc họp phải được lập thành biên bản theo mẫu số 5 kèm theo Nghị định này và gửi tới UBND cấp xã chậm nhất 15 ngày trước ngày tổ chức cuộc họp của cộng đồng dân cư.
Điều 7 Nghị định số 59/2023/NĐ-CP còn nêu rõ việc tổ chức bầu trưởng thôn, tổ trưởng tổ dân phố tại cuộc họp của cộng đồng dân cư thực hiện theo quy định.
Theo đó, trưởng thôn, tổ trưởng tổ dân phố triệu tập và chủ trì tổ chức cuộc họp của cộng đồng dân cư để nhân dân bàn và quyết định những nội dung được quy định tại khoản 1, 2, 3, 5 và 6 Điều 15 của Luật Thực hiện dân chủ ở cơ sở.
Tổ bầu cử (do Chủ tịch UBND cấp xã quyết định thành lập) triệu tập và chủ trì cuộc họp của cộng đồng dân cư để bầu trưởng thôn, tổ trưởng tổ dân phố.
Hiện Bộ Nội vụ đang xây dựng dự thảo nghị định về tổ chức và hoạt động của thôn, tổ dân phố và một số chế độ, chính sách đối với người hoạt động không chuyên trách để trình Chính phủ xem xét quyết định."
https://dantri.com.vn/noi-vu/xa-roi-vi-giay-to-viec-quan-ly-kho-tai-lieu-sau-sap-nhap-giao-ai-20251020121541225.htm,"Xã “rối” vì giấy tờ, việc quản lý kho tài liệu sau sáp nhập giao ai?","(Dân trí) - Sau khi nhận bàn giao tài liệu từ các xã cũ và cấp huyện cũ, UBND xã mới bàn giao cho Văn phòng HĐND - UBND xã hay Phòng Văn hóa - xã hội xã quản lý?","Bà Thanh Hậu công tác tại một xã thuộc tỉnh Khánh Hòa cho biết, căn cứ các quy định hiện hành, phòng Văn hóa - xã hội thực hiện tham mưu UBND xã về công tác quản lý nhà nước về công tác văn thư, lưu trữ.
Do đó, sau khi sáp nhập, phòng Văn hóa - xã hội đã tiếp nhận các tài liệu của các xã cũ bàn giao và tham mưu UBND xã mở niêm phong thống kê, xác nhận tài liệu sau khi bàn giao.
Bà Hậu thắc mắc: “Sau khi hoàn tất việc thống kê, xác nhận tài liệu bàn giao, Phòng Văn hóa - xã hội tham mưu UBND xã bàn giao lại khối lượng tài liệu này cho Văn phòng HĐND-UBND quản lý thì có đúng quy định không?”.
Hồ sơ, tài liệu bản giấy hiện còn lưu giữ rất nhiều tại các phường, xã (Ảnh minh họa: Tùng Nguyên).
Tương tự bà Hậu, bà Ánh Tuyết - cán bộ một phường thuộc tỉnh Lâm Đồng - cho biết kho của UBND phường đang lưu trữ, bảo quản nhiều giấy tờ, hồ sơ được bàn giao từ UBND các xã, phường cũ và tài liệu của UBND cấp huyện cũ. Hiện phường vẫn chưa xác định rõ phòng chuyên môn nào có trách nhiệm quản lý, bảo quản những tài liệu này.
“Kho tài liệu này theo chức năng, nhiệm vụ và quy định thì thuộc Phòng Văn hóa - xã hội UBND phường hay Văn phòng HĐND và UBND phường quản lý?”, bà Tuyết hỏi.
Bà Phạm Uyên cũng phản ánh tình trạng tương tự xảy ra ở UBND xã mình đang công tác. Bà Uyên đề xuất chuyển nhiệm vụ này về Văn phòng HĐND -UBND cấp xã.
Theo bà Phạm Uyên, đề xuất này nhằm bảo đảm việc thực hiện công tác văn thư, lưu trữ đúng chức năng, đúng người, đúng chuyên môn, tăng cường hiệu lực quản lý nhà nước, bảo đảm an toàn tài liệu. Đồng thời, việc này cũng giúp giảm tải nhiệm vụ không phù hợp cho công chức văn hóa - xã hội.
Về vấn đề này, Bộ Nội vụ khẳng định: “Phòng Văn hóa - xã hội có chức năng tham mưu, giúp UBND cấp xã thực hiện chức năng quản lý nhà nước về văn thư, lưu trữ; không có chức năng quản lý tài liệu lưu trữ thuộc thẩm quyền quản lý của UBND cấp xã”.
Các phòng chuyên môn thuộc UBND cấp xã có con dấu để thực hiện nhiệm vụ được giao, có tư cách pháp nhân. Do đó, mỗi phòng chuyên môn tổ chức bộ phận lưu trữ riêng để thực hiện lưu trữ đối với tài liệu hình thành trong quá trình hoạt động của phòng, không tập trung tài liệu về kho lưu trữ của UBND cấp xã như trước đây.
Đối với việc quản lý kho lưu trữ của UBND cấp xã hình thành trước khi vận hành chính quyền địa phương 2 cấp, các tài liệu tồn đọng từ trước ngày 30/6/2025, Bộ Nội vụ cho biết do Chủ tịch UBND cấp xã quyết định theo quy định tại Khoản 1 và Khoản 2 Điều 59 Luật Lưu trữ.
Cụ thể, Khoản 1 Điều 59 Luật Lưu trữ quy định người đứng đầu cơ quan, tổ chức, trong phạm vi nhiệm vụ và quyền hạn của mình, chịu trách nhiệm về việc lựa chọn tổ chức, cá nhân cung cấp dịch vụ lưu trữ đối với tài liệu lưu trữ thuộc thẩm quyền quản lý.
Khoản 2 Điều 59 quy định: “Người đứng đầu lưu trữ lịch sử có trách nhiệm bảo đảm các điều kiện cần thiết để cơ quan, tổ chức, cá nhân tiếp cận kịp thời, đầy đủ thông tin trong tài liệu lưu trữ khi có nhu cầu”."
https://dantri.com.vn/noi-vu/10-nguoi-lam-thu-tuc-ma-so-thu-tu-den-42-phuong-doi-cach-lay-so-20251019204227208.htm,10 người làm thủ tục mà số thứ tự đến 42: Phường đổi cách lấy số,"(Dân trí) - Phường Liên Chiểu, thành phố Đà Nẵng đã điều chỉnh cách lấy số thứ tự theo từng ô lĩnh vực riêng và có chủ trương bố trí cán bộ trực tại máy bấm số vào giờ cao điểm để giám sát.","Ông Phan Văn Đại, Phó Giám đốc Trung tâm Phục vụ hành chính công phường Liên Chiểu, thành phố Đà Nẵng, cho biết sau khi có phản ánh vềbất cập trong quá trình lấy số thứ tựlàm thủ tục hành chính, phường đã rà soát, điều chỉnh quy trình bấm số thứ tự.
Theo ông Đại, trước đây máy bấm số thứ tự được cài đặt chung cho tất cả lĩnh vực, nên dù người dân đến cùng thời điểm nhưng làm thủ tục khác nhau vẫn phải chờ chung một hàng.
Phiếu lấy số thứ tự tại phường Liên Chiểu đã được thay đổi theo phương thức mới (Ảnh: Hoài Sơn).
Ông Đại nhận định, cách vận hành này đôi khi gây hiểu nhầm hoặc khiến người dân cảm thấy chưa hợp lý, nhất là khi có trường hợp một người lấy nhiều số giúp người khác.
“Sau khi tiếp nhận phản ánh từ báo chí và người dân, phường đã rà soát, điều chỉnh lại quy trình. Hiện việc bấm số được tách riêng theo từng lĩnh vực, chỉ người đến trực tiếp mới được lấy số, không còn tình trạng nhờ bấm hộ hay lấy nhiều số cùng lúc”, ông Đại nói.
Ông Đại cho biết thêm, vào các khung giờ cao điểm buổi sáng và buổi chiều, trung tâm bố trí cán bộ túc trực tại máy bấm số để hướng dẫn, giám sát, bảo đảm mỗi người chỉ được lấy một số. Người có hồ sơ thực tế cần giải quyết mới được cấp số thứ tự.
Trung tâm cũng lắp đặt màn hình hiển thị số thứ tự rõ ràng tại khu vực giao dịch để người dân dễ theo dõi, tránh nhầm lẫn.
Máy lấy số thứ tự tại phường Liên Chiểu (Ảnh: Hoài Sơn).
Ông Đại cho hay, hiện Trung tâm Phục vụ hành chính công phường Liên Chiểu có 7 ô giao dịch, tiếp nhận trung bình hơn 100 hồ sơ mỗi ngày, trong đó lĩnh vực đất đai chiếm tỷ lệ lớn.
Tuy nhiên, đơn vị chỉ có 4 công chức biên chế chính thức nên khối lượng công việc khá áp lực. Phường phải bố trí thêm cán bộ kiêm nhiệm từ các bộ phận khác để hỗ trợ phục vụ người dân.
“Việc thiếu nhân sự là khó khăn chung, nhưng chúng tôi luôn nỗ lực bảo đảm tiến độ và chất lượng phục vụ. Khi có phản ánh, phường đều lắng nghe và điều chỉnh kịp thời để phục vụ người dân tốt hơn”, ông Đại khẳng định.
Trước đó,Dân tríđã phản ánh tình trạng người dân đến làm thủ tục đăng ký đất đai tại Trung tâm Phục vụ hành chính công phường Liên Chiểu, dù chỉ khoảng 10 người có mặt nhưng máy đã bấm ra đến số thứ tự 42. Người dân nghi ngờ có tình trạng “bấm số ảo” để giữ chỗ.
Theo UBND phường Liên Chiểu, việc cấp số thứ tự được thực hiện hoàn toàn tự động, công dân sẽ tự bấm số tại máy để chờ giao dịch.
Người dân bốc số thứ tự để chờ làm thủ tục hành chính (Ảnh: A Núi).
Đối với phản ánh “10 người có mặt nhưng số thứ tự lại đến 42”, UBND phường cho biết, vì số thứ tự cấu hình trên máy bấm số là cho tất cả 7 ô tiếp nhận tại trung tâm. Việc bấm đến số 42 có thể do một số người dân bấm nhầm hoặc thao tác kiểm tra trước đó, khiến số thứ tự trên hệ thống tăng lên.
UBND phường Liên Chiểu khẳng định, việc số thứ tự tăng lên không đồng nghĩa có người can thiệp, bấm số ảo để giữ chỗ khi làm thủ tục hành chính.
Phường Liên Chiểu nằm ở khu vực Tây Bắc thành phố Đà Nẵng. Theo báo cáo mới đây của Sở Nội vụ thành phố Đà Nẵng, phường Liên Chiểu là một trong những địa phương đang thiếu cán bộ so với khối lượng công việc thực tế."
https://dantri.com.vn/noi-vu/qua-trinh-tinh-gon-thon-to-dan-pho-tung-dien-ra-nhu-the-nao-20250623001738748.htm,"Quá trình tinh gọn thôn, tổ dân phố từng diễn ra như thế nào?","(Dân trí) - Ba năm sau khi triển khai chủ trương sáp nhập, Việt Nam bớt được hơn 16.000 thôn, tổ dân phố và cắt giảm gần 49.000 người hoạt động không chuyên trách, tiết kiệm khoảng 876 tỷ đồng ngân sách mỗi năm.","Hơn 16.000 thôn, tổ dân phố sáp nhập trong 3 năm
Chủ trương tinh gọn tổ chức ở cơ sở xuất phát từ Nghị quyết 18 năm 2017 và Nghị quyết 37 năm 2018, được Quốc hội cụ thể hóa bằng Nghị quyết 653 năm 2019 về tiêu chí bắt buộc và khuyến khích sáp nhập.
Giai đoạn 2019-2021, 45 tỉnh thành đã rà soát, hợp nhất 16.321 trong tổng số 86.282 thôn, tổ dân phố không đạt chuẩn về quy mô hộ hoặc diện tích. Kết quả, cả nước còn 69.961 thôn và 20.547 tổ dân phố.
Quy định ngưỡng tối thiểu về số hộ cho mỗi đơn vị là: thôn ở trung du miền núi phía Bắc phải có từ 150 hộ, Tây Nguyên từ 200 hộ, miền Trung 250 hộ, đồng bằng sông Hồng 300 hộ, miền Nam 350 hộ và các thôn biên giới, hải đảo tối thiểu 100 hộ; tổ dân phố ở miền núi phải có từ 200 hộ, miền Trung 300 hộ, miền Nam 400 hộ, đồng bằng sông Hồng 350 hộ, riêng Hà Nội tối thiểu 450 hộ.
Chủ trương tinh gọn thôn, tổ dân phố được đưa ra từ năm 2017 (Ảnh minh họa: DT).
Theo hướng dẫn của Bộ Nội vụ, những thôn hoặc tổ dân phố dưới 50% ngưỡng hộ bắt buộc phải sáp nhập với đơn vị liền kề; các đơn vị đạt từ 50% đến dưới ngưỡng ""được khuyến khích hợp nhất nếu địa hình thuận lợi và cử tri đồng thuận"".
Đề án sáp nhập chỉ được phê duyệt khi trên 50% số cử tri (hoặc đại diện hộ) ở từng đơn vị tán thành, đồng thời phải cân nhắc yếu tố đặc thù về dân tộc, tín ngưỡng, quốc phòng để không làm xáo trộn đời sống cộng đồng.
Việc tinh gọn giúp giảm 48.963 người hoạt động không chuyên trách cấp thôn, tổ dân phố - nhóm vốn hưởng phụ cấp khoán từ ngân sách - qua đó tiết kiệm khoảng 876 tỷ đồng mỗi năm, tách biệt với khoản 1.132 tỷ đồng tiết kiệm ở cấp huyện, xã.
Báo cáo của Ủy ban Pháp luật năm 2022 cho thấy nhiều thôn mới hình thành vượt 1.000 hộ, trong khi bản vùng cao có dưới 200 hộ vẫn khó ghép do địa hình chia cắt. Việc đổi tên, nhập hộ khẩu, di chuyển nhà văn hóa, trụ sở sinh hoạt cộng đồng cũng tạo xáo trộn nhất định.
Lộ trình sắp xếp sau 2025
Quyết định 758 của Thủ tướng Chính phủ ban hành hồi giữa tháng 4 giao Bộ Nội vụ giữ nguyên hơn 90.000 thôn, tổ dân phố hiện hữu để tập trung hoàn tất việc sáp nhập cấp tỉnh, xã.
Trước những vấn đề đã được chỉ ra trong quá trình sáp nhập thôn, tổ dân phố giai đoạn đầu, các chuyên gia đề xuất không ""đồng phục tiêu chuẩn"" giữa đồng bằng và miền núi. Theo đó, mỗi vùng cần có ngưỡng riêng để bảo đảm tự quản hiệu quả. Bên cạnh đó, việc sáp nhập phải dựa vào đánh giá cụ thể yếu tố văn hóa, địa lý, dân tộc, thay vì chỉ xét số hộ và diện tích.
Sau cuộc cách mạng tinh gọn bộ máy từ Trung ương tới cơ sở (gồm sáp nhập địa giới, tổ chức lại cấp chính quyền), mũi trọng tâm tiếp theo là sắp xếp thôn, tổ dân phố để đồng bộ về quy mô dân cư, tinh giản đầu mối và chuẩn hóa hoạt động tự quản ở cơ sở.
Mới đây, trong dự thảo Báo cáo chính trị của Ban Chấp hành Trung ương Đảng khóa XIII tại Đại hội đại biểu toàn quốc lần thứ XIV của Đảng đang được lấy ý kiến nhân dân, Trung ương giao Đảng uỷ Quốc hội và Đảng uỷ Chính phủ chủ trì, phối hợp các tỉnh uỷ, thành uỷ triển khai việc sắp xếp các thôn, tổ dân phố ở xã, phường và người hoạt động không chuyên trách tại thôn, tổ dân phố sẽ được triển khai đồng bộ. Thời gian thực hiện trong quý IV/2025.
Trước đó, Bộ Nội vụ đã có công văn gửi UBND các tỉnh, thành phố trực thuộc Trung ương đề nghị khẩn trương tổng kết, đánh giá việc thực hiện các quy định về tổ chức, hoạt động của thôn, tổ dân phố và chế độ, chính sách đối với người hoạt động không chuyên trách. Báo cáo sẽ là căn cứ để xây dựng dự thảo Nghị định của Chính phủ trong năm 2025.
Theo yêu cầu của Bộ Nội vụ, các địa phương phải khái quát tình hình tổ chức và hoạt động của thôn, tổ dân phố gắn với sắp xếp đơn vị hành chính và mô hình chính quyền địa phương hai cấp."
https://dantri.com.vn/noi-vu/ha-noi-phan-hoi-ve-de-xuat-mo-rong-nhom-lao-dong-duoc-tang-them-thu-nhap-20251018214015501.htm,Hà Nội phản hồi về đề xuất mở rộng nhóm lao động được tăng thêm thu nhập,"(Dân trí) - Nhiều đơn vị tại Hà Nội đề xuất bổ sung thêm nhóm lao động làm việc trong đơn vị sự nghiệp được hưởng mức thu nhập tăng thêm 0,8 lần lương cơ bản từ năm 2026.","UBND TP Hà Nội đang lấy ý kiến dự thảo Nghị quyết của HĐND thành phố quy định chithu nhập tăng thêmcho cán bộ, công chức, viên chức.
Đối tượng áp dụng là những người đang làm việc trong các cơ quan nhà nước, tổ chức chính trị, Mặt trận Tổ quốc Việt Nam, tổ chức chính trị - xã hội và đơn vị sự nghiệp công lập được ngân sách nhà nước bảo đảm toàn bộ chi thường xuyên thuộc phạm vi quản lý của thành phố.
Theo dự thảo Nghị quyết, mức chi thu nhập tăng thêm căn cứ vào năng lực, hiệu quả công việc của cán bộ,công chức, viên chức tại cơ quan, đơn vị do Thủ trưởng đơn vị chịu trách nhiệm đánh giá. Việc thực hiện chi thu nhập tăng thêm bảo đảm tính khách quan, công khai, minh bạch.
Nguồn kinh phí chi thu nhập tăng thêm được trích từ nguồn cải cách tiền lương còn dư của ngân sách các cấp, sau khi đã bảo đảm đủ nguồn cải cách tiền lương cho cả thời kỳ ổn định ngân sách và bảo đảm các chính sách xã hội,an sinhxã hội, phúc lợi xã hội do Trung ương ban hành.
Theo đó, nguồn kinh phí chi thu nhập tăng thêm của cơ quan, đơn vị bằng quỹ lương cơ bản (gồm lương theo ngạch, bậc, chức vụ) nhân với mức trích do HĐND TP Hà Nội quyết định.
Mức trích để tạo nguồn kinh phí thực hiện chi thu nhập tăng thêm năm 2026 bằng 0,8 lần quỹ lương cơ bản.
Cụ thể, Hà Nội đề xuất 0,5 lần quỹ lương cơ bản để chi thu nhập tăng thêm hằng tháng cho toàn bộ cán bộ, công chức, viên chức hiện có của cơ quan, đơn vị thuộc đối tượng được hưởng theo hệ số lương ngạch bậc, chức vụ hiện hưởng.
Đồng thời, 0,3 lần quỹ lương cơ bản còn lại để chi thu nhập tăng thêm cuối năm cho cán bộ, công chức, viên chức của cơ quan, đơn vị được đánh giá, xếp loại hằng năm từ hoàn thành nhiệm vụ trở lên.
Dự kiến, nếu Nghị quyết được thông qua sẽ áp dụng ngay trong năm 2026.
Hà Nội đang lấy ý kiến về việc chi thu nhập tăng thêm cho cán bộ, công chức, viên chức (Ảnh: Hoa Lê).
Góp ý dự thảo, nhiều cơ quan, tổ chức đề xuất bổ sung thêm đối tượng được hưởng chi thu nhập tăng thêm là lao động hợp đồng, đang làm việc tại các đơn vị sự nghiệp trên địa bàn thành phố.
Cụ thể, Trung tâm Phục vụ hành chính công Hà Nội đề nghị bổ sung thêm đối tượng hợp đồng có thời hạn theo quy định tại Nghị quyết số 26/2024/NQHĐND ngày 19/11/2024 của HĐND thành phố.
Theo Trung tâm này, tại Điều 4 Nghị quyết 26/2024/NQHĐND ngày 19/11/2024 của HĐND thành phố về các trường hợp được ký hợp đồng làm chuyên môn, nghiệp vụ, Khoản 1 của nghị quyết có quy định: “Trường hợp cơ quan hành chính còn chỉ tiêu biên chế công chức chưa sử dụng do chưa tuyển dụng đủ theo số được giao thì được ký hợp đồng ở vị trí việc làm chuyên môn, nghiệp vụ còn thiếu”.
Thực tế hiện nay, các trường hợp hợp đồng theo Nghị quyết số 26 thực hiện công việc chuyên môn như công chức. Tuy nhiên, họ chỉ được hưởng lương theo hệ số, không được hưởng phụ cấp công vụ như công chức và Hợp đồng theo Nghị định 111/2022/NĐ-CP của Chính phủ.
Tương tự, Sở Y tế Hà Nội đề xuất bổ sung thêm đối tượng hưởng chi thu nhập tăng thêm người làm việc theo chế độ hợp đồng lao động không xác định thời hạn tại các cơ quan, tổ chức, đơn vị được ngân sách nhà nước bảo đảm toàn bộ chi thường xuyên thuộc thành phố quản lý.
Giải trình trước đề xuất trên, Sở Nội vụ Hà Nội - đơn vị tổng hợp ý kiến giải trình cho rằng cần giữ nguyên đối tượng tại dự thảo Nghị quyết thay thế Nghị quyết 46/2024/NQ-HĐND, thực hiện theo đúng quy định tại khoản 3, 4 Điều 15 Luật Thủ đô về đối tượng được hưởng chính sách chi thu nhập tăng thêm là cán bộ, công chức, viên chức theo quy định của pháp luật."
