url,title,description,content
https://dantri.com.vn/noi-vu/quyen-tu-chu-cua-don-vi-su-nghiep-nen-cham-dut-viec-do-bang-doanh-thu-20251016124514869.htm,"""Quyền tự chủ của đơn vị sự nghiệp nên chấm dứt việc đo bằng doanh thu""","(Dân trí) - Nguyên Thứ trưởng Bộ Nội vụ Trần Anh Tuấn muốn mạnh dạn giao quyền tự chủ cho đơn vị sự nghiệp để tháo gỡ điểm nghẽn, nâng cao hiệu quả, chất lượng phục vụ thay vì ban quyền theo nguồn thu sự nghiệp.","Ý kiến được chuyên gia nêu tại hội thảo Góp ý dự thảo Luật Viên chức (sửa đổi) do Hiệp hội Khoa học hành chính Việt Nam tổ chức sáng 16/10.
Toàn cảnh Hội thảo (Ảnh: Tuấn Anh).
Đổi mới tư duy quản trị khu vực sự nghiệp công lập
Tại sự kiện, TS Trần Anh Tuấn, Chủ tịch Hiệp hội Khoa học hành chính Việt Nam, nguyên Thứ trưởng Bộ Nội vụ, nhấn mạnh sau 15 năm thực hiện, Luật Viên chức và các văn bản liên quan đã bộc lộ nhiều điểm nghẽn, không còn phù hợp với yêu cầu tinh gọn bộ máy, phân quyền mạnh, phát triển kinh tế thị trường và ứng dụng khoa học - công nghệ.
Ông cho rằng việc sửa đổi toàn diện Luật Viên chức là rất cần thiết, nhằm khơi thông các điểm tắc và rào cản về tự chủ, cơ chế tuyển dụng, sử dụng và quản lý viên chức, thu hút người tài và gắn kết khu vực công với khu vực tư.
""Cần thay đổi tư duy quản lý đối với khu vực sự nghiệp công lập theo hướng lấy vị trí việc làm để quản lý, lấy kết quả đầu ra để quản trị, chuyển từ ""quản lý"" sang ""quản trị"". Việc của đơn vị để đơn vị tự quyết, cấp trên chỉ hướng dẫn, kiểm tra và đánh giá kết quả"", ông nói.
TS Trần Anh Tuấn, Chủ tịch Hiệp hội Khoa học hành chính Việt Nam, nguyên Thứ trưởng Bộ Nội vụ, chủ trì hội thảo (Ảnh: Tuấn Anh).
TS Tuấn đề nghị xóa bỏ tư duy giao mức độ tự chủ căn cứ vào nguồn thu sự nghiệp, chuyển sang giao quyền tự chủ hoàn toàn gắn với kết quả và chất lượng dịch vụ công.
""Đơn vị sự nghiệp công lập cần được thực sự trao quyền tự quyết định tổ chức bộ máy, nhân lực, tài chính, còn cơ quan chủ quản chỉ quản lý theo sản phẩm và đầu ra"", ông nói.
Ông cũng nêu rõ, trong Luật Viên chức sửa đổi, cần thể chế hóa quy định của Đảng tại văn bản 71 quy định không tổ chức Hội đồng trường, Hội đồng quản lý trong đơn vị sự nghiệp công lập. Nên áp dụng nguyên tắc ""một luật sửa nhiều luật"" và tư tưởng xóa bỏ lợi ích cục bộ trong việc đưa các quy định tổ chức, nhân lực trong các luật chuyên ngành.
Ông cũng đồng thời cho rằng chỉ nên phải phân loại lại đơn vị sự nghiệp theo chức năng, gồm: chức năng phục vụ quản lý nhà nước; cung cấp dịch vụ công phục vụ nhân dân; vừa phục vụ quản lý nhà nước, vừa cung cấp dịch vụ công.
Tái lập thế cân bằng Nhà nước - thị trường - xã hội
Từ góc nhìn thể chế, TS Nguyễn Sĩ Dũng, nguyên Phó Chủ nhiệm Văn phòng Quốc hội, cho rằng việc sửa đổi Luật Viên chức không chỉ là kỹ thuật lập pháp mà là một cuộc cải cách cấu trúc lớn, nhằm xác lập lại mối quan hệ giữa Nhà nước - thị trường - xã hội trong cung ứng dịch vụ công.
Theo ông, khu vực sự nghiệp công lập đang vận hành trong tình trạng nửa hành chính nửa thị trường. Nhà nước vẫn bao cấp sâu, thị trường chưa vận hành đầy đủ, còn xã hội tham gia còn hạn chế.
""Chính sự thiếu cân bằng này khiến các đơn vị công lập lúng túng giữa hai cực. Nếu vận hành theo cơ chế hành chính thì kém năng động. Nếu thả nổi theo cơ chế thị trường thì dễ thương mại hóa dịch vụ công"", ông nói.
TS Nguyễn Sĩ Dũng cho rằng khu vực sự nghiệp công lập đang vận hành trong tình trạng nửa hành chính nửa thị trường (Ảnh: Tuấn Anh).
TS Dũng đề xuất chính sách phát triển khu vực sự nghiệp công lập cần dựa trên bốn nguyên tắc nền tảng.
Trước hết là nguyên tắc tự chủ có kiểm soát, tức các đơn vị sự nghiệp được trao quyền chủ động về tổ chức, tài chính và nhân sự song phải chịu sự giám sát nghiêm ngặt về kết quả đầu ra và trách nhiệm giải trình.
Thứ hai, phải bảo đảm công bằng trong tiếp cận, để mọi người dân, không phân biệt điều kiện, đều có quyền thụ hưởng dịch vụ công cơ bản ở mức tối thiểu.
Thứ ba, chính sách cần đa dạng hóa chủ thể cung ứng, khuyến khích không chỉ khu vực công mà cả tư nhân, tổ chức xã hội và doanh nghiệp phi lợi nhuận cùng tham gia trong khuôn khổ minh bạch, cạnh tranh lành mạnh.
Cuối cùng là nguyên tắc minh bạch và trách nhiệm giải trình, đòi hỏi mọi đơn vị sự nghiệp công lập phải công khai kết quả hoạt động, hiệu quả sử dụng nguồn lực và chịu sự giám sát của xã hội cũng như cơ quan chủ quản
Ông cho rằng, để nâng cao hiệu quả và tính công bằng, Nhà nước cần chuyển từ hỗ trợ đầu vào sang mua kết quả đầu ra và phân nhóm rõ ràng các đơn vị sự nghiệp công lập. Nhóm cung cấp dịch vụ công thiết yếu do Nhà nước bảo đảm hoàn toàn; nhóm có thể thực hiện cơ chế tự chủ từng phần thông qua hợp đồng dịch vụ công và nhóm có khả năng tự chủ hoàn toàn, tiến tới cổ phần hóa hoặc chuyển đổi mô hình doanh nghiệp công ích.
Cùng với đó, ông nhấn mạnh yêu cầu công khai kết quả hoạt động, tài chính và mức độ hài lòng của người dân để tăng cường giám sát xã hội và minh bạch hóa khu vực công.
Mở rộng luân chuyển công - tư, linh hoạt nhân lực
Ở góc độ pháp lý, TS Nguyễn Phước Thọ, nguyên Vụ trưởng Vụ Pháp chế (Văn phòng Chính phủ) góp ý về nội dung luân chuyển nhân lực trong dự thảo Luật Viên chức. Ông nhấn mạnh quy định về nguồn nhân lực cần được nhìn nhận hai chiều, cả từ khu vực công sang khu vực tư và ngược lại thay vì chỉ tính việc ""tư vào công"".
TS Nguyễn Phước Thọ nguyên là Vụ trưởng Vụ Pháp chế (Văn phòng Chính phủ) (Ảnh: Tuấn Anh).
Ông cho rằng, cần cho phép viên chức tạm thời làm việc hoặc hợp tác chuyên môn với khu vực tư, doanh nghiệp xã hội hoặc tổ chức phi lợi nhuận đồng thời vẫn duy trì vị thế nghề nghiệp trong khu vực công.
""Cơ chế mở sẽ giúp khu vực công hấp thụ năng lực và cách làm mới của khu vực tư thay vì đóng kín trong chính mình"", ông nêu.
TS Thọ cũng góp ý, việc quy định ai là công chức, ai là viên chức trong đơn vị sự nghiệp công lập cần được xác định rõ ràng, tránh tình trạng chồng chéo, gây khó trong quản lý và thực thi pháp luật.
Các chuyên gia đều thống nhất rằng, Luật Viên chức (sửa đổi) phải trở thành công cụ thể chế hóa một nền hành chính phục vụ, nơi đơn vị sự nghiệp được tự chủ thực chất, người dân được phục vụ tốt hơn, và nguồn lực công được sử dụng hiệu quả hơn."
https://dantri.com.vn/noi-vu/trinh-chinh-phu-lich-nghi-tet-nguyen-dan-2026-keo-dai-9-ngay-20251002100413829.htm,Trình Chính phủ lịch nghỉ Tết Nguyên đán 2026 kéo dài 9 ngày,"(Dân trí) - Bộ Nội vụ chính thức trình Chính phủ phương án nghỉ Tết Nguyên đán kéo dài 9 ngày liên tiếp, gồm 5 ngày nghỉ Tết và 4 ngày nghỉ hằng tuần.","Bộ Nội vụ chính thức trình Chính phủ phương án nghỉTết Nguyên đán, lễ Quốc khánh năm 2026 đối với cán bộ, công chức, viên chức và người lao động của các cơ quan hành chính, sự nghiệp, tổ chức chính trị, tổ chức chính trị - xã hội và người lao động thuộc khối doanh nghiệp.
(Thiết kế: Khương Hiền).
Đối với cán bộ, công chức, Bộ Nội vụ đề xuất nghỉ Tết Nguyên đán 2026 kéo dài 9 ngày liên tiếp, bao gồm 5 ngày nghỉ Tết và 4 ngày nghỉ hằng tuần.
Trong đó, công chức sẽ được nghỉ 5 ngày theo quy định của Bộ luật Lao động, gồm 1 ngày trước Tết và 4 ngày sau Tết.
Đồng thời, nhóm này được đề xuất nghỉ Tết Nguyên đán năm 2026 từ thứ bảy, ngày 14/2/2026 (tức ngày 27 tháng Chạp, năm Ất Tỵ) đến hết chủ nhật, ngày 22/2/2026 (tức ngày mùng 6 tháng Giêng, năm Bính Ngọ). Như vậy, ngoài 5 ngày nghỉ theo Bộ luật Lao động, cán bộ, công chức nghỉ thêm 4 ngày nghỉ hằng tuần.
Đối với người lao động,căn cứ vào điều kiện thực tế và lịch nghỉ đối với công chức, viên chức, người sử dụng lao động bố trí lịch nghỉ Tết Nguyên đán phù hợp.
Bộ Nội vụ gợi ý doanh nghiệp có thể lựa chọn 1 ngày cuối năm Ất Tỵ và 4 ngày đầu năm Bính Ngọ hoặc 2 ngày cuối năm Ất Tỵ và 3 ngày đầu năm Bính Ngọ hoặc 3 ngày cuối năm Ất Tỵ và 2 ngày đầu năm Bính Ngọ.
Doanh nghiệp cần thông báo phương án nghỉ Tết cho người lao động trước khi thực hiện ít nhất 30 ngày.
Nếu ngày nghỉ hằng tuần trùng với ngày nghỉ lễ, Tết quy định tại khoản 1 Điều 112 của Bộ luật Lao động thì người sử dụng lao động bố trí nghỉ bù ngày nghỉ hằng tuần cho người lao động vào ngày làm việc kế tiếp theo quy định tại khoản 3 Điều 111 Bộ luật Lao động.
Bộ Nội vụ khuyến khích người sử dụng lao động áp dụng thời gian nghỉ Tết Nguyên đán 2026 cho người lao động như phương án đối với công chức, viên chức, đồng thời cũng khuyến khích những thỏa thuận có lợi hơn cho người lao động.
Để có cơ sở đề xuất với Thủ tướng Chính phủ, Bộ Nội vụ đã xây dựng dự thảo phương án đề xuất nghỉ Tết Nguyên đán, nghỉ lễ Quốc khánh năm 2026 đối với cán bộ, công chức, viên chức và người lao động thuộc các cơ quan hành chính, sự nghiệp, tổ chức chính trị, tổ chức chính trị – xã hội, doanh nghiệp.
Phương án này được lấy ý kiến 13 bộ, cơ quan liên quan. Qua tổng hợp, 100% các, bộ, cơ quan gửi ý kiến đều thống nhất với phương án do Bộ Nội vụ đề xuất."
https://dantri.com.vn/noi-vu/lao-dong-qua-dao-tao-co-the-huong-luong-toi-thieu-cao-hon-it-nhat-7-20251015091201889.htm,Lao động qua đào tạo có thể hưởng lương tối thiểu cao hơn ít nhất 7%,"(Dân trí) - Bộ Nội vụ đề xuất lao động làm công việc hoặc chức danh đòi hỏi phải qua học tập, đào tạo nghề sẽ hưởng cao hơn ít nhất 7% so với mức lương tối thiểu.","Theo dự thảo Nghị định quy địnhmức lương tối thiểu, mức lương này được đề xuất tăng 7,2% so với mức hiện hành để áp dụng từ ngày 1/1/2026.
Dự thảo đưa ra các mức lương tối thiểu tháng theo 4 vùng như sau: Vùng I là 5,31 triệu đồng/tháng, vùng II là 4,73 triệu đồng/tháng, vùng III là 4,14 triệu đồng/tháng, vùng IV là 3,7 triệu đồng/tháng.
Mức lương tối thiểu nêu trên tăng 250.000-350.000 đồng (tương ứng tỷ lệ bình quân 7,2%) so với mức lương tối thiểu hiện hành. Mức điều chỉnh lương tối thiểu nêu trên cao hơn khoảng 0,6% so với mức sống tối thiểu của người lao động đến hết năm 2026 để cải thiện đời sống cho người lao động.
Người sử dụng lao động có trách nhiệm tổ chức rà soát lại các thỏa thuận trong hợp đồng lao động, thỏa ước lao động tập thể và các quy chế, quy định của người sử dụng lao động để điều chỉnh, bổ sung cho phù hợp.
Bộ Nội vụ yêu cầu không được xóa bỏ hoặc cắt giảm các chế độ tiền lương khi người lao động làm thêm giờ, làm việc vào ban đêm, chế độ bồi dưỡng bằng hiện vật và các chế độ khác theo quy định của pháp luật lao động.
Đặc biệt, cơ quan soạn thảo cũng đề xuất tiếp tục triển khai các nội dung đã thỏa thuận, cam kết trong hợp đồng lao động, thoả ước lao động tập thể hoặc các thỏa thuận hợp pháp khác có lợi hơn cho người lao động.
Cụ thể là chế độ trả lương cho người lao động làm công việc hoặc chức danh đòi hỏi qua học tập, đào tạo nghề cao hơn ít nhất 7% so với mức lương tối thiểu hay chế độ trả lương cho người lao động làm công việc hoặc chức danh có điều kiện lao động nặng nhọc, độc hại, nguy hiểm cao hơn ít nhất 5%.
Đồng thời, công việc hoặc chức danh có điều kiện lao động đặc biệt nặng nhọc, độc hại, nguy hiểm cao hơn ít nhất 7% so với mức lương của công việc hoặc chức danh có độ phức tạp tương đương, làm việc trong điều kiện lao động bình thường cũng tiếp tục được thực hiện, trừ trường hợp các bên có thỏa thuận khác."
https://dantri.com.vn/noi-vu/lo-trinh-cai-cach-tien-luong-dang-thuc-hien-den-dau-20251012233054485.htm,Lộ trình cải cách tiền lương đang thực hiện đến đâu?,(Dân trí) - Chính phủ đã trình cấp có thẩm quyền lộ trình thực hiện cải cách tiền lương và đang chuẩn bị các điều kiện để triển khai chính sách mới theo Nghị quyết 27 của Trung ương.,"Theo Báo cáo gửi Quốc hội mới đây, Chính phủ cho biết đã triển khai nghiêm túc nội dung được Quốc hội giao tại Nghị quyết 75/2022/QH15, trong đó có việc trình cấp có thẩm quyền lộ trình thực hiện cải cách chính sách tiền lương.
Trên cơ sở đó, Ban Cán sự Đảng Chính phủ đã báo cáo và trình Ban Chấp hành Trung ương xem xét lộ trình cải cách tiền lương đối với cán bộ, công chức, viên chức và lực lượng vũ trang.
Theo đó, lộ trình cải cách tiền lương được xác định gồm các nội dung chính:
- Xây dựng 5 bảng lương mới cho các nhóm đối tượng khác nhau;
- Hoàn thiện chế độ phụ cấp và chế độ tiền thưởng;
- Quy định chế độ nâng bậc lương và nguồn kinh phí thực hiện;
- Quản lý tiền lương và thu nhập gắn với hiệu quả công việc.
Đây là những bước được xác định trong quá trình chuẩn bị triển khai cải cách tiền lương toàn diện theo tinh thần Nghị quyết 27.
Điều chỉnh lương cơ sở từ 1,8 lên 2,34 triệu đồng/tháng
Sau giai đoạn tạm hoãn do ảnh hưởng của dịch Covid-19, chủ trương cải cách tiền lương được Quốc hội cho phép khởi động trở lại từ năm 2023, theo Nghị quyết 101/2023/QH15, với mục tiêu triển khai từ 1/7/2024.
Thực hiện nghị quyết này, Chính phủ đã ban hành các văn bản quy định mức lương cơ sở, phụ cấp và tiền thưởng, trong đó điều chỉnh lương cơ sở từ 1,8 triệu lên 2,34 triệu đồng/tháng.
Lương cơ sở được điều chỉnh từ 1,8 lên 2,34 triệu đồng/tháng (Ảnh minh họa: Tiến Tuấn).
Để triển khai kịp thời, đồng bộ với quy định của Chính phủ, Bộ trưởng Bộ Nội vụ đã ban hành Thông tư hướng dẫn thực hiện mức lương cơ sở đối với các đối tượng hưởng lương, phụ cấp trong các cơ quan, tổ chức, đơn vị sự nghiệp công lập của Đảng, Nhà nước, các tổ chức chính trị – xã hội và hội.
Đồng thời, Bộ cũng hướng dẫn điều chỉnh mức trợ cấp hằng tháng đối với cán bộ xã, phường, thị trấn đã nghỉ việc.
Đặc biệt quan tâm khối viên chức giáo dục
Trong quá trình triển khai chính sách tiền lương, Chính phủ đặc biệt quan tâm đến đội ngũ giáo viên mầm non, tiểu học, nhất là giáo viên công tác tại vùng có điều kiện kinh tế – xã hội đặc biệt khó khăn.
Giáo viên mầm non và tiểu học được hưởng lương cùng các chế độ phụ cấp theo địa bàn hoặc theo công việc đảm nhiệm như đối với viên chức nói chung. Ngoài ra, đội ngũ nhà giáo còn được áp dụng nhiều chính sách ưu đãi riêng, gồm: phụ cấp ưu đãi nhà giáo, phụ cấp thâm niên nghề (được tính đóng và hưởngbảo hiểmxã hội).
Đối với giáo viên công tác tại vùng có điều kiện kinh tế - xã hội đặc biệt khó khăn, Chính phủ quy định thêm một số chế độ hỗ trợ, bao gồm: phụ cấp thu hút, phụ cấp ưu đãi theo nghề (70%), phụ cấp công tác lâu năm ở vùng đặc biệt khó khăn, cùng các khoản trợ cấp một lần như: tiền mua và vận chuyển nước ngọt, nước sạch; trợ cấp khi chuyển công tác ra khỏi vùng đặc biệt khó khăn hoặc khi nghỉ hưu; thanh toán tiền tàu xe; trợ cấp tham quan, học tập, bồi dưỡng chuyên môn, nghiệp vụ; phụ cấp lưu động và phụ cấp dạy tiếng dân tộc thiểu số.
Đáng chú ý, ngày 16/6/2025, Quốc hội đã thông qua Luật Nhà giáo, trong đó một trong những điểm chính sách đáng chú ý là quy định về tiền lương và phụ cấp đối với nhà giáo, theo đó nhà giáo được xếp lương cao nhất trong hệ thống thang bảng lương hành chính sự nghiệp.
Chuẩn bị điều kiện triển khai cải cách tiền lương
Báo cáo của Chính phủ nêu rõ, việc điều chỉnh lương cơ sở, ban hành các văn bản hướng dẫn, xác định lộ trình cải cách là bước chuẩn bị cần thiết cho việc triển khai cải cách tiền lương trên phạm vi toàn quốc khi đủ điều kiện.
Trên cơ sở kết quả đã đạt được, Chính phủ cho biết công tác xây dựng và trình cấp có thẩm quyền lộ trình thực hiện cải cách chính sách tiền lương đã hoàn thành.
Hiện các bước chuẩn bị cần thiết về quy định, hướng dẫn và nguồn lực đã được triển khai, chuyển sang giai đoạn tổ chức thực hiện cải cách tiền lương trong thời gian tới.
Theo tinh thần Nghị quyết 27, cải cách tiền lương là một trong ba đột phá về thể chế, nhằm xây dựng cơ chế trả lương theo vị trí việc làm, chức danh, năng lực và kết quả công tác, thay cho cơ chế bình quân hiện nay.
Chính phủ khẳng định sẽ tiếp tục rà soát, hoàn thiện các quy định về phụ cấp, tiền thưởng và giám sát việc chi trả, bảo đảm việc cải cách tiền lương trở thành động lực nâng cao chất lượng đội ngũ cán bộ, công chức, viên chức, hướng tới nền công vụ chuyên nghiệp, hiệu quả, minh bạch và liêm chính."
https://dantri.com.vn/noi-vu/de-xuat-tang-luong-toi-thieu-72-se-trinh-chinh-phu-trong-thang-10-20251013084941850.htm,"Đề xuất tăng lương tối thiểu 7,2% sẽ trình Chính phủ trong tháng 10","(Dân trí) - Bộ Nội vụ dự kiến trong tháng 10 sẽ trình Chính phủ phương án điều chỉnh mức lương tối thiểu tăng bình quân 7,2% so với hiện tại, áp dụng từ ngày 1/1/2026.","Bộ Nội vụ đã có trả lời ý kiến của cử tri tỉnh Quảng Ngãi gửi đến sau kỳ họp thứ 9, Quốc hội khóa XV.
Cử tri đề nghị Bộ Nội vụ phối hợp với các cơ quan hữu quan xem xét rà soát, sửa đổi và bổ sung các quy định vềbảo hiểmxã hội, tuổi nghỉ hưu, quyền lợi người lao động và tiền lương tối thiểu bảo đảm tương xứng với thực tế phát triển kinh tế - xã hội đất nước.
Về mức lương tối thiểu, Bộ Nội vụ cho biết, theo quy định tại Bộ luật Lao động,mức lương tối thiểulà mức lương thấp nhất được trả cho người lao động làm công việc giản đơn nhất trong điều kiện lao động bình thường, nhằm bảo đảm mức sống tối thiểu của người lao động và gia đình họ, phù hợp với điều kiện phát triển kinh tế - xã hội.
Chính phủ quyết định và công bố mức lương tối thiểu trên cơ sở khuyến nghị của Hội đồng tiền lương quốc gia.
Trên cơ sở báo cáo của Hội đồng tiền lương quốc gia về khuyến nghị phương án lương tối thiểu năm 2026, Bộ Nội vụ đang chủ trì, phối hợp với các bộ, ngành xây dựng dự thảo nghị định quy định mức lương tối thiểu đối với người lao động làm việc theo hợp đồng lao động.
Nội dung này dự kiến trình Chính phủ trong tháng 10 để điều chỉnh mức lương tối thiểu tăng bình quân 7,2% so với mức hiện hành, áp dụng từ ngày 1/1/2026.
Liên quan đến vấn đề tuổi nghỉ hưu, theo Bộ Nội vụ, nội dung này đã được Trung ương thảo luận trong đề án cải cách chính sách bảo hiểm xã hội tại Hội nghị lần thứ bảy Ban Chấp hành Trung ương khóa XII, đồng thời thống nhất thông qua tại Nghị quyết 28 về cải cách chính sách bảo hiểm xã hội.
Thể chế hóa chủ trương tăng tuổi nghỉ hưu tại Nghị quyết 28, Quốc hội đã thống nhất ban hành Bộ luật Lao động năm 2019, trong đó nội dung tuổi nghỉ hưu, điều kiện về tuổi hưởng lương hưu đã được quy định tại điều 169 và điều 219.
Trong quá trình nghiên cứu, xây dựng Bộ luật Lao động 2019, vấn đề tuổi nghỉ hưu đã được trao đổi, thảo luận và đánh giá một cách kỹ lưỡng, tổng thể các mặt có liên quan.
Chính vì vậy, Bộ luật Lao động quy định việc điều chỉnh tăng tuổi nghỉ hưu không thực hiện tăng ngay lên 62 tuổi đối với nam và 60 tuổi đối với nữ. Việc điều chỉnh tăng tuổi nghỉ hưu sẽ được triển khai có lộ trình cụ thể.
Theo đó, mỗi năm chỉ tăng thêm 3 tháng đối với lao động nam và 4 tháng đối với lao động nữ cho đến khi đủ 62 tuổi đối với lao động nam vào năm 2028, và đủ 60 tuổi đối với lao động nữ vào năm 2035.
Đối với người lao động bị suy giảm khả năng lao động; làm nghề, công việc đặc biệt nặng nhọc, độc hại, nguy hiểm; làm nghề, công việc nặng nhọc, độc hại, nguy hiểm.
Làm việc ở vùng có điều kiện kinh tế - xã hội đặc biệt khó khăn có thể nghỉ hưu ở tuổi thấp hơn so với tuổi nghỉ hưu của người lao động trong điều kiện lao động bình thường.
Chính vì vậy, Luật Bảo hiểm xã hội 2024 kế thừa, đảm bảo tính thống nhất về tuổi nghỉ hưu đã được quy định tại Bộ luật Lao động."
