url,title,description,content
https://dantri.com.vn/noi-vu/thong-bao-chi-tiet-lich-nghi-tet-nguyen-dan-nghi-quoc-khanh-nam-2026-20251017101724917.htm,"Thông báo chi tiết lịch nghỉ Tết Nguyên đán, nghỉ Quốc khánh năm 2026","(Dân trí) - Bộ Nội vụ vừa thông báo về việc nghỉ Tết Nguyên đán, nghỉ lễ Quốc khánh năm 2026 đối với cán bộ, công chức, viên chức và người lao động. 2 kỳ nghỉ lớn nhất trong năm đều có số ngày nghỉ ở mức kỷ lục.","Thực hiện ý kiến chỉ đạo của Thủ tướng Chính phủ Phạm Minh Chính, Bộ trưởng Bộ Nội vụ thông báo đến các cơ quan hành chính, sự nghiệp, tổ chức chính trị, tổ chức chính trị - xã hội, doanh nghiệp và những người sử dụng lao động khác lịchnghỉ Tết Nguyên đán, nghỉ lễ Quốc khánh năm 2026.
Cụ thể, cán bộ, công chức, viên chức và người lao động của các cơ quan hành chính, sự nghiệp, tổ chức chính trị, tổ chức chính trị - xã hội được nghỉ Tết Nguyên đán 2026 5 ngày theo quy định, gồm 1 ngày trước Tết và 4 ngày sau Tết.
Như vậy, kỳ nghỉ Tết chính thức bắt đầu từ thứ hai ngày 16/2/2026 (tức ngày 29 tháng Chạp năm Ất Tỵ) đến hết thứ sáu, ngày 20/2/2026 (tức ngày mùng 4 tháng Giêng năm Bính Ngọ).
Cùng với 5 ngày nghỉ Tết, cán bộ, công chức được nghỉ nối tiếp 4 ngày nghỉ hằng tuần. Khối cơ quan khu vực công có kỳ nghỉ tới 9 ngày liên tiếp.
Lịch nghỉ Tết Nguyên đán 2026 (Thiết kế: Khương Hiền).
Bộ Nội vụ cho biết, các cơ quan, đơn vị thực hiện lịch nghỉ Tết Nguyên đán, nghỉ lễ Quốc khánh năm 2026 bố trí, sắp xếp các bộ phận ứng trực theo quy định và làm việc hợp lý để giải quyết công việc liên tục, đảm bảo tốt công tác phục vụ tổ chức, người dân.
Trong đó, Bộ này lưu ý cử cán bộ, công chức ứng trực xử lý những công việc đột xuất, bất ngờ có thể xảy ra trong thời gian nghỉ lễ, tết theo quy định.
Các bộ, cơ quan, địa phương có kế hoạch, biện pháp cụ thể, phù hợp khuyến khích các đơn vị, doanh nghiệp, tổ chức, cá nhân tích cực, chủ động triển khai thực hiện các biện pháp phát triển sản xuất, kinh doanh, các hoạt động kinh tế, xã hội.
Nội dung này nhằm bảo đảm cung cầu hàng hóa, dịch vụ, ổn định giá cả, thị trường, góp phần thúc đẩy tăng trưởng kinh tế, thực hành tiết kiệm, chống lãng phí trong thời gian trước, trong và sau dịp nghỉ Tết Nguyên đán, nghỉ lễ Quốc khánh năm 2026.
Các cơ quan, đơn vị không thực hiện lịch nghỉ cố định thứ bảy và chủ nhật hằng tuần thì căn cứ vào chương trình, kế hoạch cụ thể của đơn vị để bố trí lịch nghỉ cho phù hợp, theo đúng quy định của pháp luật.
Đối với người lao động, người sử dụng lao động khu vực ngoài công lập, đơn vị quyết định lựa chọn phương án nghỉ Tết Nguyên đán như sau: Lựa chọn nghỉ 1 ngày cuối năm Ất Tỵ và 4 ngày đầu năm Bính Ngọ hoặc 2 ngày cuối năm Ất Tỵ và 3 ngày đầu năm Bính Ngọ hoặc 3 ngày cuối năm Ất Tỵ và 2 ngày đầu năm Bính Ngọ.
Các đơn vị thông báo phương án nghỉ Tết năm 2026 cho người lao động trước khi thực hiện ít nhất 30 ngày.
Nếu ngày nghỉ hằng tuần trùng với ngày nghỉ lễ, tết quy định tại khoản 1 Điều 112 của Bộ luật Lao động thì người lao động được nghỉ bù ngày nghỉ hằng tuần vào ngày làm việc kế tiếp theo quy định tại khoản 3 Điều 111 Bộ luật Lao động.
Bộ Nội vụ khuyến khích người sử dụng lao động áp dụng thời gian nghỉ tết Âm lịch, nghỉ lễ Quốc khánh năm 2026 cho người lao động như quy định đối với công chức, viên chức. Nhà nước cũng khuyến khích những thỏa thuận có lợi hơn cho người lao động.
Với dịp lễ Quốc khánh, công chức, viên chức được nghỉ 2 ngày theo quy định, gồm ngày 2/9/2026 và 1 ngày liền kề trước là ngày 1/9/2026. Cả nước cũng thực hiện hoán đổi từ ngày làm việc thứ hai, ngày 31/8/2026, sang ngày nghỉ hằng tuần thứ bảy, ngày 22/8/2026 (nghỉ thứ hai, ngày 31/8/2026, và làm bù vào thứ bảy, ngày 22/8/2026).
Như vậy, cùng với ngày nghỉ hằng tuần và nghỉ lễ, cán bộ, công chức được nghỉ 5 ngày liên tiếp dịp này.
Với người lao động khu vực doanh nghiệp, dịp lễ Quốc khánh sẽ được nghỉ thứ tư ngày 2/9/2026 và lựa chọn nghỉ 1 trong 2 ngày: thứ ba, ngày 1/9/2026, hoặc thứ năm, ngày 3/9/2026."
https://dantri.com.vn/noi-vu/biet-phai-46-can-bo-so-nganh-ve-ho-tro-cap-xa-20251017082231410.htm,"Biệt phái 46 cán bộ sở, ngành về hỗ trợ cấp xã","(Dân trí) - Tỉnh Quảng Ngãi đã biệt phái 46 công chức, viên chức của các sở, ngành về một số xã, phường để hỗ trợ công tác chuyên môn.","Ngày 17/10, thông tin từ Văn phòng UBND tỉnh Quảng Ngãi, 8 sở, ngành của tỉnh này đã biệt phái 46 công chức, viên chức về các xã, phường để hỗ trợ công tác chuyên môn. Việc này nhằm tháo gỡ một số khó khăn, vướng mắc khi thực hiện chính quyền địa phương 2 cấp.
Sở Y tế có 22 công chức, viên chức được biệt phái về hỗ trợ các xã, phường.
Sở Nông nghiệp và Môi trường biệt phái 9 người, Sở Xây dựng 5 người, Sở Nội vụ 4 người, Văn phòng UBND tỉnh và Thanh tra tỉnh mỗi đơn vị 2 người.
Sở Dân tộc và Tôn giáo, Sở Giáo dục và Đào tạo mỗi đơn vị biệt phái 1 người.
Sự hỗ trợ của công chức, viên chức từ các sở, ngành giúp hoạt động chuyên môn của cấp xã đạt kết quả tốt hơn (Ảnh: Quốc Triều).
Cùng với biệt phái công chức, viên chức về cơ sở, nhiều sở, ngành của tỉnh còn ban hành kế hoạch triển khai, tổ chức các hội nghị trực tuyến, công bố đường dây nóng, thành lập các nhóm Zalo để kịp thời hỗ trợ, hướng dẫn chuyên môn, nghiệp vụ cho cấp xã.
Liên quan đến công tác này, Ban Thường vụ Tỉnh ủy Quảng Ngãi cũng yêu cầu các sở, ngành ưu tiên biệt phái cán bộ, công chức về những địa phương có đề nghị hỗ trợ, địa phương có công trình trọng điểm quốc gia hoặc của tỉnh.
Tỉnh Quảng Ngãi và Kon Tum sáp nhập lấy tên là tỉnh Quảng Ngãi. Tỉnh Quảng Ngãi mới có diện tích hơn 14.800km2, dân số 2,16 triệu người, 96 đơn vị hành chính cấp xã."
https://dantri.com.vn/noi-vu/dong-nai-yeu-cau-khan-truong-so-hoa-ho-so-giai-quyet-thu-tuc-hanh-chinh-20251016164429778.htm,Đồng Nai yêu cầu khẩn trương số hóa hồ sơ giải quyết thủ tục hành chính,"(Dân trí) - Theo rà soát của UBND tỉnh Đồng Nai, trên hệ thống thông tin giải quyết thủ tục hành chính của tỉnh hiện có 4.300 hồ sơ thủ tục chưa thực hiện số hóa kết quả giải quyết.","Phó Chủ tịch UBND tỉnh Đồng Nai Lê Trường Sơn vừa ký văn bản gửi lãnh đạo sở, ban, ngành, địa phương về việc khẩn trương rà soát số hóa hồ sơ, kết quả giải quyết thủ tục hành chính.
Theo đó, qua rà soát kết quả thực hiện số hóa hồ sơ thủ tục hành chính từ ngày 1/7 đến ngày 14/10, trên hệ thống thông tin giải quyết thủ tục hành chính của tỉnh hiện có 4.300 hồ sơ thủ tục chưa thực hiện việc số hóa kết quả giải quyết.
Phó Chủ tịch UBND tỉnh Đồng Nai chỉ đạo các sở, ban, ngành địa phương khẩn trương tập trung rà soát việc số hóa hồ sơ, kết quả giải quyết thủ tục hành chính trên hệ thống; bảo đảm việc cấp kết quả giải quyết thủ tục hành chính điện tử, hồ sơ được số hóa đúng, đầy đủ thành phần và thực hiện theo Thông tư số 01 của Văn phòng Chính phủ.
Đồng thời, các đơn vị phải thường xuyên rà soát các hồ sơ thủ tục hành chính đã được xử lý. Trường hợp hồ sơ chưa được số hóa, số hóa thiếu hoặc chưa đúng, chưa đủ thành phần theo quy định, các đơn vị cần thực hiện số hóa bổ sung ngay, nhằm đảm bảo tính chính xác và đầy đủ về mặt dữ liệu. Kết quả thực hiện phải được hoàn thành trong tháng 10.
Phó Chủ tịch UBND tỉnh Đồng Nai nêu rõ, mục tiêu hướng đến là đảm bảo kết quả số hóa hồ sơ; tạo cơ sở tái sử dụng dữ liệu; tăng tính minh bạch trong quá trình tiếp nhận, xử lý hồ sơ; nâng cao chất lượng phục vụ người dân, doanh nghiệp trong thực hiện thủ tục hành chính, dịch vụ công trực tuyến."
https://dantri.com.vn/noi-vu/quy-dinh-moi-ve-so-luong-cap-pho-tai-phong-chuyen-mon-thuoc-ubnd-xa-20251016162552747.htm,Quy định mới về số lượng cấp phó tại phòng chuyên môn thuộc UBND xã,"(Dân trí) - Mỗi phòng chuyên môn và trung tâm phục vụ hành chính công cấp xã chỉ có bình quân 2 cấp phó; việc bố trí thêm phải trong giới hạn cho phép, bảo đảm tinh gọn và hiệu quả quản lý.","Mới đây, Chính phủ ban hành Nghị quyết quy định về số lượng cấp phó của phòng chuyên môn, đơn vị tương đương và trung tâm phục vụ hành chính công thuộc UBND cấp xã (gồm xã, phường, đặc khu thuộc tỉnh, thành phố trực thuộc Trung ương).
Theo quy định mới, các phòng chuyên môn, đơn vị tương đương và trung tâm phục vụ hành chính công cấp xã được bố trí bình quân 2 cấp phó.
Lãnh đạo trung tâm phục vụ hành chính công cấp xã gồm giám đốc và phó giám đốc. Phó chủ tịch UBND cấp xã không kiêm giám đốc trung tâm phục vụ hành chính công cấp xã. Phó giám đốc được xác định là tương đương phó trưởng phòng thuộc UBND cấp xã.
Nghị quyết giao UBND cấp xã quyết định cụ thể số lượng cấp phó của từng phòng, trung tâm trong phạm vi quản lý, nhưng không được vượt quá tổng số lượng cấp phó đã được cấp có thẩm quyền phê duyệt.
Việc ban hành Nghị quyết dựa trên đề nghị của Bộ trưởng Bộ Nội vụ, căn cứ theo Luật Tổ chức Chính phủ, Luật Tổ chức chính quyền địa phương, và đặc biệt là Kết luận số 187-KL/TW ngày 29/8/2025 của Bộ Chính trị, Ban Bí thư về định hướng số lượng cấp phó trong hệ thống chính trị.
Nghị quyết này có hiệu lực thi hành kể từ ngày ký ban hành (15/10/2025).
Theo Nghị định 150/2025/NĐ-CP ngày 12/6/2025, các phòng chuyên môn được tổ chức ở cấp xã gồm:
Văn phòng HĐND và UBND: Tham mưu, giúp UBND cấp xã quản lý các lĩnh vực văn phòng, tư pháp, đối ngoại.
Phòng kinh tế (đối với xã, đặc khu) hoặc Phòng kinh tế, Hạ tầng và Đô thị (đối với phường và đặc khu Phú Quốc): Phụ trách tài chính - kế hoạch, xây dựng, công thương, nông nghiệp và môi trường.
Phòng văn hóa - xã hội: Quản lý các lĩnh vực nội vụ, giáo dục – đào tạo, văn hóa, khoa học – thông tin và y tế.
Theo Nghị định 118/2025/NĐ-CP (hiệu lực từ 1/7/2025), UBND cấp xã được quyết định thành lập Trung tâm phục vụ hành chính công là tổ chức hành chính trực thuộc, có con dấu và tài khoản riêng. Trung tâm được bố trí điểm tiếp nhận và trả kết quả thủ tục hành chính phù hợp với diện tích, dân số và điều kiện kinh tế - xã hội của từng địa phương."
https://dantri.com.vn/noi-vu/bo-noi-vu-dinh-huong-tang-them-cac-vi-tri-viec-lam-cho-cap-xa-20251016154432802.htm,Bộ Nội vụ định hướng tăng thêm các vị trí việc làm cho cấp xã,"(Dân trí) - Để bảo đảm đội ngũ công chức cấp xã đáp ứng yêu cầu vận hành hiệu quả của mô hình chính quyền địa phương 2 cấp, Bộ Nội vụ vừa ban hành định hướng bổ sung một số vị trí việc làm cho cấp này.","Bộ Nội vụ vừa có công văn về việc định hướng bổ sung một sốvị trí việc làmở cấp xã.
Theo đó, để bảo đảm nhân sự tại cấp xã đáp ứng yêu cầu tổ chức chính quyền địa phương 2 cấp vận hành hiệu quả, thông suốt, Bộ Nội vụ đã có công văn 7415/BNV-CCVC về định hướng danh mục vị trí việc làm tại cấp xã.
Bộ Nội vụ cho biết, qua kiến nghị của một số địa phương, căn cứ quy định pháp luật liên quan, Bộ định hướng bổ sung vị trí việc làm tại UBND xã. Việc này cũng căn cứ đảm bảo phù hợp với khung biên chế công chức cấp xã theo quy định của cấp có thẩm quyền.
Cụ thể, Bộ Nội vụ định hướng vềvị trí việc làm chuyên viên giúp việc các ban của HĐND. Theo đó, vị trí này bố trí tại văn phòng HĐND và UBND cấp xã, thực hiện nhiệm vụ chuyên trách tham mưu, giúp việc cho HĐND, các ban của HĐND cấp xã theo quy định của pháp luật.
Căn cứ theo yêu cầu nhiệm vụ, UBND xã chủ động xác định yêu cầu về chuyên ngành đào tạo của công chức để bố trí cho phù hợp, bảo đảm thực hiện tốt các nhiệm vụ được giao.
Liên quan đếnvị trí việc làm kế toán trưởng hoặc phụ trách kế toán và vị trí việc làm kế toán viên, Bộ Nội vụ định hướng sẽ bố trí tại các phòng chuyên môn và trung tâm phục vụ hành chính công thuộc UBND xã được xác định là đơn vị kế toán, đơn vị dự toán ngân sách theo hướng dẫn của Bộ Tài chính.
Việc xác định nhiệm vụ và khung năng lực của vị trí việc làm kế toán trưởng hoặc phụ trách kế toán, vị trí việc làm kế toán viên thực hiện tương ứng theo vị trí việc làm kế toán trưởng hoặc phụ trách kế toán, vị trí việc làm kế toán viên thuộc danh mục vị trí việc làm công chức nghiệp vụ chuyên môn dùng chung lĩnh vực kế hoạch, tài chính trong cơ quan, tổ chức hành chính quy định tại Thông tư 12/2022/TT-BNV (sửa đổi, bổ sung tại Thông tư 06/2024/TT-BNV).
Trước đó, Bộ Nội vụ đã định hướng 36 vị trí việc làm ở cấp xã, gồm: 8 vị trí lãnh đạo, quản lý, trong đó có chánh văn phòng, phó chánh văn phòng HĐND và UBND, trưởng phòng, phó trưởng phòng, giám đốc, phó giám đốc trung tâm phục vụ hành chính công, chỉ huy trưởng, phó chỉ huy trưởng Ban chỉ huy quân sự xã.
28 vị trí chuyên môn, nghiệp vụ trải rộng ở các lĩnh vực: Văn phòng, tư pháp, đối ngoại, tài chính - kế hoạch, xây dựng – công thương, nông nghiệp – môi trường, nội vụ, giáo dục và đào tạo, văn hóa, khoa học và thông tin, y tế, trung tâm phục vụ hành chính công, dân quân tự vệ...
Theo Nghị quyết 316/NQ-CP phiên họp Chính phủ thường kỳ tháng 9 và Hội nghị trực tuyến Chính phủ với địa phương, Chính phủ yêu cầu kịp thời tháo gỡ khó khăn, khắc phục những bất cập, mâu thuẫn, chồng chéo trong các quy định liên quan đến hoạt động của bộ máy mới, nhất là cấp cơ sở.
Bên cạnh đó, Chính phủ cũng giao UBND cấp tỉnh, cấp xã bám sát các văn bản chỉ đạo, định hướng của Ban Chỉ đạo thực hiện sắp xếp, tổ chức lại đơn vị hành chính các cấp và xây dựng mô hình chính quyền địa phương 2 cấp; các văn bản hướng dẫn của Bộ Nội vụ và căn cứ điều kiện cụ thể, thực tế để sắp xếp, bố trí cán bộ, công chức, viên chức.
Việc sắp xếp này bảo đảm bố trí đủ ở cấp cơ sở nhằm thực hiện hiệu quả chức năng, nhiệm vụ được giao, đáp ứng yêu cầu quản lý nhà nước trên địa bàn, góp phần nâng cao hiệu lực, hiệu quả hoạt động của chính quyền địa phương 2 cấp."
https://dantri.com.vn/noi-vu/tay-ninh-chi-tra-xong-hon-3700-ty-dong-che-do-cho-can-bo-nghi-viec-20251016172034153.htm,Tây Ninh chi trả xong hơn 3.700 tỷ đồng chế độ cho cán bộ nghỉ việc,"(Dân trí) - Tây Ninh đã hoàn tất việc chi trả hơn 3.700 tỷ đồng cho 3.295 cán bộ, công chức, viên chức và người lao động nghỉ việc theo Nghị định 178.","Ngày 16/10, Sở Nội vụ tỉnh Tây Ninh có báo cáo gửi Bộ Nội vụ và Bộ Tài chính về kết quả thực hiện chính sách chi trả chế độ cho các đối tượng nghỉ việc theo Nghị định 178/2024/NĐ-CP và Nghị định 67/2025/NĐ-CP của Chính phủ.
Theo báo cáo, đến ngày 30/8, UBND tỉnh đã phê duyệt 3.295 trường hợp nghỉ việc với tổng số tiền chi trả 3.758 tỷ đồng. Đến hết ngày 9/10, toàn bộ trường hợp này đã được chi trả đầy đủ, đạt 100%.
Tây Ninh hoàn tất việc chi trả hơn 3.700 tỷ đồng chế độ, chính sách cho 3.295 cán bộ (Ảnh: Huỳnh Phong).
Việc chi trả được thực hiện đúng quy định, kịp thời, bảo đảm quyền lợi cho cán bộ, công chức, viên chức và người lao động thuộc diện hưởng chính sách. Sở Nội vụ phối hợp chặt chẽ với Sở Tài chính cùng các cơ quan, đơn vị liên quan rà soát, thẩm định và giải ngân nguồn kinh phí bảo đảm tiến độ, minh bạch.
Công tác triển khai chính sách được đánh giá nghiêm túc, đúng tinh thần chỉ đạo của Bộ Chính trị và hướng dẫn của Bộ Nội vụ, góp phần ổn định tổ chức bộ máy, tạo điều kiện cho các cơ quan, đơn vị sắp xếp tinh gọn, hoạt động hiệu quả hơn."
