url,title,description,content
https://dantri.com.vn/the-gioi/nga-chuan-bi-cho-phuong-an-co-the-noi-lai-thu-vu-khi-hat-nhan-20251109070909575.htm,Nga chuẩn bị cho phương án có thể nối lại thử vũ khí hạt nhân,(Dân trí) - Nga tiết lộ đang vạch ra kế hoạch nhằm thực hiện một vụ thử hạt nhân theo chỉ đạo của Tổng thống Vladimir Putin.,"Ngoại trưởng Nga Sergei Lavrov (Ảnh: Reuters).
Ngoại trưởng Nga Sergei Lavrov ngày 8/11 cho biết công tác chuẩn bị theo chỉ thị của Tổng thống Vladimir Putin về việc xây dựng các đề xuất cho khả năng tiến hành một vụ thử hạt nhân của Nga đang được triển khai, hãng thông tấn nhà nước Tass đưa tin.
Theo Tass, ông Lavrov nói: “Về chỉ thị của Tổng thống Vladimir Putin tại cuộc họp Hội đồng An ninh ngày 5/11, chỉ thị đó đã được tiếp nhận để thực hiện và đang được tiến hành. Công chúng sẽ được thông báo về kết quả sau đó"".
Mệnh lệnh của nhà lãnh đạo Nga được đưa ra để đáp lại chỉ thị bất ngờ của Tổng thống Donald Trump vào tuần trước rằng Mỹ sẽ nối lại các vụ thử hạt nhân.
Tass cũng dẫn lời ông Lavrov cho biết Nga chưa nhận được bất kỳ sự làm rõ nào từ phía Mỹ liên quan đến chỉ thị của ông Trump.
“Hiện chưa rõ liệu điều này có liên quan đến các vụ thử phương tiện mang đầu đạn hạt nhân hay… các vụ nổ không tạo ra phản ứng hạt nhân"", ông nói, đồng thời cho biết các phát biểu công khai từ giới chức Mỹ cho đến nay cho thấy họ “chưa có sự thống nhất quan điểm” về chính sách của mình.
Tuần trước, ông Trump cho rằng Mỹ là “quốc gia duy nhất không tiến hành thử nghiệm hạt nhân. Sau đó, Tổng thống Mỹ cáo buộc Nga và Trung Quốc đang tiến hành các vụ nổ hạt nhân “bí mật”, điều mà cả Moscow lẫn Bắc Kinh đều phủ nhận.
Điện Kremlin đã phản ứng trước diễn biến này bằng tuyên bố rằng Nga sẽ “hành động tương ứng” nếu bất kỳ quốc gia nào từ bỏ lệnh hoãn thử nghiệm hạt nhân. Kremlin cũng nói rằng Moscow đang chờ đợi sự làm rõ từ Washington về vấn đề này.
Ngoài ra, Bộ trưởng Năng lượng Mỹ Chris Wright nói với Fox News rằng các cuộc thử nghiệm sẽ không bao gồm các vụ nổ hạt nhân hoàn chỉnh mà có thể chỉ gồm các vụ nổ không tới hạn (thử nghiệm kỹ thuật, không gây nổ hạt nhân thật). Ông Trump sau đó tiếp tục khẳng định kế hoạch khởi động lại thử nghiệm hạt nhân, đồng thời nói rằng ông có thể đang xây dựng một kế hoạch phi hạt nhân hóa chung với Nga và Trung Quốc.
Bộ trưởng Quốc phòng Nga Andrey Belousov tuần này cho biết Moscow sẽ phải chuẩn bị cho các vụ thử hạt nhân quy mô đầy đủ nhằm đáp trả thông báo của Mỹ. Tổng thống Vladimir Putin tái khẳng định rằng Nga sẽ tuân thủ Hiệp ước Cấm Thử hạt nhân Toàn diện, miễn là các quốc gia ký kết khác cũng làm như vậy.
Ông Putin cũng đã ra lệnh cho tất cả các cơ quan chính phủ liên quan, bao gồm Bộ Ngoại giao và Bộ Quốc phòng, thu thập và phân tích toàn bộ thông tin cần thiết về kế hoạch của Mỹ để chuẩn bị cho một phản ứng phù hợp.
Quan hệ Nga - Mỹ đã nóng lên trong vài tuần qua, khi ông Trump, thất vọng vì thiếu tiến triển trong việc chấm dứt chiến sự ở Ukraine, đã tạm hoãn hội nghị thượng đỉnh dự kiến với ông Putin và áp đặt các biện pháp trừng phạt Nga lần đầu tiên kể từ khi ông trở lại Nhà Trắng vào tháng 1."
https://dantri.com.vn/the-gioi/nga-tan-cong-lon-chua-tung-co-loat-nha-may-dien-ukraine-sap-nguon-20251109063509296.htm,"Nga tấn công lớn chưa từng có, loạt nhà máy điện Ukraine sập nguồn",(Dân trí) - Tất cả các nhà máy nhiệt điện (TPP) do tập đoàn năng lượng nhà nước Ukraine Centrenergo vận hành đều ngừng hoạt động sau “cuộc tấn công lớn nhất từ trước đến nay của Nga” vào toàn bộ hệ thống này.,"Một nhà máy nhiệt điện của Ukraine hư hại sau một cuộc tập kích của Nga (Ảnh minh họa: AFP).
Theo Centrenergo, chính những nhà máy nhiệt điện từng được khôi phục sau các cuộc tấn công trong năm 2024 lại tiếp tục bị tập kích, khi nhiều máy bay không người lái của Nga tấn công “mỗi phút” vào rạng sáng 8/11.
Ukraine cho biết, Không quân nước này đã bắn hạ 406 trong tổng số 458 máy bay không người lái, bao gồm loại máy bay không người lái tấn công Shahed, mà Nga phóng đi trong đêm. Ngoài ra, Ukraine cũng bắn hạ 9 trong số 45 tên lửa hành trình và tên lửa đạn đạo.
Centrenergo vận hành 3 nhà máy nhiệt điện, cũng đồng thời là gần như toàn bộ tài sản của công ty: Nhà máy Trypillia ở tỉnh Kiev, Zmiivska ở tỉnh Kharkov, và Vuhlehirska ở tỉnh Donetsk.
Mùa xuân năm ngoái, Centrenergo thông báo nhà máy nhiệt điện Zmiivska đã bị phá huỷ hoàn toàn. Ngày 25/7/2022, lực lượng Nga giành quyền kiểm soát nhà máy nhiệt điện Vuhlehirska.
Theo thông báo của tập đoàn, cuộc tấn công mới nhất đã phá huỷ toàn bộ phần công suất được khôi phục, khiến các nhà máy không còn phát điện.
“Vì lý do an toàn, chúng tôi đã giữ im lặng, nhưng chúng tôi đã làm mọi điều có thể để đảm bảo người dân Ukraine vượt qua mùa đông vừa rồi với điện và sưởi ấm, vượt qua những thử thách kinh hoàng để thành công bước vào mùa sưởi hiện tại. Chưa đầy một tháng kể từ cuộc tấn công trước, và đêm qua, Nga lại tấn công đồng thời vào toàn bộ cơ sở phát điện của chúng tôi”, Centrenergo nói.
Suốt mùa thu, Nga đã tăng cường tấn công cơ sở hạ tầng năng lượng của Ukraine nhằm đẩy Ukraine vào một mùa đông khắc nghiệt nữa. Một trong những đợt tấn công tồi tệ nhất xảy ra vào ngày 3/10 và 5/10 đã xoá sổ khoảng 60% các cơ sở sản xuất khí đốt của Ukraine.
Trong cuộc tấn công ngày 8/11, Nga chủ yếu nhắm vào các thành phố Kremenchuk thuộc tỉnh Poltava, Kiev, Dnipro, Kharkov và Chernihiv, gây ra tình trạng cắt điện khẩn cấp ở một số vùng.
“Có một số lượng tên lửa chưa từng có và vô số máy bay không người lái tấn công vào chính những nhà máy nhiệt điện đã được xây dựng lại sau cuộc tấn công tàn phá năm 2024. Chúng tôi đã dừng hoạt động. Sản lượng điện hiện tại bằng 0. Bằng 0! Mọi thứ chúng tôi xây dựng lại bằng công việc suốt ngày đêm đã bị xoá sổ. Hoàn toàn!”, Centrenergo cho biết.
Centrenergo nói rằng họ sẽ sửa chữa, tái thiết và tích hợp các năng lực phát điện mới.
Theo người phát ngôn Không quân Ukraine Yuri Ihnat, quân đội Nga tiếp tục tiến hành các đòn tấn công quy mô lớn vào cơ sở hạ tầng trọng yếu của Ukraine, ngày càng sử dụng nhiều tên lửa đạn đạo hơn.
Nói về cuộc tập kích mới nhất của Nga, ông cho biết, hướng tấn công chính là các tỉnh Dnipropetrovsk, Kiev và Poltava, dù các vùng khác cũng chịu thiệt hại.
Ông lưu ý một đặc điểm nổi bật của cuộc tấn công này là việc sử dụng ồ ạt tên lửa đạn đạo. Ông cho biết, năm nay, Nga đã tăng đáng kể tỷ lệ phóng tên lửa đạn đạo so với tên lửa hành trình, tập trung vào ưu thế tốc độ và khó bị đánh chặn.
Ngoài ra, Nga còn sử dụng tên lửa hành trình, gồm loại phóng từ biển và từ đất liền, và triển khai ồ ạt máy bay không người lái tấn công."
https://dantri.com.vn/the-gioi/tong-thong-putin-thay-thu-truong-quoc-phong-20251109060445579.htm,Tổng thống Putin thay Thứ trưởng Quốc phòng,(Dân trí) - Tổng thống Nga Vladimir Putin bổ nhiệm Thượng tướng Aleksandr Sanchik làm Thứ trưởng Bộ Quốc phòng thay tướng Andrey Bulyga.,"Thứ trưởng Quốc phòng mới của Nga Aleksandr Sanchik (Ảnh: TASS).
Theo một sắc lệnh được ban hành hôm 8/11, Tổng thống Nga Vladimir Putin đã bổ nhiệm Thượng tướng Aleksandr Sanchik làm Thứ trưởng Quốc phòng mới.
Ông Sanchik có kinh nghiệm chiến đấu dày dặn, từng chỉ huy các nhóm lực lượng liên hợp Đông và Nam của Nga trong cuộc xung đột Ukraine.
Vị tướng được trao nhiều huân chương này cũng tham chiến trong chiến dịch chống khủng bố của Nga tại Syria năm 2015, cuộc chiến Nga - Gruzia năm 2008, và các chiến dịch chống nhóm phiến quân cực đoan ở Bắc Caucasus.
Nhóm lực lượng liên hợp Nam đang hoạt động tích cực tại Donetsk, miền Đông Ukraine, nơi lực lượng này gần đây đã bao vây cứ điểm trọng yếu Krasnoarmeysk do Ukraine kiểm soát.
Ông Aleksandr Sanchik sẽ thay thế Thượng tướng Andrey Bulyga, người được bổ nhiệm làm Phó Thư ký Hội đồng An ninh Quốc gia.
Ông Bulyga được miễn nhiệm khỏi vai trò Thứ trưởng Quốc phòng Nga, chức vụ mà ông nắm giữ từ tháng 3 năm ngoái. Trước đó, ông Bulyga từng là Phó Tư lệnh Quân khu miền Tây của Nga phụ trách hậu cần.
Ông Bulyga sẽ phục vụ với tư cách cấp phó của Thư ký Hội đồng An ninh Nga Sergey Shoigu."
https://dantri.com.vn/the-gioi/vai-tang-hinh-giup-binh-si-nga-luon-sau-dot-kich-hau-tuyen-ukraine-20251108210005017.htm,"""Vải tàng hình"" giúp binh sĩ Nga luồn sâu, đột kích hậu tuyến Ukraine","(Dân trí) - Khi Nga đổi chiến thuật xâm nhập vào phòng tuyến của Ukraine, binh sĩ nước này đã dựa vào một trang bị đặc biệt, loại vải có khả năng ""tàng hình"" trước camera tầm nhiệt.","Binh sĩ trùm ""vải tàng hình"" (Ảnh: Forbes).
Một trang phục bảo hộ đang dần trở nên thiết yếu với binh sĩ Nga: Không phải áo giáp, mà là “áo choàng tàng hình”, giúp che chắn trước camera hồng ngoại.
Đây thực sự là vật dụng không thể thiếu cho bất cứ ai muốn vượt qua “vùng xám” rộng lớn được UAV giám sát. Dù nó không thể che giấu hoàn toàn dấu vết nhiệt, nhưng nó đã giúp binh sĩ Nga luồn sâu đột kích Ukraine trong thời gian qua.
Ban đầu, các nỗ lực tiến công của Nga tuân theo học thuyết tác chiến phối hợp truyền thống với sự kết hợp giữa xe tăng và xe chở quân bọc thép. Tuy nhiên, sự bùng nổ của UAV FPV nhanh chóng khiến cho những vũ khí hạng nặng này giảm uy lực.
Để đối phó với thực tế đã thay đổi, Nga chuyển sang chiến thuật đột kích bằng nhóm nhỏ.
Báo cáo về chiến thuật mới của Nga do tổ chức Anh RUSI công bố tháng trước mô tả: “Binh sĩ Nga thường xâm nhập theo nhóm từ 2-5 người, sử dụng tấm chắn nhiệt... và đèn pin giữa hai chân để quan sát”.
Khi lực lượng đủ lớn được tập hợp sau phòng tuyến Ukraine, họ sẽ đồng loạt tiến công các vị trí của đối phương.
Volodymyr Demchenko, một binh sĩ Ukraine, cho biết: “Chiến thuật tiến công mới: Xâm nhập dưới áo choàng chống camera hồng ngoại nhiều ngày. Thức ăn và nước uống được UAV thả xuống. Mỗi đêm binh sĩ Nga di chuyển vài chục, có khi hàng trăm mét. Có khoảng 2-5 binh sĩ mỗi nhóm"".
Hoạt động giám sát bằng UAV đang trở nên phổ biến. Bất kỳ chuyển động nào của phương tiện đều bị phát hiện từ xa. Lính bộ binh thì khó bị phát hiện hơn. Thời điểm tốt nhất để di chuyển là ban đêm, khi xâm nhập chỉ bị phát hiện qua cảm biến nhiệt.
""Vải tàng hình"" của Nga thường làm từ nylon với lớp phản quang ngăn nhiệt cơ thể thoát ra, có thể phủ thêm nhôm hoặc hạt bạc để tản nhiệt nhanh hơn. Ý tưởng là làm cơ thể gần với nhiệt độ nền và hòa lẫn vào môi trường, tránh nổi bật như “đèn báo sáng” trên địa hình. Một số loại được mô tả có thể giảm 90% bức xạ nhiệt.
Nga cũng dùng tấm ngăn nhiệt thông thường để che lều hoặc vị trí làm nơi trú ẩn. Mục tiêu là luôn được che chắn cơ thể người hoặc vật cần bảo vệ.
Tuy nhiên, chỉ một chiếc áo tàng hình hiếm khi đủ. Để không bị phát hiện, việc xâm nhập phải chọn thời điểm “giao nhiệt”, khi mọi vật từ thực vật, đất, nước nóng lên và nguội đi ở tốc độ khác nhau, tạo ra sự tương phản nhiệt. Nga thường chọn tiến công trong sương mù, mưa hoặc điều kiện có thể dẫn tới việc giảm khả năng quan sát.
Cho dù tấm vải tàng hình không phải phương án hiệu quả 100% nhưng Nga đang tìm cách tận dụng chúng một cách hiệu quả nhất có thể để có thể luồn sâu vào phòng tuyến đối phương.
Việc Ukraine thiếu quân số giữ phòng tuyến đang khiến họ lộ ra các khe hở. Nga sẽ tìm cách xâm nhập vào những khe hở này cho đến khi tập hợp đủ lực lượng tiến công, và đột kích để buộc Ukraine rút lui.
Biện pháp phòng thủ tốt nhất chống xâm nhập là bố trí nhiều bãi mìn, cảm biến khác (âm thanh, từ trường, địa chấn) và tăng lực lượng giữ tiền tuyến."
https://dantri.com.vn/the-gioi/nga-ukraine-giao-tranh-khoc-liet-o-pokrovsk-20251106054635170.htm,"Nga, Ukraine giao tranh khốc liệt ở Pokrovsk","(Dân trí) - Nga tuyên bố lực lượng của họ đang tiến lên phía bắc phần trung tâm của Pokrovsk, trong khi quân đội Ukraine nói họ đang chiến đấu quyết liệt để ngăn thành phố thất thủ.","Nga, Ukraine giao tranh khốc liệt ở Pokrovsk (Ảnh: NBC).
Kiev trong tuần này thừa nhận binh sĩ của họ đang ở trong tình thế khó khăn tại thành phố Pokrovsk chiến lược thuộc tỉnh Donetsk, nơi từng là một trung tâm hậu cần và vận chuyển quan trọng của quân đội Ukraine và cũng là nơi Nga tìm cách kiểm soát hơn một năm qua.
Nga coi thành phố này là cánh cổng để họ tiến tới kiểm soát phần lãnh thổ còn lại khoảng 5.000km² của vùng công nghiệp Donbass, miền Đông Ukraine, một trong những mục tiêu then chốt của họ trong cuộc chiến gần 4 năm qua.
Bộ Quốc phòng Nga nói 2 nhóm tấn công của họ đang loại bỏ các binh sĩ Ukraine bị bao vây trong một số quận của thành phố và tiếp tục chiến dịch tiến công, phát triển lên phía bắc. Nga cũng vô hiệu hóa các nỗ lực của Ukraine nhằm phá vòng vây.
Tuy nhiên, quân đội Ukraine bác bỏ việc binh sĩ của họ bị bao vây ở Pokrovsk, nói rằng lực lượng Kiev đang cố gắng ngăn binh sĩ Nga đào công sự, đồng thời tìm cách đảm bảo và bảo vệ các tuyến hậu cần trong khu vực rộng hơn.
“Các biện pháp đang được thực hiện nhằm chặn bước tiến của đối phương, lực lượng đang tìm cách xâm nhập và tập kết trong thành phố Pokrovsk. Các biện pháp đối phó chủ động đang được thực hiện để chống lại nỗ lực của các nhóm bộ binh đối phương nhằm giành chỗ đứng”, Bộ Tổng tham mưu Ukraine cho biết.
Quân đội Ukraine hôm qua tuyên bố, các binh sĩ thuộc Trung đoàn Xung kích Độc lập số 425 đã tiến hành một chiến dịch truy quét trong tòa nhà Hội đồng thành phố ở Pokrovsk và kéo lá cờ Ukraine lên trên đó.
Chiến dịch có sự tham gia của Tiểu đoàn Xung kích số 210 và số 1, và được thực hiện theo từng giai đoạn.
Hai nhóm xung kích xuất phát cho chiến dịch vào ban đêm. Dù một phương tiện bị trúng đạn, họ đã tiến vào thành phố và loại bỏ binh sĩ Nga trên đường tới tòa nhà.
Trung đoàn cho biết, vẫn còn binh sĩ Nga trong thành phố, nhưng các nhóm này đang bị loại bỏ.
Tổng thống Ukraine Volodymyr Zelensky hồi đầu tuần thừa nhận khu vực quanh Pokrovsk vẫn chịu áp lực nặng nề, nhưng lực lượng Nga đã không đạt được tiến triển nào trong ngày qua, và chỉ còn khoảng 60 người tại thành phố Kupiansk.
Trong khi đó, Bộ Quốc phòng Nga cho rằng ông Zelensky không nắm được tình hình, hoặc ông đang cố che giấu tình trạng tồi tệ của lực lượng Ukraine.
Theo Bộ Quốc phòng Nga, các đơn vị Ukraine đang bị mắc kẹt trong các “vạc dầu” ở cả 2 địa điểm và tình thế của họ đang xấu đi nhanh chóng khi lực lượng Nga tiến lên, “không để lại cơ hội nào cho binh sĩ Ukraine cứu mình ngoài việc đầu hàng tự nguyện”.
Moscow nói rằng việc chiếm Pokrovsk sẽ cho họ một bàn đạp để tiến lên phía bắc, hướng tới 2 thành phố lớn nhất còn do Ukraine kiểm soát ở Donetsk: Kramatorsk và Sloviansk. Điều đó sẽ mang lại cho Moscow thắng lợi lãnh thổ quan trọng nhất bên trong Ukraine kể từ khi họ chiếm được thành phố Avdiivka vào đầu năm 2024.
Không giống với các mũi tấn công trực diện dùng ở các thành phố khác, Nga đã sử dụng chiến thuật gọng kìm để gần như bao vây lực lượng Ukraine ở cả Pokrovsk lẫn Kupiansk, trong khi các đơn vị nhỏ, cơ động cao và máy bay không người lái phá rối hậu cần và gieo hỗn loạn phía sau chiến tuyến của Ukraine.
Chiến thuật của Nga ở cả hai nơi đã tạo ra cái mà các nhà quan sátquân sựNga gọi là “vùng xám”, nơi không bên nào kiểm soát hoàn toàn, nhưng cực kỳ khó để Ukraine phòng thủ.
Các bản đồ chiến trường nguồn mở cho thấy lực lượng Nga chỉ cách vài km nữa là hoàn tất bao vây Pokrovsk, nơi Nga gọi là Krasnoarmeysk, và kiểm soát một phần đáng kể Kupiansk, nơi họ đang tiến trên trục đường chính dẫn vào thành phố.
Pokrovsk, một trung tâm đường bộ và đường sắt ở vùng Donetsk. Thành phố có dân số khoảng 60.000 người trước xung đột, nhưng hầu hết người dân đã di tản, toàn bộ trẻ em đã được sơ tán và chỉ còn rất ít dân thường giữa những tòa căn hộ bị phá hủy và những con đường đầy hố bom.
Ngoài nỗ lực kiểm soát toàn bộ Donbass, Nga cũng đang đạt các bước tiến dần dần tại các vùng Kharkov và Dnipropetrovsk. Quân đội Nga nói họ hiện kiểm soát hơn 19% lãnh thổ Ukraine, tương đương khoảng 116.000km².
Bản đồ của Ukraine cũng cho thấy Nga kiểm soát khoảng 19% lãnh thổ Ukraine, tăng khoảng 1% so với vị trí của Moscow 2 năm trước."
