url,title,description,content
https://dantri.com.vn/the-gioi/tong-thong-putin-ra-lenh-khan-khi-my-tinh-noi-lai-thu-vu-khi-hat-nhan-20251105215950831.htm,Tổng thống Putin ra lệnh khẩn khi Mỹ tính nối lại thử vũ khí hạt nhân,(Dân trí) - Tổng thống Nga Vladimir Putin lệnh cho các quan chức cấp cao soạn thảo đề xuất về thử vũ khí hạt nhân sau khi Mỹ để ngỏ khả năng thực hiện các vụ thử này.,"Tổng thống Nga Vladimir Putin chủ trì cuộc họp với các thành viên Hội đồng An ninh tại Moscow ngày 5/11 (Ảnh: Reuters).
Tại cuộc họp nội các vào ngày 5/11, Bộ trưởng Quốc phòng Nga Andrey Belousov tuyên bố Moscow phải chuẩn bị tiến hành các vụ thử hạt nhân quy mô lớn để đáp trả kế hoạch tái khởi động các vụ thử vũ khí hạt nhân của Mỹ.
Ông Belousov nói với Tổng thống Nga Vladimir Putin tại cuộc họp rằng, Moscow ""phải đáp trả các động thái của Washington nhằm đảm bảo an ninh cho Nga”. Quan chức Nga tuyên bố Moscow phải hành động ngay lập tức.
“Việc bắt đầu chuẩn bị ngay lập tức cho các vụ thử hạt nhân quy mô lớn là điều cần thiết”, Bộ trưởng Quốc phòng Nga nhấn mạnh.
Tổng thống Putin nhắc lại rằng Nga từ lâu đã tuyên bố sẽ tuân thủ Hiệp ước Cấm Thử Hạt nhân Toàn diện, miễn là các thành viên khác không vi phạm thỏa thuận.
""Nếu Mỹ hoặc các quốc gia thành viên khác của hiệp ước tiến hành các vụ thử như vậy, thì Nga cũng sẽ thực hiện các biện pháp đáp trả tương xứng”, Tổng thống Putin tuyên bố.
Tổng thống Putin tiếp tục chỉ đạo tất cả các cơ quan chính phủ có liên quan, bao gồm Bộ Ngoại giao và Bộ Quốc phòng Nga, thu thập và phân tích thông tin cần thiết về kế hoạch tái khởi động các vụ thử hạt nhân của Mỹ, trước khi đệ trình các đề xuất về ""khả năng bắt đầu chuẩn bị cho các vụ thử vũ khí hạt nhân"" của Nga.
""Tôi chỉ thị cho Bộ Ngoại giao, Bộ Quốc phòng... các cơ quan đặc biệt và các cơ quan dân sự liên quan làm mọi cách có thể để thu thập thêm thông tin về vấn đề này, phân tích tại Hội đồng An ninh và đưa ra các đề xuất thống nhất về khả năng bắt đầu công tác chuẩn bị cho các vụ thử vũ khí hạt nhân"", Tổng thống Putin phát biểu.
Tổng thống Putin cho rằng tuyên bố của Tổng thống Trump về việc nối lại các vụ thử vũ khí hạt nhân là “vấn đề nghiêm trọng”.
Tuần trước, ngay trước cuộc gặp Chủ tịch Trung Quốc Tập Cận Bình tại Hàn Quốc, Tổng thống Trump cho biết ông đã ra lệnh cho quân đội nối lại thử nghiệm hạt nhân ngay lập tức “trên cơ sở ngang bằng”, khởi động lại quy trình thử nghiệm vũ khí hạt nhân sau 33 năm tạm ngừng, bởi vì “những quốc gia khác cũng đang làm” như vậy.
Tổng thống Trump sau đó nói rằng việc ông chỉ thị quân đội lập tức tiến hành các vụ thử hạt nhân diễn ra sau khi ông nhận ra Mỹ không thể là quốc gia duy nhất không thực hiện thử nghiệm, dù đang nắm trong tay kho vũ khí khổng lồ.
“Chúng ta có nhiều vũ khí hạt nhân hơn bất kỳ quốc gia nào khác. Và tôi nghĩ chúng ta nên làm điều gì đó về giải trừ hạt nhân. Tôi đã thảo luận điều đó với cả Tổng thống Nga Vladimir Putin và Chủ tịch Trung Quốc Tập Cận Bình. Nga có rất nhiều vũ khí hạt nhân, và Trung Quốc sẽ có rất nhiều”, ông Trump nói.
Tổng thống Trump nhấn mạnh, ông không muốn Mỹ là quốc gia duy nhất không thử vũ khí của mình.
Quyết định của ông Trump được đưa ra trong bối cảnh Nga thông báo thử nghiệm tên lửa hạt nhân “tầm bắn không giới hạn” Burevestnik. Tuy nhiên, Điện Kremlin khẳng định đây không phải một vụ thử hạt nhân, đồng thời cảnh báo sẽ hành động tương tự nếu Washington tiến hành nổ thử hạt nhân.
Lần cuối cùng Mỹ tiến hành thử nghiệm hạt nhân là vào tháng 9/1992 trong khuôn khổ “Chiến dịch Julin”. Chiến dịch này gồm 7 vụ thử hạt nhân và là những vụ thử cuối cùng trước khi bắt đầu đàm phán về Hiệp ước Cấm Thử Hạt nhân Toàn diện (CTBT).
CTBT là một thỏa thuận quốc tế cấm mọi vụ nổ hạt nhân cho cả mục đích dân sự lẫn quân sự. Hiệp ước được ký bởi tổng cộng 187 quốc gia, bao gồm Trung Quốc, Ấn Độ, Pakistan, Triều Tiên, Israel và cả Nga.
Tuy nhiên, hiệp ước này chỉ được phê chuẩn và thực thi bởi 178 quốc gia. Mỹ là quốc gia ký kết hiệp ước, nhưng chưa phê chuẩn.
Sau tuyên bố của Tổng thống Trump, người phát ngôn Điện Kremlin Dmitry Peskov cho biết Nga vẫn chờ ""lời giải thích rõ ràng từ phía Mỹ"" về phát ngôn của ông Trump.
Theo thống kê tính đến đầu năm 2025, Nga và Mỹ là 2 cường quốc vũ khí hạt nhân hàng đầu thế giới. Hai nước duy trì sự ngang bằng hạt nhân, khi mỗi bên sở hữu khoảng 4.000-5.000 đầu đạn. Ngoài ra, một số quốc gia khác cũng sở hữu vũ khí hạt nhân, nhưng số lượng thấp hơn đáng kể so với Mỹ và Nga."
https://dantri.com.vn/the-gioi/di-san-cua-cuu-pho-tong-thong-quyen-luc-nhat-nuoc-my-dick-cheney-20251105092759371.htm,Di sản của cựu Phó Tổng thống quyền lực nhất nước Mỹ Dick Cheney,"(Dân trí) - Dưới thời Tổng thống George W. Bush, ông Dick Cheney không chỉ là “người dự bị” theo truyền thống, mà trở thành cố vấn thân cận nhất có ảnh hưởng sâu sắc đến mọi khía cạnh của chính sách.","Cựu Phó Tổng thống Mỹ Dick Cheney (Ảnh: AFP).
Cựu Phó Tổng thống Mỹ Richard Bruce Cheney, hay còn được biết đến với cái tên Dick Cheney, một trong những nhân vật có ảnh hưởng sâu sắc nhất đến chính trường Mỹ, đã qua đời vào tối ngày 3/11 (theo giờ địa phương) ở tuổi 84.
Gia đình ông cho biết trong một thông báo chính thức rằng ông qua đời do những biến chứng từ bệnh viêm phổi kết hợp với các vấn đề tim mạch. “Ông là một người đàn ông vĩ đại, nhân hậu, người đã truyền cảm hứng cho con cháu yêu nước, sống can đảm, danh dự và đầy yêu thương”, thông báo của gia đình viết.
Sự ra đi của ông Cheney đánh dấu kết thúc của một chương sử quan trọng trong lịch sử chính trị Mỹ, nơi ông không chỉ là một cố vấn thân cận mà còn là kiến trúc sư của nhiều chính sách then chốt, định hình lại vai trò của Phó Tổng thống và củng cố sức mạnh của nhánh hành pháp.
Tuy nhiên, ông Cheney cũng bị chỉ trích vì vai trò trong việc ủng hộ mạnh mẽ chiến dịchquân sựcủa Mỹ tại Iraq năm 2003.
Hành trình sự nghiệp
Sinh ra vào năm 1941 tại Lincoln, Nebraska, trong gia đình trung lưu với người cha làm nhân viên bảo tồn cho chính phủ, Cheney lớn lên ở vùng đất miền Tây nước Mỹ hoang dã và đầy thử thách. Tuổi trẻ của ông không phải lúc nào cũng suôn sẻ, ông từng gặp khó khăn ở Đại học Yale và làm việc như một thợ điện tại Wyoming, tiểu bang mà sau này trở thành quê hương thứ hai của ông.
Tuy nhiên, chính những trải nghiệm ấy đã rèn luyện cho ông Cheney. Ông kết hôn với người bạn thời trung học, Lynn Vincent, sinh hai con gái và hoàn thành bằng cử nhân tại Đại học Wyoming trước khi theo đuổi chương trình sau đại học tại Đại học Wisconsin. Những năm tháng ấy không chỉ xây dựng nền tảng cá nhân mà còn khơi dậy niềm đam mê với chính trị và dịch vụ công, dẫn dắt ông bước chân vào hành lang quyền lực của Washington D.C.
Ông Cheney bắt đầu sự nghiệp chính trị một cách khiêm tốn nhưng đầy tham vọng năm 1969, với vai trò thực tập sinh tại Quốc hội. Cùng năm đó, ông có cơ hội làm việc bên cạnh Donald Rumsfeld - nhân vật sẽ trở thành đồng minh lâu năm trong văn phòng kinh tế tại Nhà Trắng dưới thời Tổng thống Richard Nixon.
Những bước đi đầu tiên này đặt nền móng cho sự thăng tiến nhanh chóng của ông. Đến năm 1974, khi Tổng thống Gerald Ford lên nắm quyền sau sự ra đi của ông Nixon, ông Cheney trở lại Nhà Trắng, trải qua nhiều vị trí. Ở tuổi 34, ông được bổ nhiệm làm Chánh văn phòng Nhà Trắng, vị trí trẻ nhất trong lịch sử Mỹ lúc bấy giờ. Vai trò này không chỉ chứng tỏ khả năng lãnh đạo của ông Cheney mà còn cho phép ông tiếp cận trực tiếp với các quyết định cốt lõi của chính phủ, từ kinh tế đến an ninh quốc gia.
Năm 1978 đánh dấu bước ngoặt khác trong sự nghiệp của ông Cheney khi ông tranh cử và thắng cử vào Hạ viện đại diện từ Wyoming. Trong thập kỷ tiếp theo, ông Cheney phục vụ như một nghị sĩ tận tụy, tập trung vào các vấn đề năng lượng,môi trườngvà quốc phòng. Ông không chỉ là tiếng nói của miền Tây mà còn trở thành nhà lập pháp có ảnh hưởng, tham gia vào các ủy ban then chốt và xây dựng mạng lưới quan hệ rộng lớn ở Quốc hội. Sự nghiệp lập pháp của ông kết thúc năm 1989 khi Tổng thống George H.W. Bush đề cử ông làm Bộ trưởng Quốc phòng - vị trí mà ông Cheney sẽ biến thành bệ phóng cho tương lai.
Là Bộ trưởng Quốc phòng giai đoạn 1989-1993, ông Cheney lãnh đạo Bộ Quốc phòng Mỹ qua một giai đoạn chuyển mình lịch sử: sự sụp đổ của Bức tường Berlin và kết thúc Chiến tranh Lạnh (1991). Ông tái cấu trúc lực lượng vũ trang, cắt giảm chi phí không cần thiết trong khi duy trì sức mạnh răn đe của Mỹ. Điểm nhấn của nhiệm kỳ này là vai trò chỉ huy Chiến tranh Vùng Vịnh - mật danh “Chiến dịch Bão táp Sa mạc” - năm 1991 nhằm giải phóng Kuwait
Sinh thời, ông Cheney có ảnh hưởng mạnh mẽ tới các chính sách của chính quyền Tổng thống George W. Bush (Ảnh: AFP).
Sau khi rời Lầu Năm Góc năm 1993, ông Cheney không nghỉ hưu mà chuyển sang lĩnh vực tư nhân, đảm nhận vị trí CEO của Halliburton - tập đoàn dịch vụ năng lượng hàng đầu thế giới. Trong 6 năm tại đây, từ 1995-2000, ông dẫn dắt công ty mở rộng toàn cầu, tăng doanh thu gấp đôi, củng cố vị thế của Mỹ trong ngành dầu khí. Vai trò này không chỉ mang lại cho ông Cheney kinh nghiệm quản lýdoanh nghiệpquy mô lớn mà còn sâu sắc hóa hiểu biết của ông về năng lượng như trụ cột an ninh quốc gia. Theo NPR, thời kỳ tại Halliburton giúp ông Cheney phát triển tầm nhìn toàn diện về kinh tế toàn cầu, chuẩn bị cho ông vai trò cố vấn kinh tế trong chính quyền sau này.
Năm 2000, sự nghiệp của ông Cheney có ngã rẽ khi ông được George W. Bush chọn làm ứng cử viên phó tổng thống. Ban đầu, ông Cheney dẫn dắt quá trình tìm kiếm người đồng hành tranh cử cho ông Bush, nhưng cuối cùng chính ông được chọn, quyết định mà ông Bush sau này mô tả là “lựa chọn sáng suốt nhất của chiến dịch”.
Chiến thắng của ông Bush năm 2000 và tái đắc cử 2004 đã đưa ông Cheney vào vị trí Phó Tổng thống, nơi ông tái định nghĩa chức vụ này một cách triệt để.
Dưới thời Tổng thống George W. Bush, ông Cheney không chỉ là “người dự bị” theo truyền thống mà trở thành cố vấn thân cận nhất, ảnh hưởng sâu sắc đến mọi khía cạnh của chính sách. Ông được công nhận rộng rãi là Phó Tổng thống quyền lực nhất trong lịch sử Mỹ, với văn phòng lớn hơn bất kỳ người tiền nhiệm nào và quyền tiếp cận trực tiếp đến các quyết định cốt lõi.
Theo chuyên gia Joel Goldstein, ông Cheney biến chức vụ Phó Tổng thống thành một vị trí quyền lực thực sự, nơi ông có thể định hình chính sách mà không bị ràng buộc bởi các rào cản truyền thống. Đặc biệt, sau sự kiện khủng bố 11/9/2001, ông Cheney đã đóng vai trò then chốt trong phối hợp phản ứng quốc gia.
Khi đó, từ hầm trú ẩn dưới Nhà Trắng, ông hướng dẫn các biện pháp đảm bảo an ninh, gồm việc hỗ trợ Tổng thống Bush di chuyển an toàn và kích hoạt kế hoạch kế thừa quyền lực. Sự lãnh đạo bình tĩnh của ông trong giờ phút khủng hoảng được khen ngợi bởi các nhà phân tích an ninh, như cựu Giám đốc CIA Michael Hayden, nhận xét: “Ông Cheney hiểu rõ rằng an ninh quốc gia đòi hỏi sự quyết đoán và ông đã cung cấp chính điều đó cho chính quyền Bush”.
Di sản tranh cãi
Ông Cheney và phu nhân Lynne trong một bức ảnh chụp năm 2000 (Ảnh: AFP).
Một trong những đóng góp lớn nhất của ông Cheney là củng cố quyền lực hành pháp. Ông ủng hộ mạnh mẽ việc mở rộng thẩm quyền của tổng thống trong lĩnh vực an ninh quốc gia, lập luận rằng trongthế giớihậu 9/11, Mỹ cần một lãnh đạo linh hoạt để đối phó các mối đe dọa mới nổi. Các chính sách do ông đồng thiết kế như tăng cường giám sát tình báo, hợp tác quốc tế chống khủng bố, giúp Mỹ xây dựng khung pháp lý vững chắc hơn cho các hoạt động tình báo.
Theo Foreign Affairs, ông Cheney khôi phục sự cân bằng quyền lực nghiêng về hành pháp, đảm bảo tổng thống có công cụ cần thiết để bảo vệ dân chúng mà không bị cản trở bởi thủ tục quan liêu. Hơn nữa, ông Cheney đã thúc đẩy các sáng kiến năng lượng, nhấn mạnh vào việc đa dạng hóa nguồn cung để giảm phụ thuộc vào dầu mỏ nước ngoài - một di sản vẫn còn ảnh hưởng đến chính sách năng lượng Mỹ ngày nay.
Trong lĩnh vực đối ngoại, ông Cheney thường xuyên đại diện cho Mỹ tại các diễn đàn quốc tế. Ông góp phần xây dựng liên minh rộng lớn chống khủng bố, hợp tác chặt chẽ với NATO và các đối tác châu Á. Các chuyến công du của ông đến Trung Đông và châu Âu củng cố vị thế lãnh đạo của Mỹ, theo đánh giá từ Viện Nghiên cứu Chiến lược Quốc tế (IISS). Giáo sư John Mearsheimer từ Đại học Chicago từng viết: “Ông Cheney hiểu rõ sức mạnh của ngoại giao cứng rắn kết hợp với liên minh, ông áp dụng điều đó để duy trì bá quyền Mỹ trong thế giới đa cực”.
Tuy nhiên, ông Cheney cũng gây tranh cãi mạnh mẽ khi ủng hộ hành động quân sự của Mỹ chống lại Iraq vào năm 2003. Ông là người đóng vai trò thúc đẩy cuộc chiến, với cáo buộc của Mỹ rằng ""Iraq tàng trữ vũ khí hủy diệt hàng loạt"". Tuy nhiên, không vũ khí nguy hiểm nào như vậy được tìm thấy, khiến chính quyền Mỹ khi đó bị thế giới chỉ trích dữ dội.
Những năm cuối đời
Sau khi rời nhiệm sở năm 2009, ông Cheney tiếp tục là tiếng nói có trọng lượng trong chính trường Mỹ. Ông viết hồi ký “In My Time” (2011), cuốn sách bán chạy chia sẻ những bài học từ sự nghiệp, nhấn mạnh vào tầm quan trọng của lãnh đạo quyết đoán.
Ông Cheney cũng tham gia các hoạt động từ thiện xã hội, hỗ trợ các cựu chiến binh và các chương trình giáo dục về lịch sử nước Mỹ.
Di sản của ông Cheney là chủ đề được các học giả quốc tế phân tích. Ông đã tái định hình chức vụ Phó Tổng thống từ vị trí ít quan trọng thành một trung tâm quyền lực thực thụ, mở đường cho các Phó Tổng thống sau này như Joe Biden, Kamala Harris có vai trò tích cực hơn.
Ngoài ra, ông Cheney cũng để lại dấu ấn trong thúc đẩy giá trị bảo thủ: niềm tin vào chủ nghĩa tự do kinh tế, an ninh biên giới và sức mạnh quân sự. Ông Cheney được xem là nhà tư tưởng thực tiễn, người giúp đảng Cộng hòa định hướng lại sau Chiến tranh Lạnh, tập trung vào các mối đe dọa mới. Di sản cá nhân của ông còn thể hiện qua gia đình: hai con gái, gồm Liz Cheney - cựu nghị sĩ và nhà phê bình nổi bật, tiếp tục theo đuổi sự nghiệp công.
Những năm cuối đời, ông Cheney đã gây bất ngờ khi không ủng hộ người cùng đảng Cộng hòa là ông Donald Trump trong trong chiến dịch tranh cử tổng thống năm 2024, mà thay vào đó ủng hộ ứng viên đảng Dân chủ Kamala Harris."
https://dantri.com.vn/the-gioi/ukraine-tung-chien-thuat-linh-hoat-pha-gong-kim-nga-quanh-phao-dai-donbass-20251102081200775.htm,"Ukraine tung chiến thuật linh hoạt, phá gọng kìm Nga quanh pháo đài Donbass",(Dân trí) - Lực lượng Ukraine đang sử dụng các chiến thuật nhằm giữ vững phòng tuyến Pokrovsk trước đà tiến công dồn dập của Nga.,"Binh sĩ Ukraine ở Pokrovsk (Ảnh: Getty).
Quân đoàn Phản ứng nhanh số 7 thuộc Lực lượng Tấn công Đường không Ukraine cho biết quân đội Ukraine đã cải thiện vị trí chiến thuật tại một số khu vực ở Pokrovsk thuộc tỉnh Donetsk.
Tuyên bố của quân đoàn Ukraine cho biết tính đến 15h ngày 1/11, tình hình tại Pokrovsk vẫn còn khó khăn và thay đổi nhanh chóng.
""Nhờ các hoạt động đối phó thành công, quân đội Ukraine đã cải thiện được tình hình chiến thuật tại một số quận của thành phố”, quân đoàn 7 nhận định.
Quân đội Ukraine cũng đang mở rộng số lượng nhóm tấn công ở Pokrovsk bằng cách sử dụng nhiều phương pháp đa dạng để di chuyển nhân lực. Đồng thời, lực lượng Ukraine đang nỗ lực ngăn chặn các tuyến hậu cần của Nga và cuối cùng là cắt đứt hoàn toàn.
“Chúng tôi đang tăng cường số lượng các nhóm tấn công tại Pokrovsk, sử dụng các phương pháp điều động nhân lực đa dạng. Đồng thời, quân đội Ukraine đang nghiên cứu các giải pháp nhằm ngăn chặn hậu cần của đối phương và sau đó cắt đứt các tuyến hậu cần này”, lực lượng Ukraine cho biết thêm.
Theo quân đoàn 7, lực lượng phòng vệ Ukraine đã thực hiện thành công cuộc đổ bộ tại khu vực Pokrovsk. Quân đoàn Ukraine thừa nhận đây là một chiến dịch phức tạp, đòi hỏi sự phối hợp hành động đồng bộ của nhiều đơn vị thuộc lực lượng phòng vệ. Các điều kiện cần thiết phải được tạo ra để đảm bảo an toàn cho máy bay và cho phép binh sĩ đổ bộ dưới sự đe dọa trực tiếp của đối phương.
“Các đơn vị phòng không, tác chiến điện tử, tìnhbáo điện tửvà hệ thống không người lái đã được triển khai trong khu vực hoạt động của Quân đoàn Phản ứng Nhanh số 7 thuộc Lực lượng Tấn công Đường không Ukraine để đảm bảo hoàn thành nhiệm vụ”, quân đoàn Ukraine cho biết thêm.
Theo quân đoàn 7, lực lượng Nga đang bị kiểm soát hỏa lực và số thương vong của Nga tại Pokrovsk đang dần tăng lên. Trong tuần qua, 85 binh sĩ Nga đã thiệt mạng tại thành phố này.
Moscow hiện chưa lên tiếng về thông tin trên.
Chuyên giaquân sựNga Vitaly Kiselyov nhận định quân đội Ukraine có thể sẽ sử dụng các tòa nhà dân cư để củng cố khả năng phòng thủ tại Pokrovsk.
""Ngay cả hiện nay, họ (quân đội Ukraine) vẫn chưa xây dựng các công sự mới ở Pokrovsk để quân đội tiếp tục rút lui - một chiến thuật rút lui về hậu phương"", ông Kiselyov lưu ý.
Theo chuyên gia Kiselyov, ban đầu Kiev không có kế hoạch từ bỏ Pokrovsk và đây là lý do lực lượng Ukraine không tăng cường phòng thủ.
Vị trí Pokrovsk trên bản đồ (Ảnh: Sky).
Tổng tư lệnh Lực lượng Vũ trang Ukraine Oleksandr Syrskyi ngày 1/11 tuyên bố không có tình trạng bao vây hay phong tỏa nào đối với khu vực Pokrovsk hay Myrnohrad.
Ông Syrskyi cũng cho biết một chiến dịch phức tạp đang được tiến hành nhằm đẩy lùi lực lượng Nga tại Pokrovsk, với sự tham gia của Lực lượng Tác chiến Đặc biệt, Cơ quan An ninh Ukraine và Cơ quan Tình báo Quốc phòng Ukraine (DIU).
Reuters dẫn nguồn tin cho biết, lực lượng đặc nhiệm DIU đã được triển khai đến Pokrovsk vào đầu tuần này trong bối cảnh giao tranh ác liệt, với mục đích ổn định tình hình. Theo nguồn tin, chiến dịch này do Giám đốc DIU Kyrylo Budanov trực tiếp chỉ huy.
Một nguồn tin tình báo quân sự nói với trang tin Ukrainska Pravda rằng DIU đang tiến hành các biện pháp ổn định tình hình tại Pokrovsk.
Ukraine tuyên bố triển khai lực lượng đặc nhiệm đến Pokrovsk đầu tuần này, sử dụng trực thăng Black Hawk.
Trong khi đó, Bộ Quốc phòng Nga thông báo, lực lượng Nga đã loại bỏ một nhóm đặc nhiệm Ukraine được điều gấp đến thành phố Pokrovsk, trong nỗ lực ngăn lực lượng Nga tiến sâu hơn vào thành phố.
Nga đặt mục tiêu kiểm soát toàn bộ khu vực Donbass, bao gồm hai tỉnh Lugansk và Donetsk. Ukraine hiện vẫn giữ khoảng 10% diện tích Donbass, tức khoảng 5.000km², nằm ở phía tây tỉnh Donetsk.
Nga đã sử dụng chiến thuật gọng kìm để gần như bao vây hoàn toàn Pokrovsk và đe dọa tuyến tiếp tế của Ukraine, đồng thời tung các đơn vị nhỏ và máy bay không người lái vào tập kích hậu tuyến, gây rối loạn hệ thống hậu cần của đối phương.
Việc giành được Pokrovsk, nơi truyền thông Nga gọi là “cánh cổng tiến vào Donetsk”, cùng với Kostiantynivka ở phía đông bắc - nơi Nga cũng đang tìm cách bao vây - sẽ giúp Moscow có bàn đạp để tiến về phía bắc, hướng tới hai thành phố lớn còn do Ukraine kiểm soát ở Donetsk: Kramatorsk và Sloviansk.
Giành được Pokrovsk sẽ là chiến thắng quan trọng nhất của Nga tại Ukraine kể từ khi Moscow kiểm soát thị trấn đổ nát Avdiivka vào đầu năm 2024 sau một trong những trận chiến khốc liệt nhất từ đầu cuộc xung đột."
