url,title,description,content
https://dantri.com.vn/noi-vu/sap-xep-thon-to-dan-pho-tren-toan-quoc-trong-quy-iv2025-20251018172429365.htm,"Sắp xếp thôn, tổ dân phố trên toàn quốc trong quý IV/2025","(Dân trí) - Trung ương sẽ phối hợp các địa phương triển khai sắp xếp thôn, tổ dân phố và người hoạt động không chuyên trách trong quý IV/2025, đảm bảo tinh gọn, phù hợp yêu cầu tình hình mới.","Sắp xếp đơn vị sự nghiệp, thôn, tổ dân phố ngay trong năm 2025
Tại Dự thảo Báo cáo chính trị của Ban Chấp hành Trung ương Đảng khóa XIII tại Đại hội đại biểu toàn quốc lần thứ XIV của Đảng đang được lấy ý kiến nhân dân, Trung ương giao Đảng uỷ Quốc hội và Đảng uỷ Chính phủ chủ trì, phối hợp các tỉnh uỷ, thành uỷ triển khai việc sắp xếp các đơn vị sự nghiệp công lập, trường học, cơ sở giáo dục, cơ sở y tế, doanh nghiệp nhà nước theo đúng định hướng; bảo đảm tổ chức phù hợp từng ngành, lĩnh vực, địa bàn và quan tâm các vùng khó khăn, miền núi, vùng sâu, vùng xa. Thời gian thực hiện trong quý IV/2025.
Cùng thời gian này, việc sắp xếp các thôn, tổ dân phố ở xã, phường và người hoạt động không chuyên trách tại thôn, tổ dân phố sẽ được triển khai đồng bộ, nhằm đáp ứng yêu cầu trong tình hình mới, gắn với mục tiêu tinh gọn, hiệu lực, hiệu quả ở cơ sở.
Trước đó, Bộ Nội vụ đã có công văn gửi UBND các tỉnh, thành phố trực thuộc Trung ương đề nghị khẩn trương tổng kết, đánh giá việc thực hiện các quy định về tổ chức, hoạt động của thôn, tổ dân phố và chế độ, chính sách đối với người hoạt động không chuyên trách. Báo cáo sẽ là căn cứ để xây dựng dự thảo Nghị định của Chính phủ trong năm 2025.
Theo yêu cầu của Bộ Nội vụ, các địa phương phải khái quát tình hình tổ chức và hoạt động của thôn, tổ dân phố gắn với sắp xếp đơn vị hành chính và mô hình chính quyền địa phương hai cấp.
Sẽ triển khai việc sắp xếp thôn, tổ dân phố trong năm 2025 (Ảnh: Mạnh Quân).
Tính đến cuối năm 2021, cả nước có 90.508 thôn, tổ dân phố, trong đó 69.580 thôn và 20.928 tổ dân phố. Giai đoạn 2019-2021, cả nước đã tinh giản, sáp nhập hơn 15.000 thôn, tổ dân phố, đưa tổng số còn khoảng 90.500 đơn vị.
Tuy nhiên, nhiều thôn, tổ dân phố vẫn còn bất cập về dân số, diện tích hoặc đặc thù miền núi, hải đảo. Vì vậy, Chính phủ yêu cầu sớm ban hành tiêu chí, thủ tục thống nhất để địa phương có căn cứ tiếp tục sắp xếp, bảo đảm công khai, minh bạch và phù hợp thực tiễn.
Hoàn thiện bộ máy, tinh gọn tổ chức, đảm bảo vận hành thông suốt, hiệu quả
Song song với nhiệm vụ trên, Trung ương còn yêu cầu thêm một loạt nhiệm vụ cấu trúc bộ máy để bảo đảm vận hành thông suốt, hiệu lực, hiệu quả.
Trong Quý IV năm 2025, công tác chuẩn bị nền tảng về thể chế phải được hoàn thành. Cụ thể, Ban Tổ chức Trung ương chủ trì việc hoàn thiện vị trí việc làm phù hợp với chức năng, nhiệm vụ của từng cơ quan, tổ chức. Đây sẽ là cơ sở vững chắc để xác định, giao và quản lý biên chế của toàn hệ thống chính trị trong giai đoạn 2026-2031.
Sẽ hoàn thiện vị trí việc làm phù hợp với chức năng, nhiệm vụ của từng cơ quan, tổ chức (Ảnh minh họa: Trịnh Nguyễn).
Đồng thời, một quy định mới về quản lý biên chế cũng sẽ được ban hành theo hướng phân cấp mạnh mẽ quyền quản lý biên chế cho các cấp ủy trực thuộc Trung ương, tăng tính chủ động và trách nhiệm cho cơ sở.
Đến tháng 6/2026, hệ thống tổ chức bộ máy bên trong tiếp tục được tinh gọn. Các cơ quan, đơn vị của Đảng ở Trung ương chủ trì việc rà soát, sửa đổi, bổ sung quy định về chức năng, nhiệm vụ theo nguyên tắc ""một cơ quan làm nhiều việc; một việc chỉ giao một cơ quan chủ trì"".
Yêu cầu này nhằm sắp xếp, tinh gọn tổ chức bên trong cơ quan, đơn vị từ Trung ương đến địa phương, đi kèm với việc đẩy mạnh phân cấp, phân quyền và cải cách thủ tục hành chính.
Cùng thời điểm này, Trung ương cũng yêu cầu cần hoàn thiện việc phân định rõ thẩm quyền giữa cấp tỉnh và cấp xã, đồng thời đổi mới tổ chức, nâng cao chất lượng hoạt động của Mặt trận Tổ quốc và các tổ chức chính trị - xã hội.
Bên cạnh đó, công tác cán bộ phải được thực hiện thường xuyên, liên tục theo nguyên tắc kiên quyết: ""có vào, có ra, có lên, có xuống"".
Ban Tổ chức Trung ương có trách nhiệm triển khai đồng bộ các quy định về tiêu chuẩn chức danh, tiêu chí đánh giá, quy hoạch, đào tạo, bố trí, sử dụng cán bộ, công chức, viên chức.
Việc đánh giá cán bộ sẽ được thực hiện thường xuyên, liên tục, đa chiều, theo kết quả và sản phẩm cụ thể để đảm bảo lựa chọn đúng người, đúng việc.
Đặc biệt, để kiểm soát hiệu quả của các cải cách, Ban Tổ chức Trung ương còn chủ trì việc đánh giá tổng kết việc thực hiện mô hình tổ chức bộ máy mới của hệ thống chính trị theo các mốc 2 năm (vào năm 2027) và 5 năm (vào năm 2030) để kịp thời rút kinh nghiệm và điều chỉnh."
https://dantri.com.vn/noi-vu/dinh-huong-bien-che-tai-don-vi-su-nghiep-cong-lap-da-linh-vuc-o-cap-xa-20251018151058751.htm,Định hướng biên chế tại đơn vị sự nghiệp công lập đa lĩnh vực ở cấp xã,"(Dân trí) - Ban Chỉ đạo của Chính phủ hướng dẫn cụ thể việc thành lập và tổ chức hoạt động của đơn vị sự nghiệp công lập cung ứng các dịch vụ công cơ bản, thiết yếu tại cấp xã.","Bộ trưởng Bộ Nội vụ Phạm Thị Thanh Trà, Phó Trưởng ban thường trực Ban Chỉ đạo sắp xếp đơn vị hành chính các cấp và xây dựng mô hình tổ chức chính quyền địa phương 2 cấp của Chính phủ vừa ký ban hành Công văn 20/CV-BCĐ về việc thành lậpđơn vị sự nghiệp công lậpcung ứng các dịch vụ sự nghiệp đa ngành, đa lĩnh vực ở cấp xã.
Động thái này được đưa ra sau khi Ban Chỉ đạo có Công văn số 145/CV-BCĐ ngày 8/10 về việc kiện toàn hệ thống tổ chức thực hiện nhiệm vụ khuyến nông ở địa phương.
Theo đó, Ban đề nghị UBND các tỉnh, thành phố trực thuộc Trung ương khẩn trương triển khai các nhiệm vụ được giao, bảo đảm tiến độ theo yêu cầu.
Trong thời gian Chính phủ chưa ban hành Nghị định sửa đổi, bổ sung một số điều của Nghị định số 120/2020/NĐ-CP, trên cơ sở kiến nghị của một số địa phương, Ban Chỉ đạo của Chính phủ hướng dẫn cụ thể việc thành lập và tổ chức hoạt động của đơn vị sự nghiệp công lập do ngân sách nhà nước bảo đảm thuộc UBND cấp xã. Đơn vị này sẽ cung ứng các dịch vụ sự nghiệp công cơ bản, thiết yếu đa ngành, đa lĩnh vực.
Thành lập trên cơ sở nhu cầu thực tế của địa phương
Căn cứ quy định của Luật Tổ chức chính quyền địa phương năm 2025, Ban Chỉ đạo đề nghị UBND cấp tỉnh chỉ đạo UBND cấp xã quyết định thành lập theo thẩm quyền 1 đơn vị sự nghiệp công lập cung ứng dịch vụ sự nghiệp công cơ bản, thiết yếu đa ngành, đa lĩnh vực (gồm: văn hóa, thể thao, du lịch, thông tin, truyền thông, môi trường, khuyến nông, đô thị...) do ngân sách nhà nước bảo đảm.
Trường hợp tại UBND cấp xã đã thành lập đơn vị sự nghiệp công lập do ngân sách nhà nước bảo đảm thì đề nghị tổ chức lại và bổ sung nhiệm vụ về khuyến nông theo yêu cầu tại Thông báo số 371-TB/VPTW.
Cấp xã được thành lập 1 đơn vị sự nghiệp công lập cung ứng dịch vụ cơ bản (Ảnh minh họa: Phú Việt).
Quy định rõ về nhiệm vụ và số người làm việc
Từ yêu cầu thực tiễn đặt ra trên địa bàn, UBND cấp tỉnh chỉ đạo về tên gọi, tổ chức bộ máy và chức năng, nhiệm vụ, quyền hạn của đơn vị sự nghiệp công lập cung ứng các dịch vụ sự nghiệp công đa ngành, đa lĩnh vực ở cấp xã.
Cụ thể, cần quy định đầy đủ nhiệm vụ, quyền hạn của đơn vị sự nghiệp công lập cung ứng dịch vụ sự nghiệp công cơ bản, thiết yếu thuộc các lĩnh vực sự nghiệp mà đơn vị sự nghiệp công lập này được giao thực hiện trên địa bàn cấp xã, bảo đảm theo hướng dẫn của Bộ quản lý chuyên ngành và phù hợp với yêu cầu nhiệm vụ phát sinh trên địa bàn cấp xã.
Về cơ cấu tổ chức và số lượng cấp phó, việc thành lập các phòng chuyên môn trong đơn vị sự nghiệp công lập phải dựa trên khối lượng công việc và đặc thù quản lý.
Mỗi phòng cần đảm nhiệm từ hai mảng công tác trở lên, có quy trình quản lý riêng và tối thiểu 7 viên chức làm việc trở lên.
Người đứng đầu đơn vị sự nghiệp công lập có không quá 2 cấp phó; trưởng phòng có 1 cấp phó để bảo đảm tinh gọn, hiệu quả trong điều hành.
Về số lượng người làm việc, trên cơ sở tổng biên chế viên chức hưởng lương từ ngân sách nhà nước (không bao gồm lĩnh vực giáo dục và y tế), UBND cấp tỉnh sẽ rà soát, cân đối và phân bổ phù hợp khi thành lập đơn vị sự nghiệp công lập cấp xã.
Xã chịu trách nhiệm tuyển dụng, bố trí đủ viên chức làm việc tại đơn vị sự nghiệp công lập theo số lượng biên chế được giao (Ảnh minh họa: Huỳnh Hải).
Điều này bảo đảm đáp ứng yêu cầu nhiệm vụ được giao và theo đúng chỉ đạo của cấp có thẩm quyền.
Trong quá trình triển khai, UBND cấp xã có trách nhiệm tuyển dụng, bố trí viên chức theo biên chế được giao.
Trường hợp chưa tuyển dụng kịp thời, cấp xã được phép ký hợp đồng lao động với người có chuyên môn, nghiệp vụ phù hợp để đáp ứng yêu cầu nhiệm vụ theo quy định tại khoản 3, Điều 9 Nghị định 111/2022/NĐ-CP ngày 30/12/2022 của Chính phủ."
https://dantri.com.vn/noi-vu/tinh-cu-86-cong-chuc-ve-cap-xa-de-cam-tay-chi-viec-thao-go-ton-dong-20251018094520069.htm,"Tỉnh cử 86 công chức về cấp xã để “cầm tay chỉ việc”, tháo gỡ tồn đọng","(Dân trí) - Tỉnh Điện Biên biệt phái 86 công chức, viên chức về các xã hỗ trợ vận hành chính quyền địa phương 2 cấp. Công chức này về địa phương cần làm ngay 3 nhiệm vụ quan trọng.","Trước thực tế vừa thừa, vừa thiếu công chức cấp xã tại tỉnh Điện Biên, Phó Vụ trưởng Vụ Tổ chức phi chính phủ (Bộ Nội vụ) Phạm Trung Giang cho biết địa phương này đã đề xuất đưa 86công chức, viên chức ở các sở, ngành của tỉnh về hỗ trợ cấp xã thực hiện vận hành chính quyền địa phương 2 cấp.
Để giải quyết tình trạng thiếu công chức chuyên môn theo ngành, lĩnh vực, trước mắt Điện Biên cần biệt phái công chức, viên chức thuộc các cơ quan, đơn vị của tỉnh về các xã nhằm giúp địa phương giải quyết ngay các nhiệm vụ được giao.
Theo ông Giang, đây cũng là dịp giúp các xã đào tạo, bồi dưỡng đội ngũ công chức hiện có. Dự kiến thời gian thực hiện biệt phái kéo dài 6 tháng.
Sở Nội vụ tỉnh Điện Biên quy định, công chức, viên chức được biệt phái phải là người có trình độ chuyên môn, năng lực thực tiễn. Nhóm này được cơ quan, đơn vị đánh giá hoàn thành tốt nhiệm vụ trong 3 năm gần nhất và đang giữ chức vụ lãnh đạo, quản lý hoặc được quy hoạch chức vụ lãnh đạo, quản lý.
Lãnh đạo Sở Nội vụ về nắm tình hình vận hành chính quyền địa phương 2 cấp tại địa phương (Ảnh: NVCC).
86 cán bộ, công chức biệt phái trải rộng trên các lĩnh vực chuyên ngành mà cấp xã đang thiếu như: Công nghệ thông tin; thông tin, truyền thông, chuyển đổi số, công thương; xây dựng, giao thông; lao động, nội vụ; tư pháp; nông nghiệp, quản lý đất đai; văn hóa...
Phó Vụ trưởng Vụ Tổ chức phi chính phủ cho biết, Sở Nội vụ cũng đặt tiêu chuẩn lựa chọn công chức, viên chức cấp tỉnh đi biệt phái tại cấp xã là người có năng lực, trình độ, tâm huyết, trách nhiệm biệt phái hỗ trợ các xã, phường vận hành chính quyền 2 cấp.
Ngoài chuyên môn phù hợp với nhu cầu các xã, phường đang thiếu hụt, công chức phải có bản lĩnh chính trị vững vàng, có tinh thần trách nhiệm, chuyên nghiệp, sẵn sàng cống hiến, phục vụ nhân dân và thực hiện nhiệm vụ chung.
Ông Giang cho biết, tỉnh ưu tiên lựa chọn công chức, viên chức đang giữ chức vụ lãnh đạo, quản lý cấp phòng hoặc được quy hoạch các chức vụ lãnh đạo, quản lý.
Khi về công tác tại xã, phường, nhóm cán bộ được biệt phái thực hiện được 3 nội dung quan trọng. Cụ thể, họ là người trực tiếp thực hiện công việc, cùng với công chức, viên chức cấp xã để xử lý ngay những công việc đang tồn đọng, vướng mắc, đặc biệt là các thủ tục hành chính liên quan trực tiếp đến người dân và doanh nghiệp.
Nhóm này trở thành người hướng dẫn, “cầm tay chỉ việc”, chuyển giao kiến thức, hướng dẫn quy trình, bồi dưỡng kỹ năng cho đội ngũ cán bộ tại chỗ. Để sau khi kết thúc nhiệm vụ, đội ngũ cơ sở có thể tự tin thực hiện tốt các nhiệm vụ chuyên môn.
""Cuối cùng, nhóm công chức, viên chức biệt phái là cầu nối thông tin hai chiều; lắng nghe, tổng hợp những khó khăn, vướng mắc từ thực tiễn để kịp thời báo cáo, tham mưu, đề xuất cho tỉnh những giải pháp chỉ đạo sát sao, hiệu quả hơn"", ông Giang nhắc thêm yêu cầu.
Khối Đảng, đoàn thể
Tại Điện Biên, cơ bản đội ngũ cán bộ, công chức khối Đảng, đoàn thể đã được bố trí đủ theo quy định. Trước việc một số xã thiếu công chức kế toán, Sở Nội vụ đã phối hợp thống nhất với Đảng ủy các xã chủ động rà soát, điều chỉnh trong nội bộ xã hoặc đề xuất tiếp nhận, điều động từ các xã khác, không đề xuất biệt phái.
Khối chính quyền
Tổng số công chức còn thiếu theo các lĩnh vực tại các phòng chuyên môn thuộc UBND cấp xã là 240 người.
Sau khi thống nhất, các xã, phường chủ động rà soát, sắp xếp, bố trí điều động, biệt phái trong nội bộ giữa cơ quan Đảng, đoàn thể với chính quyền và giữa các cơ quan, đơn vị thuộc xã, phường đối với 154 người.
Đồng thời đề xuất biệt phái 86 công chức, viên chức từ các cơ quan, đơn vị thuộc tỉnh về giúp các xã, phường theo các lĩnh vực chuyên môn.
Ban chỉ huy quân sự xã
Theo quy định mỗi xã, phường được bố trí tối thiểu 3 công chức Ban chỉ huy quân sự (tổng cộng ở 45 xã, phường là 135 công chức).
Đến nay, tại các xã, phường trên địa bàn tỉnh đã thực hiện bổ nhiệm 72 công chức Ban chỉ huy quân sự (gồm 37 chỉ huy trưởng, 26 phó chỉ huy trưởng và 9 trợ lý). Số còn thiếu so với định mức biên chế là 63 công chức (gồm 8 chỉ huy trưởng, 19 phó chỉ huy trưởng và 36 trợ lý)."
https://dantri.com.vn/noi-vu/chi-hon-3100-ty-dong-ho-tro-3800-nguoi-nghi-viec-20251017141300655.htm,Chi hơn 3.100 tỷ đồng hỗ trợ 3.800 người nghỉ việc,"(Dân trí) - Thực hiện chính sách sắp xếp, tinh gọn bộ máy, tại Quảng Ngãi có 3.800 cán bộ, công chức, viên chức nghỉ việc đã được hỗ trợ với số tiền hơn 3.100 tỷ đồng.","Ngày 17/10, thông tin từ UBND tỉnh Quảng Ngãi, toàn tỉnh có 3.800 cán bộ, công chức, viên chức nghỉ việc nhằm thực hiện tinh gọn, sắp xếp, tổ chức bộ máy. Những người này đã được hỗ trợ với tổng số tiền hơn 3.100 tỷ đồng.
Trong đó có 2.800 cán bộ, công chức, viên chức nghỉ việc theo Nghị định 178, Nghị định 67, được hỗ trợ với tổng số tiền 2.900 tỷ đồng. Tỉnh cũng chi trả hơn 200 tỷ đồng cho 1.000 người hoạt động không chuyên trách ở cấp xã nghỉ việc theo Nghị định 154.
Cán bộ cấp xã ở Quảng Ngãi tận tình hướng dẫn người dân giải quyết thủ tục hành chính (Ảnh: Quốc Triều).
Các chế độ, chính sách đối với cán bộ, công chức, viên chức, người lao động, người hoạt động không chuyên trách nghỉ việc đã được tỉnh Quảng Ngãi giải quyết kịp thời, đảm bảo đúng quy định.
Việc tinh gọn bộ máy, thực hiện chính quyền địa phương 2 cấp giúp các cơ quan, đơn vị, địa phương tại Quảng Ngãi hoạt động thông suốt, hiệu quả. Đội ngũ cán bộ, công chức, viên chức thể hiện tốt tinh thần, thái độ phục vụ nhân dân.
Tháng 8, Hội đồng nhân dân tỉnh Quảng Ngãi đã thông qua nghị quyết giao biên chế công chức năm 2025. Tổng biên chế công chức cấp tỉnh là 2.386 người; cấp xã có 5.618 biên chế, trong đó 4.235 biên chế chính thức và 1.383 biên chế dự phòng."
https://dantri.com.vn/noi-vu/chuyen-giao-hai-don-vi-khac-phuc-hau-qua-bom-min-ve-bo-quoc-phong-20251017102433700.htm,Chuyển giao hai đơn vị khắc phục hậu quả bom mìn về Bộ Quốc phòng,"(Dân trí) - Bộ Quốc phòng chính thức tiếp nhận Trung tâm Hành động khắc phục bom mìn Việt Nam và Quỹ hỗ trợ khắc phục hậu quả bom mìn từ Bộ Nội vụ, theo Quyết định của Thủ tướng Chính phủ.","Sáng 17/10, Bộ Nội vụ và Bộ Quốc phòng tổ chức Lễ ký kết Biên bản chuyển giao nguyên trạng Trung tâm Hành động khắc phục bom mìn Việt Nam và Quỹ hỗ trợ khắc phục hậu quả bom mìn Việt Nam từ Bộ Nội vụ về trực thuộc Bộ Quốc phòng, theo Quyết định số 1510/QĐ-TTg ngày 10/7/2025 của Thủ tướng Chính phủ.
Tham dự buổi lễ có Thượng tướng Hoàng Xuân Chiến, Thứ trưởng Bộ Quốc phòng; Thứ trưởng Bộ Nội vụ Nguyễn Văn Hồi; đại diện các Bộ, Ngành cùng lãnh đạo các Cục, Vụ chức năng của Bộ Quốc phòng và Bộ Nội vụ.
Lễ ký kết chuyển giao hai đơn vị khắc phục hậu quả bom mìn về Bộ Quốc phòng (Ảnh: Tống Giáp).
Bàn giao nguyên trạng, bảo đảm hoạt động thông suốt
Theo Biên bản được ký kết, hai đơn vị sự nghiệp công lập gồm Trung tâm Hành động khắc phục bom mìn Việt Nam và Quỹ hỗ trợ khắc phục hậu quả bom mìn Việt Nam được chuyển nguyên trạng về Bộ Quốc phòng quản lý. Việc chuyển giao bao gồm toàn bộ tổ chức bộ máy, nhân sự, cơ sở vật chất, tài sản, tài chính, hồ sơ, dữ liệu và các quyền, nghĩa vụ pháp lý liên quan.
Bộ Nội vụ và Bộ Quốc phòng phối hợp thực hiện công tác chuyển giao, bảo đảm tính liên tục, không gián đoạn nhiệm vụ; đồng thời tiếp nhận, kiện toàn tổ chức Đảng, đoàn thể tại các đơn vị theo quy định. Các bên thống nhất hoàn thành toàn bộ thủ tục bàn giao trước ngày 31/12/2025.
Thượng tướng Hoàng Xuân Chiến nhấn mạnh: ""Việc tiếp nhận hai đơn vị này là sự kiện có ý nghĩa đặc biệt, thể hiện quyết tâm của Chính phủ trong sắp xếp, kiện toàn tổ chức bộ máy, đồng thời nâng cao hiệu quả công tác khắc phục hậu quả bom mìn sau chiến tranh – một nhiệm vụ nhân đạo, vừa cấp thiết, vừa lâu dài"".
Thượng tướng Hoàng Xuân Chiến, Thứ trưởng Bộ Quốc phòng (Ảnh: Tống Giáp).
Phát huy vai trò nòng cốt của Quân đội trong nhiệm vụ nhân đạo
Thứ trưởng Hoàng Xuân Chiến khẳng định, Việt Nam là một trong những quốc gia chịu hậu quả nặng nề nhất của bom mìn, vật nổ và chất độc hóa học còn sót lại sau chiến tranh.
Việc giao Bộ Quốc phòng quản lý Trung tâm và Quỹ sẽ giúp phát huy tốt hơn vai trò nòng cốt của Quân đội trong công tác nhân đạo, bảo đảm an toàn tính mạng nhân dân và phục vụ phát triển kinh tế – xã hội bền vững.
Bộ Quốc phòng cam kết tiếp nhận đầy đủ nguyên trạng tổ chức, nhân sự, cơ sở vật chất, nhanh chóng ổn định tổ chức, duy trì hoạt động thông suốt, đồng thời tăng cường phối hợp liên ngành và mở rộng hợp tác quốc tế nhằm huy động nguồn lực thực hiện hiệu quả Chương trình hành động quốc gia khắc phục hậu quả bom mìn sau chiến tranh.
Phát biểu tại buổi lễ, Thứ trưởng Bộ Nội vụ Nguyễn Văn Hồi nhấn mạnh: ""Chúng tôi hy vọng các bộ, ngành liên quan sẽ tiếp tục phối hợp chặt chẽ với Bộ Quốc phòng để thực hiện sứ mệnh nhân đạo này, bởi sau năm 1975 đến nay, số lượng diện tích bị ô nhiễm bom mìn còn rất lớn, nhiều người dân vẫn bị thương vong. Đây là vấn đề day dứt mà sắp tới, chúng tôi sẽ phối hợp xử lý theo chức năng, quyền hạn được giao"".
Thứ trưởng Bộ Nội vụ Nguyễn Văn Hồi phát biểu tại buổi lễ (Ảnh: Tống Giáp).
Buổi lễ ký kết đánh dấu bước chuyển quan trọng trong công tác khắc phục hậu quả bom mìn, đồng thời mở ra giai đoạn mới trong việc phát huy vai trò của Quân đội trong các hoạt động nhân đạo."
