url,title,description,content
https://thanhnien.vn/vi-sao-dong-co-dau-diesel-tren-o-to-van-hanh-thuong-on-hon-dong-co-xang-185251022115427985.htm,Vì sao động cơ dầu diesel trên ô tô vận hành thường ồn hơn động cơ xăng?,"Tiếng ồn động cơ khi vận hành là một trong những đặc điểm giúp nhiều người phân biệt giữa ô tô động cơ dầu diesel với xe dùng động cơ xăng, tuy nhiên không phải ai cũng hiểu rõ nguyên nhân khiến động cơ dầu diesel trên ô tô khi vận hành thường ồn hơn xe xăng.","Bất chấp xu hướng điện hóa đang diễn ra rầm rộ trong ngành ô tô cùng những quy định ngày càng nghiêm ngặt liên quan đến tiêu chuẩn khí thải; ô tôđộng cơ dầudiesel vẫn tồn tại và chưa thể thay thế trên nhiều dòng xe như SUV,xe bán tải… Hầu hết các mẫu mã xe bán tải tại Việt Nam hiện nay như Ford Ranger, Toyota Hilux, Mitsubishi Triton… đều dùng động cơ dầu. Trong khi đó, nhiều mẫu mã như KIA Carnival, Hyundai Tucson từng được phân phối song song hai lựa chọn động cơ xăng vàđộng cơ dầu diesel.
Với những mẫu xe vừa có động cơ dầu, vừa có bản động cơ xăng; nhiều người thường phân biệt thông qua âm thanh động cơ. Bởi so với động cơ xăng, các dòng xe dùng động cơ dầu diesel khi vận hành thường có âm thanh máy ồn hơn động cơ xăng. Đặc biệt, một số dòng xe bán tải hay SUV máy dầu, thường phát ra tiếng ""rè rè"" hoặc ""lạch cạch"" đặc trưng mỗi khi khởi động máy.
Dù vận hành mạnh mẽ nhưng xe máy dầu lại ồn hơn xe máy xăng
Ảnh: B.H
Đây cũng là lý do khiến nhiều người chọn mua ô tô thường không thích các phiên bản dùng động cơ dầu diesel. Bởi dù vận hành mạnh mẽ nhưng xe máy dầu lại ồn hơn xe máy xăng. Tuy nhiên không phải ai cũng hiểu rõ nguyên nhân khiếnđộng cơ dầu dieseltrên ô tô khi vận hành thường ồn xe xăng (!?)
Thực tế, không phải tất cả những âm thanh động cơ dầu diesel phát ra khi vận hành đều do hư hỏng mà xuất phát từ đặc điểm cấu tạo, vận hành ở áp suất nhiên liệu cao hơn nhiều so với các loại động cơ còn lại.
Về mặt cấu tạo cũng như nguyên lý hoạt động; động cơ dầu diesel và động cơ xăng có những điểm tương đồng. Tuy nhiên, động cơ diesel ồn hơn khi vận hành một phần xuất phát từ cấu tạo đặc trưng của nó. Điểm khác biệt cơ bản giữa động cơ dầu diesel và động cơ xăng nằm ở nguyên lý hoạt động. Động cơ xăng sử dụng bu-gi để đánh lửa hỗn hợp nhiên liệu - không khí đưa vào buồng đốt, trong khi động cơ dầu diesel tự bốc cháy nhờ nhiệt độ nén cao. Khi không khí bị nén đến áp suất rất lớn, dầu diesel được phun vào sẽ bốc cháy gần như tức thì, tạo ra âm thanh máy đặc trưng.
Động cơ diesel ồn ào hơn khi vận hành một phần xuất phát từ cấu tạo đặc trưng của nó
Ảnh: Ford
Theo anh Lê Văn Tú, kỹ thuật viên của một garage chuyên sửa chữa, bảo dưỡng ô tô tại TP.HCM, tỷ số nén của động cơ diesel rất cao, cao hơn nhiều lần so với động cơ xăng. Đây cũng được xem là một nguyên nhân chủ yếu dẫn đến việc xuất hiện những tiếng ồn của động cơ diesel. Một động cơ xăng thông thường sẽ có tỷ số nén rơi vào khoảng 8:1 hoặc 12:1. Tuy nhiên, ở động cơ diesel có tỷ số nén thường rơi vào khoảng từ 16:1 đến 22:1. Chính áp suất nén cao và lực đốt mạnh khiến thân máy rung nhiều hơn, tạo ra âm thanh và dao động cơ học lớn.
Khác với động cơ xăng, để chịu được áp suất buồng đốt lớn, các chi tiết như piston, trục khuỷu, thanh truyền trong động cơ diesel đều được thiết kế dày, nặng và chắc hơn. Khi hoạt động, lực va đập giữa các chi tiết cơ khí cũng phát ra nhiều tiếng động hơn so với máy xăng.
Đặc biệt, hệ thống phun nhiên liệu của động cơ diesel hoạt động ở áp suất cực cao. Áp suất phun cao trong động cơ diesel ngay cả những loại động cơ dùng hệ thống phun nhiên liệu đa điểm, điều khiển điện tử (Common rail) có thể đạt tới 1.600 bar, so với mức 180 - 200 bar của các thế hệ động cơ trước, dẫn đến quá trình đốt cháy rất mạnh. Mỗi lần kim phun làm việc đều tạo ra tiếng ""tạch tạch"" nhỏ, đây là một phần của âm thanh đặc trưng mà người dùng thường nghe thấy khi động cơ diesel vận hành.
Với công nghệ hiện đại, những ""cỗ máy dầu"" ngày nay đã êm ái, tiết kiệm và thân thiện hơn rất nhiều so với trước đây
Ảnh: Ford
Như vậy, tiếng ồn của động cơ dầu diesel chủ yếu đến từ quá trình đốt cháy mạnh và kết cấu cơ khí chịu tải cao. Tuy nhiên, với công nghệ hiện đại, những ""cỗ máy dầu"" ngày nay đã êm ái, tiết kiệm và thân thiện hơn rất nhiều so với trước đây. Những năm gần đây, các hãng ô tô đã nỗ lực cải thiện nhược điểm này bằng việc áp dụng hệ thống phun nhiên liệu điện tử (Common rail), bộ cách âm khoang động cơ và đệm giảm chấn. Một số dòng xe như Mazda CX-8, Hyundai Tucson máy dầu đã giảm tiếng ồn đáng kể, thậm chí khó phân biệt với động cơ xăng."
https://thanhnien.vn/sai-lam-pho-bien-cua-tai-xe-khi-gat-den-xi-nhan-trong-qua-trinh-vuot-o-to-185251104143657873.htm,Sai lầm phổ biến của tài xế khi gạt đèn xi-nhan trong quá trình vượt ô tô,"Không ít tài xế sử dụng chế độ đèn xi-nhan không đúng khi vượt xe, dẫn đến tín hiệu cảnh báo ngắt giữa chừng. Đây là lỗi kỹ thuật phổ biến nhưng tiềm ẩn nguy hiểm.","Xi-nhan là một trong những đèn tín hiệu quan trọng khi tham gia giao thông, đặc biệt trong những tình huống rủi ro cao nhưvượt xe, chuyển làn. Tuy nhiên, không ít tài xế sử dụng sai thao tác khi xin vượt, khiến tín hiệu xi-nhan bị ngắt giữa chừng. Điều này khiến các phương tiện xung quanh không nhận được cảnh báo đầy đủ, dễ dẫn đến va chạm do phản ứng chậm.
Công tắc đèn xi-nhan có hai nấc, sử dụng trong nhiều tình huống khác nhau
ẢNH: B.H
Lỗi phổ biến nhất là tài xế chỉ gạt nhẹ cầnxi-nhankhi bắt đầu vượt xe. Trong trường hợp này, hệ thống đèn sẽ chỉ nháy khoảng 3 - 5 lần rồi tự tắt. Khi xe vẫn đang lấn sang làn bên cạnh để vượt, tín hiệu đã mất, các phương tiện phía sau hoặc ngược chiều không còn nhận được cảnh báo. Điều này dễ gây hiểu nhầm hoặc phản ứng chậm từ các xe xung quanh, đặc biệt khi tài xế chưa hoàn tất quá trình vượt.
Nguyên nhân nằm ở cấu tạo kỹ thuật của cần xi-nhan trên hầu hết các mẫu xe hiện nay. Bộ phận này thường có hai chế độ, gồm chạm nhẹ để phát tín hiệu ngắn (dành chochuyển lànnhanh) và gạt mạnh qua điểm cản để bật tín hiệu liên tục (phù hợp cho rẽ và vượt xe). Tuy nhiên, nhiều tài xế chỉ gạt nhẹ xi-nhan khi vượt, dẫn đến đèn tín hiệu bị ngắt quãng giữa chừng.
Tài xế có thể theo dõi cảnh báo đèn xi-nhan trên bảng đồng hồ hoặc từ tiếng rơ-le
ẢNH: B.H
Theo Luật Trật tự, an toàn giao thông đường bộ 2024, khi vượt xe, người điều khiển phải bật tín hiệu báo chuyển hướng trong suốt quá trình thực hiện. Đây là yêu cầu bắt buộc nhằm đảm bảo các xe xung quanh có đủ thời gian để xử lý tình huống, giữ khoảng cách an toàn. Nếu tín hiệu bị tắt sớm do thao tác sai, dù người lái không cố ý, hành vi này vẫn tiềm ẩn nguy cơ gây tai nạn giao thông.
Khi vượt xe, người lái phải gạt cần xi-nhan qua điểm cản để kích hoạt chế độ nháy liên tục vì vượt xe thường mất nhiều thời gian hơn chuyển làn. Sau khi hoàn tất, nếu xe không tự tắt xi-nhan, tài xế cần chủ động trả cần gạt về vị trí ban đầu. Ngoài ra, nên kiểm tra biểu tượng xi-nhan trên bảng đồng hồ và lắng nghe tiếng rơ-le để đảm bảo tín hiệu vẫn duy trì trong suốt quá trình vượt.
Dù đây chỉ là thao tác nhỏ nhưng việc gạt sai chế độ xi-nhan khi vượt xe là lỗi kỹ thuật phổ biến, có thể dẫn đến hậu quả nghiêm trọng nếu không được chú ý. Tín hiệu xi-nhan không đơn thuần là yêu cầu bắt buộc khi tham gia giao thông mà còn là ""ngôn ngữ giao tiếp"" giữa các tài xế khi di chuyển trên đường."
https://thanhnien.vn/vi-sao-khong-nen-keo-phanh-tay-o-to-ngay-sau-khi-rua-xe-185251106092751055.htm,Vì sao không nên kéo phanh tay ô tô ngay sau khi rửa xe?,"Thói quen kéo phanh tay ô tô ngay sau khi rửa xe tưởng chừng vô hại nhưng có thể khiến hệ thống phanh bị kẹt, rỉ sét, thậm chí gây hư hỏng nếu đỗ xe lâu ngày không sử dụng.","Với điều kiện đường sá giao thông tại Việt Nam, ô tô trong quá trình sử dụng cần thường xuyên vệ sinh, rửa sạch bùn đất, bụi bẩn để tránh ẩm mốc, hoen gỉ cho các bộ phận, chi tiết trên xe. Chính vì vậy, không chỉrửa xetrong quá trình sử dụng hay sau mỗi chuyến đi, nhiều người ít khi dùng ô tô cũng thường rửa sạch xe sau đó đưa vào bãi đỗ, kéo phanh tay ô tô.
Thực tế, kéophanh tay ô tôđã trở thành thao tác quen thuộc của hầu hết người dùng ô tô mỗi khi đỗ xe. Mua ô tô chủ yếu để gia đình sử dụng cuối tuần về quê, thỉnh thoảng đi lại công việc anh Hoàng Quốc Minh cho biết: ""Thường sau khi về quê lên tôi sẽ tự rửa xe, rồi kéo phanh tay đỗ ngay trong sân nhà, nhiều khi 3 - 4 ngày mới dùng đến."" Không chỉ anh Minh, nhiều người dùng ô tô sau khi rửa xe cũng thường kéo phanh tay đỗ xe theo thói quen thao tác ngay sau khirửa xe.
Thói quen kéo phanh tay ngay sau khi rửa xe để đỗ ô tô tưởng chừng vô hại lại tiềm ẩn nguy cơ gây hỏng hệ thống phanh
Ảnh: B.H
Tuy nhiên, theo các kỹ thuật viên chuyên sửa chữa bảo dưỡng ô tô, thói quen kéo phanh tay ngay sau khi rửa xe để đỗ ô tô tưởng chừng vô hại lại tiềm ẩn nguy cơ gây hỏng hệ thống phanh, thậm chí khiến hệ thống phanh bị kẹt, rỉ sét… nhất là với những lúc đỗ ô tô lâu ngày không sử dụng.
Thông thường, sau khi xịt rửa xe các kỹ thuật viên sẽ dùng khăn lau khô xe. Tuy nhiên, hầu hết các chi tiết được lau khô là ở bề mặt thân xe, dễ thao tác. Trong khi, hệ thống phanh lại ít khi được chú ý đến do bị mâm xe che khuất. Nếu không được xịt khô, nước sẽ bám vào các chi tiết kim loại ở hệ thống phanh bất kể là phanh tang trống hay phanh đĩa.
Sau khi rửa xe, nếu tài xế kéo ngay phanh tay để đỗ xe, má phanh đang ướt sẽ bị ép chặt vào mặt trống hoặc đĩa phanh
Ảnh: B.H
Trong trường hợp này, nếu tài xế kéo ngay phanh tay để đỗ xe, má phanh đang ướt sẽ bị ép chặt vào mặt trống hoặc đĩa phanh. Sau một thời gian, nước và bụi bẩn kết hợp lại có thể gây gỉ sét, khiến má phanh bị ""dính chết"" vào bề mặt phanh.
Với các xe đỗ lâu ngày không sử dụng, khi hạ phanh tay người dùng sẽ gặp tình huống bánh sau không nhả dù đã hạ hết phanh, nhiều trường hợp sẽ cảm nhận được xe di chuyển nặng nề, thậm chí không thể lăn bánh. Việc khắc phục tình trạng này đòi hỏi phải tháo bánh và vệ sinh hệ thống phanh.
Thực tế, từng có trường hợp tài xế sau khi rửa xe rồi để qua 2 -3 ngày mới sử dụng, khi khởi động lại xe khó di chuyển do bánh sau bị kẹt. Khi đưa vào xưởng kiểm tra, kỹ thuật viên phát hiện má phanh bị dính vào trống phanh do bị ẩm nước và gỉ sét nhẹ. Nguyên nhân là do bụi má phanh kết hợp với dầu mở, bụi đất… khi gặp nước hình thành bùn bám trong các khe nhỏ của hệ thống phanh. Khi không được xịt sạch, người dùng kéo phanh tay ngay sau khi rửa xe, bùn sẽ lọt vào tạo mảng bám theo thời gian khiến phanh bị kẹt.
Phanh tay ô tôhoạt động dựa trên cơ cấu cơ khí, trong đó nhiều chi tiết như dây cáp, lò xo, càng phanh… làm bằng kim loại. Khi bị ẩm nước rồi tiếp xúc với không khí, các chi tiết này dễ bị oxy hóa, rỉ sét và hoạt động kém trơn tru. Lâu dần, lực phanh tay sẽ giảm, làm mất tác dụng cố định xe khi đỗ trên dốc, gây nguy hiểm cho người dùng và phương tiện xung quanh.
Theo các chuyên gia kỹ thuật, ngay cả ô tô dùng phanh tay điện tử (EPB), tình trạng kẹt phanh, rỉ sét vẫn có thể xảy ra nếu người dùng kích hoạt ngay sau khi rửa xe, bởi cơ cấu phanh vẫn hoạt động dựa trên lực ép cơ khí.
Nên kiểm tra, vệ sinh bảo dưỡng định kỳ hệ thống phanh trên ô tô
Ảnh: B.H
Để tránh gặp phải tình trạng bị kẹt phanh, theo các kỹ thuật viên bảo dưỡng ô tô sau khi rửa xe, nên khởi động máy một lúc hoặc lái xe chậm vài trăm mét để giúp hệ thống phanh khô tự nhiên, sau đó mới đỗ xe, kéo phanh tay. Bên cạnh đó, nên kiểm tra, vệ sinh bảo dưỡng định kỳ hệ thống phanh trên ô tô."
https://thanhnien.vn/thuc-hu-meo-dung-dau-goi-de-ngan-kinh-o-to-bi-mo-hoi-suong-185251104214028383.htm,Thực hư mẹo dùng dầu gội để ngăn kính ô tô bị mờ hơi sương,"Một số người dùng ô tô truyền tai nhau mẹo bôi dầu gội đầu, bọt cạo râu lên kính để ngăn ngừa tình trạng kính ô tô bị mờ hơi sương khi sử dụng xe trong những ngày mưa hay thời tiết lạnh giá; tuy nhiên cách làm đơn giản này liệu có thực sự hiệu quả và an toàn cho kính xe?","Thời tiết tại nhiều tỉnh, thành phố tại Việt Nam đang bước vào mùa mưa, lạnh… đây cũng là lúc người dùng ô tô gặp một số bất tiện khikính ô tôthường bị mờ do hơi sương gây khó khăn cho việc quan sát, thậm chí có thể tiềm ẩn nguy cơ mất an toàn và tai nạn giao thông khi lái xe. Trên một số diễn đàn, hội nhóm mạng xã hội của người dùng ô tô chỉ nhau mẹo dùng dầu gội đầu, bọt cạo râu… thoa đều lên kính ô tô để ngăn ngừa tình trạngkính ô tôbị mờ hơi sương.
Cụ thể, một thành viên trong nhóm người dùng xe Hyundai Accent chia sẻ, chỉ cần thoa một lớp dầu gội hoặc bọt cạo râu mỏng lên mặt kính lái, sau đó chờ 1 - 2 phút rồi dùng khăn vải mềm lau khô. Cách làm này cho sẽ tạo một lớp màng mỏng, ngăn ngừa tình trạng hơi nước đọng trên kính lái làm mờ kính ô tô.
Thời tiết lạnh giá, trời mưa thường làm kính ô tô thường bị mờ hơi sương
Ảnh: B.H
Tuy nhiên, thực tế hiệu quả của mẹo nhỏ này ra sao và có ảnh hưởng gì đến lớp bảo vệ bề mặt kính ô tô hay không lại là vấn đề cần được nhìn nhận đúng.
Thực tế không phải ngẫu nhiên mà một số người dùng ô tô lại chỉ nhau mẹo bôi dầu gội đầu, bọt cạo râu lên kính ô tô để ngăn ngừa tình trạng kính bị mờ hơi sương. Bởi theo các kỹ thuật viên chuyênbảo dưỡng ô tô, hàm lượng chất trong dầu gội, bọt cạo râu có thể giúp giảm độ bám dính của nước vào bề mặt kính.
Cụ thể, liên quan đến vấn đề này, anh Trần Hồng Phúc - Kỹ thuật viên của một garage chuyên sửa chữa,bảo dưỡng ô tôtại phường Thủ Đức, TP.HCM cho biết: ""Dầu gội đầu hay bọt cạo râu có thể là giải pháp đơn giản để khắc phục tình trạng cửakính ô tôbị mờ sương khi trời mưa hay thời tiết lạnh. Trong dầu gội đầu, bọt cạo râu đều chứa chất hoạt động bề mặt (surfactant) có khả năng giảm sức căng bề mặt của nước, khiến hơi nước không kết tụ thành giọt li ti trên bề mặt kính"".
Sử dụng dầu gội đầu, bọt cạo râu ít nhiều mang lại hiệu quả trong việc ngăn ngừa hơi sương đọng trên kính ô tô khi lái xe dưới thời tiết lạnh hay trời mưa
Ảnh: B.H
Đây thực chất cũng là nguyên lý được áp dụng trong dung dịch chống mờ chuyên dụng (anti-fog) dùng cho mũ bảo hiểm, kính lặn hoặc kính ô tô.
Sử dụng dầu gội đầu, bọt cạo râu ít nhiều mang lại hiệu quả trong việc ngăn ngừa hơi sương đọng trên kính ô tô khi lái xe dưới thời tiết lạnh hay trời mưa. Tuy nhiên, theo anh Phúc đây cũng chỉ là biện pháp tạm thời, không có hiệu quả lâu dài. Bởi lớp màng dầu gội đầu, bọt cạo tạo ra trên bề mặt kính chỉ tồn tạo trong thời gian ngắn.
Nhiều loại dầu gội chứa hương liệu, chất làm mềm, nếu thường xuyên sử dụng có thể làm mờ lớp phủ chống tia UV hoặc chống chói của kính, gây phản sáng khi lái xe ban đêm. Nếu chọn không đúng loại dầu gội, không những phản tác dụng mà còn gây mất an toàn bởi lớp dầu gội khi bôi lên bề mặt kính sẽ dễ bị khô, bám bụi hoặc để lại vệt loang, đặc biệt khi gặp nắng nóng.
Về lâu dài, người dùng nên ưu tiên các sản phẩm chuyên dụng và sử dụng đúng chế độ sấy kính để loại bỏ hơi sương bám trên kính
Ảnh: B.H
Do đó, nên chú ý liều lượng sử dụng cũng như chọn loại dầu gội phù hợp để đạt hiệu quả và tránh làm hỏng các bộ phận của xe, đặc biệt là hệ thống cần gạt mưa hay bề mặt kính chắn gió. Loại dầu gội được sử dụng cũng phải dịu nhẹ, không chứa chất làm đặc hoặc chất dưỡng ẩm quá mức. Điều này rất quan trọng để tránh để lại cặn hoặc vệt trên cửa kính ô tô.
Dùng dầu gội để để ngăn kính ô tô bị mờ hơi sương là cách làm ít nhiều mang lại hiệu quả nhưng chỉ nên xem là biện pháp tạm thời. Về lâu dài, người dùng nên ưu tiên các sản phẩm chuyên dụng và sử dụng đúng chế độsấy kính."
https://thanhnien.vn/xe-ban-tai-tai-viet-nam-o-at-giam-gia-ban-185251104141014549.htm,Xe bán tải tại Việt Nam ồ ạt giảm giá bán,"Nhiều mẫu mã xe bán tải tại Việt Nam đang được các nhà sản xuất, phân phối chạy đua giảm giá bán lên đến hàng chục triệu đồng, trong bối cảnh thời gian bán hàng đang trôi về những tháng cuối năm.","Tương tự nhiều dòng xe khác trên thị trường ô tô Việt Nam, xe bán tải với nhiều mẫu mã đang rầm rộ giảm giá bán thông qua các chương trình ưu đãi của nhà sản xuất, phân phối bất chấp doanh số bán hàng vẫn đang tăng trưởng so với năm ngoái. Từ những mẫu mã vốn không tạo được nhiều sức hút như Isuzu D-Max,Mitsubishi Triton,Toyota Hiluxcho đến mẫu xe bán chạy nhất phân khúc như Ford Ranger đều đang ""lao"" vào cuộc đua ưu đãi, giảm giá nhằm gia tăng lợi thế cạnh tranh, tạo sức hút với khách hàng mua xe dịp cuối năm.
Thị trường ô tô Việt Nam tăng trưởng sau nửa đầu năm 2025, xe 'xanh' chiếm 29% thị phần
Theo ghi nhận của PVThanh Niên, bước sang tháng 11.2025, nhiều mẫu xe bán tải đang được nhà sản xuất, phân phối giảm giá bán thông qua hình thức ưu đãi, hỗ trợ lệ phí trước bạ kèm theo quà tặng với trị giá lên đến hàng chục triệu đồng.
Mitsubishi Triton đang được ưu đãi, giảm giá từ 23 - 40 triệu đồng, tùy phiên bản
Ảnh: B.H
Trong đó, Mitsubishi Triton như thường lệ vẫn được Mitsubishi Việt Nam đưa vào danh sách ưu đãi. Cụ thể, mẫu bán tải này hiện có 3 phiên bản tại Việt Nam, trong đó hai phiên bản Triton. 2WD AT Premium và Triton 4WD AT Athlete (có giá niêm yết 782 - 924 triệu đồng) đang được hãng giảm giá từ 23 - 28 triệu đồng, tương đương mức hỗ trợ 50% lệ phí trước bạ. Riêng bản Triton 2WD AT GLX (giá 655 triệu đồng) được giảm gần 40 triệu đồng, tương đương mức hỗ trợ 100% lệ phí trước bạ.
Toyota Hilux tăng trưởng mạnh hơn Ford Ranger trong nửa đầu năm 2025
Như vậy, với chương trình ưu đãi này, giá bán thực tế củaMitsubishi Tritontrong tháng 11.2025 chỉ ở mức 615 - 896 triệu đồng. Ngoài ra, khách hàng mua một trong các phiên bản của mẫu bán tải này còn được tặng gói quà tặng trị giá 10 triệu đồng. ""Trường hợp khách hàng không muốn nhận gói quà tặng, có thể quy đổi sang mức giảm trực tiếp vào giá xe."" Nhân viên bán hàng một đại lý Mitsubishi tại TP.HCM cho biết.
Sau ba quý đầu năm 2025, tổng doanh số bán Mitsubishi Triton đạt 2.814 xe, đồng thời đang nắm lợi thế trong việc cạnh tranh vị trí thứ hai ở phân khúcxe bán tảivới Toyota Hilux (đạt 2.504 xe). Chính vì vậy, khi Mitsubishi Triton ""lên tiếng""Toyota Hiluxcũng lập tức có động thái đáp trả.
Ba phiên bản Toyota Hilux  đều được Toyota Việt Nam (TMV) áp dụng ưu đãi giảm giá từ 20 - 30 triệu đồng
Ảnh: T.M.V
Theo đó, trong tháng 11.2025 cả ba phiên bản Toyota Hilux 2.4L 4x4 MT, Hilux 2.4L 4x4 MT, Hilux 2.4L 4x2 AT và Hilux 2.4L 4x4 AT Adventure đều được Toyota Việt Nam (TMV) áp dụng ưu đãi giảm giá từ 20 - 30 triệu đồng, tương đương mức hỗ trợ 50% lệ phí trước bạ. Sau ưu đãi, giá bán thực tế các phiên bản Hilux đang ở mức 648 - 969 triệu đồng.
Không chỉ hai mẫu bán tải thương hiệu Nhật Bản, ngay cả Ford Ranger - mẫu xe bán tải hút khách nhất thị trường Việt Nam đồng thời liên tục góp mặt trong top10 ô tô bán chạy nhấthàng tháng cũng được áp dụng ưu đãi, giảm giá.
Cụ thể, các phiên bản Ranger XLS (giá 707 - 784 triệu đồng), Ranger Stormtrak (1,039 tỉ đồng), Ranger Wildtrak (979 - 987 triệu đồng) và Ranger Raptor (1,299 - 1,307 tỉ đồng) đều được Ford Việt Nam ưu đãi giảm giá tương đương 100% lệ phí trước bạ.
Ford đang ưu đãi 100% lệ phí trước bạ cho một số phiên bản Ranger
Ảnh: B.H
Theo số liệu từ Hiệp hội Các nhà sản xuất ô tô Việt Nam (VAMA), sau ba quý đầu năm 2025, tổng doanh số bánxe bán tảitại Việt Nam đạt 18.282 xe, tăng 3.196 xe tương đương 17,5% so với cùng kỳ năm ngoái. Trong đó, Ford Ranger bán chạy nhất với tổng cộng 12.577 xe đã giao đến tay khách hàng. Toyota Hilux, Mitsubishi Triton đều đã bán được hơn 2.500 xe. Trong khi doanh số cộng dồn của Isuzu D-Max chưa tới 400 xe."
