url,title,description,content
https://thanhnien.vn/cong-bo-du-thao-van-kien-dai-hoi-xiv-cua-dang-lay-y-kien-nhan-dan-185251015221406922.htm,Công bố dự thảo văn kiện Đại hội XIV của Đảng lấy ý kiến nhân dân,"Ngày 15.10, các văn kiện Đại hội XIV của Đảng đã được công bố để lấy ý kiến đại biểu Quốc hội, MTTQ, các tổ chức chính trị - xã hội, đoàn thể, cán bộ, đảng viên và nhân dân.","Dự thảo các văn kiệnĐại hội XIVcủa Đảng gồm: Báo cáo chính trị; Báo cáo tổng kết một số vấn đề lý luận và thực tiễn về công cuộc đổi mới theo định hướng XHCN trong 40 năm qua ởViệt Nam, và Báo cáo tổng kết 15 năm thi hành Điều lệ Đảng. Trong đó, dự thảo Báo cáo chính trị được xây dựng trên cơ sở tích hợp 3 báo cáo, gồm: Báo cáo chính trị, Báo cáo KT-XH, Báo cáo tổng kết xây dựng Đảng và thi hành Điều lệ Đảng.
Báo cáo chính trị trìnhĐại hội XIVcủa Đảng có tiêu đề: Dưới lá cờ vẻ vang của Đảng, chung sức, đồng lòng thực hiện thắng lợi các mục tiêu phát triển đất nước đến năm 2030; tự chủ chiến lược, tự cường, tự tin, tiến mạnh trong kỷ nguyên vươn mình của dân tộc vì hòa bình, độc lập, dân chủ, giàu mạnh, phồn vinh, văn minh, hạnh phúc, vững bước đi lên CNXH.
Tại Hội nghị T.Ư 13 vừa qua, T.Ư Đảng đã giao Bộ Chính trị hoàn thiện dự thảo văn kiện, gửi lấy ý kiến nhân dân
ẢNH: GIA HÂN
Báo cáo cho biết quá trình thực hiệnNghị quyếtĐại hội XIII diễn ra trong bối cảnh rất nhiều khó khăn, thách thức. Song với ý chí, khát vọng phát triển, kiến tạo tương lai, tư duy đổi mới, nỗ lực lớn, hành động quyết liệt, toàn Đảng, toàn dân, toàn quân ta đã chung sức, đồng lòng thực hiện thắng lợi Nghị quyết Đại hội XIII. Đảng đã vững vàng lãnh đạo đất nước tiếp tục đạt được những kết quả rất quan trọng, toàn diện, đột phá, nhiều điểm sáng nổi bật.
Cụ thể là phát triển kinh tế, thực hiện 3 đột phá chiến lược đạt nhiều kết quả quan trọng, nổi bật; quản lý tài nguyên, bảo vệ môi trường và thích ứng vớibiến đổi khí hậucó bước chuyển biến tích cực. Trong đó, tăng trưởng GDP giai đoạn 2021 - 2025 đạt bình quân khoảng 6,3%/năm, thuộc nhóm nước tăng trưởng cao của khu vực và thế giới. Quy mô GDP năm 2025 ước đạt trên 510 tỉ USD, gấp 1,47 lần so với năm 2020, xếp thứ 32 trên thế giới; GDP bình quân đầu người đạt khoảng 5.000 USD, gia nhập nhóm nước có thu nhập trung bình cao… Việc phát triển văn hóa, con người và xã hội đạt kết quả rất quan trọng, nhiều mặt tiến bộ; an sinh xã hội và đời sống nhân dân ngày càng được nâng cao. Chỉ số xếp hạng hạnh phúc tăng 33 bậc so với đầu nhiệm kỳ, xếp thứ 46/143 quốc gia.
Cùng đó, báo cáo đánh giá,quốc phòng, an ninh không ngừng được củng cố, tăng cường; quan hệ đối ngoại và hội nhập quốc tế được nâng tầm, đạt nhiều kết quả nổi bật. Xây dựng, chỉnh đốn Đảng và hệ thống chính trị đạt được nhiều kết quả rất quan trọng, có mặt nổi bật, đột phá chưa từng có. Đặc biệt lần đầu tiên hoàn thành việc bố trí 100% bí thư tỉnh ủy, thành ủy trực thuộc T.Ư, chủ nhiệm ủy ban kiểm tra cấp xã không phải là người địa phương. Đồng thời, xây dựng phương án bố trí nhân sự chủ tịch UBND tỉnh, thành phố, chánh thanh tra tỉnh, thành phố không phải người địa phương trước và ngay sau Đại hội XIV của Đảng.
Báo cáo cũng đặc biệt nhấn mạnh cuộc cách mạng về sắp xếp tổ chức bộ máy của hệ thống chính trị theo hướng tinh, gọn, mạnh, hiệu năng, hiệu lực, hiệu quả đã đạt được những kết quả mang tính đột phá. Trong một thời gian rất ngắn, đã tiến hành đồng bộ việc sửa đổi, bổ sung, ban hành mới hệ thống các quy định của Đảng, Hiến pháp, pháp luật… tạo lập cơ sở chính trị, pháp lý vững chắc để bộ máy hoạt động bình thường, liên tục, thông suốt, góp phần mở đường cho kiến tạo phát triển.
Về mục tiêu xây dựng, phát triển đất nước trong giai đoạn mới, Báo cáo chính trị nêu rõ cục diện thế giới đang chuyển biến nhanh, phức tạp chưa từng có theo hướng đa cực, đa trung tâm, đa tầng, phân mảnh và phân tuyến mạnh. Ở trong nước, sau 40 năm đổi mới, cơ đồ, tiềm lực, vị thế và uy tín quốc tế của đất nước được nâng lên, là nền tảng quan trọng để đất nước vươn mình trongkỷ nguyên mới. Tuy nhiên, trong 5 năm tới, đất nước ta sẽ phải đối mặt với nhiều khó khăn, thách thức, có những mặt gay gắt, nặng nề hơn so với giai đoạn trước. Phát triển KT-XH chưa bền vững. Nguy cơ bao trùm là nguy cơ tụt hậu, nhất là về công nghệ và rơi vàobẫy thu nhập trung bình...
Về mục tiêu phát triển, báo cáo nêu rõ, giữ vững môi trường hòa bình, ổn định; phát triển nhanh, bền vững đất nước và bảo vệ vững chắc Tổ quốc; cải thiện và nâng cao toàn diện đời sống nhân dân; tự chủ chiến lược, tự cường, tự tin, tiến mạnh trong kỷ nguyên mới của dân tộc; thực hiện thắng lợi mục tiêu đến năm 2030 trở thành nước đang phát triển có công nghiệp hiện đại, thu nhập trung bình cao; hiện thực hóa tầm nhìn đến năm 2045 trở thành nước phát triển, thu nhập cao vì một nướcViệt Namhòa bình, độc lập, dân chủ, giàu mạnh, phồn vinh, văn minh, hạnh phúc, vững bước đi lên CNXH.
Báo cáo cũng xác định 6 nhiệm vụ trọng tâm. Trong đó nhấn mạnh tập trung ưu tiên xây dựng đồng bộ thể chế phát triển, trọng tâm là hệ thống pháp luật, cơ chế, chính sách nhằm tháo gỡ kịp thời, dứt điểm các nút thắt, điểm nghẽn, thúc đẩy đổi mới sáng tạo, đáp ứng yêu cầu phát triển nhanh, bền vững đất nước trong kỷ nguyên mới.
Tiếp tục đẩy mạnh xây dựng, chỉnh đốn Đảng và hệ thống chính trị trong sạch, vững mạnh toàn diện. Triển khai hoạt động có hiệu quả tổ chức bộ máy hệ thống chính trị theo mô hình mới bảo đảm vận hành thông suốt, đáp ứng yêu cầu nhiệm vụ phát triển đất nước nhanh và bền vững. Tiếp tục đổi mới mạnh mẽ công tác cán bộ bảo đảm thực chất, hiệu quả, nhất là công tác thẩm định, đánh giá cán bộ. Xây dựng đội ngũ cán bộ các cấp thật sự có đức, có tài, không ngừng tự đổi mới, ngang tầm nhiệm vụ.
Về kinh tế:Phấn đấu đạt tốc độ tăng trưởng GDP bình quân cho giai đoạn 2026 - 2030 từ 10%/năm trở lên; GDP bình quân đầu người đến năm 2030 đạt khoảng 8.500 USD; tỷ trọng kinh tế số đạt khoảng 30% GDP; tỷ lệ đô thị hóa đạt trên 50%...
Về xã hội:Chỉ số phát triển con người (HDI) phấn đấu đạt khoảng 0,78; tuổi thọ trung bình tính từ lúc sinh đạt khoảng 75,5 tuổi, trong đó thời gian sống khỏe mạnh đạt tối thiểu 68 năm. Tỷ lệ hộ nghèo (theo chuẩn nghèo đa chiều giai đoạn 2026 - 2030) duy trì mức giảm 1 - 1,5 điểm %/năm.
Về môi trường:Tỷ lệ che phủ rừng duy trì mức 42%; tỷ lệ xử lý và tái sử dụng nước thải ra môi trường lưu vực các sông đạt khoảng 65 - 70%; lượng phát thải khí nhà kính giảm 8 - 9%; tỷ lệ các cơ sở sản xuất kinh doanh đạt quy chuẩn về môi trường đạt khoảng 98 - 100%...
Đẩy mạnh phát triển nền kinh tế thị trường định hướng XHCN hiện đại, hội nhập quốc tế, đáp ứng yêu cầu phát triển lực lượng sản xuất mới; phát triển kinh tế nhà nước thực sự giữ vai trò chủ đạo, phát triển kinh tế tư nhân là một động lực quan trọng nhất của nền kinh tế. Xác lập mô hình tăng trưởng mới, cơ cấu lại nền kinh tế, đẩy mạnh công nghiệp hóa, hiện đại hóa, lấy KH-CN, đổi mới sáng tạo và chuyển đổi số làm động lực chính.
Báo cáo cũng xác định, tập trung triển khai đột phá về KH-CN, đổi mới sáng tạo và chuyển đổi số tạo nền tảng cho phát triển lực lượng sản xuất mới, hiện đại, ưu tiên phát triển một số ngành công nghiệp, công nghệ chiến lược, trọng tâm là trí tuệ nhân tạo. Đồng thời, phát triển nguồn lực con người, phát triển văn hóa thực sự trở thành nền tảng, sức mạnh nội sinh, động lực to lớn cho sự phát triển nhanh, bền vững của đất nước. Xây dựng nền giáo dục quốc dân hiện đại, ngang tầm khu vực và thế giới, trọng tâm là nâng cao chất lượng GD-ĐT. Tiếp tục đổi mới phương thức quản lý xã hội và quản lý phát triển xã hội bền vững.
Tiếp tục xây dựng lực lượng quân đội nhân dân, công an nhân dân cách mạng, chính quy, tinh nhuệ, hiện đại, bảo vệ vững chắc độc lập, chủ quyền, thống nhất và toàn vẹn lãnh thổ, biển, đảo của đất nước. Đẩy mạnh triển khai đồng bộ, sáng tạo, hiệu quả công tác đối ngoại.
Báo cáo chính trị cũng xác định 3 đột phá chiến lược trong nhiệm kỳ 2026 - 2030. Trong đó xác định đột phá mạnh mẽ về thể chế phát triển, nâng cao năng lực hoạch định và tổ chức thực hiện chủ trương, đường lối của Đảng, chính sách, pháp luật của Nhà nước để khơi thông, giải phóng và phát huy hiệu quả mọi nguồn lực; đẩy mạnh phân cấp, phân quyền trong quản lý, quản trị phát triển giữa T.Ư và địa phương, phát huy vai trò tự chủ, tự chịu trách nhiệm của địa phương; thúc đẩy đột phá về KH-CN, đổi mới sáng tạo và chuyển đổi số phục vụ, kiến tạo phát triển; thúc đẩy phát triển kinh tế tư nhân…
Cùng đó, tập trung chuyển đổi cơ cấu và nâng cao chất lượng nguồn nhân lực, phát triển nguồn nhân lực chất lượng cao, trình độ cao; đẩy mạnh thu hút và trọng dụng nhân tài; khuyến khích và bảo vệ cán bộ năng động, sáng tạo, dám nghĩ, dám làm, dám chịu trách nhiệm vì lợi ích chung. Đổi mới mạnh mẽ công tác cán bộ, bảo đảm khách quan, dân chủ, thực chất, hiệu quả, nhất là công tác thẩm định, đánh giá cán bộ theo đúng chủ trương ""có vào, có ra"", ""có lên, có xuống"".
Tiếp tục hoàn thiện đồng bộ và đột phá mạnh mẽ trong xây dựng kết cấu hạ tầng kinh tế - xã hội; nhất là kết cấu hạ tầng giao thông đa phương thức, hạ tầng công nghệ phục vụ cho quá trình quản lý, quản trị và kiến tạo phát triển, hạ tầng phục vụ chuyển đổi số, chuyển đổi xanh, chuyển đổi năng lượng, thích ứng với biến đổi khí hậu.
Chiều cùng ngày, tại họp báo quốc tế công bố các dự thảo văn kiện trình Đại hội XIV của Đảng để lấy ý kiến nhân dân, Phó chủ tịch thường trực Hội đồng Lý luận T.Ư Tạ Ngọc Tấn cho biết dự thảo văn kiện trình Đại hội XIV lần này có rất nhiều nội dung mới.
Theo ông Tấn, từ tổng kết 40 năm đổi mới và thực hiện Nghị quyếtĐại hội XIIIcủa Đảng, T.Ư Đảng đã rút ra những bài học kinh nghiệm quan trọng. Trên cơ sở đó, dự thảo văn kiện Đại hội XIV đã đưa ra nhóm quan điểm phát triển mới. Trong đó, văn kiện vẫn nhất quán kiên định với chủ nghĩa Mác - Lê nin, mục tiêu xây dựng CNXH; kiên định đường lối đổi mới và đặc biệt là coi lý luận về đường lối đổi mới là một bộ phận thuộc nền tảng tư tưởng của Đảng.
Cạnh đó, khi xác định những quan điểm chỉ đạo về phát triển đất nước trong giai đoạn tới, dự thảo văn kiện đã bổ sung, nhấn mạnh nhiều nội dung mới. Cụ thể là việc đưa môi trường vào thành một nội dung trọng yếu, trung tâm cùng với KT-XH. Theo đó, văn kiện nhấn mạnh phát triển KT-XH và bảo vệ môi trường là trung tâm; xây dựng Đảng là then chốt và phát triển văn hóa, con người là nền tảng. Văn kiện cũng nhấn mạnh nội dung đẩy mạnh đối ngoại và hội nhập quốc tế; coi tăng cường quốc phòng, an ninh và đẩy mạnh đối ngoại, hội nhập quốc tế là trọng yếu, thường xuyên.
Một điểm mới nữa, ông Tấn cho hay trong quan điểm chỉ đạo về phát triển đất nước giai đoạn tới, văn kiện Đại hội XIV cũng xác định xác lập mô hình tăng trưởng mới, lấy KH-CN, đổi mới sáng tạo, chuyển đổi số quốc gia là động lực chính vàphát triển kinh tế tư nhânlà một động lực quan trọng nhất. Đây là lần đầu tiên văn kiện Đại hội Đảng xác định kinh tế tư nhân là một động lực quan trọng nhất của kinh tế quốc gia.
Với vấn đề xây dựng Đảng, hệ thống chính trị, ông Tấn cho biết trước Đại hội, cả nước đã thực hiện cuộc cách mạng sắp xếp, tinh gọn tổ chức bộ máy, xây dựng chính quyền địa phương 2 cấp. Vấn đề còn lại rất mới đặt ra là tăng cường công tác tổ chức cán bộ và đặc biệt là tăng cường đội ngũ cán bộ cấp cơ sở để thực hiện các nhiệm vụ rất quan trọng của địa phương.
Về mục tiêu phát triển, dự thảo văn kiện Đại hội XIV đã xác định mục tiêu rất ""tham vọng"" của Đảng là đến năm 2030, GDP phải đạt 8.500 USD/người; trở thành một nước đang phát triển, có thu nhập trung bình cao. Để đạt mục tiêu này, dự thảo văn kiện Đại hội XIV đã nêu hàng loạt đổi mới, cải cách, đặc biệt là cải cách vềthể chế. Do đó, văn kiện trình Đại hội lần này có hẳn một mục riêng là hoàn thiện thể chế để phát triển nhanh, bền vững. Trong đó xác định, tập trung hoàn thiện toàn diện, đồng bộ thể chế phát triển nhanh, bền vững đất nước, trong đó thể chế chính trị là then chốt, thể chế kinh tế là trọng tâm, các thể chế khác là rất quan trọng.
(*) Mời bạn đọc xemtoàn văn dự thảo các văn kiện Đại hội XIV của Đảng."
https://thanhnien.vn/dam-bao-chat-luong-an-toan-cho-le-mo-ky-cong-uoc-ha-noi-185251015225722669.htm,"Đảm bảo chất lượng, an toàn cho lễ mở ký Công ước Hà Nội","Sáng 15.10, Chủ tịch nước Lương Cường đã làm việc với các cơ quan liên quan về công tác chuẩn bị cho lễ mở ký Công ước của Liên Hiệp Quốc về chống tội phạm mạng (Công ước Hà Nội) sẽ diễn ra vào 25 - 26.10 tại Hà Nội.","Báo cáo của ban chỉ đạo lễ mở ký cho biết, tính đến ngày 14.10 đã có 93 đoàn do lãnh đạo cấp cao và lãnh đạo bộ ngành các nước làm trưởng đoàn khẳng định tham dự sự kiện cùng hơn 1.000 đại biểu và báo chí.
Chủ tịch nước Lương Cường chủ trì buổi làm việc về công tác chuẩn bị cho lễ mở ký Công ước Hà Nội
Ảnh: TTXVN
Bộ Công anvà Bộ Ngoại giao đã phối hợp chặt chẽ với Cơ quan củaLiên Hiệp Quốc(LHQ) về ma túy và tội phạm (UNODC) xây dựng chương trình lễ mở ký, cũng như 8 sự kiện cấp cao do lãnh đạo các bộ, ngành liên quanViệt Namvà UNODC điều hành; 38 hội thảo, thảo luận chuyên môn và hơn 20 gian hàng triển lãm.
Phát biểu kết luận buổi làm việc, Chủ tịch nước nhấn mạnhViệt Namđăng cai mở lễ ký Công ước Hà Nội là một dấu mốc quan trọng khi lần đầu tiênViệt Namlà chủ nhà để tổ chức mở ký mộtcông ướccủa LHQ, trong bối cảnh vấn đề chống tội phạm mạng đang được quan tâm.
Chủ tịch nước khẳng định, việc chủ trì lễ mở ký là minh chứng cho thấyViệt Namlà một quốc gia chủ nhà có trách nhiệm; là bạn, là đối tác tin cậy, là thành viên tích cực, có trách nhiệm của cộng đồng quốc tế; sẵn sàng đóng góp cho hòa bình, ổn định và phát triển của thế giới; tuân thủ Hiến chương LHQ và luật pháp quốc tế.
Để lễ mở ký đạt được yêu cầu cao nhất, Chủ tịch nước lưu ý các cơ quan chức năng, rà soát sự phối hợp trong nội bộ từng bộ ngành và giữa các bộ ngành, TP.Hà Nội, bảo đảm chặt chẽ từ kịch bản, nội dung, kế hoạch, tiến độ, chất lượng triển khai. Cùng với đó đánh giá kỹ lưỡng các nội dung đã chuẩn bị từ các khâu kỹ thuật, nội dung, lễ tân, an ninh; xem xét những vấn đề gì có khó khăn, vướng mắc phải giải quyết, tháo gỡ, bảo đảm công tác tổ chức chu đáo, chất lượng, an toàn tuyệt đối."
https://thanhnien.vn/ong-nguyen-doan-anh-tiep-tuc-lam-bi-thu-tinh-uy-thanh-hoa-185251015153824324.htm,Ông Nguyễn Doãn Anh tiếp tục làm Bí thư Tỉnh ủy Thanh Hóa,"Ông Nguyễn Doãn Anh, Ủy viên T.Ư Đảng, Bí thư Tỉnh ủy Thanh Hóa khóa XIX, đã được Ban Chấp hành Đảng bộ tỉnh Thanh Hóa bầu giữ chức Bí thư Tỉnh ủy Thanh Hóa khóa XX, nhiệm kỳ 2025 - 2030.","Chiều 15.10, Đoàn chủ tịch Đại hội đại biểuĐảng bộ tỉnh Thanh Hóađã thông báo kết quả phiên họp thứ nhất của Ban Chấp hành Đảng bộ tỉnh Thanh Hóa khóa XX. Trước đó, vào sáng cùng ngày, đại hội đã bầu 69 người vào Ban Chấp hành Đảng bộ tỉnh Thanh Hóa khóa XX.
Thủ tướng Chính phủ Phạm Minh Chính tặng hoa chúc mừng Ban Chấp hành Đảng bộ tỉnh Thanh Hóa khóa XX, nhiệm kỳ 2025 - 2030.
ẢNH: BTC
Theo đó, tại phiên họp thứ nhất, Ban Chấp hành Đảng bộ tỉnh Thanh Hóa khóa XX đã tiến hành bầu Ban Thường vụ Tỉnh ủy, Bí thư Tỉnh ủy, Phó bí thư Tỉnh ủy, Ủy ban Kiểm tra Tỉnh ủy và Chủ nhiệm Ủy ban Kiểm tra Tỉnh ủy Thanh Hóa khóa XX, nhiệm kỳ 2025 - 2030.
Cụ thể,  đã bầu 15 người vào Ban Thường vụ Tỉnh ủy. ÔngNguyễn Doãn Anh, Ủy viên T.Ư Đảng, Bí thư Tỉnh ủy Thanh Hóa khóa XIX, tiếp tục được bầu giữ chứcBí thư Tỉnh ủy Thanh Hóakhóa XX.
Các ông:Nguyễn Hoài Anh, Ủy viên dự khuyết T.Ư Đảng, Phó bí thư Tỉnh ủy khóa XIX, Chủ tịch UBND tỉnh Thanh Hóa; Nguyễn Hồng Phong, Phó bí thư thường trực Tỉnh ủy khóa XIX; Trịnh Tuấn Sinh, Phó bí thư Tỉnh ủy khóa XIX, Chủ tịch Ủy ban MTTQ VN tỉnh, tiếp tục giữ chức Phó bí thư Tỉnh ủy Thanh Hóa khóa XX.
Bí thư Tỉnh ủy Thanh Hóa Nguyễn Doãn Anh
ẢNH: BTC
Ông Nguyễn Doãn Anh, quê ở TP.Hà Nội, Ủy viên T.Ư Đảng khóa XIII, có bằng đại học ngành Chỉ huy Tham mưu Binh chủng Hợp thành, Cao cấp chuyên ngành Quân sự. Ông Nguyễn Doãn Anh là sĩ quan cao cấp mang quân hàm thượng tướng QĐND VN, từng đảm nhiệm các chức vụ Tư lệnh Bộ Tư lệnh Thủ đô Hà Nội, Tư lệnh Quân khu 4, Phó tổng tham mưu trưởng QĐND VN. Ngày 25.10.2024, ông Nguyễn Doãn Anh được Bộ Chính trị điều động, chỉ định giữ chức Bí thư Tỉnh ủy Thanh Hóa nhiệm kỳ 2020 - 2025.
Ban Chấp hành Đảng bộ tỉnh Thanh Hóa cũng đã bầu Ủy ban Kiểm tra Tỉnh ủy gồm 10 người. Bà Phạm Thị Thanh Thủy, Ủy viên Ban Thường vụ, Chủ nhiệm Ủy ban Kiểm tra Tỉnh ủy khóa XIX tiếp tục được bầu giữ chức Chủ nhiệm Ủy ban Kiểm tra Tỉnh ủy khóa XX, nhiệm kỳ 2025 - 2030.
Cũng tại phiên họp chiều 15.10, đại hội đã bầu Đoàn đại biểu Đảng bộ tỉnh Thanh Hóa đi dự Đại hội đại biểu toàn quốc lần thứ XIV của Đảng, gồm 33 đại biểu chính thức và 2 đại biểu dự khuyết."
