url,title,description,content
https://thanhnien.vn/xe-the-thao-toyota-nhieu-dai-gia-viet-so-huu-se-khai-tu-vao-nam-2026-185251028142503102.htm,Xe thể thao Toyota nhiều đại gia Việt sở hữu sẽ khai tử vào năm 2026,"Vốn đã hiếm có khó tìm tại Việt Nam, xe thể thao Toyota GR Supra càng trở nên giá trị hơn sau khi hãng xe Nhật Bản công bố thời điểm ngừng sản xuất vào năm 2026.","Toyota xác nhận sẽ ngừng sản xuất xe thể thaoGR Supravào tháng 3.2026, khép lại hành trình hơn nửa thập kỷ của mẫu xe này, kể từ khi xuất hiện vào năm 2019. Với giới mê xe, GR Supra không dừng ở xe thể thao Nhật Bản, mà còn là một biểu tượng gắn liền với tốc độ, hiệu suất và những phong cách độ xe táo bạo.
Tại Việt Nam, GR Supra được giới mộ điệu ví như ""xe độc"" vì chưa từng được Toyota Việt Nam phân phối chính hãng. Mẫu xe này chủ yếu nhập về nước thông qua đơn vị kinh doanh xe không chính hãng với số lượng giới hạn với giá không dưới 5 tỉ đồng. Chính sự hiếm có khso tìm này càng làm tăng giá trị của GR Supra Việt Nam.
Một chiếc Toyota GR Supra hiếm hoi lăn bánh tại Việt Nam
ẢNH: TN
Trước thế hệ MkV, thế hệ Supra MkIV sản xuất từ 1993 - 2002 từng gây chú ý và tạo dấu ấn với tín đồ chơi xe phong cách JDM. Đây là giai đoạn vàng son của dòng xe này khi mang trong mình khối động cơ 2JZ-GTE trứ danh, được một số lò độ nâng cấp công suất vượt mốc 1.000 mã lực. Ngoài ra, Supra MkIV cũng góp mặt trong loạt phim Fast & Furious và nhanh chóng trở thành biểu tượng được nhiều người biết đến.
Sau 17 năm gián đoạn, Supra được Toyota hồi sinh vào năm 2019 dưới tên GR Supra (MkV), phát triển trên nền tảng khung gầm chung với BMW Z4, sử dụng động cơ tăng áp B58 I6, dung tích 3.0 lít do BMW cung cấp.
Trước đó đã có thông tin BMW Z4 bị khai tử, dây chuyền sản xuất mẫu xe này tại nhà máy Magna Steyr (Graz) sẽ dừng hoạt động vào đầu năm 2026. Vì Supra và Z4 phát triển chung nền tảng nên nhiều người cho rằng Toyota Supra khai tử cũng phần nào liên quan tới mẫu xe thể thao hạng sang của BMW.
Dùng chung động cơ với BMW Z4, GR Supra (MkV) sẽ khai tử vào đầu năm 2026
ẢNH: TOYOTA
Trong tương lai, để duy trì huyền thoại ""Supra"", có lẽToyotaphải tự phát triển thế hệ kế tiếp với nền tảng, động cơ hoàn toàn mới. Đây cũng là yếu tố khá tốn kém, đáng được cân nhắc kỹ lưỡng trong bối cảnh kỷ nguyên xe điện đang lên ngôi.
Trước khi khai tử GR Supra, Toyota sẽ tung ra phiên bản đặc biệt Final Edition cho mẫu xe này. Tại Mỹ, GR Supra Final Edition vẫn dùng động cơ xăng tăng áp 3.0 lít, công suất 382 mã lực đi kèm hộp số sàn hoặc hộp số tự động. Riêng tại thị trường quê nhà và châu Âu, phiên bản đặc biệt vẫn dùng động cơ tương tự nhưng công suất được nâng lên 429 mã lực, số lượng xe bán ra giới hạn 300 chiếc.
Việc Toyota khai tử GR Supra khiến mẫu xe này càng trở nên độc đáo và thành ""của hiếm"" tại Việt Nam với số lượng vốn đã ít ỏi. Trong thời gian tới, chiếc xe này có thể sẽ được nhiều đại gia Việt, chơi xe có gu sẵn sàng chi số tiền lớn để săn đón."
https://thanhnien.vn/mg-hs-giam-gia-con-560-trieu-dong-re-hon-toyota-yaris-cross-185251030104903788.htm,"MG HS giảm giá còn 560 triệu đồng, rẻ hơn Toyota Yaris Cross","Mẫu crossover hạng C - MG HS tiếp tục được đại lý giảm giá bán lên đến gần 150 triệu đồng, giá thực tế hiện chỉ khoảng 560 triệu đồng, rẻ hơn một số mẫu SUV hạng B nhưng chỉ áp dụng cho xe số VIN 2024.","Trong quý cuối cùng của năm 2025, thị trường ô tô Việt Nam tiếp tục chứng kiến đợt giảm giá mạnh từ các hãng, đại lý để kích cầu tiêu dùng. Trong đó, mẫuMG HSđang được giảm tất tay lên tới 145 triệu đồng, cao nhất từ trước đến nay. So với mức giảm 115 triệu đồng vào hồi tháng 4, ""đáy"" mới của MG HS tạo không ít áp lực lên các mẫu xe đối thủ trong phân khúccrossover hạng Cvà cả những mẫu xe phân khúc hạng B.
MG HS đang được đại lý giảm giá 135 - 145 triệu đồng, tùy từng phiên bản
ẢNH: MG
Theo đó,MG HSbản DEL tiêu chuẩn được giảm 135 triệu đồng, đưa giá niêm yết 699 triệu xuống còn 564 triệu đồng. Bản LUX cao cấp nhất được giảm 145 triệu đồng, giá thực tế chỉ còn 604 triệu đồng. Tuy nhiên, mức giá trên chỉ áp dụng với xe có số VIN 2024 và số lượng xe cũng như màu sắc có giới hạn.
Trao đổi với PVThanh Niên, một số tư vấn bán hàng của đại lý MG khu vực miền Bắc cho biết, xe HS đời 2025 chưa nhập về nước nên hiện tại chỉ bán lô xe đời 2024, nhờ đó giá xe được ưu đãi mạnh.
Với giá thực tế sau ưu đãi từ 564 triệu đồng, MG HS tiếp tục trở thành mẫu crossover hạng C rẻ nhất phân khúc, thậm chí thấp hơn nhiều mẫu SUV đô thị hạng B như Toyota Yaris Cross (650 - 765 triệu đồng), Mitsubishi Xforce (599 - 705 triệu đồng), Hyundai Creta (599 - 715 triệu đồng)... Điều này tạo áp lực cạnh tranh khá lớn lên các mẫu xe kể trên khi MG HS được đánh giá vượt trội hơn ở nhiều khía cạnh.
Nội thất phiên bản LUX của MG HS bọc da 2 tông màu thể thao
ẢNH: MG
MG HS sở hữu kích thước tổng thể dài, rộng, cao lần lượt 4.610 x 1.876 x 1.664 (mm), chiều dài cơ sở 2.720 mm. Từ phiên bản tiêu chuẩn, mẫu xe này đã trang bị nhiều tiện nghi như hàng ghế trước chỉnh điện, 4 cửa kính chỉnh điện một chạm, điều hòa tự động, cửa sổ trời toàn cảnh, camera 360 độ...
Về khả năng vận hành, MG HS trang bị động cơ xăng tăng áp, dung tích 1.5 lít, công suất 160 mã lực và mô-men xoắn đạt 250 Nm, kết hợp cùng hộp số ly hợp kép 7 cấp, dẫn động cầu trước.
SUV đô thị: Vượt Mitsubishi Xforce, Toyota Yaris Cross bán chạy nhất nửa đầu năm 2025
Mặc dù vượt trội ở nhiều khía cạnh, MG HS vẫn chưa được trang bị côngnghệ antoàn, hỗ trợ lái xe nâng cao ADAS. Đây là ""điểm trừ"" của mẫu xe này khi so sánh với các mẫu xe đối thủ trong phân khúc. Thậm chí, những mẫu SUV đô thị cỡ nhỏ hiện nay cũng đã tích hợp công nghệ ADAS trên một số phiên bản cao cấp.
Xét ở khía cạnh tổng thể,MG HSvẫn là một mẫu xe đáng cân nhắc khi đang được giảm giá từ 135 - 145 triệu đồng. Với mức giá hiện tại chỉ từ 560 triệu đồng, mẫu xe này không chỉ gây ""khó dễ"" cho các đối thủ trong phân khúc mà còn tạo thêm áp lực cạnh tranh với các mẫuSUV đô thị."
https://thanhnien.vn/giai-ma-bi-mat-thanh-cong-cua-lexus-18525110218193154.htm,Giải mã bí mật thành công của Lexus,"Non và trẻ là thứ người ta nghĩ đến khi hỏi về ""tuổi tác"" của Lexus nhưng không vì thế mà hãng xe Nhật Bảnthua kém đối thủ xe sang nhờ những bí mật dưới đây.","Có thể bạn không biết giá trị thị trường xe sang đã tăng gấp đôi chỉ trong thập niên qua từ khoảng 390 tỉ USD (năm 2014) đến 695 tỉ USD (năm 2024). Con số này nói lên một thực tế đây là phân khúc béo bở với bất kì nhà sản xuất xe hơi nào nhưng cũng đầy khốc liệt. Chẳng thế mà vào cuối những năm 80 thế kỷ trước, cả 3 nhà sản xuất xe hơi phổ thông đến từ Nhật Bản không hẹn mà gặp cùng nhau khai sinh ra thương hiệu xe sang của riêng mình. Toyota có Lexus, Honda có Acura, Nissan có Infiniti.
Thế nhưng…
Chỉ có duy nhất Lexus thành công trên thị trường toàn cầu đồng thời đứng đầu doanh số tại chính quê nhà Nhật Bản. Acura và Infiniti cũng gặt hái nhiều thành công trên đất Mỹ nhưng không thể hiện diện tại 90 quốc gia trên toàn thế giới và cạnh tranh sòng phẳng với các thương hiệu có tuổi đời tính bằng thế kỷ đến từ lục địa già như Lexus.
Vậy, thành công ấy đến từ đâu?
Lexus LS Coupe Concept 4 cửa nhưng khác biệt với cửa sau dạng ""suicide door"" và một cửa hậu
ẢNH: QUANG THÁI
Câu khẩu hiệu của Lexus có vẻ như không phải sinh ra để truyền thông mà thực sự được áp dụng xuyên suốt trong lịch sử hơn 30 năm. Điều này thể hiện rõ qua những thống kê về độ tin cậy.
Lexus đứng đầu với chỉ 140 vấn đề trên 100 xe, trong khi con số này trên Mercedes-Benz là 190, BMW trên 200, theo J.D.Power. Đây là lần thứ 12/14 năm Lexus đứng top bảng xếp hạng. Tờ U.S. News cũng xếp thương hiệu này vào top xe sang đáng tin cậy nhất năm 2025 với số điểm 91-100 trong khi BMW hay Audi chỉ ở mức 81-90.
Một số nghiên cứu độc lập cũng chỉ ra rằng, so với đối thủ cạnh tranh, Lexus có chi phí sửa chữa thấp và ít hỏng vặt hơn. Đơn cử một số mẫu xe như Lexus RX hay GX thường chạy mượt mà sau hơn 300.000 km nhưng BMW 5-Series hay Audi A6 lại bắt đầu có dấu hiệu lỗi ở hệ thống điện tử. Một khảo sát của Consumer Reports cho thấy, sau 10 năm xe Lexus mất khoảng 6.750 USD để bảo dưỡng xe, thấp hơn nhiều so với BMW (9.500), Audi (9.809), Mercedes-Benz (10.525). Độ tin cậy này giúp Lexus giữ được giá trị bán lại cao, từ 60-70% so với con số 50-60% của BMW sau cùng 5 năm sử dụng.
Lexus LM 500h mới với nhiều thay đổi theo hướng thanh lịch mang tính tái định vị dòng xe này
ẢNH: LEXUS
Cùng với nghệ thuật chăm sóc khách hàng ""Omotenashi"" được áp dụng mang đến tính nhất quán trên quy mô toàn cầu, tỉ lệ khách hàng hài lòng với Lexus cũng ở mức cao giúp thương hiệu này ""được lòng"" tệp khách hàng lớn tuổi, họ hầu hết là chuyên gia, nhà quản lý thuộc nhóm 20% có địa vị kinh tế xã hội cao nhất và được xếp vào nhóm chi tiêu mạnh tay cần chất lượng, sự tin cậy hơn là ngoại hình, công nghệ hay ""cảm giác lái"".
Trước khi ngôn ngữ thiết kế L-Finesse áp dụng rộng rãi từ khoảng 2014-2015, Lexus thường bị lép vế khá nhiều khi đặt cạnh đối thủ. L-Finesse ra đời là sự kết hợp hai yếu tố ""Leading edge - Tiên phong, đổi mới"" và ""Finesse - Tinh tế, nghệ thuật"" tạo nên phong cách thiết kế hiện đại, trẻ trung nhưng vẫn sang trọng, tinh tế.
Lexus LS Concept 6 bánh xe độc đáo thu hút khách thưởng lãm Japan Mobility Show 2025
ẢNH: QUANG THÁI
Ngôn ngữ thiết kế này tập trung vào dự đoán, thấu hiểu và đáp ứng mong muốn của người dùng một cách liền mạch đồng thời giản lược, loạt bỏ chi tiết thừa hướng đến làm nổi bật vẻ đẹp bản chất nhờ kết hợp đối lập của nét thanh lịch và mạnh mẽ mang đến chiều sâu trong cả thẩm mỹ và cảm xúc. Trong đó, lưới tản nhiệt hình con suốt chính là nhận diện đặc trưng, thành công nhất của ngôn ngữ thiết kế này trên thế hệ xe Lexus mới.
Hiện tại, Lexus đang trong quá trình áp dụng ngôn ngữ thiết kế Beyond L mới trên các dòng xe xanh. Nó không thay thế L-Finesse mà như một bản nâng cấp 2.0 phá cách hơn nhưng vẫn giữ được sự tinh tế đón đầu kỷ nguyên xe điện. Nếu coi L-Finesse là một bộ vest may đo cổ điển thì Beyond L là một chiếc ""streetwear"" hiện đại, linh hoạt và mượt mà hơn.
SUV và Hybrid
Ngoài ""giá trị cốt lõi"" và ngôn ngữ thiết kế đổi mới, thành công của Lexus còn được ghi nhận bằng chiến lược phát triển sản phẩm. Trong đó, hãng xe sang Nhật Bản tập trung vào phát triển và bán các dòng xe thể thao đa dụng nhiều hơn so với đối thủ. Bằng chứng là tại châu Âu, xe thể thao đa dụng chiếm tới 80% doanh số của Lexus.
Thành công của Lexus được ghi nhận bằng chiến lược phát triển sản phẩm, trong đó xe thể thao đa dụng chiếm tới 80% doanh số của hãng tại châu Âu
ẢNH: QUANG THÁI
Tại thị trường Mỹ, doanh số bán hàng SUV của Lexus cũng tỏ ra vượt trội khi RX đứng đầu danh sách SUV hạng sang bán chạy nhất 3 quý đầu năm 2025 với 80.427 xe, vượt trội hơn so với đối thủ BMW X5 (51.870 xe), Mercedes-Benz GLE (48.200 xe) và Audi Q5 (42.150 xe). Bản thân ""đàn em"" Lexus NX cũng ""cân đẹp"" đối thủ Audi Q3, BMW X1 trong phân khúc SUV cỡ nhỏ.
Thừa hưởng công nghệ từ hãng mẹ Toyota, Lexus đưa hybrid ""vào đời"" khá sớm từ năm 2005 với mẫu RX400h. Xe hybrid của hãng xe sang Nhật Bản được đánh giá cao hơn đối thủ ở hiệu suất và khả năng vận hành ổn định, mạnh mà êm, bền bỉ. J.D. Power xếp Lexus ở vị trí số 1 khi thống kê hãng này chỉ có 10% lỗi so với 25% trên BMW. Khách hàng chọn Lexus hybrid vì ""không lo sửa chữa"" và nhiều lựa chọn.
Dòng xe Lexus RX đóng góp không nhỏ vào sự thành công của hãng xe sang Nhật Bản
ẢNH: LEXUS
Lexus hiện cũng đang tham gia phân khúc xe thuần điện nhưng mới dừng ở bước ""làm quen"" với doanh số khiêm tốn dưới 10.000 xe năm 2024 trong khi đối thủ đến từ Đức đã bỏ rất xa như BMW tiệm cận 400.000 xe thuần điện, Audi, Mercedes-Benz cũng không vừa với doanh số dao động 150.000-200.000 xe. Lexus EV có quãng đường di chuyển sau mỗi lần sạc đầy ngắn nhưng vẫn tiếp tục được đánh giá cao ở độ bền bỉ, ít tốn chi phí bảo dưỡng và khấu hao ít.
Xét theo ""tuổi đời"", hành trình của Lexus có thể coi là như mơ với bất kì thương hiệu xe hơi nào. Dù chặng đường vươn tới top 3 doanh số xe sang toàn cầu còn rất dài nhưng với chiến thắng và thành công nhất định tại thị trường Mỹ, châu Âu, châu Á và sự kiên định với triết lý phát triển sản phẩm, một tương lai mới rộng mở hơn đang chờ Lexus phía trước. Đặc biệt là khi Century đã tách ra độc lập thành một thương hiệu xe siêu sang riêng góp phần ""cởi trói"" cho Lexus tự do bứt phá hơn nữa…"
https://thanhnien.vn/sedan-xin-nhat-cua-toyota-tang-gap-doi-uu-dai-giam-gia-hon-150-trieu-dong-185251104110024969.htm,"Sedan 'xịn' nhất của Toyota tăng gấp đôi ưu đãi, giảm giá hơn 150 triệu đồng","Các phiên bản Toyota Camry - mẫu sedan ""xịn"" nhất của Toyota tại thị trường Việt Nam được hãng áp dụng ưu đãi, giảm giá 122 - 153 triệu đồng, tăng gấp đôi so với tháng trước đó.","Bất chấp sức mua đang trên đà hồi phục, doanh số bán hàng tăng trưởng liên tiếp trong hai tháng qua, Toyota Việt Nam (TMV) vẫn tiếp tục mạnh tay áp dụng chương trình ưu đãi, giảm giá với nhiều mẫu mã trong danh mục sản phẩm của hãng. Trong đó, đáng chú ý là các phiên bản củaToyota Camry- mẫu sedan 'xịn' nhất hãng xe Nhật Bản tại thị trường Việt Nam.
Camry được TMV trình làng, phân phối thế hệ mới nhất từ tháng 11 năm ngoái với 3 phiên bản, gồm 2.5 Q sử dụng động cơ đốt trong có giá 1,22 tỉ đồng, trong khi hai phiên bản 2.5HEV MID và 2.5HEV TOP dùng hệ truyền động hybrid có giá 1,46 - 1,53 tỉ đồng. Sau ba quý đầu năm 2025, tổng doanh số bán mẫu xe này tại Việt Nam đạt 1.609 xe, tăng gần 650 xe so với cùng kỳ năm ngoái.
Sau ba quý đầu năm 2025, tổng doanh số bán mẫu xe này tại Việt Nam đạt 1.609 xe, tăng gần 650 xe so với cùng kỳ năm ngoái
Ảnh: B.H
Với kết quả này, Toyota Camry hiện đang dẫn đầu doanh số bán ở phân khúc sedan hạng D, bỏ xa các đối thủ cạnh tranh như Honda Accord, KIA K5, MG7… Dù vậy, khoảng hai tháng trở lại đây, TMV vẫn mạnh tay áp dụng chương trình ưu đãi thông qua hình thức hỗ trợ lệ phí trước bạ nhằm gia tăng sức hút cho mẫu xe này. Đáng chú ý, sau khi triển khai chương trình hỗ trợ 50% lệ phí trước bạ cho khách mua các phiên bản Camry trong tháng 10.2025, bước sang tháng 11.2025 hãng xe Nhật Bản khiến không ít người bất ngờ khi tăng gấp đôi ưu đãi.
Cụ thể, TMV vừa công bố chương trình ưu đãi, giảm giá lên tới 122 - 153 triệu đồng cho các phiên bản củaToyota Camry, tương đương mức hỗ trợ 100% lệ phí trước bạ. Qua đó, đưa mức giá thực tế của mẫu sedan này về mức 1,098 - 1,377 tỉ đồng. Đây được xem là mức giảm mạnh nhất từ trước đến nay mà hãng xe Nhật áp dụng cho mẫu sedan hạng D này. Trước đây, Camry hầu như chỉ được khuyến mãi nhỏ lẻ tại đại lý hoặc giảm giá nhẹ cho xe tồn kho, ít khi có chương trình hỗ trợ chính hãng quy mô toàn quốc.
TMV đang áp dụng mức giảm giá lên tới 122 - 153 triệu đồng cho các phiên bản của Toyota Camry
Ảnh: B.H
Việc đưa Camry vào danh mục sản phẩm áp dụng ưu đãi, giảm giá được xem là động thái kích cầu trong những tháng bán hàng cuối năm của Toyota Việt Nam. Bên cạnh đó cũng góp phần tăng sức hút cho Toyota Camry trong bối cảnh dòng xe sedan nói chung đang mất dần vị thế trên thị trường ô tô Việt Nam.
Hiện tại, Toyota Camry với 3 phiên bản, tương ứng hai tùy chọn động cơ, gồm động cơ xăng 2.0 lít cho công suất 170 mã lực, mô-men xoắn 206 Nm và động cơ xăng 2.5 lít kết hợp hai mô-tơ điện (trên bản hybrid), sản sinh tổng công suất 231 mã lực, mô-men xoắn 221 Nm."
https://thanhnien.vn/xe-khach-lang-lach-danh-vong-chen-duong-xe-ban-tai-tren-quoc-lo-185251105153053711.htm,"Xe khách lạng lách, đánh võng chèn đường xe bán tải trên quốc lộ","Bất chấp nguy hiểm cho mình và các phương tiện cùng lưu thông, tài xế liều lĩnh lái xe khách chạy lạng lách, chèn đường một xe bán tải cùng chiều trên quốc lộ, nhiều lần suýt gây tai nạn.","Mạng xã hội mới đây lan truyền đoạn video ghi lạitình huống giao thông gây bức xúc; khi một tài xế xe khách xem thường luật, bất chấp nguy hiểm lái xe lạng lách, đánh võng trên quốc lộ, liên tục tạt đầu chèn đường xe bán tải cùng chiều, suýt gây tai nạn cho các xe khác cùng lưu thông.
Vụ việc được xác định xảy ra vào khoảng 8 giờ ngày 3.11.2025, trên quốc lộ 37, đoạn qua địa bàn phường Bắc Giang, tỉnh Bắc Ninh.
Xe khách lạng lách, đánh võng chèn đường xe bán tải trên quốc lộ
Theo hình ảnh trích xuất từcamera hành trìnhgắn trên ô tô con cùng lưu thông, thời điểm nói trên, chiếc xe khách màu đỏ mang biển kiểm soát 98F-012.52 đang di chuyển trên quốc lộ 37, hướng từ Bắc Ninh về Lạng Sơn. Khi đến khu vực gần cầu vượt Bắc Giang,xe kháchnày bị một xe bán tải màu trắng đi ở làn bên cạnh đột ngột chuyển hướng, tạt đầu ở cự ly gần. Tình huống bất ngờ buộc xe khách phải phanh gấp để tránh.
Đáng nói, do quá bức xúc với kiểu lái xe của tài xế xe bán tải, tài xế xe khách nhấn ga cho xe vượt lên; sau đó liên tục chạy lạng lách tạt đầu, chèn đường để ""cà khịa""xe bán tải. Tình huống diễn ra giữa lúc quốc lộ 37 đang có rất đông phương tiện khác cùng lưu thông. Nhiềutài xế ô tôkhác di chuyển phía sau không dám cho xe vượt lên vì sợ ""vạ lây"".
Tài xế xe khách cố tình lái xe lạng lách, đánh võng trên quốc lộ bất chấp nguy hiểm
ẢNH: CẮT TỪ CLIP
Trênmạng xã hội, đoạn video ghi lại toàn bộ vụ việc sau khi được đăng tải đã nhanh chóng thu hút sự chú ý từ cộng đồng mạng. Đa phần người xem tỏ ra hết sức phẫn nộ trước hành vi lái xe liều lĩnh và xem thường pháp luật của tài xế xe khách nói trên. Bởi dù trước đó có xảy ra mâu thuẫn gì thì hành vi lái xe lạng lách, đánh võng như trong đoạn video là cực kỳ nguy hiểm, tiềm ẩn nguy cơ tai nạn giao thông.
Bên cạnh đó, nhiều người lên tiếng đề nghị cơ quan chức năng cần nhanh chóng vào cuộc, truy tìm và xử phạt thật nghiêmtài xếnói trên, tránh những sự vụ đáng tiếc có thể xảy ra.
Nghị định 168/2024/NĐ-CP quy định:
Phạt tiền 40 - 50 triệu đồng đối với người điều khiến xe thực hiện hành vi điều khiến xe lạng lách, đánh võng trên đường bộ; chạy quá tốc độ đuổi nhau trên đường bộ (Khoản 12 điều 6). Đồng thời tước quyền sử dụng giấy phép lái xe 10 - 12 tháng; tịch thu phương tiện nếu tái phạm.
Trường hợp thực hiện hành vi vi phạm gây tai nạn, tài xế bị phạt tiền 50 - 70 triệu đồng, tước quyền sử dụng Giấy phép lái xe 22 - 24 tháng.
"
