url,title,description,content
https://thanhnien.vn/toyota-hilux-the-he-moi-lo-dien-voi-nhieu-thay-doi-quyet-dau-ford-ranger-185251104160126961.htm,"Toyota Hilux thế hệ mới lộ diện với nhiều thay đổi, quyết 'đấu' Ford Ranger","Xe bán tải Toyota Hilux sẽ chính thức bước sang thế hệ mới vào giữa tháng 11.2025, dự kiến ""lột xác"" về ngoại hình, bổ sung nhiều trang bị nhằm tăng sức cạnh tranh với các đối thủ, nhất là Ford Ranger.","Sau hàng loạt hình ảnh ngụy trang trên đường thử bị rò rỉ, mới đây thông tin về việcToyota Hilux 2026sắp mở bán tiếp tục được củng cố; khi hãng xe Nhật Bản tung ra đoạn ""teaser"" đầu tiên, hé lộ phần nào ngoại hình của mẫu bán tải thế hệ mới. Đồng thời xác nhận lịch ra mắt khách hàng toàn cầu vào ngày 10.11 tới tại Thái Lan.
Như vậy, sau đúng 10 năm phân phối thế hệ thứ 8 với tổng cộng 3 đợt nâng cấp (facelift), cuối cùng Toyota Hilux đã chính thức bước sang thế hệ tiếp theo, ngay trong năm 2025.
Toyota Hilux thế hệ thứ 9 dự kiến trình làng thị trường toàn cầu vào ngày 10.11.2025
ẢNH: TOYOTA
Hình ảnh từ đoạn ""teaser"" cho thấy, so với bản hiện hành, Hilux mới thay đổi rõ nét về diện mạo. Trong đó đáng chú ý phải kể đến khu vực đầu xe, với thiết kế đèn LED mảnh và sắc sảo, nắpca-pôđược tạo khối mạnh mẽ hơn. Bên cạnh đó, cản trước cũng lớn hơn tạo dáng vóc ""cơ bắp"". Lưới tản nhiệt đính kèm logo ""TOYOTA"" bằng chữ in hoa to bản nằm ngang, vừa tạo dấu ấn thương hiệu vừa gợi cảm giác hiện đại.
Toyota Hilux 2026 sử dụng bộ mâm thiết kế đa chấu dạng chữ ""Y"" to bản. Ở phía sau,mẫu bán tảimới bố trí đèn hậu có kiểu dáng góc cạnh với đồ họa LED hình chữ C, nắp thùng có thêm gờ nhỏ tăng độ cứng cáp.
Thế hệ mới của xe bán tải cỡ trung nhà Toyota ""lột xác"" kiểu dáng, hợp xu hướng hơn
ẢNH: TOYOTA
Bên trong cabin, dù teaser chưa cho thấy toàn bộ khoang nội thất. Tuy nhiên theo thông tin lan truyền, Hilux mới sẽ trang bị màn hình giải trí nổi kết hợp với bảng đồng hồ kỹ thuật số, thiết kế bảng táp-lô góc cạnh hơn. Chất liệu nội thất cũng được nâng cấp để tạo cảm giác ""không chỉ là xe tải"". Đây được cho là động thái rõ ràng của Toyota trong việc thu hẹp khoảng cách giữa dòng bán tải truyền thống và nhómSUV cao cấphơn.
Xét về khả năng vận hành, Toyota Hilux 2026 được thông báo vẫn sử dụng khung gầm dạng rời body-on-frame dựa trên nền tảng IMV ladder-frame tương tự thế hệ trước, chứ không chuyển sang nền tảng TNGA-F như một số dòng xe cơ bắp khác củaToyota. Mặc dù vậy, khung gầm trên Hilux thế hệ mới đã được tinh chỉnh, kết hợp với hệ thống hỗ trợ lái và an toàn tiên tiến nhằm mang lại cảm giác lái ""tân thời"", gọn gàng hơn so với hình ảnh xe bán tải thuần túy trước đây.
Bên cạnh những bổ sung trang bị, công nghệ, giá bán sẽ là yếu tố quyết định nhiều đến thành công của Toyota Hilux thế hệ mới
ẢNH: TOYOTA
Dưới nắp ca-pô, xe trang bịđộng cơ dầu dieseltăng áp, dung tích 2.8 lít, kết hợp công nghệ mild-hybrid, cho công suất tối đa khoảng 201 mã lực và mô-men xoắn cực đại 500 Nm. Điều này hoàn toàn khớp với thông tin rò rỉ tại thị trường Úc trước đây cho rằng Toyota đang có kế hoạch loại bỏ dần các phiên bản động cơ dầu 2.4 lít và động cơ xăng 2.7 lít. Thay vào đó, hãng tập trung phát triển phiên bản hybrid hoặc thậm chí điện hoàn toàn cho dòng Hilux, những sẽ bổ sung trong tương lai gần.
Nhìn chung, với thị trường Việt Nam và khu vực Đông Nam Á, động thái tung ""teaser"" hé lộ những thay đổi lớn, đồng thời sớm công bố ngày ra mắt đang cho thấy phần nào quyết tâm của Toyota trong việc giúp Hilux tăng cường sức cạnh tranh và tìm lại vị thế trước các đối thủ. Đặc biệt làFord Ranger, mẫu xe vốn đang dẫn đầu phân khúc xe bán tải ở khu vực nhiều năm nay."
https://thanhnien.vn/honda-sh-2026-gia-tu-7789-trieu-dong-nang-cap-nhung-gi-185251105105613916.htm,"Honda SH 2026 giá từ 77,89 triệu đồng nâng cấp những gì?","Hai phiên bản 125i và 160i của dòng xe tay ga Honda SH 2026 lần đầu được trang bị màn hình điện tử 4,2 inch, nâng cấp cụm đèn theo phong cách Honda SH 350i, đồng thời bổ sung một số trang bị mới để tăng sức cạnh tranh.","Honda SH 2026 nâng cấp những điểm nào?
Tung ra thị trường Việt Nam,Honda SH 2026có một số thay đổi nhỏ, vẫn giữ thiết kế tổng thể so với bản tiền nhiệm. Đây cũng là điều dễ hiểu bởi đây là bản nâng cấp giữa vòng đời sản phẩm, chưa phải thế hệ mới.
So vớibản tiền nhiệm, phần đầu xe Honda SH 2026 thiết kế lại, tinh chỉnh cụm đèn LED trước theo hướng thể thao hơn, lấy cảm hứng từ ""đàn anh""Honda SH350i. Mẫu xe tay ga cao cấp của Honda bổ sung thêm nhiều lựa chọn màu sắc như xám mờ, trắng ngọc và xanh xám...
Honda SH 2026 thay đổi thiết kế đèn, lấy cảm hứng từ ""đàn anh"" SH 350i
ẢNH: C.T
Về trang bị, Honda SH 2026 là mẫu xe đầu tiên được trang bị màn hình điện tử TFT 4,2 inch, thay cho màn hình điện tử 2 tầng trước đây. Màn hình này hiển thị thông tin đa dạng, trực quan nhưng thông số vận tốc có kích thước nhỏ hơn đáng kể so với bản tiền nhiệm. Điều này khiến người lái khó quan sát, nhất là khi di chuyển dưới trời nắng.
Ngoài ra, hộc chứa đồ trước được mở rộng và bổ sung cổng sạc USB-C, tăng tính tiện dụng cho người dùng trong quá trình di chuyển.
Bảng đồng hồ điện tử TFT 4,2 inch trên Honda SH 2026
ẢNH: C.T
Honda SH 2026 phân phối tại thị trường Việt Nam hai phiên bản động cơ 125i và 160i, đạt chuẩn khí thải Euro 3. Phiên bản SH 160i sử dụng động cơ dung tích xi-lanh 156,9 cc, đạt công suất 16,6 mã lực và mô-men xoắn cực đại 14,8 Nm. Phiên bản 125i thấp hơn có dung tích xi-lanh 124,8 cc, công suất 12,8 mã lực và mô-men xoắn 11,9 Nm."
https://thanhnien.vn/bo-ba-tay-ga-honda-lead-air-blade-sh-2026-chot-gia-tu-4029-trieu-dong-18525110510380429.htm,"Bộ ba tay ga Honda Lead, Air Blade, SH 2026 chốt giá từ 40,29 triệu đồng","Bộ ba xe tay ga chủ lực của Honda chính thức tung ra thị trường Việt Nam bản nâng cấp với thay đổi đáng kể về thiết kế, trang bị tiện ích; trong đó Lead có giá từ 40,29 triệu, Air Blade giá từ 42,99 triệu và SH125i giá từ 77,89 triệu đồng.","Trong bối cảnhthị trường xe máy Việt Namđang cạnh tranh khốc liệt với sự góp mặt của nhóm xe điện càng trở nên gay gắt hơn. Để duy trì vị thế, thời gian gần đây, Honda Việt Nam liên tục nâng cấp, làm mới dải sản phẩm để giữ chân khách hàng. Mới đây nhất, liên doanh Nhật tung ra bản mới của bộ baxe tay gaHonda SH, Air Blade và Lead với nhiều thay đổi về thiết kế và trang bị công nghệ tiện ích.
Cùng với ""đàn em""Vision, Air Blade cũng là trụ cột của Honda ở phân khúc xe tay ga tầm trung, hướng đến nhóm người dùng đô thị, đặc biệt là giới trẻ. Vì vậy, ở phiên bản nâng cấp mới, mẫu xe này được Honda tập trung cải tiến về ngoại hình lẫn tiện ích, công nghệ.
Honda Air Blade 2026 phân phối tại Việt Nam 6 phiên bản, 2 tùy chọn động cơ
ẢNH: CHÍ TÂM
Tổng thể xe tinh gọn với kích thước dài, rộng, cao lần lượt 1.887 x 686 x 1.086 (mm), trọng lượng ở mức 113 kg. Kiểu dángAir Blademới thay đổi rõ rệt với phần đầu xe làm mới hoàn toàn. Trong đó, nổi bật có cụm đèn LED toàn phần và dải định vị ban ngày hiện đại. Cụm đồng hồ LCD 4,2 inch hiển thị đa thông tin, đi kèm cổng sạc USB bố trí bên trong hộc chứa đồ.
Về vận hành, Honda Air Blade tiếp tục sử dụng động cơ eSP+ 4 van, làm mát bằng dung dịch, với hai tùy chọn dung tích (125cc và 160cc). Trong đó, động cơ 160cc sản sinh công suất khoảng 15 mã lực và mô-men xoắn cực đại 14,8 Nm. Động cơ dung tích 125cc cho công suất gần 12 mã lực, mô-men xoắn 11,3 Nm.
Trên các phiên bản dùng động cơ dung tích 160cc,hãng xe Nhậttrang bị hệ thống chống bó cứng phanh ABS ở bánh trước. Riêng các bản thấp hơn vẫn duy trì hệ thống phanh kết hợp CBS. Ngoài ra, Honda cũng cải tiến hệ thống khung và giảm xóc để xe ổn định hơn khi vào cua hoặc di chuyển ở tốc độ cao.
Honda Air Blade mới thay đổi khá nhiều về kiểu dáng, đồng thời bổ sung một số tiện ích
ẢNH: CHÍ TÂM
Tại Việt Nam, Honda Air Blade 2026 mới phân phối tổng cộng 6 phiên bản, tương ứng hai loại động cơ. Các bản sử dụng động cơ dung tích 125cc niêm yết từ 42,99 - 48,69 triệu đồng (đã gồm 10% VAT). Trong khi, các bản dùng động cơ dung tích 160cc từ 56,89 - 58,59 triệu đồng. Đối thủ cạnh tranh chính của mẫu xe Nhật ở nhómxe tay ga tầm trungvẫn là bộ đôi ""đồng hương"" Yamaha NVX 155 (giá từ 55,3 - 69 triệu đồng) vàYamaha Lexi 155(giá từ 48,5 - 48,9 triệu đồng).
Tương tự Air Blade, SH cũng đượcHonda Việt Namtrình làng phiên bản mới, tập trung nâng cấp về ngoại hình và trang bị.
So với bản tiền nhiệm, mẫu xe tay ga này nhìn chung vẫn trung thành với phong cách sang trọng quen thuộc, nhưng các chi tiết được tinh chỉnh mang hơi hướng thể thao và hiện đại hơn. Trong đó, điểm nhấn chính nằm ở phía trước và sau xe với cụm đèn LED lấy cảm hứng từ mẫuSH350i. Trong khi dải đèn hậu được thiết kế lại giúp tổng thể SH 2026 trở nên hài hòa hơn.
Tương tự ""đàn em"" Air Blade, Honda SH mới cũng chính thức mở bán tại Việt Nam
ẢNH: CHÍ TÂM
Bên cạnh đó, điểm mới về ngoại thất còn nằm ở tùy chọn dải màu. Cụ thể, ngoài những tông màu truyền thống, Honda Việt Nam bổ sung 3 lựa chọn màu mới, gồm xanh, xám và trắng, đem đến diện mạo trẻ trung hơn cho dòng xe này.
Xét về trang bị, điểm khác biệt nhất trênHonda SH 2026là màn hình TFT 4,2 inch hoàn toàn mới - lần đầu tiên xuất hiện trên dòng này. Bên cạnh hiển thị sắc nét, màn hình này còn có thể tùy chỉnh màu nền, đồng thời kết nối với điện thoại thông minh để hiển thị thông tin hành trình. Ngoài ra, hộc chứa đồ phía trước cũng được mở rộng và tích hợp cổng sạc USB loại Type-C, hỗ trợ sạc nhanh cho các thiết bị di động.
So với bản cũ, Honda SH 2026 cũng điều chỉnh thiết kế và bổ sung nhiều tính năng, tiện ích đáp ứng nhu cầu người dùng
ẢNH: CHÍ TÂM
Honda SH 2026 tiếp tục sử dụng động cơ eSP+ 4 van, với hai tùy chọn dung tích tương tự Air Balde. Trong đó, động cơ trên các phiên bảnSH125isản sinh công suất gần 13 mã lực và mô-men xoắn 11,9 Nm. Riêng các bản 160i, sức mạnh ở mức 16,6 mã lực và mô-men xoắn cực đại 14,8 Nm.
SH mới cũng được trang bị hệ thống kiểm soát lực kéo (HSTC) cùngphanh ABStrên hầu hết số phiên bản (trừ hai phiên bản 125i Tiêu chuẩn và 160i Tiêu chuẩn).
Tại Việt Nam, SH mới phân phối tổng cộng 8 phiên bản, chia đều cho hai tùy chọn động cơ. Cụ thể, các bản Honda SH 125i niêm yết giá dao động từ 77,89 - 87,09 triệu đồng (đã gồm 10% VAT). Trong khi, các bản SH 160i có giá từ 95,08 - 104,29 triệu đồng.
Bên cạnh bản mới của SH và Air Blade, Honda Việt Nam cũng áp dụng thêm tùy chọn màu sắc ngoại thất cho mẫu Honda Lead 2026 (mở bán từ cuối tháng 9). Theo đó, phiên bản Lead ABS đặc biệt bổ sung màu bạc nhám, trong khi bản cao cấp tạo điểm nhấn với màu trắng hoàn toàn mới. Tại Việt Nam, Honda Lead phân phối 3 phiên bản, đi kèm mức giá 40,29 – 46,49 triệu đồng."
https://thanhnien.vn/2-truong-hop-ngoai-le-duoc-phep-vuot-xe-tu-ben-phai-185251104123934533.htm,2 trường hợp ngoại lệ được phép vượt xe từ bên phải,"Theo nguyên tắc, người điều khiển phương tiện phải vượt xe phía trước từ bên trái. Tuy nhiên vẫn có 2 trường hợp đặc biệt, lái xe được phép vượt phải nếu đảm bảo điều kiện an toàn.","Đa số tài xế điều khiểnô tôđều biết nguyên tắc vượt xe phải thực hiện từ bên trái. Đây là quy tắc cơ bản để đảm bảo tầm nhìn, giữ khoảng cách an toàn và hạn chế va chạm. Tuy nhiên, luật Trật tự, an toàn giao thông đường bộ 2024 có hiệu lực từ ngày 1.1.2025 cho phép tài xế đượcvượt xetừ bên phải trong một số tình huống mà không bị xử phạt.
Về quy tắc, tài xế phải vượt xe phía trước từ bên trái nhưng vẫn có 2 tình huống đặc biệt, được vượt xe từ bên phải
ẢNH: CẮT TỪ CLIP
Căn cứ theo điểm 2, điều 14 của bộ luật trên, khi vượt các xe phải vượt bên trái; trường hợp khi xe phía trước có tín hiệu rẽ trái hoặc đang rẽ trái hoặc khi xe chuyên dùng đang làm việc trên đường mà không thể vượt bên trái thì được vượt về bên phải.
Như vậy, sẽ có hai trường hợp màtài xếđược vượt xe phía trước từ phía bên phải, bao gồm: xe phía trước có tín hiệu rẽ trái hoặc đang rẽ trái và khi gặp xe chuyên dùng đang làm việc trên đường mà không thể vượt bên trái.
Dù được cho phép trong hai trường hợp kể trên, việc vượt bên phải vẫn cần tuân thủ đầy đủ các điều kiện an toàn. Cụ thể, tài xế phải phát tín hiệu xin vượt bằng đèn hoặc còi; đoạn đường định vượt không có chướng ngại vật phía trước và không có xe đi ngược chiều.
Đồng thời, xe phía trước không được có tín hiệu xin vượt xe khác và đã chủ động nhường đường. Việc tuân thủ các điều kiện trên giúp đảm bảo an toàn, tránh nguy cơ xảy ra tai nạn.
Với những vi phạm về hành vi vượt xe không đúng quy định, mức xử phạt hiện nay khá nghiêm khắc.
Vượt xe không đúng quy định có thể bị phạt tới 6 triệu đồng, trừ 2 điểm trong giấy phép lái xe
ẢNH: TN
Theo điểm a, khoản 5, điều 6, Nghị định 168/2024/NĐ-CP (Nghị định 168), tài xế điều khiển ô tô vượt không đúng quy định sẽ bị phạt tiền 4 - 6 triệu đồng. Ngoài ra, căn cứ điểm a, khoản 16, điều 6, người vi phạm còn bị trừ 2 điểm trên giấy phép lái xe, áp dụng theo hệ thống tính điểm bằng lái từ năm 2025.
Trường hợp vượt xe sai quy định và gây tai nạn giao thông, mức phạt tăng lên 20 - 22 triệu đồng, đồng thời bị trừ 10 điểm trong giấy phép lái xe.
Vượt xe là tình huống tiềm ẩn rủi ro nguy hiểm nếu thực hiện không đúng quy định. Dù có hai trường hợp ngoại lệ được phép vượt bên phải, người điều khiển chỉ nên áp dụng trong tình huống thực sự cần thiết và phải đảm bảo đầy đủ điều kiện an toàn. Trong mọi trường hợp, tốt nhất vẫn nên tuân thủ nguyên tắc vượt bên trái để hạn chế nguy cơ tai nạn."
https://thanhnien.vn/bo-ba-lexus-concept-man-nhan-khach-thuong-lam-japan-mobility-show-2025-18525110310231311.htm,Bộ ba Lexus Concept mãn nhãn khách thưởng lãm Japan Mobility Show 2025,"Lexus mang tới sàn diễnJapan Mobility Show 20252025 ba xe concept mang triết lý thiết kế riêng nhưng cùng hướng tới mục tiêu điện hóa và phục vụ nhu cầu đa dạng người dùng, từ khách hàng VIP đến giới mê xe thể thao.","Bộ ba xe Lexus Concept mãn nhãn khách thưởng lãm Japan Mobility Show 2025
Gian trưng bày củaLexustạiJapan Mobility Show 2025- Triển lãm ô tô Nhật Bản (tên gọi mới của Tokyo Motor Show trước đây) thu hút sự chú ý với loạt xe concept (xe ý tưởng) mang thiết kế đậm chất tương lai, thể hiện tầm nhìn điện hóa và tinh thần đổi mới của hãng xe sang Nhật Bản.
Tâm điểm của khu trưng bày Lexus là LS Concept six wheeled với cấu hình 6 bánh xe độc đáo, phá vỡ khuôn mẫu của dòng sedan hạng sang truyền thống. Xe định hướng tới khách hàng cao cấp với khoang hành khách rộng rãi, lấy cảm hứng từ ghế thương gia trên máy bay.
Việc bổ sung thêm một trục bánh xe phía sau không chỉ nhằm tạo không gian rộng rãi mà còn cải thiện độ êm ái và ổn định khi vận hành.
Lexus LS Concept 6 bánh xe độc đáo, hàng ghế sau thiết kế theo phong cách thương gia
ẢNH: QUANG THÁI
Kế đến, LS Coupe Concept sở hữu kiểu dáng crossover sang trọng với thiết kế cửa sau mở ngược (suicide door) tạo dấu ấn khác biệt, gợi nhớ đến phong cách của dòng xe siêu sang Rolls-Royce. Khoang nội thất tối giản, định hình xu hướng thiết kế của Lexus trong thời gian tới.
Bên cạnh đó, Lexus giới thiệu Sport Concept kiểu dáng thể thao, táo bạo trong kỷ nguyên xe điện. Mẫu coupe thuần điện có thiết kế thân xe thấp, đậm tính khí động học với phần mui vuốt dốc ra sau. Đây được xem tiền đề cho dòng xe điện hiệu suất cao tương lai của Lexus, nhằm cạnh tranh với những đối thủ đến từ châu Âu.
Thông qua bộ ba concept này, Lexus thể hiện bước chuyển mình trong thiết kế và công nghệ, chuẩn bị cho thời kỳ hậu động cơ đốt trong với định hướng sản phẩm đa dạng, đậm dấu ấn riêng."
https://thanhnien.vn/xe-mui-tran-hang-sang-maserati-grancabrio-folgore-co-gia-hon-133-ti-dong-185251101143853933.htm,"Xe mui trần hạng sang Maserati GranCabrio Folgore có giá hơn 13,3 tỉ đồng","GranCabrio Folgore đánh dấu cột mốc quan trọng khi Maserati lần đầu trình làng mẫu xe mui trần thuần điện, mở ra chương mới cho hãng xe Ý trên thị trường xe sang.","Sau thành công của các dòng xe sang thuần điện, Maserati tung ra thị trường mẫu GranCabrio Folgore để tiếp tục khẳng định vị thế thương hiệu ""Cây đinh ba"" ở phân khúc ô tô hạng sang cao cấp. Tại Việt Nam, mẫu xe sang đến từ Ý niêm yết giá 13,314 tỉ đồng
ẢNH: C.T
GranCabrio Folgore duy trì ngôn ngữ thiết kế đặc trưng của Maserati với phần đầu xe dài, cụm đèn thanh mảnh và mặt ca-lăng tạo hình khí động học. Đây là mẫu mui trần thuần điện đầu tiên củaMaserati, phát triển từ dòng GranTurismo EV trước đó
ẢNH: C.T
Nhìn từ bên hông, tổng thể thân xe giữ tỷ lệ chiều dàinắp ca-pôvà khoang hành khách của dòng GT truyền thống nhưng tối ưu về trọng tâm để phù hợp với hệ truyền động điện. Phần mui mềm có thể đóng/mở điện ngay cả khi xe đang di chuyển ở tốc độ dưới 60 km/giờ
ẢNH: MASERATI
Ở gói trang bị tiêu chuẩn, mẫu mui trần thuần điện của Maserati sử dụng hệ thống đèn pha công nghệ LED với tính năng bật/tắt đèn tự động. Để có trang bị đèn LED ma trận, khách có thể tìm hiểu và đặt thêm theo nhu cầu
ẢNH: C.T
Nhìn từ phía sau, phần đuôi xe GranCabrio Folgore khá gợi cảm, mang đậm DNA của Maserati với các đường nét thiết kế đơn giản, mềm mại. Cụm đèn hậu sau với viền LED định vị tạo hình sắc nét, tạo thêm điểm nhấn khi nhìn vào ban đêm
ẢNH: MASERATI
Rũ bỏ thiết kế cổ điển trước kia, Maserati GranCabrio thuần điện cũng có không gian nội thất hiện đại với ba màn hình hiển thị thông tin và giải trí. Thiết kế này tương tự mẫu SUV hạng sang Grecale Folgore
ẢNH: MASERATI
Bảng đồng hồ sau vô-lăng có chức năng hiển thị thông tin vận hành, dung lượng pin, nhiệt độ và mức độ tiêu hao năng lượng, giúp người lái theo dõi dễ dàng
ẢNH: C.T
Nội thất xe sử dụng vật liệu tái chế Econyl cho các bề mặt tiếp xúc chính, bao gồm ghế, táp-pi cửa và thảm sàn giúp thân thiện hơn với môi trường
ẢNH: C.T
Với cấu hình tiêu chuẩn, Maserati GranCabrio Folgore đã được trang bị hệ thống âm thanh cao cấp Sonus Faber gồm 13 loa. Nếu chưa thỏa mãn, hãng xe Ý cung cấp thêm tùy chọn nâng cấp với 16 loa
ẢNH: C.T
Ngoài các công nghệ an toàn cơ bản, mẫu xe sang đến từ Ý còn có các tính năng trong gói hỗ trợ lái xe nâng cao như hỗ trợ giữ làn đường, kiểm soát hành trình thích ứng, giữ khoảng cách với xe phía trước... Các phím điều khiển được bố trí trên vô-lăng, giúp dễ dàng thao tác
ẢNH: C.T
Về khả năng vận hành, GranCabrio Folgore sử dụng 3 mô-tơ điện có tổng công suất tiêu chuẩn đạt 751 mã lực và mô-men xoắn 1.350 Nm. Tuy nhiên, với chế độ MaxBoost, mẫu xe này có thể đạt công suất tối đa tới 818 mã lực trong 10 giây, giúp tăng tốc từ 0 - 100 km/giờ trong 2,8 giây trước khi đạt tốc độ tối đa 290 km/giờ
ẢNH: C.T
Với bộ pin dung lượng 92,5 kWh, mẫu xe sang này có thể đi được 447 km sau mỗi lần sạc đầy. Khi kết nối với bộ sạc nhanh DC 150 kW, xe có thể sạc từ 20 - 80% chỉ trong khoảng 20 phút, hoặc mất khoảng 2,3 giờ nếu dùng sạc AC 3 pha, công suất 22 kW
ẢNH: MASERATI

"
