url,title,description,content
https://thanhnien.vn/dai-tuong-niem-nan-nhan-covid-19-bieu-tuong-nhac-nho-va-giao-duc-the-he-tre-185251108173416812.htm,Đài tưởng niệm nạn nhân Covid-19: Biểu tượng nhắc nhớ và giáo dục thế hệ trẻ,"Tiếp tục ghi nhận ý kiến về công trình xây dựngcông viên và đài tưởng niệm nạn nhân Covid-19tại khu 'đất vàng'số 1 Lý Thái Tổ (P.Vườn Lài), nhiều sinh viên trên địa bàn TP.HCM bày tỏ sự đồng tình và hy vọng đây sẽ trở thànhđiểm đến ý nghĩa, vừa để nhắc nhớ, vừa để giáo dục thế hệ trẻvề một giai đoạn đặc biệt trong lịch sử đất nước.","Đối với người dân TP.HCM nói riêng và cả nước nói chung,dịch bệnhCovid-19là một cột mốc khó quên... Thế nhưng, cũng chính trong giai đoạn đầy thử thách ấy,tinh thầnđoàn kết, tương thân tương áicủa người Việt lại được thắp sáng mạnh mẽ hơn bao giờ hết. Hình ảnh các y bác sĩ, tình nguyện viên, lực lượng tuyến đầu ngày đêm căng mình chống dịch đã để lại dấu ấn sâu sắc trong lòng người dân.
Còn với thế hệ học sinh,sinh viên, ký ức về thời điểm ấy không chỉ là những buổi học online kéo dài, những ngày xa trường lớp mà còn là bài học lớn về sự sẻ chia và trân trọng cuộc sống bình thường. Chính vì những điều đó, chủ trương xây dựng công viên vàđài tưởng niệm nạn nhân Covid-19tại khu đất số 1 Lý Thái Tổ (P.Vườn Lài) của TP.HCM nhận được nhiều sự đồng tình, đặc biệt từ thế hệ trẻ.
Khu đất số 1 Lý Thái Tổ, P.Vườn Lài, TP.HCM, dự kiến sẽ xây dựng công trình biểu tượng vượt qua đại dịch Covid-19
Ảnh: NHẬT THỊNH
Bạn Quách Thị Ngọc Yến, sinh viên Trường ĐH Nguyễn Tất Thành, cho rằng sau hơn 4 năm, công trình tưởng niệm vẫn rất cần thiết. ""Không chỉ để tưởng nhớ quá khứ, nơi đây còn giúp gắn kết cộng đồng, nhắc mọi người trân trọng cuộc sống hiện tại và ý thức hơn trong việc bảo vệ sức khỏe cộng đồng. Tôi mong công trình được thiết kế giản dị, trang nghiêm, có không gian xanh, khu tưởng niệm, khu trưng bày tư liệu và nơi sinh hoạt cộng đồng, vừa là nơi tưởng nhớ và cũng là điểm đến nhân văn của thành phố"", Yến chia sẻ.
Sinh viên Trần Lê Ngọc Lợi
Ảnh: NVCC
Đồng quan điểm, bạn Trần Lê Ngọc Lợi, sinh viên Trường ĐH Khoa học Xã hội và Nhân văn (ĐH quốc gia TP.HCM) cho biết nếu được đầu tư đúng hướng, công trình tưởng niệm không chỉ là điểm đến của người dân thành phố mà còn có thể trở thành nơi tri ân của người dân cả nước và du khách quốc tế. Theo Lợi, một công trình giản dị nhưng ý nghĩa sẽ góp phần nhắc nhớ về giai đoạn khó khăn, đồng thời khẳng định tinh thần đoàn kết, nhân ái của người Việt.
Còn với Trần Thanh Nhã, sinh viên Trường ĐH Văn Lang, cho biết ký ức về những ngày đại dịch vẫn còn in đậm trong tâm trí. Nhã chia sẻ rằng kỷ niệm đáng nhớ nhất với cô là khoảng thời gian phải chiến đấu với dịch bệnh Covid-19, vừa học vừa thi online tại nhà. Dù trải qua nhiều khó khăn, bạn nhận ra rằng sau tất cả bản thân trân trọng sự sống hơn bao giờ hết. ""Tôi mong công trình tưởng niệm được thiết kế giản dị nhưng trang nghiêm, mang tính biểu tượng và gắn liền với không gian xanh. Bên cạnh đó, có thể phát triển nơi đây thành không gian triển lãm mở, không chỉ để tưởng nhớ mà còn để giáo dục thế hệ trẻ về tinh thần vượt khó và lòng nhân ái"", Nhã bày tỏ.
Bạn Lê Nguyên Trương, sinh viên Trường ĐH Y Dược TP.HCM, bày tỏ sự đồng tình sâu sắc với chủ trương của thành phố và cho rằng, đối với sinh viên ngành y, công trình tưởng niệm có thể trở thành một điểm đến ngoại khóa ý nghĩa, giúp thế hệ sau hiểu hơn về công lao của các y bác sĩ đã tham gia tuyến đầu chống dịch. Trương mong muốn công trình được thiết kế giản dị nhưng sâu sắc, là không gian mở với cây xanh, hồ nước, cùng khu vực khắc tên hoặc biểu tượng tưởng nhớ những người đã mất. Ngoài ra, theo Trương, nên có khu trưng bày tư liệu, hình ảnh và câu chuyện... về những tháng ngày chống dịch, đồng thời tổ chức các hoạt động tưởng niệm hằng năm để lan tỏa giá trị nhân văn.
Bên cạnh đó, nhiều sinh viên cũng cho rằng, công trình tưởng niệm nên được kết hợp hài hòa giữa yếu tố tưởng niệm và không gian sinh hoạt cộng đồng, vừa là nơi để người dân đến dâng hương, tưởng nhớ, vừa là điểm hẹn văn hóa, giáo dục về tinh thần sống đẹp, sống trách nhiệm.
Theo ghi nhận củaThanh Niên, nhiều ý kiến đồng tình nếu được quy hoạch hài hòa với mảng xanh đô thị, kết hợp khu tưởng niệm, trưng bày tư liệu và hoạt động cộng đồng. Đài tưởng niệm nạn nhân Covid-19 sẽ không chỉ là một công trình kiến trúc mà còn là biểu tượng của lòng biết ơn, ký ức và giáo dục thế hệ trẻ.
TP.HCM mời người dân đóng góp ý tưởng cho công trình
Thông tin từ Sở VH-TT TP.HCM cho biết từ nay đến ngày 15.11 sẽ đón nhận ý tưởng công trình biểu tượng ghi nhận sự chung sức, đồng lòng của người dân TP.HCM vượt qua đại dịch Covid-19 tại khu đất số 1 Lý Thái Tổ, P.Vườn Lài (Q.10 cũ), TP.HCM.
Việc lấy ý kiến rộng rãi người dân cả nước là một trong các chỉ đạo của Bí thư Thành ủy TP.HCM Trần Lưu Quang về việc xây dựng công viên, đài tưởng niệm nạn nhân mất vì Covid-19 tại khu đất trên.
Các ý tưởng về công trình biểu tượng vượt qua đại dịch Covid-19 gửi về Sở VH-TT qua hộp thư điện tửsvhtt@tphcm.gov.vn, gửi trực tiếp hoặc bưu điện tại địa chỉ số 164 Đồng Khởi, P.Sài Gòn (Q.1 cũ), TP.HCM
"
https://thanhnien.vn/dai-tuong-niem-nan-nhan-covid-19-can-dam-bao-cong-trinh-mang-lai-hieu-qua-tich-cuc-185251108160323143.htm,Đài tưởng niệm nạn nhân Covid-19: Cần đảm bảo công trình mang lại hiệu quả tích cực,"Theo luật sư Nguyễn Văn Hậu, việc xây công viên và đài tưởng niệm nạn nhân Covid-19 tại TP.HCM là chủ trương nhân văn, ý nghĩa, song cần được thực hiện trên cơ sở pháp lý chặt chẽ, bảo đảm tính minh bạch, quản lý bền vững.","Khu “đất vàng” rộng 4,3 ha tại số 1 Lý Thái Tổ (phường Vườn Lài) dự kiến được dùng để xây dựng công viên, đài tưởng niệm nạn nhân mất vì Covid-19
Ảnh: Nhật Thịnh
Đại dịch Covid-19 đã đi qua, nhưng quãng thời gian ấy vẫn hằn sâu trong ký ức của mỗi người dân Việt Nam. Đại dịch đã làm đảo lộn mọi mặt đời sống, gây thiệt hại nặng nề về con người, kinh tế, xã hội. Thế nhưng, giữa những mất mát, tinh thần đoàn kết, chung sức đồng lòng lại được thắp sáng mạnh mẽ. Từ những đội ngũ y bác sĩ, lực lượng tuyến đầu ngày đêm giành giật sự sống cho bệnh nhân đến những người dân bình thường cùng nhau san sẻ lương thực, giúp đỡ lẫn nhau, tất cả đã tạo nên hình ảnh đẹp về lòng nhân ái. Giai đoạn ấy không chỉ là thử thách khắc nghiệt, mà còn là bài học sâu sắc về ý chí, tình người và sức mạnh của cộng đồng Việt Nam.
Thời gian qua, chủ trương của TP.HCM dành khu ""đất vàng"" rộng 4,3 ha tại số 1 Lý Thái Tổ (P.Vườn Lài) để xây dựng công viên vàđài tưởng niệm nạn nhân Covid-19đang nhận được sự quan tâm của dư luận. Theo nhiều ý kiến, đây là một chủ trương nhân văn, song cần được thực hiện đúng quy định pháp luật, bảo đảm giá trị tinh thần, xã hội và sự đồng thuận của người dân.
Trao đổi vớiThanh Niên, luật sư Nguyễn Văn Hậu - Phó chủ nhiệm Đoàn Luật sư TP.HCM cho rằng đề xuất xây dựng công viên vàđài tưởng niệm nạn nhân Covid-19của TP.HCM là một chính sách nhân văn, thể hiện được tinh thần tương thân tương ái và sẽ mang lại ý nghĩa sâu sắc đối với nhân dân.
Theo luật sư Hậu, để đảm bảo công trình đài tưởng niệm mang lại được hiệu quả tích cực và được triển khai đúng chủ trương nhà nước, ưu tiên quyền lợi của người dân, các cơ quan chức năng và đơn vị đầu tư nên tập trung hoàn thiện những mặt về pháp lý dự án cũng như những mặt giúp nâng cao giá trị tinh thần xã hội.
""Trước tiên hết, cần xác định rõ tính chất công trình. Đài tưởng niệm các nạn nhân Covid-19 là công trình công cộng đặc thù, có yếu tố tâm linh - văn hóa. Vì vậy, nên được xếp vào nhóm công trình văn hóa - tưởng niệm theo quy định của luật Xây dựng 2014 (sửa đổi 2020). Theo đó, thẩm quyền phê duyệt sẽ thuộc về UBND TP.HCM. Trong đó, UBND TP.HCM sẽ ban hành quyết định chủ trương đầu tư, đồng thời phân công cho Sở Xây dựng, Sở Quy hoạch - Kiến trúc thẩm định quy hoạch chi tiết, hồ sơ kỹ thuật trên nguyên tắc đảm bảo phù hợp với quy hoạch đô thị chung"", luật sư Hậu phân tích.
TP.HCM tất bật dọn ""đất vàng"" để xây công viên và đài tưởng niệm nạn nhân Covid-19
Ảnh: Nhật Thịnh
Ông cũng cho rằng, với quy mô lớn và vị trí dự kiến nằm trong khu vực nội thành, dự án cần được đánh giá tác động môi trường (ĐTM) theo luật Bảo vệ môi trường 2020, đặc biệt nếu có hoạt động lưu tro cốt hoặc khu vực tưởng niệm riêng biệt.
Bên cạnh đó, Phó chủ nhiệm Đoàn Luật sư TP.HCM nhấn mạnh, một điểm đặc biệt quan trọng cần phải lưu ý khi triển khai các dự án thi công quốc gia chính là cần phải xác định rõ nguồn gốc đất, phân biệt đất công, đất quốc phòng, hoặc đất được chuyển mục đích sử dụng để từ đó xây dựng chính sách bồi thường phù hợp, tránh tranh chấp hoặc vi phạm quy hoạch dẫn đến kéo dài thời gian thi công. Đồng thời giai đoạn trước, trong và sau khi hoàn thành thi công công trình, cơ quan chức năng cần ban hành quy định phân công giao nhiệm vụ cho cơ quan, đơn vị cụ thể trách nhiệm quản lý dự án và khai thác hoạt động của công viên tưởng niệm (ví dụ: Sở Xây dựng, Sở VH-TT hoặc thành lập một ban quản lý chuyên trách), tránh tình trạng công trình bị xuống cấp hoặc thương mại hóa.
Với bản chất là dự án công trình công cộng vì lợi ích của người dân, việc huy động vốn, xã hội hóa (nếu có) cần đảm bảo tuyệt đối công khai, minh bạch. Trong quá trình xây dựng và quản lý, cần có cơ chế giám sát cộng đồng, đặc biệt có sự tham gia của cơ quanMặt trận Tổ quốc Việt Namvà các tổ chức xã hội đại diện cho tiếng nói của người dân.
Về giá trị tinh thần, luật sư Hậu chia sẻ: ""Đài tưởng niệm nạn nhân Covid-19 không chỉ là nơi tưởng nhớ người đã mất mà còn là biểu tượng của sự đoàn kết, sẻ chia và phục hồi sau đại dịch. Thiết kế nên hướng đến không gian xanh, yên bình, mang tính chữa lành, có khu vực dành cho thân nhân nạn nhân, người dân đến tưởng niệm, và khu trưng bày ghi nhận đóng góp của lực lượng tuyến đầu"".
Theo ông, để đảm bảo công trình hoạt động đúng mục tiêu và đối tượng, cần ưu tiên tham khảo ý kiến rộng rãi của thân nhân nạn nhân Covid-19, các tổ chứctôn giáo, chuyên gia văn hóa, xã hội để đảm bảo công trình mang tính bao dung, không phân biệt tôn giáo, tầng lớp, hay nguồn gốc. Đồng thời cũng nên tránh yếu tố mang tính phô trương, hình thức, thay vào đó tập trung vào giá trị tưởng nhớ và giáo dục cộng đồng. Với quy mô dự kiến hiện nay, công trình có thể được dùng để kết hợp với không gian giáo dục, triển lãm về y tế, dịch bệnh và bài học ứng phó khẩn cấp để nâng cao ý thức cộng đồng."
https://thanhnien.vn/nhac-si-pham-dang-khuong-tac-gia-con-duong-den-truong-dang-nguy-kich-185251108135206031.htm,Nhạc sĩ Phạm Đăng Khương - tác giả 'Con đường đến trường' đang nguy kịch,Nhạc sĩ tài hoa đất Quảng Ngãi Phạm Đăng Khương đang trải qua những ngày tháng gian nan khi chống chọi với bệnh tật.,"Sau khi vào Khoa Cấp cứu hồi sức (Bệnh viện 175, TP.HCM) thăm tác giảCon đường đến trường, MC Quỳnh Hoa cho biết cô luôn nghĩ đến và thương cho hoàn cảnh của nhạc sĩ Phạm Đăng Khương lúc này...
Nhạc sĩ Phạm Đăng Khương (bìa phải) và những giây phút vui vẻ bên MC Kiều Hải Chuyên, nhà thơ Lê Minh Quốc
Ảnh: E MÌ
Tác giảCon đường đến trườnglúc nào cũng tràn đầy năng lượng
Ảnh: FBNV
Nhà neo người, con trai lớn đi làm, đứa nhỏ đang ở xa, vợ ông lại bị bệnh parkinson nên việc chăm sóc cho ông vô cùng khó khăn; bệnh tình ông lại đang rất nặng, lúc mê lúc tỉnh. Ông đã từng vào nhập viện mấy lần và khỏe thì lại được về, nhưng lần này là nguy kịch nhất...
""Hôm qua, lúcca sĩ Hồng Mơvào anh còn nhận ra nhưng khi tôi vào thăm thì anh rơi vào trạng thái lơ mơ. Nghe nói cả tháng nay anh không ăn uống gì được mà phải đặt ống để bơm thức ăn vào dạ dày. Theo thông tin từ gia đình, anh đang bị viêm phổi, suy đa tạng, tiểu đường và rồi một số bệnh nền khác nữa nên sức khỏe cực kỳ xấu... Ngày xưa anh mạnh mẽ, tìm tòi học hỏi liên tục, sáng tác nhạc, quay phim, viết sách, vẽ tranh, giờ chỉ nằm một chỗ, mở khí quản để thở và còn có 30 ký... Thương anh quá..."", MC Quỳnh Hoa rưng rưng.
Người đồng nghiệp thân thiết lànhạc sĩ Nguyễn Ngọc Thiệncho biết thêm: ""Hồi tháng 6, Khương qua Mỹ và phát bệnh ở đó. Trên 60 tuổi, các bộ phận đều rệu rã hết rồi nhưng Khương đam mê công việc quá.... 20 ngày ở Mỹ sáng đi quay, tối về dựng phim liên tục, bị mất ngủ nên sức khỏe bị đuối quá, phải vào viện. Bác sĩ bên Mỹ ra giá 80 ngàn USD, Khương lại phải ráng về Việt Nam... Trải qua hai lần đột quỵ tại Việt Nam rồi nên giờ mới bị nặng vậy. Bệnh viện đang sử dụng thuốc để thải nước ra, giữ cho phổi và tim được khỏe... nên chỉ còn 30 ký. Tôi cũng từng sử dụng thuốc đó mà từ 70 ký giảm xuống còn có 50 ký... Chỉ mong cho Khương mau chóng bình phục..."".
Nhạc sĩ Nguyễn Văn Hiên chia sẻ đã nghe tinPhạm Đăng Khươngbị bệnh nặng mà chưa vào thăm được vì đồng nghiệp cho biết ông đang nằm hồi sức cấp cứu nên hạn chế thăm nom.
Sau hai lần đột quỵ, bệnh của nhạc sĩ đang trở nặng, phải bơm thức ăn vào dạ dày
Ảnh: QUỲNH HOA Cung cấp
Nhạc sĩ Phạm Đăng Khương là một tên tuổi quen thuộc của giới yêu nhạc. Cả cuộc đời ông gần như gắn bó vớiNhà văn hóa Thanh Niên(TP.HCM). Từ năm 1977, khi còn là sinh viên Khoa Toán, Trường ĐH Sư phạm TP.HCM, ông đã theo học lớp sáng tác ca khúc ở Nhà văn hóa Thanh Niên. Sau đó ông trở thành hội viên của Câu lạc bộ Sáng tác trẻ Thành Đoàn. Ông tốt nghiệp bậc đại học - Nhạc viện TP.HCM, Khoa Lý luận - Sáng tác - Chỉ huy (năm 1998).
Năm 1991, nhạc sĩ Phạm Đăng Khương làm Trưởng phòng Văn hóa nghệ thuật rồi Phó giám đốc Nhà văn hóa Thanh Niên cho đến khi nghỉ hưu vào năm 2017.
Nhạc sĩ Phạm Đăng Khương cũng là người đam mê và có tài ở nhiều lĩnh vực nghệ thuật... Ngoài sáng tác nhạc, ông còn tự thiết kế phòng thu âm, quay phim, dựng phim, chụp hình nghệ thuật, đạo diễn những bản video karaoke, viết sách, thiết kế mỹ thuật cho những tập sách, tập nhạc...
Trước hoàn cảnh neo người và chi phí thuốc men điều trị rất tốn kém,MC Quỳnh Hoavà bạn bè, đồng nghiệp đang thầm lặng vận động các văn nghệ sĩ cùng người thân hỗ trợ, giúp nhạc sĩ Phạm Đăng Khương cũng như cầu mong cho ông sớm vượt qua cơn nguy kịch này."
https://thanhnien.vn/nhac-si-pham-dang-khuong-ra-mat-50-bai-su-ca-185241222174759572.htm,Nhạc sĩ Phạm Đăng Khương ra mắt 50 bài sử ca,"Sáng 22.12, tại Nhà Văn hóa Thanh Niên TP.HCM, nhạc sĩ Phạm Đăng Khương ra mắt công trình nghệ thuật sử ca Việt Nam mang tựa đề 'Hồng Bàng đất mẹ Văn Lang', gồm 50 ca khúc viết về lịch sử Việt Nam.","Nhạc sĩ Phạm Đăng Khương giới thiệu tuyển tập nhạcHồng Bàng đất mẹ Văn Lang
Ảnh: FBNV
Hồng Bàng đất mẹ Văn Langlà tập nhạc gồm 50 ca khúc về lịch sử, từ thời đại Hồng Bàng (trước công nguyên) liên tục qua quá trình dựng nước, giữ nước, kéo dài đến giai đoạn phong trào Duy Tân năm 1872, do nhạc sĩPhạm Đăng Khươngsáng tác với sự cộng tác của nhiều nhà văn, nhà thơ, nhà báo.
Công trình nghệ thuật gồm tập nhạc với 140 trang, được in màu công phu. Tất cả các tập nhạc đều có mã QR code, chỉ cần quét để xem video, karaoke trên YouTube rất sống động. Với tiết tấu và giai điệu âm nhạc đa số mang tính chất hùng ca, tuyển tập sử nhạc trên rất hữu ích trong các sinh hoạt cộng đồng như trường học, hội đoàn thanh niên, học sinh sinh viên, hướng đạo sinh...
Nhạc sĩ Phạm Đăng Khương tại buổi giao lưu, giới thiệu dự án nghệ thuật sáng 22.12
Ảnh: CTV
Đông đảo đồng nghiệp, bạn bè và các bậc phụ huynh, học sinh khắp nơi hào hứng tham gia chương trình
Ảnh: CTV
Tại buổi giới thiệu,nhạc sĩ Phạm Đăng Khươngcòn giao lưu, ký tặng tập nhạc cho khán giả tham dự. Bên cạnh đó,Nhà văn hóa Thanh Niên TP.HCMcũng dành một góc ở gần sân khấu để trưng bày những ấn phẩm mà nhạc sĩ đã xuất bản.
Ông Nguyễn Hồng Phúc, Giám đốc Nhà văn hóa Thanh Niên TP.HCM chia sẻ nhạc sĩ Phạm Đăng Khương có nhiều đóng góp trong phong tràovăn hóa nghệ thuậtquần chúng của Nhà văn hóa Thanh Niên nói riêng và cả nước nói chung. Suốt thời gian dài khi công tác và gắn bó với Nhà văn hóa Thanh Niên, nhạc sĩ Phạm Đăng Khương góp phần quan trọng trong hoạt động chức năng của đơn vị và cả phong trào về văn hóa nghệ thuật của Thành đoàn.
Theo ông Nguyễn Hồng Phúc, những sáng tác của nhạc sĩ Phạm Đăng Khương đều có những dấu ấn tích cực. Trong mỗi sự kiện quan trọng của tổ chức đoàn, đại hội, sự kiện chính trị... thì những bài hát của nhạc sĩ Phạm Đăng Khương góp phần quan trọng để đem lại cảm xúc cho giới trẻ.
Hồng Bàng đất mẹ Văn Langlà tập nhạc gồm 50 ca khúc lịch sử Việt Nam
Ảnh: FBNV
""Chính những tác phẩm này đã lan tỏa thông điệp rất đẹp của tổ chức đoàn với người trẻ. Ví dụ như bàiKhi Tổ Quốc cần,Thành Đoàn bản hùng ca, Thanh niên vì ngày mai... là những ca khúc đã đồng hành với các phong trào thanh niên tình nguyện. Tại Nhà văn hóa Thanh Niên, anh Khương tập hợp được một lực lượng đông đảo các nhạc sĩ ở nhiều thế hệ, từ nhạc sĩ gạo cội đến nhạc sĩ trẻ để đóng góp cho phong trào văn hóa nghệ thuật của TP.HCM nói riêng và cả nước nói chung. Đến bây giờ, niềm đam mê sáng tác của anh Khương vẫn còn. Anh vẫn tiếp tục đồng hành cùng Nhà văn hóa Thanh Niên và tiếp tục có những sáng tác phù hợp trong cuộc phát triển của thành phố"", Giám đốc Nhà văn hóa Thanh Niên TP.HCM chia sẻ.
Nhạc sĩ Phạm Đăng Khương vẫn miệt mài cống hiến cho nghệ thuật
Ảnh: FBNV
Nhạc sĩ Phạm Đăng Khương sinh năm 1957 tạiQuảng Ngãi, là tên tuổi quen thuộc của giới âm nhạc TP.HCM. Cả cuộc đời ông gần như gắn bó với Nhà văn hóa Thanh Niên (TP.HCM). Từ năm 1977, khi còn là sinh viên khoa Toán, Trường đại học Sư phạm TP.HCM, ông đã theo học lớp Sáng tác ca khúc ở Nhà văn hóa Thanh Niên. Sau đó ông trở thành hội viên của Câu lạc bộ Sáng tác trẻ Thành đoàn.
Năm 1991 nhạc sĩ Phạm Đăng Khương làm Trưởng phòng Văn hóa nghệ thuật rồi Phó giám đốc Nhà văn hóa Thanh Niên cho đến khi nghỉ hưu vào năm 2017. Ông tốt nghiệp bậc đại học, Nhạc viện TP.HCM - khoa Lý luận - Sáng tác - Chỉ huy (năm 1998). Nhạc sĩ Phạm Đăng Khương cũng là người đam mê và có tài ở nhiều lĩnh vực nghệ thuật.
Ngoài việc sáng tác nhạc, giai đoạn sau này ông còn tự thiết kế phòng thu âm, quay phim, dựng phim, chụp hình nghệ thuật, đạo diễn những bản video và karaoke, tham gia làm phim du lịch ở rất nhiều nước trênthế giớicho những công ty du lịch nổi tiếng. Ngoài ra, nhạc sĩ Phạm Đăng Khương còn viết sách, thiết kế mỹ thuật cho những tập sách, tập nhạc..."
