url,title,description,content
https://thanhnien.vn/quoc-hoi-se-tao-dieu-kien-hon-nua-de-phu-nu-phat-huy-nang-luc-185251017223455082.htm,Quốc hội sẽ tạo điều kiện hơn nữa để phụ nữ phát huy năng lực,"Quốc hội sẽ tiếp tục quan tâm, tạo điều kiện hơn nữa để phụ nữ phát huy năng lực, tiếp tục cống hiến, hoàn thành xuất sắc nhiệm vụ được giao...","Nhân kỷ niệm 95 năm Ngày thành lập Hội Liên hiệp phụ nữ VN (20.10.1930 - 20.10.2025), chiều 17.10, tại Nhà Quốc hội (QH), Chủ tịch QH Trần Thanh Mẫn gặp mặt, chúc mừng các nữ đại biểu QH chuyên trách, nữ lãnh đạo, nữ đảng ủy viên các Đảng bộ trực thuộc Đảng ủy QH.
Thay mặt Ủy ban Thường vụ QH, Ban Thường vụ Đảng ủy QH,Chủ tịch QH Trần Thanh Mẫngửi đến các nữ đại biểu QH chuyên trách, nữ lãnh đạo, nữ đảng ủy viên các Đảng bộ trực thuộc Đảng ủy QH lời chúc mừng mạnh khỏe, hạnh phúc, thành công và có nhiều đóng góp cho sự nghiệp của QH.
Chủ tịch Quốc hội Trần Thanh Mẫn tặng hoa, chúc mừng các nữ đại biểu Quốc hội trực thuộc Đảng ủy Quốc hội
Ảnh: TTXVN
Chủ tịch QH nêu rõ, chặng đường gần 80 năm xây dựng và trưởng thành của QH VN đã ghi dấu đóng góp của biết bao thế hệ đại biểu QH, cán bộ, nữ đại biểu QH qua các thời kỳ.
Nhấn mạnh nhiệm vụ của QH từ nay đến cuối năm 2025 rất nặng nề, trong đó có việc chuẩn bị cho Kỳ họp thứ 10, QH khóa XV với khối lượng công việc rất lớn, Chủ tịch QH đề nghị các nữ đại biểu QH chuyên trách, nữ lãnh đạo, nữđảng ủyviên các Đảng bộ trực thuộc Đảng ủy QH tiếp tục phát huy truyền thống tốt đẹp của phụ nữ VN; phát huy trí tuệ, trách nhiệm, nhiệt huyết, tài năng, bản lĩnh để góp phần nâng cao hiệu quả hoạt động QH.
Để thích ứng nhanh với sự thay đổi của thực tiễn, mỗi nữ đại biểu QH, phụ nữ trong cơ quan của QH tiếp tục tiên phong trong rèn luyện, có tri thức, sức khỏe, trách nhiệm với bản thân, gia đình, xã hội và đất nước; không ngừng nghiên cứu, lắng nghe, trang bị thêm kiến thức, kỹ năng phục vụ công tác…
Chủ tịch QH mong muốn, phụ nữ tại khối cơ quan QH sẽ đi đầu, làm nòng cốt thúc đẩy phong trào ứng dụng công nghệ thông tin, chuyển đổi số, đổi mới sáng tạo, nghiên cứu và tiếp thu các thành tựu khoa học công nghệ; thực hiện hiệu quả phong trào ""Bình dân học vụ số"". Đặc biệt, phụ nữ cần quán triệt tinh thần và thực hiện chỉ đạo củaTổng Bí thư Tô Lâmtại Đại hội Thi đua yêu nước lần thứ 5 của Hội Liên hiệp phụ nữ VN, gợi mở 10 định hướng, nhiệm vụ trọng tâm ""đột phá chiến lược"" của phong trào phụ nữ VN giai đoạn 2025 - 2035, tầm nhìn 2045.
Chủ tịch QH khẳng định, Đảng ủy QH, Ủy ban Thường vụ QH, các cơ quan QH sẽ tiếp tục quan tâm, tạo điều kiện hơn nữa để phụ nữ phát huy năng lực, tiếp tục cống hiến, hoàn thành xuất sắc nhiệm vụ được giao, đóng góp nhiều hơn nữa cho hoạt động của QH."
https://thanhnien.vn/ha-noi-quyet-tam-giai-quyet-dut-diem-4-van-de-duoc-tong-bi-thu-chi-ro-18525101716255252.htm,Hà Nội quyết tâm giải quyết dứt điểm 4 vấn đề được Tổng Bí thư chỉ rõ,"Trình bày dự thảo chương trình hành động thực hiện thực hiện Nghị quyết Đại hội Đảng bộ TP.Hà Nội lần thứ XVIII, Chủ tịch Hà Nội cho biết, thành phố sẽ quyết tâm giải quyết dứt điểm 4 vấn đề đô thị tồn tại kéo dài.","Chiều 17.10, tại phiên bế mạcĐại hội Đảng bộ TP.Hà Nộikhóa XVIII, nhiệm kỳ 2025 - 2030, Phó bí thư Thành ủy, Chủ tịch UBND TP.Hà Nội Trần Sỹ Thanh đã báo cáo đại hội các nội dung chủ yếu của Dự thảo Chương trình hành động thực hiện Nghị quyết Đại hội Đảng bộ TP.Hà Nội lần thứ XVIII.
Chủ tịch UBND TP.Hà Nội Trần Sỹ Thanh phát biểu tại tổ thảo luận
ẢNH: THÀNH ỦY HÀ NỘI
Theo đó, về thể chế, quản trị và huy động nguồn lực, Hà Nội sẽ đổi mới mạnh mẽ mô hình quản trị thủ đô theo hướng tiên tiến, tích hợp, hiện đại, chuyển từ tư duy quản lý sang tư duy kiến tạo, phục vụ.
Hà Nội cũng xác lập mô hình phát triển mới, đẩy mạnh công nghiệp hóa, hiện đại hóa và phát triển kinh tế tư nhân thành lực lượng chủ đạo. Tiến tới nền kinh tế tri thức, đổi mới sáng tạo và có giá trị gia tăng cao. Hình thành ba cực sáng tạo làm trụ cột dẫn dắt: ""Di sản - Tri thức - Công nghệ""…
Cạnh đó, Hà Nội sẽ thúc đẩy mạnh mẽ KH-CN, đổi mới sáng tạo và chuyển đổi số toàn diện trong mọi lĩnh vực. Xây dựng Hà Nội thành thành phố thông minh, lấy người dân và doanh nghiệp là trung tâm.
Về quy hoạch và phát triển đô thị, nông thôn, Hà Nội sẽ triển khai, rà soát và điều chỉnh quy hoạch theo mô hình phát triển mới; quản lý phát triển đô thị, nông thôn bền vững gắn với bảo vệ môi trường, sử dụng tài nguyên hiệu quả. Quyết tâm giải quyết dứt điểm 4 vấn đề đô thị tồn tại kéo dài gồm: ùn tắc giao thông; trật tự, kỷ cương và vệ sinh đô thị; ô nhiễm môi trường (nước, không khí); tình trạng ngập úng ở khu vực nội đô và ven đô.
Về văn hóa, dự thảo cho biết sẽ phát huy truyền thống ngàn năm văn hiến Thăng Long Hà Nội, xây dựng con người Hà Nội thanh lịch, văn minh… Lấy con người làm trung tâm và thước đo mọi sự phát triển, xây dựng thủ đô nhân văn, hạnh phúc, công bằng và văn minh, trở thành hình mẫu văn hoá, tri thức dẫn dắt quốc gia.
Thường trực Ban Bí thư Trần Cẩm Tú thay mặt lãnh đạo Đảng, Nhà nước tặng hoa Ban Chấp hành Đảng bộ TP.Hà Nội khóa XVIII
ẢNH: HỮU THẮNG
Về GD-ĐT, Hà Nội sẽ xây dựng hệ thống giáo dục hàng đầu cả nước, hội nhập quốc tế; phổ cập giáo dục STEAM, STEM (phương pháp giáo dục tích hợp - PV), giáo dục sáng tạo và nghiên cứu khoa học từ bậc phổ thông. Hoàn thiện quy hoạch hệ thống trường học từ phổ thông đến đại học.
Về y tế và an sinh xã hội, Hà Nội sẽ nâng cao phúc lợi xã hội, cải thiện chất lượng sống người dân. Đảm bảo mọi người dân được tiếp cận dịch vụ xã hội thiết yếu chất lượng.
Cạnh đó, Hà Nội sẽ tăng cường tiềm lực quốc phòng, an ninh gắn với phát triển kinh tế - xã hội. Xây dựng công trình có tính lưỡng dụng cao; giữ vững ổn định chính trị, an ninh trật tự, tạo môi trường bình yên cho phát triển…
Hà Nội sẽ tiếp tục xây dựng, chỉnh đốn Đảng trong sạch, vững mạnh, nêu gương, hành động, trách nhiệm. Xây dựng hệ thống chính trị thành phố tinh gọn, hiệu lực, hiệu quả; chuyển mạnh từ tư duy quản lý sang tư duy kiến tạo, phục vụ…
Chủ tịch Hà Nội Trần Sỹ Thanh cho biết, toàn Đảng bộ quán triệt sâu sắc phương châm hành động mà Tổng Bí thư đã chỉ đạo: ""Hà Nội đã nói là làm - làm nhanh, làm đúng, làm hiệu quả, làm đến cùng"". Đây cũng là thông điệp hành động của Ban Chấp hành Đảng bộ thành phố khóa XVIII, cũng là lời hiệu triệu gửi tới toàn thể cán bộ, đảng viên và nhân dân thủ đô.
""Mỗi người trong chúng ta hãy tiếp tục đổi mới, sáng tạo, dấn thân và tiên phong, vượt qua mọi khó khăn, thách thức, quyết liệt hành động, hoàn thành thắng lợi các mục tiêu, nhiệm vụ Nghị quyết Đại hội XVIII Đảng bộ thành phố đã đề ra; góp phần xây dựng thủ đô Hà Nội phát triển nhanh và bền vững, ngày càng giàu đẹp, văn hiến, văn minh, hiện đại, xứng đáng với niềm tin yêu, kỳ vọng của cả nước và danh hiệu cao quý ""Thủ đô anh hùng - Thành phố vì hòa bình - Thành phố sáng tạo"", ông Thanh bày tỏ.
Trước đó, sáng 16.10, phát biểu chỉ đạo tại phiên khai mạc Đại hội đại biểu Đảng bộ TP.Hà Nội lần thứ XVIII, nhiệm kỳ 2025 - 2030, Tổng Bí thư Tô Lâm đề nghị, trong nhiệm kỳ Đại hội Đảng bộ thành phố lần thứ XVIII, Hà Nội phải giải quyết dứt điểm 4 vấn đề tồn tại nhiều năm của thủ đô: ô nhiễm, ùn tắc, ngập úng, trật tự đô thị. Đây là những vấn đề mà nhân dân rất mong đợi."
https://thanhnien.vn/ha-noi-co-2-tan-pho-bi-thu-thanh-uy-185251017104531968.htm,Hà Nội có 2 tân Phó bí thư Thành ủy,"Thường trực Thành ủy Hà Nội khóa XVIII, nhiệm kỳ 2025 - 2030 gồm 5 người, trong đó có 2 tân phó bí thư Thành ủy là bà Phùng Thị Hồng Hà và ông Nguyễn Trọng Đông.","Tại Đại hội đại biểuĐảng bộ TP.Hà Nộilần thứ XVIII, nhiệm kỳ 2025 - 2030, Ban Chấp hành Đảng bộ TP.Hà Nội lần thứ XVIII đã tổ chức hội nghị lần thứ nhất, bầu ra 17 ủy viên Ban Thường vụ Thành ủy Hà Nội khóa XVIII.
Tân Phó bí thư Thành ủy Hà Nội Phùng Thị Hồng Hà
ẢNH: HỮU THẮNG
Trong 17 ủy viên Ban Thường vụ Thành ủy Hà Nội khóa XVIII, 11 người là ủy viên Ban Thường vụ Thành ủy Hà Nội khóa XVII tái cử và 6 người tham gia lần đầu.
Ban Chấp hành Đảng bộ TP.Hà Nội lần thứ XVIII đã bầu bà Bùi Thị Minh Hoài, Bí thư Thành ủy Hà Nội khóa XVII, giữ chức Bí thư Thành ủy Hà Nội khóa XVIII, nhiệm kỳ 2025 - 2030.
4 Phó bí thư Thành ủy Hà Nội khóa XVIII, gồm các ông, bà: Trần Sỹ Thanh, Nguyễn Văn Phong, Phùng Thị Hồng Hà, Nguyễn Trọng Đông.
Như vậy, so với Thường trực Thành ủy Hà Nội khóa XVII, Thường trực Thành ủy Hà Nội khóa XVIII có thêm 2 tân phó bí thư Thành ủy là bà Phùng Thị Hồng Hà và ông Nguyễn Trọng Đông.
Phó chủ tịch UBND TP.Hà Nội Nguyễn Trọng Đông được bầu làm Phó bí thư Thành ủy Hà Nội
ẢNH: VIẾT THÀNH
Bà Phùng Thị Hồng Hà (sinh 1971, quê Ứng Hòa, Hà Nội), trình độ thạc sĩ tài chính - ngân hàng. Bà Hà từng có nhiều năm công tác tại Sở Tài chính Hà Nội, Bí thư H.Thanh Oai (cũ). Trước khi được bầu làm Phó bí thư Thành ủy, bà Hà có nhiều năm làm Phó chủ tịch HĐND thành phố.
Ông Nguyễn Trọng Đông (sinh năm 1969, quê Đông Anh, Hà Nội), trình độ kỹ sư quản lý đất đai, cử nhân ngoại ngữ. Ông Đông từng làm Phó giám đốc rồi Giám đốc Sở TN-MT (cũ), sau đó có nhiều năm làm Phó chủ tịch UBND thành phố trước khi được bầu làm Phó bí thư Thành ủy Hà Nội."
https://thanhnien.vn/bo-chinh-tri-co-trach-nhiem-chuan-bi-gioi-thieu-nhan-su-bau-4-lanh-dao-chu-chot-185251017105404903.htm,"Bộ Chính trị có trách nhiệm chuẩn bị, giới thiệu nhân sự bầu 4 lãnh đạo chủ chốt","Quy định 377 của Bộ Chính trị quy định Bộ Chính trị có trách nhiệm chuẩn bị, giới thiệu nhân sự bầu các chức danh Tổng Bí thư, Chủ tịch nước, Thủ tướng Chính phủ, Chủ tịch Quốc hội.","Bộ Chính trịvừa ban hành Quy định 377 về phân cấp quản lý cán bộ và quy hoạch, bổ nhiệm, giới thiệu ứng cử, tạm đình chỉ công tác, cho thôi giữ chức vụ, từ chức, miễn nhiệm đối với cán bộ.
Hội nghị Trung ương 13 đã thống nhất giới thiệu nhân sự Trung ương Đảng khóa XIV
ẢNH: GIA HÂN
Theo đó, Quy định 377 nêu rõ, Bộ Chính trị có trách nhiệm và quyền chuẩn bị, giới thiệu nhân sự để Trung ương Đảng xem xét bầu Tổng Bí thư, Bộ Chính trị; Ban Bí thư, Ủy ban Kiểm tra Trung ương, Chủ nhiệm Ủy ban Kiểm tra Trung ương; giới thiệu nhân sự để Quốc hội bầu giữ chức Chủ tịch nước, Thủ tướng, Chủ tịch Quốc hội.
Bộ Chính trị còn có trách nhiệm chuẩn bị, giới thiệu nhân sự để xin ý kiến Trung ương trước khi giới thiệu nhân sự để Quốc hội bầu, phê chuẩn đối với các chức danh: phó chủ tịch nước, phó chủ tịch Quốc hội, phó thủ tướng, chánh án TAND tối cao, viện trưởng Viện KSND tối cao, ủy viên Ủy ban Thường vụ Quốc hội, chủ tịch Hội đồng Dân tộc, tổng thư ký Quốc hội - chủ nhiệm Văn phòng Quốc hội, chủ nhiệm ủy ban của Quốc hội, tổng kiểm toán nhà nước, các thành viên Chính phủ.
Bộ Chính trị xin ý kiến Trung ương trước khi xem xét, quyết định quy hoạch Ban Chấp hành Trung ương Đảng, Bộ Chính trị, Ban Bí thư.
Cạnh đó, Bộ Chính trị có quyền kỷ luật cán bộ và những vấn đề khác về công tác cán bộ thuộc thẩm quyền của Trung ương Đảng. Quyết định phân công công tác đối với ủy viên Bộ Chính trị, ủy viên Ban Bí thư, ủy viên Trung ương Đảng (cả chính thức và dự khuyết).
Bộ Chính trị cũng có trách nhiệm và quyền chỉ định phó bí thư, ủy viên Quân ủy Trung ương và bí thư, phó bí thư, ủy viên Đảng ủy Công an Trung ương; chỉ định (hoặc thí điểm chỉ định) theo quy định của Ban Chấp hành Trung ương Đảng đối với ủy viên ban chấp hành, ban thường vụ, bí thư, phó bí thư, ủy ban kiểm tra, chủ nhiệm, phó chủ nhiệm ủy ban kiểm tra tỉnh ủy, thành ủy, đảng ủy trực thuộc Trung ương.
Khi cần thiết, Bộ Chính trị chỉ định bí thư, giao quyền bí thư hoặc giao phụ trách đảng bộ trực thuộc Trung ương.
Bộ Chính trị cũng có trách nhiệm quyết định đánh giá, quy hoạch, đào tạo, bồi dưỡng, bố trí, phân công, bổ nhiệm, giới thiệu ứng cử, tái cử, chỉ định, điều động, luân chuyển, biệt phái cán bộ; phong, thăng, giáng, tước cấp bậc hàm cấp tướng; tạm đình chỉ, đình chỉ chức vụ; tạm đình chỉ công tác, cho thôi giữ chức vụ, từ chức, miễn nhiệm, đưa ra khỏi quy hoạch; khen thưởng, kỷ luật và thực hiện chế độ, chính sách đối với các chức danh cán bộ theo thẩm quyền.
Bộ Chính trị có thể ủy quyền cho Chủ tịch nước, Thủ tướng, Chủ tịch Quốc hội, Thường trực Ban Bí thư trong phạm vi, lĩnh vực phụ trách xem xét.
Theo đó, Chủ tịch nước, Thủ tướng, Chủ tịch Quốc hội có thể được ủy quyền quyết định phân công, bổ nhiệm, giới thiệu ứng cử đối với cán bộ thuộc diện Bộ Chính trị quản lý giữ các chức danh, chức vụ có cơ cấu kiêm nhiệm của các đảng ủy trực thuộc Đảng ủy các cơ quan Đảng Trung ương, Đảng ủy Chính phủ, Đảng ủy Quốc hội, Đảng ủy Mặt trận Tổ quốc, các đoàn thể Trung ương; Mặt trận Tổ quốc Việt Nam, các tổ chức chính trị - xã hội, hội, tổ chức nghị sĩ hữu nghị của Việt Nam với các nước, các ban chỉ đạo theo quy định.
Chủ tịch nước, Thủ tướng, Chủ tịch Quốc hội có thể được ủy quyền bổ nhiệm lại và thực hiện chế độ nghỉ hưu đối với cán bộ thuộc diện Bộ Chính trị quản lý theo quy định (trừ các ủy viên Trung ương Đảng)."
https://thanhnien.vn/ba-bui-thi-minh-hoai-tiep-tuc-lam-bi-thu-thanh-uy-ha-noi-185251017084447724.htm,Bà Bùi Thị Minh Hoài tiếp tục làm Bí thư Thành ủy Hà Nội,"Bà Bùi Thị Minh Hoài, Bí thư Thành ủy Hà Nội khóa XVII, tiếp tục được bầu làm Bí thư Thành ủy Hà Nội khóa XVIII, nhiệm kỳ 2025 - 2030.","Cùng vớiBí thưThành ủy Hà Nội Bùi Thị Minh Hoài, Thường trực Thành ủy Hà Nội khóa XVIII còn có 4 Phó bí thư Thành ủy.
Bà Bùi Thị Minh Hoài được bầu giữ chức Bí thư Thành ủy Hà Nội khóa XVIII
ẢNH: HỮU THẮNG
4 Phó bí thư Thành ủy Hà Nội gồm: ông Trần Sỹ Thanh, Phó bí thư Thành ủy khóa XVII, Chủ tịch UBND TP.Hà Nội; ông Nguyễn Văn Phong, Phó bí thư thường trực Thành ủy Hà Nội khóa XVII; bà Phùng Thị Hồng Hà, Phó chủ tịch thường trực HĐND TP.Hà Nội; ông Nguyễn Trọng Đông, Phó chủ tịch UBND TP.Hà Nội.
Như vậy, ở nhiệm kỳ lần này, Hà Nội có 2 tân Phó bí thư Thành ủy Hà Nội là bà Phùng Thị Hồng Hà và ông Nguyễn Trọng Đông.
Danh sách 17 ủy viên Ban Thường vụ Thành ủy Hà Nội khóa XVIII như sau:
1. Bà Bùi Thị Minh Hoài, Ủy viên Bộ Chính trị, Bí thư Thành ủy Hà Nội khóa XVII, Trưởng đoàn đại biểu Quốc hội TP.Hà Nội khóa XV
2. Ông Trần Sỹ Thanh, Ủy viên Trung ương Đảng, Phó bí thư Thành ủy khóa XVII, Chủ tịch UBND TP.Hà Nội, đại biểu Quốc hội khóa XV
3. Ông Nguyễn Văn Phong, Phó bí thư thường trực Thành ủy Hà Nội khóa XVII
4. Bà Phùng Thị Hồng Hà, Phó bí thư Thành ủy khóa XVII, Phó chủ tịch thường trực HĐND TP.Hà Nội
5. Ông Nguyễn Trọng Đông, Phó bí thư Thành ủy khóa XVII, Phó chủ tịch UBND TP.Hà Nội
6. Ông Hà Minh Hải, Trưởng ban Tổ chức Thành ủy Hà Nội khóa XVII, Phó bí thư thường trực Đảng ủy các cơ quan Đảng TP.Hà Nội
7. Ông Nguyễn Doãn Toản, Trưởng ban Tuyên giáo và Dân vận Thành ủy Hà Nội khóa XVII
8. Ông Đỗ Anh Tuấn, Trưởng ban Nội chính Thành ủy Hà Nội khóa XVII
9. Ông Dương Đức Tuấn, Phó chủ tịch UBND TP.Hà Nội
10. Bà Bùi Huyền Mai, Phó chủ tịch thường trực Ủy ban Mặt trận Tổ quốc Việt Nam TP.Hà Nội
11. Ông Nguyễn Thanh Tùng, Giám đốc Công an TP.Hà Nội
12. Ông Đào Văn Nhận, Tư lệnh Bộ Tư lệnh thủ đô Hà Nội
13. Ông Nguyễn Xuân Lưu, Chủ nhiệm Ủy ban Kiểm tra Thành ủy khóa XVII, Giám đốc Sở Tài chính TP.Hà Nội
14. Ông Nguyễn Mạnh Quyền, Phó chủ tịch UBND TP.Hà Nội
15. Ông Trần Đình Cảnh, Giám đốc Sở Nội vụ TP.Hà Nội
16. Ông Trần Thế Cương, Giám đốc Sở GD-ĐT TP.Hà Nội
17. Ông Vũ Đăng Định, Bí thư Đảng ủy, Chủ tịch HĐND P.Hoàn Kiếm.
Bà Bùi Thị Minh Hoài (59 tuổi), quê H.Thanh Liêm, tỉnh Hà Nam; trình độ thạc sĩ, cử nhân luật. Bà Hoài là Bí thư T.Ư Đảng khóa XIII, Ủy viên T.Ư Đảng các khóa IX (dự khuyết), XI, XII, XIII.
Bà Bùi Thị Minh Hoài từng giữ các chức vụ: Phó chủ nhiệm Ủy ban Kiểm tra Tỉnh ủy, Phó chủ tịch HĐND tỉnh Hà Nam, Trưởng ban Dân vận Tỉnh ủy Hà Nam, Bí thư Thành ủy Phủ Lý (tỉnh Hà Nam), Phó chủ tịch rồi Phó chủ tịch thường trực Hội Nông dân Việt Nam.
Từ năm 2011, bà Bùi Thị Minh Hoài làm Phó chủ nhiệm Ủy ban Kiểm tra T.Ư, sau đó giữ cương vị Phó chủ nhiệm thường trực Ủy ban Kiểm tra T.Ư vào năm 2018.
Tại Đại hội XIII của Đảng năm 2021, bà Bùi Thị Minh Hoài tái đắc cử vào Ban Chấp hành T.Ư Đảng và được bầu vào Ban Bí thư T.Ư Đảng nhiệm kỳ 2021 - 2026.
Tháng 4.2021, bà Bùi Thị Minh Hoài được phân công giữ chức Trưởng ban Dân vận T.Ư. Tại Hội nghị T.Ư 9 khóa XIII khai mạc sáng 16.5.2024, T.Ư Đảng bầu bổ sung bà Hoài vào Bộ Chính trị khóa XIII.
Đến tháng 7.2024, Bộ Chính trị quyết định phân công bà Bùi Thị Minh Hoài, Trưởng ban Dân vận T.Ư, giữ chức Bí thư Thành ủy Hà Nội khóa XVII.
"
