url,title,description,content
https://thanhnien.vn/dan-da-dak-son-o-lam-dong-duoc-cong-nhan-la-bao-vat-quoc-gia-185250912053240835.htm,Đàn đá Đắk Sơn ở Lâm Đồng được công nhận là bảo vật quốc gia,"Đàn đá Đắk Sơn có nguồn gốc bản địa, được sản xuất tại chỗ trên vùng đất Tây nguyên thời tiền sử, vừa được Thủ tướng Chính phủ công nhận là bảo vật quốc gia.","Ngày 12.9, tại P.Đông Gia Nghĩa (TP.Gia Nghĩa, Đắk Nông cũ), UBND tỉnh Lâm Đồng tổ chức lễ công bố quyết định của Thủ tướng Chính phủ công nhậnđàn đáĐắk Sơn làbảo vật quốc gia.
Bộ đàn đá Đắk Sơn được chế tác bằng đá Rhyolite
ẢNH: LÂM VIÊN
Theo Sở VH-TT-DL tỉnh Lâm Đồng, đàn đá Đắk Sơn được phát hiện ngẫu nhiên trong lòng đất khi người dân đào hố trồng tiêu để canh tác nông nghiệp ở độ sâu từ 50 đến 90 cm vào năm 2014 tại thôn Đắk Sơn, xã Nam Xuân, H.Krông Nô, tỉnh Đắk Nông cũ - nay là xã Đắk Sắk, Lâm Đồng.
Sở VH-TT-DL tỉnh Lâm Đồng nhận quyết định của Thủ tướng Chính phủ công nhận đàn đá Đắk Sơn là bảo vật quốc gia
ẢNH: LÂM VIÊN
Đàn đá Đắk Sơn được chế tác từ đá rhyolite (đá phiến biến chất), có niên đại khoảng 3.500 – 3.000 năm, gồm 16 thanh. Trong đó, 11 thanh còn nguyên vẹn, 5 thanh bị gãy đôi hoặc gãy ba nhưng vẫn có thể phục dựng nguyên dạng, đủ điều kiện nghiên cứu về kỹ thuật chế tác. Chiều dài trung bình của các thanh 57,6 cm, chiều rộng trung bình 12,4 cm, độ dày trung bình các thanh 3 cm, trọng lượng trung bình 3,94 kg, tần số âm thanh dao động lớn, thấp nhất 191,9 Hz, lớn nhất 4.500 Hz.
Bộ đàn đá Đắk Sơn minh chứng cho đời sống văn hóa tinh thần rất đa dạng, phong phú của cư dân bản địa ở xã Đắk Sơn
ẢNH: LV
Bộ sưu tập đàn đá Đắk Sơn không chỉ là cứ liệu minh chứng cho đời sống văn hóa tinh thần rất đa dạng, phong phú của cư dân bản địa ở xã Đắk Sơn, mà còn khẳng định đây là bộ sưu tập có giá trị đặc biệt về lịch sử, văn hóa, có nguồn gốc bản địa, được sản xuất tại chỗ trên vùng đất Tây nguyên thời tiền sử.
Di tích quốc gia, danh lam thắng cảnh Hang C3 thuộc hệ thống hang động núi lửa Krông Nô
ẢNH: L.V
Dịp này, tỉnh Lâm Đồng công bố quyết định của Bộ trưởng Bộ VH-TT-DL về việc xếp hạngdi tích quốc gia, danh lam thắng cảnh Hang C3, C4, C7, C8 thuộc hệ thống hang động núi lửa Krông Nô (tỉnh Đắk Nông cũ).
Đây là một phần của hệ thống hang động núi lửa dài nhất Đông Nam Á, có cấu trúc địa chất độc đáo và giá trị nghiên cứu cao, hình thành từ hoạt động phun trào của núi lửa Chư B'luk khoảng 600.000 - 200.000 năm trước. Ngoài ra, lễ hội Tăm Blang M'prang Bon (lễ cúng rào bon trồng cây) của người M'nông cũng được Bộ VH-TT-DL xếp vào danh mụcdi sản văn hóa phi vật thể quốc gia.
Miệng hang núi lửa C7 thuộc hệ thống hang động núi lửa Krông Nô
ẢNH: L.V

Hội nghị xúc tiến, liên kết hợp tác phát triển du lịch tỉnh Lâm Đồng sáng 12.9, tại Trung tâm hội nghị Đắk Nông
ẢNH: LÂM VIÊN
NhưThanh Niênđã thông tin, từ ngày 9-13.9, tỉnh Lâm Đồng tổ chức chương trình khảo sát, xây dựng các sản phẩm, dịch vụ du lịch tại 3 khu vực Mũi Né, Đà Lạt và Gia Nghĩa với sự tham gia của trên 100 đại biểu đến từ các sở ngành, Hiệp hội Du lịch tỉnh Lâm Đồng và Đồng Nai, các doanh nghiệp du lịch, hãng lữ hành trong và ngoài tỉnh; các chuyên gia tư vấn du lịch, chuyên gia xây dựng sản phẩm, tour tuyến du lịch...
Đặc biệt, ngày 12.9, tại Trung tâm hội nghị Đắk Nông, tỉnh Lâm Đồng tổ chức hội nghị xúc tiến, liên kết hợp tác phát triển du lịch tỉnh Lâm Đồng. Tại hội nghị, ông Nguyễn Văn Lộc, Giám đốc Sở VH-TT-DL tỉnh Lâm Đồng cho biết, Lâm Đồng (mới) là vùng đất hội tụ những giá trị độc đáo về thiên nhiên và văn hóa, từ cao nguyên Đà Lạt thơ mộng, vùng biển Mũi Né đầy nắng gió đến rừng nguyên sinh Tà Đùng hùng vĩ. Thông qua hội nghị, tỉnh mong muốn gắn kết các sản phẩm, dịch vụ, điểm đến du lịch ở các địa phương thành chuỗi sản phẩm chất lượng, có tính khác biệt, có tính cạnh tranh cao, mang lại trải nghiệm trọn vẹn cho du khách, góp phần khẳng định thương hiệu sản phẩm, thúc đẩy phát triển du lịch toàn diện, bền vững và đột phá.

"
https://thanhnien.vn/bo-suu-tap-da-quy-lien-quan-xa-loi-phat-duoc-tra-ve-an-do-185250801075310631.htm,Bộ sưu tập đá quý liên quan xá lợi Phật được trả về Ấn Độ,Một bộ sưu tập gồm hàng trăm món đồ trang sức liên quan đến xá lợi Phật được trả về Ấn Độ sau 127 năm.,"Cuộc đấu giá bộ sưu tập đá quý liên quan đếnxá lợi Phậtđược lên kế hoạch vào đầu năm nay, gây ra mối đe dọa về việc hồi hương số cổ vật quý này.
Bộ trưởng Bộ Văn hóa và Du lịch Ấn Độ Gajendra Singh Shekhawat cầu nguyện sau khi nhận lại những viên ngọc Piprahwa linh thiêng
ẢNH: REUTERS
Thủ tướng Ấn Độ Narendra Modi hoan nghênh sự trở lại của bộ sưu tập được gọi làĐá quý Piprahwa của Đức Phật.""Một ngày vui cho di sản văn hóa chúng ta! Điều đó sẽ khiến mọi người dân Ấn Độ tự hào"", ông Modi viết trong bài đăng trên X hôm 30.7.
Bộ sưu tập hơn 300 loại đá quý bao gồm thạch anh tím, topaz và ngọc trai có niên đại từ Đế chế Maurya, thời đại Ashokan, khoảng năm 240-200 trước Công nguyên.
Bộ sưu tập lần đầu tiên được một người Anh khai quật ở miền bắc Ấn Độ, ban đầu dự kiến đượcSotheby'sHồng Kông (Trung Quốc) bán đấu giá vào tháng 5.2025 nhưng cuộc bán đấu giá đã bị hoãn lại sau khi chính phủ Ấn Độ đe dọa sẽ có hành động pháp lý và yêu cầu trả lại số trang sức, theoReuters.
Sau đó, Sotheby's đã xác định tập đoàn Godrej Industries Group của Ấn Độ là người mua và đảm bảo một cuộc mua bán chứng kiến sự trở lại vĩnh viễn của những viên đá quý này về Ấn Độ, cũng như sẽ được trưng bày trước công chúng.
""Sotheby's rất vui mừng khi được tạo điều kiện để đưa Piprahwa Gems trở về Ấn Độ"", đại diện nhà đấu giá cho biết vào cuối ngày 30.7.
Những viên đá quý Piprahwa, có niên đại từ khoảng năm 240-200 trước Công nguyên
ẢNH: SOTHEBY'S
Bộ Văn hóa và Du lịch Ấn Độ cho biết đây là mối quan hệ đối tác công tư mẫu mực và sáng kiến này phù hợp với sứ mệnh rộng lớn hơn của Thủ tướng Modi, nhằm khôi phục và tôn vinh di sản văn hóa của Ấn Độ trên khắp thế giới.
Những viên ngọc này được khai quật vào năm 1898 từ một bảo tháp cổ ở Piprahwa, miền bắc Ấn Độ, bởi người quản lý bất động sản William Claxton Peppe, cùng với những mảnh xương được cho là của Đức Phật. Sau đó, Peppe được phép giữ lại hơn 300 viên ngọc, hiện vẫn thuộc về gia đình ông."
https://thanhnien.vn/doi-giay-mon-got-hanh-trinh-ke-chuyen-bang-nhung-buoc-chan-18525110510491311.htm,‘Đôi giày mòn gót’ - hành trình kể chuyện bằng những bước chân,"Có những quyển sách ra đời từ ý tưởng, và cũng có những quyển được viết nên từ nhịp thở của cuộc đời - nơi tác giả gom góp từng kỷ niệm, từng giọt mồ hôi và nụ cười để chắt chiu thành trang viết.","Đôi giày mòn gótcủa tác giả Thi Quốc Duy là một quyển sách như thế: chân thật, mộc mạc và đầy ắp hơi thở của những chuyến đi.
Gần 300 trang sách được chia thành 3 phần, như mộtcuốn nhật kýhành trình xen lẫn hồi ức nghề nghiệp. Ở đó, người đọc bắt gặp đủ sắc thái của đời hướng dẫn viên, từ ánh hào quang đến góc khuất, từ tiếng cười rộn rã đến cả những giọt nước mắt giấu kín sau mỗi chuyến đi...
Giọng văn dung dị, đôi khi như lời tâm sự, khiến người đọc nhiều lần dừng lại để suy ngẫm về lòng kiên trì và niềm say mê trong từng bước chân rong ruổi của tác giả - từng là sinh viên ngành ngân hàng nhưng đã rẽ ngang với nghề hướng dẫn viêndu lịch.
Bìa sáchĐôi giày mòn gót(NXB Thế Giới)
ẢNH: NXB
Đôi giày mòn gótkhông chỉ kể chuyện nghề, mà còn mở ra những khung trời rộng lớn. Từ mùa thu vàng trênruộng bậc thangTú Lệ (Việt Nam), ánh hoàng hôn đổ dài trên Đấu trường Colosseum (Ý) đến nhịp vó ngựa nơi cố đô Bagan (Myanmar)… Mỗi vùng đất hiện lên qua lăng kính của người kể chuyện vừa gần gũi, vừa tràn đầy rung động. Những câu chuyện được viết không để phô trương trải nghiệm, mà để nhắc nhớ về tình người, về những khoảnh khắc nhỏ bé nhưng thắp sánghành trìnhdài.
Duy không tô hồng nghề mình, cũng chẳng than vãn. Anh kể bằng giọng của người từng trải, người đã đi qua những cú ""rơi tự do"" giữa không trung và cả những cạm bẫy ngọt ngào của nghề. Ở mỗi trang viết, ta bắt gặp tinh thần sống tích cực, rằng dù đôi giày có mòn thì trái tim vẫn còn ấm và tình yêu nghề vẫn vẹn nguyên.
Với các bạn trẻ đang ấp ủ giấc mơ theo nghề du lịch,Đôi giày mòn gótcó thể xem như một cẩm nang hướng nghiệp sinh động, giúp hiểu hơn về niềm vui, thử thách và giá trị của nghề.
Còn đối với những ai đang đứng trước ngã rẽ cuộc đời, cuốn sách này như một lời nhắc rằng đừng sợ hãi, hãy cứ bước theo hướng mà bạn thấy trái tim ấm áp và có ước mơ cháy bỏng, hãy cứ đi bằng tất cả sự tử tế và đam mê của mình, thành công sẽ gõ cửa."
https://thanhnien.vn/dien-vien-mua-do-dan-anh-trai-bieu-dien-2025-k-vietnam-pop-up-festa-in-dalat-185251105212014673.htm,"Diễn viên 'Mưa đỏ', dàn 'anh trai' biểu diễn '2025 K- Vietnam Pop Up Festa In Dalat'","2025 K-Vietnam Pop Up Festa In Dalatdiễn ra tại quảng trường Lâm Viên, với sự góp mặt của nhiều nghệ sĩ nổi tiếng,  nhằm quảng bá hình ảnh, giao lưu văn hóa nghệ thuật Hàn – Việt và kết nối doanh nghiệp Hàn Quốc – Việt Nam.","Từ ngày 7-9.11 tạiquảng trường Lâm Viên(P.Xuân Hương, Đà Lạt, Lâm Đồng) diễn ra chương trình giao lưu văn hóa, âm nhạc, ẩm thực Hàn – Việt2025 K- Vietnam Pop Up Festa In Dalat, với sự góp mặt của nhiều nghệ sĩ nổi tiếng. Đây đồng thời là cơ hội kết nối doanh nghiệp 2 nước.
Chương trình giao lưu văn hóa, âm nhạc, ẩm thực Hàn – Việt2025 K-Vietnam Pop Up Festa In Dalatsẽ diễn ra tại quảng trường Lâm Viên
ẢNH: L.V
Cụ thể, từ 9 giờ đến 22 giờ mỗi ngày sẽ diễn ra nhiều hoạt động nhưgiao lưu nghệ thuật, biểu diễn âm nhạc,biểu diễn thời trangHanbok và áo dài, thi ẩm thực truyền thống Hàn – Việt.
2025 K- Vietnam Pop Up Festa In Dalatcó sự góp mặt của nhiều nghệ sĩ như: Neko Lê (Gai), Doãn Hiếu, Khôi Vũ, Jey B (Anh trai say hi), Lý Tuấn Kiệt, nhóm Tây Nguyên, Ngô Trúc Linh, Huy Tít (vai Tấn trongMưa đỏ), Phạm Việt Thắng, Hana Cẩm Tiên, nhóm Nam tộc… Song song đó, các nghệ sĩ Hàn Quốc biểu diễn nhạc cụ truyền thống K-Nanta show, dân gian đương đại (fusion), múa ba lê trích đoạn vởKẹp hạt dẻ, vở múaVũ điệu ánh trăng… cùng tiết mục DJ sôi động đến từ nhóm Kimchifactori homies.
Ban tổ chức kỳ vọng sẽ thu hút khoảng 45.000 khán giả đến với2025 K- Vietnam Pop Up Festa In Dalat
ẢNH: L.V
Đại diện đơn vị tổ chức, Công ty TNHH Da Hae International (DHI GROUP), cho biết2025 K- Vietnam Pop Up Festa In Dalatnhằm thúc đẩy quan hệ hữu nghị, giao lưu nghệ thuật và hợp tác thương mại giữa Hàn Quốc – Việt Nam. Ban tổ chức kỳ vọng sẽ thu hút khoảng 45.000 khán giả đến với các chương trình nghệ thuật, giao lưu văn hóa Hàn -Việt lần này."
https://thanhnien.vn/phat-mien-phi-30000-ve-moi-concert-quang-ninh-dat-mo-anh-hung-185251105163700644.htm,Phát miễn phí 30.000 vé mời concert ‘Quảng Ninh - Đất mỏ anh hùng’,"Sau thành công của Concert Hạ Long 2025, Quảng Ninh tiếp tục tổ chức đại nhạc hội 'Quảng Ninh - Đất mỏ anh hùng"" với quy mô 30.000 khán giả, phát miễn phí toàn bộ vé mời để tri ân người thợ mỏ.","Tiếp nối hiệu ứng ấn tượng từ Concert Hạ Long 2025 cuối tháng 10 vừa qua, tỉnh Quảng Ninh sẽ tổ chức đại nhạc hội ""Quảng Ninh - Đất mỏ anh hùng"" vào tối 12.11.2025 tại Quảng trường 30.10 (TP.Hạ Long). Chương trình được đầu tư công phu, dự kiến đón 30.000 khán giả, với toàn bộ vé mời được phát miễn phí để phục vụ người dân và du khách.

Concert kéo dài 120 phút, được dàn dựng theo 3 chương nghệ thuật xuyên suốt và liền mạch cảm xúc:
Chương 1:Từ lòng đất - Ngọn lửa niềm tin
Chương 2:Kỷ luật - Đồng tâm: Mạch nguồn sức mạnh
Chương 3:Quảng Ninh - Khát vọng vươn mình trong kỷ nguyên mới
Chương trình là sự kết hợp sáng tạo giữa âm nhạc, xiếc, phóng sự và trình diễn sân khấu hiện đại, với sự góp mặt của dàn nghệ sĩ hàng đầu Việt Nam như NSND Quang Thọ, Trọng Tấn, Hồ Ngọc Hà, Đen Vâu, Hoàng Thùy Linh, Bích Phương, Tóc Tiên, Trúc Nhân, (S)Trong Trọng Hiếu, Quang Hùng MasterD, Ryhder, Violist Trần Quang Duy, nhóm Oplus, cùng Liên đoàn Xiếc Việt Nam.
Theo đại diện Sở Văn hóa, Thể thao và Du lịch Quảng Ninh, concert không chỉ là món quà tri ân người thợ mỏ mà còn là sản phẩm văn hóa du lịch đặc trưng, góp phần định vị thương hiệu ""Quảng Ninh - Vùng đất di sản, năng động và sáng tạo"", đồng thời thúc đẩy kinh tế đêm và công nghiệp văn hóa phát triển.
Với quy mô và chất lượng được nâng tầm, Concert ""Quảng Ninh - Đất mỏ anh hùng"" hứa hẹn sẽ trở thành điểm nhấn văn hóa cuối năm 2025, mang đến không khí tự hào, sôi động và tràn đầy cảm xúc cho vùng đất mỏ anh hùng."
https://thanhnien.vn/thuong-nho-nhung-ngay-o-paris-185251017214509533.htm,Thương nhớ ‘Những ngày ở Paris’,"Được mệnh danh là kinh đô ánh sáng, kinh đô thời trang nhưng thủ đô Paris (Pháp) trong tác phẩm mới của nhà văn Nguyễn Hoài Nam (hội viên Hội Nhà văn VN) không hiện lên với các công trình kiến trúc cổ kính, ga tàu điện sôi động mà đó chỉ là bối cảnh cho những hồi ức thương nhớ trải đầy cung bậc cảm xúc…","Nhờ theo học nghề y giỏi, bác sĩ -nhà vănNguyễn Hoài Nam có cơ duyên đến Pháp tu nghiệp. May mắn mỉm cười nên nhiều người bạn còn trêu chọc ông như ""trúng số 3 đời và tu 4 kiếp mới được"". Sân bay Charles de Gaulle đón tác giả lần đầu tiên đến Pháp trong mùa đông gió lạnh, bầu trời u ám: ""Mưa phùn bay lất phất đi kèm gió lạnh cuối đông, trông thật ảm đạm"". Tưởng sẽ rất buồn nhưng những ngày sống tha hương, tình người nơi đất khách đã giúp ông luôn nhận lại sự ấm áp xoa dịu rét mướt.


Sách Những ngày ở Paris (NXB Hội Nhà văn ấn hành) của nhà văn Nguyễn Hoài Nam
Ảnh: Q.TRÂN
Tác giả kể: ""Khi tới Paris, tôi được GS Jean Michel Cormier - một cây đại thụ của ngành phẫu thuật mạch máu châu Âu rất yêu quý VN tiếp nhận làm học trò"". Ông còn may mắn gặp thêm thầy Pierre Desoutter cùng bà Parteney, mà sự chân tình của họ đã khiến nhà văn dành rất nhiều tình cảm. Câu chuyện về ""bà Parteney ấm áp"" cũng được nhà văn viết rất cảm động: ""Bà Parteney gọi cậu y tá mang đồ và chỉ phòng ở của tôi trong khu nhà học viên. Nơi ở khá đẹp, nằm ngay trên đỉnh đồi, xung quanh là những hàng cây trụi lá, đang uốn éo trong gió lạnh những ngày cuối đông. Anh bạn y tá nói với tôi, sáng nay nhiệt độ khoảng 4 độ C. Lạnh mà không có tuyết rơi. Căn hộ bệnh viện dành cho tôi ngoài sức tưởng tượng với phòng ngủ có máy sưởi, một phòng bếp có phục vụ ăn uống, phòng tiếp khách. Giá cho thuê là 2.000 francs/tháng thế mà bệnh viện và giám đốc Parteney không lấy đồng nào. Sau này khi vợ tôi sang ở cùng, tôi đã đi làm nên xin đóng một nửa tiền nhà, bà cũng không đồng ý. Ơn này không biết bao giờ tôi mới trả nổi"".
Và ở Paris cổ kính, không chỉ có tình cảm ấm áp của người bản địa, nơi xứ lạ xa xôi, bác sĩ Nam còn gặp nhiều bà conViệt kiềunặng lòng với quê hương, luôn chia sẻ ngọt bùi cùng ông, như: Michel Trần Văn Quyền, chú Kh., bác sĩ Michel Trần… Đặc biệt là những bữa cơm ngon trưa thứ bảy hằng tuần đậm đà bản sắc của những người Việt xa xứ khiến ông không thể nào quên.
Nhận xét về cuốn sáchNhững ngày ở Paris, nhà phê bình Lê Thiếu Nhơn chia sẻ: ""Đã có không ít bác sĩ được sang Pháp tu nghiệp. Thế nhưng, không mấy ai tìm thấy ""ở Paris"" như Nguyễn Hoài Nam. Bởi lẽ, bác sĩ Nam vốn có sẵn một trái tim nghệ sĩ để tương tác mạnh mẽ với không gian sống ông may mắn dự phần. Cuốn sách thành nhiều đoạn ngắn, như những lát cắt run rủi trong ngổn ngang thương nhớ. Tác giả đối diện vớiParis, để cồn cào thương nhớ một vùng đất. Rồi đối diện với chính ông để bâng khuâng thương nhớ nhiều tri kỷ. Thong dongNhững ngày ở Paris và đọc thật chậm rãi, không khó để nhận ra một sự thật, rằng giàu có vật chất lắm khi chẳng đáng quý bằng sự giàu có về tinh thần, nếu con người biết nghĩ và biết tin nhau"".
Lang thangNhững ngày ở Pariscùng nhà văn Nguyễn Hoài Nam, ngoài nhiều câu chuyện độc đáo, lý thú qua góc nhìn đa sầu đa cảm của ông, độc giả thích khám phá thế giới còn tự mình trải nghiệm chuyến du ngoạn giữa lòngnước Phápthơ mộng, qua các áng văn nhẹ nhàng.
""Ở Paris, thích nhất là được dạo bước trên vỉa hè lót bằng đá thiên nhiên, trong những chiều đầu đông hay chớm thu về, với cái lạnh se se đang đua sức với làn gió hiu hiu thổi. Con đường dẫn lên đỉnh đồi từ sân Gage Metro rất đẹp với vỉa hè lót đá nhẵn thín với thời gian, những căn nhà của Pháp kiểu cổ điển, âm thầm nép sau hàng cây phong lá đỏ ối mỗi khi thay mùa""(Rảo bước trên khắp phố phường).
Tác giả Nguyễn Hoài Nam cũng dành khá nhiều trang viết về ẩm thực Pháp ""ngon khó cưỡng"", về thành phố Cannes - kinh đô của nghệ thuật thứ bảy… để rồi khi chia xa chỉ còn là những hồi ức ngổn ngang thương nhớ.
""Tạm biệt Paris hoa lệ. Sống mũi tôi cay rần, vài giọt nước mắt lăn dài trên má. Vợ tôi cũng khóc. Chúng tôi khóc vì những kỷ niệm êm đềm trong những năm tháng xa quê, khóc vì tấm thịnh tình của những người bạn. Máy bay cất cánh, tôi nhìn qua khung cửa sổ, ngoài trời đang mưa, phía dưới là cả thành phố Paris sáng rực một góc trời…"", nhà văn Nguyễn Hoài Nam rưng rưng.


"
