url,title,description,content
https://thanhnien.vn/tphcm-lam-gi-sau-cu-hich-thanh-pho-dien-anh-dau-tien-cua-dong-nam-a-185251109154921102.htm,TP.HCM làm gì sau cú hích 'thành phố điện ảnh' đầu tiên của Đông Nam Á?,"Sau khi được UNESCO vinh danh, TP.HCM có những kế hoạch để củng cố vị thế của một 'thành phố điện ảnh', trở thành điểm đến sáng tạo của điện ảnh khu vực.","TP.HCM là thành phố điện ảnh đầu tiên ở Đông Nam Á
ẢNH: HIFF
Cuối tháng 10 vừa qua,TP.HCMchính thức đượcUNESCOcông nhận là thành phố sáng tạo trong lĩnh vực điện ảnh. Đây là thành phố đầu tiên ở Việt Nam cũng nhưĐông Nam Áđược ghi danh ở lĩnh vực này.
Nhắc đến bước tiến kể trên, đại diện lãnh đạo Sở VH-TT TP.HCM chia sẻ vớiThanh Niên: ""Đây là dấu mốc có ý nghĩa đặc biệt, là niềm tự hào của không chỉ của riêng thành phố; góp phần khẳng định vị thế quốc tế và tiềm năng phát triển mạnh mẽ của ngành công nghiệp điện ảnh thành phố trong kỷ nguyên hội nhập toàn cầu. Bên cạnh đó, danh hiệu này còn cho thấy trách nhiệm lớn của thành phố trong việc thực hiện những mục tiêu phát triển điện ảnh nói riêng và văn hóa thành phố nói chung thông qua các cam kết khi xây dựng hồ sơ đăng ký gia nhập Mạng lưới các thành phố sáng tạo của UNESCO"".
TP.HCM là bối cảnh chính của phim hợp tác Việt - HànTay anh giữ một vì sao(2025)
ẢNH: ĐPCC
Theo đó, TP.HCM hướng đến tầm nhìn phát triển công nghệ, vốn văn hóa, sự sáng tạo và ý thức bảo vệ môi trường có thể hòa quyện để mang lại cuộc sống tốt đẹp hơn cho người dân.
""Trở thành thành phố điện ảnh sẽ hiện thực hóa, giúp thành phố thực hiện vai trò trung tâm kết nối Việt Nam với các làn sóng đổi mới của thế giới, nâng cao năng lực sáng tạo và đặt văn hóa vào trung tâm của chính sách phát triển, trên cơ sở lấy tiếp cận sáng tạo nghệ thuật làm yếu tố chính để nâng cao thị hiếu thẩm mỹ và nhận thức cho người dân phù hợp với bối cảnh của một đô thị thông minh. Cụ thể là sáng kiến 'Đưa điện ảnh vào môi trường học đường' hoặc dự án 'Sắc màu điện ảnh', qua đó giúp lan tỏa các giá trị truyền thống tương thích với bối cảnh đương đại và chuyển tải các giá trị phổ quát đến người dân nhằm khuyến khích các biểu đạt sáng tạo đa dạng và lan tỏa nếp sống văn hóa sáng tạo cũng như tạo cơ hội cho thế hệ trẻ trở thành những người dẫn dắt trong lĩnh vực sáng tạo"", phía Sở VH-TT TP.HCM thông tin.
Cùng với đó, TPHCM sẽ từng bước đầu tư phát triển điện ảnh như cơ sở hạ tầng, nhân lực, hình thành các không gian sáng tạo… được kỳ vọng sẽ tạo ra động lực thúc đẩy kinh tế sáng tạo mở ra hướng đi mới trong tương lai. Phát triển điện ảnh chính là thúc đẩy cá nhân, cộng đồng, tổ chức khai thác công cụ, phương tiện, nhằm thể hiện quan điểm, tiếng nói, gợi mở, đề xuất, kiến nghị nhằm khơi gợi, giải quyết các vấn đề kinh tế, xã hội, môi trường của thành phố hướng đến sự phát triển bền vững.
HIFF là điểm hẹn của nhiều nhà làm phim trong nước và quốc tế
ẢNH: HIFF
Ngoài ra, việc đưa Liên hoan phim quốc tế TP.HCM (HIFF) trở thành sự kiện điện ảnh thường niên, nỗ lực khẳng định vị thế, uy tín đối với điện ảnh trong nước và quốc tế cũng là mục tiêu quan trọng được cơ quan quản lý thành phố chú trọng.
Theo Sở VH-TT TP.HCM, HIFF sẽ trở lại vào năm 2026 với những mục tiêu xây dựng một liên hoan phim diễn ra thường xuyên của TP.HCM. ""HIFF luôn đặt mục tiêu là sự kiện điện ảnh chuyên nghiệp, quy tụ nhiều nhà làm phim, nghệ sĩ và khách mời từ nhiều quốc gia; là nơi trình chiếu các tác phẩm điện ảnh quốc tế và Việt Nam, đồng thời tổ chức các buổi hội thảo, giao lưu, và ký kết hợp tác giữa các đơn vị sản xuất phim trong nước và quốc tế. HIFF không chỉ mang lại cơ hội giao lưu văn hóa, trao đổi kinh nghiệm giữa các nhà làm phim mà còn giúp TP.HCM xây dựng mối quan hệ với các tổ chức điện ảnh quốc tế, thu hút sự quan tâm của giới chuyên môn và các nhà đầu tư nước ngoài"", cơ quan này nêu rõ.
TP.HCM đang là điểm đến tiềm năng được giới điện ảnh khu vực cũng như quốc tế nhắm đến
ẢNH: HẢI DUY
Với vị trí là một trong những trung tâm kinh tế, văn hoá, giáo dục, khoa học công nghệ, một siêu đô thị đông dân nhất cả nước, tốc độ phát triển nhanh, TPHCM đứng trước nhiều cơ hội, thách thức trong mục tiêu phát triển bền vững.
Đối với môn nghệ thuật thứ 7, một trong những thách thức hàng đầu là thiếu cơ sở hạ tầng hiện đại phục vụ cho phát triển công nghiệp điện ảnh như trường quay và hệ thống hậu kỳ tiêu chuẩn quốc tế, thủ tục hành chính còn rườm rà, khó khăn trong việc hình thành và phát triển các quỹ hỗ trợ văn hóa và tiếp cận thị trường quốc tế. Sự khác biệt về thị hiếu thẩm mỹ của khán giả cũng là một thách thức đáng kể. Ngoài ra, sự giao thoa giữa dòng chảy lịch sử dân tộc và hiện đại, giữa các thế hệ khi cùng hòa chung với nhịp phát triển của đất nước; sự phát triển như vũ bão của khoa học - công nghệ...
""Chúng tôi đánh giá những thực tế trên vừa là thách thức nhưng đồng thời cũng tạo ra cơ hội, yêu cầu các cơ quan quản lý, đội ngũ hoạt động trong ngành điện ảnh phải đổi mới tư duy, cách thức vận hành, đầu tư nhiều mặt để đáp ứng những mục tiêu của sự phát triển"",  Sở VH-TT TP.HCM phân tích.
Theo cơ quan này, TP.HCM đang xây dựng một hệ sinh thái hỗ trợ ngành điện ảnh, bao gồm dự kiến mô hình một Trung tâm hỗ trợ phát triển điện ảnh sẽ đóng vai trò là đầu mối tư vấn, hỗ trợ thủ tục hành chính và kết nối các nhà sản xuất, nhà đầu tư, cơ quan chức năng, giúp giảm thiểu thủ tục hành chính. Ngoài ra, thành phố sẽ xây dựng cơ sở dữ liệu ngành điện ảnh, giúp các nhà làm phim phát triển các dự án phù hợp với nhu cầu thị trường. Đồng thời, sẽ thiết lập quỹ tài chính hỗ trợ các mô hình phát triển điện ảnh; thúc đẩy sáng tạo và nâng cao hiệu quả công việc."
https://thanhnien.vn/cu-hich-cho-nganh-cong-nghiep-dien-anh-185251108232401844.htm,'Cú hích' cho ngành công nghiệp điện ảnh,UNESCO vừa ghi danh TP.HCM là thành phố sáng tạo toàn cầu trong lĩnh vực điện ảnh. Sự công nhận này được kỳ vọng sẽ là bệ phóng cho công nghiệp điện ảnh thành phố phát triển mạnh mẽ hơn trong tương lai.,"TP.HCM nằm trong danh sách 58 thành phố (TP) là thành viên mới của Mạng lưới TP sáng tạoUNESCO(UCCN), chính thức là TP điện ảnh đầu tiên của VN và Đông Nam Á. Bà Dương Cẩm Thúy, Chủ tịch Hội Điện ảnh TP.HCM, bày tỏ: ""Sự công nhận này cho chúng ta một điểm lợi rất lớn là thúc đẩy ngành điện ảnh TP phát triển hơn nữa, xứng đáng là trung tâm điện ảnh của cả nước, là TP điện ảnh. TP.HCM vẫn được coi là TP sáng tạo, năng động về nhiều mặt. Sáng tạo lĩnh vực điện ảnh thì chúng ta đã có nền tảng, chỉ cần vạch ra chiến lược, kế hoạch và thực hiện"".
Các buổi chiếu phim ngoài trời tại Công viên bờ sông Sài Gòn trong khuôn khổ Liên hoan phim quốc tế TP.HCM 2024 thu hút đông đảo người dân
ẢNH: TTXVN
Trong khi đó, diễn viên, nhà sản xuất Hồng Ánh tin rằng đây sẽ là cơ hội để TP.HCM có chiến lược phát triển rõ ràng hơn về đầu tư mạnh cho hạ tầng, đào tạo nhân lực, khuyến khích các dự án sáng tạo và mở rộng hợp tác quốc tế. ""Khi có một môi trường thuận lợi, phim Việt sẽ có thêm điều kiện để phát triển chuyên nghiệp hơn, còn khán giả sẽ được thưởng thức nhiều tác phẩm chất lượng, gần gũi với đời sống"", nữ diễn viên bày tỏ.
Trước khi được công nhận là TP điện ảnh, TP.HCM đã là trung tâm sản xuất và tiêu thụ điện ảnh hàng đầu cả nước. Số liệu từ Sở VH-TT TP.HCM cho thấy điện ảnh là khu vực đang quy tụ 935 doanh nghiệp với 9.294 lao động, tạo ra doanh thu 500 triệu USD/năm, đóng góp 0,43% GRDP. TP có lượng khán giả đông đảo bậc nhất cả nước cùng 10 hệ thống rạp, 52 cụm rạp, 295 phòng chiếu và 184 không gian sáng tạo là nơi thực hành nghệ thuật chuyên nghiệp. TP.HCM cũng là điểm hẹn của nhiều sự kiện phim ảnh mang tầm vóc quốc tế, nổi bật là Liên hoan phim quốc tế TP.HCM (HIFF).
Còn NSƯT Hạnh Thúy, Ủy viên Ban Chấp hành Hội Điện ảnh TP.HCM, đánh giá khi TP.HCM trở thành TP sáng tạo điện ảnh, chúng ta có thể kỳ vọng nhiều chuyển biến tích cực trên nhiều phương diện từ văn hóa, kinh tế đến du lịch và hình ảnh quốc tế. Nữ diễn viên - đạo diễn chia sẻ: ""Có thể đây là sự thúc đẩy phát triển ngành công nghiệp điện ảnh một cách thật sự hiệu quả và ấn tượng hơn nữa, bởi hiện tại TP.HCM là trung tâm sản xuất phim lớn nhất cả nước và là nơi tập trung hầu hết mọi dịch vụ tốt nhất trong sản xuất điện ảnh"".
Khán giả xem phim ngoài trời ở Công viên điện ảnh ngay bờ sông Thủ Thiêm, tại Liên hoan phim quốc tế TP.HCM 2024 (HIFF 2024)
ẢNH: HIFF
Nghệ sĩ Hạnh Thúy cũng phân tích việc TP.HCM được công nhận là TP sáng tạo điện ảnh mang đến rất nhiều lợi ích cho lao động trong ngành, bởi nhu cầu làm phim cao thì nhu cầu tuyển dụng càng cao, cơ hội việc làm cho nhân sự càng lớn, sự tiếp cận nguồn hỗ trợ sáng tạo sẽ phong phú hơn. Việc kêu gọi đầu tư, hợp tác quốc tế có sự bảo chứng của ""TP sáng tạo điện ảnh"" sẽ có giá trị, cơ hội cao hơn. ""Điều này mở ra nhiều cơ hội làm việc xuyên biên giới, các nhân sự điện ảnh có thể học hỏi công nghệ, quy trình sản xuất hiện đại từ các đối tác quốc tế để vừa tăng thu nhập, vừa nâng cao năng lực chuyên môn và sáng tạo từ những hợp tác này"", nghệ sĩ chia sẻ.
Ngoài những cơ hội, tín hiệu tích cực từ sự công nhận này, việc phát triển, củng cố vị thế của một ""TP điện ảnh"" cũng khiến TP.HCM đối mặt với không ít thách thức khi lĩnh vực này còn tồn tại nhiều hạn chế, khó khăn. Theo nghệ sĩ Hạnh Thúy, những khó khăn đó phải kể đến tình trạng thiếu cơ sở hạ tầng và kỹ thuật hiện đại, bởi số lượng trường quay, trung tâm hậu kỳ, kho dữ liệu phim đạt chuẩn quốc tế còn hạn chế, công nghệ sản xuất phim VN vẫn còn khoảng cách lớn với thế giới, nguồn lực tài chính vẫn còn mỏng, hạn chế về nguồn nhân lực chất lượng cao, sự cạnh tranh trong khu vực …
Phim MỹA Tourist’s Guide to Love(2023) có nhiều cảnh được quay tại TP.HCM
ẢNH: NETFLIX
Còn bà Dương Cẩm Thúy nhận định sự công nhận mà TP.HCM vừa đạt được đi kèm những trách nhiệm, cam kết và điện ảnh TP cần có kế hoạch, phát triển toàn diện.
Trên thực tế, phát triển công nghiệp điện ảnh đã và đang là một trong những nhiệm vụ quan trọng được TP.HCM chú trọng thực hiện. Nhằm tiếp nối mục tiêu phát triển ngành công nghiệp điện ảnh mà Chính phủ đã đề ra, UBND TP.HCM đã ban hành Đề án về chiến lược phát triển ngành công nghiệp văn hóa TP.HCM đến năm 2030, và ngành công nghiệp điện ảnh được xác định là một trong 8 ngành trọng tâm.
Tom Cross(giữa), nhà dựng phim gốc Việt đầu tiên đoạt giải Oscar, dự Liên hoan phim quốc tế TP.HCM 2024 (HIFF 2024)
ẢNH: HIFF
Theo Sở VH-TT TP.HCM, TP đặt văn hóa vào trọng tâm của sự phát triển, trong đó lĩnh vực điện ảnh sẽ hiện thực hóa tầm nhìn, giúp nâng cao vai trò trung tâm dẫn dắt kết nối VN với các làn sóng đổi mới của thế giới; thiết lập quan hệ hợp tác, thúc đẩy giao lưuvăn hóa, trao đổi năng lực sáng tạo hợp tác liên văn hóa với các thành viên UCCN. Bên cạnh đó, TP nỗ lực phát triển cơ sở hạ tầng làm phim chuyên nghiệp, cung cấp không gian cho việc sáng tạo điện ảnh; xây dựng nguồn nhân lực điện ảnh chuyên sâu; phát triển thương hiệu liên hoan phim thường niên xứng tầm quốc tế; tạo sự bình đẳng xã hội trong việc được tiếp cận, thụ hưởng và sáng tạo nghệ thuật…
Bà Nguyễn Thị Thanh Thúy, Phó giám đốc Sở VH-TT TP.HCM, gặp gỡ các nghệ sĩ, nhà làm phim trong nước và quốc tế tại sự kiện thuộc khuôn khổ Liên hoan phim Quốc tế TP.HCM lần thứ nhất
ẢNH: HIFF
Sở VH-TT đánh giá khi trở thành TP điện ảnh, TP.HCM sẽ trở thành nơi kết nối điện ảnh VN với quốc tế, đóng góp hiệu quả và có trách nhiệm vào sự phát triển chung của điện ảnh khu vực. Đây là động lực để TP triển khai hiệu quả các dự án phát triển điện ảnh chuyên nghiệp và hiện đại; tăng cường đào tạo và trao đổi chuyên gia, bổ sung thêm nguồn nhân lực chất lượng cao; tiếp tục các sự kiện về điện ảnh, đưa HIFF trở thành sự kiện điện ảnh thường niên, nỗ lực khẳng định vị thế, uy tín đối với điện ảnh trong nước và quốc tế.
TP.HCM là điểm hẹn của nhiều sự kiện phim ảnh quốc tế, thu hút sự tham gia của nhiều nhà làm phim tài năng trên thế giới
ẢNH: HIFF
Trở thành TP điện ảnh mở ra nhiều cơ hội để kết nối điện ảnh Việt với quốc tế, từ đó thực hiện mục tiêu quảng bá hình ảnh đất nước qua nghệ thuật thứ bảy. Tuy nhiên, để thực hiện hóa điều đó không đơn giản mà đòi hỏi có sự kết nối, phát triển đồng bộ, trong đó phải quan tâm đến nguồn nhân lực. Do đó, việc đẩy mạnh công tác đào tạo, tạo điều kiện để sinh viên các trường sân khấu có cơ hội thể hiện năng lực hay việc ươm mầm những tài năng trẻ là điều cần lưu tâm trong hành trình phát triển. ""Tôi cũng rất tâm đắc với định hướng đưa điện ảnh vào học đường. Khi các em nhỏ được làm quen với phim ảnh như một hình thức nghệ thuật và giáo dục, các em sẽ biết cảm, biết yêu và biết trân trọng giá trị của sáng tạo. Tôi nghĩ đó chính là nền tảng bền vững nhất cho tương lai điện ảnh TP.HCM"", diễn viên Hồng Ánh bày tỏ.
Tài tử Hứa Quang Hán(thứ hai từ phải qua)tại buổi họp báo ra mắt phim mới ở TP.HCM hồi tháng 9.2025

Chưa kể, thị trường điện ảnh hiện nay không chỉ là sự cạnh tranh khốc liệt giữa các dự án nội mà còn với các tác phẩmnước ngoài, trong khi làm phim là một ngành có sự rủi ro cao. Để thúc đẩy các nhà làm phim mạnh dạn thử sức, sáng tạo, người làm phim và nhà sản xuất mong muốn cơ quan quản lý cũng cần có những chính sách hỗ trợ, chẳng hạn như giảm thuế, tạo điều kiện vay vốn… Đồng thời, người làm trong ngành điện ảnh cũng cần có trách nhiệm trau dồi, hoàn thiện mình, đóng góp bằng những tác phẩm tốt để tạo nên một TP tương xứng với danh hiệu vừa đạt được."
https://thanhnien.vn/hoa-hau-va-thuong-hieu-thoi-trang-rieng-185251108195613234.htm,Hoa hậu và thương hiệu thời trang riêng,"Sau khi thành công trong vai trò người mẫu, nhiều hoa hậu tiếp tục bước sang con đường kinh doanh thời trang như Lương Thùy Linh, Khánh Vân, Ngọc Hân… Hiệu ứng truyền thông và sức ảnh hưởng từ danh hiệu hoa hậu vừa là ""bàn đạp"" vừa có thể khiến thương hiệu gặp bất lợi hơn ngay ở thời điểm khởi đầu.","Đầu tháng 8.2025,Hoa hậu Thế giớiVN 2019 Lương Thùy Linh cho ra mắt thương hiệu thời trang Lumie Concept hợp tác cùng những người bạn lâu năm. Khởi nghiệp ở tuổi 25, cô làm mẫu cho bộ sưu tập đầu tay gồm các mẫu trang phục trẻ trung làm từ vải thun tăm.
Với danh tiếng có sẵn, thương hiệu của nàng hậu thu hút sự chú ý lớn từ người hâm mộ, công chúng và truyền thông. Không chỉ dự sự kiện khai trương, các hoa - á hậu nổi tiếng như Đoàn Thiên Ân, Huỳnh Trần Ý Nhi, Phương Anh, Ngọc Thảo… còn làm KOL mặc thử và nhận xét (review) sản phẩm. Tuy nhiên, trái ngược với sự hào hứng ban đầu, công chúng nhanh chóng ""quay xe"" khi xem các buổilivestream. Bài đăng trên các mạng xã hội của thương hiệu nhận được nhiều bình luận không tích cực, từ mẫu mã thiết kế đến phom dáng đều bị đánh giá lỗi thời, kém chỉn chu nhưng lại có mức giá cao từ 1 - 2 triệu đồng. Lumie vừa bị đặt lên bàn cân so sánh với thương hiệu cùng phân khúc, vừa bị hoài nghi về khả năng thành công trong tương lai.
Ngọc Hân, Phương Nga, Đỗ Mỹ Linh cùng diện áo dài do Hoa hậu Ngọc Hân thiết kế trong đám hỏi của cặp đôi diễn viên Phương Nga và Bình An
ẢNH: NSCC
Trong làn ""sóng dữ"" từ mạng xã hội, Thùy Linh đưa ra phản hồi qua một video rằng cô trân trọng mọi ý kiến đóng góp và cho rằng ở lần đầu tiên nên không thể tránh khỏi thiếu sót. Cô hứa nỗ lực học hỏi và hoàn thiện sản phẩm tốt hơn. Sau khoảng 2 - 3 tuần ồn ào, các bài đăng mới của thương hiệu đều ""sạch sẽ"", không có bình luận trái chiều và cũng không có tương tác. Điều này phần nào cho thấy sự chú ý dành cho thương hiệu bắt đầu nguội.
Hoa hậu Khánh Vân mặc trang phục La Vani
ẢNH: NSCC
Hoa hậu Hoàn vũVN 2019 Khánh Vân là một trong số ít người đẹp có những bước đi bài bản trước khi phát triển thương hiệu La Vani vào giữa năm 2023. Cô hai lần hợp tác cùng NTK Brian Võ làm bộ sưu tập trình diễn trong cuộc thi Hoa hậu Hoàn Vũ VN; mời Hoa hậu Ngọc Châu cùng làm người mẫu cho bộ ảnh, tổ chức show thời trang ra mắt, có website bán hàng bài bản… Tuy nhiên, số lượng và mẫu trang phục của La Vani khá hạn chế, chủ yếu là đầm dự tiệc dáng ngắn có chi tiết đính kết giá bán trên 2 triệu đồng/sản phẩm. Gần đây, thương hiệu có thêm các mẫu váy giá ""mềm"" hơn, dưới 1 triệu đồng.
Hoa hậu Lương Thùy Linh làm người mẫu cho thương hiệu thời trang do cô sáng lập
ẢNH: NSCC
Trong khi đó, thương hiệu Corentin được Hoa hậu VN 2016 Đỗ Mỹ Linh ra mắt năm 2021 lại ghi dấu ấn với phong cách thanh lịch, trung tính và tối giản. Dù hoạt động theo mô hình online nhưng Corentin được đầu tư bài bản, đều đặn ra bộ sưu tập theo mùa.
Hoa hậu Lương Thùy Linh thử sức với thương hiệu thời trang Lumie Concept ở tuổi 25
ẢNH: NSCC
Người đẹp hiếm hoi gây được tiếng vang trong lĩnh vực thời trang là Hoa hậu VN 2010 Ngọc Hân. Khi giành vương miện Hoa hậu VN 2010, cô đang là sinh viên Trường ĐH Mỹ thuật công nghiệp và đã có kinh nghiệm làm người mẫu. ""Khi là một hoa hậu, những lợi thế để phát triển sự nghiệp thì ai cũng biết nhưng lợi thế cũng là bất lợi. Khi chưa có nhiều kinh nghiệm, những bộ sưu tập thời trang của tôi nhanh chóng được quan tâm nhưng cũng đầy ắp áp lực khen chê"", Ngọc Hân chia sẻ. Sau ba năm thử sức với trang phục ứng dụng, cô rẽ hướng sang làm thời trang áo dài từ năm 2016 và đến năm 2021 thì mở cửa hàng riêng tại Hà Nội. Là một trong những NTK áo dài trẻ nổi bật, cô không chỉ làm áo dài cưới hỏi cho những người bạn nổi tiếng như hoa hậu Đỗ Mỹ Linh, diễn viên Phương Nga, Phương Oanh… mà còn thường xuyên mang áo dài ra quốc tế qua các chương trình truyền hình, sự kiện văn hóa tại Dubai (UAE), Ả Rập Xê Út, Venezuela… Với lợi thế từ chuyên ngành mỹ thuật và hội họa, Hoa hậu Ngọc Hân khéo léo đưa tranh của các danh họa nổi tiếng vào tà áo dài, sử dụng kỹ thuật in vải, kỹ thuật thêu may thủ công… để tạo nét riêng cho sản phẩm thời trang mang tên mình."
