url,title,description,content
https://thanhnien.vn/van-phong-tu-dang-can-dong-vai-nhac-truong-lam-guong-mau-muc-185251018231024206.htm,"Văn phòng T.Ư Đảng cần đóng vai 'nhạc trưởng', làm gương mẫu mực","Chiều 18.10, tại Hà Nội, Văn phòng T.Ư Đảng tổ chức trọng thể lễ kỷ niệm 95 năm Ngày truyền thống Văn phòng T.Ư Đảng và văn phòng cấp ủy (18.10.1930 - 18.10.2025); đón nhận Huân chương Lao động hạng nhất và tuyên dương các điển hình tiên tiến giai đoạn 2020 - 2025.","Tổng Bí thư Tô Lâmdự và phát biểu tại lễ kỷ niệm. Cùng dự lễ kỷ niệm có nguyên Tổng Bí thư Nông Đức Mạnh; Ủy viên Bộ Chính trị, Thường trực Ban Bí thư Trần Cẩm Tú; nguyên Ủy viên Bộ Chính trị, nguyên Thường trực Ban Bí thư Phan Diễn; các ủy viên Bộ Chính trị, Bí thư T.Ư Đảng; nguyên Ủy viên Bộ Chính trị, nguyên Ủy viên T.Ư Đảng, lãnh đạo các ban đảng T.Ư, lãnh đạo, nguyên lãnh đạo các Văn phòng vàVăn phòng T.Ư Đảng.
Tổng Bí thư Tô Lâm trao Huân chương Lao động hạng nhất tặng Văn phòng T.Ư Đảng
ẢNH: TTXVN
Phát biểu tại lễ kỷ niệm, Tổng Bí thư Tô Lâm khẳng định, 95 năm qua, biết bao lượt cán bộ văn phòng cấp ủy đã hy sinh, chịu đựng gian khổ, giữ đúng nguyên tắc, giữ trọn kỷ luật, nhận phần khó về mình để công việc của Đảng thông suốt. Tổng Bí thư bày tỏ lòng biết ơn sâu sắc đối với những cán bộ hết lòng vì công việc, dám hy sinh lợi ích cá nhân vì lợi ích tập thể, vì cái chung; ghi nhận và tri ân cống hiến của các thế hệ đi trước...
Bước vàokỷ nguyên số, xã hội số,kinh tế số, Tổng Bí thư đề nghịVăn phòng T.Ư Đảnghành động theo 3 định hướng lớn: Sớm số hóa toàn diện vòng đời văn bản, hồ sơ công việc; chữ ký số - lịch số - giao việc số - báo cáo số; xây dựng kho dữ liệu chuẩn dùng chung, bảo đảm bảo mật - an toàn - bền vững. Chuẩn hóa quy trình theo nguyên tắc ""một lần nhập - dùng nhiều lần"", rút ngắn thời gian xử lý, truy xuất nhanh, chính xác; lấy mức độ hài lòng của cơ quan, của nhân dân là thước đo. Phát triển năng lực số cho đội ngũ cán bộ văn phòng về kỹ năng dữ liệu, an toàn thông tin, phân tích tổng hợp; kết hợp kỷ luật sắt với sáng tạo mềm để tham mưu ngắn gọn - đúng việc - đúng lúc - dễ thực thi.
Tổng Bí thư yêu cầu Văn phòng T.Ư Đảng thực hiện 6 nhiệm vụ: cần đóng vai ""nhạc trưởng"", làm gương mẫu mực cho toàn hệ thống văn phòng cấp ủy và văn phòng của cả hệ thống chính trị. Khi tham mưu chiến lược cho Ban Chấp hành T.Ư Đảng, Bộ Chính trị, Ban Bí thư cần nêu rõ vấn đề, nêu đúng phương án, nêu đủ nguồn lực, nêu kỹ lộ trình, nêu rõ trách nhiệm. Xây dựng chuẩn mực nghiệp vụ thống nhất từ T.Ư đến cơ sở: mẫu hóa hồ sơ, chuẩn hóa quy trình, đo lường thời gian - chất lượng - chi phí; đào tạo, bồi dưỡng thường xuyên đối với cán bộ. Xây dựng văn hóa chất lượng của công việc, của văn bản. Xây dựng văn hóa nêu gương: lãnh đạo, quản lý nói đi đôi với làm, chấp hành kỷ luật thông tin, giữ bí mật tài liệu, tôn trọng sự thật; đề cao tinh thần hợp tác liên thông giữa các cơ quan tham mưu của Đảng và Nhà nước. Trong thời gian tới Văn phòng T.Ư Đảng cần chuẩn bị thật tốt công tác phục vụ Đại hội Đại biểu toàn quốc lần thứ XIV của Đảng.
Tại lễ kỷ niệm, thay mặt lãnh đạo Đảng, Nhà nước, Tổng Bí thư Tô Lâm đã trao tặngHuân chương Lao động hạng nhấtcho Văn phòng T.Ư Đảng đã có thành tích đặc biệt xuất sắc trong công tác tham mưu chiến lược phục vụ Bộ Chính trị, Ban Bí thư trong tổ chức điều hành công việc lãnh đạo của Đảng và có thành tích to lớn trong sự phát triển KT-XH của đất nước.
Thường trực Ban Bí thư Trần Cẩm Tú đã trao tặng Bằng khen của Thủ tướng Chính phủ cho tập thể, cá nhân Văn phòng T.Ư Đảng ghi nhận thành tích xuất sắc trong các hoạt động kỷ niệm 50 năm ngày đất nước thống nhất.
* Cùng ngày, Tổng cụcTình báoquốc phòng (Tổng cục II), Bộ Quốc phòng đã tổ chức trọng thể Lễ kỷ niệm 80 năm Ngày truyền thống Tình báo quốc phòng VN (25.10.1945 - 25.10.2025) và đón nhận Huân chương Hồ Chí Minh.
Tổng Bí thư Tô Lâm, Bí thư Quân ủy T.Ư, dự và phát biểu chỉ đạo tại lễ kỷ niệm. Chủ tịch nước Lương Cường; Thủ tướng Chính phủ Phạm Minh Chính, các ban, bộ, ngành T.Ư, địa phương đã gửi lẵng hoa chúc mừng."
https://thanhnien.vn/thu-tuong-tranh-tinh-trang-trong-cuoc-hop-rat-nong-nhung-hop-xong-lai-nguoi-185251018144109928.htm,"Thủ tướng: Tránh tình trạng ‘trong cuộc họp rất nóng, nhưng họp xong lại nguội’","Nhấn mạnh quan điểm cán bộ vô cảm, chậm trễ phải thay thế,Thủ tướng Phạm Minh Chínhcũng yêu cầu tránh tình trạng 'trong cuộc họp thì nóng, nhưng họp xong lại nguội'.","Sáng 18.10, Thủ tướng Phạm Minh Chính chủ trì hội nghị toàn quốc thúc đẩy đầu tư công năm 2025. Đây là hội nghị lần thứ 4 trong năm về đầu tư công.
Báo cáo tại hội nghị cho hay, có 9 bộ, cơ quan và 16 địa phương tỷ lệ giải ngân trên bình quân chung cả nước.
Một số bộ, cơ quan, địa phương có tỷ lệ giải ngân cao như Ngân hàng Chính sách xã hội (đạt 96%) Văn phòng T.Ư Đảng (90%), Bộ Quốc phòng (khoảng 60%), Hà Tĩnh (100%), Thanh Hóa (92%), Ninh Bình (91%), Lào Cai (81%). 6 địa phương đạt tăng trưởng 2 con số đều có tỷ lệ giải ngân cao, trên trung bình cả nước.
Thủ tướng Phạm Minh Chính chủ trì hội nghị sáng 18.10
ẢNH: NHẬT BẮC
Kết luận hội nghị, Thủ tướng Phạm Minh Chính chỉ rõ, còn 20 bộ, cơ quan và 26 địa phương chưa phân bổ hết kế hoạch vốn được giao với số vốn 26.200 tỉ đồng.
Đến hết ngày 16.10, còn 29 bộ, cơ quan và 18 địa phương có tỷ lệ giải ngân dưới mức trung bình cả nước.
Thủ tướng phê bình nghiêm khắc và yêu cầu các bộ, cơ quan và địa phương này làm rõ trách nhiệm tập thể, cá nhân liên quan, nghiêm túc rút kinh nghiệm, đề ra giải pháp mạnh mẽ để thúc đẩy giải ngân đến cuối năm.
Chỉ rõ thực trạng, người đứng đầu Chính phủ nhấn mạnh còn tình trạng chậm trễ trong công tác bồi thường, giải phóng mặt bằng, tái định cư… Nguồn cung nguyên vật liệu chưa được giải quyết tốt, giá nguyên vật liệu tăng so với thời điểm mở thầu làm tăng chi phí.
Công tác đấu thầu và thanh tra, kiểm tra còn nhiều hạn chế; xử lý các vi phạm, chậm trễ trong quản lý, sử dụng vốn đầu tư công chưa kịp thời, nghiêm minh.
Một số địa phương còn chưa chủ động, chưa quyết liệt, còn lúng túng trong chỉ đạo, điều hành, tinh thần trách nhiệm chưa cao, thậm chí còn tâm lý né tránh, đùn đẩy trách nhiệm, chờ đợi trong quá trình sắp xếp, tổ chức bộ máy…
Việc thực hiện các kết luận, chỉ đạo của Chính phủ, Thường trực Chính phủ, Thủ tướng có lúc, có nơi còn chậm và chưa nghiêm; công tác truyền thông một số nơi chưa hiệu quả, thiếu chủ động, không đủ để người dân đồng tình, ủng hộ…
""Phải xác định giải ngân vốn đầu tư công vừa là chức trách nhiệm vụ theo thẩm quyền được giao, vừa là lương tâm, đạo đức công vụ của người cán bộ"", Thủ tướng chia sẻ.
Nhiệm vụ, giải pháp sắp tới, Thủ tướng Phạm Minh Chính yêu cầu ""càng áp lực, càng phải nỗ lực""; thường xuyên rà soát, đôn đốc, kịp thời phát hiện và tháo gỡ các khó khăn, vướng mắc phát sinh của từng dự án, thúc đẩy các dự án trọng điểm mang tính ""xoay chuyển tình thế, thay đổi trạng thái"" phát triển của đất nước.
Theo đó, coi kết quả giải ngân là một trong những căn cứ quan trọng để đánh giá mức độ hoàn thành nhiệm vụ hằng năm của tổ chức, cá nhân (thực hiện đánh giá cán bộ theo Quyết định số 366 của Bộ Chính trị); tránh tình trạng ""trên nóng dưới lạnh"" hay ""trong cuộc họp thì rất nóng nhưng xong cuộc họp lại nguội"".
Thủ tướng yêu cầu, các bộ, cơ quan T.Ư và địa phương triển khai thực hiện nghiêm túc các nghị quyết Chính phủ, chỉ thị, công điện của Thủ tướng Chính phủ và các văn bản chỉ đạo của lãnh đạo Chính phủ về đôn đốc phân bổ, giải ngân vốn đầu tư công năm 2025 - quyết tâm giải ngân đạt 100% kế hoạch giao.
Khẩn trương phân bổ chi tiết toàn bộ kế hoạch đầu tư công năm 2025, đặc biệt là kế hoạch vốn được giao từ nguồn tăng thu ngân sách T.Ư năm 2024.
Khẩn trương rà soát, đánh giá tình hình thực hiện giải ngân đối với từng dự án; phân loại dự án theo mức độ giải ngân (tốt, chậm, không có khả năng giải ngân…); từ đó xây dựng tiến độ giải ngân cụ thể theo từng tuần, tháng, quý và có giải pháp cụ thể, phù hợp, thúc đẩy giải ngân đạt mục tiêu đề ra.
Thường xuyên rà soát, kịp thời điều chỉnh vốn từ dự án giải ngân chậm, hoặc không có khả năng giải ngân sang các dự án có khả năng giải ngân tốt và có nhu cầu bổ sung vốn. ""Một đồng không tiêu được cũng phải phân bổ cho nơi khác"", Thủ tướng nói."
https://thanhnien.vn/dua-quan-he-viet-anh-sang-giai-doan-phat-trien-moi-185251017222236613.htm,Đưa quan hệ Việt - Anh sang giai đoạn phát triển mới,"Tổng Bí thư Tô Lâm khẳng định Đảng, Nhà nước Việt Nam luôn coi trọng và dành sự quan tâm đặc biệt đối với việc tăng cường hơn nữa, đưa quan hệ Đối tác chiến lược Việt - Anh sang giai đoạn phát triển mới, đáp ứng kỳ vọng của nhân dân hai nước.","Chiều 17.10, tại Trụ sở T.Ư Đảng, Tổng Bí thư Tô Lâm tiếp Đại sứ Anh tại VN Iain Frew.
Tại cuộc tiếp,Tổng Bí thư Tô Lâmbày tỏ vui mừng về những bước phát triển tốt đẹp của quan hệ song phương trong thời gian vừa qua; khẳng định quan hệ song phương đã phát triển thực chất và hiệu quả trên tất cả các lĩnh vực, tương xứng với tầm mức quan hệĐối tác chiến lượcViệt - Anh; đánh giá cao vai trò của đại sứ, góp phần quan trọng vào các thành tựu hợp tác song phương.
Tổng Bí thư Tô Lâm tiếp Đại sứ Iain Frew
Ảnh: TTXVN

Bày tỏ hài lòng trước những kết quả tích cực của hợp tác giữa hai nước, Tổng Bí thư Tô Lâm đánh giá quan hệ hai nước còn rất nhiều tiềm năng phát triển, đặc biệt trong các lĩnh vực quốc phòng - an ninh, tài chính - tiền tệ, giáo dục - đào tạo, khoa học - công nghệ, lao động, chuyển đổi năng lượng, ứng phó biến đổi khí hậu, đặc biệt là văn hóa, thể thao và giao lưu nhân dân đã đi trước mở đường cho hợp tác trong các lĩnh vực khác.
Tổng Bí thư Tô Lâm khẳng định Đảng, Nhà nước VN luôn coi trọng và dành sự quan tâm đặc biệt đối với việc tăng cường hơn nữa, đưa quan hệ Đối tác chiến lược Việt - Anh sang giai đoạn phát triển mới, đáp ứng kỳ vọng của nhân dân hai nước, vìhòa bình, hợp tác và phát triển ở khu vực và thế giới.
Hai bên cũng nhấn mạnh tầm quan trọng của trụ cột hợp tác kinh tế, thương mại và đầu tư. Hiện Anh là đối tác thương mại quan trọng của VN tại châu Âu và là nhà đầu tư đứng thứ 15/152 nước và vùng lãnh thổ có đầu tư tại VN, VN là đối tác thương mại lớn thứ 2 của Anh trong ASEAN.
Đại sứ Anh Iain Frew cảm ơn Tổng Bí thư Tô Lâm đã dành thời gian tiếp; bày tỏ vui mừng về sự phát triển tốt đẹp của quan hệ song phương, nhất là trong bối cảnh hai nước kỷ niệm 15 năm thiết lập quan hệ Đối tác chiến lược; khẳng định Anh coi trọng phát triển quan hệ Đối tác chiến lược với VN, coi VN là một trong những đối tác quan trọng nhất của Anh tại khu vực. Đại sứ Iain Frew bày tỏ tin tưởng các hoạt động trao đổi đoàn cấp cao giữa hai nước trong thời gian tới sẽ tạo động lực mạnh mẽ, đưahợp tác song phươnglên tầm cao mới, nhất là trong các lĩnh vực quốc phòng - an ninh, khoa học - công nghệ, đổi mới sáng tạo, phát triển trung tâm tài chính quốc tế, tăng trưởng xanh, phát triển bền vững, du lịch và giao lưu nhân dân.
Hai bên khẳng định sẽ tiếp tục phối hợp chặt chẽ trong hợp tác song phương và trên các diễn đàn đa phương, đặc biệt tại Liên Hiệp Quốc; cùng thúc đẩy hòa bình, ổn định, an ninh và hợp tác tại khu vực; đưa quan hệ Đối tác chiến lược đi vào chiều sâu, hiệu quả, phù hợp với lợi ích của hai nước."
https://thanhnien.vn/giam-doc-so-tai-chinh-ha-noi-lam-chu-nhiem-uy-ban-kiem-tra-thanh-uy-18525101709092496.htm,Giám đốc Sở Tài chính Hà Nội làm Chủ nhiệm Ủy ban Kiểm tra Thành ủy,"Ông Nguyễn Xuân Lưu, Giám đốc Sở Tài chính Hà Nội, đã được bầu làm Chủ nhiệm Ủy ban Kiểm tra Thành ủy Hà Nội nhiệm kỳ 2025 - 2030.","Sáng 17.10, Đại hội đại biểuĐảng bộ TP.Hà Nộilần thứ XVIII, nhiệm kỳ 2025 - 2030 tiến hành ngày làm việc chính thức thứ hai.
Ông Nguyễn Xuân Lưu
ẢNH: VIẾT THÀNH
Mở đầu phiên làm việc, thay mặt Đoàn chủ tịch, Phó bí thư Thành ủy khóa XVII, Chủ tịch UBND TP.Hà Nội Trần Sỹ Thanh đã báo cáo Đại hội kết quả Hội nghị lần thứ nhất Ban Chấp hành Đảng bộ thành phố khóa XVIII.
Theo đó, chiều 16.10, Đại hội đã bầu Ban Chấp hành Đảng bộ thành phố khóa XVIII gồm 75 người. Tại Hội nghị lần thứ nhất diễn ra cùng ngày, Ban Chấp hành Đảng bộ thành phố khóa XVIII đã bầu 17 Ủy viên Ban Thường vụ Thành ủy Hà Nội khóa XVIII.
Bà Bùi Thị Minh Hoài, Bí thư Thành ủy Hà Nội khóa XVII được tín nhiệm bầu giữ chức Bí thư Thành ủy Hà Nội khóa XVIII, nhiệm kỳ 2025 - 2030.
4 Phó bí thư Thành ủy Hà Nội khóa XVIII, gồm các ông, bà: Trần Sỹ Thanh, Nguyễn Văn Phong, Phùng Thị Hồng Hà, Nguyễn Trọng Đông.
Ban Chấp hành Đảng bộ TP.Hà Nội khóa XVIII cũng đã bầu Ủy ban Kiểm tra Thành ủy khóa XVIII gồm có 12 người. Trong đó, ông Nguyễn Xuân Lưu, Ủy viên Ban Thường vụ Thành ủy Hà Nội khóa XVIII, Giám đốc Sở Tài chính, được tín nhiệm bầu giữ chức Chủ nhiệm Ủy ban Kiểm tra Thành ủy Hà Nội khóa XVIII.
Trước đó, ngày 16.10, ông Hoàng Trọng Quyết (sinh năm 1964), Chủ nhiệm Ủy ban Kiểm tra Thành ủy Hà Nội khóa XVII, không tái cử Ban Chấp hành Đảng bộ TP.Hà Nội khóa XVIII, do quy định về độ tuổi.
Tân Chủ nhiệm Ủy ban Kiểm tra Thành ủy Hà Nội Nguyễn Xuân Lưu sinh năm 1969. Trước đó, ông từng là Giám đốc Sở Tài chính, Bí thư Quận ủy, Chủ tịch UBND Q.Thanh Xuân."
https://thanhnien.vn/danh-sach-ban-thuong-vu-thanh-uy-ha-noi-nhiem-ky-2025-2030-18525101708301195.htm,Danh sách Ban Thường vụ Thành ủy Hà Nội nhiệm kỳ 2025 - 2030,"Sau khi bầu 75 người vào Ban Chấp hành Đảng bộ TP.Hà Nội khóa XVIII, nhiệm kỳ 2025 - 2030, Ban Chấp hành Đảng bộ TP.Hà Nội khóa XVIII, nhiệm kỳ 2025 - 2030 đã bầu Ban Thường vụ Thành ủy khóa XVIII.","Danh sách Ban Thường vụ Thành ủy TP.Hà Nộikhóa XVIII gồm 17 người.
Quang cảnh đại hội
ẢNH: KHẮC HIẾU
Danh sách cụ thể như sau:
1. Bà Bùi Thị Minh Hoài, Ủy viên Bộ Chính trị, Bí thư Thành ủy Hà Nội khóa XVII, Trưởng đoàn đại biểu Quốc hội TP.Hà Nội khóa XV
2. Ông Trần Sỹ Thanh, Ủy viên Trung ương Đảng, Phó bí thư Thành ủy khóa XVII, Chủ tịch UBND TP.Hà Nội, đại biểu Quốc hội khóa XV
3. Ông Nguyễn Văn Phong, Phó bí thư thường trực Thành ủy Hà Nội khóa XVII
4. Bà Phùng Thị Hồng Hà, Phó bí thư Thành ủy khóa XVII, Phó chủ tịch thường trực HĐND TP.Hà Nội
5. Ông Nguyễn Trọng Đông, Phó bí thư Thành ủy khóa XVII, Phó chủ tịch UBND TP.Hà Nội
6. Ông Hà Minh Hải, Trưởng ban Tổ chức Thành ủy Hà Nội khóa XVII, Phó bí thư thường trực Đảng ủy các cơ quan Đảng TP.Hà Nội
7. Ông Nguyễn Doãn Toản, Trưởng ban Tuyên giáo và Dân vận Thành ủy Hà Nội khóa XVII
8. Ông Đỗ Anh Tuấn, Trưởng ban Nội chính Thành ủy Hà Nội khóa XVII
9. Ông Dương Đức Tuấn, Phó chủ tịch UBND TP.Hà Nội
10. Bà Bùi Huyền Mai, Phó chủ tịch thường trực Ủy ban Mặt trận Tổ quốc Việt Nam TP.Hà Nội
11. Ông Nguyễn Thanh Tùng, Giám đốc Công an TP.Hà Nội
12. Ông Đào Văn Nhận, Tư lệnh Bộ Tư lệnh thủ đô Hà Nội
13. Ông Nguyễn Xuân Lưu, Chủ nhiệm Ủy ban Kiểm tra Thành ủy khóa XVII, Giám đốc Sở Tài chính TP.Hà Nội
14. Ông Nguyễn Mạnh Quyền, Phó chủ tịch UBND TP.Hà Nội
15. Ông Trần Đình Cảnh, Giám đốc Sở Nội vụ TP.Hà Nội
16. Ông Trần Thế Cương, Giám đốc Sở GD-ĐT TP.Hà Nội
17. Ông Vũ Đăng Định, Bí thư Đảng ủy, Chủ tịch HĐND P.Hoàn Kiếm
Trong 17 Ủy viên Ban Thường vụ Thành ủy Hà Nội khóa XVIII, 11 người là Ủy viên Ban Thường vụ Thành ủy Hà Nội khóa XVII tái cử và 6 người tham gia lần đầu.
6 người tham gia lần đầu gồm: thiếu tướng Đào Văn Nhận, Tư lệnh Bộ Tư lệnh thủ đô Hà Nội; ông Nguyễn Xuân Lưu, Chủ nhiệm Kiểm tra Thành ủy khóa XVII, Giám đốc Sở Tài chính TP.Hà Nội; ông Nguyễn Mạnh Quyền, Phó chủ tịch UBND TP.Hà Nội; ông Trần Đình Cảnh, Giám đốc Sở Nội vụ TP.Hà Nội; ông Trần Thế Cương, Giám đốc Sở GD-ĐT TP.Hà Nội; ông Vũ Đăng Định, Bí thư Đảng ủy, Chủ tịch HĐND P.Hoàn Kiếm.
Trong sáng nay 17.10, Ban Chấp hành Đảng bộ TP.Hà Nội khóa XVIII, nhiệm kỳ 2025 - 2030 sẽ ra mắt đại hội. Bí thư Thành ủy Hà Nội khóa XVIII sẽ có bài phát biểu trước đại hội."
https://thanhnien.vn/thuong-truc-ban-bi-thu-chuan-bi-tot-hoi-nghi-trung-uong-14-15-185251016204328158.htm,"Thường trực Ban Bí thư: Chuẩn bị tốt Hội nghị Trung ương 14, 15","Thường trực Ban Bí thư Trần Cẩm Tú đề nghị các cơ quan, đơn vị tập trung chuẩn bị tổ chức tốt kỳ họp thứ 10 Quốc hội khóa XV, các Hội nghị Trung ương 14, 15 khóa XIII và Đại hội XIV của Đảng, bầu cử Quốc hội và HĐND...","Ngày 16.10, tại trụ sở Trung ương Đảng,Thường trực Ban Bí thưTrần Cẩm Tú chủ trì giao ban công tác quý 3/2025 với các ban đảng, 4 văn phòng, các đảng ủy, cơ quan, đoàn thể Trung ương.
Thường trực Ban Bí thư Trần Cẩm Tú kết luận hội nghị
ẢNH: DANGCONGSAN.ORG.VN
Kết luận hội nghị, Thường trực Ban Bí thư Trần Cẩm Tú nêu rõ, công việc trong quý 4 và cả năm 2025 có khối lượng rất lớn, yêu cầu rất cao, đòi hỏi các cơ quan phải chủ động hơn, rà soát kỹ các nhiệm vụ, chỉ tiêu.
Ông Trần Cẩm Tú yêu cầu các cơ quan, đơn vị tập trung tiếp tục tham mưu, tổ chức thực hiện, hoàn thành toàn bộ chương trình làm việc năm 2025. Chuẩn bị chu đáo, bảo đảm chất lượng, tiến độ các đề án, nội dung trình Trung ương, Bộ Chính trị, Ban Bí thư, Quốc hội.
Cùng đó là chuẩn bị tổ chức tốt kỳ họp thứ 10, Quốc hội khóa XV; Hội nghị Trung ương 14, 15 khóa XIII và Đại hội XIV của Đảng; bầu cử Quốc hội và HĐND các cấp... Có biện pháp thúc đẩy việc hoàn thành và hoàn thành vượt mức các chỉ tiêu, nhiệm vụ; tiến hành tổng kết công tác năm trước ngày 25.12.
Thường trực Ban Bí thư cũng yêu cầu các cơ quan tham mưu tổng kết Nghị quyết 18 về sắp xếp, tinh gọn bộ máy và tổng kết việc tổ chức đại hội đảng bộ cấp tỉnh.
Tiếp tục triển khai thực hiện nghiêm các kết luận của Bộ Chính trị, Ban Bí thư về nhiệm vụ, giải pháp nâng cao hiệu quả hoạt động của hệ thống chính trị và bộ máy chính quyền địa phương 2 cấp. Đồng thời, đẩy mạnh cải cách thủ tục hành chính (khắc phục ngay việc địa phương hóa thủ tục hành chính), cắt giảm báo cáo, văn bản, hội họp không cần thiết. Tăng cường kiểm tra, hướng dẫn, tập huấn chuyên môn, nghiệp vụ; tiếp tục rà soát, tinh gọn bộ máy bên trong; xử lý tốt vấn đề tài chính, tài sản công.
Thường trực Ban Bí thư cũng yêu cầu đẩy mạnh giải ngân vốn đầu tư công, tháo gỡ khó khăn cho sản xuất kinh doanh, phấn đấu tăng trưởng đạt 8,3 - 8,5%; đẩy mạnh phát triển khoa học, công nghệ, đổi mới sáng tạo, chuyển đổi số trong tất cả các địa bàn, lĩnh vực.
Triển khai quyết liệt, hiệu quả các nghị quyết gần đây của Bộ Chính trị; tập trung tháo gỡ khó khăn, vướng mắc các dự án tồn đọng, kéo dài; chú trọng phát triển văn hóa, xã hội, bảo đảm an sinh xã hội, nâng cao đời sống nhân dân; tăng cường bảo vệ môi trường, phòng, chống thiên tai, ứng phó biến đổi khí hậu. Tập trung khắc phục nhanh hậu quả các cơn bão số 9, 10, 11 và mưa lũ sau bão; đặc biệt cần chăm lo, hỗ trợ sinh hoạt và sản xuất của đồng bào vùng chịu ảnh hưởng trực tiếp của bão, lũ vừa qua.
Ông Trần Cẩm Tú cũng đề nghị tiếp tục đẩy nhanh tiến độ kiểm tra, thanh tra, điều tra, xử lý các vụ án, vụ việc thuộc diện Ban Chỉ đạo T.Ư về phòng, chống tham nhũng, lãng phí, tiêu cực theo dõi, chỉ đạo; đặc biệt là các vụ án, vụ việc liên quan đến các dự án lãng phí, chậm tiến độ, gian lận thương mại, sản xuất hàng giả...
Nâng cao hiệu quả công tác tiếp công dân và giải quyết khiếu nại, tố cáo, kiến nghị, phản ánh; tập trung giải quyết dứt điểm các vụ việc khiếu kiện phức tạp, kéo dài chưa giải quyết xong... theo chỉ đạo của Tổng Bí thư."
