url,title,description,content
https://thanhnien.vn/dien-vien-dong-phat-to-nhu-lai-trong-tay-du-ky-qua-doi-185250804123639659.htm,Diễn viên đóng Phật Tổ Như Lai trong 'Tây Du Ký' qua đời,"Nghệ sĩ Chu Long Quảng - người đóng vai Phật Tổ Như Lai trong 'Tây Du Ký' bản 1986 vừa qua đời ở tuổi 86. Trên trang cá nhân, 'Tôn Ngộ Không' Lục Tiểu Linh Đồng đăng bài thương tiếc ông.","""Phật Tổ Như Lai"" Chu Long Quảng qua đời ở tuổi 86
ẢNH: SINA
TheoSina, ngày 3.8, gia đình của diễn viên kỳ cựu Chu Long Quảng đăng tải cáo phó, thông báo tin buồn đến bạn bè, đồng nghiệp, khán giả. Theo thông tin được đưa ra, nam diễn viên đóngPhật Tổ Như Laiqua đời hôm 2.8 tại Bắc Kinh (Trung Quốc), hưởng thọ 86 tuổi. Người thân mô tả ông Chu là người say mê nghệ thuật biểu diễn, sống khiêm tốn, gần gũi, trung thực, vị tha, lạc quan và đầy kiên trì. Hình tượng nghệ thuật mà ông tạo ra và cách ông đối nhân xử thế trong cuộc sống đời thường đã truyền tải nhiều điều tích cực đến mọi người xung quanh.
Trên trang cá nhân, ""Tôn Ngộ Không""Lục Tiểu Linh Đồngcũng chia sẻ về sự ra đi của tiền bối và gửi lời tiễn biệt ông. Ngôi sao kỳ cựu gọi Chu Long Quảng là bậc thầy về kịch, điện ảnh và truyền hình, cho biết ông qua đời do bệnh tật. Nam nghệ sĩ cũng bày tỏ: ""Ông mãi mãi là Phật Tổ Như Lai trong lòng khán giả, vô cùng thương tiếc và thương nhớ ông"".
Chu Long Quảng được đông đảo khán giả biết đến với hình tượng Phật Tổ Như Lai trongTây Du Ký
ẢNH: CHỤP MÀN HÌNH
Chu Long Quảng sinh năm 1939 tại tỉnh Thiểm Tây (Trung Quốc), ông hoạt động trong lĩnh vực kịch, phim ảnh từ cuối thập niên 1950 đầu 1960. Đầu những năm 1980, đoàn phimTây Du Kývà đạo diễnDương Khiếtchật vật tìm diễn viên cao lớn, đường bệ, phúc hậu để vào vai Phật Tổ Như Lai. Qua nhiều lần tuyển chọn, họ vẫn chưa tìm được người ưng ý. Lúc này, một người bạn trong nghề đã giới thiệu Chu Long Quảng cho đạo diễn Dương Khiết, từ hồ nghi, băn khoăn về diễn viên họ Chu, nhà làm phim bị thuyết phục sau khi thấy ông hóa trang thành Phật Tổ Như Lai.
Sau khi phim ra mắt, hình ảnh Phật Tổ Như Lai uy nghi, sống động của Chu Long Quảng ghi dấu ấn sâu sắc với khán giả và gắn liền với tên tuổi của nam diễn viên từ đó về sau. SauTây Du Kýcủa đạo diễn Dương Khiết, Chu Long Quảng còn hóa thân thành Phật Tổ Như Lai trong một vài dự án phim, chương trình giải trí khác.
Vai diễn gắn liền với tên tuổi của nghệ sĩ kỳ cựu
ẢNH: CHỤP MÀN HÌNH BAIDU
TheoBaidu, hình ảnh Phật Tổ Như Lai gắn liền với nghệ sĩ này đến mức có lần ông chưa kịp thay trang phục, xóa lớp hóa trang đã ra ngoài khiến nhiều người lầm tưởng ông là Đức Phật, quỳ bái trước mặt ông. Thậm chí, một số vật phẩm liên quan đến hình ảnh Phật Tổ Như Lai được bày bán ở nhiều nơi cũng được lấy từ hình ảnh của nam diễn viên họ Chu trongTây Du Ký.Chu Long Quảng từng bày tỏ được đóng vai Phật Tổ Như Lai và có được sự đón nhận tích cực từ công chúng là cơ hội, trải nghiệm quý báu trong cuộc đời mình.
NgoàiTây Du Ký, Chu Long Quảng còn ghi dấu ấn qua nhiều bộ phim:Địa đạo chiến, Võ Lâm ngoại truyện, Ngô Thừa Ân và Tây Du Ký, Tân Bạch nương tử truyền kỳ…
Về đời tư, Chu Long Quảng có cuộc tình đẹp với diễn viên Ngô Huệ Phương. Ông gặp vợ từ đầu thập niên 1960, yêu bà ngay từ cái nhìn đầu tiên. Đến năm 1965, họ có dịp quay chung phim rồi nên duyên sau đó. Đến năm 1967, hai nghệ sĩ kết hôn, lần lượt đón ba con gái. Những năm qua, Chu Long Quảng lui về nghỉ hưu, vui vầy bên con cháu, thỉnh thoảng xuất hiện tại một số sự kiện, chương trình giải trí.
"
https://thanhnien.vn/my-tam-don-tin-vui-185251107193128342.htm,Mỹ Tâm đón tin vui,"Hơn 2 thập niên hoạt động nghệ thuật, Mỹ Tâm tiếp tục ghi dấu ấn khi được tạp chí Tatler Asia vinh danh trong danh sách Tatler Most Influential 2025 - những gương mặt tạo nên sức ảnh hưởng mang tầm toàn cầu.","TheoTatler, danh sách Tatler Most Influential 2025 - những gương mặt tạo nên sức ảnh hưởng mang tầm toàn cầu lần đầu tiên được mở rộng phạm vi từ khu vực châu Á ra thế giới. Bảng xếp hạng nhằm tôn vinh những cá nhân tạo ragiá trị tích cựctrong lĩnh vực của họ, góp phần định hình xu hướng và lan tỏa tinh thần phát triển bền vững. Trong hơn 20 năm gắn bó với âm nhạc,Mỹ Tâmlà một trong những nghệ sĩ hiếm hoi duy trì được phong độ ổn định và sức hút bền bỉ.
Mỹ Tâm là một trong những gương mặt kiến tạo ảnh hưởng toàn cầu
Ảnh: FBNV
Cô gắn liền với thế hệ khán giả 8X, 9X qua những bản hit nhưCây đàn sinh viên, Ước gì, Họa mi tóc nâu...đồng thời vẫn giữ được vị trí đặc biệt trong lòng công chúng trẻ bằng tinh thần làm nghề nghiêm túc và sự nỗ lực làm mới bản thân. Không chỉ dừng lại ở vai trò ca sĩ, Mỹ Tâm còn tham gia sản xuất phim, tổ chức liveshow quy mô lớn và thực hiện nhiều dự ánthiện nguyệnlâu dài, trong đó có quỹ học bổng dành cho học sinh, sinh viên có hoàn cảnh khó khăn.
Hiện tại, Mỹ Tâm đang chuẩn bị cho live concertSee The Light, dự kiến diễn ra ngày 13.12 tại sân vận động quốc gia Mỹ Đình (Hà Nội). Theo ban tổ chức, hơn 20.000 vé mở bán sớm đã được bán hết chỉ trong vài giờ, cho thấy sức hút bền vững của nữ ca sĩ sau hơn 2 thập niên ca hát.
Việc được vinh danh trong danh sách Tatler Most Influential 2025 - những gương mặt tạo nên sức ảnh hưởng mang tầmtoàn cầu, không chỉ là một dấu mốc đáng nhớ trong hành trình làm nghệ thuật của Mỹ Tâm, mà còn phản ánh hình ảnh người nghệ sĩ Việt Nam hiện đại - luôn nỗ lực tạo ảnh hưởng tích cực, vượt qua giới hạn của âm nhạc để chạm đến những giá trị bền vững và lan tỏa."
https://thanhnien.vn/my-tam-noi-ve-man-trinh-dien-xuc-dong-nhat-trong-su-nghiep-cua-minh-tai-a80-185250902173354903.htm,Mỹ Tâm nói về 'màn trình diễn xúc động nhất trong sự nghiệp' của mình tại A80,"""Tâm nghĩ không thể so sánh màn trình diễn sáng nay với bất kỳ sô diễn nào của mình vì đó không phải là một sô diễn, và Tâm đã đứng đó không như một nghệ sĩ mà là một người con của đất nước…"", Mỹ Tâm xúc động nói về màn trình diễn đáng nhớ nhất trong sự nghiệp ca hát hơn 20 năm qua của cô tại A80.","Thức trắng đêm để chờ đến suất diễn ""đáng nhớ nhất trong cuộc đời mình"": hòa giọng cùng bàiTiến quân cavà bảnTuyên ngôn Độc lậptạiquảng trường Ba Đìnhsáng 2.9,Mỹ Tâmđã hào hứng riêng dành choThanh Niênmột cuộc trò chuyện đầy xúc động.
Chỉ 8 câu hát, nhưng màn trình diễn ""ngắn kỷ lục"" của Mỹ Tâm đã ngay lập tức gây viral mạnh trên mạng xã hội, khi được vang lên tại Lễ diễu binh, diễu hành kỷ niệm 80 năm Cách mạng Tháng Tám và Quốc khánh nước Cộng hoà Xã hội Chủ nghĩa Việt Nam 2.9, nơi hàng triệu con tim đang cùng hòa nhịp vào thời khắc linh thiêng của cả dân tộc. Sau những lời mở đầu quen thuộc của bàiTiến quân cađược cất lên bởi chất giọng con trẻ hồn nhiên:""Đoàn quân Việt Nam đi chung lòng cứu quốc…"", là giọng hát vang ngời lảnh lót mà điềm đạm ấm áp của Mỹ Tâm với những ca từ thiết tha mà giản dị của nhạc sĩ Phạm Hồng Biển trong ca khúcGiai điệu tự hào: ""Bài hát ấy vang trong tim con/Bài hát ấy làm con mạnh mẽ phi thường/Bài hát ấy khiến con rưng rưng/ Khi đứng dưới cờ đỏ sao vàng/Bài hát ấy con nghe hôm nay/Là điều tuyệt vời thiêng liêng của cả dân tộc/Cùng triệu người ngân vang câu ca/Nước non Việt Nam ta, vững bền…"".
Màn trình diễn truyền cảm được đánh giá: ""Chỉ có thể là Mỹ Tâm!"" tại A80
Ảnh: Thắng Đặng
Mỹ Tâm, giọng hát với sức bền hơn 20 năm, với ""nhan sắc không tuổi"" trong tà áo dài tinh khôi, mái tóc bối cao giản dị, phong thái bình thản, nét mặt cương nghị, ánh mắt ngời sáng tin yêu cùng chất giọng thanh thoát vút bay đã trở thành một biểu tượng đẹp của âm nhạc khi song hành cùng khoảnh khắc lịch sử và là một khoảnh khắc đẹp trong cuộc đời ca hát của ""người giữ thời gian"".
Còn nhớ, trong một cuộc trò chuyện cách đây chưa lâu trên Thanh Niên, chị từng nói: ""Lên cao nhìn được rộng lắm"". Còn hôm nay, liệu có là cảm giác ngược lại, khi đứng giữa sân khấu rộng thênh thang là quảng trường Ba Đình?
- Chính xác là một cảm giác ngược lại: Đứng ở nơi rộng, để thấy được tầm cao. Tầm cao của lý tưởng. Và lý tưởng không ở đâu xa, mà ngay trước mắt mình. Là hình ảnh lăng Bác thiêng liêng, đã trở thành biểu tượng ""hồn thiêng"" của dân tộc. Đó là nơi Tâm từng được vào lăng viếng Bác lần đầu vào năm 1998, và lần nào ra Hà Nội biểu diễn, Tâm cũng thường đi ngang qua nhưng không thể nghĩ lại có lần được hát trước lăng Bác, giữa quảng trường Ba Đình lịch sử, lại còn vào đúng thời khắc linh thiêng của cả dân tộc. Đó là khoảnh khắc mà Tâm nghĩ cái lý tưởng sống mà lâu nay Tâm lặng lẽ theo đuổi có lẽ đã hòa vào lý tưởng chung của dân tộc, khi những vị lãnh đạo cao nhất của đất nước hiện diện tại kỳ đài đến những người dân khắp mọi nẻo phố phường đang cùng lắng nghe tiếng vọng của lịch sử.
Cảm giác đặc biệt nhất là gì?
- Tâm và mọi người đứng xếp hàng chờ từ 2-3 giờ sáng, gần như trắng đêm thức đợi giây phút được tiến qua kỳ đài. Gần sáng, tiết trời cũng vẫn còn rất âm u, vậy mà sát giờ khai màn, nhất là khi chúng tôi được tiến vào lễ đài, trời bỗng dưng hửng nắng, thật là linh diệu!
""Sát giờ khai màn, trời bỗng dưng hửng nắng, thật là linh diệu!"", Mỹ Tâm cho biết
Ảnh: Thắng Đặng
Màn trình diễn ngắn nhất, có lẽ là ngắn kỷ lục trong cuộc đời ca hát của Tâm hồi giờ, nhưng là màn trình diễn xúc động nhất từ trước đến nay của Tâm, chắc chắn rồi; là kỷ niệm đẹp nhất, thiêng liêng nhất trong đời nghệ sĩ. Mà không, Tâm nghĩ không thể so sánh màn trình diễn sáng nay với bất kỳ sô diễn nào của mình vì đó không phải là một sô diễn, và Tâm đã đứng đó, ở đó không như một nghệ sĩ mà là một người con của đất nước. Tâm nghĩ mình thật may mắn. Cảm ơn Hà Nội đã dành cơ hội đó cho Mỹ Tâm!
Màn trình diễn ngắn nhất, lại cùng một bạn diễn ""nhí"" với chất giọng con trẻ hồn nhiên và ngay sau đó, là lời Bác đọc Tuyên ngôn Độc lập, chị đã ""cân giọng"" mình thế nào cho vừa vặn với không gian nó thuộc về?
- Tâm thực sự không nghĩ là mình đang hát, mà chỉ đơn giản, là cất lên một tiếng lòng, với tất cả sự chân thành tha thiết nhất. Đây là màn trình diễn mà Tâm gần như biết trước chắc chắn mình sẽ vô cùng xúc động. Dù lúc tập luyện, Tâm cũng đã không ít lần rưng rưng nhưng vào thời khắc linh thiêng đó, Tâm đã thực sự xúc động đến phát khóc. Thường Mỹ Tâm rất ít khi khóc, nhưng đây hiếm hoi là lần Tâm không thể ngăn được cảm xúc của mình.
Thật sự rất nể bàn tay sắp đặt khéo léo và tinh tế của đạo diễn âm nhạc khi đã tạo ra được một màn kết hợp gây xúc động và giàu ý nghĩa đến vậy. Hai chất giọng: một đại diện cho thế hệ mầm non của đất nước, một đại diện cho thế hệ trưởng thành, và sau đó là giọng đọcTuyên ngôn độc lậpđầy vang vọng của Bác. Cùng lúc, hiện tại - quá khứ - tương lai đồng hiện, giao hòa, kết nối, làm nên một khoảnh khắc thật khó quên.
Mỹ Tâm trình diễn ca khúcKhát vọng tuổi trẻtại sân vận động Mỹ Đình tối 1.9
Ảnh: Thắng Đặng
Trước đó, tối 1.9, trong chương trình 80 năm hành trình Độc lập – Tự do – Hạnh phúc, Mỹ Tâm cũng đã xuất hiện giản dị với mái tóc bối gọn cùng gương mặt trang điểm nhẹ nhàng, móng tay để mộc… ở một nơi mà chị hoàn toàn có đủ lý do để nổi bật?
- Tâm nghĩ mình làm vậy là đúng. Trong một buổi lễ trang trọng thì phục trang và tóc tai gọn gàng là phù hợp. Móng tay thì chắc chắn không thể sơn đỏ được rồi, làm vậy coi sao được! Tâm không cố để nổi bật, cũng không cố để hòa vào đám đông, vì Tâm luôn tin mỗi người sẽ có phong thái riêng của mình để tự biết thế nào là phù hợp và vừa vặn với nơi mình đang đứng. May mắn cho Tâm là đã có được những khuôn hình đẹp vào lúc Tâm cần đẹp nhất để xứng đáng với khoảnh khắc đẹp đó.
Lẽ thường, chúng ta có thể dễ dàng nói ra lời yêu thương với người mình yêu, nhưng yêu nước, thì dường như hơi ngại ngần vì sợ bị cho là ""hô khẩu hiệu"". Tự nhận mình thuộc ""khối yêu nước"", chị có từng có cảm giác ngần ngại đó?
- Chưa bao giờ. Sao lại phải ngại khi nói về lòng yêu nước? Vì nếu mình không yêu nước, mình đâu có thể sống được! Hơn 20 năm làm nghề, bản thân Tâm cũng phải tự xây dựng lý tưởng sống cho riêng mình để có thể sống tốt mỗi ngày và hoàn thiện mình. Trong lý tưởng đó, và cách Tâm yêu thương bản thân, có cả hành trang là lòng yêu nước.
Với Tâm, A50 và A80, lễ diễu binh diễu hành hay những ""concert quốc gia"" không phải là những dịp ""trống giong cờ mở"" mà hơn hết, đó là tấm gương soi để các bạn trẻ hôm nay nhìn vào và biết mình đang sống ở đâu, thuộc về đâu. Một khi biết mình đang đứng ở đâu và thuộc về đâu, tình yêu tự nó sẽ toát lên rất tự nhiên và chân thành, giản dị và gần gũi.
Từng đặt tên cho bộ phim tài liệu chân dung của mình là ""Người giữ thời gian"", chị nghĩ khoảnh khắc sáng nay sẽ giúp chị giữ lại điều gì trước thời gian?
- Khoảnh khắc đó, nó chắn chắn sẽ là ""timeless"" rồi! Nhưng Tâm không nghĩ Tâm sẽ cất kỹ nó vào sâu trong ký ức để lâu lâu mới lôi ra dùng. Trái lại, Tâm sẽ luôn mang theo nó bên mình, ngắm nó mỗi ngày để thực hành lòng biết ơn. Biết ơn đất nước. Lý tưởng với Tâm không phải là một thứ ""nhân dịp"", nó là hành trang mỗi ngày.
Mỹ Tâm cùng bạn diễn ""nhí"" 7 tuổi tại A80
Ảnh: Thắng Đặng
Nếu không phải là lời tự vấn to tát: ""… mà cần hỏi ta đã làm gì cho Tổ quốc hôm nay"" – như ca khúc Khát vọng tuổi trẻ chị vừa hát đêm 1.9, thì câu tự vấn chị dành cho mình mỗi ngày là gì?
- Là liệu mình sống đã có ý nghĩa chưa, có sai đâu đó… Vì làm sai thì dễ lắm, sống đúng mới là...!
Giữa lúc nhiều nghệ sĩ chọn thời điểm này để đưa ra những ca khúc có tính hiệu triệu, tự hào, ngợi ca đất nước…, vì sao Mỹ Tâm lại tung ra MV Mùa gió thổi trên mái nhà để thương về một miền Trung mưa buồn bão dữ?
- Thật ra ca khúc đó là nằm trong album đầu tayMade in Vietnamvừa phát hành của DTAP nhưng cũng tình cờ đến với khán giả vào đúng lúc miền Trung quê Tâm vừa hứng bão, hẳn cũng là một lời xoa dịu. Trong ""khối yêu nước"", nhiều bạn trẻ đã làm rất tốt chữ ""yêu"" rồi, như hơn 20 năm qua Mỹ Tâm cũng đã làm, giờ để Mỹ Tâm chọn từ khác đi. Trong chữ ""yêu"" luôn có chữ ""thương"" mà, Tâm nghĩ vậy!
""Tâm bình thản vì Tâm rất thích cho đi...""
Ảnh: Thắng Đặng
Chăm chỉ làm từ thiện một cách lặng lẽ, đó là cách chị chia động từ ""yêu nước"" theo kiểu Mỹ Tâm. Phong thái bình thản thường thấy ở chị, liệu có đến từ đó?
- Chắc thế! Tâm bình thản vì Tâm rất thích cho đi, và Tâm vui vì điều đó. Nói thì Tâm không giỏi đâu, Tâm mà lên sân khấu nói là khán giả của mình ""đứng hình"" luôn đó, vì Tâm thường chỉ nói theo cảm tính, và bao năm rồi vẫn lớ ngớ. Nhưng Tâm nghĩ mình làm được, bằng vào nguồn năng lượng tích cực mà Mỹ Tâm luôn kiên nhẫn tích cóp, học hỏi mỗi ngày.
Nếu quả thực có những khoảnh khắc đủ khiến sau đó chúng ta không thể nào… sống bình thường được nữa, chị có nghĩ, với chị, đó chính là khoảnh khắc sáng nay?
- Trái lại, kể từ đây, Tâm thấy mình càng phải sống bình thường, càng không nên làm quá. Phải bình thường mới có thể cảm nhận được một cách bình thản niềm hạnh phúc mà mình đang có, là được sống giữa nhân dân này, đất nước này, những ngày tháng này…
""Khoảnh khắc đó, nó chắn chắn sẽ là ""timeless"" rồi! Nhưng Tâm không nghĩ tôi sẽ cất kỹ nó vào sâu trong ký ức để lâu lâu mới lôi ra dùng. Trái lại, Tâm sẽ luôn mang theo nó bên mình, ngắm nó mỗi ngày để thực hành lòng biết ơn. Biết ơn đất nước. Lý tưởng với Tâm không phải là một thứ ""nhân dịp"", nó là hành trang mỗi ngày"" (Mỹ Tâm)
"
https://thanhnien.vn/nguoi-mau-han-quoc-qua-doi-o-tuoi-35-185251107192919903.htm,Người mẫu Hàn Quốc qua đời ở tuổi 35,Nam người mẫu Kim Sung Chan đã qua đời ở tuổi 35 sau khoảng 2 năm kiên trì điều trị ung thư máu.,"TheoSBS, ngày 7.11, Kim Sung Chan đã trút hơi thở cuối cùng sau thời gian điều trị tích cực kể từ khi được chẩn đoán mắc bệnhung thư máuvào năm 2023. Thông tin đau buồn này được anh trai của người mẫu chia sẻ cùng ngày trên mạng xã hội. Trong lời chia sẻ, anh viết: “Kyung-mo (tên thật của Kim Sung Chan) đã rời bỏ chúng ta sau hơn 2 năm chiến đấu với bệnh ung thư. Xin mọi người hãy nhớ đến em ấy trong tâm trí và dành những lời ấm áp cho em trai tôi”.
Ngay sau khi thông tin được công bố, nhiều đồng nghiệp trong ngành giải trí và thời trang đã bày tỏ lòng tiếc thương sâu sắc. Cựu thành viên nhóm nhạc Rainbow, No Eul, chia sẻ: ""Sung Chan, tôi hy vọng anh sẽ không còn đau đớn nữa và có thể yên nghỉ"". Người mẫu Joo Won Dae và nam diễn viên Lee Jae Sung cũng bày tỏ sự xót xa: ""Cầu mong anh ra đi thanh thản"".
Thông tin về tang lễ của người mẫu Kim Sung Chan đã được gia đình công bố. Lễ viếng được tổ chức tại Nhà tang lễ Trung tâm Y tế Seoul, Hàn Quốc. Lễ an táng dự kiến diễn ra vào 10 giờ 30 ngày 8.11.
Kim Sung Chan qua đời ở tuổi 35
ẢNH: CHOSUN
Kim Sung Chan được biết đến lần đầu tiên thông qua buổi trình diễn thời trangS/S Unbounded AWE 2014và nhanh chóng gây chú ý. Anh trở thành gương mặt quen thuộc, xuất hiện đều đặn trên sàn diễn tại Tuần lễ thời trang Seoul hằng năm.
Bước ngoặt lớn giúp anh được công chúng biết đến rộng rãi là khi tham gia chương trình thực tếKorea's Next Top Model 5 Guys & Girlscủa OnStyle vào năm 2014. Với cá tính vui vẻ, phong thái tự tin và sự dễ gần, anh đã để lại ấn tượng mạnh mẽ với dàn giám khảo là các người mẫu hàng đầu của Hàn Quốc như Lee Hye Jung và Kim Won Jung.
Năm 2019, Kim Sung Chan đạt dấu mốc quốc tế quan trọng khi sải bước tại Tuần lễ thời trang Milan cho bộ sưu tậpYouser 2020 S/S, khẳng định vị thế trên bản đồ thời trang toàn cầu. Ngoài sàn catwalk, anh còn xuất hiện trong nhiều quảng cáo nổi tiếng cho các thương hiệu lớn như bia và máy tính xách tay, đồng thời tích cực kết nối với người hâm mộ qua kênhYouTubecá nhân mang tênSungnan TV.
Năm 2019, Kim Sung Chan đạt dấu mốc quốc tế quan trọng khi sải bước tại Tuần lễ Thời trang Milan
ẢNH: CHOSUN"
