url,title,description,content
https://thanhnien.vn/yamaha-lan-dau-tien-to-chuc-hanh-trinh-chinh-phuc-man-dem-cung-yamaha-nvx-1852511081444237.htm,Yamaha lần đầu tiên tổ chức hành trình chinh phục màn đêm cùng Yamaha NVX,"Từ ngày 1 - 2.11 vừa qua, những thành viên trong cộng đồng đam mê Yamaha NVX vừa có một trải nghiệm khó quên với hành trình 'NVX Midnight Touring' - chuyến phượt xuyên đêm từ TP.HCM đến Phan Thiết, mang đến không khí phấn khích của tuổi trẻ và niềm đam mê tốc độ.","Hành trình “NVX Midnight Touring”

Khởi hành từ trung tâm TP.HCM, đoàn xe NVX di chuyển qua các cung đường ven thành phố và quốc lộ trong không gian đêm tĩnh lặng, hướng đến Phan Thiết. Đây là lần đầu Yamaha triển khai hình thức ""midnight touring"" dành riêng cho cộng đồng người dùng NVX - một trải nghiệm lái xe xuyên đêm, vừa kiểm nghiệm khả năng vận hành của xe trong điều kiện thực tế, vừa mang đến góc nhìn khác biệt về những cung đường quen thuộc. Khi trời bắt đầu chuyển sáng, các thành viên dừng chân tại điểm ngắm bình minh ở vùng biển Phan Thiết, cùng ghi lại hình ảnh mặt trời mọc và tận hưởng cảnh sắc buổi sớm đặc trưng của vùng biển Nam Trung bộ.
Điểm nhấn của chuyến đi nằm ở trải nghiệm vận hành Yamaha NVX 155 phiên bản mới với công nghệ YECVT lần đầu tiên được Yamaha giới thiệu tại Việt Nam. Không vận hành theo cơ chế vô cấp truyền thống, YECVT sử dụng mô-tơ điện để điều chỉnh tỉ số truyền động, hỗ trợ xe phản hồi ga nhạy, duy trì sức kéo tốt khi vượt dốc hoặc tăng tốc nhanh, đồng thời góp phần cải thiện hiệu suất vận hành và sự êm ái trong quá trình di chuyển liên tục.
YECVT - Hệ truyền động vô cấp điện tử độc quyền từ Yamaha

Trong điều kiện vận hành đêm có mưa nhỏ và quãng đường kéo dài, NVX cho thấy khả năng giữ ga ổn định, vào cua chắc chắn và độ bám đường tốt nhờ bộ lốp bản lớn và hệ thống treo đầm chắc. Các thành viên trong đoàn chia sẻ rằng họ cảm nhận rõ sự khác biệt của hệ truyền động điện tử YECVT trên những pha tăng tốc. Mỗi lần vặn ga vượt xe, sức kéo lên mượt nhưng dứt khoát, kèm phản hồi ga nhạy, tạo sự tự tin khi giữ tốc độ ổn định trên quãng đường dài. Ở những khúc cua dài gần Phan Thiết, cảm giác thân xe ít rung, giúp người lái dễ kiểm soát hơn trong đêm tối.
Sức mạnh của NVX đến từ khối động cơ Blue Core 155cc làm mát bằng dung dịch, 4 van, kết hợp cùng công nghệ van biến thiên VVA, đảm bảo vận hành mượt mà ở mọi tốc độ và khả năng tăng tốc ổn định. Công nghệ VVA hỗ trợ tối ưu hiệu suất ở cả tốc độ thấp và cao, tạo cảm giác lái linh hoạt trên nhiều cung đường khác nhau, đặc biệt khi di chuyển đường trường và chạy đêm. Một người tham gia đến từ TP.HCM chia sẻ: ""Chạy đêm mưa nhẹ, đường trơn nhưng xe bám khá chắc, nhất là khi thoát cua hay cần tăng tốc để vượt. Có YECVT nên cảm giác ga lên đều và mạnh hơn, xe không bị hụt lực nên chạy lâu vẫn rất yên tâm"".
Hệ thống đèn LED giúp tăng khả năng nhận diện và an toàn khi di chuyển ban đêm

Đáng chú ý, NVX 2025 được nâng cấp với hệ thống kiểm soát lực kéo TCS can thiệp khi phát hiện hiện tượng trượt, giúp người lái tăng tốc an toàn hơn và vào cua ổn định hơn. Đồng thời, hệ thống chống bó cứng phanh ABS trang bị cho bánh trước hạn chế tình trạng bó cứng bánh khi phanh gấp, hỗ trợ kiểm soát xe tốt hơn trong các tình huống khẩn cấp và đảm bảo hiệu quả vận hành.
Đèn LED trước của NVX phát huy hiệu quả rõ rệt khi chạy đêm: vùng sáng rộng, rõ và tập trung, giúp quan sát mặt đường dễ dàng. Nhịp dừng nghỉ ngắn dọc đường không gây mệt mỏi nhờ yên xe hai tầng, đệm yên được cải tiến êm ái hơn và tư thế lái thể thao nhưng không quá dồn trọng tâm. Cổng sạc USB và màn hình hiển thị lớn giúp người dùng theo dõi hành trình, giữ liên lạc và sử dụng thiết bị định vị tiện lợi trong suốt chặng đi.
Đoàn xe dừng chân ngắm bình minh tại biển Phan Thiết

Sau chặng đường dài xuyên đêm, đoàn NVX dừng chân tại bờ biển Phan Thiết khi ánh sáng đầu tiên bắt đầu xuất hiện trên đường chân trời. Các thành viên tranh thủ thư giãn, phục hồi năng lượng và cùng nhau đón khoảnh khắc mặt trời dần lên, nhuộm sắc vàng lên mặt biển.
Ông Okutani Masahiro, Tổng giám đốc Yamaha Motor Việt Nam chia sẻ

Tổng giám đốc Yamaha Motor Việt Nam, ông Okutani Masahiro cho biết: ""Với NVX Midnight Touring, Yamaha mong muốn định nghĩa lại về touring, không chỉ giới hạn với những cung đường chạy vào ban ngày, mà là cách để mỗi chúng ta trải nghiệm sự tự do, phấn khích và cùng chia sẻ niềm đam mê dành cho xe máy với những người cùng sở thích"".
Ngoài ra, mẫu xe cũng được trang bị nhiều tiện ích hỗ trợ người lái như hệ thống khóa thông minh Smart Key, kết nối Y-Connect giúp đồng bộ thông tin xe với điện thoại để theo dõi tình trạng vận hành và lịch bảo dưỡng. Dung tích cốp rộng đáp ứng nhu cầu mang theo hành lý cho chuyến đi ngắn ngày, phù hợp với phong cách di chuyển linh hoạt của người dùng trẻ.
NVX 155 sở hữu loạt trang bị đảm bảo an toàn tối đa

NVX Midnight Touring không chỉ là một chuyến đi, đó là khoảnh khắc những người trẻ sống trọn tốc độ, tự do và đam mê. Và chính NVX, với khả năng tăng tốc mạnh mẽ, tư thế lái thể thao và loạt công nghệ hiện đại, đã trở thành người bạn đồng hành lý tưởng để biến từng khoảnh khắc trên hành trình ấy thành trải nghiệm đầy năng lượng và cảm xúc.
Đăng ký nhận thông tin tư vấn mua xe và thông tin ưu đãi mới nhất tại đây:https://yamaha-motor.com.vn/dang-ky-tu-van-mua-xe/
"
https://thanhnien.vn/nhuoc-diem-cua-google-maps-khi-su-dung-tren-o-to-185251107110227762.htm,Nhược điểm của Google Maps khi sử dụng trên ô tô,"Google Maps là ứng dụng dẫn đường phổ biến hiện nay nhưng khi sử dụng cho ô tô tại Việt Nam, công cụ này vẫn tồn tại nhiều hạn chế, gây bất tiện và rủi ro cho người lái.","Với điều kiện giao thông, đường sá phức tạp tại Việt Nam, hầu hết tài xế đều sử dụng ứng dụng bản đồ mỗi khi lái xe. Trong số những ứng dụng phổ biến hiện nay,Google Mapsvẫn được chuộng nhất nhờ giao diện trực quan, gần gũi, dễ thao tác và vẫn đang miễn phí cho người dùng.
Google Maps vẫn là một trong những ứng dụng bản đồ phổ biến hiện nay
ẢNH: C.T
Ở mỗi quốc gia, thị trường khác nhau, Google Maps sẽ cung cấp nhiều tính năng khác nhau nhưng tại Việt Nam, ứng dụng này hiện chỉ mang đến những tính năng cơ bản, còn bộc lộ nhiều hạn chế. Điều này không chỉ khiếntài xếkhó khăn trong quá trình sử dụng mà còn tiềm ẩn nhiều nguy cơ vi phạm luật giao thông.
Dưới đây là một số nhược điểm của Google Maps khi sử dụng trên ô tô tại Việt Nam:
So với một số ứng dụng bản đồ đang có mặt trên thị trường hiện nay, nhược điểm lớn của Google Maps là không hiển thị giới hạn tốc độ của đoạn đường đang di chuyển. Trong khi đó, tính năng này đã phổ biến tại nhiều quốc gia như Mỹ, châu Âu...
Google Maps tại Việt Nam chưa hiển thị cảnh báo tốc độ
ẢNH: C.T
Ứng dụng chỉ hỗ trợ đồng hồ đo tốc độ bằng GPS nhưng không có cảnh báo khi người lái vượt quá tốc độ giới hạn cho phép. Điều này khiến tài xế dễ rơi vào tình huống phạm lỗi điều khiển xe chạy quá tốc độ mà không hay biết, nhất là ở khu vực đông dân cư hoặc tuyến đường có biển báo thay đổi liên tục.
Trên thực tế, nhiều tài xế khi dùng Google Maps phải tập trung nhìn biển báo, vốn không phải lúc nào cũng được đặt ở vị trí dễ quan sát. Đây cũng là điểm bất lợi lớn khi so sánh với các ứng dụng bản đồ chuyên dụng trong nước đã cập nhật đầy đủ dữ liệu biển báo, tốc độ giới hạn và vị trí camera giám sát.
Nếu Google Maps bổ sung tính năngcảnh báo tốc độ, người lái sẽ chủ động hơn trong việc kiểm soát hành trình và tránh bị phạt nguội.
Google Maps ưu tiên tuyến đường ngắn hoặc nhanh nhất trong một số tình huống mà không đánh giá điều kiện thực tế như mặt đường, độ rộng hay giới hạn phương tiện. Điều này khiến nhiều tài xế bị hướng dẫn đi vào đường hẹp, ngõ nhỏ, thậm chí là đường dân sinh, gây khó khăn khi quay đầu và tiềm ẩnrủi ro va quẹt. Nhược điểm này nằm ở thuật toán dẫn đường chưa tối ưu cho ô tô.
Nhiều tuyến đường nhỏ hẹp khó di chuyển được Google Maps đề xuất cho tài xế
ẢNH: TN
Ngoài ra, một số tuyến đường được ứng dụng đề xuất cũng là ""đường tắt"", chỉ phù hợp với xe máy. Những tình huống này khá phổ biến tại Hà Nội, TP.HCM hay các khu vực vùng ven, nơi mạng lưới đường nhánh dày đặc và không đồng nhất.
Google đang phát triển tính năng ""Narrow Road Avoidance"" trên ứng dụng bản đồ của mình, giúp tự động tránh các tuyến đường quá hẹp. Dù vậy, chưa rõ khi nào tính năng này sẽ được triển khai tại thị trường Việt Nam.
Ứng dụng bản đồ của Google thường đưa ra chỉ dẫn cơ bản như ""rẽ trái"", ""rẽ phải"" hoặc ""đi thẳng"", không hướng dẫn cụ thể người lái nên giữ làn nào. Điều này khiến tài xế phải tự điều khiển phương tiện theo kinh nghiệm, kiến thức hoặc nhìn biển báo phụ. Các tình huống như vậy dễ dẫn đến tình huống chuyển làn đột ngột, bỏ lỡ lối ra/vào cao tốc.
Google Maps chưa có tính năng chỉ dẫn làn đường cụ thể
ẢNH: B.H
Trên các ứng dụng điều hướng khác đang có mặt trên thị trường, tính năng hướng dẫn làn đường trực tiếp đã được triển khai, hiển thị hình ảnh trực quan từng làn đường tại nút giao. Nếu được bổ sung trên Google Maps, đây sẽ là cải tiến quan trọng giúp giảm sai sót khilái xetrong môi trường giao thông phức tạp.
Không phủ nhận những tính năng đáng giá, được coi là ưu điểm của Google Maps khi sử dụng trên ô tô tại Việt Nam như khả năng cập nhật dữ liệu giao thông theo thời gian thực, phản hồi nhanh về tình trạng kẹt xe... Tuy nhiên, nếu bổ sung thêm các tính năng phù hợp đặc thù giao thông hiện nay, ứng dụng bản đồ của Google sẽ ngày càng khẳng định chỗ đứng hơn đối với giới tài xế."
https://thanhnien.vn/phim-cach-nhiet-kem-chat-luong-tran-lan-lam-sao-nhan-biet-185251031190731014.htm,"Phim cách nhiệt kém chất lượng tràn lan, làm sao nhận biết?","Thị trườngphim cách nhiệtô tô đang bị ""nhiễu loạn"" bởi hàng loạt sản phẩm kém chất lượng, hàng giả tinh vi, khiến người dùng tốn nhiều chi phí dán phim nhưng không đạt hiệu quả.","Với đặc điểm khí hậu nắng nóng, cường độ tia cực tím cao, phim cách nhiệt trở thành phụ kiện quan trọng, gần như được người dùng trang bị choô tôtại Việt Nam. Thực tế, thị trường hiện nay đang đối mặt tình trạng nhiễu loạn khi xuất hiện nhiều loại phim không rõ nguồn gốc, chất lượng kém, thậm chí bị làm giả và mang ""mác"" các thương hiệu lớn.
Nhiều mẫu xe mới khi bán ra thị trường đã được dán sẵn phim cách nhiệt
ẢNH: B.H
Một trong những hình thức phổ biến, khiến người dùng dễ ""dính bẫy"" là chương trình khuyến mãi khi mua ô tô mới. Nhiều đại lý thường tặng gói ""Phim - Sàn - Cam"" (tức dán phim cách nhiệt, lót sàn và lắp camera hành trình) để thu hút khách mua. Tuy nhiên, nhiều chủ xe phản ánh loại phim được tặng có hiệu quả cách nhiệt kém, nhất là khi đi dưới trời nắng gắt.
Điều này dễ khiến nhiều người hoài nghi về sự hiệu quả của phim cách nhiệt mang lại. Trên thực tế, phim cách nhiệt chất lượng cao có thể giảm tới 90% bức xạ nhiệt, giúp khoang cabin duy trì nhiệt độ ổn định và giảm tải công suất hệ thốngđiều hòa. Để đạt được hiệu quả đó, người dùng phải dán đúng loại phim chất lượng, đáp ứng được tiêu chuẩn kỹ thuật nhất định, đặc biệt ở khả năng phản xạ hoặc hấp thụ tia hồng ngoại (IR).
Cần đến dụng cụ kỹ thuật mới có thể đo được thông số của phim cách nhiệt dán ô tô
ẢNH: C.T
Trao đổi với PVThanh Niên, ông Vũ Hoàng Khánh - đại diện hãng phim cách nhiệt Hi-Kool chia sẻ: ""Phim giá rẻ thường chỉ cản được tia UV, không ngăn chặn được nhiều tia hồng ngoại. Trong khi đó, tia hồng ngoại là một trong những nguyên nhân chính sinh nhiệt nên nhiều người sẽ cảm thấy hơi nóng hắt vào mặt khi lái xe dù đã dán phim cách nhiệt, nhất là ở vị trí kính lái"".
Ngoài vấn đề chất lượng thấp, người dùng còn phải cảnh giác với tình trạng phim cách nhiệt giả. Các sản phẩm làm nhái ngày càng tinh vi, có thể in logo chìm, nhãn mác giống hệt hàng thật. ""Nhiều thương hiệu lớn thường bị làm giả để qua mặt người dùng thiếu kinh nghiệm. Nhìn bằng mắt thường rất khó phân biệt nếu không có công cụ hỗ trợ"", ông Khánh chia sẻ thêm.
Logo thương hiệu phim cách nhiệt in chìm cũng có thể bị làm giả
ẢNH: C.T
Để bảo vệ người tiêu dùng, một số hãng phim cách nhiệt đã triển khai giải pháp xác thực sản phẩm qua mã số seri và bảo hành điện tử. Đơn cử như phim cách nhiệt Hi-Kool, người mua có thể kiểm tra thông tin sản phẩm, thời gian bảo hành, mẫu xe và biển số được dán... thông qua hệ thống quản lý.
Trong bối cảnh thị trường phim cách nhiệt kém chất lượng tràn lan, người dùng nên tham khảo các thương hiệu phim cách nhiệt có uy tín và tìm hiểu kỹ sản phẩm trước khi dán lên ô tô. Điều này góp phần nâng cao trải nghiệm sử dụng xe dưới thời tiết nắng nóng."
https://thanhnien.vn/hang-xe-nhat-ban-phat-trien-pin-o-to-dien-dung-duoc-40-nam-185251106153104897.htm,Hãng xe Nhật Bản phát triển pin ô tô điện dùng được 40 năm,"Toyota đặt mục tiêu phát triển pin thể rắn có thể đạt tuổi thọ khoảng 40 năm đồng thời dung lượng sau mỗi lần sạc duy trì ở mức 90%, hướng tới độ bền, hiệu suất và khả năng tái sử dụng trong lĩnh vực ô tô điện.","Nhiều hãng xe rên thế giới xác địnhô tô điệnlà xu hướng phát triển trong tương lai để giảm tác động khí thải ra môi trường. Chính vì vậy, công nghệ pin đang trở thành tâm điểm quyết định năng lực cạnh tranh của các hãng xe.
Sau nhiều năm nghiên cứu,Toyotavừa đưa ra tuyên bố gây chú ý khi đặt mục tiêu phát triển loạipin thể rắncó tuổi thọ lên đến 40 năm. Đây được xem là bước đi đầy tham vọng, thách thức giới hạn, điểm yếu còn hiện hữu trênpin lithium-ionhiện có tuổi thọ tối đa khoảng 10 năm sử dụng.
Toyota dự kiến thương mại hóa pin thể rắn cho ô tô điện từ 2027 - 2028
ẢNH: TN
Theo công bố của Toyota, pin thể rắn của hãng xe này có thể được thương mại hóa vào năm 2027 - 2028, hướng tới duy trì dung lượng pin thực tế đạt khoảng 90% sau quá trình sử dụng khoảng 40 năm, nghĩa là chỉ ""chai pin"" khoảng 10%. Con số này cao hơn nhiều lần so với tuổi thọ trung bình của pin lithium-ion trên xe điện hiện nay.
Toyota cho rằng, việc kéo dài tuổi thọ pin thể rắn sẽ giúp giảm đáng kể lượng phát thải carbon trong sản xuất. Thay vì phải chế tạo bốn bộ pin lithium-ion để phục vụ cùng một quãng thời gian sử dụng, chỉ cần một bộ pin thể rắn là đủ, qua đó cắt giảm tới 75% lượng khí thải carbon. Điều này phù hợp với chiến lược trung hòa khí thải mà hãng xe Nhật Bản đang theo đuổi, góp phần giải ""bài toán"" ô nhiễm môi trường, vốn là thách thức lớn của ngành công nghiệp ô tô hiện nay.
Bên cạnh độ bền, Toyota cũng đặt kỳ vọng lớn về hiệu suất. Pin thể rắn được hãngxe Nhật Bảnchia sẻ có thể di chuyển hơn 1.000 km chỉ trong một lần sạc, thậm chí có thể đạt tới 1.200 km trong điều kiện tối ưu.
Ngoài ra, thời gian sạc nhanh được rút ngắn đáng kể, chỉ mất khoảng 10 - 15 phút để nạp từ 10 - 80% pin. Nếu những công bố trên trở thành sự thật, đây sẽ là lời giải toàn diện cho người dùng xe điện, đáp ứng được quãng đường di chuyển dài và sạc nhanh.
Xe điện Toyota trong tương lai có phạm vi hoạt động khoảng 1.000 km sau mỗi lần sạc đầy
ẢNH: TN
Không chỉToyota, nhiều hãng xe khác cũng đang chạy đua trong lĩnh vực pin thể rắn, trong đó có các thương hiệu Trung Quốc. Mới đây, Chery đã công bố phát triển pin thể rắn đạt mật độ năng lượng 600 Wh/kg, giúp xe điện có thể đi tối đa 1.300 km theo chuẩn CLTC.
Đáng chú ý, hãng xe Trung Quốc này cũng đặt mục tiêu thương mại hóa vào năm 2027, tương đương với lộ trình của Toyota. Điều đó cho thấy công nghệ pin thể rắn đã vượt qua giai đoạn thử nghiệm, đang tiến gần tới giai đoạn đưa vào sản xuất thương mại.
Xét về khía cạnh kỹ thuật, pin thể rắn sử dụng chất điện phân ở trạng thái rắn nên giảm nguy cơ cháy nổ, đồng thời mang lại mật độ năng lượng cao, khả năng sạc nhanh hơn so với pin lithium-ion truyền thống. Đây được xem là hướng phát triển tối ưu để nâng hiệu suất và độ an toàn cho xe điện.
Nếu mục tiêu về tuổi thọ 40 năm trở thành hiện thực, pin thể rắn không chỉ là bước đột phá công nghệ mà còn có thể thay đổi cách hãng xe điện tiếp cận khách hàng. Khi đó, pin không còn là linh kiện hao mòn nhanh mà có thể trở thành phụ tùng có thể tái sử dụng, mở ra kỷ nguyên mới cho ngành công nghiệp xe điện."
https://thanhnien.vn/lo-anh-thuc-te-noi-that-xe-tai-dien-vinfast-ec-van-185251107130942431.htm,Lộ ảnh thực tế nội thất xe tải điện VinFast EC Van,"Xe tải điện VinFast EC Van có khoang nội thất thiết kế đơn giản, trang bị ghế nỉ, điều hòa chỉnh tay, phanh cơ và sử dụng vô-lăng, cần chuyển số tương tự mẫu xe anh em VinFast VF 3.","Tháng 5.2025, VinFast trình làng xe tải điệnEC Vanvà nhận nhiều đánh giá tích cực, nhất là khi hãng xe Việt Nam dấn thân vào phân khúc xe tải cỡ nhỏ, lâu nay vốn là sân chơi của các hãng xe Nhật Bản, Trung Quốc. Nhận thấy tiềm năng lớn từ nhu cầu vận tải trong đô thị,VinFastđã đẩy nhanh quá trình nghiên cứu, hoàn thiện EC Van để sớm đưa vào thương mại hóa.
Hình ảnh thực tế VinFast EC Van cho thấy kích thước tổng thế xe khá nhỏ
ẢNH: EC VAN CLUB
Sau hơn 5 tháng kể từ khi những hình ảnh thiết kế đầu tiên xuất hiện, đến cuối tháng 10 vừa qua, VinFast EC Van đã lộ diện thực tế trên đường thử. Mới đây nhất, hình ảnh về khoang nội thất xe cũng được hé lộ, thu hút sự chú ý trên các hội nhóm mạng xã hội.
Theo đó, xe tải điện VinFast EC Van có nhiều điểm tương đồng với mẫu xe bán chạy nhất Việt Nam hiện nay VinFast VF 3. Nội thất xe trang bị cơ bản với ghế nỉ chỉnh cơ, chìa khóa cơ, phanh tay cơ khí và không có bệ tỳ tay trung tâm. Vô-lăng và cần chuyển số trên VinFast EC Van cũng tương tự VinFast VF 3.
Nội thất xe tải điện VinFast EC Van trang bị cơ bản
ẢNH: EC VAN CLUB
Ngoài ra, phía sau vô-lăng VinFast EC Van có thêm màn hình thông tin nhỏ gọn, hiển thị thông số về dung lượng pin, phạm vi hoạt động và tốc độ di chuyển... Trong khi đó, khu vực trung tâm bảng táp-lô có đài radio và các phím điều chỉnh âm lượng. Đáng chú ý, xe tải điện này sử dụng cơ chế nâng, hạ gương chỉnh điện thay vì kiểu cơ học như trên các mẫu xe đối thủ.
Được phát triển nhằm tối ưu không gian chở hàng, VinFast EC Van có thể tích khoang chứa hàng lên tới 2.600 lít, tải trọng hơn 600 kg. Xe có kích thước tổng thể dài, rộng, cao lần lượt 3.767 x 1.680 x 1.790 (mm), giúp di chuyển linh hoạt trong đô thị.
Khoang chở hàng khá cao, hốc bánh sau không chiếm nhiều diện tích giúp trên VinFast EC Van chở hàng hóa tốt hơn
ẢNH: EC VAN CLUB
Xe tải điện cỡ nhỏ nàh VinFast sử dụng mô-tơ công suất 40,2 mã lực và mô-men xoắn cực đại 110 Nm, tốc độ tối đa 75 km/giờ, phù hợp với nhu cầu vận chuyển hàng hóa trong đô thị. Nguồn năng lượng cung cấp cho xe có bộ pin dung lượng 17 kWh, cho phép xe di chuyển khoảng 150 km sau mỗi lần sạc đầy.
VinFast EC Van hỗ trợ sạc nhanh công suất tối đa 19,4 kW, giúp nạp từ 10 - 70% pin chỉ trong 42 phút. Ngoài ra, người dùng có thể lựa chọn thêm bộ sạc di động 3 kW để chủ động hơn khi sạc tại nhà, kho bãi.
Lợi thế lớn của VinFast nằm ở mạng lưới trạm sạc phủ khắp cả nước, giúp người dùng xe dễ dàng nạp năng lượng. Quan trọng hơn, hãng xe Việt Nam đang miễn phí sạc pin đến hết tháng 6.2027 và miễn lệ phí trước bạ đến tháng 2.2027 theo Nghị định 51/2025, giúp giảm đáng kể chi phí vận hành và lăn bánh trong hơn 2 năm tới.
Trong bối cảnh các quy định kiểm soát khí thải ngày càng siết chặt, VinFast EC Van trở thành lựa chọn phù hợp nhu cầu vận tải đô thị. Khi các phương tiện dùng động cơ đốt trong (chặy bằng xăng, dầu) dần bị hạn chế lưu thông trong tương lai, xe tải điện không phát thải này sẽ nắm giữ nhiều lợi thế về chính sách lẫn tính thực dụng."
