url,title,description,content
https://thanhnien.vn/bo-chinh-tri-danh-gia-can-bo-hang-quy-dieu-chuyen-khi-khong-hoan-thanh-nhiem-vu-185251016203017261.htm,"Bộ Chính trị: Đánh giá cán bộ hằng quý, điều chuyển khi không hoàn thành nhiệm vụ","Bộ Chính trị ban hành Kết luận số 198 thống nhất đánh giá cán bộ hằng quý, hằng năm và đột xuất khi có yêu cầu; điều chuyển, bố trí công tác khác khi cán bộ không hoàn thành nhiệm vụ.","Thay mặt Bộ Chính trị, Ủy viên Bộ Chính trị, Thường trực Ban Bí thư Trần Cẩm Tú đã ký ban hành Kết luận số 198 của Bộ Chính trị về chủ trương đánh giá đối vớicán bộlãnh đạo, quản lý trong hệ thống chính trị (Kết luận số 198).
Hội nghị Trung ương 13 khóa XIII vừa diễn ra
ẢNH: GIA HÂN
Kết luận nêu, tại phiên họp ngày 3.10, xem xét báo cáo của Ban Tổ chức Trung ương về tình hình đội ngũ cán bộ thuộc diện Bộ Chính trị, Ban Bí thư quản lý, Bộ Chính trị kết luận, thống nhất chủ trương tiến hành đánh giá cán bộ định kỳ hằng quý, hằng năm và đột xuất khi có yêu cầu.
Đối với chức danh diện Bộ Chính trị, Ban Bí thư quản lý, Bộ Chính trị giao ban thường vụ các tỉnh ủy, thành ủy, đảng ủy trực thuộc Trung ương; ban thường vụ đảng ủy các ban, bộ, ngành, tập thể lãnh đạo cơ quan, đơn vị trực thuộc Trung ương trực tiếp quản lý cán bộ định kỳ hằng quý tiến hành đánh giá cán bộ.
Nội dung, tiêu chí đánh giá cần tập trung gồm: phẩm chất chính trị, đạo đức, lối sống; việc thực hiện quy chế làm việc, nguyên tắc tập trung dân chủ, tự phê bình và phê bình và trách nhiệm nêu gương; xây dựng mối đoàn kết nội bộ...
Cùng đó là kết quả lãnh đạo, chỉ đạo, điều hành, tổ chức thực hiện các chỉ tiêu, nhiệm vụ được giao và mức độ hoàn thành của các tổ chức, cơ quan, đơn vị trực thuộc trong phạm vi phụ trách; đối với những tồn tại, hạn chế trong việc thực hiện nhiệm vụ được giao, cần phân tích, đánh giá, làm rõ nguyên nhân khách quan, chủ quan và đề ra biện pháp khắc phục.
Bộ Chính trị cũng yêu cầu các tổ chức đảng nói trên đề xuất xếp loại mức độ hoàn thành nhiệm vụ đối với cán bộ; đồng thời, kiến nghị cấp có thẩm quyền xem xét việc điều chuyển, bố trí công tác khác đối với cán bộ có vi phạm, khuyết điểm hoặc không hoàn thành chức trách, nhiệm vụ được giao.
Bộ Chính trị yêu cầu định kỳ báo cáo kết quả với Bộ Chính trị, Ban Bí thư (qua Ban Tổ chức Trung ương) trước ngày 15 tháng cuối của mỗi quý.
Đối với chức danh diện cấp ủy, tổ chức đảng, cơ quan, đơn vị quản lý, Bộ Chính trị giao các tổ chức, cơ quan, đơn vị tập trung lãnh đạo, chỉ đạo, thực hiện việc đánh giá định kỳ hằng quý đối với cán bộ thuộc diện cấp mình quản lý. Nội dung, tiêu chí định hướng đánh giá như với cán bộ diện Bộ Chính trị, Ban Bí thư quản lý nói trên.
Bộ Chính trị cũng yêu cầu trên cơ sở xếp loại mức độ hoàn thành nhiệm vụ đối với cán bộ, xem xét, quyết định điều chuyển, bố trí công tác khác đối với cán bộ có vi phạm, khuyết điểm hoặc không hoàn thành chức trách, nhiệm vụ được giao.
Bộ Chính trị cũng nêu rõ, định kỳ hằng quý báo cáo Bộ Chính trị, Ban Bí thư kết quả đánh giá cán bộ (qua Văn phòng Trung ương Đảng) trước ngày 30 tháng cuối của mỗi quý; đồng thời, gửi Ban Tổ chức Trung ương để theo dõi, tổng hợp, báo cáo cấp có thẩm quyền khi có yêu cầu.
Bộ Chính trị giao Ban Tổ chức Trung ương định kỳ hằng quý, tổng hợp, báo cáo Bộ Chính trị, Ban Bí thư về tình hình xếp loại, đánh giá hằng quý đối với cán bộ thuộc diện Bộ Chính trị, Ban Bí thư quản lý công tác tại các cơ quan, đơn vị, địa phương.
Cùng đó, phối hợp chặt chẽ với Ủy ban Kiểm tra Trung ương, các cấp ủy, tổ chức đảng, tập thể lãnh đạo cơ quan, đơn vị và các cơ quan liên quan đề xuất việc điều chuyển, phân công, bố trí công tác khác đối với cán bộ có vi phạm, khuyết điểm hoặc không hoàn thành chức trách, nhiệm vụ được giao."
https://thanhnien.vn/tong-bi-thu-to-lam-va-phu-nhan-tham-chinh-thuc-phan-lan-tu-20-2210-185251016201253103.htm,Tổng Bí thư Tô Lâm và phu nhân thăm chính thức Phần Lan từ 20 - 22.10,Tổng Bí thư Tô Lâm và phu nhân cùng đoàn đại biểu cấp cao Việt Nam sẽ thăm chính thức Phần Lan từ ngày 20 - 22.10.,"Ngày 16.10, theo thông cáo của Bộ Ngoại giao, nhận lời mời của Tổng thống Phần Lan Alexander Stubb,Tổng Bí thư Tô Lâmvà phu nhân cùng đoàn đại biểu cấp cao Việt Nam sẽ thăm chính thức Phần Lan từ ngày 20 - 22.10.
Tổng Bí thư Tô Lâm và phu nhân
ẢNH: TTXVN
Trước đó, tại cuộc họp báo thường kỳ diễn ra chiều nay 16.10, Người phát ngôn Bộ Ngoại giao Phạm Thu Hằng cho biết, Phần Lan là đối tác bạn bè hữu nghị lâu năm của Việt Nam. Về chính trị và ngoại giao, hai bên thường xuyên trao đổi đoàn các cấp, phối hợp chặt chẽ, ủng hộ lẫn nhau tại các diễn đàn đa phương, đặc biệt là tại Liên Hiệp Quốc và tại ASEAN, EU.
Hợp tác trong lĩnh vực kinh tế, thương mại và đầu tư giữa hai nước phát triển. Hợp tác giữa hai nước trong các lĩnh vực khác như quốc phòng, an ninh, giáo dục - đào tạo, nông nghiệp, môi trường, văn hóa, giao lưu nhân dân, du lịch và hợp tác địa phương cũng phát triển tốt đẹp.
Trong chuyến thăm chính thức Phần Lan, Tổng Bí thư Tô Lâm sẽ có cuộc hội đàm với Tổng thống Phần Lan Alexander Stubb, có các cuộc hội kiến với Thủ tướng Phần Lan, Phó chủ tịch thứ nhất Quốc hội Phần Lan, Chủ tịch Đảng Cộng sản Phần Lan và gặp gỡ một số doanh nghiệp tiêu biểu Phần Lan, cũng như có một số hoạt động đối ngoại quan trọng khác."
https://thanhnien.vn/ong-le-ngoc-quang-giu-chuc-bi-thu-thanh-uy-da-nang-185251016161021962.htm,Ông Lê Ngọc Quang giữ chức Bí thư Thành ủy Đà Nẵng,"Ông Lê Ngọc Quang, Bí thư Tỉnh ủy Quảng Trị được Bộ Chính trị điều động, phân công, chỉ định làm Bí thư Thành ủy Đà Nẵng.","Chiều tối 16.10, tạiThành ủy Đà Nẵng, Ban Tổ chức Trung ương đã công bố quyết định của Bộ Chính trị về công tác cán bộ.
Theo Quyết định số 2447, Bộ Chính trị quyết định chỉ định ông Lê Ngọc Quang, Ủy viên Trung ương Đảng, Bí thư Tỉnh ủy Quảng Trị giữ chức Bí thư Thành ủy Đà Nẵng (nhiệm kỳ 2025 - 2030).
Tại buổi lễ, thay mặt Bộ Chính trị, ôngLê Minh Hưng, Ủy viên Bộ Chính trị, Bí thư Trung ương Đảng, Trưởng ban Tổ chức Trung ương đã trao quyết định và chúc mừng ông Lê Ngọc Quang.
Ông Lê Ngọc Quang, Ủy viên Trung ương Đảng Khóa XIII, Bí thư Tỉnh ủy Quảng Bình (cũ) được Trung ương chỉ định làm Bí thư Tỉnh ủy Quảng Trị (mới) nhiệm kỳ 2020 - 2025 sau khi tỉnh Quảng Bình và tỉnh Quảng Trị hợp nhất.
Ông Lê Minh Hưng, Ủy viên Bộ Chính trị, Bí thư Trung ương Đảng, Trưởng ban Tổ chức Trung ương đã trao quyết định cho ông Lê Ngọc Quang
ẢNH: S.X
Ông Lê Ngọc Quang sinh ngày 21.1.1974, quê quán xã Thiệu Dương, H.Thiệu Hóa, tỉnh Thanh Hóa. Trình độ lý luận chính trị cao cấp; trình độ chuyên môn cử nhân Báo chí.
Trước tháng 11.2019 ôngLê Ngọc Quanglà Trưởng ban Thời sự, Đài Truyền hình Việt Nam.
Tháng 12.2019, ông Quang được bổ nhiệm chức Phó tổng giám đốc Thường trực Đài Truyền hình Việt Nam kiêm Ủy viên Ủy ban An toàn giao thông Quốc gia.
Ngày 30.1.2021, tại Đại hội Đại biểu toàn quốc lần thứ XIII của Đảng, ông Lê Ngọc Quang được bầu là Ủy viên Ban chấp hành Trung ương Đảng khóa XIII, nhiệm kỳ 2021 - 2026.
Ngày 22.3,2021, ông Lê Ngọc Quang giữ chức vụ Tổng giám đốc Đài Truyền hình Việt Nam.
Ngày 31.10.2024, Bộ Chính trị có quyết định điều động, phân công, chỉ định ông Lê Ngọc Quang tham gia Ban Chấp hành, Ban Thường vụ và giữ chức Bí thư Tỉnh ủy Quảng Bình, nhiệm kỳ 2020 - 2025.
Ngày 1.7.2025, ông Quang được chỉ định giữ chức Bí thư Tỉnh ủy Quảng Trị (mới) nhiệm kỳ 2020 - 2025.
Tại Đại hội Đảng bộ tỉnh Quảng Trị lần thứ I vừa diễn ra vào ngày 5.10 vừa qua, ông Lê Ngọc Quang, Bí thư Tỉnh ủy tiếp tục giữ chức Bí thư Tỉnh ủy Quảng Trị, nhiệm kỳ 2025 - 2030.
Chiều cùng ngày, tại trụ sở Tỉnh ủy Đắk Lắk, ông Lê Minh Hưng, Trưởng ban Tổ chức Trung ương đã trao quyết định của Bộ Chính trị điều động, phân công, chỉ định ôngLương Nguyễn Minh Triết,Bí thư Thành ủy Đà Nẵng, giữ chức Bí thư Tỉnh ủy Đắk Lắk (nhiệm kỳ 2025 - 2030)."
https://thanhnien.vn/ong-lam-dong-giu-chuc-chu-tich-hdnd-tinh-khanh-hoa-185251016170729714.htm,Ông Lâm Đông giữ chức Chủ tịch HĐND tỉnh Khánh Hòa,"HĐND tỉnh Khánh Hòa bầu ông Lâm Đông giữ chức Chủ tịch HĐND tỉnh, ông Lữ Thanh Hải làm Phó chủ tịch HĐND tỉnh nhiệm kỳ 2021 - 2026 và ông Nguyễn Thanh Hà giữ chức Phó chủ tịch UBND tỉnh.","Chiều 16.10, HĐND tỉnhKhánh Hòakhóa VII, nhiệm kỳ 2021 - 2026 tổ chức kỳ họp chuyên đề để thực hiệncông tác nhân sựthuộc thẩm quyền và xem xét, quyết định một số nội dung quan trọng khác.
Tại kỳ họp, HĐND tỉnh đã tiến hành bầu và biểu quyết (100% đại biểu) thông qua Nghị quyết về việc xác nhận kết quả bầuChủ tịch HĐNDtỉnh khóa VII, nhiệm kỳ 2021 - 2026 đối với ông Lâm Đông (Phó bí thư Tỉnh ủy) và bầu Phó chủ tịch HĐND tỉnh đối với ông Lữ Thanh Hải (Ủy viên Ban Thường vụ Tỉnh ủy, Bí thư Đảng ủy, Chủ tịch HĐND P.Nha Trang).
Ông Lâm Đông (thứ 2 từ phải qua) cùng ông Lữ Thanh Hải (đứng giữa) nhận hoa chúc mừng từ lãnh đạo tỉnh Khánh Hòa
ẢNH: BÁ DUY
Ông Lâm Đông (54 tuổi, quê quán P.Hoài Nhơn Bắc, tỉnh Gia Lai) có trình độ thạc sĩ Xây dựng Đảng và chính quyền Nhà nước; Cử nhân sư phạm tiếng Anh; Cử nhân giáo dục chính trị; Cao cấp lý luận chính trị.
Ông Lữ Thanh Hải (57 tuổi, quê quán P.Bình Định, tỉnh Gia Lai) có trình độ Cử nhân Luật; Cử nhân Xây dựng Đảng và Chính quyền nhà nước; Cao cấp lý luận chính trị.
Phát biểu nhận nhiệm vụ, ông Lâm Đông cho biết, ông được HĐND tỉnh Khánh Hòa tín nhiệm bầu giữ chức vụ Chủ tịch HĐND tỉnh là vinh dự, trọng trách lớn lao. Tân Chủ tịch HĐND tỉnh Khánh Hòa khẳng định sẽ cùng tập thể Thường trực HĐND tỉnh, các ban của HĐND tỉnh kế thừa những kinh nghiệm quý báu, nỗ lực phấn đấu, nêu cao tinh thần trách nhiệm để không ngừng đổi mới, nâng cao chất lượng hoạt động của HĐND tỉnh.
Cũng tại kỳ họp, các đại biểu đã bầu ông Nguyễn Thanh Hà (Tỉnh ủy viên, Chánh Văn phòngTỉnh ủy Khánh Hòa) giữ chức Phó chủ tịch UBND tỉnh Khánh Hòa nhiệm kỳ 2021 - 2026.
Ông Nguyễn Thanh Hà (thứ 5 từ trái sang) được bầu giữ chức Phó chủ tịch UBND tỉnh nhiệm kỳ 2021 - 2026
ẢNH: BÁ DUY
Ông Nguyễn Thanh Hà (44 tuổi, quê quán Hải Phòng) có trình độ thạc sĩ Quản lý công, Cử nhân hành chính học, Cao cấp lý luận chính trị. Từ tháng 7.2020 đến 7.2022, ông Hà giữ chức Giám đốc Sở VH-TT Khánh Hòa (nay là Sở VH-TT-DL). Từ tháng 8.2022 đến 6.2025, ông Hà giữ chức Chánh Văn phòng UBND tỉnh Khánh Hòa. Sau khisáp nhậphai tỉnh Khánh Hòa và Ninh Thuận, ông Hà giữ chức Chánh Văn phòng Tỉnh ủy Khánh Hòa.
Như vậy, hiện nay, lãnh đạo UBND tỉnh Khánh Hòa gồm ông Nguyễn Khắc Toàn, Chủ tịch UBND tỉnh và 5 Phó chủ tịch là các ông: Nguyễn Long Biên, Trịnh Minh Hoàng, Lê Huyền, Trần Hòa Nam, Nguyễn Thanh Hà."
https://thanhnien.vn/ong-tran-tien-dung-lam-bi-thu-tinh-uy-dien-bien-18525101617514406.htm,Ông Trần Tiến Dũng làm Bí thư Tỉnh ủy Điện Biên,"Ban Chấp hành Đảng bộ tỉnh Điện Biên khóa XV đã bầu ông Trần Tiến Dũng, Phó bí thư Tỉnh ủy Điện Biên khóa XIV, làm Bí thư Tỉnh ủy Điện Biên khóa XV.","Chiều nay 16.10, Hội nghị lần thứ nhất Ban Chấp hành Đảng bộ tỉnhĐiện Biênkhóa XV đã bầu Ban Thường vụ Tỉnh ủy gồm 14 người. Ông Trần Tiến Dũng, Phó bí thư Tỉnh ủy Điện Biên khóa XIV, được bầu giữ chức Bí thư Tỉnh ủy Điện Biên khóa XV.
Tân Bí thư Tỉnh ủy Điện Biên Trần Tiến Dũng
ẢNH: CỔNG TTĐT ĐIỆN BIÊN
Các ông: Lê Thành Đô, Phó bí thư Tỉnh ủy, Chủ tịch UBND tỉnh; Mùa A Vảng, Ủy viên dự khuyết T.Ư Đảng, Ủy viên Ban Thường vụ Tỉnh ủy, Chủ tịch Ủy ban MTTQ Việt Nam tỉnh Điện Biên; Hà Quang Trung, Ủy viên Ban Thường vụ Tỉnh ủy, Phó trưởng ban Tổ chức Tỉnh ủy, được bầu giữ chức Phó bí thư Tỉnh ủy khóa XV, nhiệm kỳ 2025 - 2030.
Ban Chấp hành Đảng bộ tỉnh Điện Biên cũng đã bầu Ủy ban Kiểm tra Tỉnh ủy gồm 11 người. Ông Nguyễn Sỹ Quân, Ủy viên Ban Thường vụ Tỉnh ủy, Chủ nhiệm Ủy ban Kiểm tra Tỉnh ủy khóa XIV, tiếp tục được bầu giữ chức Chủ nhiệm Ủy ban Kiểm tra Tỉnh ủy khóa XV, nhiệm kỳ 2025 - 2030.
Phát biểu nhận nhiệm vụ, tân Bí thư Tỉnh ủy Điện Biên Trần Tiến Dũng cảm ơn sự tin tưởng, tín nhiệm của đại hội đối với toàn thể Ban Chấp hành Đảng bộ và cá nhân ông.
Ông Dũng cho biết, đây vừa là vinh dự, vừa là trọng trách lớn lao mà Đảng bộ, chính quyền và nhân dân các dân tộc tỉnh Điện Biên giao phó cho tập thể Ban Chấp hành Đảng bộ tỉnh khóa XV. Đồng thời, khẳng định sẽ cùng tập thể Ban Chấp hành Đảng bộ tỉnh khóa XV thực hiện nghiêm nguyên tắc tập trung dân chủ trong sinh hoạt Đảng, tiếp tục nâng cao năng lực lãnh đạo và sức chiến đấu của Đảng bộ.
Tập trung cụ thể hóa, quyết liệt triển khai thực hiện nghị quyết đại hội, lấy ""tinh thần Điện Biên Phủ"" như một mệnh lệnh trong thời bình để phát triển. Ông Dũng nêu rõ sẽ gắn trách nhiệm của tập thể Ban Chấp hành Đảng bộ, từng cá nhân ủy viên Ban Chấp hành Đảng bộ với những mục tiêu, chỉ tiêu, nhiệm vụ theo đúng tinh thần rõ người, rõ việc, rõ trách nhiệm, rõ thời gian, rõ kết quả; phát huy tốt tiềm năng, lợi thế, quyết tâm xây dựng tỉnh Điện Biên phát triển vững mạnh.
Trước đó, Đại hội đại biểu Đảng bộ tỉnh Điện Biên lần thứ XV đã bầu Ban Chấp hành Đảng bộ tỉnh khóa XV, nhiệm kỳ 2025 - 2030 gồm 52 người. Đại hội cũng bầu đoàn đại biểu dự Đại hội đại biểu toàn quốc lần thứ XIV của Đảng, gồm 17 đại biểu chính thức và 2 đại biểu dự khuyết đảm bảo tiêu chuẩn, cơ cấu và đại diện cho ý chí, nguyện vọng của Đảng bộ, chính quyền và nhân dân trong tỉnh.
Đại hội cũng nhất trí cao và biểu quyết thông qua Nghị quyết của Đại hội Đảng bộ tỉnh lần thứ XV, nhiệm kỳ 2025 - 2030; giao Ban Chấp hành Đảng bộ tỉnh khóa XV tiếp thu ý kiến góp ý, bổ sung, hoàn thiện các văn kiện của đại hội và tập trung lãnh đạo, chỉ đạo, triển khai và tổ chức thực hiện thắng lợi mục tiêu, nhiệm vụ mà nghị quyết đại hội đã đề ra.
Ông Trần Tiến Dũng sinh năm 1975, quê P.Thành Nam, tỉnh Ninh Bình. Trước khi được bầu làm Bí thư Tỉnh ủy Điện Biên, ông Dũng từng làm Thứ trưởng Bộ Tư pháp (2 lần, lần đầu từ 1.2016 - 27.2.2019 và lần 2 từ 15.5.2023 - 18.1.2025); Phó bí thư Tỉnh ủy, Chủ tịch UBND tỉnh Lai Châu; Bí thư Tỉnh ủy Long An; Phó bí thư tỉnh ủy Điện Biên."
https://thanhnien.vn/ong-luong-nguyen-minh-triet-giu-chuc-bi-thu-tinh-uy-dak-lak-185251016132048972.htm,Ông Lương Nguyễn Minh Triết giữ chức Bí thư Tỉnh ủy Đắk Lắk,"Ông Lương Nguyễn Minh Triết, Ủy viên dự khuyết BCH Trung ương Đảng khóa XIII, Bí thư Thành ủy Đà Nẵng, được Bộ Chính trị điều động giữ chức Bí thư Tỉnh ủy Đắk Lắk (nhiệm kỳ 2025 - 2030).","Chiều 16.10, tại trụ sởTỉnh ủy Đắk Lắkdiễn ra hội nghị công bố quyết định của Bộ Chính trị vềcông tác cán bộ. Đến dự có ôngLê Minh Hưng, Bí thư Trung ương Đảng, Trưởng ban Tổ chức Trung ương; ông Nguyễn Văn Quảng, Phó tổng thanh tra Thường trực Thanh tra Chính phủ...
Tại buổi lễ, ông Lê Minh Hưng trao quyết định của Bộ Chính trị điều động, phân công, chỉ định ôngLương Nguyễn Minh Triết, Bí thư Thành ủy Đà Nẵng, giữ chức Bí thư Tỉnh ủy Đắk Lắk (nhiệm kỳ 2025 - 2030).
Bộ Chính trị trao quyết định điều động ông Lương Nguyễn Minh Triết giữ chức Bí thư Tỉnh ủy Đắk Lắk (nhiệm kỳ 2025 - 2030)
ẢNH: T.X
Phát biểu nhận nhiệm vụ, ông Lương Nguyễn Minh Triết bày tỏ lòng biết ơn lãnh đạo Đảng và Nhà nước đã quan tâm, tin tưởng, giao trọng trách lớn lao là người đứng đầu Đảng bộ tỉnh Đắk Lắk.
Đắk Lắklà một tỉnh có vị trí hết sức quan trọng về chiến lược, quốc phòng, an ninh, có nhiều tiềm năng, lợi thế để phát triển kinh tế, văn hóa, xã hội, có thiên nhiên hùng vĩ, có nền văn hóa đặc sắc và có đội ngũ cán bộ cần cù, sáng tạo, nhanh nhạy, nhiệt tình.
Tân Bí thư Tỉnh ủy Đắk Lắk nhận thức sâu sắc nhiệm vụ được giao vừa là vinh dự vừa là trách nhiệm nặng nề trước yêu cầu cao của sự phát triển, thực hiện trọng trách của Đảng bộ tỉnh đã đề ra. Ông hứa sẽ cùng tập thể Đảng bộ, chính quyền, nhân dân đoàn kết, quyết tâm phấn đấu xây dựng Đắk Lắk ngày càng giàu đẹp, phát triển nhanh, bền vững, trở thành một cực tăng trưởng mới của vùng Tây nguyên và duyên hải Nam Trung bộ.
Ông Lương Nguyễn Minh Triết phát biểu nhận nhiệm vụ
ẢNH: HỮU TÚ
Ông Triết nhấn mạnh bản thân sẽ nỗ lực hết mình, không ngừng học tập và trách nhiệm với công việc, kế tục và tiếp nối các thành quả, tâm huyết mà các thế hệ lãnh đạo tỉnh Đắk Lắk đã dày công xây dựng.
Ông Lương Nguyễn Minh Triết được điều động, phân công giữ chức vụBí thư Tỉnh ủy Đắk Lắkthay ông Nguyễn Đình Trung (nhận nhiệm vụ khác).
Ông Lương Nguyễn Minh Triết (49 tuổi, quê xã Duy An, H.Duy Xuyên, Quảng Nam cũ) có trình độ thạc sĩ quản trị kinh doanh, kỹ sư công nghệ Silcat; cao cấp lý luận chính trị.
Ông Lương Nguyễn Minh Triết từng giữ chức vụ: Phó bí thư Thường trực Thành đoàn, Chủ tịch Hội sinh viên TP.Đà Nẵng, Ủy viên Ban Thường vụ T.Ư Đoàn, Phó chủ tịch T.Ư Hội Sinh viên Việt Nam; Bí thư Thành đoàn, Chủ tịch Hội Sinh viên TP.Đà Nẵng.
Tháng 2.2013, ông được điều động giữ chức Bí thư Quận ủy Liên Chiểu. Từ 3.2016 - 11.2017 là Thành ủy viên, Chủ tịch Liên đoàn Lao động TP.Đà Nẵng; đại biểu HĐND thành phố khóa IX; Ủy viên Đoàn chủ tịch Tổng liên đoàn Lao động Việt Nam.
Từ tháng 11.2017 - 1.2020, ông được điều động giữ chức Chánh văn phòng Thành ủy Đà Nẵng; Bí thư Quận ủy Hải Châu. Tiếp đến, từ tháng 10.2020 – 12.2020, ông được điều động giữ chức Phó bí thư Thường trực Thành ủy Đà Nẵng khóa XXII (nhiệm kỳ 2020 - 2025).
Từ tháng 12.2020 - 1.2021, ông Triết là Phó bí thư Thường trực Thành ủy khóa XXII, Bí thư Đảng đoàn, Chủ tịch HĐND TP.Đà Nẵng khóa IX.
Từ tháng 1.2021 - 1.2024, ông Triết Ủy viên dự khuyết T.Ư Đảng khóa XIII, Phó bí thư Thường trực Thành ủy khóa XXII, Bí thư Đảng đoàn, Chủ tịch HĐND TP.Đà Nẵng khóa IX, khóa X (từ tháng 6.2021).
Tháng 1.2024, ông Triết là Ủy viên dự khuyết T.Ư Đảng khóa XIII, Bí thư Tỉnh ủy Quảng Nam (cũ).
Từ tháng 7.2025, Ủy viên dự khuyết T.Ư Đảng khóa XIII, Chủ tịch UBND TP.Đà Nẵng (mới).
Từ ngày 5.9.2025, Ủy viên dự khuyết T.Ư Đảng khóa XIII, Bí thư Thành ủy Đà Nẵng (nhiệm kỳ 2020 - 2025).
Từ tháng 17.9.2025, ông Lương Nguyễn Minh Triết là Ủy viên dự khuyết T.Ư Đảng khóa XIII, Bí thư Thành ủy Đà Nẵng (nhiệm kỳ 2025 - 2030)."
