url,title,description,content
https://tienphong.vn/chay-dua-thoi-gian-de-hoc-sinh-tro-lai-truong-sau-thien-tai-kep-o-dak-lak-post1794519.tpo,Chạy đua thời gian để học sinh trở lại trường sau thiên tai kép ở Đắk Lắk,"TPO - Sau cơn bão số 13 kết hợp ngập lụt, 226 cơ sở giáo dục tại Đắk Lắk bị thiệt hại nặng nề. Giáo viên cùng các lực lượng đang gấp rút dọn dẹp, khắc phục để học sinh sớm quay trở lại trường trong điều kiện an toàn.","Cơnbão số 13quét qua tỉnhĐắk Lắkchưa kịp lắng lại, nước lũ từ thượng nguồn tràn về, tạo nên thiên tai kép khiến nhiều địa phương rơi vào cảnh tan hoang. Xã Đồng Xuân là một trong những khu vực chịu ảnh hưởng nặng nề nhất. Nhiều trường học bị ngập sâu, cây cối đổ, mái tôn hư hỏng, khiến việc dạy và học bị gián đoạn nghiêm trọng.
Ngày 8/11, ngay khi nước rút, các thầy cô Trường Tiểu học và Trung học cơ sở Xuân Sơn Bắc (xã Đồng Xuân) đã có mặt từ sáng sớm, tham gia dọn dẹp, thu dọn mái che hư hỏng, đồng thời thuê máy bơm hút nước để nhanh chóng khắc phục thiệt hại.
Các thầy cô Trường Tiểu học và Trung học cơ sở Xuân Sơn Bắc dọn trường sau lũ.
Ông Nguyễn Văn Thắng - Hiệu trưởng trường Tiểu học và THCS Xuân Sơn Bắc, cho biết: Ngoài trường chính, nhà trường còn có 3 điểm trường với tổng số 367 học sinh. Nước ngập sâu hơn 2 m, nhiều cây xanh bị đổ và mái che khu vực để xe bị tốc, khiến việc ổn định cơ sở vật chất trở thành nhiệm vụ cấp bách.
Ông Nguyễn Văn Thắng - Hiệu trưởng Trường Tiểu học và Trung học cơ sở Xuân Sơn Bắc, tham gia dọn dẹp trường học.
Theo thống kê của Sở Giáo dục và Đào tạo tỉnh Đắk Lắk, tính đến sáng 8/11, toàn tỉnh có 226 cơ sở giáo dục bị thiệt hại với tổng giá trị ước tính khoảng 22,8 tỷ đồng, trong đó 38 đơn vị trực thuộc sở thiệt hại gần 5 tỷ đồng.
Hậu quả cụ thể gồm tường rào, cổng trường, phòng học hư hỏng, mái tôn tốc mái, 1.024 cây xanh gãy đổ, 654 bộ bàn ghế và 176 bộ máy tính hư hỏng, cùng bùn đất và rác thải tràn vào lớp học.
Trước tình hình này, ngành giáo dục phối hợp chính quyền địa phương và các lực lượng dân quân, quân đội, đoàn viên thanh niên triển khai khẩn trương các biện pháp: dọn vệ sinh, khử khuẩn, kiểm tra an toàn trường lớp, ưu tiên sửa chữa các hạng mục thiết yếu. Đảm bảo vệ sinh và an toàn trường học cần được hoàn thành trước ngày 10/11.
Sở Giáo dục và Đào tạo Đắk Lắk yêu cầu chỉ tổ chức dạy học khi đã được xác nhận đủ điều kiện an toàn. Tuyệt đối không để học sinh học tập trong các phòng học chưa bảo đảm an toàn. Đồng thời, các trường điều chỉnh kế hoạch học bù, triển khai học trực tuyến nếu điều kiện cho phép, và hỗ trợ học sinh bị thiệt hại về sách vở, đồ dùng học tập. Mục tiêu là đảm bảo an toàn tuyệt đối cho học sinh, giáo viên và duy trì tiến độ học tập sau bão.
Ông Đào Mỹ - Phó Chủ tịch UBND tỉnh Đắk Lắk, cho biết: UBND tỉnh đã giao trách nhiệm cho Sở Giáo dục và Đào tạo tỉnh cùng chính quyền các địa phương chủ trì khắc phục hậu quả, dọn dẹp trường học, nhằm đảm bảo học sinh trở lại trường sớm nhất và an toàn nhất."
https://tienphong.vn/chuong-trinh-thac-si-hsu-hon-45-hoc-vien-la-ceo-quan-ly-va-100-huong-den-gia-tri-that-trong-su-nghiep-post1794579.tpo,"Chương trình Thạc sĩ HSU: Hơn 45% học viên là CEO, quản lý và 100% hướng đến giá trị thật trong sự nghiệp","Ngày 8/11/2025, tại Khách sạn Rex Sài Gòn (TP.HCM), Trường Đại học Hoa Sen (HSU) tổ chức Lễ Tốt nghiệp cho 80 tân thạc sĩ, đồng thời thực hiện nghi thức khai giảng cho 60 tân học viên của chương trình cao học.","Theo đó, HSU đã trao bằng thạc sĩ cho các tân khoa thuộc các ngành Quản trị Kinh doanh (MBA), Ngôn ngữ Anh (MAE) và Quản trị Dịch vụ du lịch và lữ hành (MAT). Các tân thạc sĩ tốt nghiệp trong đợt này có 18 bài báo nghiên cứu khoa học được đăng tải trên các tạp chí uy tín trong và ngoài nước, cùng 5 đề tài ứng dụng thực tiễn, được giao quyết định triển khai tại doanh nghiệp.
Trong đó, hơn 20% tân thạc sĩ là giám đốc/phó giám đốc doanh nghiệp, và hơn 25% đang đảm nhiệm vị trí quản lý tại các doanh nghiệp trong nước và quốc tế. Theo khảo sát của Viện Sau đại học và Lãnh đạo HSU năm 2025, 95% học viên bày tỏ sự hài lòng với chất lượng chương trình đào tạo, tính ứng dụng và môi trường học tập năng động, đa ngành.
Phát biểu tại buổi lễ, PGS.TS Nguyễn Hữu Huy Nhựt - Phó Hiệu trưởng, phụ trách Trường Đại học Hoa Sen chia sẻ: “Trong một thập kỷ đào tạo các chương trình sau đại học, HSU tự hào đã cung cấp nguồn nhân lực chất lượng cao cho cả nước với hơn 1000 cựu thạc sĩ - hiện đã thành danh và tạo dựng được sự nghiệp của riêng mình”.
Theo thầy, 3 phẩm chất đặc trưng của học viên HSU là tinh thần nghiên cứu, tư duy phản biện và năng lực để ứng dụng tri thức vào thực tiễn. Những điều đó được tích lũy từng ngày thông qua chương trình đào tạo chuẩn quốc tế và thực chiến. Đặc biệt, 2 chương trình MBA và MAE của HSU đã được bảo chứng chất lượng bởi AUN-QA - Mạng lưới các trường đại học Đông Nam Á. Đồng thời, các học viên còn được đào tạo bởi Ban giảng huấn là những nhà sáng lập, điều hành, nhân sự cấp cao của các tập đoàn, tổng công ty và các nhà khoa học giàu kinh nghiệm trong giảng dạy, nghiên cứu của HSU.
Tại lễ tốt nghiệp, tân thạc sĩ Đỗ Như Thảo (Thủ khoa MAT) - Phó Giám đốc Nhân sự hành chánh kiêm Trưởng phòng chăm sóc khách hàng và quản lý chất lượng Công ty TNHH MTV Dịch vụ Lữ hành Saigontourist cho biết: “Tôi tự tin cho rằng, việc học thạc sĩ không chỉ để nhận một tấm bằng, mà để chúng tôi tự tin khẳng định rằng: tri thức chỉ thật sự có giá trị khi được sẻ chia và cống hiến. Bởi, trong bối cảnh toàn cầu không ngừng thay đổi, tri thức đã trở thành nền tảng giúp con người thích ứng, sáng tạo và lan tỏa những giá trị tốt đẹp, vì giá trị con người và sự phát triển bền vững của toàn xã hội”.
Cũng trong khuôn khổ buổi lễ, HSU đã tổ chức lễ khai giảng năm học mới, hướng đến mục tiêu bồi dưỡng tinh thần doanh chủ, phát triển đội ngũ lãnh đạo kế thừa, đồng thời tăng cường kết nối cộng đồng học viên tinh hoa.
Đứng trước những thách thức mới, Phó Viện trưởng Viện Sau đại học & Lãnh đạo HSU - ThS Nguyễn Bảo Anh nhắn nhủ các tân thạc sĩ và học viên: “Tri thức là hành trình không có điểm dừng. Mỗi chúng ta hãy luôn giữ khát vọng học hỏi, dám bước ra khỏi vùng an toàn để đương đầu với thử thách, bền bỉ theo đuổi đam mê và đóng góp giá trị tích cực cho cộng đồng”.
ThS Nguyễn Bảo Anh đồng thời cho biết, trong năm học 2025-2026, Viện sẽ không ngừng xây dựng môi trường học tập năng động và đào tạo theo hướng ứng dụng, tinh gọn, hiệu quả. Bên cạnh việc thường xuyên cập nhật các kiến thức mới, Viện sẽ đẩy mạnh đưa vào chương trình học các nghiên cứu điển hình cũng như những buổi tập huấn từ chuyên gia đầu ngành và hội thảo với diễn giả nổi tiếng trong lĩnh vực quản trị, công nghệ, tài chính, giáo dục…"
https://tienphong.vn/cac-truong-quan-doi-tuyen-bo-sung-he-dan-su-post1776336.tpo,Các trường quân đội tuyển bổ sung hệ dân sự,"TPO - Học viện Hậu cần, Khoa học Quân sự, Đại học Thông tin liên lạc tuyển bổ sung hàng trăm chỉ tiêu các ngành thuộc khối ngôn ngữ, kinh tế, công nghệ, kỹ thuật.","Học viện Khoa học Quân sự tuyển ba ngành gồm: Ngôn ngữ Anh, Nga và Trung Quốc bằng các phương thức xét điểm thi tốt nghiệp THPT, điểm đánh giá năng lực của Đại học Quốc gia Hà Nội và TPHCM với ngưỡng nhận hồ sơ từ 19-20,81. Thí sinh nộp hồ sơ từ nay đến 15/9.
Theo đó, chỉ tiêu, tổ hợp, ngưỡng điểm nhận hồ sơ như sau:
Thí sinh chưa trúng tuyển hoặc đã trúng tuyển những chưa xác nhận nhập học vào bất kỳ cơ sở đào tạo nào.
Mức điểm nhận hồ sơ xét tuyển: Thí sinh có tổng cộng điểm xét tuyển (sau khi quy đổi các chứng chỉ thành điểm môn ngoại ngữ và quy đổi điểm ĐGNL HSA và APT về thang điểm 30).
+ Ngành ngôn ngữ Anh: Từ 19.00 điểm trở lên
+ Ngành ngôn ngữ Nga: Từ 19.38 điểm trở lên.
+ Ngành ngôn ngữ Trung Quốc: Từ 20.81 điểm trở lên.
Tổng chỉ tiêu dự kiến tuyển bổ sung 73 chỉ tiêu, trong đó:
+ Ngành ngôn ngữ Anh: 29 chỉ tiêu.
+ Ngành ngôn ngữ Nga: 27 chỉ tiêu.
+ Ngành ngôn ngữ Trung Quốc: 17 chỉ tiêu.
Trường Đại học Thông tin liên lạc còn 20 chỉ tiêu ngành Công nghệ thông tin và 20 ngành Kỹ thuật Điện tử - Viễn thông, tuyển đến 15/9. Điểm xét tuyển là 19,5.
Thí sinh có thể đăng ký xét bằng điểm thi tốt nghiệp THPT các tổ hợp A00, A01, C01 và X06, hoặc dùng điểm thi đánh giá năng lực của Đại học Quốc gia Hà Nội và TP HCM.
Học viện Hậu cần cũng thông báo tuyển bổ sung hơn 240 sinh viên cho ba ngành Tài chính - Ngân hàng (37 chỉ tiêu), Kế toán (135), Kỹ thuật xây dựng (69). Thời gian nhận hồ sơ đến 14/9.
4 tổ hợp xét tuyển gồm A00 (Toán, Lý, Hóa), A01 (Toán, Lý, Anh), C01 (Toán, Văn, Lý), X06 (Toán, Lý, Tin).
Điểm sàn nhận hồ sơ xét theo điểm thi tốt nghiệp THPT là 18/30, điểm đánh giá năng lực của Đại học Quốc gia Hà Nội và TP HCM lần lượt là 74/150 và 603/1200. Tất cả sau đó được quy đổi về thang 30.
Các trường quân đội được tuyển sinh hệ dân sự từ năm 2002, nhưng đến năm 2017-2021 thì dừng, nhằm đổi mới, sắp xếp tổ chức.
Năm 2025, 13 trường quân đội được giao đào tạo hệ dân sự với tổng cộng hơn 3.200 chỉ tiêu, trong đó Học viện Kỹ thuật quân sự có 755 chỉ tiêu, Học viện Hậu cần 460 chỉ tiêu, Học viện Quân y 630 chỉ tiêu, và Học viện Khoa học Quân sự 250 chỉ tiêu. Một số trường khác như Học viện Chính trị, Trường Sĩ quan thông tin cũng được giao nhiệm vụ đào tạo hệ dân sự từ năm 2025."
https://tienphong.vn/nganh-hoc-nong-mua-tuyen-sinh-2025-nhieu-diem-chuan-cham-moc-kich-tran-30-diem-post1774449.tpo,Ngành học “nóng” mùa tuyển sinh 2025: Nhiều điểm chuẩn chạm mốc kịch trần 30 điểm,"HHTO - Mùa tuyển sinh đại học 2025 ghi nhận nhiều ngành có điểm chuẩn đạt mức kịch trần, phản ánh sức hút đặc biệt của một số ngành đào tạo cũng như sự cạnh tranh gay gắt trong kỳ tuyển sinh năm nay.","Theo công bố chính thức, có 6 ngành thuộc 4 cơ sở đào tạo công lập có điểm chuẩn đạt mức tuyệt đối. Cụ thể, ngành Y khoa (Học viện Quân y - đối tượng Nữ khu vực miền Bắc) và ngành Quan hệ quốc tế (Học viện Khoa học Quân sự - đối tượng Nữ) yêu cầu điểm trúng tuyển là 30 điểm. Ngoài ra, các ngành Sư phạm tiếng Anh và Sư phạm tiếng Trung tại Trường Đại học Ngoại ngữ (Đại học Quốc gia Hà Nội) và Đại học Ngoại ngữ (Đại học Huế) cũng đều có điểm chuẩn chạm trần.
Hàng loạt ngành khác cũng ghi nhận điểm chuẩn tiệm cận 30. Ngành Khoa học máy tính (Chương trình tiên tiến) của Trường Đại học Khoa học Tự nhiên (Đại học Quốc gia TP.HCM) đạt mức 29,92 điểm; ngành Sư phạm Lịch sử - Địa lý (Đại học Giáo dục, ĐH Quốc gia Hà Nội) đạt 29,84 điểm; ngành Trí tuệ nhân tạo (Đại học Công nghệ - ĐH Quốc gia TP.HCM) có mức 29,6 điểm.
Một số ngành khác cũng ở mức rất cao như Sư phạm Tiếng Anh (ĐH Sư phạm Kỹ thuật TP.HCM) với 29,57 điểm; AI (chương trình tiên tiến) tại Đại học Bách khoa Hà Nội và ĐH Khoa học Tự nhiên - ĐH Quốc gia TP.HCM đạt 29,39 điểm; Sư phạm Hóa học (ĐH Sư phạm TP.HCM) với 29,38 điểm; hay Tâm lý học (ĐH Khoa học xã hội và Nhân văn - ĐH Quốc gia Hà Nội) 29,00 điểm.
Các chuyên gia cho rằng nguyên nhân dẫn tới điểm chuẩn cao kỷ lục này xuất phát từ nhiều yếu tố. Trước hết là do chỉ tiêu tuyển sinh của các ngành, đặc biệt là khối Sư phạm ngoại ngữ - khá hạn chế so với lượng thí sinh đăng ký.
Bên cạnh đó, việc cộng điểm ưu tiên cho thí sinh đoạt giải học sinh Giỏi, tham gia các kỳ thi Olympic, cũng như quy đổi chứng chỉ Ngoại ngữ quốc tế (như IELTS từ 7.5 được tính điểm tuyệt đối môn tiếng Anh) đã tạo ra lợi thế lớn, khiến phổ điểm cao hơn hẳn so với mặt bằng chung. Ngoài ra, sức hút nghề nghiệp và chính sách hỗ trợ sinh viên sư phạm trong những năm gần đây cũng góp phần làm tăng tỷ lệ đăng ký vào các ngành này.
Thí sinh trúng tuyển cần lưu ý hoàn tất thủ tục xác nhận nhập học trực tuyến trên hệ thống của Bộ GD&ĐT trước 17h ngày 2/9/2025.
Năm 2025 được đánh giá là một trong những mùa tuyển sinh cạnh tranh gay gắt nhất từ trước đến nay, khi nhiều ngành không chỉ đạt mức điểm chuẩn “kịch trần” mà còn cho thấy xu hướng chuyển dịch mạnh mẽ của thí sinh sang các lĩnh vực công nghệ, sư phạm ngoại ngữ và y dược."
https://tienphong.vn/bo-gddt-gia-han-them-thoi-gian-xac-nhan-nhap-hoc-truc-tuyen-dot-1-tren-he-thong-post1774259.tpo,Bộ GD&ĐT gia hạn thêm thời gian xác nhận nhập học trực tuyến đợt 1 trên hệ thống,"HHTO - Bộ GD&ĐT vừa thông báo điều chỉnh lịch xác nhận nhập học trực tuyến đợt 1 trên hệ thống tuyển sinh chung. Thay vì kết thúc vào 17h ngày 30/8/2025 như kế hoạch ban đầu, thời hạn mới được gia hạn thêm 3 ngày.","Cụ thể, theo thông báo từ Bộ GD&ĐT, thay vì kết thúc xác nhận nhập học trực tuyến đợt 1 vào 17h ngày 30/8/2025 như kế hoạch ban đầu, thời hạn mới được gia hạn thêm 3 ngày, thời gian xác nhận sẽ được kéo dài đến 17h ngày 2/9/2025.
Quyết định này được đưa ra sau khi xảy ra sự cố kỹ thuật và sai sót trong khâu xử lý dữ liệu, khiến nhiều thí sinh rơi vào tình trạng “trúng tuyển nhưng lại thành trượt” hoặc ngược lại. Một số trường đại học như Đại học Sư phạm TP.HCM, Đại học Tài chính - Marketing, Đại học Ngân hàng TP.HCM, Đại học Ngoại thương… đã ghi nhận phản ánh của thí sinh và báo cáo Bộ để kịp thời khắc phục.
Đại diện Bộ GD&ĐT cho biết việc gia hạn nhằm đảm bảo quyền lợi tối đa cho thí sinh, tránh để bất kỳ trường hợp nào mất cơ hội nhập học vì lỗi hệ thống. Các trường được yêu cầu phối hợp rà soát và điều chỉnh danh sách trúng tuyển, đồng thời cập nhật chính xác thông tin lên hệ thống tuyển sinh chung.
Thời gian qua, một số cơ sở đào tạo đã bước đầu hoàn tất khắc phục. ĐH Tài chính - Marketing đã sửa dữ liệu cho 75 thí sinh bị ảnh hưởng, trong khi ĐH Sư phạm TP.HCM đang phối hợp cùng 64 trường khác để giải quyết triệt để các trường hợp “trượt oan”.
Bộ GD&ĐT nhấn mạnh mọi thí sinh đủ điều kiện trúng tuyển chắc chắn sẽ được đảm bảo quyền nhập học. Việc gia hạn thêm thời gian xác nhận không ảnh hưởng đến các mốc tuyển sinh tiếp theo, đồng thời tạo điều kiện cho các trường và thí sinh xử lý các vấn đề phát sinh một cách đầy đủ, chính xác.
Thí sinh cần thường xuyên truy cập hệ thống tuyển sinh chungtại đâyđể kiểm tra kết quả, đồng thời theo dõi thông báo chính thức từ trường đã trúng tuyển. Trong trường hợp có sai lệch, cần liên hệ ngay với cơ sở đào tạo để được xử lý kịp thời."
https://tienphong.vn/diem-san-cham-day-loat-truong-dai-hoc-van-xet-tuyen-bo-sung-hang-ngan-chi-tieu-post1772750.tpo,"Điểm sàn chạm 'đáy', loạt trường đại học vẫn xét tuyển bổ sung hàng ngàn chỉ tiêu","TPO - Dù điểm chuẩn chỉ ở mức 15 -16 điểm song chưa hết thời hạn xét tuyển đợt 1, nhiều trường đại học tại TPHCM vẫn tiếp tục tuyển bổ sung đợt 2.","Hôm nay sẽ kết thúc đợt 1 xét tuyển đại học năm 2025, nhiều trường đại học cả công lẫn tư thục đã vội thông báo xét tuyển bổ sung với số lượng hàng ngàn chỉ tiêu.
Cụ thể,Trường ĐH Quốc tế Sài Gòntuyển bổ sung 350 chỉ tiêu cuối cho 29 chuyên ngành đào tạo bậc ĐH. Thời gian nhận hồ sơ xét tuyển bổ sung đến hết ngày 10/9. ThS Cao Quảng Tư, Giám đốc tuyển sinh Trường ĐH Quốc tế Sài Gòn, cho biết trường áp dụng 3 phương thức:
Xét tuyển bằng học bạ lớp 12: Tổng điểm 3 môn thuộc tổ hợp xét tuyển đạt từ 18 trở lên;
Xét tuyển kết quả kỳ thi THPT 2025: Thí sinh cần tốt nghiệp THPT 2025 và đạt mức điểm tổ hợp 3 môn từ 15 - 18 trở lên theo từng chuyên ngành;
Xét tuyển kết quả kỳ thi đánh giá năng lực của ĐHQG TP HCM tổ chức năm 2025. Mức điểm nhận hồ sơ từ 600 (theo thang điểm 1.200).
Mức điểm chi tiết của từng phương thức như bảng sau:
TạiTrường ĐH Hùng Vương TP.HCM, ở đợt 2 sẽ tuyển bổ sung 12 ngành học theo hai phương thức: Xét tuyển dựa trên kết quả kỳ thi tốt nghiệp THPT năm 2025 và xét tuyển từ kết quả học bạ lớp 12.
Trong đó, đối với ngành Luật, mức điểm xét tuyển từ kỳ thi tốt nghiệp THPT được quy định từ 18 điểm trở lên, trong đó Toán và Ngữ văn (hoặc Toán, hoặc Ngữ văn trong tổ hợp) phải đạt tối thiểu 6 điểm. Nếu xét bằng học bạ, thí sinh cần đạt điểm trung bình cộng các môn lớp 12 nhân hệ số ba từ 18 điểm, đồng thời Toán và Ngữ văn không dưới 6 điểm.
Ở các ngành còn lại, mức điểm nhận hồ sơ theo kết quả thi THPT chỉ từ 15 điểm. Đây là mức điểm thấp nhất trong mùa tuyển sinh năm 2025 này. Ở phương thức xét học bạ, trường cũng chỉ yêu cầu điểm trung bình cộng nhân hệ số ba đạt từ 17 điểm trở lên. Trong số này, có nhiều ngành hot như: Công nghệ thông tin, Tài chính ngân hàng, Thương mại điện tử, Marketing…
Tương tự,Trường ĐH Ngoại ngữ – Tin học TP.HCM (HUFLIT)nhận hồ sơxét tuyển bổ sungtrực tuyến 100% cho 23 ngành đào tạo hệ chính quy từ nay đến hết ngày 31/8.
Trường áp dụng ba phương thức xét tuyển với mức điểm xét tuyển rất thấp và cũng là điểm chuẩn trước đó của trường. Trong đó, xét điểm thi tốt nghiệp THPT chỉ từ 15 điểm theo tổ hợp ba môn, học bạ lớp 12 từ 18 điểm và kết quả thi đánh giá năng lực ĐH Quốc gia TP.HCM (từ 500 điểm). Thí sinh đăng ký tài khoản và nộp hồ sơ tại website tuyển sinh của trường, kết quả sẽ được phản hồi sau 3-4 ngày.
Trường ĐH Văn Langthông báo xét tuyển bổ sung vào 59 ngành đào tạo ĐH hệ chính quy với 5 phương thức tuyển sinh: Xét điểm thi tốt nghiệp THPT, xét học bạ THPT, xét điểm thi đánh giá năng lực ĐHQG TP HCM tổ chức, xét tuyển kết hợp thi tuyển các môn năng khiếu, xét tuyển theo kết quả thi đánh giá đầu vào ĐH trên máy tính (V-SAT).
Mức điểm nhận hồ sơ xét tuyển bổ sung cụ thể như sau:
Trường ĐH Gia Địnhthông báo tuyển bổ sung 371 chỉ tiêu cho 8 ngành: Trí tuệ nhân tạo, kinh doanh quốc tế, công nghệ thông tin, tài chính ngân hàng, quan hệ công chúng, công nghệ truyền thông, công nghệ tài chính, ngôn ngữ Anh.
Phương thức xét tuyển:
- Điểm thi tốt nghiệp THPT 2025: từ 15 điểm
- Điểm học bạ THPT 2025: từ 16 điểm
- Điểm thi đánh giá năng lực ĐHQG TP HCM 2025: từ 550 điểm
Trường ĐH Quốc tế Hồng Bàng xét bổ sung đến ngày 31/8 cho các ngành: Dược, Điều dưỡng, Hộ sinh, Kỹ thuật hình ảnh y học, Kỹ thuật xét nghiệm, Y tế công cộng, Dinh dưỡng, Quản trị kinh doanh, Tài chính - Ngân hàng, Kế toán, Công nghệ tài chính, Quản trị khách sạn, Quản trị sự kiện, Thương mại điện tử, Ngôn ngữ Anh, Nhật, Trung, Hàn; Quan hệ quốc tế, Công nghệ thông tin, Logistics, Kỹ thuật y sinh, Công nghệ sinh học, Thiết kế đồ họa, Kiến trúc, Tâm lý học, Truyền thông đa phương tiện, Quan hệ công chúng, Luật, Quản lý giáo dục, Việt Nam học. Mức nhận hồ sơ từ 15 đến 17 điểm.
Trường Đại học Nguyễn Tất Thànhxét tuyển bổ sung từ ngày 25/8 với mức điểm nhận hồ sơ tương đương mức điểm chuẩn đã công bố trước đó. Xét tuyển bổ sung trên 3 phương thức: điểm thi tốt nghiệp THPT, điểm học bạ THPT và kết quả bài thi đánh giá năng lực ĐH Quốc gia TPHCM và ĐH Quốc gia Hà Nội.
Ngành Y khoa: điểm thi tốt nghiệp THPT từ 20,5; điểm học bạ từ 23; điểm đánh giá năng lực ĐHQG TPHCM từ 650; điểm đánh giá năng lực ĐHQG Hà Nội từ 85.
Mức điểm nhận hồ sơ với ngành Răng - Hàm - Mặt lần lượt là 20,5; 23; 600; 75 điểm.
Ngành Dược học và Y học cổ truyền lần lượt là 19; 21; 570; 70. Ngoài ra để xét tuyển vào 4 ngành học trên, thí sinh cần có kết quả học tập cả năm lớp 12 được đánh giá mức Tốt hoặc điểm xét tốt nghiệp từ 8 trở lên.
Mức điểm nhận hồ sơ các ngành Y học dự phòng, Điều dưỡng, Kỹ thuật xét nghiệm y học, Kỹ thuật phục hồi chức năng là 17; 19 điểm; 550; 70. Thí sinh cũng cần có kết quả học tập cả năm lớp 12 được đánh giá mức Khá hoặc điểm xét tốt nghiệp từ 6,5 trở lên.
Các ngành Luật, Luật kinh tế, Luật kinh tế (chương trình chuẩn quốc tế) là 17 điểm xét tốt nghiệp và 18 điểm xét học bạ.
Các ngành còn lại là 15; 18 điểm; 550 và 70 điểm.
Ở khối công lập cóTrường ĐH Công Thương TP.HCMcũng thông báo xét bổ sung các ngành Công nghệ chế biến thủy sản, Công nghệ vật liệu (hệ chính quy) và Quản trị kinh doanh (chương trình liên kết quốc tế), mỗi ngành khoảng 30 chỉ tiêu. Điểm nhận hồ sơ từ 16-17 điểm. Trường áp dụng nhiều phương thức xét tuyển và có chính sách hỗ trợ 50% học phí học kỳ 1 cho thí sinh trúng tuyển. Hạn cuối nhận hồ sơ là ngày 20/9.
Trường Đại học Tôn Đức Thắng thông báo xét tuyển bổ sung năm 2025, với mức điểm nhận hồ sơ bằng hoặc tương đương điểm chuẩn đợt 1 bằng ba phương thức: dựa trên kết quả học tập THPT; kết quả thi THPT năm 2025; và kết quả bài thi đánh giá năng lực năm 2025 của Đại học Quốc gia TPHCM..."
