url,title,description,content
https://tienphong.vn/nhom-bi-cao-la-cuu-can-bo-cong-chuc-neu-muon-van-ly-do-khi-vao-khach-san-pullman-danh-bac-post1792211.tpo,"Nhóm bị cáo là cựu cán bộ, công chức nêu muôn vàn lý do khi vào khách sạn Pullman đánh bạc","TPO - Trả lời xét hỏi, các bị cáo là cựu cán bộ, công chức đã khai muôn vàn lý do vào khách sạn Pullman đánh bạc, như vì tò mò, để giải trí, giải tỏa áp lực, thậm chí đi đánh bạc vì gặp biến cố gia đình...","Không bị phát hiện vẫn tiếp tục 'gỡ'
Ngày 31/10, phiên xét xử 141 bị cáo phạm tội đánh bạc và tổ chức đánh bạc tại khách sạn Pullman (Hà Nội) tiếp tục phần xét hỏi.
Trả lời Hội đồng xét xử, bị cáoTạ Quốc Thịnh(SN 1980, cựu Phó Hiệu trưởng Trường Đại học Hùng Vương) khai, nhân dịp đi Hà Nội đào tạo nâng cao, buổi tối ông tìm đến câu lạc bộ King Club (trong tầng 1 khách sạn Pullman) để giải trí.
Theo ông Thịnh, mỗi lần chơi ông mang theo 10 - 20 triệu đồng. Hết thời gian đào tạo, ông Thịnh chơi thua hơn 1 tỷ đồng.
Viện Kiểm sát quy kết, ông Thịnh mở thẻ đánh bạc 53 lần, bằng hình thức chơi Roulette, Baccarat, với tổng số tiền hơn 137.597 USD.
Tương tự như Thịnh, bị cáoĐỗ Anh Tuấn, cựu Chi Cục trưởng thuộc Sở Nông nghiệp phát triển nông thôn tỉnh Phú Thọ) khai nhân thời gian đi công tác đã tìm đến sòng bạc vì ""biến cố gia đình"".
Theo ông Tuấn, thời điểm đó nhà xảy ra nhiều chuyện “nên chán, chơi bạc để giải tỏa căng thẳng"". Ông chơi 84 lần với tổng số tiền 877.511 USD (tương đương khoảng 23 tỷ đồng). Mỗi lần vào chơi bị cáo mang từ 20 - 30 triệu đồng, do chơi thua, muốn gỡ nhưng kết quả không như mong muốn.
""Nếu cơ quan điều tra không phát hiện ra thì ông vẫn đi gỡ tiếp à?"", Chủ tọa hỏi. Ông Tuấn trả lời “vâng”.
Trong cáo trạng, Viện kiểm sát quy kết ông Tuấn chơi thua hơn 4,5 tỷ đồng.
Cũng là cựu công chức nhà nước, bị cáoTô Thị Thu Hương, khi phạm tội là cán bộ thuộc Bảo tàng tỉnh Phú Thọ. Người phụ nữ này chơi số tiền 944.000 USD (khoảng 25 tỷ đồng), lần chơi nhiều nhất lên tới 59.630 (khoảng 1,6 tỷ đồng).
Bà Hương cho hay mỗi lần chơi ngồi khoảng 1 - 2 tiếng, nếu thua đến 5.000 USD, người của King Club sẽ hoàn tiền vì các chương trình kích cầu của King Club, ""khách thua càng nhiều thì hoàn tiền càng cao"".
""Bị cáo là người công tác trong cơ quan nhà nước, xuống dưới này làm gì mà trong 4 tháng xuống đánh bạc tới 69 lần?"", Chủ tọa hỏi. Bà Hương trả lời ngoài công tác ngày hành chính còn thăm bạn bè vào thứ bảy, chủ nhật.
“Nguồn tiền đánh bạc là tự thân bị cáo tích cóp, khi chơi bị cáo biết nhiều người cùng quê nhưng không rủ”, bà Hương khai.
Bị cáo một mực khẳng định không phạm tội
Còn ông Nguyễn Xuân Huệ (cựu Phó phòng thuộc Văn phòng UBND tỉnh Phú Thọ) bị quy kết đến King Club 61 lần đánh bạc với tổng số tiền 447.080 USD (12 tỷ đồng).
Theo ông Huệ khai, lý do đánh bạc vì “tò mò”. “Tò mò thì chơi một lần biết rồi thì thôi, đây lại chơi tới tận 61 lần?”, Chủ tọa hỏi. Ông Huệ không nói gì.
Lời khai của ông Huệ còn thể hiện, ông này đã cùng với ông Hồ Đại Dũng (cựu Phó chủ tịch UBND tỉnh Phú Thọ) mở thẻ đánh bạc vào ngày 6/6/2020 khi đi công tác và ở cùng khách sạn.
Trong vụ án, ông Hồ Đại Dũng đánh bạc tổng số tiền hơn 7 triệu USD, thua gần 1 triệu USD. Phiên tòa ông Dũng xin xét xử vắng mặt, được chấp thuận.
Ngoài các cựu quan chức, một số bị cáo làm doanh nghiệp, lao động tự do cũng khai báo thành khẩn. Điểm chung của họ “nguyên nhân tìm đến sòng bạc là tò mò, muốn vui chơi giải trí sau những biến cố gia đình hoặc gặp chuyện buồn trong công việc”.
Như bị cáo Uông Trường Giang (SN 1974, ở TP HCM, làm tự do) bị cáo buộc mở thẻ với tên “Mrs Ryan” vào tháng 10/2022, đã đánh bạc 36 lần bằng hình thức chơi Slot, Roulette, Baccarat, với tổng số tiền hơn 215.000 USD. Lần chơi nhiều nhất hơn 66.000 USD (tương đương hơn 1,5 tỷ đồng). Bị cáo thua hơn 20.000 USD (tương đương khoảng 500 triệu đồng).
Tại phiên tòa, ông Giang không thừa nhận hành vi của mình là đánh bạc, cho rằng đó là trò “vui chơi có thưởng”.
“Vậy là bị cáo không nhận thức được hành vi phạm tội của mình, về lại tiếp tục chơi, vẫn tiếp tục vi phạm pháp luật?”, Chủ tọa hỏi gắt. Ông Giang tiếp tục khẳng định “Tôi không vi phạm pháp luật. Không phải tôi không nhận thức ra, mà tôi không phạm tội. Số liệu quy kết các lần và tổng số tiền bị cáo đánh bạc không đúng, bị cáo ngạc nhiên về số tiền này”."
https://tienphong.vn/ca-mau-khoi-to-11-vu-an-vi-pham-chong-khai-thac-iuu-post1792194.tpo,Cà Mau khởi tố 11 vụ án vi phạm chống khai thác IUU,"TPO - Trong công tác chống khai thác thủy sản bất hợp pháp, không báo cáo và không theo quy định (IUU), các ngành chức năng tỉnh Cà Mau đã khởi tố 11 vụ án, chủ yếu liên quan đến tàu vi phạm vùng biển nước ngoài, sử dụng giấy tờ giả hoặc tổ chức xuất nhập cảnh trái phép. Hiện Cà Mau có đội tàu cá lớn nhất cả nước.","Sáng 31/10, Thứ trưởng Bộ Nông nghiệp và Môi trường - Phùng Đức Tiến làm việc với UBND tỉnh Cà Mau về chống khai thác thủy sản bất hợp pháp, không báo cáo và không theo quy định(IUU)trên địa bàn tỉnh.
Ông Lê Văn Sử - Phó Chủ tịch UBND tỉnhCà Maucho biết, hiện toàn tỉnh có hơn 5.200 tàu cá đang hoạt động, trong đó hơn 1.900 tàu dài từ 15m trở lên – nhóm bắt buộc phải lắp đặt thiết bị giám sát hành trình (VMS). Trong 10 tháng năm nay, tỉnh Cà Mau đã chi hơn 7,5 tỷ đồng hỗ trợ cước thuê bao dịch vụ giám sát hành trình cho tàu cá.
Theo ông Sử, Cà Mau đã phát hiện và xử lý hơn 470 vụ vi phạm hành chính trong lĩnh vực thủy sản, trong đó 43 vụ vi phạm ngắt kết nối VMS. Về hình sự, lực lượng chức năng đã khởi tố 11 vụ án, chủ yếu liên quan đến tàu vi phạm vùng biển nước ngoài, sử dụng giấy tờ giả hoặc tổ chức môi giới xuất nhập cảnh trái phép.
Trong đó, 6 vụ đã được đưa ra xét xử, 5 vụ còn lại dự kiến xét xử trước ngày 15/11. Việc xử lý nghiêm minh đã tạo hiệu ứng răn đe, góp phần củng cố hình ảnh Việt Nam trong nỗ lực gỡ “thẻ vàng” của Ủy ban châu Âu (EC).
Dù vậy, ông Sử nhìn nhận, tỉnh cũng gặp khó trong quản lý tàu cá sang nhượng chưa khai báo, cập nhật số hóa chưa đồng bộ. Một số vụ vi phạm ở nước ngoài chưa thể xử lý do ngư dân chưa về nước. Cán bộ chuyên trách sau sắp xếp đơn vị hành chính còn thiếu, gây áp lực trong triển khai nhiệm vụ.
Thứ trưởng Bộ Nông nghiệp và Môi trường - Phùng Đức Tiến ghi nhận nỗ lực của tỉnh Cà Mau trong chống khai thác IUU. ""Cà Mau có đội tàu cá lớn nhất cả nước, vì vậy kết quả chống khai thác IUU của tỉnh mang ý nghĩa rất quan trọng đối với mục tiêu chung của Việt Nam trong việc gỡ ‘thẻ vàng’ EC"", ông Tiến nói.
Ông Tiến đề nghị tỉnh Cà Mau tiếp tục rà soát, truy vết triệt để tàu cá vi phạm, tăng cường kỷ luật hành chính và đảm bảo dữ liệu nghề cá luôn cập nhật, minh bạch."
https://tienphong.vn/mot-facebooker-o-ha-noi-bi-xu-phat-vi-dang-tin-sai-su-that-post1792119.tpo,Một Facebooker ở Hà Nội bị xử phạt vì đăng tin sai sự thật,"TPO - Phòng An ninh mạng và phòng, chống tội phạm sử dụng công nghệ cao, Công an TP Hà Nội vừa xử phạt 1 trường hợp đăng tải thông tin sai sự thật trên Facebook.","Trước đó, qua công tác nắm tình hình trên không gian mạng, Phòng An ninh mạng và phòng, chống tội phạm sử dụng công nghệ cao, Công an TP Hà Nội phát hiện bài viết từ 1 tài khoản Facebook đăng tải nội dung sai sự thật về vụ án cơ quan Công an đang điều tra, thu hút nhiều lượt tương tác.
Cơ quan chức năng đã xác minh và làm việc với chủ tài khoản là T.Q.A (trú tại phường Hoàng Mai, TP Hà Nội). Tại cơ quan Công an, T.Q.A đã thừa nhận hành vi vi phạm và gỡ bỏ bài viết sai sự thật.
Ngày 29/10, Phòng An ninh mạng và phòng chống tội phạm sử dụng công nghệ cao, CATP Hà Nội đã ra quyết định xử phạt 7,5 triệu đồng đối với T.Q.A về hành vi“Cung cấp, chia sẻ thông tin giả mạo, thông tin sai sự thật, xuyên tạc, vu khống, xúc phạm uy tín của cơ quan, tổ chức, danh dự, nhân phẩm của cá nhân”.
Được biết, trên mạng xã hội T.Q.A có nhiều người theo dõi.
Công an TP Hà Nội đề nghị người dân không chia sẻ, viết bài, bình luận các thông tin không chính xác, thông tin chưa được kiểm chứng; tránh gây hoang mang dư luận, ảnh hưởng đến uy tín, quyền và lợi ích hợp pháp của các tổ chức, cá nhân. Mọi hành vi vi phạm sẽ bị xử lý nghiêm theo quy định của pháp luật."
https://tienphong.vn/nguoi-dan-ong-bi-sat-hai-trong-can-nha-khoa-trai-o-tphcm-nghi-do-mau-thuan-vo-chong-post1792029.tpo,"Người đàn ông bị sát hại trong căn nhà khóa trái ở TPHCM, nghi do mâu thuẫn vợ chồng","TPO - Công an xã Thái Mỹ, TPHCM phối hợp với các đơn vị nghiệp vụ Công an TPHCM lấy lời khai những người liên quan để điều tra làm rõ vụ án mạng xảy ra tại một căn nhà trên đường Trung Lập.","Theo thông tin ban đầu, rạng sáng 29/10, người dân khu vực nghe nhiều tiếng hô hoán, kêu cứu phát ra từ căn nhà nói trên. Khi chạy đến, họ thấy một phụ nữ trẻ hô lớn rằng cha ruột bị thương và đang nằm trong nhà bị khóa trái.
Lực lượng công an xã nhanh chóng có mặt, phá cửa tiếp cận hiện trường. Bên trong, một người đàn ông khoảng 60 tuổi được phát hiện bị thương rất nặng. Dù được đưa đi cấp cứu, nạn nhân đã không qua khỏi.
Tại thời điểm xảy ra vụ việc, trong nhà có 3 người gồm ông C., bà V. (khoảng 60 tuổi, vợ ông C.) và con gái. Bước đầu, cơ quan điều tra nhận định bà V. có thể đã dùng hung khí tấn công chồng, sau đó khóa cửa nhà. Con gái phát hiện sự việc nên hô hoán kêu cứu.
Hiện Công an TPHCM đang tiếp tục lấy lời khai, làm rõ nguyên nhân vụ việc.
Tối 30/10, trao đổi với Tiền Phong, một lãnh đạo xã Thái Minh cho biết đã yêu cầu công an vào cuộc điều tra báo cáo vụ việc."
https://tienphong.vn/thu-giu-tren-35-tan-chan-ga-ban-o-khu-vuc-bien-gioi-post1792069.tpo,"Thu giữ trên 3,5 tấn chân gà ‘bẩn’ ở khu vực biên giới","TPO - Qua các biện pháp nghiệp vụ, lực lượng chức năng tỉnh Lạng Sơn vừa phát hiện số lượng lớn chân gà không có nguồn gốc, xuất xứ nghi nhập lậu từ bên kia biên giới.","Ngày 31/10, Công an tỉnh Lạng Sơn cho biết, Phòng Cảnh sát kinh tế Công an tỉnh chủ trì phối hợp với lực lượng chức năng địa phương vừa kiểm tra hộ kinh doanh Tuấn Minh, địa chỉ tại thôn Bản Hoi, xã Lộc Bình, tỉnh Lạng Sơn, qua đó phát hiện hàng hóa là chân gà đã qua sơ chế, chế biến không có nhãn mác, thông tin nguồn gốc, xuất xứ với tổng trọng lượng trên 3.500kg.
Chủ hộ kinh doanh là bà Nông Thúy Hằng (SN 2004, trú tại khu Nhà Thờ, xã Lộc Bình, tỉnh Lạng Sơn) không xuất trình được giấy tờ chứng minh nguồn gốc, xuất xứ. Qua thẩm tra, số hàng trênnghi nhập lậutừ bên kia biên giới, tập kết tại xã Lộc Bình để phân loại, đóng gói rồi chuyển về các tỉnh, địa phương khác để tiêu thụ, bán vào các cửa hàng, nhà hàng, quán nhậu. Hiện các ngành chức năng Lạng Sơn tiếp tục điều tra, xử lý theo quy định của pháp luật."
https://tienphong.vn/bat-nhom-dieu-hanh-quan-bar-mua-ban-hang-chuc-nghin-qua-bong-cuoi-tai-tphcm-post1792038.tpo,"Bắt nhóm điều hành quán bar, mua bán hàng chục nghìn quả 'bóng cười' tại TPHCM","TPO - Theo điều tra ban đầu, mỗi tháng quán nhập từ 50–200 bình khí N₂O (loại 2kg) với giá 2,3–4,3 triệu đồng/bình. Trong sáu tháng đầu năm 2025, nhóm này đã bán ra hơn 65.500 quả bóng cười, thu lợi bất chính gần 7 tỷ đồng.","Ngày 31/10, Công an TP.HCM cho biết vừa triệt phá một tụ điểm bán khí cười (N₂O) hoạt động trái phép tại quán bar Destiny (số 16 Quốc Hương, phường An Khánh).
Qua kiểm tra, Phòng Cảnh sát kinh tế (PC03) phát hiện cơ sở này tàng trữ 21 bình khí N₂O và 40 quả bóng cười chưa sử dụng. Quán có 6 nhân viên, do Trương Ngọc Ẩn (sinh năm 1990) làm chủ, cùng các đồng phạm Sử Hữu Minh Kha, Nguyễn Diệp Huy và Lương Mộc Hân điều hành, quản lý, thu ngân.
Các đối tượng sử dụng nhiều nhóm Zalo, Viber để trao đổi, đặt mua khí N₂O và thống kê doanh thu hằng ngày. Quán bố trí khu vực riêng phục vụ bóng cười, hoạt động 24/24, chủ yếu đón khách sau 23 giờ để đối phó với cơ quan chức năng. Khi bị kiểm tra, nhân viên được chỉ đạo cất giấu bình khí.
Theo điều tra ban đầu, mỗi tháng quán nhập từ 50–200 bình khí N₂O (loại 2kg) với giá 2,3–4,3 triệu đồng/bình. Trong sáu tháng đầu năm 2025, nhóm này đã bán ra hơn 65.500 quả bóng cười, thu lợi bất chính gần 7 tỷ đồng.
Doanh thu từ bóng cười được ghi chép nội bộ, không kê khai sổ sách, và các đối tượng còn thay đổi tên mặt hàng trong menu, hóa đơn để che giấu hành vi vi phạm.
Các đối tượng khai biết rõ bóng cười là hàng cấm, gây hại sức khỏe nhưng vẫn kinh doanh. Cơ quan Cảnh sát điều tra – Công an TP.HCM đã khởi tố vụ án, khởi tố bị can và bắt tạm giam 4 đối tượng nêu trên về tội“Buôn bán hàng cấm”, đồng thời mở rộng điều tra đường dây cung cấp khí N₂O trên địa bàn.
Công an TP.HCM khuyến cáo người dân và các cơ sở kinh doanh tuyệt đối không tàng trữ, sử dụng, buôn bán khí N₂O, vì đây là mặt hàng bị Nhà nước cấm do gây ảnh hưởng nghiêm trọng đến sức khỏe và trật tự xã hội.
Trước đó, Công an TPHCM liên tục triệt phá nhiều nhà hàng, quán bar kinh doanh bóng cười. Trong đó, Nguyễn Thị Ngọc Anh (37 tuổi, biệt danh Miss Audition 2006) cùng 4 đồng phạm khác bị công an TPHCM khởi tố, bắt tạm giam để điều tra hành vi buôn bán, tàng trữ và tổ chức cho khách sử dụng khí N2O (khí cười) trái phép tại quán bar Lava..."
https://tienphong.vn/bat-ngo-tinh-tiet-vu-dot-nha-nguoi-tinh-lam-2-nguoi-tu-vong-post1792019.tpo,Bất ngờ tình tiết vụ đốt nhà người tình làm 2 người tử vong,"TPO - Duy uống thuốc trừ sâu rồi lẻn vào nhà thấy chị N. và anh C. ngủ với nhau nên đi mua một can xăng về rồi châm lửa đốt. Ngọn lửa khiến chị N. và anh C. tử vong, cháu T. bị bỏng nặng.","Ngày 30/10, Viện Kiểm sát nhân dân tỉnh Gia Lai cho biết, đơn vị này đã phối hợp với Cơ quan Cảnh sát Điều tra - Công an tỉnh Gia Lai thi hànhlệnh bắtbị can để tạm giam đối với Nguyễn Anh Duy (SN 2001, trú phường An Khê, Gia Lai) về tội “Giết người”.
Theo đó, chị T.T.T.N. (SN 1994, trú phường An Khê) và anh N.B.C. (SN 1992, trú phường An Khê) là vợ chồng với nhau và có một người con chung là cháu N.B.T. (SN 2020), đến năm 2024 đã ly hôn. Thời gian sau ly hôn, chị N. có quan hệ tình cảm và được Duy giúp đỡ trong quá trình kinh doanh tiệm Spa tại nhà ở đường Đỗ Trạc (phường An Khê, Gia Lai).Trong thời gian này, anh C.nhiều lần thách thứcđòi đánh nhau với Duy nhưng được chị N. can ngăn. Sau đó, giữa chị N. và Duy xảy ra mâu thuẫn cãi nhau.
Đến tối 18/10, anh C. đến tiệm Spa để chơi với con rồi ngủ lại, đến khoảng 00h ngày 19/10, sau khi uống thuốc diệt cỏ, Duy đi bộ đến tiệm Spa tìm chị N.giải quyết mâuthuẫn. Vì có thời gian ở căn nhà trên, Duy biết cửa bên hông nhà thường xuyên không khóa nên Duy mở cửa đi vào trong.
Tại đây, Duy thấy chị N. cùng anh C. đang nằm ngủ ở phòng cuối cùng của căn nhà nên đối tượng bực tức, nảy sinh ý định đốt nhà. Sau đó, Duy đi bộ sang nhà bên cạnh lấy một can nhựa màu vàng rồi đi xe ôm mua 400 nghìn đồng xăng, đựng vào can nhựa. Người xe ôm chở đến ngã ba Trần Phú - Trần Hưng Đạo, cách tiệm Spa khoảng 1km, Duy thì xuống xe đi bộ lại nhà chị N.
Đến nơi, Duy mở cửa chính căn nhà rồi đổ xăng vào phòng ngủ cùng nhiều nơi khác trong nhà. Lúc này, chị N. cùng với anh C. và cháu T. vẫn đang ngủ.
Sau khi tưới xăng, Duy cầm bật lửa đi vào căn phòng thứ nhất gần bếp nấu ăn rồi bật lửa đốt. Phát hiện cháy, anh C. đã ôm cháu nhỏ chạy ra đường nhưng cả 2 đều bị bỏng nặng, chị N. không chạy kịp nên tử vong ngay tại chỗ (đến ngày 28/10 anh C. tử vong, cháu C. đang được điều trị).
Sau khi châm lửa đốt, Duy kéo cửa tôn bên hông nhà và chạy ra đường. Do lửa cháy lớn nên Duy cũng bị ngạt khói, bỏng ở tai và mu bàn chân. Lúc này do ngấm thuốc cỏ đã uống trước đó nên Duy khó thở, bị bội nhiễm nên được đưa đến Trung tâm y tế An Khê cấp cứu và tiếp tục chuyển đến Bệnh viện đa khoa Trung tâm Gia Lai để điều trị.
Sau khi xác định tình trạng sức khỏe ổn định và được Bệnh viện Đa khoa tỉnh Gia Lai cho xuất viện, Cơ quan Cảnh sát điều tra - Công an tỉnh Gia Lai đã ra quyết định khởi tố bị can và lệnh bắt bị can để tạm giam đối với Nguyễn Anh Duy về tội “Giết người”."
https://tienphong.vn/bat-giu-nghi-can-sat-hai-cu-ba-72-tuoi-post1791998.tpo,Bắt giữ nghi can sát hại cụ bà 72 tuổi,TPO - Công an tỉnh Lâm Đồng đã bắt giữ nghi can liên quan vụ cụ bà 72 tuổi bị sát hại trong căn nhà cấp 4 ở xã Tuyên Quang.,"Chiều 30/10, Cơ quan Cảnh sát điều tra Công an tỉnh Lâm Đồng đã tạm giữ nghi can tên T. để điều tra vụ án một cụ bà 72 tuổi bịsát hạitrong căn nhà cấp 4 trên đường Âu Cơ, xã Tuyên Quang.
Theo điều tra ban đầu, chiều 29/10, người dân phát hiện bà N.T.N. (72 tuổi, trú xã Tuyên Quang, tỉnh Lâm Đồng) tử vong trong nhà riêng vớinhiều vết thương. Thời điểm lực lượng chức năng tiếp cận, nạn nhân nằm trên giường trong tình trạng bán khỏa thân và có vết thương sâu ở vùng cổ nghi do vật sắc nhọn gây ra. Hiện trường có dấu hiệu bị xáo trộn.
Qua trích xuất camera, công an phát hiện chiều cùng ngày có một thanh niên cởi trần đi vào nhà nạn nhân. Qua điều tra xác định người này tên T., sống gần nhà bà N. và thường xuyên sử dụng ma túy."
https://tienphong.vn/ha-noi-cong-an-moi-quai-xe-trinh-dien-boc-dau-xe-may-va-phu-huynh-len-lam-viec-post1791943.tpo,Hà Nội: Công an mời 'quái xế' trình diễn bốc đầu xe máy và phụ huynh lên làm việc,"TPO - CSGT Hà Nội đã xác minh, làm rõ nam tài xế xe máy không đội mũ bảo hiểm trình diễn ""bốc đầu"" trên đường, còn nhóm bạn đứng xem, cổ vũ.","Ngày 29/10, mạng xã hội lan truyền đoạn video ghi lại hình ảnh một nam thanh niên điều khiển xe máy không đội mũ bảo hiểm, thực hiện hành vi “bốc đầu” (đi bằng một bánh) trên đường Xuân Tảo, TP Hà Nội. Hành vi này gây bức xúc trong dư luận, tiềm ẩn nguy cơ mất an toàn giao thông.
Ngay sau khi nắm được thông tin, Trưởng phòng CSGT Công an TP Hà Nội đã chỉ đạo Đội CSGT đường bộ số 6 khẩn trương vào cuộc xác minh. Bằng các biện pháp nghiệp vụ, lực lượng chức năng đã xác định phương tiện và danh tính người điều khiển là L.Q.L (SN 2009, trú tại phường Tây Hồ, TP Hà Nội).
Tối cùng ngày, Đội CSGT đường bộ số 6 đã mời L và chủ phương tiện (bố của L) đến trụ sở làm việc. Tại cơ quan công an, L khai nhận sáng 29/10, đã mượn xe máy biển kiểm soát 29AD-176.XX của bố để đi học, sau đó không đội mũ bảo hiểm và thực hiện hành vi điều khiển xe đi bằng một bánh trên đường Xuân Tảo.
Căn cứ tài liệu xác minh, Đội CSGT đường bộ số 6 đã lập biên bản vi phạm hành chính đối với chủ phương tiện về hành vi “giao xe cho người không đủ điều kiện điều khiển phương tiện tham gia giao thông” với mức phạt 9 triệu đồng. Đối với L.Q.L, do thời điểm vi phạm chưa đủ 16 tuổi, cơ quan công an đã tạm giữ phương tiện và tiếp tục củng cố hồ sơ để xử lý theo quy định của pháp luật.
Phòng CSGT Công an TP Hà Nội khuyến cáo, hành vi điều khiển xe máy bốc đầu, không đội mũ bảo hiểm là vi phạm nghiêm trọng quy định về trật tự, an toàn giao thông. Lực lượng CSGT sẽ tiếp tục tăng cường kiểm tra, xử lý nghiêm các trường hợp vi phạm, đặc biệt là lứa tuổi thanh thiếu niên, nhằm bảo đảm an toàn cho người dân khi tham gia giao thông trên địa bàn."
https://tienphong.vn/ngon-lua-trum-kho-phe-lieu-trong-khu-dan-cu-nguoi-dan-hoang-loan-thao-chay-post1792354.tpo,"Ngọn lửa trùm kho phế liệu trong khu dân cư, người dân hoảng loạn tháo chạy","TPO - Tối 31/10, một vụ cháy lớn kèm nhiều tiếng nổ xảy ra tại kho phế liệu rộng khoảng 100 m² nằm sâu trong khu dân cư phường Bình Hưng Hòa (TP.HCM), khiến người dân hoảng loạn bỏ chạy.","Khoảng 18 giờ, người dân trên đường số 5, cách ngã tư Bốn Xã, phường Bình Hưng Hòa khoảng một km, phát hiện lửa bùng lên dữ dội từ một kho phế liệu đóng kín cửa. Khói đen cuồn cuộn bốc cao, kèm theo nhiều tiếng nổ lớn, làm cả khu phố náo loạn.
Một số người dân nhanh chóng kéo ống nước, dùng bình chữa cháy mini dập lửa nhưng bất thành do ngọn lửa lan nhanh, bao trùm toàn bộ nhà kho.
“Lửa bốc rất mạnh, sức nóng hầm hập. Cả nhà tôi phải ôm con nhỏ chạy ra ngoài vì khói đen tràn vào, ngột ngạt không thở được,” chị Hương, sống gần hiện trường, kể.
Chỉ khoảng 10 phút sau khi nhận tin báo, nhiều xe chữa cháy cùng hơn 20 cán bộ, chiến sĩ Phòng Cảnh sát PCCC & CNCH TP.HCM được điều đến hiện trường. Lực lượng nhanh chóng triển khai vòi rồng, phun nước khống chế đám cháy, ngăn lửa lan sang các nhà dân liền kề.
Sau khoảng 30 phút, ngọn lửa được dập tắt hoàn toàn. Vụ cháy không gây thương vong về người, nhưng nhiều vật dụng, phế liệu trong kho bị thiêu rụi.
Nguyên nhân và thiệt hại đang được lực lượng chức năng tiếp tục điều tra, làm rõ."
