url,title,description,content
https://tienphong.vn/dung-flycam-bay-anh-de-bao-ve-chim-yen-post1794236.tpo,"Dùng flycam, bẫy ảnh... để bảo vệ chim yến","TPO - Tài nguyên yến sào đang đứng trước nguy cơ bị sụt giảm nghiêm trọng, đòi hỏi con người phải ứng dụng các công nghệ như: Flycam, bẫy ảnh tiên tiến, thiết bị định vị và đặc biệt cần có chế tài xử phạt nghiêm minh để bảo vệ tài nguyên quý hiếm này.","Ngày 7/11, UBND tỉnh Khánh Hòa phối hợp cùng Công ty Yến sào Khánh Hòa tổ chức hội thảo khoa học với chủ đề “Bảo vệ vàphát triển bền vững quần thể chim yến”. Sự kiện quy tụ nhiều nhà khoa học, nhà quản lý, doanh nghiệp và đại diện các địa phương, nhằm tìm kiếm giải pháp bảo tồn nguồn tài nguyên thiên nhiên quý giá – đàn chim yến.
Tại hội thảo, các chuyên gia tập trung phân tích nhiều vấn đề nổi bật như: Tình hình phát triển và quản lý nghề nuôi chim yến ở Việt Nam, phòng chống săn bắt trái phép, xây dựng chuỗi giá trị ngành hàng yến, ứng dụng công nghệ hiện đại trong giám sát tài nguyên chim yến đảo…
Theo ông Võ Văn Công - Phó Giám đốc Sở Nông nghiệp và Môi trường Khánh Hòa, thời gian qua tình trạngsăn bắt chim yến trái phépđang ngày càng gia tăng. Các đối tượng giăng ""lưới tàng hình"" cùng với loa phát tiếng dẫn dụ chim yến tại nhiều cánh đồng, các vùng ven biển hay khu vực gần nhà nuôi yến.
""Tình trạng này làm suy giảm nghiêm trọng quần thể chim yến đảo, gây thiệt hại kinh tế cho người nuôi và doanh nghiệp cũng như ảnh hưởng đến nguồn tài nguyên quý"", ông Công nói.
Ông Công cho rằng, cần phát động phong trào ""3 không"": Không săn bắt, không buôn bán, không tiêu thụ chim yến trái phép. Tăng cường kiểm tra, xử lý nghiêm các nhà hàng, chợ, điểm kinh doanh hoặc phóng sinh có dấu hiệu vi phạm. Đồng thời tuyên truyền nâng cao ý thức của người dân trong việc bảo vệ chim yến.
Trong khi đó, PGS.TS. Nguyễn Lân Hùng Sơn – Trưởng khoa Sinh học, Đại học Sư phạm Hà Nội, nhấn mạnh: Bảo vệ yến sào không chỉ là bảo vệ nguồn lợi kinh tế mà còn là gìn giữ niềm tự hào văn hóa dân tộc.
Ông Sơn cũng cảnh báo quần thể chim yến đảo tự nhiên đang suy giảm nghiêm trọng do biến đổi khí hậu, ô nhiễm môi trường và nạn săn bắt trái phép. Bên cạnh đó, nghề nuôi yến hiện nay còn phát triển tự phát, thiếu quy hoạch tổng thể và liên kết chuỗi giá trị, trong khi nhận thức cộng đồng chưa đồng đều.
Theo PGS.TS Nguyễn Lân Hùng Sơn, trong bảo tồn động vật hoang dã nói chung và quản lý các loài chim di cư nói riêng, các nhà khoa học cũng đang nhanh chóng nghiên cứu ứng dụng các thành tựu khoa học để nâng cao hiệu quả công tác giám sát động vật và đưa ra các chiến lược bảo tồn phù hợp. Từ sử dụng máy bay không người lái (flycam), bẫy ảnh tiên tiến, camera giám sát tổ yến hay công nghệ định vị và theo dõi động vật hoang dã.
“Tuy nhiên, giải pháp gốc rễ nằm ở hệ thống pháp luật và ý thức người dân. Cần có chế tài xử phạt nghiêm minh, bởi giáo dục bảo tồn chỉ đóng vai trò hỗ trợ”, ông Sơn nói.
Đồng quan điểm, TS Nguyễn Văn Long - Vụ trưởng Vụ Khoa học và Công nghệ (Bộ Nông nghiệp và Môi trường), cho rằng cần hoàn thiện khung pháp lý quốc gia về quản lý, khai thác, xuất khẩu và truy xuất nguồn gốc sản phẩm yến sào. Ông đề xuất xây dựng chiến lược quốc gia về bảo tồn và phát triển bền vững quần thể chim yến Việt Nam, đồng thời thúc đẩy hợp tác khoa học - công nghệ quốc tế, đặc biệt trong nghiên cứu gen và khả năng thích ứng với biến đổi khí hậu.
TS Nguyễn Văn Long cũng kêu gọi tăng cường liên kết “4 nhà”: Nhà nước, Nhà khoa học, Nhà doanh nghiệp và Nhà nông, để hình thành chuỗi giá trị yến sào bền vững, góp phần bảo vệ nguồn tài nguyên quý báu cho thế hệ mai sau."
https://tienphong.vn/tphcm-quyet-tai-lap-hat-kiem-lam-rung-dac-dung-con-dao-post1794049.tpo,TPHCM quyết tái lập Hạt kiểm lâm rừng đặc dụng Côn Đảo,"TPO - Để có cơ sở đề xuất tái lập Hạt kiểm lâm rừng đặc dụng Côn Đảo (trực thuộc Ban Quản lý Vườn quốc gia Côn Đảo), Sở Nội vụ TPHCM căn cứ theo tinh thần Kết luận 14 và Nghị định 73, cho phép “dám nghĩ, dám làm, dám chịu trách nhiệm” đối với những vấn đề chưa được quy định cụ thể nhưng phù hợp thực tiễn địa phương.","Chiều 6/11, tại cuộc họp báo về tình hình kinh tế - xã hội, ông Nguyễn Bắc Nam, Phó giám đốc Sở Nội vụ TPHCM cho biết, sở đang thẩm định hồ sơ đề án thành lập lại Hạt kiểm lâm rừng đặc dụng Côn Đảo, theo đề nghị của Ban Quản lý Vườn quốc gia Côn Đảo.
Trước đó, Hạt kiểm lâm Vườn quốc gia Côn Đảo đã giải thể để thành lập Hạt kiểm lâm trực thuộc Chi cục Kiểm lâm tỉnh Bà Rịa - Vũng Tàu (nay là Chi cục Kiểm lâm TPHCM).
Tuy nhiên, quá trình chuyển đổi mô hình tổ chức, địa phương này gặp nhiều khó khăn trong quản lý, điều hành và phối hợp nghiệp vụ. Từ thực tế đó, Ban Quản lý Vườn quốc gia Côn Đảo đã đề xuất thành phố xem xét, khôi phục tổ chức Hạt kiểm lâm trực thuộc Ban Quản lý, nhằm đảm bảo sự linh hoạt trong quản lý rừng đặc dụng, phù hợp đặc thù địa lý và nhiệm vụ bảo tồn sinh thái tại Côn Đảo.
Theo đại diện Sở Nội vụ, ngày 4/9/2025, Ban Quản lý Vườn quốc gia Côn Đảo có công văn gửi UBND TPHCM đề nghị xem xét việc thành lập lại Hạt kiểm lâm. UBND TPHCM đã giao Sở Nội vụ hướng dẫn quy trình, đồng thời xin ý kiến Bộ Nội vụ, Bộ Nông nghiệp và Môi trường theo đúng quy định.
Thế nhưng, khó khăn phát sinh khi Ban Quản lý Vườn quốc gia là đơn vị sự nghiệp công lập, trong khi Hạt kiểm lâm lại mang tính chất đơn vị hành chính. Việc khôi phục lại mô hình cũ cũng chưa từng có tiền lệ.
Do đó, để trung ương có cơ sở xem xét, Sở Nội vụ đề xuất xử lý linh hoạt theo tinh thần Kết luận 14 và Nghị định 73 của Chính phủ, cho phép “dám nghĩ, dám làm, dám chịu trách nhiệm” đối với những vấn đề chưa có quy định cụ thể nhưng phù hợp thực tiễn địa phương. Đề án chi tiết về việc tái lập Hạt kiểm lâm đã hoàn thành, lấy ý kiến các sở, ban ngành liên quan và được gửi lại Sở Nội vụ đầu tháng 11. Hiện, Sở Nội vụ đang tiến hành thẩm định trước khi trình UBND TPHCM xem xét, quyết định.
Vườn quốc gia Côn Đảo có diện tích hơn 19.800 ha đất liền và gần 14.000 ha vùng biển, là khu rừng đặc dụng có giá trị sinh học và bảo tồn cao bậc nhất Việt Nam, nơi sinh sống của hàng trăm loài sinh vật quý hiếm. Việc tái lập Hạt kiểm lâm trực thuộc Ban Quản lý được đánh giá giúp tăng tính chủ động, kịp thời trong quản lý, bảo vệ và ứng phó cháy rừng trên đảo."
https://tienphong.vn/su-co-bat-thuong-khien-tau-vu-tru-trung-quoc-chua-tro-ve-trai-dat-post1793961.tpo,Sự cố bất thường khiến tàu vũ trụ Trung Quốc chưa trở về Trái đất,"TPO - Tàu vũ trụ Thần Châu-20 của Trung Quốc phải hoãn nhiệm vụ trở về Trái Đất sau khi con tàu có khả năng đã va đập với các mảnh vỡ trong không gian, Cơ quan vũ trụ có người lái Trung Quốc (CMSA) cho biết.","Đây là tình huống bất thường có thể gây ảnh hưởng đến hoạt động của trạm vũ trụ Thiên Cung.
Ngày 6/11, CMSA cho biết họ đang tiến hành phân tích va chạm và đánh giá rủi ro, nhưng không đưa ra lịch trình mới cho nhiệm vụ trở về.
Sự cố cho thấy các chuyến bay vũ trụ đối mặt với ngày càng nhiều rủi ro, khi số lượng mảnh vỡ hay rác trong không gian ngày càng nhiều. Chúng bắt nguồn từ các tầng tên lửa cũ và các bộ phận tàu vũ trụ bị bỏ lại, trôi trong không gian ở độ cao hàng trăm kilomet so với mặt đất, có nguy cơ va chạm với các phương tiện đang hoạt động.
Chương trình Thần Châu có nhiệm vụ đưa các phi hành gia Trung Quốc lên trạm Thiên Cung định kỳ 6 tháng để thực hiện nhiều nhiệm vụ, bao gồm sửa chữa các hư hại do mảnh vỡ không gian gây ra cho trạm.
Nhiệm vụ trở về của phi hành đoàn Thần Châu-19 hồi tháng 4 cũng bị trì hoãn, nhưng vì điều kiện thời tiết tại khu vực hạ cánh. Đây là lần đầu tiên nhiệm vụ trở về bị chậm vì mảnh vỡ không gian.
CMSA không cho biết Thần Châu-20 bị va chạm khi đang neo tại Thiên Cung, nơi Thần Châu-21 cũng đang ghép nối sau khi bay lên tuần trước. Hai phi hành đoàn đang trong giai đoạn bàn giao kéo dài vài ngày.
Theo quy trình vận hành, nếu Thần Châu-20 không thể sửa chữa được trên trạm, thì Thần Châu-21 sẽ được dùng để đưa phi hành đoàn trở về Trái đất.
Trong trường hợp cả 2 tàu đều hư hỏng không thể sử dụng, tàu Thần Châu dự phòng sẽ được phóng từ Trung tâm phóng vệ tinh Tửu Tuyền ở tây bắc Trung Quốc lên đón các phi hành gia.
Tại trung tâm phóng, một tên lửa Trường Chinh-2F dự phòng và một tàu Thần Châu dự phòng luôn trong trạng thái sẵn sàng cho tình huống khẩn cấp.
Dù thời gian trì hoãn có thể ngắn, nhưng kinh nghiệm cho thấy các phi hành gia đôi khi phải ở lại vũ trụ lâu hơn dự kiến. Năm ngoái, 2 phi hành gia NASA phải ở lại 9 tháng trên Trạm Vũ trụ quốc tế sau sự cố kỹ thuật với tàu vũ trụ Boeing Starliner."
https://tienphong.vn/gau-lien-tuc-tan-cong-nguoi-nhat-ban-huy-dong-binh-linh-doi-pho-post1793716.tpo,"Gấu liên tục tấn công người, Nhật Bản huy động binh lính đối phó","TPO - Nhật Bản vừa triển khai binh lính tới khu vực miền núi phía bắc của nước này, sau khi nhận được yêu cầu khẩn cấp từ chính quyền địa phương về tình trạng gấu liên tục tấn công người.","Chiến dịch bắt đầu tại thị trấn Kazuno thuộc tỉnh Akita, nơi người dân trong nhiều tuần qua được khuyến cáo tránh vào khu rừng rậm xung quanh, hạn chế ra ngoài sau khi trời tối và mang theo chuông để xua đuổi gấu.
Theo Bộ Môi trường Nhật Bản, kể từ tháng 4 năm ngoái đã xảy ra hơn 100 vụ gấu tấn công trên toàn quốc, khiến 12 người thiệt mạng. Hai phần ba số ca tử vong xảy tại tỉnh Akita và tỉnh Iwate lân cận.
“Người dân cảm nhận sự nguy hiểm mỗi ngày. Nó ảnh hưởng đến cách mọi người sinh hoạt, khiến họ phải hạn chế ra ngoài hoặc hủy nhiều sự kiện”, Thị trưởng Kazuno Shinji Sasamoto phát biểu sau buổi gặp gỡ khoảng 15 binh lính được điều tới thị trấn trên xe tải quân sự và nhiều xe jeep, mang theo áo giáp và bản đồ địa hình.
Binh lính sẽ hỗ trợ vận chuyển, lắp đặt và kiểm tra bẫy bắt gấu, nhưng việc xử lý gấu sẽ do các thợ săn được cấp phép thực hiện, sử dụng vũ khí phù hợp.
Giới chức Akita cho biết số lượng gấu được nhìn thấy đã tăng gấp 6 lần trong năm nay, lên hơn 8.000 con, khiến lãnh đạo tỉnh phải yêu cầu Lực lượng Phòng vệ hỗ trợ.
Sau Kazuno, binh lính sẽ tiếp tục tới hai thành phố Odate và Kitaakita để thực hiện nhiệm vụ tương tự.
Số lượng gấu tăng, biến đổi khí hậu khiến nguồn thức ăn tự nhiên thay đổi, cùng tình trạng dân số nông thôn giảm sút là những nguyên nhân khiến số vụ gấu tấn công người gia tăng. Lực lượng thợ săn từng là tuyến phòng vệ chính, nay không đủ để kiểm soát tình hình.
Trong vài tuần gần đây, đã xảy ra nhiều vụ nghiêm trọng như gấu tấn công khách hàng trong siêu thị, tấn công du khách đang đợi xe buýt gần di sản UNESCO. Một số trường học phải tạm đóng cửa sau khi phát hiện gấu đi lại quanh khuôn viên.
Đây không phải lần đầu quân đội Nhật hỗ trợ kiểm soát động vật hoang dã. Nước này từng huy động trực thăng quân sự hỗ trợ săn hươu hoang cách đây khoảng 10 năm; tiêu diệt sư tử biển nhằm bảo vệ thủy sản trong những năm 1960.
Phó Chánh Văn phòng Nội các Kei Sato cho biết, Tokyo sẽ công bố gói biện pháp khẩn cấp đối phó gấu vào cuối tháng này, trong đó có biện pháp tuyển thêm thợ săn được cấp phép. Hồi tháng 9, chính phủ nới lỏng quy định sử dụng súng để việc bắn gấu trong khu dân cư dễ dàng hơn."
https://tienphong.vn/tuong-thanh-hue-can-nhieu-hon-mot-cuoc-trung-tu-post1793729.tpo,Tường thành Huế cần nhiều hơn một cuộc trùng tu,TP - Bức tường Hoàng thành Huế dài gần 15 m bị sập là biểu hiện cụ thể của tác động khí hậu lên di sản. Sự cố này một lần nữa đặt ra yêu cầu cấp thiết về các giải pháp tổng thể và dài hạn cho công tác bảo tồn di sản vật chất truyền thống ở Huế.,"Sự cố được dự đoán
Chiều tối 2/11, đoạn tường Hoàng thành Huế trên đường Đặng Thái Thân bất ngờ đổ sập sau nhiều ngày mưa lớn và nước ngập kéo dài. Nằm cách cổng Hòa Bình khoảng 50 m, đoạn tường dài 14-15 m bị nghiêng hoàn toàn vào phía trong. Hình ảnh các khối gạch vồ bung vỡ, lớp kết dính truyền thống gần như tách rời cho thấy sức chịu đựng của kết cấu đã đến giới hạn. Sự cố diễn ra nhanh và bất ngờ, nhưng với những người làm công tác bảo tồn tại Cố đô Huế, nguy cơ này đã được cảnh báo từ nhiều năm trước.
Ông Hoàng Việt Trung, Giám đốc Trung tâm Bảo tồn Di tích Cố đô Huế cho biết, hệ thống tường Hoàng thành có tổng chiều dài khoảng 2,4 km, trải qua hàng trăm năm phong hóa. Kết cấu tường gồm ba lớp: hai lớp ngoài bằng gạch vồ, lớp giữa sử dụng đất sét để liên kết. Trong điều kiện khí hậu miền Trung, đặc biệt là mùa mưa kéo dài, tường liên tục hấp thụ nước, phình giãn và giảm độ bền. Nước từ hồ Ngoại Kim Thủy bao quanh Hoàng thành tạo thêm áp lực xói mòn ở chân tường.
“Đợt mưa lũ kéo dài khiến tường bị ngậm nước quá lâu, tạo tải trọng lớn. Khi một phần kết cấu đạt đến ngưỡng mất ổn định, sập đổ là điều không thể tránh khỏi”, ông Trung nói. Ông cho biết, trước khi xảy ra sự cố, Trung tâm đã phát hiện một số đoạn tường có biểu hiện nứt, nghiêng và cần được xử lý dài hạn.
Đại Nội Huế được xây dựng từ năm 1804 dưới triều vua Gia Long, hoàn thiện năm 1833 dưới triều Minh Mạng, gồm ba vòng thành bảo vệ: Kinh thành, Hoàng thành và Tử Cấm thành. Tường Hoàng thành cao khoảng 4m, dày hơn 1m, xây bằng gạch và bao quanh bởi hệ thống hào phòng thủ. Năm 1993, quần thể di tích Cố đô Huế được UNESCO công nhận là Di sản Văn hóa Thế giới.
Ngay trong đêm xảy ra sự cố, lực lượng bảo vệ di tích đã lập rào chắn, đặt biển cảnh báo và bao che khu vực hư hỏng. Sáng hôm sau, Trung tâm phối hợp với Sở Xây dựng tiến hành khảo sát sơ bộ, đồng thời báo cáo UBND TP Huế xin ý kiến xử lý theo quy định đối với di tích quốc gia đặc biệt.
Miền Trung nhiều năm nay liên tục chứng kiến các hình thái thời tiết cực đoan: mưa lớn kéo dài, lũ quét, nước dâng nhanh. Di tích cố đô vốn xây dựng với vật liệu truyền thống phụ thuộc nhiều vào điều kiện tự nhiên trở thành đối tượng chịu tổn thương đầu tiên.
Theo TS. Ngô Đình Thành (Viện Vật liệu xây dựng): “Đất sét vốn có độ thở tự nhiên, giúp công trình điều chỉnh độ ẩm. Nhưng khi môi trường ẩm ướt kéo dài, vật liệu liên kết mất khả năng phục hồi, việc trùng tu không thể chỉ dựa vào kinh nghiệm truyền thống mà cần kết hợp công nghệ hiện đại và nghiên cứu địa kỹ thuật”.
Ông Thành cũng đánh giá tường thành Huế từng trải qua nhiều chiến sự và biến động khí hậu, nhưng sức ép nước mưa tích lũy liên tục, cộng thêm biến đổi dòng chảy quanh hồ Ngoại Kim Thủy, khiến tình trạng xuống cấp tăng nhanh trong khoảng 10 năm trở lại đây. Việc khôi phục không đơn thuần là xây lại một bức tường, mà phải phục hồi một cấu trúc mang giá trị biểu tượng của quyền lực nhà Nguyễn và lịch sử đô thị Huế.
Kinh nghiệm quốc tế
Kiến trúc sư Nguyễn Ngọc Sơn (Đại học Strasbourg II, Pháp) chia sẻ vớiTiền Phongrằng, thế giới đã nhiều lần đối diện những tình huống di sản bị đe dọa bởi thiên tai và biến đổi khí hậu. Ứng xử của các quốc gia ngoài việc xây lại phần hư hỏng, còn được đặt trong tầm nhìn rộng hơn: bảo vệ di tích bằng việc kiểm soát môi trường tự nhiên xung quanh, tạo nên một vành đai an toàn để công trình có thể tồn tại bền vững về lâu dài. Theo ông Sơn, những kinh nghiệm này đáng để tham khảo khi nhìn vào sự cố tường Hoàng thành Huế vừa sập sau mưa lũ kéo dài.
Trước hết, ông nhắc đến thành cổ Himeji ở Nhật Bản, một công trình nằm trong khu vực thường xuyên hứng chịu bão lớn. Để bảo vệ công trình đã tồn tại hàng trăm năm tuổi, Nhật Bản triển khai hệ thống giám sát điện tử liên tục. Các cảm biến được cắm trực tiếp vào tường để đo độ ẩm, lực nén và độ nghiêng theo thời gian thực.
Dữ liệu thu được được chuyển về trung tâm phân tích, từ đó dự báo nguy cơ biến dạng hoặc sập đổ trước khi hư hại diễn ra. Các kế hoạch bảo trì được triển khai chủ động, thay vì chờ đến khi kết cấu bộc lộ dấu hiệu xuống cấp rõ ràng. Đây là mô hình coi trọng cảnh báo sớm, giúp giảm thiểu can thiệp nặng tay và giữ được tính nguyên gốc của công trình.
Ví dụ thứ hai là thành phố Venice ở Ý, nơi đang phải đối mặt với nguy cơ chìm dần dưới mực nước biển. Thay vì chỉ gia cố các tòa nhà cổ, chính quyền địa phương xây dựng hệ thống đê chắn biển MOSE gồm các tấm chắn có khả năng nâng, hạ tùy theo thủy triều. Giải pháp này không tách rời công cuộc bảo tồn mà liên kết chặt với quy hoạch đô thị, giao thông đường thủy, du lịch và bảo vệ cảnh quan. Nhờ đó, Venice không bị cô lập khỏi đời sống đương đại, mà tiếp tục vận hành như một đô thị sống trong khi vẫn gìn giữ được cấu trúc lịch sử của mình.
Trường hợp thứ ba là Angkor Wat ở Campuchia. Các chuyên gia UNESCO và các viện nghiên cứu địa kỹ thuật đã theo dõi mực nước ngầm thay đổi theo mùa, đồng thời kiểm soát rễ cây cổ thụ xâm lấn gây phá vỡ cấu trúc. Hệ thống thoát nước được điều chỉnh liên tục để tránh hiện tượng rỗng chân móng, giúp công trình ổn định trước các chu kỳ mưa lớn.
Từ các mô hình nêu trên, kiến trúc sư Nguyễn Ngọc Sơn nhận định, bài học lớn nhất nằm ở tư duy phòng ngừa. Di sản cần được đặt trong mạng lưới giám sát môi trường lâu dài, có dữ liệu theo dõi liên tục và kế hoạch ứng phó chủ động. Khi điều kiện tự nhiên ngày càng khắc nghiệt, bảo tồn không thể chỉ trông vào biện pháp tu bổ sau hư hỏng, mà phải kiến tạo một không gian an toàn để di tích có thể tiếp tục hiện diện.
“Hoàng thành Huế không chỉ là một công trình kiến trúc thời quân chủ. Nó là biểu hiện của cấu trúc đô thị, mỹ học vương quyền và ký ức của cộng đồng. Việc tường thành sập là lời nhắc nhở rõ ràng về việc di sản đang phải đối diện với sức ép mới từ khí hậu, môi trường và dòng chảy thời gian”, ông Sơn nói."
https://tienphong.vn/truong-dai-hoc-y-khoa-pham-ngoc-thach-len-tieng-ve-don-to-gian-lan-nghien-cuu-khoa-hoc-post1793610.tpo,Trường Đại học Y khoa Phạm Ngọc Thạch lên tiếng về đơn 'tố' gian lận nghiên cứu khoa học,"TPO - PGS.TS Nguyễn Trọng Hào – Chủ tịch Hội đồng trường, Trường ĐH Y khoa Phạm Ngọc Thạch cho biết ngay sau khi nhận được thư tố cáo một số cá nhân thuộc trường gian lận trong nghiên cứu, vi phạm liêm chính khoa học, nhà trường đã gửi email mời người tố cáo đến cung cấp thông tin, tài liệu, minh chứng nhưng người này không đến.","Ngày 5/11, Hội đồng trường, Ban giám hiệu Trường ĐH Y khoa Phạm Ngọc Thạch đã có buổi trao đổi với báo chí sau những lùm xùm về liêm chính khoa học của một số cá nhân thuộc trường gây xôn xao dư luận thời gian qua.
Theo PGS.TS Nguyễn Trọng Hào – Chủ tịch Hội đồng trường Trường Đại học Y khoa Phạm Ngọc Thạch, vào ngày 20/10 nhà trường nhận được một thư điện tử tố cáo “một số cá nhân thuộc trường” có hành vi gian lận trong nghiên cứu, vi phạm nguyên tắc liêm chính khoa học.
Ngay sau khi nhận được thư, ngày 22/10, nhà trường đã gửi email mời người tố cáo đến cung cấp thông tin, tài liệu, minh chứng. Tuy nhiên, người này đã không đến.
Do thư tố cáo gửi dưới dạng nặc danh nên theo ông Hào, nhà trường không thể xử lý theo đúng thủ tục quy định tại Điều 25 Luật Tố cáo 2018 và Thông tư 05/2021/TT­-TTCP.
Dù vậy, vì nội dung tố cáo liên quan đến một số cá nhân thuộc phạm vi quản lý, lãnh đạo nhà trường đã chủ động tiến hành rà soát, xác minh các nội dung tố cáo nói trên nhằm đảm bảo các hoạt động đào tạo và nghiên cứu khoa học tại trường tuân thủ đúng quy định pháp luật.
PGS. Hào cũng cho biết, trường đã xây dựng dự thảo “Quy định về Liêm chính khoa học” và đang lấy ý kiến các đơn vị trong trường để ban hành trong thời gian tới.
Vào ngày 28/10, trường đã quyết định thành lập Tổ công tác gồm 7 thành viên do TS.BS Phạm Quốc Dũng – Phó Hiệu trưởng làm tổ trưởng, phụ trách công tác rà soát liêm chính khoa học.
Tuy nhiên, ngay sau khi thành lập, một thành viên trong danh sách đã xin rút. Do nhận thấy một số tiêu chí không phù hợp nên nhà trường bổ sung bằng thành viên khác. Vấn đề trở nên nghiêm trọng khi các cá nhân trong tổ liên tục bị công kích, cáo buộc vi phạm liêm chính khoa học... khiến ai cũng chịu áp lực.
Mối nghi vấn này được đặt ra trong bối cảnh trường xảy ra “ồn ào” từ việc thí sinh 24 tuổi Âu Nhật Huy trúng tuyển chương trình tiến sĩ ngành Nội khoa của trường. Đặc biệt, thí sinh này lại là con của PGS.TS Trần Thị Khánh Tường - Trưởng khoa Y, Trường Đại học Y khoa Phạm Ngọc Thạch."
