url,title,description,content
https://tienphong.vn/linh-an-19-nam-tu-vi-thua-bac-bat-coc-em-ho-tong-tien-post1792305.tpo,"Lĩnh án 19 năm tù vì thua bạc, bắt cóc em họ tống tiền","TPO - Bị cáo Phan Mạnh Quý bị tòa tuyên mức án 19 năm tù với cáo buộc bắt cóc em họ để tống tiền, do thua bạc trên mạng.","Ngày 31/10, TAND Hà Nội xét xử sơ thẩm, tuyên phạt bị cáoPhan Mạnh Quý(24 tuổi, quê ở tỉnh Ninh Bình) 19 năm tù về các tội ""Đánh bạc và Bắt cóc nhằm chiếm đoạt tài sản"".
Tháng 7/2024, bị cáoQuýtạo lập tài khoản để tham gia đánh bạc trên mạng qua hình thức đặt cược “Tài - Xỉu”.
Ngày 12/9/2024, Quý tham gia đặt cược 40 lần với tổng số tiền gần 140 triệu đồng. Do thua bạc, khoảng 14h cùng ngày, Quý nảy sinh ý định khống chế, bắt cóc anh P. T. H (là em họ của bị Quý) để tống tiền.
Thực hiện hành vi, Quý gọi điện cho anh H, giả danh nhân viên giao hàng để hỏi địa chỉ nhà. Sau đó, bị cáo lấy dao, giấu vào trong người rồi đi đến nhà anh H.
Đến nơi, bị cáoQuý(đeo khẩu trang) bấm chuông cửa. Khi anh H. mở cửa, bị cáo đẩy anh H. vào trong nhà, dùng dao khống chế nạn nhân, đóng cửa lại.
Do Quý đeo khẩu trang nên anh H. không nhận ra bị cáo là anh họ của mình. Sau đó, bị cáo lấy băng dính của chủ nhà để trói chân, tay anh H. lại, đồng thời hỏi “bây giờ tao muốn lấy 600 triệu đồng thì mày gọi cho ai để chuyển được tiền”.
Do sợ bị giết, anh H. gọi điện cho anh trai, bảo chuyển số tiền trên vào tài khoản của mình. Tuy nhiên, anh trai nạn nhân không chuyển tiền.
Lúc này, Quý lấy điện thoại, gọi cho bố của nạn nhân, yêu cầu chuyển 600 triệu đồng, nếu không sẽ “không để cho H. sống” rồi tắt máy.
Sau lời đe dọa trên, trong vòng 30 phút, người thân của anh H. đã chuyển 230 triệu đồng vào 2 tài khoản của anh H. Sau đó, bị cáo Quý dùng 150 triệu đồng trong 1 tài khoản của anh H. để nạp vào tài khoản game đánh bạc.
Tiếp đó, Quý yêu cầu nạn nhân đăng nhập tài khoản còn lại để chuyển nốt 50 triệu đồng. Tuy nhiên, do tài khoản của anh H chưa cài đặt sinh trắc học nên không thực hiện được giao dịch trên.
Lo sợ nếu khống chế anh H. lâu sẽ bị nạn nhân nhận ra họ hàng nên bị cáo Quý đe dọa bố nạn nhân không được báo công an.
Quý sau đó cởi trói cho anh H, dùng dao khống chế anh này đi ra ngoài khu vực thang máy để bỏ trốn.
Khi vừa đi ra ngoài, Phan Mạnh Quý bị công an khống chế."
https://tienphong.vn/ca-si-vu-ha-khai-danh-bac-trong-tui-chi-co-5-10-trieu-dong-post1792250.tpo,Ca sĩ Vũ Hà khai đánh bạc trong túi chỉ có 5 - 10 triệu đồng,"TPO - Tại tòa, ca sĩ Vũ Ngọc Hà khai mỗi lần chơi bạc trong túi chỉ có 5 – 10 triệu đồng, do ngồi kéo máy nhiều giờ đồng hồ nên số tiền bị quy kết đánh bạc lên hàng nghìn USD.","Số tiền đánh bạc lớn do ""ngồi lâu, kéo máy nhiều""
Chiều 31/10, bị cáoVũ Ngọc Hà(tức ca sĩ Vũ Hà, sinh năm 1971, trú tại phố Hoàng Hoa Thám, phường 7, thành phố Hồ Chí Minh) được Hội đồng xét xử gọi lên bục khai báo trả lời các các hỏi liên quan đến hành vi đánh bạc tại câu lạc bộ King Club, khách sạn Pullman.
“Bị cáo có thực hiện hành vi như nội dung cáo trạng nêu không”, Chủ tọa hỏi câu đầu tiên. Bị cáoVũ Hàtrả lời giọng nhỏ nhẹ “dạ có”.
Theo lời khai của Vũ Hà, anh ta biết trong khách sạn có trò chơi đánh bạc là nhờ người bạn từ bên Úc mở thẻ giúp. Thời gian mở thẻ vào thời điểm nào, tên thẻ là gì bị cáo không nhớ.
Sau khi được Chủ tọa nhắc lại “bị cáo mở thẻ ngày 18/5/2024”, ca sĩ Vũ Hà trả lời thêm chỉ chơi duy nhất trò Slot. Mỗi lần chơi trong túi chỉ có 5 – 10 triệu đồng.
“Chỉ 5 – 10 triệu mà tổng số tiền bị quy kết chơi là hơn 2.618 USD?”, Chủ tọa nói. Bị cáo Vũ Hà lập luận “chắc do ngồi kéo máy đến 2 – 3 tiếng đồng hồ nên tiền lên nhiều như vậy”.
Kết quả đánh bạc, nam ca sĩ khai đã thua 199 USD. Nguồn tiền đánh bạc có được từ thu nhập, mỗi khi đi ra ngoài thường mang trong người 5 – 10 triệu đồng. Hiện bị cáo đã nộp 10 triệu đồng cho cơ quan tố tụng.
Viện Kiểm sát cáo buộc, Vũ Hà mở thẻ với tên ""MR BARET"" và đánh bạc 1 lần bằng hình thức chơi Slot, Roulette với số tiền đánh bạc là 2.618,16 USD (tương đương hơn 63 triệu đồng), thua 199,34 USD.
Ca sĩ Vũ Hà nổi tiếng từ thập niên 1990, đặc biệt với khán giả miền Tây Nam bộ, chuyên hát dòng nhạc trữ tình, nhạc trẻ và chính là người đưa Đàm Vĩnh Hưng đến với con đường ca hát. Chặng đường làm ca sĩ của Vũ Hà trải qua nhiều thăng trầm, gián đoạn, có lúc lận đận nhưng cũng có lúc nổi tiếng, được khán giả yêu thích. Hơn 10 năm trở lại đây, Vũ Hà ít đi hát mà chủ yếu tham gia các video hài hước.
Dùng hết tiền tiết kiệm để mổ mắt ""nướng"" vào canh bạc
Còn nam ca sĩ Nguyễn Thế Vũ mở thẻ với tên “MR MICHAEL. Trong khoảng thời gian từ ngày 4/2/2024 – 22/6/2024, ca sĩ này có 116 lần đánh bạc hình thức chơi baccarat, tổng số tiền đánh bạc là 4,3 triệu USD, thua hơn 81 nghìn USD.
Ca sĩ Thế Vũ từng công tác tại một đoàn ca múa nhạc đến năm 1995 thì ra hoạt động nghệ thuật tự do. Thế Vũ có thời gian bị tạm giam về tội đánh bạc, sau đó được thay thế biện pháp ngăn chặn cấm đi khỏi nơi cư trú.
Cũng trong phiên xét hỏi chiều nay, nhiều bị cáo thừa nhận đứng ở bên ngoài ""thấy hay"" nên vào trong khách sạn đánh bạc.
Như bị cáo Phạm Thị Hợp (68 tuổi, ở quận Thanh Xuân cũ, Hà Nội) trên bục khai báo gượng cười, tỏ thái độ xấu hổ khi trả lời câu hỏi của Hội đồng xét xử.
Bị cáo Hợp cho hay, do tò mò thấy người khác chơi hay đã đem toàn bộ số tiền tiết kiệm dành để mổ mắt ""nướng"" hết vào canh bạc. Kết quả, bà thua 1.522 USD.
Một số bị cáo khác thừa nhận hành vi đánh bạc, song bày tỏ băn khoăn về việc bị cơ quan tiến hành tố tụng quy kết số tiền chơi quá lớn ""không biết cộng dồn thế nào"".
""Bị cáo đồng ý với tội danh truy tố nhưng khoản tiền quy kết và một số hành vi khác bị cáo thấy chưa được khách quan, có chưa đúng, xin Hội đồng xét xử cho trình bày trong phần tự bào chữa ạ"", một bị cáo nói."
https://tienphong.vn/bo-cong-an-ung-cap-luong-thuc-thuc-pham-ho-tro-nguoi-dan-vung-lu-post1792140.tpo,"Bộ Công an ứng cấp lương thực, thực phẩm hỗ trợ người dân vùng lũ","TPO - Trước tình hình mưa lũ đặc biệt nghiêm trọng tại các tỉnh miền Trung, tối 30/10, Thiếu tướng Nguyễn Hồng Nguyên, Phó Chánh Văn phòng Bộ Công an, Phó Trưởng Ban Thường trực Ban Chỉ huy Phòng thủ dân sự Bộ Công an, đã chủ trì và trực tiếp chỉ đạo công tác tiếp nhận, tổ chức vận chuyển hàng hóa cứu trợ tới đồng bào vùng lũ.","Đây là chuyến ứng phó cấp khẩn cấp do Văn phòng Bộ Công an, Cơ quan thường trực Ban Chỉ huy Phòng thủ dân sự Bộ Công an, phối hợp với Đoàn Vận tải Công an nhân dân cùng các đơn vị chức năng tổ chức thực hiện, với tổng số hơn 50 tấn hàng hóa thiết yếu.
Ngay trong đêm 30/10, cán bộ, chiến sĩ các đơn vị thuộc Bộ Công an đã tổ chức bốc xếp, kiểm đếm, niêm phong hàng hóa và bảo đảm an toàn tuyệt đối cho người, phương tiện và vật tư trên toàn hành trình.
Theo Thiếu tướng Nguyễn Hồng Nguyên, đợt cứu trợ này gồm: 60.000 chai nước tinh khiết, 7 tấn bánh và lương khô, được chuyển khẩn cấp vào miền Trung, giao cho Công an TP Huế và Công an TP Đà Nẵng tiếp nhận, phân phối trực tiếp đến người dân tại các khu vực đang ngập sâu, bị chia cắt do mưa lũ.
Thiếu tướng Nguyễn Hồng Nguyên cho biết, sáng 31/10, toàn bộ hàng cứu trợ sẽ đến tận tay người dân, đảm bảo “người dân nào cũng có lương thực, thực phẩm, nước uống đầy đủ, đúng tinh thần chỉ đạo của Tổng Bí thư Tô Lâm: “Không để một người dân nào bị đói, không để một người dân nào bị rét, không để một người dân nào phải màn trời chiếu đất”.
Khẳng định tinh thần trách nhiệm và tình cảm của lực lượng, Thiếu tướng Nguyễn Hồng Nguyên nhấn mạnh, trái tim của lực lượng Công an nhân dân luôn hướng về đồng bào miền Trung. Chúng tôi dứt khoát không để một người dân nào phải đói, phải rét. Lực lượng Công an nhân dân sẽ làm tất cả những gì có thể để giúp bà con vượt qua thiên tai, sớm ổn định cuộc sống”.
Trận lũ lịch sử năm nay được ghi nhận vượt mốc lịch sử 1964, nhiều khu vực tại Huế và Đà Nẵng ngập sâu, giao thông chia cắt, hàng nghìn hộ dân lâm vào cảnh thiếu thốn. Trong bối cảnh đó, hoạt động cứu trợ khẩn cấp của Bộ Công an không chỉ thể hiện trách nhiệm xã hội, mà còn lan tỏa tinh thần “lúc dân cần, lúc dân khó, có Công an”, đúng phương châm “không để ai bị bỏ lại phía sau”.
Bên cạnh công tác cứu trợ, Bộ Công an tiếp tục chỉ đạo Công an các địa phương miền Trung nắm chắc tình hình, bảo đảm an ninh, trật tự, hỗ trợ di dời người dân khỏi vùng nguy hiểm, giúp nhân dân khắc phục hậu quả mưa lũ, sớm ổn định đời sống và khôi phục sản xuất.
Hành trình ứng cấp khẩn cấp của Bộ Công an không chỉ là sự hỗ trợ vật chất kịp thời, mà còn là nguồn động viên tinh thần lớn lao, thể hiện sâu sắc truyền thống nhân ái và vì nhân dân phục vụ của lực lượng Công an nhân dân Việt Nam."
https://tienphong.vn/tuoi-tre-cong-an-da-nang-cong-10-nghin-tui-an-sinh-tiep-suc-cac-ron-lu-post1792023.tpo,Tuổi trẻ Công an Đà Nẵng 'cõng' 10 nghìn túi an sinh tiếp sức các 'rốn lũ',"TPO - Tuổi trẻ Công an TP Đà Nẵng vượt nước lũ, mang theo các túi an sinh gồm nhu yếu phẩm, thuốc men… để hỗ trợ hàng nghìn hộ dân ở các xã bị cô lập trên địa bàn.","Đà Nẵng kích hoạt các đội hình sinh viên tình nguyện khắc phục hậu quả lũ lụt
Chiều ngày 30/10, Thành Đoàn - Hội Sinh viên Việt Nam TP Đà Nẵng tổ chức họp triển khai các đội hình sinh viên tình nguyện hỗ trợ các địa phương sau lũ lụt, nhằm hỗ trợ bà con nhân dân khắc phục hậu quả và sớm ổn định đời sống.
Anh Lê Công Hùng - Bí thư Thành Đoàn Đà Nẵng, chỉ đạo các đơn vị khẩn trương triển khai thành lập các đội hình sinh viên tình nguyện, chuẩn bị các trang thiết bị, nhu yếu phẩm, phương án di chuyển tiếp cận các địa bàn cần hỗ trợ với phương châm đảm bảo an toàn là trên hết. Bên cạnh đó, Thành Đoàn sẽ kêu gọi thêm các nguồn lực để đồng hành cùng các địa phương, người dân khắc phục hậu quả sau lũ lụt."
https://tienphong.vn/phu-nu-cong-an-tp-ha-noi-day-manh-ung-dung-cong-nghe-chuyen-doi-so-trong-hoat-dong-cong-tac-post1791624.tpo,"Phụ nữ Công an TP Hà Nội đẩy mạnh ứng dụng công nghệ, chuyển đổi số trong hoạt động công tác","TPO - Phát biểu tại Đại hội đại biểu Phụ nữ CATP Hà Nội lần thứ XVIII, nhiệm kỳ 2025-2030, Đại tá Nguyễn Ngọc Quyền – Phó Giám đốc CATP Hà Nội đề nghị Hội Phụ nữ CATP đẩy mạnh ứng dụng công nghệ, chuyển đổi số trong hoạt động công tác Hội, nhất là trong công tác tuyên truyền, quản lý hội viên, phát động phong trào thi đua, đảm bảo mỗi hội viên đều là công dân số an toàn, văn minh.","Ngày 29/10, Hội Phụ nữ Công an thành phố (CATP) Hà Nội tổ chức Đại hội đại biểu Phụ nữ CATP Hà Nội lần thứ XVIII, nhiệm kỳ 2025-2030. Đại tá Nguyễn Ngọc Quyền - Phó Bí thư Đảng uỷ, Phó Giám đốc CATP Hà Nội dự và chỉ đạo Đại hội.
Nhiệm kỳ 2025-2030, Đại hội xác định mục tiêu chung với 6 nhóm chỉ tiêu, 5 nhiệm vụ trọng tâm và 4 nhóm giải pháp lớn, trong đó nhấn mạnh yêu cầu nâng cao hiệu quả công tác Hội, phát huy vai trò, tiềm năng của hội viên trong mọi lĩnh vực công tác công an, góp phần xây dựng lực lượng Công an Thủ đô vững mạnh toàn diện.
Đặc biệt là quyết tâm chính trị của Hội được thể hiện qua chủ đề Đại hội: ""Phát huy truyền thống Công an Thủ đô anh hùng, Phụ nữ Công an thành phố Hà Nội đoàn kết, kỷ cương, đột phá, sáng tạo, xây dựng tổ chức Hội vững mạnh, góp phần bảo đảm an ninh trật tự và tham gia xây dựng Thủ đô ngày càng giàu đẹp, văn minh, hiện đại, vững bước trong Kỷ nguyên vươn mình của dân tộc”.
Phát biểu tại Đại hội, bà Lê Kim Anh, Ủy viên Đoàn Chủ tịch Trung ương Hội Liên hiệp Phụ nữ Việt Nam, Thành ủy viên, Phó Chủ tịch Ủy ban Mặt trận Tổ quốc Việt Nam thành phố Hà Nội, ghi nhận và đánh giá cao những kết quả nổi bật mà Ban Công tác Phụ nữ Công an TP Hà Nội đã đạt được trong thời gian qua.
Bà Kim Anh cho biết, các nữ cán bộ, chiến sĩ không ngại gian khổ, hiểm nguy khi trực tiếp đối mặt với tội phạm; sẵn sàng làm thêm ca, thêm giờ để phục vụ nhân dân trong giải quyết thủ tục hành chính, công tác hồ sơ bảo vệ chính trị nội bộ, tuyên truyền, phổ biến, giáo dục pháp luật. Chị em còn chủ động nhận diện, xử lý hiệu quả nhiều vấn đề phức tạp phát sinh, đóng góp tích cực trong đấu tranh phòng, chống tội phạm và tệ nạn xã hội; góp phần kiềm chế sự gia tăng tội phạm.
Theo CATP Hà Nội, với gần 4.000 hội viên, phụ nữ CATP Hà Nội đang công tác ở hầu hết các lĩnh vực, địa bàn. Trong môi trường làm việc đa dạng, áp lực, nhiều khó khăn, gian khổ và hiểm nguy, các cán bộ, hội viên phụ nữ vẫn luôn phát huy phẩm chất cần cù, sáng tạo, kiên định và bền bỉ, vượt qua mọi thử thách, hoàn thành xuất sắc nhiệm vụ được giao.
Nhiều tập thể, cá nhân nữ chiến sĩ đã lập thành tích tiêu biểu trên các lĩnh vực công tác, góp phần quan trọng vào sự nghiệp bảo vệ an ninh chính trị, trật tự an toàn xã hội; xây dựng lực lượng Công an nhân dân trong sạch, vững mạnh, chính quy, tinh nhuệ, hiện đại.
Phát biểu chỉ đạo tại Đại hội, Đại tá Nguyễn Ngọc Quyền cho biết, trong quá trình sắp xếp tổ chức bộ máy, triển khai Công an địa phương 2 cấp, nhiều cán bộ, chiến sĩ nữ đã tình nguyện xung phong đến nhận công tác tại địa bàn cơ sở, chủ động thích ứng với môi trường làm việc mới, đóng góp tích cực vào sự nghiệp bảo vệ an ninh chính trị và giữ gìn trật tự an toàn xã hội, xây dựng lực lượng Công an nhân dân thật sự trong sạch, vững mạnh, chính quy, tinh nhuệ, hiện đại.
Về nhiệm vụ trong thời gian tới, Đại tá Nguyễn Ngọc Quyền đề nghị Hội Phụ nữ CATP tiếp tục phát huy vai trò, trách nhiệm của phụ nữ trong từng lĩnh vực công tác, lấy hiệu quả thực hiện nhiệm vụ chính trị là thước đo chủ yếu trong phong trào thi đua của Phụ nữ. Cụ thể hoá phong trào thi đua của Phụ nữ, gắn với các chỉ tiêu, nhiệm vụ chuyên môn của từng đơn vị.
Đẩy mạnh ứng dụng công nghệ, chuyển đổi số trong hoạt động công tác Hội, nhất là trong công tác tuyên truyền, quản lý hội viên, phát động phong trào thi đua, đảm bảo mỗi hội viên đều là công dân số an toàn, văn minh.
Tại Đại hội đã chỉ định Trung tá Vũ Thị Tứ - Trưởng ban Ban Phụ nữ CATP giai đoạn 2021-2025 giữ chức vụ Trưởng ban Ban Phụ nữ CATP nhiệm kỳ 2025-2030; Trung tá Nguyễn Thị Vân Hạnh - Phó Trưởng ban Ban Phụ nữ CATP giai đoạn 2021-2025 giữ chức vụ Phó Trưởng ban Ban Phụ nữ CATP nhiệm kỳ 2025 - 2030."
https://tienphong.vn/nu-sinh-o-ha-noi-bo-nha-di-vi-gian-me-post1791556.tpo,Nữ sinh ở Hà Nội bỏ nhà đi vì giận mẹ,"TPO - Chỉ vì bị mẹ nhắc nhở, nữ sinh ở Hà Nội đã bỏ nhà đi khiến mọi người lo lắng. Ngay sau đó, lực lượng Công an đã nhanh chóng vào cuộc và tìm được nữ sinh.","Trước đó, khoảng 9h ngày 28/10, Công an phường Phú Lương (Hà Nội) tiếp nhận trình báo của ông Đ.V.T (trú tại tổ 11, phường Phú Lương) về việc cháu Đ.P.A (SN 2011, con gái ông T) rời khỏi nhà từ sớm và không liên lạc được.
Ngay sau khi tiếp nhận thông tin, Công an phường Phú Lương đã chỉ đạo tổ công tác phòng chống tội phạm, khẩn trương triển khai lực lượng, phối hợp rà soát hệ thống camera, kiểm tra các tuyến đường trọng điểm, đồng thời cùng người dân và các đơn vị liên quan hỗ trợ xác minh, tìm kiếm.
Đến khoảng 17h30 cùng ngày, tổ công tác đã tìm thấy cháu A. tại khu vực Trường THPT Trần Hưng Đạo – Khu đô thị The Vesta và đưa về trụ sở, động viên giúp cháu ổn định tâm lý, liên hệ với gia đình đến đón.
Qua trao đổi, cháu A. cho biết, nguyên nhân do bị mẹ nhắc nhở, nên tự ý rời nhà một mình. Đồng thời khẳng định không bị ai dụ dỗ hay gặp nguy hiểm.
Đến đón con, ông T. bày tỏ lòng cảm ơn sâu sắc trước tinh thần trách nhiệm, tận tụy và sự vào cuộc nhanh chóng, hiệu quả, nhân văn của Công an phường Phú Lương.
Qua sự việc trên, Công an TP Hà Nội khuyến cáo phụ huynh cần quan tâm, thấu hiểu, chia sẻ, động viên con em để chủ động phòng ngừa các tình huống ảnh hưởng tâm lý tiêu cực ở trẻ nhỏ."
https://tienphong.vn/dong-loat-kham-xet-mot-so-tiem-vang-o-thanh-hoa-post1792138.tpo,Đồng loạt khám xét một số tiệm vàng ở Thanh Hóa,"TPO - Hàng chục cảnh sát đã phong tỏa đoạn đường Lê Hoàn, phường Hạc Thành, tỉnh Thanh Hóa để khám xét một số tiệm vàng.","Sáng 31/10, Công an tỉnhThanh Hóahuy động hàng chục cán bộ, chiến sĩ, tiến hành phong tỏa một đoạn đường Lê Hoàn, phường Hạc Thành. Việc phong tỏa phục vụ cho quá trình khám xét một số tiệm vàng ở đây.
Theo ghi nhận, nhiều lực lượng như cảnh sát cơ động, giao thông và hình sự đã căng dây, ngăn không cho người, phương tiện qua lại trên đoạn đường này.
Phía bên trong khu vựcphong tỏa, lực lượng chức năng xuất hiện tại một số cửa hàng kinh doanh vàng. Sự việc thu hút đông đảo người dân hiếu kỳ đứng xem.
Hiện Công an tỉnh Thanh Hóa chưa công bố thông tin chính thức về vụ việc nêu trên.
Trước đó, chiều 26/10, Công an tỉnh Thanh Hóa cũng đã phong tỏa khu vực trước ngôi nhà số 88, đường Dương Đình Nghệ, phường Hạc Thành.
Căn nhà này thuộc sở hữu của ông N.X. B. - một doanh nhân có tiếng tại Thanh Hóa, hoạt động trong nhiều lĩnh vực khác nhau. Cảnh sát cũng xuất hiện, phong tỏa trước ngôi nhà của ông V.V.H. (trên đường Triệu Quốc Đạt, phường Hạc Thành). Ông H. cũng là một giám đốc doanh nghiệp, là em vợ ông của ông N.X.B.."
https://tienphong.vn/bat-hai-doi-tuong-su-dung-vat-lieu-no-de-khai-thac-thiec-trai-phep-post1792130.tpo,Bắt hai đối tượng sử dụng vật liệu nổ để khai thác thiếc trái phép,"TPO - Công an tỉnh Tuyên Quang vừa khởi tố, bắt tạm giam hai đối tượng quê Phú Thọ vì tổ chức khai thác quặng thiếc và sử dụng vật liệu nổ trái phép tại phường Mỹ Lâm.","Ngày 31/10,Công an tỉnh Tuyên Quangthông tin, Cơ quan An ninh điều tra Công an tỉnh Tuyên Quang đã khởi tố, bắt tạm giam Nguyễn Đình Tân (SN 1978, trú tại xã Vĩnh Tường, tỉnh Phú Thọ) và Trần Thị Mùi (SN 1972, trú tại xã Tam Dương, tỉnh Phú Thọ) để điều tra hành vikhai thác khoáng sản trái phépvà mua bán, sử dụng vật liệu nổ trái phép.
Trước đó, ngày 30/7, Phòng An ninh điều tra phối hợp với Phòng An ninh kinh tế, Phòng Kỹ thuật hình sự, Phòng Cảnh sát cơ động, Phòng Cảnh sát PCCC và CNCH, Viện kiểm sát nhân dân tỉnh tiến hành kiểm tra, xác minh, phát hiện 16 đối tượng đang khai thác khoáng sản trái phép tại vườn nhà ông Trần Văn Minh thuộc Tổ dân phố Kim Phú 28, phường Mỹ Lâm, tỉnh Tuyên Quang. Lực lượng chức năng thu giữ gần 10 tấn chất rắn nghi là quặng thiếc, 22 thỏi thuốc nổ nhũ tương; 73 kíp nổ, 01 túi chứa tiền chất nổ và các máy móc, phương tiện khai thác khoáng sản như máy nổ, máy nén khí, máy khoan...
Theo điều tra, từ tháng 3/2025, các đối tượng bàn bạc, chuẩn bị máy móc, tuyển người để tổ chứckhai thác quặng thiếc trái phéptại tổ dân phố Kim Phú 28, phường Mỹ Lâm, TP Tuyên Quang.
Đến giữa tháng 7/2025, nhóm này bắt đầu hoạt động khai thác. Sau khoảng 10 ngày, hành vi bị lực lượng Công an phát hiện, thu giữ nhiều phương tiện cùng vật liệu nổ dùng để phá đá lấy quặng.
Theo cơ quan chức năng, đây làhành vi phạm tộirất nghiêm trọng, xâm phạm an toàn công cộng và gây ảnh hưởng xấu đến an ninh, trật tự địa phương. Người dân khi phát hiện dấu hiệu khai thác khoáng sản trái phép hoặc sử dụng vật liệu nổ cần lập tức thông báo cho cơ quan Công an để kịp thời ngăn chặn, xử lý. Hiện nay, cơ quan An ninh điều tra đang mở rộng vụ án, làm rõ vai trò của các đối tượng liên quan."
