url,title,description,content
https://tienphong.vn/giao-dich-chung-cu-nha-rieng-le-giam-manh-nhung-gia-van-tang-cao-post1792183.tpo,"Giao dịch chung cư, nhà riêng lẻ giảm mạnh nhưng giá vẫn tăng cao","TPO - Theo báo cáo của Bộ Xây dựng, phân khúc chung cư, nhà riêng lẻ đạt hơn 32.100 giao dịch, giảm 16% theo năm. Thế nhưng, giá chung cư vẫn tiếp tục tăng khiến giá mặt bằng chung tăng cao.","Trong báo cáo thị trường mới công bố,Bộ Xây dựngcho biết lượng giao dịch bất động sản quý III giảm mạnh, nhất là phân khúc chung cư, nhà riêng lẻ. Quý này có tổng cộng gần 136.700 giao dịch, giảm 13% theo quý và hơn 3% theo năm.
Riêngphân khúc chung cư, nhà riêng lẻ ghi nhận hơn 32.100 giao dịch, bằng 93% so với quý II và giảm hơn 16% cùng kỳ năm ngoái. Tương tự, đất nền gần 104.600 giao dịch, sụt gần 15% theo quý.
Trong khi đó, nguồn cung dự án nhà ở tiếp tục tăng. Quý này ghi nhận gần 9.500 sản phẩm hoàn thành, gấp đôi so với quý trước và 31% theo năm. Lượng hàng đủ điều kiện kinh doanh cũng tăng đến 43% so với cùng kỳ năm ngoái.
Mặc dù giao dịch giảm nhưng giá vẫn tiếp đà tăng, Bộ Xây dựng cho biết không chỉ giá bán sơ cấp (giá chủ đầu tư rao bán), mà giá bán thứ cấp (mua lại từ chủ cũ) chung cư cũng duy trì đà tăng và thiết lập mặt bằng mới trong quý 3 năm nay, đặc biệt tại các dự án đã bàn giao, có hạ tầng đồng bộ.
Nguyên nhân chính của xu hướng này là do khan hiếm quỹ đất, chi phí đầu vào tăng cao, quy trình pháp lý chậm và kỳ vọng cao từ phía chủ đầu tư.
Cụ thể tại Hà Nội, giá bán sơ cấp căn hộ chung cư tăng mạnh với mức giá trung bình đạt 95 triệu đồng/m2, trong đó hơn 43% nguồn cung mới có giá trên 120 triệu đồng/m2.
Mặt bằng giá sơ cấp tăng mạnh kéo theomặt bằng giátoàn thị trường tăng cao.
Bộ Xây dựng cũng cho hay cùng với đà tăng giá chung cư, giá rao bán trung bình của loại hình biệt thự, nhà liền kề cũng tăng nhẹ, mức tăng từ 1-3% tùy theo từng dự án.
Theo đó, Bộ Xây dựng đề nghị các bộ, địa phương thực hiện một số nhóm giải pháp để kiểm soát giá nhà.
Cụ thể, tập trung hoàn thiện thể chế, chính sách, pháp luật về nhà ở, kinh doanh bất động sản, đất đai, quy hoạch, đầu tư, xây dựng, tín dụng, thuế đảm bảo đồng bộ, thống nhất.
Tiếp tục cắt giảm tối đa thủ tục hành chính, tăng cường phân cấp phân quyền hơn nữa.
Nghiên cứu, điều chỉnh quy định về tiền sử dụng đất hợp lý, không để là nguyên nhân tăng giá bất động sản, nhà ở và đất đai vượt xa so với thu nhập của người dân.
Xây dựng và ban hành các cơ chế có tính đột phá, thông thoáng, thuận lợi nhằm thu hút các nguồn lực để phát triển các phân khúc nhà ở có giá phù hợp với thu nhập của người dân.
Tập trung chỉ đạo, thúc đẩy phát triển nhà ở xã hội để hoàn thành chỉ tiêu 100.000 căn nhà ở xã hội trong năm 2025 đã được Chính phủ giao.
Rà soát, tháo gỡ vướng mắc cho các dự án bất động sản, đặc biệt là tháo gỡ các vướng mắc trong công tác quy hoạch, bồi thường, giải phóng mặt bằng, giao/thuê đất để sớm hoàn thành các dự án bất động sản, tạo nguồn cung cho thị trường.
Tiếp tục theo dõi, nắm bắt thông tin thị trường để kịp thời ban hành các giải pháp, cơ chế quản lý thị trường theo hướngổn định, an toàn, bền vững."
https://tienphong.vn/tphcm-bo-tri-cac-khu-dat-rong-hang-tram-hec-ta-lam-nha-o-xa-hoi-post1792181.tpo,TPHCM bố trí các khu đất rộng hàng trăm héc ta làm nhà ở xã hội,"TPO - Sở Xây dựng TPHCM cho biết, thành phố tập trung bố trí các khu đất có diện tích lớn từ 100 ha đến 200 ha và tiếp tục rà soát, bổ sung quỹ đất nhà ở xã hội giai đoạn 2030-2040 tại 2 khu vực Bình Dương và Bà Rịa-Vũng Tàu trong quá trình lập Quy hoạch chung TPHCM.","Sáng 31/10, tại phiên họp về tình hình kinh tế - xã hội, Sở Xây dựng TPHCM cho biết, trong 10 tháng đầu năm, TPHCM đã hoàn thành 4 dự án với quy mô 2.639 căn. 13 dự án đang thi công xây dựng với 15.202 căn và 17 dự án được chấp thuận chủ trương đầu tư với quy mô 13.959 căn.
Dự kiến đến cuối năm 2025 có 8 dự án hoàn thành với quy mô 7.257 căn (2 dự án hoàn thành một phần là dự án Nhà ở an sinh xã hội HUD Bình Dương và dự án K-Home Kim Oanh).
Đến nay, có 7 dự án hoàn thành phần móng, đủ điều kiện được bán, cho thuê, cho thuê mua với quy mô 7.954 căn, 17 dự án được chấp thuận chủ trương đầu tư với quy mô 13.959 căn.
Như vậy, dự kiến trong năm 2025, TPHCM sẽ hoàn thành 9.896 căn nhà ở xã hội, đạt 75,9% kế hoạch năm 2025. Cả giai đoạn 2021-2025, TPHCM dự kiến hoàn thành 14.999 căn, đạt 82,7% kế hoạch 5 năm (trong đó, giai đoạn 2021-2024 hoàn thành 5.103 căn, năm 2025 dự kiến hoàn thành 9.896 căn).
Theo đại diện Sở Xây dựng TPHCM, trong thời gian qua, đơn vị đã tập trung rà soát, bổ sung quỹ đất quy hoạchnhà ở xã hộiđến năm 2040 làm cơ sở hoàn thiện hồ sơ Đồ án điều chỉnh Quy hoạch chung TP.HCM đến năm 2040, tầm nhìn đến năm 2060.
Trong đó, tập trung bố trí các khu đất có diện tích lớn từ 100 ha đến 200 ha và tiếp tục rà soát, bổ sung quỹ đất nhà ở xã hội giai đoạn 2030-2040 tại 2 khu vực Bình Dương và Bà Rịa-Vũng Tàu trong quá trình lập Quy hoạch chung TPHCM.
Sở cũng đang khẩn trương hoàn tất thủ tục pháp lý đối với các mẫu thiết kế nhà ở xã hội điển hình để các chủ đầu tư áp dụng nhằm rút ngắn thời gian thực hiện thủ tục hành chính;
Di dời 6.500 căn nhà ven kênh rạch
Về tiến độ chương trình di dời 6.500 căn nhà ven kênh rạch, trong giai đoạn 2021- 2025, TPHCM đặt ra chỉ tiêu bồi thường, di dời 6.500 căn nhà trên và ven kênh rạch. Đến nay, TP.HCM đã bồi thường, di dời 4.454 căn.
Theo phương án bố trí vốn hiện nay và cam kết của các địa phương, đến hết năm 2025, dự kiến sẽ bồi thường, di dời được 5.860 căn.
Trong đó trọng tâm triển khai thực hiện dự án nạo vét, cải tạo môi trường, xây dựng hạ tầng rạch Xuyên Tâm tại quận Bình Thạnh, Gò Vấp cũ à dự án cải tạo Bờ Bắc Kênh Đôi, quận 8 cũ; dự án nạo vét trục thoát nước Rạch Xóm Củi tại quận 8, huyện Nhà Bè, huyện Bình Chánh cũ."
https://tienphong.vn/bo-xay-dung-noi-ve-giai-phap-ha-nhiet-gia-nha-o-post1792134.tpo,Bộ Xây dựng nói về giải pháp hạ nhiệt giá nhà ở,"TPO - Bộ Xây dựng cho biết, giá nhà đất ở nhiều nơi không phản ánh đúng cung - cầu thực tế mà bị chi phối bởi đầu cơ, thông tin quy hoạch chưa minh bạch, sắp xếp điều chỉnh địa giới hành chính, tâm lý đám đông. Theo đó, cần thiết phải kiểm soát thị trường bất động sản, nhất là giải pháp điều tiết về cơ cấu sản phẩm nhà ở, giá giao dịch đất đai, nhà ở.","Mới đây, cử tri tỉnh Quảng Trị phản ánh, việc sắp xếp lại đơn vị hành chính khiến nhiều cán bộ, công chức phải di chuyển hàng trăm km đến trung tâm hành chính mới, kéo theo giá đất, thuê nhà và chi phí sinh hoạt tăng cao.
Trả lời cử tri,Bộ Xây dựngcho biết, thời gian qua, thị trường bất động sản tại nhiều địa phương diễn biến phức tạp, tiềm ẩn yếu tố bất ổn, ảnh hưởng đến khả năng tiếp cận nhà ở của người dân và sự phát triển lành mạnh của thị trường bất động sản.
Đặc biệt, tại các đô thị lớn, giá nhà tăng mạnh vượt xa khả năng chi trả của đại bộ phận người dân, nhất là nhóm thu nhập trung bình, thấp, nhóm hưởng lương như người lao động trong các doanh nghiệp, cán bộ, công chức, viên chức.
“Trong nhiều trường hợp, giá nhà đất nhiều nơi không còn phản ánh quy luật cung - cầu mà bị chi phối bởi đầu cơ, thông tin quy hoạch thiếu minh bạch, việc điều chỉnh địa giới hành chính và tâm lý đám đông”, Bộ Xây dựng nêu rõ.
Theo báo cáo của Bộ Xây dựng, trong 9 tháng đầu năm, giá bán sơ cấp trung bình chung cư tại Hà Nội, TPHCM từ 70 - 80 triệu đồng/m2. Một số dự án chung cư hạng sang tại Hà Nội ghi nhận giá bán 150 - 300 triệu đồng/m2.
Thực tế cho thấy,hiện tượng “sốt đất”không chỉ ở các đô thị lớn như Hà Nội, TPHCM mà còn lan tới nhiều tỉnh, thành có quy hoạch mở rộng trung tâm hành chính hoặc xây dựng khu công nghiệp mới. Các cơn sốt này khiến giá nhà đất tăng vọt, trong khi hạ tầng và tiện ích chưa theo kịp.
Làm gì để ổn định thịtrường?
Theo Bộ Xây dựng, để ổn địnhthị trườngvà đảm bảo người dân có thể tiếp cận nhà ở với giá phù hợp, cần thiết phải kiểm soát thị trường bất động sản, nhất là giải pháp điều tiết về cơ cấu sản phẩm nhà ở, giá giao dịch đất đai, nhà ở.
Bộ cho biết đang nghiên cứu, đề xuất cơ chế, chính sách thí điểm mô hình “Trung tâm giao dịch bất động sản và quyền sử dụng đất"" do Nhà nước quản lý nhằm tăng cường tính công khai, minh bạch của giao dịch bất động sản.
Đồng thời, Bộ cũng xây dựng và trình Chính phủ ban hành Nghị quyết về cơ chế kiểm soát,kiềm chế giá bất động sảnnhằm thiết lập cơ chế pháp lý đặc thù để kiểm soát, điều tiết, từng bước kéo giảm giá nhà ở về mức phù hợp với thu nhập của đại bộ phận người dân, đặc biệt là nhóm thu nhập trung bình và thấp; điều tiết thị trường theo hướng công khai, minh bạch, kiểm soát chặt hoạt động đầu cơ, thao túng giá.
Cùng với đó, xây dựng chính sách đồng bộ về đất đai, đầu tư, quy hoạch, tín dụng, thuế, và lựa chọn nhà đầu tư để phát triển mạnh mẽ nhà ở giá phù hợp. Kiểm soát biên độ lợi nhuận doanh nghiệp trong phân khúc này, coi đây là “giải pháp then chốt” để hạ giá thành sản phẩm.
Điều chỉnhcơ cấu thị trườngđang mất cân đối, tạo nguồn cung nhà ở thương mại giá phù hợp, từ đó kéo mặt bằng giá chung giảm xuống, tăng khả năng tiếp cận nhà ở của người dân có nhu cầu thực.
Ngoài ra, Bộ Xây dựng đang phối hợp các cơ quan liên quan rà soát, hoàn thiện hệ thống pháp luật về nhà ở, kinh doanh bất động sản, quy hoạch đô thị và xây dựng. Việc này nhằm tháo gỡ các vướng mắc, hoàn thiện hành lang pháp lý cho thị trường phát triển bền vững.
Một trong những nhiệm vụ trọng tâm là thúc đẩy chương trình xây dựng ít nhất 1 triệu căn nhà ở xã hội đến năm 2030 nhằm đáp ứng nhu cầu chỗ ở cho người thu nhập thấp.
Ngoài ra, Bộ cũng xây dựng, trình Chính phủ ban hành Nghị định sửa đổi Nghị định 94/2024 về xây dựng và quản lý hệ thống thông tin, cơ sở dữ liệu về nhà ở và thị trường bất động sản để làm cơ sở xây dựng, vận hành cơ sở dữ liệu quốc gia về nhà ở và thị trường bất động sản. Đồng thời, chủ trì, phối hợp vớiBộ Tài chínhsớm hoàn thiện khung pháp lý thành lập Quỹ nhà ở quốc gia.
Theo Bộ Xây dựng, việc thiết lập công cụ pháp lý để kiểm soát và điều tiết thị trường bất động sản không chỉ giúp hạ nhiệt giá nhà, mà còn góp phần đảm bảo an sinh xã hội, ổn định kinh tế vĩ mô."
https://tienphong.vn/tphcm-chi-con-9-can-ho-co-gia-ban-duoi-3-ty-dong-post1792046.tpo,TPHCM chỉ còn 9% căn hộ có giá bán dưới 3 tỷ đồng,"TPO - Thị trường căn hộ phía Nam ngày càng phân hóa rõ rệt. Cụ thể, căn hộ dưới 3 tỷ đồng chỉ chiếm 9% tổng số giao dịch tại TPHCM. Ngược lại, tại các tỉnh lân cận, căn hộ dưới 3 tỷ đồng chiếm đến hơn 60% lượng giao dịch.","Báo cáo tiêu điểm thị trường bất động sản của Savills TPHCM cho biết, trong 9 tháng năm 2025, loại hình căn hộ ghi nhận sự trở lại thận trọng của nguồn cung mới và tỷ lệ hấp thụ cải thiện, nhưng khả năng chi trả là thách thức lớn nhất.
Trong quý III/2025, nguồn cung sơ cấp căn hộ TPHCM đạt 5.200 căn, nguồn cung mới đạt 2.000 căn - đến từ một dự án mới và năm giai đoạn tiếp theo. Các chủ đầu tư vẫn tập trung phát triển phân khúc trung cấp. Dù có dấu hiệu cải thiện, nguồn cung hiện tại vẫn chưa đủ để đáp ứng nhu cầu thực tế.
Lượng giao dịch trong quý III năm nay tăng lên 2.700 căn, với tỷ lệ hấp thụ đạt 51%, nhờ nhu cầu ở thực và đầu tư ổn định. Trong năm qua, cả thị trường sơ cấp và thứ cấp đều ghi nhận mức tăng giá mạnh.
Phân hóa rõ rệt
Theo Savills, dù thị trường có điều chỉnh giảm nhẹ trong quý III/2025 do các ưu đãi lớn được triển khai tại các dự án quy mô nhằm giải phóng hàng tồn kho đã bàn giao, nhưng xu hướng chung của thị trường vẫn duy trì đà tăng trưởng.
Thị trường căn hộ phía Nam ngày càng phân hóa rõ rệt. Cụ thể, căn hộ dưới 3 tỷ đồng chỉ chiếm 9% giao dịch tại TPHCM. Ngược lại, tại các tỉnh lân cận, căn hộ dưới 3 tỷ đồng chiếm đến hơn 60% lượng giao dịch. Đặc biệt, Bình Dương cũ nắm giữ đến 90% lượng giao dịch căn hộ giá phải chăng của khu vực.
Theo báo cáo của CBRE Việt Nam, quý III/2025, TPHCM ghi nhận hơn 2.500 căn hộ và 220 căn nhà thấp tầng mở bán mới - mức tăng mạnh nhất kể từ đầu năm. Tuy nhiên, giá nhà sơ cấp bình quân đã đạt tới 87 triệu đồng/m2, tăng hơn 30% so với cùng kỳ khiến giấc mơ mua nhà của nhiều người càng xa vời.
Giá tăng không chỉ ở dự án mới mà còn lan sang thị trường thứ cấp, nơi mỗi mét vuông căn hộ đã chạm 60 triệu đồng. Dù giao dịch tăng hơn 60% so với quý trước, tỷ lệ hấp thụ lại giảm còn 68%, phản ánh tâm lý thận trọng của người mua trong bối cảnh giá liên tục leo thang.
Trong khi giá nhà tại TPHCM tiếp tục lập đỉnh, các khu vực giáp ranh như Bình Dương (cũ) lại trở thành điểm đến mới của người mua nhà. Riêng Bình Dương (cũ) chỉ 9 tháng đầu năm 2025 đã có gần 11.000 căn hộ giá dưới 60 triệu/m2 mở bán và trở thành “vùng đệm” hấp dẫn cho người có thu nhập trung bình.
Việc chênh lệch giá giữa TPHCM và vùng ven hiện lên tới 50 - 70%, trong khi hạ tầng kết nối ngày càng hoàn thiện như cao tốc TPHCM - Long Thành - Dầu Giây, Vành đai 3… tạo động lực để người dân dịch chuyển ra ngoài trung tâm, vừa giảm áp lực chi phí, vừa cải thiện chất lượng sống.
Khó tiếp cận
Ông Võ Huỳnh Tuấn Kiệt, Giám đốc Bộ phận nhà ở CBRE cho biết, tại TPHCM các dự án có giá trên 120 triệu đồng/m2 ngày càng phổ biến, đẩy toàn thị trường nghiêng hẳn về phân khúc cao cấp. Trong khi đó, nguồn cung căn hộ tầm trung, vốn phục vụ nhóm khách hàng mua để ở đã gần như “mất hút”.
Đối với những đô thị lớn như TPHCM, quy mô dân số hiện nay rất cao, điều đó đồng nghĩa với việc, nhu cầu về nhà ở thực của phần lớn người dân cũng không ngừng gia tăng. Dẫu vậy, nguồn cung trên thị trường chủ yếu tập trung vào phân khúc cao cấp, khiến những người có nhu cầu ở thực thuộc phân khúc trung cấp, đặc biệt là các gia đình trẻ hay người có thu nhập trung bình, gần như không thể tiếp cận được.
Đáng chú ý, số liệu của DKRA Group cho thấy, trong hơn 2.000 giao dịch 9 tháng đầu năm, 70% là nhà đầu tư, chỉ 30% là người mua để ở. Giao dịch chủ yếu xoay quanh nhóm khách hàng đã sở hữu từ hai bất động sản trở lên, mua để tích sản hoặc lướt cọc hưởng chênh lệch.
Trong khi đó, VARS IRE ghi nhận 80% lượng căn hộ chào bán có giá trên 80 triệu đồng/m2, trong khi phân khúc bình dân, vốn là “xương sống” của thị trường bất động sản, gần như biến mất suốt 3 năm qua.
Cũng theo báo cáo của Savills, phân khúc nhà ở thấp tầng tiếp tục hạn chế về nguồn cung, với hàng tồn kho giá cao chiếm ưu thế. Tuy nhiên, thanh khoản đã có dấu hiệu tích cực hơn trong quý III/2025, tập trung tại các khu vực phía Tây và phía Nam thành phố.
Tuy nhiên, cơ cấu giá trên 30 tỷ đồng tiếp tục chiếm ưu thế trên thị trường. Tình hình hoạt động trong quý III/2025 được cải thiện, với tỷ lệ hấp thụ tăng lên 24%. Động lực hấp thụ này được thúc đẩy bởi nguồn cung mới giá hợp lý tham gia thị trường, giúp giải quyết vấn đề cung cầu hiện hữu. Nguồn cung mới chiếm 50% tổng giao dịch, với tỷ lệ hấp thụ đạt 89%.
Các chuyên gia Savills kỳ vọng phân khúc nhà ở thấp tầng sẽ mở rộng ra các khu vực ngoại thành và các tỉnh lân cận dọc theo các tuyến hạ tầng trọng điểm. Sau thời gian dài khan hiếm nguồn cung, thị trường nhà ở liền thổ tại khu vực ngoại thành được trở lại với các dự án đô thị quy mô lớn, đặc biệt tại Cần Giờ."
