url,title,description,content
https://tienphong.vn/nhung-chinh-sach-noi-bat-co-hieu-luc-tu-thang-112025-post1792098.tpo,Những chính sách nổi bật có hiệu lực từ tháng 11/2025,"TPO - Từ tháng 11/2025, nhiều chính sách mới có hiệu lực như: Phải báo cáo khi chuyển tiền từ 500 triệu đồng; Quy định xử lý hành vi chậm đóng, trốn đóng bảo hiểm xã hội; Ngân hàng được giao, nhận vàng miếng...","Phải báo cáo khi chuyển tiền từ 500 triệu đồng
Từ ngày 1/11, Thông tư số 27/2025/TT-NHNN hướng dẫn thực hiện một số điều của Luật Phòng, chống rửa tiền quy định nội dung báo cáo giao dịch chuyển tiền điện tử trong nước và quốc tế, chính thức có hiệu lực.
Thông tư trên quy định, đối với giao dịch chuyển tiền điện tử trong nước từ 500 triệu đồng trở lên hoặc bằng ngoại tệ tương đương; giao dịch quốc tế từ 1.000 USD trở lên hoặc bằng ngoại tệ khác có giá trị tương đương phải báo cáo cơ quan chức năng có thẩm quyền dưới dạng điện tử.
Ngoài ra, thông tư cũng quy định mức giá trị của ngoại tệ tiền mặt, đồng Việt Nam tiền mặt, kim loại quý, đá quý, công cụ chuyển nhượng phải khai báo hải quan cửa khẩu khi cá nhân xuất cảnh, nhập cảnh và giấy tờ xuất trình. Cụ thể, mức giá trị của kim loại quý (trừ vàng), đá quý là 400 triệu đồng.
Quy định xử lý hành vi chậm đóng, trốn đóng bảo hiểm xã hội
Nghị định số 274/2025/NĐ-CP quy định chi tiết thi hành một số điều của Luật Bảo hiểm xã hội 2024 về chậm đóng, trốn đóng bảo hiểm xã hội (BHXH) bắt buộc, bảo hiểm thất nghiệp và giải quyết khiếu nại, tố cáo về bảo hiểm xã hội, có hiệu lực từ ngày 30/11.
Theo quy định, cơ quan BHXH quản lý trực tiếp đối tượng tham gia bảo hiểm xã hội bắt buộc, bảo hiểm thất nghiệp có trách nhiệm xác định hành vi chậm đóng, trốn đóng BHXH bắt buộc, bảo hiểm thất nghiệp; áp dụng hoặc trình cấp có thẩm quyền áp dụng các biện pháp xử lý hành vi chậm đóng, trốn đóng BHXH bắt buộc, bảo hiểm thất nghiệp.
Hằng tháng, cơ quan BHXH quản lý trực tiếp đối tượng tham gia BHXH bắt buộc, bảo hiểm thất nghiệp xác định số tiền BHXH bắt buộc, bảo hiểm thất nghiệp chậm đóng, trốn đóng và số ngày đóng, trốn đóng BHXH bắt buộc, bảo hiểm thất nghiệp; tính số tiền người sử dụng lao động phải nộp bằng 0,03 %/ngày đối với số tiền chậm đóng, trốn đóng; thông báo với người sử dụng lao động để đối chiếu; tổ chức thu và quản lý theo quy định.
Từ 15/11, ngân hàng được giao, nhận vàng miếng
Ngày 15/11, Thông tư số 33/2025/TT-NHNN sửa đổi, bổ sung Thông tư số 17/2014/TT-NHNN quy định về phân loại, đóng gói và giao nhận kim khí quý, đá quý, chính thức có hiệu lực.
Theo đó, Ngân hàng Nhà nước và các tổ chức tín dụng được phép giao, nhận vàng miếng theo hợp đồng mua, bán hoặc gia công. Việc giao nhận phải thực hiện theo đúng quy trình, có giấy tờ hợp pháp, niêm phong rõ ràng và chịu trách nhiệm về chất lượng, khối lượng vàng miếng.
Thông tư cũng quy định cụ thể tiêu chuẩn phân loại vàng làm ba nhóm: vàng trang sức - mỹ nghệ (hàm lượng từ 8 Kara trở lên), vàng miếng (có ký mã hiệu, thông số, tiêu chuẩn rõ ràng) và vàng nguyên liệu (dưới dạng thỏi, hạt, miếng). Bao bì vàng miếng phải được chống giả theo quy chuẩn của ngân hàng thương mại hoặc doanh nghiệp được phép sản xuất vàng miếng.
Việc đóng gói và niêm phong được quy định: vàng miếng cùng chất lượng được đóng thành lô 100 hoặc bội số của 100 miếng (tối đa 500 miếng), vàng nguyên liệu đóng thành lô 5 hoặc bội số của 5 thỏi (tối đa 25 thỏi), trong hộp kim loại không gỉ, có niêm phong và ghi rõ thông tin kiểm nhận.
Điều chỉnh về giấy tờ tùy thân khi sử dụng dịch vụ thanh toán không dùng tiền mặt
Ngân hàng Nhà nước Việt Nam sửa đổi, bổ sung một số điều về cung ứng dịch vụ thanh toán không dùng tiền mặt tại Thông tư 30/2025/TT-NHNN, có hiệu lực từ 18/11.
Theo đó, giấy tờ tùy thân được sử dụng trong Thông tư này khi thanh toán không dùng tiền mặt đã có sự thay đổi so với quy định cũ. Cụ thể, công dân Việt Nam (thẻ CCCD, thẻ Căn cước hoặc Căn cước định danh điện tử); Người gốc Việt Nam chưa xác định được quốc tịch (Giấy chứng nhận gốc Việt Nam do cơ quan có thẩm quyền cấp).
Đối với người nước ngoài cư trú tại Việt Nam bao gồm: Hộ chiếu hoặc giấy tờ xác minh nhân thân do cơ quan có thẩm quyền nước ngoài cấp, hoặc giấy tờ theo thị thực nhập cảnh, giấy tờ thay thế thị thực, giấy tờ chứng minh được miễn thị thực nhập cảnh, hoặc danh tính điện tử (qua tài khoản định danh điện tử mức độ 2, nếu có).
Không yêu cầu xuất trình bản chính, bản sao khi đã có trên VNeID
Nghị định 280/2025/NĐ-CP sửa đổi, bổ sung một số điều của Nghị định số 23/2015/NĐ-CP về cấp bản sao từ sổ gốc, chứng thực bản sao từ bản chính, chứng thực chữ ký và chứng thực hợp đồng, giao dịch, được sửa đổi, bổ sung bởi Nghị định số 07/2025/NĐ-CP, chính thức có hiệu lực từ ngày 1/11.
Trong đó, bổ sung khoản 8 và khoản 9 vào Điều 9, “không yêu cầu người yêu cầu chứng thực nộp, xuất trình bản chính hoặc bản sao các giấy tờ, tài liệu đã được tích hợp trên VNeID khi người yêu cầu chứng thực đã xuất trình thông tin tương ứng từ VNeID”.
Trong trường hợp người yêu cầu chứng thực đề nghị và người thực hiện chứng thực có thể khai thác thông tin, giấy tờ từ Cơ sở dữ liệu quốc gia về dân cư hoặc các cơ sở dữ liệu khác theo quy định của pháp luật thì người thực hiện chứng thực có trách nhiệm thực hiện việc khai thác thông tin, giấy tờ từ các cơ sở dữ liệu này, không yêu cầu người yêu cầu chứng thực xuất trình bản chính, bản sao từ sổ gốc hoặc bản sao có chứng thực đối với các thông tin, giấy tờ đã được khai thác."
https://tienphong.vn/dot-kich-3-co-so-san-xuat-my-pham-gia-thu-giu-hang-nghin-san-pham-mang-thuong-hieu-noi-tieng-post1792129.tpo,"Đột kích 3 cơ sở sản xuất mỹ phẩm giả, thu giữ hàng nghìn sản phẩm mang thương hiệu nổi tiếng","TPO - Thực hiện kế hoạch phá án, nhiều tổ công tác của Phòng Cảnh sát kinh tế Công an TPHCM đã đồng loạt triển khai khám xét 2 cơ sở sản xuất và 1 kho hàng thu giữ hàng ngàn sản phẩm mỹ phẩm giả mang các thương hiệu nổi tiếng như Vichy, My Gold Korea Red Ginseng… cùng nhiều máy móc, thiết bị, nguyên liệu và vật tư phục vụ sản xuất hàng giả. Số hàng giả được xác định có giá trị tương đương hàng thật lên đến nhiều tỷ đồng.","Ngày 31/10, Phòng Cảnh sát kinh tế, Công an TPHCM thông tin về vụ triệt phá đường dây sản xuất, buôn bán mỹ phẩm giả quy mô lớn, hoạt động tinh vi trên địa bàn thành phố và nhiều tỉnh lân cận.
Động thái này diễn ra trong đợt cao điểm đấu tranh phòng, chống buôn lậu, gian lận thương mại và hàng giả theo chỉ đạo của Bộ Công an.
Qua công tác trinh sát, lực lượng chức năng phát hiện tại số 20 đường Kênh 4 (phường Tân Tạo, TP.HCM) có dấu hiệu sản xuất mỹ phẩm giả các nhãn hiệu nổi tiếng.
Xác minh ban đầu xác định Nguyễn Đức Khánh (sinh năm 1982, ngụ xã Rạch Kiến, tỉnh Tây Ninh) là người cầm đầu, thuê nhiều người tổ chức pha chế, đóng gói, đưa hàng giả ra thị trường tiêu thụ.
Ngoài cơ sở tại TP.HCM, Khánh còn điều hành một xưởng sản xuất khác ở Tây Ninh. Hỗ trợ Khánh tiêu thụ hàng giả là Khổng Đức Hồng (sinh năm 1992, ngụ phường Bình Trị Đông, TP.HCM) và Bùi Thị Mộng Thu (sinh năm 1987, thường trú tại tỉnh Vĩnh Long). Nhóm đối tượng đã lợi dụng mạng xã hội, các hội nhóm trực tuyến và dịch vụ chuyển phát nhanh để quảng bá, giao hàng giả đến nhiều tỉnh, thành trên cả nước.
Triển khai kế hoạch phá án, nhiều tổ công tác của Phòng Cảnh sát kinh tế đã đồng loạt khám xét ba địa điểm gồm hai cơ sở sản xuất và một kho hàng.
Tại hiện trường, công an thu giữ hàng nghìn sản phẩm mỹ phẩm giả mang các thương hiệu nổi tiếng như Vichy, My Gold Korea Red Ginseng…, cùng nhiều máy móc, nguyên liệu và vật tư phục vụ sản xuất. Số hàng giả bị thu giữ có giá trị tương đương hàng thật lên tới nhiều tỷ đồng.
Căn cứ tài liệu, chứng cứ thu thập được, Cơ quan Cảnh sát điều tra – Công an TP.HCM đã khởi tố bị can và bắt tạm giam Nguyễn Đức Khánh, Khổng Đức Hồng và Bùi Thị Mộng Thu để điều tra về hành vi, đồng thời tiếp tục mở rộng điều tra các hành vi liên quan.
Kết quả trên thể hiện tinh thần kiên quyết đấu tranh, trấn áp tội phạm kinh tế của Công an TP.HCM trong đợt cao điểm phòng, chống buôn lậu, hàng giả; góp phần bảo vệ quyền lợi người tiêu dùng và giữ vững môi trường kinh doanh lành mạnh trên địa bàn."
https://tienphong.vn/giam-doc-cong-an-ha-noi-kiem-tra-co-so-san-xuat-ho-kinh-doanh-o-la-phu-post1792224.tpo,"Giám đốc Công an Hà Nội kiểm tra cơ sở sản xuất, hộ kinh doanh ở La Phù","TPO - Ngày 31/10, Trung tướng Nguyễn Thanh Tùng – Giám đốc Công an TP Hà Nội cùng đại diện các sở, ngành TP Hà Nội kiểm tra thực tế tại các cơ sở sản xuất, hộ kinh doanh tại làng nghề La Phù, để lắng nghe những khó khăn, vướng mắc trong sản xuất, kinh doanh.","Việc kiểm tra thực tế nhằm tham mưu lãnh đạo UBND TP Hà Nội có giải pháp tháo gỡ những ""điểm nghẽn"" về cơ chế chính sách, qua đó tạo điều kiện cho các hộ kinh doanh phát triển tốt nhất về kinh tế tư nhân, góp phần thúc đẩy phát triển kinh tế toàn thành phố.
Tại buổi làm việc, các chủ cơ sở cho biết, thời gian trước có sản xuất hàng kém chất lượng, kinh doanh các mặt hàng bánh, kẹo không có hóa đơn, chứng từ. Tuy nhiên, được sự quan tâm, chỉ đạo sát sao của các cấp ủy Đảng, chính quyền địa phương cùng sự vào cuộc quyết liệt của các lực lượng chức năng như công an, quản lý thị trường, thuế, công thương… công tác quản lý, kiểm tra và tuyên truyền đã được đẩy mạnh, ý thức người dân ngày càng được nâng cao.
Các chủ cơ sở khẳng định không còn tình trạng sản xuất hàng kém chất lượng, kinh doanh các mặt hàng không hóa đơn chứng từ tạo điều kiện thuận lợi để các cơ sở cạnh tranh kinh doanh lành mạnh.
Trung tướng Nguyễn Thanh Tùng khẳng định, việc chú trọng công tác bảo vệ môi trường, phòng chống hàng giả, hàng nhái và hàng kém chất lượng không chỉ góp phần xây dựng hình ảnh làng nghề văn minh, phát triển bền vững mà còn thể hiện rõ trách nhiệm của mỗi cá nhân, cơ sở sản xuất đối với cộng đồng và xã hội.
""Đây không chỉ là nhiệm vụ riêng của làng nghề La Phù, mà là yêu cầu chung đối với tất cả các làng nghề trên địa bàn thành phố Hà Nội"" - Trung tướng Nguyễn Thanh Tùng nhấn mạnh.
Trung tướng Nguyễn Thanh Tùng đề nghị các sở, ngành cần chủ động tham mưu giải pháp tháo gỡ khó khăn, hỗ trợ phát triển làng nghề bền vững theo Quyết định 282/2025 của UBND Thành phố. Cơ sở sản xuất, kinh doanh phải tuân thủ pháp luật, cạnh tranh lành mạnh, bảo vệ người tiêu dùng và môi trường.
Đồng thời đề nghị lực lượng chức năng tăng cường kiểm tra, xử lý nghiêm các vi phạm; đẩy mạnh tuyên truyền, vận động người dân và doanh nghiệp tố giác hành vi vi phạm, góp phần xây dựng môi trường kinh doanh an toàn, lành mạnh, phát triển bền vững.
Trên địa bàn Thủ đô hiện có 327 làng nghề được công nhận và 488 làng có nghề, phân bố trong 6 nhóm ngành chính từ chế biến nông-lâm-thủy sản, sản xuất thủ công mỹ nghệ đến dệt may, gỗ, cơ khí nhỏ và dịch vụ nông thôn. Làng nghề La Phù, thuộc xã An Khánh, với 717 cơ sở sản xuất, kinh doanh. Từ năm 2022 đến tháng 6/2025, lực lượng chức năng đã kiểm tra xử lý 60 cơ sở, khởi tố 5 vụ án, 9 bị can về tội sản xuất, buôn bán hàng giả, hàng giả là thực phẩm, xâm phạm sở hữu công nghiệp; xử phạt hành chính 55 vụ với tổng số tiền 2,211 tỷ đồng.
Trước đó, vào tháng 6/2026, Trung tướng Nguyễn Thanh Tùng đã từng dẫn đầu đoàn công tác gồm đại diện lãnh đạo Công an thành phố, Sở Công Thương Hà Nội và UBND huyện Hoài Đức đến làm việc và kiểm tra thực tế hoạt động sản xuất kinh doanh và công tác đấu tranh chống hàng lậu, hàng giả, gian lận thương mại, xâm phạm quyền sở hữu trí tuệ và vi phạm về an toàn thực phẩm trên địa bàn xã La Phù, huyện Hoài Đức. Đoàn công tác đã kiểm tra thực tế tại một số cơ sở sản xuất, kinh doanh hàng hóa tiêu dùng, mặt hàng bánh kẹo truyền thống – lĩnh vực đặc trưng tại La Phù."
https://tienphong.vn/mot-pho-phong-ngan-hang-lua-48-ty-dong-de-dau-tu-tai-chinh-qua-mang-post1792254.tpo,"Một phó phòng ngân hàng lừa 4,8 tỷ đồng để đầu tư tài chính qua mạng","TPO - Lợi dụng sự tin tưởng của người quen, một phó phòng ngân hàng ở Đắk Lắk đã vay hơn 4,8 tỷ đồng với lý do “đáo hạn cho khách” nhưng thực chất để đầu tư tài chính qua mạng.","Ngày 31/10, Văn phòng Cơ quan Cảnh sát điều tra Công an tỉnhĐắk Lắkđã tống đạt quyết định khởi tố bị can, bắttạm giam4 tháng đối với Tống Minh Hòa (32 tuổi, trú xã Ea Knốp, tỉnh Đắk Lắk) về hành vi “Lừa đảo chiếm đoạt tài sản”.
Theo điều tra, năm 2024, Hòa là Phó phòng giao dịch của một ngân hàng ở phường Buôn Ma Thuột (Đắk Lắk). Từ khoảng tháng 5/2024, Hòa bắt đầu tìm hiểu và tham gia đầu tư tài chính trên mạng. Thời gian đầu tham gia thấy có lời nên Hòa tiếp tục đầu tư số tiền lớn hơn.
Để có vốn, Hòa nói dối một phụ nữ ở tỉnh Lâm Đồng cần tiền đáo hạn cho khách hàng và vay tổng cộng 4,8 tỷ đồng, cam kết trả gốc và lãi đầy đủ.
Tin tưởng vì Hòa đang là cán bộ ngân hàng, người phụ nữ nhiều lần cho vay. Tuy nhiên, Hòa dùng toàn bộ tiền để đầu tư và trả nợ cá nhân, sau đó thua lỗ, bỏ việc và bỏ trốn.
Sau khi nhận được đơn tố giác, cơ quan công an đã vào cuộc điều tra, củng cố chứng cứ và bắt giữ Hòa để xử lý theo quy định pháp luật."
https://tienphong.vn/chu-kenh-tiktok-gia-dinh-hai-sen-bi-cao-buoc-che-giau-doanh-thu-86-ty-dong-post1792232.tpo,Chủ kênh TikTok 'Gia đình Hải Sen' bị cáo buộc che giấu doanh thu 86 tỷ đồng,"TPO - Theo cơ quan điều tra, Công ty TNHH Hải Bé, chủ kênh TikTok “Gia đình Hải Sen”, doanh thu thực tế hơn 101 tỷ đồng, nhưng chỉ kê khai 15 tỷ đồng bỏ ngoài sổ sách gần 86 tỷ đồng.","Cụ thể, quá trình mở rộng điều tra vụ án “Buôn bán hàng giả là thực phẩm” xảy ra tại Công ty TNHH Hải Bé (trụ sở tại xã Văn Phú, huyện Nho Quan, nay là xã Thanh Sơn, tỉnh Ninh Bình), Cơ quan CSĐT Công an tỉnh Ninh Bình đã ra quyết định bổ sung khởi tố vụ án và khởi tố bị can đối với Trần Đại Phúc (SN 1990, trú xã Giao Thủy, Ninh Bình) và Lê Văn Hải (SN 1996, trú xã Thanh Sơn, Ninh Bình) về hành vi “Trốn thuế”.
Theo cơ quan điều tra, cả hai bị can là đồng sáng lập Công ty TNHH Hải Bé, trong đó Lê Văn Hải là chủ tài khoản mạng xã hội TikTok “Gia đình Hải Sen”, thường xuyên đăng tải video quảng cáo và bán các sản phẩm mỹ phẩm, thực phẩm chức năng.
Theo kết quả điều tra, từ năm 2022 đến tháng 6/2025, các bị can Trần Đại Phúc và Lê Văn Hải đã lợi dụng các nền tảng mạng xã hội như TikTok, Facebook, Shopee để bán hàng với quy mô lớn, nhưng chỉ báo cáo với cơ quan thuế doanh thu hơn 15 tỷ đồng, trong khi doanh thu thực tế vượt 101 tỷ đồng, chênh lệch gần 86 tỷ đồng.
Để trốn thuế, các bị can đã sử dụng nhiều thủ đoạn tinh vi, trong đó có: Không xuất hóa đơn giá trị gia tăng (GTGT) cho từng lần bán hàng; Thành lập nhiều hộ kinh doanh cá thể để bán hàng cho chính Công ty TNHH Hải Bé, nhằm chỉ phải nộp thuế khoán, không phải kê khai chi tiết, không xuất hóa đơn GTGT;
Thống nhất với bên bán chỉ xuất hóa đơn cho một phần hàng hóa đã giao dịch thực tế, nhằm hợp thức hóa sổ sách kế toán. Bằng các phương thức này, nhóm đối tượng đã trốn thuế gần 9 tỷ đồng.
Từ bán hàng online đến buôn bán hàng giả
Trước đó, ngày 14/6/2025, Cơ quan Cảnh sát điều tra Công an tỉnh Ninh Bình đã khởi tố vụ án hình sự và khởi tố bị can đối với Trần Đại Phúc, Giám đốc Công ty TNHH Hải Bé và Lê Văn Hải, chủ kênh TikTok “Gia đình Hải Sen”, về tội “Buôn bán hàng giả là thực phẩm”.
Qua công tác nắm tình hình trên không gian mạng, lực lượng công an phát hiện tài khoản TikTok “Gia đình Hải Sen” thường xuyên quảng cáo, livestream bán các sản phẩm mỹ phẩm và thực phẩm chức năng, trong đó có “Siro ăn ngon Hải Bé”, sản phẩm được phản ánh không đảm bảo chất lượng.
Khi kiểm tra Công ty TNHH Hải Bé, cơ quan chức năng thu giữ nhiều hàng hóa là mỹ phẩm và thực phẩm chức năng không có hóa đơn, chứng từ chứng minh nguồn gốc.Kết quả giám định cho thấy, hàm lượng các chất chính như Vitamin A, Calci, Vitamin C chỉ đạt dưới 70% so với công bố, xác định đây là hàng giả.
Theo điều tra, từ năm 2024 đến nay, Công ty TNHH Hải Bé đã bán ra hơn 800.000 sản phẩm qua các kênh TikTok Shop, Facebook, Shopee với các tên tài khoản “Gia đình Hải Sen”, “Hải Sen”. Riêng sản phẩm “Siro ăn ngon Hải Bé” đã được tiêu thụ trên 100.000 hộp khắp cả nước.
Cơ quan Cảnh sát điều tra Công an tỉnh Ninh Bình đang tiếp tục mở rộng điều tra, làm rõ hành vi trốn thuế, buôn bán hàng giả và trách nhiệm của các cá nhân, tổ chức có liên quan để xử lý theo quy định của pháp luật."
