url,title,description,content
https://tienphong.vn/thi-thiet-ke-ve-tinh-ascend-2026-tai-viet-nam-tim-dai-dien-thi-quoc-te-o-kazakhstan-post1794242.tpo,"Thi thiết kế vệ tinh ASCEND 2026 tại Việt Nam, tìm đại diện thi quốc tế ở Kazakhstan","Cuộc thi ASCEND 2026 mang đến cho học sinh Việt Nam cơ hội hiếm có được trải nghiệm quy trình thiết kế và thử nghiệm phóng vệ tinh mini dưới sự hướng dẫn của chuyên gia quốc tế, đồng thời tranh tài để đại diện Việt Nam dự thi tại Kazakhstan.","Ngày 22/10, The Global Citizen Education Group (TGCEG) đã chính thức công bố khởi động Cuộc thi Thiết kế Vệ tinh ASCEND 2026 - AEROO Satellite Challenge for Empowering Next-Gen Developers tại Việt Nam. Đây là lần đầu tiên một cuộc thi với quy mô và hình thức độc đáo này được tổ chức, mở ra cơ hội tiếp cận với khoa học vũ trụ cho học sinh THPT trên cả nước.
ASCEND 2026 được tổ chức bởi The Global Citizen Education Group và AEROO, dưới sự bảo trợ của Chính phủ Kazakhstan. Cuộc thi nhằm thúc đẩy tinh thần đam mê khoa học không gian, đổi mới sáng tạo trong học sinh. Sự kiện tạo môi trường để học sinh ứng dụng kiến thức STEM liên ngành, phát huy tư duy thiết kế (Design Thinking) và tinh thần khởi nghiệp (Entrepreneurship) để giải quyết các vấn đề thực tiễn. Cuộc thi là vòng loại quốc gia chính thức, tìm kiếm đội vô địch đại diện Việt Nam tham dự Vòng Chung kết Quốc tế tại Astana, Kazakhstan.
Đối tượng dự thi là học sinh đang sinh sống tại Việt Nam, độ tuổi từ 14-18 tuổi (tính đến ngày 07/03/2026). Các dự án dự thi sẽ tập trung vào 04 lĩnh vực chính: Sứ mệnh Mở; Trái Đất & Môi trường; Cộng đồng & Cơ sở hạ tầng; và Khoa học & Giáo dục.
Học sinh tham dự theo nhóm 04 thành viên. Đội vô địch vòng chung kết Quốc gia sẽ trở thành đại diện Việt Nam nhận được một chuyến đi tài trợ toàn phần tới thủ đô Astana, Kazakhstan tham dự vòng Chung kết Quốc tế International Space Day 2026. Tại đây các em sẽ được tự tay chế tạo và phóng vệ tinh của chính mình lên tầng bình lưu.
Khác biệt với các cuộc thi ý tưởng, ASCEND tập trung vào quá trình học tập thực tiễn. Xuyên suốt cuộc thi, các đội thi sẽ tham gia chuỗi huấn luyện trực tuyến độc quyền với các chuyên gia quốc tế từ AEROO và TGCEG để được hướng dẫn từ giai đoạn hình thành ý tưởng, thiết kế kỹ thuật, đến xây dựng kế hoạch kinh doanh.
Với thông điệp ""Kiến tạo vệ tinh, chinh phục không gian"", ASCEND 2026 kỳ vọng trở thành bệ phóng cho những dự án công nghệ đột phá của học sinh Việt Nam, đặc biệt là ở lĩnh vực khoa học công nghệ vũ trụ.
ASCEND hứa hẹn không chỉ là một sân chơi công nghệ, mà còn là nơi ươm mầm thế hệ kỹ sư, nhà khoa học và doanh nhân công nghệ tương lai, góp phần xây dựng một Việt Nam năng động, sáng tạo và sẵn sàng hội nhập với ngành công nghiệp không gian toàn cầu."
https://tienphong.vn/phat-hien-cac-loai-thu-cuc-ky-bi-an-o-viet-nam-post1794303.tpo,Phát hiện các loài thú cực kỳ bí ẩn ở Việt Nam,TPO - Tổ chức Quốc tế bảo vệ thiên nhiên (WWF) vừa công bố hình ảnh những loài thú vô cùng bí ẩn và hiếm gặp ở Việt Nam trong suốt mấy chục năm qua. Đây là kết quả của đợt bẫy ảnh lớn nhất lịch sử tại 21 khu vực rừng đặc dụng Việt Nam kéo dài bốn năm.,"Trong khuôn khổ Dự án Bảo tồn Đa dạng Sinh học do USAID tài trợ, WWF-Việt Nam và WWF-Hoa Kỳ phối hợp với các Ban quản lý rừng địa phương và Viện nghiên cứu Động vật hoang dã Leibniz thực hiện khảo sát và đặt bẫy ảnh tại 21 khu rừng đặc dụng tại Việt Nam.
Dự án nhằm nghiên cứu nhằm theo dõi những thay đổi quan trọng trong quần thể các loài thú và chim sống dưới mặt đất, đồng thời đánh giá hiệu quả các nỗ lực bảo tồn đa dạng sinh học đang được triển khai.
Kết quả khảo sát cho thấy, mức độ phong phú của các loài thú và chim đang có chiều hướng gia tăng – dấu hiệu tích cực cho sự phục hồi của hệ sinh thái. Tuy nhiên, các mối đe dọa vẫn tồn tại dai dẳng, đặc biệt là nạn đặt bẫy, khiến những thành quả này trở nên mong manh.
Khảo sát ghi nhận ít nhất 49 loài thú và 11 loài chim trĩ, trong đó có 9 loài đặc hữu của Trung Trường Sơn và 22 loài bị đe dọa toàn cầu.
Đáng chú ý nhất là các bằng chứng ghi nhận mang lớn, gấu ngựa và cầy giông đốm lớn - đây là những ghi nhận hiếm hoi về các loài này trong hai thập kỷ qua. Đặc biệt, tỷ lệ xuất hiện của tê tê đã tăng tại nhiều khu vực, nhất là tại Vườn Quốc gia Cát Tiên. Nhìn chung, mức độ phong phú loài tăng đáng kể tại 16 địa điểm, và không có nơi nào ghi nhận sự suy giảm.
Tuy nhiên, kết quả khảo sát cũng ghi nhận sự vắng mặt của các loài thú ăn thịt và thú ăn cỏ cỡ trung bình hoặc lớn (như hổ, báo hoa mai, báo gấm, mèo rừng vàng châu Á, và sao la) cho thấy hậu quả của nạn đặt bẫy kéo dài trong nhiều thập kỷ.
Theo các chuyên gia của WWF- Việt Nam, hầu hết các loài được ghi nhận là những loài có khả năng phục hồi trước các áp lực săn bắt cao. Các dữ liệu cho thấy chúng chủ yếu xuất hiện ở những khu vực xa xôi, khó tiếp cận.
Khảo sát năm 2024 tiếp nối kết quả khảo sát đầu tiên cũng do dự án thực hiện năm 2019-2022, cho phép so sánh và theo dõi xu hướng đa dạng sinh học của 21 khu vực theo thời gian.
Kết quả khảo sát đóng góp trực tiếp cho các chỉ số giám sát đa dạng sinh học quốc gia và quốc tế, đồng thời hỗ trợ các khu bảo tồn xác định vùng ưu tiên từ đó phân bổ nguồn lực bảo tồn hiệu quả hơn.
Theo ông Nguyễn Quang Hòa Anh, Chuyên gia Đa dạng Sinh học, WWF-Việt Nam, rừng Việt Nam vẫn là nhà của nhiều loài động vật có giá trị toàn cầu. Những tín hiệu phục hồi đáng khích lệ cho thấy thiên nhiên có thể tái sinh khi có cơ hội.
""Tuy nhiên, sự phục hồi bền vững chỉ có thể đạt được nếu có sự hợp tác chặt chẽ và lâu dài giữa chính quyền các cấp, cộng đồng và các đối tác bảo tồn nhằm chấm dứt các mối đe doạ đối với các loài hoang dã, đặc biệt là nạn đặt bẫy tràn lan"", ông Hoà Anh nói.
Báo cáo từ kết quả khảo sát khuyến nghị lặp lại khảo sát đa dạng sinh học định kỳ 3–5 năm/lần nhằm giám sát dài hạn các loài động vật hoang dã của Việt Nam, đồng thời đáp ứng các cam kết bảo tồn trong nước và quốc tế.
Trong tương lai, việc khảo sát cần một hoặc nhiều viện nghiên cứu của nhà nước phụ trách, do mức độ phức tạp trong triển khai khảo sát và phân tích dữ liệu.
Đặc biệt, Báo cáo kêu gọi các tổ chức bảo tồn, chính phủ cân nhắc các chương trình tái thả các loài hoang dã về các sinh cảnh trước đây của chúng, hoặc tại các sinh cảnh có số lượng quần thể quá ít, giúp duy trì và phục hồi các hệ sinh thái rừng Việt Nam."
https://tienphong.vn/thap-cham-nghin-nam-tuoi-tai-hue-ngam-nuoc-nhieu-ngay-xu-li-the-nao-post1794294.tpo,Tháp Chăm nghìn năm tuổi tại Huế ngâm nước nhiều ngày: Xử lí thế nào?,"TPO - Trước tình trạng di tích tháp Chăm Phú Diên bị ngập sâu trong nước nhiều ngày, ngày 7/11, Ủy viên Thường vụ Thành ủy, Phó Chủ tịch UBND TP Huế Hoàng Hải Minh đã trực tiếp tới hiện trường để kiểm tra và chỉ đạo khắc phục.","Tại thời điểm kiểm tra, khi chứng kiến di tích cổ bị ngâm nước kéo dài, Phó Chủ tịch UBND TP Huế đã phê bình đơn vị quản lý và chính quyền địa phương vì chậm báo cáo, chậm triển khai phương án xử lý, để xảy ratình trạng ngập únggây nguy cơ ảnh hưởng đến di tích.
Ông Hoàng Hải Minh yêu cầu huy động ngay máy bơm để hút nước, đồng thời chỉ đạo đơn vị liên quan cùng chính quyền địa phươngtúc trực, giám sátthường xuyên, đảm bảo trong ngày 7/11 phải rút hết nước và báo cáo kết quả về UBND thành phố.
Về lâu dài, lãnh đạo UBND TP Huế giao cho đơn vị quản lý di tích nghiên cứu, đề xuất phương án bảo vệ công trình hiệu quả hơn, trong đó đặc biệt chú trọng đến giải pháp thoát và chống ngập nước, nhằmđảm bảo an toàn cho ngôi tháp cổvà khu vực phụ cận, tránh tái diễn sự cố tương tự.
Được biết, tháp Chăm Phú Diên được phát hiện năm 2001 tại xã Phú Diên, huyện Phú Vang (nay là xã Phú Vinh, TP Huế), là di tích Chăm Pa cổ được tìm thấy dưới lòng cát ven biển, có giá trị lớn vềlịch sử, khảo cổ và văn hóa. Công trình được xếp hạng Di tích Kiến trúc Nghệ thuật cấp Quốc gia, hiện do Bảo tàng Lịch sử TP Huế quản lý.
Ngày 14/3/2022, Tổ chức Kỷ lục Việt Nam (VietKings) xác lập kỷ lục “Tháp Phú Diên - tháp Chăm cổ chìm sâu dưới cồn cát ven biển được khai quật và bảo tồn đầu tiên tại Việt Nam”. Tiếp đó, ngày 30/5/2022, Liên minh Kỷ lục Thế giới (WorldKings) ghi nhận thêm kỷ lục “Tháp Chăm cổ bằng gạch chìm sâu dướicồn cát ven biểnđược khai quật và bảo tồn đầu tiên trên thế giới”.
Trao đổi với phóng viên, Chủ tịch UBND TP Huế Phan Thiên Định, cho biết, ông đã chỉ đạo Sở Văn hóa - Thể thao thành phố cho tiến hành kiểm tra thêm các di tích khác trên địa bàn sau khi trải qua trậnmưa lũ lịch sử, kéo dài nhiều ngày.
Còn theo Tiến sĩ Trần Đình Hằng - Phân viện trưởng Phân viện Văn hóa Nghệ thuật Quốc gia Việt Nam tại Huế, vấn đề giải phápbảo vệ bền vững di tíchtháp Chăm Phú Diên đã từng nhiều lần được bàn thảo. Ông nhận định, việc làm nhà kính che phủ di tích tuy có tác dụng hạn chế mưa gió, nhưng vào mùa hè, nhiệt độ trong nhà kính rất lớn có thể gây ảnh hưởng đến môi trường bảo tồn. Giờ đây, trong bối cảnh tháp bị ngâm nước nhiều ngày, vị này lo ngại gạch cổ của ngôi tháp có thể bị rệu rã vàxuống cấpnhanh hơn.
Trước đó, nhưTiền Phongphát hiện và phản ánh, tháp Chăm Phú Diên -di tích hơn nghìn năm tuổi- bị ngâm trong nước suốt nhiều ngày do mưa lớn kéo dài hơn một tuần. Có thời điểm mực nước dâng gần nửa thân tháp, khiến người dân địa phương lo ngại nền móng gạch cổ có thể bị mục rữa, sụt lún, thậm chí sập đổ.
Do công trình nằm dưới cồn cát và thấp hơn mực nước biển, nước mưa dồn ứ không thể thoát, biếnkhu vực di tíchthành “hố nước” tù đọng. Trong khi đó, chính quyền địa phương và Bảo tàng Lịch sử TP Huế - đơn vị quản lý di tích - lại chậm có biện pháp xử lý triệt để, dẫn đến việc công trình có giá trị đặc biệt về lịch sử - văn hóa này bị ngâm nước kéo dài, gây lo lắng trong dư luận."
https://tienphong.vn/tphcm-chuyen-tham-quyen-cap-giay-phep-xay-dung-ve-ubnd-xa-post1794643.tpo,TPHCM chuyển thẩm quyền cấp giấy phép xây dựng về UBND xã,"TPO - Sở Xây dựng TPHCM được giao nghiên cứu ứng dụng phần mềm theo dõi việc cấp giấy phép xây dựng có thời hạn và thời hạn tồn tại của công trình đã được cấp phép, để UBND cấp xã triển khai thực hiện, kết nối liên thông hệ thống mạng với Sở Xây dựng.","Văn phòng UBND TPHCM vừa có thông báo kết luận của Phó Chủ tịch UBND TPHCM Bùi Xuân Cường về dự thảo quyết định phân cấp thẩm quyền cấp giấy phép xây dựng. Quy định về quy mô, thời hạn tồn tại của công trình được cấp giấy phép xây dựng có thời hạn trên địa bàn TPHCM.
Theo đó, Phó Chủ tịch UBND TPHCM Bùi Xuân Cường giao Sở Xây dựng tiếp thu ý kiến của các cơ quan, đơn vị để rà soát, bổ sung hoàn chỉnh lại tờ trình và dự thảo quyết định về các nội dung phân cấp thẩm quyền cấp giấy phép xây dựng.
Cụ thể, Sở Xây dựng có nhiệm vụ rà soát, làm rõ nội dung phân cấp hay ủy quyền, điều chỉnh lại tên gọi dự thảo quyết định “Phân cấp thẩm quyền cấp giấy phép xây dựng. Quy định về quy mô, thời hạn tồn tại của công trình được cấp giấy phép xây dựng có thời hạn trên địa bàn”. Đồng thời, bổ sung số liệu cấp giấy phép xây dựng của các địa phương trước và sau khi sáp nhập vào TPHCM, đánh giá quá trình triển khai thực hiện.
Ngoài ra, Sở Xây dựng được giao nghiên cứu ứng dụng phần mềm theo dõi việc cấp giấy phép xây dựng có thời hạn và thời hạn tồn tại của công trình đã được cấp phép có thời hạn, để UBND cấp xã triển khai thực hiện, kết nối liên thông hệ thống mạng với Sở Xây dựng.
Phó Chủ tịch UBND TPHCM Bùi Xuân Cường cũng giao Sở Xây dựng hướng dẫn UBND phường, xã, đặc khu về công tác cấp giấy phép xây dựng đối với việc triển khai thực hiện quyết định 71 của UBND TPHCM về ban hành quy định trình tự, thủ tục cho thuê ngắn hạn quỹ đất, tài sản gắn liền với đất do Trung tâm Phát triển quỹ đất TPHCM quản lý."
https://tienphong.vn/du-bao-thoi-tiet-mien-bac-nhung-ngay-toi-post1794614.tpo,Dự báo thời tiết miền Bắc những ngày tới,"TPO - Tình trạng nhiều mây, mưa nhỏ ở miền Bắc chỉ còn kéo dài hết hôm nay (9/11), ngày mai trời nhiều mây, không mưa. Từ thứ Ba (11/11) đến hết tuần, trời hửng nắng vào trưa chiều, se lạnh vào đêm và sáng.","Khu vực phíaĐông Bắc Bộhôm nay nhiều mây, ngày có mưa, mưa rào rải rác, đêm có mưa vài nơi. Gió đông bắc cấp 2-3. Sáng sớm và đêm trời lạnh, vùng núi có nơi trời rét. Nhiệt độ thấp nhất 20-23 độ, vùng núi có nơi dưới 20 độ. Nhiệt độ cao nhất 26-29 độ.
Khu vực phíaTây Bắc Bộhôm nay nhiều mây, có mưa, mưa rào rải rác. Gió nhẹ. Sáng và đêm trời lạnh, có nơi trời rét. Nhiệt độ thấp nhất 19-22 độ, có nơi dưới 19 độ. Nhiệt độ cao nhất 25-28 độ, có nơi trên 28 độ.
Hà Nộihôm nay nhiều mây, ngày có mưa rải rác, đêm có mưa vài nơi. Gió đông bắc cấp 2-3. Sáng sớm và đêm trời lạnh. Nhiệt độ thấp nhất 21-23 độ, cao nhất 26-28 độ.
Dự báo ngày mai (10/11), miền Bắc nhiều mây, không mưa. Từ thứ Ba đến hết tuần (11-16/11) thời tiết khá đẹp, trời se lạnh về đêm và sáng, trưa chiều hửng nắng, không mưa.
Khu vựcThanh Hoá đến Hà Tĩnhhôm nay nhiều mây, có mưa, mưa rào rải rác. Trong mưa dông có khả năng xảy ra lốc, sét và gió giật mạnh. Sáng sớm và đêm trời lạnh với nhiệt độ thấp nhất 22-23 độ cao nhất 27-29 độ.
Quảng Trị và Huếhôm nay ít mưa, nắng nhẹ, gió bắc đến tây bắc cấp 2-3. Nhiệt độ thấp nhất 24-25 độ, cao nhất 31-33 độ.
Duyên hải Nam Trung Bộ, nơi vừa hứng chịu cơn bão số 13, hôm nay trời nắng ít mưa, rất thuận lợi cho công tác khắc phục hậu quả. Nhiệt độ thấp nhất 23-26 độ, có nơi dưới 23 độ. Nhiệt độ cao nhất 30-33 độ.
Dự báo thời tiết thuận lợi còn kéo dài trong nhiều ngày tới ở các tỉnh miền Trung.
Tây Nguyênhôm nay ngày nắng, riêng phía Nam chiều tối có mưa rào và dông rải rác. Trong mưa dông có khả năng xảy ra lốc, sét và gió giật mạnh. Nhiệt độ thấp nhất 19-22 độ. Nhiệt độ cao nhất 27-30 độ, có nơi trên 30 độ.
Nam Bộhôm nay ngày nắng, chiều tối có mưa rào và dông rải rác, đêm có mưa rào và dông vài nơi. Gió tây nam đến tây cấp 2-3. Trong mưa dông có khả năng xảy ra lốc, sét và gió giật mạnh. Nhiệt độ thấp nhất 23-26 độ, cao nhất 30-33 độ.
TPHCMhôm nay trời nắng, chiều tối có mưa rào và dông rải rác, đêm có mưa rào và dông vài nơi. Gió tây nam cấp 2-3. Trong mưa dông có khả năng xảy ra lốc, sét và gió giật mạnh. Nhiệt độ thấp nhất 24-26 độ, cao nhất 31-33 độ.
Dự báo ngày mai (10/11), Nam Bộ tiếp tục có mưa rào và dông rải rác vào chiều tối và tối, cục bộ có mưa vừa, mưa to."
https://tienphong.vn/chuyen-gia-neu-diem-nghen-trong-phan-loai-rac-thai-tai-nguon-post1794239.tpo,Chuyên gia nêu 'điểm nghẽn' trong phân loại rác thải tại nguồn,"TPO - GS.TS Hoàng Xuân Cơ cho rằng, “điểm nghẽn"" lớn nhất khi triển khai phân loại rác thải tại nguồn không nằm riêng ở người dân hay hạ tầng, mà ở cơ chế quản lý thiếu đồng bộ.","Theo LuậtBảo vệ môi trường2020, từ ngày 1/1/2025, các hộ gia đình phải phân loại rác thải sinh hoạt thành 3 nhóm trước khi chuyển giao cho đơn vị thu gom.
Tuy nhiên, thực tế cho thấy việc triển khai phân loại rác tại nguồn ở Hà Nội còn nhiều khó khăn, vướng mắc, đặc biệt sau giai đoạn thực hiện chính quyền đô thị 2 cấp.
Tại buổi tọa đàm “Phân loại rác thảitại nguồn: Từ cam kết đến hành động”, do báo Báo Kinh tế & Đô thị phối hợp tổ chức ngày 7/11, ông Bùi Ngọc Tú, Trưởng phòng Kỹ thuật Công nghệ (Công ty TNHH MTV Môi trường đô thị Hà Nội - URENCO) cho biết, hiện nay hạ tầng tiếp nhận xử lý rác thải không đồng bộ. Nhiều khu vực thiếu điểm tập kết/trạm trung chuyển phù hợp cho nhiều nhóm rác, trong khi đó hạ tầng để xử lý rác hữu cơ, tái chế tại nhiều nơi còn thiếu hoặc chưa phát huy hiệu quả, người dân vẫn chưa quen với phân loại rác ở nguồn.
Ông Phạm Xuân Điệp, Trưởng Ban Quản trị tòaChung cưNew Skyline (KĐT Văn Quán) cho rằng: Ngay cả khi người dân đã phân loại đúng, xe thu gom vẫn trộn chung rác do đơn vị thu gom chưa có hạ tầng tiếp nhận tách biệt. Điều này làm mất niềm tin của người dân, khiến họ không còn động lực duy trì phân loại rác thải.
Ông Nguyễn Anh Tuấn, Chủ tịch UBND phường Hoàng Liệt cho biết, trên địa bàn phường có 83 tòa chung cư. Mỗi ngày thải ra hàng trăm tấn rác thải sinh hoạt. Thời gian qua, phường đã thực hiện nhiều giải pháp bảo vệ môi trường, nhưng quá trình triển khai gặp nhiều khó khăn.
Ông Đặng Thành Vinh, Phó trưởng phòng Quản lý chất thải rắn (Sở NN&MT Hà Nội) cho biết, phần lớn các tòa nhà chung cư hiện nay chưa đáp ứng được yêu cầu phân loại rác thành 3 nhóm. Nhiều chung cư mới chỉ có 2 thùng rác, chưa bố trí khu lưu giữ tách biệt, chưa có quy trình thu gom riêng cho từng loại rác... Theo ông Vinh, luật đã có, chế tài đã ban hành, nhưng nếu hạ tầng và quy trình chưa hoàn thiện thì việc xử phạt gần như không thể triển khai thực chất.
""Phá"" điểm nghẽn chính sách
Theo GS.TS Hoàng Xuân Cơ, Trưởng ban Khoa học (Hội Kinh tế Môi trường Việt Nam), “điểm nghẽn"" lớn nhất không nằm riêng ở người dân hay hạ tầng, mà ở cơ chế quản lý thiếu đồng bộ. Người dân phần lớn đã có ý thức, nhưng chính quyền địa phương thiếu hướng dẫn rõ ràng. Cùng với đó, hạ tầng thu gom – từ thùng chứa, xe vận chuyển đến điểm trung chuyển – chưa được đầu tư đồng bộ.
TS. Hoàng Dương Tùng, Chủ tịch Mạng lưới không khí sạch Việt Nam cho rằng, thành phố cần có chính sách khuyến khích người dân sử dụng tái chế, tái sử dụng rác thải sinh hoạt. Ví như, triển khai chương trình tích điểm xanh – người dân mang rác tái chế đến điểm thu đổi để nhận quà, phiếu mua hàng. Các khu dân cư, tổ dân phố làm tốt có thể được công nhận danh hiệu “Khu dân cư xanh”, “Tổ dân phố phân loại tốt”; Vinh danh tập thể và cá nhân tiêu biểu, giúp người dân thấy rõ “làm đúng là có lợi, có ghi nhận”.
Để chính sách đi vào cuộc sống, theo ông Bùi Ngọc Tú, doanh nghiệp cần đầu tư đồng bộ hạ tầng thu gom – xử lý, thiết lập cơ chế phối hợp cùng hệ thống giám sát minh bạch. Đặc biệt, doanh nghiệp cần đầu tư vào công nghệ tái chế, xử lý rác hiện đại, giảm phụ thuộc vào chôn lấp; xây dựng chuỗi kinh tế tuần hoàn, thu hồi – tái chế – tái sử dụng, đặc biệt với nhựa, kim loại và thực phẩm thừa.
Ngoài ra, người dân cần thay đổi thói quen, thực hiện phân loại rác tại nguồn, giảm sử dụng túi nilon và đồ nhựa dùng một lần. Chính quyền địa phương tăng cường công tác tuyên truyền, chuyển từ khẩu hiệu sang truyền cảm hứng bằng câu chuyện thật, mô hình thật..."
