url,title,description,content
https://tienphong.vn/nasa-bi-chi-trich-vi-khong-cong-bo-hinh-anh-sao-choi-ky-la-post1793565.tpo,NASA bị chỉ trích vì không công bố hình ảnh sao chổi kỳ lạ,TPO - NASA đang chịu sức ép phải công bố những hình ảnh được chờ đợi bấy lâu về sao chổi hiếm gặp 3I/ATLAS - vật thể thứ ba đi vào hệ Mặt trời của chúng ta.,"Tàu quỹ đạo thám hiểm sao Hỏa Mars Reconnaissance Orbiter (MRO) đã chụp ảnh sao chổi này khi nó bay qua gần sao Hỏa vào đầu tháng 10. Nhưng những hình ảnh thu được trong thời gian từ ngày 2–3/10 vẫn chưa được công bố.
Nguyên nhân chậm trễ được cho là do đợt đóng cửa chính phủ liên bang bắt đầu từ ngày 1/10, khiến nhân sự NASA phải nghỉ việc tạm thời và các quy trình xử lý dữ liệu, rà soát và công bố thông tin bị đình trệ. Dù phần lớn giới quan sát coi đây thuần túy là vấn đề hành chính, nhưng đã có một số suy đoán trên mạng cho rằng NASA che giấu bằng chứng về hoạt động của vật thể từ ngoài hệ Mặt trời.
Sao chổi 3I/ATLAS được hệ thống cảnh báo tiểu hành tinh ATLAS phát hiện từ ngày 1/7. Khi tiến gần Mặt trời, nó tăng tốc mà không phụ thuộc vào lực hấp dẫn như thể đang tự điều chỉnh quỹ đạo - hiện tượng chưa từng thấy ở một số vật thể liên sao khác.
Kính viễn vọng Hubble và kính viễn vọng Không gian James Webb đã quan sát sao chổi này, nhưng giới khoa học vẫn đang chờ dữ liệu độ phân giải cao từ MRO và tàu tự hành Perseverance chụp khi vật thể tiến sát sao Hỏa ngày 6/10.
Áp lực với NASA gia tăng sau khi Hạ nghị sĩ Anna Paulina Luna gửi thư cho quyền Giám đốc NASA Sean Duffy ngày 31/10 để thúc giục cơ quan này công bố dữ liệu.
“Thông tin này rất quan trọng để nâng cao hiểu biết của chúng ta về các vật thể liên sao và cách chúng tương tác với hệ Mặt trời. Điểm sáng nhất trong những hình ảnh này sẽ cho phép chúng ta xác định kích thước vật thể một cách chính xác nhất”, bà Luna viết.
Bà lưu ý rằng camera HiRISE trên MRO chụp được ảnh với độ phân giải khoảng 19 dặm mỗi pixel, sắc nét hơn 3 lần so với ảnh Hubble chụp ngày 21/7.
Nghị sĩ Luna cũng yêu cầu NASA công khai bất kỳ dữ liệu nào khác từ các nhiệm vụ sao Hỏa nếu phát hiện hoạt động bất thường, vào thời điểm sao chổi 3I/ATLAS cách hành tinh này khoảng 30 triệu km.
Bà dẫn trường hợp một thiên thạch liên sao rơi gần Papua New Guinea năm 2014, khi cơ sở dữ liệu của NASA có mâu thuẫn, cho rằng việc công bố thông tin rõ ràng sẽ hỗ trợ nghiên cứu khoa học và đảm bảo tính minh bạch.
Nhà vật lý thiên văn Harvard Avi Loeb cũng kêu gọi NASA công bố ảnh MRO, cho rằng tiếp cận mở sẽ giúp các nhà thiên văn lên kế hoạch quan sát tiếp theo.
“Khoa học không nên trở thành con tin vì đóng cửa chính phủ”, ông Loeb viết trong một bài đăng trên mạng xã hội.
Trước đó, ông đưa ra giả thuyết rằng 3I/ATLAS có thể không phải vật thể tự nhiên.
Giữa làn sóng tranh luận, ngôi sao truyền hình thực tế Kim Kardashian cũng tham gia với bài đăng trên mạng xã hội X: “Chuyện gì đang xảy ra với 3I ATLAS thế?”. Quyền giám đốc Duffy nhanh chóng trả lời: “Quan sát của NASA cho thấy đây là sao chổi liên sao thứ ba đi qua hệ Mặt trời. Không có người ngoài hành tinh. Không có mối đe dọa với Trái đất”.
Loeb sau đó đùa rằng ông sẵn sàng mời Kardashian tham gia nhóm nghiên cứu của mình.
Sao chổi 3I/ATLAS sẽ đến gần Trái đất nhất vào 19/12 tới, ở khoảng 270 triệu km, không gây nguy cơ va chạm.
Loeb liệt kê một số điểm dị thường của 3I/ATLAS so với sao chổi thông thường: quỹ đạo của nó gần trùng với mặt phẳng hoàng đạo, nó có luồng khí phụt hướng về phía Mặt trời bất thường.
Khi 3I/ATLAS tiếp tục hành trình trong hệ Mặt trời, cả giới khoa học và công chúng đều đang chờ NASA công bố hình ảnh từ MRO, hé lộ thêm về một trong những vật thể kỳ lạ và hấp dẫn nhất từng được quan sát."
https://tienphong.vn/9-ca-the-ho-nuoi-trai-phep-o-thanh-hoa-gio-ra-sao-post1793505.tpo,9 cá thể hổ nuôi trái phép ở Thanh Hóa giờ ra sao?,"TPO - Đàn hổ 9 con do một hộ dân ở Thanh Hóa nuôi nhốt nhiều năm dự kiến được chuyển giao cho cơ sở nuôi đủ điều kiện ở Hà Nội, không yêu cầu bồi hoàn, hỗ trợ kinh phí. Ngành chức năng địa phương đã lên phương án chuyển giao đàn hổ cho đơn vị đảm bảo yêu cầu.","Ngày 5/11, thông tin từ Chi cục Kiểm lâm tỉnhThanh Hóacho biết, đơn vị đã đề nghị UBND tỉnh này về việc phối hợp với UBND TP Hà Nội để lên phương án chuyển giao đàn hổ tại trang trại của gia đình ông Nguyễn Mậu Chiến (xã Xuân Tín) tiếp tục chăm sóc, nuôi dưỡng.
Hiện nay có 2 đơn vị gồm Vườn thú Hà Nội và Trung tâm cứu hộ động vật hoang dã ở Hà Nội có đủ điều kiện tiếp nhận đàn hổ. Chủ trại hổ và các bên cũng thống nhất chủ trương, quy trình chuyển giao, không yêu cầu bồi thường, hỗ trợ kinh phí nào song cần thêm thời gian làm thủ tục xác lập quyền sử dụng tài sản công cũng như các giải pháp đảm bảo an toàn khi bắt và di chuyển đàn hổ đến cơ sở mới.
Trước đó, năm 2007 gia đình ông Chiến mua 10 con hổ, mỗi con nặng trung bình 7 kg của một người không quen biết, đưa từ Lào về Việt Nam nuôi nhốt trong khu trại ở xã Xuân Tín. Sau khi bị xử phạt 30 triệu đồng, ông Chiến được giao chăm sóc, nuôi dưỡng đàn hổ. Năm 2008, người này mua thêm 5 con hổ khác, một lần nữa bị phạt 30 triệu đồng.
Ông Chiến ban đầu nuôi hổ trong khu chuồng nhỏ ở xóm 27, xã Xuân Tín. Tuy nhiên, trại hổ nằm giữa khu dân cư gây nguy hiểm, mất vệ sinh môi trường và ô nhiễm tiếng ồn do hổ thường gầm rú khiến người dân lo lắng. Gia đình sau đó thuê đất ở cánh đồng Cồn Tàu Voi, cách vị trí cũ khoảng 2,5 km. Đàn hổ hiện được nuôi tại khu trại rộng 4.000 m2, tường rào bao quanh, bên trên lắp lưới thép B40 kiên cố, cao 4,5 m.
Đến năm 2008, ông Chiến mua thêm 5 cá thể hổ khác và tiếp tục bị UBND tỉnh xử phạt hành chính 30 triệu đồng vì hành vi tương tự.
Từ khi bắt đầu nuôi nhốt đến nay, đã có 6 cá thể hổ bị chết. Trang trại hiện còn lại 9 con, trong đó có 3 con cái, với trọng lượng trung bình 180kg/con, cá thể lớn nhất gần 300kg.
Tháng 5/2017, giấy phép nuôi nhốt hổ sinh trưởng, sinh sản hết hạn, chủ trại nhiều lần kiến nghị gia hạn nhưng không được chấp thuận. Căn cứ Luật Đa dạng sinh học 2008 và Nghị định 160/2013 thì ""trại hổchưa đủ điều kiện thành lập cơ sở bảo tồn đa dạng sinh học"". Gia đình được giao tiếp tục nuôi dưỡng đàn hổ, song không có quyền thay đổi hiện trạng, mua bán, vận chuyển hoặc giết mổ...
Vào tháng 10/2018, hộ gia đình ông Chiến có làm đơn tự nguyện chuyển giao hổ gửi UBND tỉnh Thanh Hóa. Tuy nhiên, do vướng mắc về kinh phí hỗ trợ nên đến nay việc chuyển giao 9 cá thể hổ chưa được giải quyết.
Mỗi ngày, đàn hổ tiêu thụ gần 100kg thức ăn các loại. Chi phí nuôi dưỡng quá lớn đang khiến chủ trại rơi vào tình trạng kiệt quệ.
Phía kiểm lâm và chính quyền địa phương cũng cho hay rất vất vả khi phải cắt cử lực lượng, thành lập tổ công tác thường xuyên kiểm tra nhằm tránh xảy ra sai sót, trong khi họ không được cấp kinh phí thực hiện việc này."
https://tienphong.vn/bao-tac-dong-tung-tinhthanh-mien-trung-nhu-nao-post1793489.tpo,Bão tác động từng tỉnh/thành miền Trung như nào?,"TPO - Khu vực phía đông tỉnh Quảng Ngãi, Bình Định và Phú Yên cũ là nơi có thể hứng chịu gió mạnh nhất, cấp 10-12, giật cấp 14-15. Đà Nẵng - nơi vừa trải qua mưa lũ lịch sử có thể hứng chịu lượng mưa rất lớn và gió mạnh. Dự báo vùng mưa lớn kéo dài suốt từ Thanh Hoá đến Lâm Đồng, vùng gió mạnh từ Nam Quảng Trị đến Phú Yên cũ.","Cơn bão mạnh nhất đổ bộ từ đầu năm
Sáng sớm nay (5/11), bão Kalmaegi đã đi vào vùng biển phía đông khu vực Giữa Biển Đông, trở thành cơn bão số 13 trên Biển Đông năm 2025. Vào 4h sáng nay, tâm bão cách đảo Song Tử Tây khoảng 560km về phía đông. Sức gió mạnh nhất vùng gần tâm bão mạnh cấp 13 (134-149 km/giờ), giật cấp 16.
Dự báo trong ngày và đêm nay (5/11), bão di chuyển nhanh theo hướng tây tây bắc, mỗi giờ đi được khoảng 25km/h và tiếp tục mạnh thêm. Đến 4h sáng 6/11, tâm bão cách bờ biển tỉnh Gia Lai (Bình Định cũ) khoảng 550km về phía đông đông nam với cường độ cấp 14, giật cấp 17.
Dự báo trong ngày và đêm 6/11, bão tiếp tục di chuyển nhanh theo hướng tây tây bắc, mỗi giờ đi được 25km, suy yếu không đáng kể, từ chiều tối 6/11 bắt đầu tác động trực tiếp vào đất liền khu vực từ Đà Nẵng đến Phú Yên cũ.
Trung tâm Dự báo Khí tượng Quốc gia nhận định, bão đổ bộ trong đêm 6/11 với cường độ khoảng cấp 11,12, giật cấp 14,15. Đây là cường độ đổ bộ rất mạnh, tương đương với cơn bão Damrey năm 2017 và Molave năm 2018 tàn phá nặng nề ở các địa phương bão qua. Bão số 13 cũng có thể mạnh hơn cơn bão Bualoi đổ bộ khu vực Hà Tĩnh - Nghệ An vào cuối tháng 9.
Theo ông Mai Văn Khiêm, Giám đốc Trung tâm Dự báo Khí tượng Thuỷ văn Quốc gia, đây là cơn bão rất nguy hiểm với tốc độ di chuyển rất nhanh, thời gian tác động đất liền rất sớm, ngay từ chiều tối 6/11, tức là chỉ chưa đến hai ngày sau khi vào Biển Đông. Đây cũng là cơn bão có cường độ rất mạnh và vùng ảnh hưởng rất rộng lớn, trùng với khu vực vừa hứng chịu một đợt mưa lũ lịch sử.
Vùng ảnh hưởng rộng khắp miền Trung
Dự báo, vùng ven biển 3 địa phương là Gia Lai (Bình Định cũ), Đắk Lắk (Phú Yên cũ) và Quảng Ngãi sẽ là nơi hứng chịu gió mạnh nhất từ cơn bão này với cường độ khoảng cấp 10-12, giật cấp 14-15. Ngoài ra, khu vực phía tây của 3 tỉnh này cũng có gió mạnh cấp 6-7, giật cấp 9-10. Gió bắt đầu mạnh dần trên đất liền từ chiều tối 6/11, dữ dội nhất vào đêm 6/11 và sáng 7/11.
Gia Lai, Đắk Lắk và Quảng Ngãi cũng là 3 địa phương hứng chịu lượng mưa lớn nhất do bão, từ khoảng 200-400mm, có nơi trên 600mm trong hai ngày 6-7/11. Theo ông Mai Văn Khiêm, Giám đốc Trung tâm Dự báo Khí tượng Thuỷ văn Quốc gia, khu vực này khả năng xảy ra lũ lớn, cần đặc biệt đề phòng.
Đà Nẵng nằm ở hoàn lưu phía bắc của cơn bão. Từ chiều tối 6/11 đến sáng 7/11, địa phương này có khả năng hứng chịu gió mạnh cấp 8-9, giật cấp 11-12. Đà Nẵng cũng nằm trong vùng mưa rất lớn của bão số 13 với lượng mưa trong hai ngày (6-7/11) từ 200-400mm, có nơi trên 600mm. Lũ có khả năng dâng trở lại trên các sông của Đà Nẵng nhưng ít nguy cơ vượt qua lũ kỷ lục vào cuối tháng 10.
Huế và Nam Quảng Trị, nơi cũng vừa trải qua mưa lũ lịch sử có thể hứng chịu gió mạnh khoảng cấp 7-8, giật cấp 9-10 vào đêm 6/11 và sáng sớm 7/11. Mưa ở khu vực này trong hai ngày 6-7/11 từ 150-300mm, có nơi trên 450mm. Lũ có thể dâng trở lại nhưng ít khả năng vượt qua lũ lịch sử vào cuối tháng 10 và đầu tháng 11 vừa qua.
Khánh Hoà và Lâm Đồng nằm ở hoàn lưu phía nam cơn bão. Dù ít khả năng xảy ra gió mạnh, hai địa phương này cũng hứng chịu lượng mưa rất lớn trong hai ngày 6-7/11, khoảng 150-300mm, có nơi trên 450mm.
Ngoài ra, hoàn lưu sau bão có khả năng gây ra mưa lớn cho khu vực Thanh Hoá đến Bắc Quảng Trị trong các ngày 7-8/11 với lượng mưa từ 50-150mm, có nơi trên 200mm.
Cùng với mưa lớn gió giật mạnh, Trung tâm Dự báo Khí tượng Thuỷ văn Quốc gia đặc biệt lưu ý nguy cơ xảy ra dông, lốc và gió giật mạnh cả trước và trong khi bão đổ bộ. Loại hình thiên tai này có yếu tố bất ngờ và gây thiệt hại rất nặng nề.
Ngoài ra, từ chiều tối 6/11, khu vực ven biển từ Huế đến Đắk Lắk đề phòng mực nước biển dâng cao 0,3-0,6m. Nước biển dâng kết hợp với sóng lớn có khả năng gây ngập úng tại khu vực trũng thấp, sóng tràn đê, đường giao thông ven biển, sạt lở bờ biển, làm chậm thoát lũ trên khu vực.
Biển Đông đang trải qua một mùa mưa bão nhiều hiếm thấy, trong đó nhiều cơn bão tác động trực tiếp, gây ảnh hưởng nặng nề đến đất liền nước ta.
Theo các chuyên gia, dải hội tụ nhiệt đới đang hoạt động mạnh và ổn định ở khu vực gần xích đạo với các nhiễu động khí quyển và xoáy nhỏ chính là mầm mống phát triển thành áp thấp nhiệt đới, sau đó là bão. Điều kiện mặt biển ấm cũng là nguyên nhân khiến nhiều cơn bão mạnh hình thành và đi vào Biển Đông."
https://tienphong.vn/elon-musk-sao-choi-3iatlas-co-the-la-nguoi-ngoai-hanh-tinh-post1793299.tpo,Elon Musk: Sao chổi 3I/ATLAS có thể là 'người ngoài hành tinh',"Sao chổi 3I/ATLAS – có kích thước được ví như bằng cả Manhattan – đang trở thành tâm điểm tranh luận toàn cầu. Và mới đây, Elon Musk – người đang dẫn đầu ngành công nghệ vũ trụ – cũng không loại trừ khả năng đó là “tàu vũ trụ ngoài hành tinh'.","Ban đầu, các nhà khoa học dự đoán sao chổi 3I/ATLAS sẽ tiến đến điểm gần Mặt Trời nhất vào thứ Năm tuần trước. Nhưng điều khiến dư luận rúng động không chỉ là quỹ đạo đó, mà là những chuyển động bất thường của nó.
Theo các quan sát, 3I/ATLAS đã bay cực kỳ sát các hành tinh như sao Mộc, sao Kim và sao Hỏa – một hành vi không thường thấy ở các sao chổi thông thường.
Chính điều này đã dẫn đến một giả thuyết táo bạo: đó có thể không phải là sao chổi, mà là một tàu vũ trụ do nền văn minh ngoài Trái Đất điều khiển.
Elon Musk: “Nó có thể là người ngoài hành tinh”
Trong lần xuất hiện gần đây trên podcastThe Joe Rogan Experience, Elon Musk – CEO của SpaceX và Tesla – được hỏi về hiện tượng kỳ lạ này. Dù không khẳng định chắc chắn, Musk bất ngờ đồng tình với giả thuyết rằng vật thể này có thể là “người ngoài hành tinh.”
Theo Musk, có một lực tác động lên 3I/ATLAS ngoài trọng lực, khiến quỹ đạo của nó không hoàn toàn tuân theo các quy luật vật lý thông thường.
“Có thứ gì đó hơn cả lực hấp dẫn đang ảnh hưởng đến quỹ đạo của nó,” Musk nói.
Không dừng lại ở đó, Musk tiết lộ một thông tin gây sốc: 3I/ATLAS gần như được tạo thành hoàn toàn từ niken, điều mà ông cho là quá bất thường đối với một sao chổi. Với cấu tạo kim loại cùng kích thước khổng lồ, nếu 3I/ATLAS lao vào Trái Đất, hậu quả sẽ không thể tưởng tượng được.
“Nó có đủ sức mạnh để xóa sổ một lục địa… hoặc tệ hơn,” Musk nói.
Nhận định của Musk khiến người dẫn chương trình Joe Rogan thốt lên: “Nếu nó va chạm, có lẽ hầu hết loài người sẽ chết.”
Kịch bản va chạm: Tiềm năng diệt vong của Trái Đất
Musk tiếp tục phân tích: mức độ tàn phá phụ thuộc vào khối lượng chính xác của vật thể. Ông nhắc lại trong hồ sơ hóa thạch Trái Đất, từng xảy ra ít nhất 5 sự kiện tuyệt chủng quy mô lớn, trong đó nổi bật là thời kỳ tuyệt chủng kỷ Permi, quét sạch gần như toàn bộ sự sống và diễn ra trong hàng triệu năm.
Musk nói: “Có một sự kiện, chắc chắn là do tiểu hành tinh – thời kỷ Jura. Nhưng điều chúng ta không thấy được trong hồ sơ hóa thạch là những vụ va chạm chỉ phá hủy một lục địa.”
Theo Musk, những vụ va chạm nhỏ hơn – đủ để phá hủy hàng triệu sinh mạng hoặc cả một châu lục – lại không để lại dấu tích rõ ràng sau hàng trăm triệu năm.
“Có thể trong lịch sử, đã có nhiều vụ va chạm xóa sổ toàn bộ sự sống ở một nửa Bắc Mỹ,” Musk nhận định.
Rogan sững sờ hỏi: “Và hiện tại chúng ta không thể làm gì nếu điều đó xảy ra?”
Musk chỉ im lặng gật đầu.
NASA trấn an, nhưng một nhà khoa học Harvard bác bỏ
Ban đầu, NASA công bố rằng sao chổi 3I/ATLAS sẽ chỉ bay cách Trái Đất 170 triệu dặm, hoàn toàn không gây ra mối đe dọa trực tiếp.
Nhưng niềm trấn an này nhanh chóng bị lung lay bởi diễn biến mới của sao chổi.
Giáo sư Avi Loeb – nhà vật lý thiên văn nổi tiếng của Harvard – vừa đăng tải một bài viết gây chấn động, cho biết: “Sự gia tốc phi trọng lực có thể là dấu hiệu công nghệ của một động cơ bên trong.”
Loeb cũng lưu ý rằng sao chổi 3I/ATLAS đang thay đổi màu sắc, trở nên sáng và xanh hơn khi tiến gần ánh sáng Mặt Trời – một biến đổi khác thường, không phù hợp với hành vi của vật thể tự nhiên.
3I/ATLAS không chỉ là một vật thể lạ bay qua Hệ Mặt Trời, nó đang thách thức cả hiểu biết khoa học của nhân loại. Quỹ đạo bất thường. Cấu tạo kim loại gần như thuần niken. Gia tốc phi trọng lực. Biến đổi màu sắc.
Và giờ đây, Elon Musk – người đang dẫn đầu ngành công nghệ vũ trụ – cũng không loại trừ khả năng đó là “tàu vũ trụ ngoài hành tinh.”
Cho đến lúc này, NASA nói 3I/ATLAS không nguy hiểm; Musk nói có thể hủy diệt cả lục địa; Một nhà khoa học Harvard nói có dấu hiệu công nghệ bên trong sao chổi này. Và sự thật là gì thì không ai chắc chắn.
Nhưng có một điều rõ ràng là thế giới đang theo dõi từng bước di chuyển của 3I/ATLAS.
Và nếu nó thật sự là một tàu vũ trụ, con người có thể đang đứng trước khoảnh khắc thay đổi lịch sử nhân loại.
(Theo NY Post, Space, Times Of India)"
https://tienphong.vn/bac-ninh-du-kien-ho-tro-hoc-phi-dao-tao-nhan-luc-cho-cong-nghiep-ai-post1793170.tpo,Bắc Ninh dự kiến hỗ trợ học phí đào tạo nhân lực cho công nghiệp AI,"TPO - Tỉnh Bắc Ninh dự kiến chính sách hỗ trợ đào tạo các ngành, nghề phục vụ công nghiệp mũi nhọn, bán dẫn, trí tuệ nhân tạo và công nghiệp số cho học sinh, sinh viên.","Theo đó, đối tượng là học sinh, sinh viên tại các cơ sở đào tạo trên địa bàn tỉnhBắc Ninh. Để nhận hỗ trợ, học sinh tốt nghiệp THPT, trúng tuyển và tham gia học các trình độ trung cấp, cao đẳng, đại học các ngành, nghề đào tạo phục vụ công nghiệp mũi nhọn, công nghiệp bán dẫn, AI và công nghiệp số; tuyển sinh từ năm học 2025-2026 đến năm học 2029-2030.
Học sinh, sinh viên được hỗ trợ một lần/một năm học bằng tiền. Trường hợp học sinh, sinh viên học đồng thời ở nhiều cơ sở đào tạo, nhiều chương trình đào tạo thì chỉ được hưởng chính sách tại một cơ sở, một chương trình đào tạo do học sinh, sinh viên lựa chọn.
Thời gian được hưởng hỗ trợ theo thời gian học thực tế của khóa học nhưng không quá 10 tháng/1 năm học; không quá 20 tháng/1 khóa học chương trình đào tạo trình độ trung học nghề hoặc trình độ trung cấp; không quá 30 tháng/1 khóa học chương trình đào tạo trình độ cao đẳng; không quá 50 tháng/1 khóa học chương trình đào tạo trình độ đại học.
Học sinh, sinh viên học các chương trình đào tạo theo phương thức tích lũy mô đun, tín chỉ thì kinh phí được cấp theo thời gian đào tạo quy đổi nhưng không vượt quá thời gian đào tạo của ngành, nghề học và trình độ đào tạo tương đương theo niên chế.
Trường hợp học sinh, sinh viên bỏ học, bị kỷ luật buộc thôi học trong năm học nào thì không được hỗ trợ học phí của năm học đó; trường hợp học sinh, sinh viên năm học cuối không tham gia thi tốt nghiệp hoặc không được công nhận tốt nghiệp thì không được hỗ trợ học phí của năm học đó.
Trường hợp học sinh, sinh viên chưa được nhận kinh phí hỗ trợ học phí theo thời hạn quy định thì được truy lĩnh trong lần chi trả tiếp theo. Riêng kinh phí hỗ trợ cho đối tượng được hưởng chính sách từ ngày 1/8/2030 đến ngày 31/12/2030 thì được thanh toán trong năm 2031.
Học sinh, sinh viên thường trú trên địa bàn tỉnh Bắc Ninh, đủ điều kiện được hỗ trợ bằng100% học phítheo thực tế, tối đa không quá mức hỗ trợ theo từng năm học. Cụ thể, bậc đại học, năm học 2025-2026, một học sinh, sinh viên có mức hỗ trợ 1.850.000 đồng/tháng; năm học 2026-2027 mức hỗ trợ 2.090.000 đồng/tháng; năm học 2027-2028 mức hỗ trợ 2.240.000 đồng/tháng; năm học 2028-2029 mức hỗ trợ 2.400.000 đồng/tháng; năm học 2029-2030 mức hỗ trợ 2.570.000 đồng/tháng.
Bậc cao đẳng và trung cấp, năm học 2025-2026, một học sinh, sinh viên có mức hỗ trợ 2.040.000 đồng/tháng; năm học 2026-2027 mức hỗ trợ 2.400.000 đồng/tháng; năm học 2027-2028 mức hỗ trợ 2.570.000 đồng/tháng; năm học 2028-2029 mức hỗ trợ 2.750.000 đồng/tháng; năm học 2029-2030 mức hỗ trợ 2.940.000 đồng/tháng."
