url,title,description,content
https://tienphong.vn/ly-do-nhieu-truong-hoc-tai-tphcm-khong-nhan-hoa-ngay-2011-post1794470.tpo,Lý do nhiều trường học tại TPHCM không nhận hoa ngày 20/11,TPO - Nhiều trường học tại TPHCM đổi hoa ngày 20/11 thành sách vở và dành phần kinh phí đó để giúp học sinh khó khăn hoặc hỗ trợ đồng bào gặp thiên tai.,"Trường Tiểu học Phan Văn Trị (phường Cầu Ông Lãnh, TPHCM) mới đây đăng thông báo mong muốn không nhận hoa dịp20/11, mà thay bằng sách vở, bánh kẹo hoặc dụng cụ học tập cho học sinh.
Thầy Lê Hồng Thái, Hiệu trưởng Trường Tiểu học Phan Văn Trị, cho hay nhiều năm qua,dịp 20/11nhà trường nhận được rất nhiều hoa tươi. Nhưng hoa rồi sẽ tàn, trong khi học trò vẫn còn thiếu nhiều dụng cụ học tập. Vì vậy, thay vì nhận hoa, nhà trường mong nhận được những món quà là sách vở, dụng cụ học tập, bánh kẹo để khuyến khích, động viên học trò, cũng để niềm vui ngày nhà giáo thêm ý nghĩa.
Thầy Thái thông tin thêm, từ năm học trước, nhà trường đã thông báo không nhận hoachúc mừng 20/11. Phong trào nhận được sự đồng thuận lớn từ phụ huynh, mạnh thường quân. Nhiều phụ huynh đã trao tặng nhà trường dụng cụ học tập, thiết bị thể thao, góp phần tăng nguồn lực hỗ trợ học sinh tham gia các hoạt động văn - thể - mỹ.
""Trong điều kiện kinh phí và cơ sở vật chất còn hạn chế, nhà trường mong phụ huynh và mạnh thường quân tiếp tục đồng hành thông qua việc thay hoa bằng những hỗ trợ thiết thực cho học sinh"", thầy Thái bày tỏ.
Tương tự, Trường THCS Nguyễn Văn Luông (phường Bình Phú, TPHCM) cũng tổ chức lễ kỷ niệm Ngày Nhà giáo Việt Nam 20/11 nhẹ nhàng, tiết kiệm và mang tính sẻ chia.
Thầy Đinh Phú Cường, Hiệu trưởng Trường THCS Nguyễn Văn Luông (TPHCM) cho biết, năm nay nhà trường không tổ chức lễ lớn 20/11, chỉ làm gọn nhẹ với buổi tuyên truyền ngắn cho học sinh vào sáng thứ Hai đầu tuần.
“Ngày 20/11 rơi vào giữa tuần, nên sau buổi tuyên truyền, thầy cô vẫn dạy học bình thường. Chúng tôi thống nhất không làm lễ long trọng. Một phần vì tình hình khó khăn chung, phần khác là vì năm nay đồng bào miền Trung chịu thiệt hại nặng do thiên tai. Nhà trường muốn dành phần kinh phí tổ chức để ủng hộ người dân vùng lũ, theo gợi ý của Mặt trận Tổ quốc"", thầy Cường nói.
Tại ngôi trường này, việc không nhận hoa và quà ngày 20/11 đã thành truyền thống kéo dài ba năm qua. Những năm trước, trường từng khuyến khích phụ huynh đổi hoa thành thẻ bảo hiểm y tế cho học sinh, nhưng hiện nay học sinh đã được miễn phí bảo hiểm nên không còn cần thiết. Thay vì vậy, mạnh thường quân và phụ huynh tặng tập, sách, đồ dùng học tập.
“Chúng tôi không kêu gọi, mà phụ huynh tự ngỏ ý từ tặng hoa thành tặng quà cho học sinh khó khăn. Khi có người gửi tặng, nhà trường sẽ trao trực tiếp cho các em”, thầy Cường nói thêm."
https://tienphong.vn/bo-gddt-xay-dung-chinh-sach-dac-thu-thu-hut-giao-vien-vung-bien-gioi-post1794479.tpo,Bộ GD&ĐT xây dựng chính sách đặc thù thu hút giáo viên vùng biên giới,"TPO - Bộ GD&ĐT cho biết, đơn vị đang phối hợp với các bộ, ngành và địa phương xây dựng chính sách đặc thù để bố trí, đào tạo, thu hút và giữ chân đội ngũ giáo viên có năng lực, đáp ứng yêu cầu giáo dục vùng biên giới. Các chính sách dự kiến được ban hành trước năm học 2026–2027.","Theo Bộ GD&ĐT, ngày 9/11 sẽ khởi công đồng loạt các trường phổ thông nội trú liên cấp tại các xã biên giới đất liền.
Lễ khởi công đồng loạt các trường được truyền hình trực tiếp trên kênh VTV1 từ 9h – 10h30, với điểm cầu trung tâm tại xã Yên Khương, tỉnh Thanh Hóa, nơi Thủ tướng Chính phủ Phạm Minh Chính dự và phát biểu chỉ đạo.
13 điểm cầu còn lại được tổ chức tại các tỉnh: Lạng Sơn, Cao Bằng, Lào Cai, Tuyên Quang, Điện Biên, Lai Châu, Sơn La, Nghệ An, Hà Tĩnh, Quảng Trị, Đăk Lăk, Lâm Đồng và An Giang.
Đây là sự kiện mang ý nghĩa chính trị, xã hội và nhân văn sâu sắc, thể hiện sự quan tâm đặc biệt của Đảng, Nhà nước đối với học sinh vùng biên giới – nơi ""phên dậu” của Tổ quốc và cũng là hoạt động hướng tới mục tiêu bảo đảm công bằng trong tiếp cận giáo dục, thu hẹp chênh lệch vùng miền, nâng cao an sinh xã hội và củng cố quốc phòng, an ninh khu vực biên giới.
Theo thống kê, cả nước hiện có 956 trường phổ thông ở 248 xã biên giới đất liền. Trong số này, mới chỉ có 22 trường phổ thông dân tộc nội trú (PTDTNT); có khoảng 160 trường phổ thông dân tộc bán trú (PTDTBT).
Trong tổng số 625.255 học sinh trên địa bàn các xã biên giới, số học sinh không đủ điều kiện học tại trường PTDTNT, PTDTBT nhưng có nhu cầu được học nội trú, bán trú khoảng gần 44%.
Bộ GD&ĐT đã báo cáo, đề xuất lãnh đạo Đảng, Nhà nước chủ trương xây dựng các trường nội trú cho học sinh ở vùng sâu, vùng xa, biên giới, hải đảo, đặc biệt là tại các xã biên giới đất liền.
Theo đó, cả nước sẽ được đầu tư 248 trường phổ thông nội trú liên cấp tiểu học – trung học cơ sở.
Trong đó, 100 trường được chọn đầu tư xây dựng giai đoạn 1, với tổng nhu cầu vốn đầu tư gần 20.000 tỷ đồng.
Các trường được khởi công đồng loạt ngày 9/11 đều thuộc danh mục 100 trường đã được Chính phủ phê duyệt đầu tư trong năm 2025, dự kiến hoàn thành và đưa vào sử dụng trước khai giảng năm học 2026–2027.
Mỗi trường được bố trí khu học tập, khu nhà ở nội trú, nhà ăn, khu sinh hoạt văn hóa – thể thao, thư viện, phòng học bộ môn, khu giáo viên nội trú, đảm bảo điều kiện học tập, sinh hoạt, rèn luyện toàn diện.
Bộ GDĐT xác định đây là mô hình trường mới, không phải “trường nén” hay “trường phân tán”, mà là một mô hình hiện đại, đồng bộ, kết hợp chính sách nội trú – bán trú linh hoạt.
Đây là bước khởi đầu để tiến tới hoàn thành 248 trường trong giai đoạn 2025–2028, góp phần xóa dần khoảng cách vùng miền và tạo dựng vành đai tri thức bền vững nơi biên cương.
Cùng với đó, Bộ GD&ĐT cũng đang phối hợp xây dựng các chính sách đặc thù đào tạo, thu hút và giữ chân đội ngũ giáo viên có năng lực."
https://tienphong.vn/truong-hoc-van-dong-gan-1-ty-dong-xa-hoi-hoa-gay-xon-xao-hieu-truong-noi-gi-post1794307.tpo,"Trường học vận động gần 1 tỷ đồng xã hội hoá gây xôn xao, hiệu trưởng nói gì?","TPO - Tại Trường Tiểu học và THCS Kỳ Văn (Hà Tĩnh) đã đưa ra kế hoạch vận động tài trợ xã hội hoá với tổng gần 1 tỷ đồng. Phụ huynh phản ánh trường thu cào bằng, trong đó có hạng mục cải tạo phòng nghỉ cho giáo viên chưa phù hợp với quy định.","Choáng với loạt hạng mục vận động
Những ngày qua, nhiều phụ huynh có con theo học tại Trường Tiểu học và THCS Kỳ Văn (tỉnh Hà Tĩnh) phản ánh về việc nhà trường triển khai nhiều khoản vận động xã hội hóa chưa phù hợp, đặc biệt chia bình quân 850.000 đồng/học sinh gây bức xúc.
Qua tìm hiểu, trong năm học 2025 – 2026, Trường Tiểu học và THCS Kỳ Văn (xã Kỳ Văn, tỉnh Hà Tĩnh) đã ban hành kế hoạch vận động tài trợ, tiếp nhận, quản lý và sử dụng các khoản tài trợ phục vụ hoạt động giáo dục với nhiều hạng mục khác nhau.
Theo nội dung văn bản, nhà trường dự kiến vận động tài trợ cho hàng loạt hạng mục với tổng kinh phí hơn 934 triệu đồng.
Bên cạnh các khoản tài trợ bằng tiền, trường cũng kêu gọi tài trợ bằng hiện vật, gồm 10 cây cảnh, cây bóng mát đã lớn (đường kính từ 0,25m trở lên) và 150 đầu sách phục vụ công tác giảng dạy và học tập.
Trong phụ lục kế hoạch vận động tài trợ do Trường Tiểu học và THCS Kỳ Văn ban hành, có 16 hạng mục cần huy động để tu sửa và mua sắm trang thiết bị, cơ sở vật chất.
Nhóm trang thiết bị, nhà trường dự kiến: Mua bàn ghế học sinh tại phòng học với kinh phí gần 185 triệu đồng; bàn ghế cho phòng tin học hơn 34 triệu đồng; mua bàn để dụng cụ, thiết bị dạy tại lớp học (9 bộ), đơn giá gần 19 triệu đồng; bảng trượt chống loá tại các phòng học bộ môn (7 chiếc) với giá hơn 52 triệu đồng.
Còn nhóm cơ sở vật chất gồm 12 hạng mục, trong đó có: Phá dỡ nhà nội trú cũ, thu gom vật liệu, xử lý xỉ thải xây dựng phía sau nhà đa năng, san lấp mặt bằng phòng học và nhà xe học sinh tiểu học… với tổng chi phí 36 triệu đồng. Đối với hạng mục làm mới và di chuyển nhà xe học sinh THCS, trường dự kiến kinh phí khoảng 130 triệu đồng.
Ngoài ra, trường còn liệt kê chi tiết nhiều hạng mục khác như: Làm hệ thống tưới nước, trồng cây cảnh (hơn 79 triệu đồng); phá dỡ bồn hoa cũ, hư hỏng, không còn phù hợp (36 triệu đồng); làm vườn hoa hai bên cổng chính và phụ (hơn 39 triệu đồng); san lấp, cải tạo sân thể dục khối tiểu học (45 triệu đồng)…
Đáng chú ý, trong kế hoạch vận động tài trợ của Trường Tiểu học và THCS Kỳ Văn có một số hạng mục gây băn khoăn. Cụ thể, nhà trường dự kiến làm vách ngăn 2 phòng họp cũ thành 3 phòng tổ chuyên môn, đồng thời cải tạo 4 phòng nội trú thành phòng nghỉ giáo viên, phòng Đoàn - Đội, phòng Đảng - Đoàn thể và phòng kho với tổng kinh phí hơn 45 triệu đồng.
Bên cạnh đó, trường cũng dự kiến sơn hàng rào trước đường liên thôn, phòng nghỉ giáo viên, phòng Đoàn - Đội, phòng Đảng - Đoàn thể và phòng chuyên môn với kinh phí hơn 48 triệu đồng. Nhiều phụ huynh cho rằng việc đưa phòng nghỉ giáo viên và một số công trình phục vụ nội bộ vào danh mục vận động xã hội hóa là chưa phù hợp với quy định về xã hội hóa trong giáo dục.
Hiệu trưởng nói gì về các khoản thu?
Trao đổi vớiBáo Tiền Phong, ông Vũ Việt Thành - Hiệu trưởng Trường Tiểu học và THCS Kỳ Văn cho biết, năm nay trường vận động xã hội hoá làm một số hạng mục tại trường với tổng kinh phí hơn 934 triệu đồng. Tuy nhiên việc phụ huynh phản ánh thu cào bằng, lãnh đạo trường khẳng định chủ trương vận động xã hội hoá chỉ thực hiện trên tinh thần tự nguyện. Có thể một số giáo viên chủ nhiệm chưa hiểu đúng chủ trương nên phổ biến với phụ huynh sai.
Theo lãnh đạo trường Trường Tiểu học và THCS Kỳ Văn, các hạng mục đưa vào vận động xã hội hoá là những hạng mục đã khảo sát thực tế, cần được sửa chữa, mua sắm phục vụ năm học mới. Những hạng mục này đã được sắp xếp theo thứ tự, cần sẽ làm trước.
""Kế hoạch này đã được UBND phường Kỳ Văn phê duyệt xét theo nhu cầu thực tế từ trường trình lên. Quan điểm nhà trường là tự nguyện, ai tài trợ được bao nhiêu thì tốt bấy nhiêu, có nguồn sẽ làm ưu tiên các hạng mục quan trọng trước. Đối với tổng kinh phí nhìn thì nhiều, nhưng đó là hai cấp với hơn 1.100 học sinh"", ông Vũ Việt Thành chia sẻ.
Khi hỏi đến việc triển vận động tài trợ để cải tạo phòng nghỉ cho giáo viên liệu đã đúng quy định, lãnh đạo trường cho biết: ""Cái này để chúng tôi kiểm tra lại. Còn theo tôi nghĩ nếu có điều kiện mà làm được thì tốt. Đây chỉ mới kêu gọi tài trợ, nếu xin làm được thì tốt, không thì thôi"".
Liên quan đến bản kế hoạch vận động tài trợ, trong đó số tiền kêu gọi được chia theo từng khối lớp gây xôn xao, lãnh đạo trường Trường Tiểu học và THCS Kỳ Văn khẳng định đó chỉ là bản dự thảo, chưa ban hành. Văn bản này trước đó đưa ra để lấy ý kiến hội đồng, còn trường thực hiện vận động xã hội hoá theo hình thức tự nguyện."
https://tienphong.vn/nxbgdvn-danh-20-ti-dong-dong-hanh-cung-hoc-sinh-truong-hoc-vung-bao-lu-post1794549.tpo,"NXBGDVN dành 20 tỉ đồng đồng hành cùng học sinh, trường học vùng bão lũ","NXBGDVN cam kết dành tổng kinh phí đến 20 tỉ đồng cho chương trình “Ủng hộ sách giáo khoa cho học sinh vùng bão lũ, vùng khó khăn” trong năm nay.","Trước những thiệt hại nghiêm trọng do mưa bão liên tiếp gây ra trên khắp cả nước, Nhà xuất bản Giáo dục Việt Nam (NXBGDVN) khẳng định tinh thần sẵn sàng chung tay cùng ngành giáo dục và các địa phương, hỗ trợ sách giáo khoa cho học sinh, nhà trường vùng khó khăn và vùng bị ảnh hưởng bởi thiên tai trên cả nước.
Trong bối cảnh mưa lũ liên tiếp hoành hành, đặc biệt là sau các cơn bão số 3, 10, 11 và nay là bão số 12 và 13 đang tiếp diễn, NXBGDVN một lần nữa khẳng định tinh thần “Vì học sinh thân yêu – không để em nào bị bỏ lại phía sau”, luôn sẵn sàng đồng hành, sẻ chia cùng các em học sinh, các thầy cô giáo và các nhà trường vùng khó khăn, vùng chịu ảnh hưởng nặng nề của thiên tai, bão lũ.
Tính từ đầu năm đến nay, tổng kinh phí NXBGDVN dành cho công tác xã hội, từ thiện lên tới 4,3 tỉ đồng. Riêng trong các đợt bão lũ vừa qua, NXBGDVN đã trao tặng gần 200.000 bản sách giáo khoa cùng tiền mặt, tổng trị giá 3,5 tỉ đồng đến các trường học và học sinh tại các tỉnh: Điện Biên, Lai Châu, Nghệ An, Tuyên Quang, Sơn La, Lào Cai, Bắc Ninh, Cao Bằng, Lạng Sơn, Thái Nguyên, Thanh Hóa, Đà Nẵng, Thừa Thiên Huế.
Ví dụ ngày 4/11, Đoàn công tác của NXBGDVN do ông Nguyễn Chí Bính, Phó Tổng Giám đốc dẫn đầu đã đến thăm hỏi và ủng hộ các trường học bị ảnh hưởng bởi lũ lụt tại tỉnh Bắc Ninh.
Được biết sau hai cơn bão số 10 và 11 vừa qua, ngành giáo dục tỉnh Bắc Ninh bị ảnh hưởng nặng nề, trong đó có khoảng 100 trường học chịu thiệt hại với số tiền ước tính ban đầu hơn 20 tỉ đồng.
Với tinh thần tương thân tương ái, NXBGDVN đã ủng hộ các trường học bị ảnh hưởng bởi lũ lụt thuộc tỉnh Bắc Ninh với số tiền mặt 30 triệu đồng và 7.752 bản sách giáo khoa (500 bộ) với trị giá gần 106 triệu đồng. NXBGDVN hi vọng hỗ trợ này sẽ giúp các em học sinh khắc phục khó khăn, nhanh chóng ổn định việc học tập.
Trước đó, chia sẻ khó khăn với các em học sinh của tỉnh, thông qua Sở GD&ĐT Tuyên Quang, NXBGDVN đã hỗ trợ các em số sách sách giáo khoa trị giá khoảng 100 triệu đồng.
Hiện nay, bão số 13 đang tiếp tục gây ảnh hưởng nghiêm trọng đến các tỉnh miền Trung, dự báo sẽ gây ra thiệt hại lớn về cơ sở vật chất, đặc biệt là tại các trường học. Trước tình hình đó, NXBGDVN đã chủ động chuẩn bị nguồn lực và sẵn sàng hỗ trợ các địa phương bị ảnh hưởng, nhằm giúp thầy và trò sớm ổn định dạy – học sau bão.
NXBGDVN cam kết dành tổng kinh phí đến 20 tỉ đồng cho chương trình “Ủng hộ sách giáo khoa cho học sinh vùng bão lũ, vùng khó khăn” trong năm nay. Các cơ sở giáo dục gặp khó khăn về sách giáo khoa do mưa lũ xin vui lòng gửi công văn về NXBGDVN, chúng tôi sẵn sàng tiếp nhận, xem xét và hỗ trợ nhanh nhất có thể.
Với tinh thần “Chung tay vì học sinh thân yêu”, NXBGDVN cam kết luôn đồng hành, sẻ chia và góp phần giúp học sinh ở mọi miền đất nước được tiếp cận tri thức, dù trong bất kỳ hoàn cảnh nào."
https://tienphong.vn/nam-sinh-lop-11-danh-hoc-sinh-lop-9-tu-vong-post1794289.tpo,Nam sinh lớp 11 đánh học sinh lớp 9 tử vong,"TPO - Do phát sinh mâu thuẫn, nam sinh lớp 9B Trường THCS Minh Lạc (Hà Tĩnh) bị học sinh khác trường đánh vào đầu gây chấn thương sọ não, tử vong sau nhiều ngày điều trị.","Ngày 7/11, lãnh đạo UBND xã Cẩm Lạc (tỉnh Hà Tĩnh) xác nhận, trên địa bàn vừa xảy ra vụ việc nam sinh lớp 9B Trường THCS Minh Lạc bị học sinh lớp 11 đánh vào đầu, dẫn đến tử vong. Hiện phía xã đã có báo cáo về sự việc gửi cơ quan chức năng.
Theo báo cáo của UBND xã Cẩm Lạc, vào khoảng 11h25, ngày 24/9, sau giờ tan học, giữa các em N.K.M.; T.Q.H. và V.Q.A. cùng học lớp 9 tại Trường THCS Minh Lạc xảy ra xô xát với em L.V.P. (SN 2007, trú thôn Quang Trung 1, xã Cẩm Lạc), là học sinh lớp 11 tại Trung tâm Giáo dục nghề nghiệp - Giáo dục thường xuyên Cẩm Xuyên.
Quá trình xảy ra xô xát, em N.K.M. bị nam sinh L.V.P đánh vào đầu gây chấn thương sọ não.
Sau khi xảy sự việc, em M. được đưa đi cấp cứu tại Bệnh viện Đa khoa tỉnh Hà Tĩnh và điều trị cho đến ngày 8/10. Do sốt cao, từ ngày 9/10, em M. được gia đình chuyển ra Bệnh viện Nhi Trung ương điều trị.
Đến ngày 30/10, em M. đã tử vong tại Bệnh viện Nhi Trung ương. Sau đó, gia đình đã đưa thi thể em về quê tổ chức tang lễ, an táng vào ngày 31/10.
Ngay sau sự việc, Công an xã Cẩm Lạc đã triệu tập những học sinh liên quan đến làm việc, điều tra làm rõ.
Trong quá trình chữa trị cho em M, phía UBND xã Cẩm Lạc đã hỗ trợ 10 triệu đồng, Trường THCS Minh Lạc hỗ trợ 17 triệu đồng để gia đình lo chi phí thuốc men. Tuy nhiên, do bị thương nặng, cháu không qua khỏi.
""Nguyên nhân xuất phát từ mâu thuẫn cá nhân nên các em hẹn nhau ra bờ sông để giải quyết và được người dân phát hiện, ngăn cản. Sau đó, trên đường em L.K.M. trở về nhà thì bị L.V.P. đuổi theo đánh vào đầu dẫn đến bị thương nặng và tử vong sau đó"", lãnh đạo xã Cẩm Lạc nói.
Hiện vụ việc đang tiếp tục được cơ quan chức năng điều tra làm rõ."
