url,title,description,content
https://tienphong.vn/de-xuat-ke-khai-so-huu-nha-o-lo-ngai-khong-kha-thi-va-trung-lap-post1790842.tpo,Đề xuất kê khai sở hữu nhà ở: Lo ngại không khả thi và trùng lặp,"TPO - Hiện không thể thống kê số liệu về nhà vì Việt Nam có đến hàng chục loại nhà khác nhau như nhà tạm, nhà không phép, sai phép, nhà có sổ, không sổ, nhà tranh chấp, nhà vô chủ… Việc xây dựng dữ liệu dân cư dựa trên nhà ở sẽ dẫn đến trùng lặp, thiếu chính xác và chồng chéo giữa các cơ quan.","Bộ Xây dựng đang lấy ý kiến cho dự thảo Nghị định thay thế Nghị định 94/2024/NĐ-CP về hệ thống thông tin nhà ở và thị trường bất động sản. Điểm đáng chú ý trong dự thảo là từ năm 2026, cá nhân sẽ phải cung cấp thông tin về sở hữu nhà ở để tích hợp vào cơ sở dữ liệu quốc gia.
Theo dự thảo, cả tổ chức và cá nhân tại Việt Nam và nước ngoài phải cung cấp các dữ liệu gồm thông tin nhận diện (họ tên, số định danh, giấy tờ pháp lý), thông tin nhà ở sở hữu như loại hình nhà, địa chỉ, diện tích, số lượng, thời hạn và hình thức sở hữu, tình trạng pháp lý.
Trao đổi với PVTiền Phong, TS Phạm Viết Thuận, Viện trưởng Viện Kinh tế Tài nguyên và Môi trường TPHCM cho rằng dự thảo về kê khai nhà ở do Bộ Xây dựng đưa ra là không khả thi về mặt quản lý Nhà nước.
Nếu số hóa tài sản là nhà ở của người dân để phục vụ giao dịch bất động sản qua sàn nhằm chống gian lận, ổn định giá bất động sản lại không đúng mục tiêu số hóa thông tin về nhà ở và thửa đất mà Bộ Nông nghiệp và Môi trường đang cập nhật là làm sạch dữ liệu trong 90 ngày.
Hiện, công tác thống kê và quản lý đất đai được thực hiện theo thửa đất và tờ bản đồ, do Bộ Nông nghiệp và Môi trường chủ trì, phối hợp cùng Bộ Công an trong làm sạch dữ liệu. Mục tiêu quản lý đất đai cơ bản là quản lý dữ liệu từ các thửa đất, số tờ, số thửa chứ không phải từ căn nhà trên đất.
“Điều quan trọng nhất hiện nay là thống kê thửa đất tờ bản đồ tích hợp vào căn cước công dân mà trước đó Viện Kinh tế Tài nguyên và Môi trường TPHCM đã đề xuất Chính phủ. Cơ sở dữ liệu quốc gia bao gồm thửa đất, tờ bản đồ là dữ liệu quan trọng nhất. Do đó, Bộ Xây dựng muốn quản lý thông tin sở hữu nhà ở là điều không thể triển khai vì chồng chéo”, ông Thuận nói.
Theo Viện trưởng Viện Kinh tế Tài nguyên và Môi trường TPHCM, hiện nay chúng ta không thể thống kê số liệu về nhà vì Việt Nam có đến hàng chục loại nhà khác nhau. Cụ thể, gồm nhà tạm, nhà không phép, sai phép, nhà có sổ, không sổ, nhà tranh chấp, nhà vô chủ… Việc xây dựng dữ liệu dân cư dựa trên nhà ở sẽ dẫn đến trùng lặp, thiếu chính xác và chồng chéo giữa các cơ quan.
“Không thể dựa vào nhà để lấy thông tin làm dữ liệu dân cư theo dự thảo của Bộ Xây dựng. Do đó, dữ liệu dân cư là phải tập trung về một đầu mối là Bộ Nông nghiệp và Môi trường - nơi đang quản lý dữ liệu đất đai thống nhất. Bộ Xây dựng nên quan tâm hơn việc nhà xây dựng miễn giấy phép, hướng dẫn đăng ký nhà ở trên nền tảng số gắn với dữ liệu lô - thửa thay vì đi thống kê nhà. Hãy để tập trung về một mối, sau đó sẽ triển khai đồng bộ các sự vụ liên quan đến nhà và thửa đất thì sẽ hợp lý hơn”, ông Thuận kiến nghị.
Để số hóa tài sản trên đất hợp pháp, ông Thuận cho rằng, Bộ Xây dựng nên phối hợp với Bộ Nông nghiệp và Môi trường trích xuất trên cơ sở dữ liệu từng địa phương trên cơ sở bản đồ ranh, thửa sẽ có thông tin đầy đủ nhà đất theo số thửa, kể cả căn cước công dân của chủ sở hữu nhà. Việc đề xuất người dân thống kê nhà ở theo dự thảo là thiếu tính khoa học trong thời đại số hóa dữ liệu theo Nghị quyết 57/2025 của Bộ Chính trị.
Tổng giám đốc một công ty bất động sản ở TPHCM cho rằng, đề xuất của Bộ Xây dựng đang trùng lặp với công việc của Bộ Nông nghiệp và Môi trường, Bộ Công an đang triển khai trong quá trình xây dựng cơ sở dữ liệu đất đai.
Chưa kể, UBND các xã - phường, ngành quản lý đất đai cũng vừa yêu cầu người dân cung cấp thông tin về sổ đỏ nên lo ngại về trùng lặp dữ liệu giữa ngành quản lý đất đai, chính quyền cơ sở và Bộ Xây dựng là hoàn toàn có cơ sở. Người dân nhiều lần phải cung cấp thông tin tương tự khi đăng ký đất đai, cấp sổ đỏ hoặc cập nhật biến động sở hữu. Nếu Bộ Xây dựng tiếp tục yêu cầu kê khai riêng từ năm 2026 mà không có cơ chế liên thông dữ liệu thì sẽ làm tăng gánh nặng hành chính và nguy cơ phân mảnh cơ sở dữ liệu quốc gia.
“Yêu cầu của Bộ Xây dựng sẽ gây trùng lặp dữ liệu và tăng gánh nặng hành chính, bởi các thông tin như họ tên, số định danh, địa chỉ, diện tích, tình trạng pháp lý... đã có trong cơ sở dữ liệu đất đai, dân cư và thuế”, vị này nói.
Trước đó, Cục Quản lý đất đai, Bộ Nông nghiệp và Môi trường cũng đã có hướng dẫn các địa phương chỉnh lý cơ sở dữ liệu đất đai theo chính quyền 2 cấp sau sáp nhập và gắn mã định danh thửa đất trên địa bàn có dữ liệu địa chính. Quy trình xây dựng mã ID cho thửa đất có 4 bước, gồm xác định điểm đặc trưng của thửa đất, chuyển vị trí từ hệ tọa độ của Việt Nam sang quốc tế, mã hóa vị trí điểm đặc trưng, cập nhật bảng dữ liệu không gian thửa đất."
https://tienphong.vn/khong-can-di-xa-noi-do-van-co-du-an-gia-re-hiem-co-cho-nguoi-tre-mua-nha-post1791939.tpo,"Không cần đi xa, nội đô vẫn có dự án giá rẻ hiếm có cho người trẻ mua nhà","Người trẻ mua nhà tăng mạnh với tiêu chí giá càng thấp càng tốt nhưng tiện ích đủ đầy. Những dự án đáp ứng bộ đôi nhu cầu này thường tập trung tại vùng ven, thậm chí đi xa hơn. Chính điều đó khiến Hanoi Melody Residences trở thành ngoại lệ khi sở hữu vị trí gần trung tâm Thủ đô vẫn có mức giá “rẻ giật mình”.","Mức giá trong mơ của khách hàng trẻ
Trong khi giá nhà ngày càng xa tầm với của người mua ở thực, đặc biệt là khách hàng trẻ, Hanoi Melody Residences ở Tây Nam Linh Đàm lại khiến nhiều người bất ngờ khi vẫn giữ được mức giá hợp lý dù có vị trí thuận lợi ngay nội đô.
Anh Nguyễn Quốc Đạt – một môi giới tham gia bán hàng tại Hanoi Melody Residences cho hay, tỷ lệ người trẻ tìm tới Hanoi Melody Residences trong thời gian qua rất đông đảo, chủ yếu là các cặp đôi mới kết hôn hoặc có con nhỏ.
Theo anh Đạt, yếu tố hấp dẫn nhất người trẻ mua nhà Hanoi Melody Residences là mức giá cạnh tranh bậc nhất nội đô, chỉ từ 71,9 triệu đồng/m2. Đây được coi là của hiếm trên thị trường, giúp người mua không cần dịch chuyển ra xa trong bối cảnh mặt bằng giá nhà tại Hà Nội liên tục lập đỉnh, thậm chí nhiều dự án vùng ven cũng tiệm cận 100 triệu đồng/m².
“Giới trẻ ngày nay rất thực tế khi mua nhà. Họ đề cao trải nghiệm sống – muốn nơi ở có thiết kế hiện đại, tiện ích đầy đủ nhưng vẫn đặt bài toán tài chính lên hàng đầu: giá phải phù hợp, phương án thanh toán linh hoạt, và đặc biệt là pháp lý minh bạch, tiến độ chắc chắn để tránh mọi rủi ro khi mua nhà lần đầu”,anh Đạt nhận định.
Vợ chồng anh Minh Tuấn (29 tuổi) – khách hàng sở hữu căn hộ 2 phòng ngủ tại Hanoi Melody Residences – cho biết, sau khi tìm hiểu nhiều dự án từ nội đô đến vùng ven, anh nhận ra hầu hết đều vượt quá khả năng tài chính.
“Khi biết Hanoi Melody Residences có giá chỉ hơn 70 triệu đồng/m², không quá xa chỗ làm và đang vào giai đoạn cất nóc các tòa, vợ chồng tôi quyết định nhờ ông bà hai bên hỗ trợ và vay ngân hàng một phần để chốt sớm”,anh Tuấn chia sẻ.
Theo anh, đây là quyết định “vừa liều vừa may” bởi sau khi đặt cọc ít lâu, loại diện tích anh mua đã “bay sạch”.“May mắn là giờ chúng tôi có thể yên tâm chờ ngày nhận nhà, lại đúng quỹ tài chính dự trù. Nếu chậm thêm chút nữa, chắc đã lỡ mất cơ hội này”anh nói.
Thêm khẩu vị chọn nhà của khách hàng trẻ
Những khách hàng trẻ của Hanoi Melody Residences góp phần làm nên xu hướng trẻ hóa tuổi mua nhà. Theo dữ liệu mới nhất của Hội Môi giới Bất động sản Việt Nam (VARS), từ năm 2019 đến nay, tỷ lệ người trẻ tham gia thị trường bất động sản, đặc biệt ở phân khúc căn hộ, tăng rõ rệt. Khách hàng trong độ tuổi 25-35 hiện chiếm trung bình hơn 40% giao dịch. Tại một số dự án, tỉ lệ này chiếm tới 70%.
Khẩu vị mua nhà của người trẻ cũng thay đổi rõ rệt so với thế hệ trước. Họ không còn ưu tiên nhà phố hay đất nền mà hướng đến căn hộ chung cư có kết nối hạ tầng tốt, giá cả ""dễ thở"" và phù hợp với phong cách sống hiện đại, cùng hệ thống tiện ích nội khu đồng bộ như: siêu thị, phòng gym, trường học, công viên... Đây cũng chính là những yếu tố mà Hanoi Melody Residences đang sở hữu.
Hanoi Melody Residences nổi bật với hệ thống gần 20 tiện ích nội khu khép kín: bể bơi, sân thể thao đa năng, vườn gym, đường dạo bộ, shophouse khối đế, khu vui chơi trẻ em… Tất cả được thiết kế để đáp ứng trọn vẹn nhu cầu sống, làm việc và thư giãn của cư dân trẻ. Đặc biệt, dự án có trường mầm non nội khu và kế cận hàng loạt trường học đa cấp bậc, giúp cư dân yên tâm cho con theo học gần nhà.
Nằm trong khu đô thị mới Tây Nam Linh Đàm, Hanoi Melody Residences sở hữu 4 mặt thoáng, bao quanh là các dãy biệt thự quy hoạch đồng bộ, đảm bảo không gian yên tĩnh và riêng tư. Từ đây, cư dân dễ dàng kết nối đến trung tâm thành phố và các khu vực khác qua trục Giải Phóng – Vành đai 3 – Quốc lộ 1A, đồng thời thừa hưởng hệ thống tiện ích ngoại khu hoàn chỉnh: bệnh viện, trường học, trung tâm thương mại…
Dự án cung cấp chính sách tài chính linh hoạt, hỗ trợ tối ưu cho khách hàng. Khách vay mua nhà được hỗ trợ lãi suất 0% và ân hạn nợ gốc đến khi nhận nhà hoặc tối đa 24 tháng. Chính sách này giảm áp lực tài chính ban đầu, tạo cơ hội cho người trẻ ổn định thu nhập trước khi bước vào giai đoạn trả góp.
Đặc biệt, dự án đã sổ đỏ toàn khu và tiến độ thi công đảm bảo với tòa đầu tiên đã cất nóc từ đầu tháng 8/2025. Các tòa còn lại đang được đẩy nhanh hoàn thiện, dự kiến bàn giao đồng loạt vào quý IV/2026. Những yếu tố này giúp người trẻ thêm yên tâm khi chọn nơi an cư đầu tiên cho mình.
Trong bối cảnh giá bất động sản ngày càng tăng, việc “xuống tiền” sớm tại những dự án có vị trí đẹp, tiện ích hoàn chỉnh và tiến độ đảm bảo như Hanoi Melody Residences được xem là bước đi chiến lược, giúp người trẻ vừa an cư, vừa nắm bắt cơ hội đầu tư cho tương lai.
Để biết thêm chi tiết, vui lòng xem tại:Hanoi Melody Residences"
https://tienphong.vn/pi-group-hop-tac-cung-viet-land-mo-rong-mang-luoi-phan-phoi-do-thi-so-picity-post1791932.tpo,"Pi Group hợp tác cùng Việt Land, mở rộng mạng lưới phân phối Đô thị số Picity","Ngày 28/10/2025, tại Khách sạn Hilton, Pi Group đã tổ chức Lễ ký kết Hợp tác Phân phối Đô thị số Picity cùng đối tác Việt Land. Sự kiện này chính thức đưa Việt Land trở thành đại sứ lan tỏa giá trị của mô hình đô thị số tiên phong đến với khách hàng.","Là một trong những đơn vị phân phối năng động, nhạy bén với xu hướng, Việt Land đã khẳng định uy tín qua việc đồng hành cùng nhiều chủ đầu tư hàng đầu thị trường. Việc tham gia phân phối Đô thị số Picity khẳng định sự chủ động của Việt Land trên hành trình mang đến cho khách hàng những sản phẩm bất động sản đột phá của kỷ nguyên số.
Theo chia sẻ từ Việt Land, phần lớn thị trường vẫn đang tập trung khai thác các lợi thế mang tính chất truyền thống, xoay quanh bài toán vị trí và quy mô xây dựng, trong khi đó Đô thị số Picity của Pi Group nổi lên như một ""điểm sáng"" với triết lý phát triển hoàn toàn khác biệt. Sức hút của mô hình này đến từ việc Pi Group kiên định kiến tạo một hệ giá trị toàn diện, hội tụ đủ ba trụ cột cốt lõi: quản lý vận hành toàn diện bằng công nghệ (AI, IoT, Blockchain); hệ sinh thái tiện ích 5 sao chuẩn quốc tế và đồng bộ chất lượng từ thương hiệu toàn cầu.
Pi Group định hướng đây chính là xu hướng tất yếu, là chuẩn mực mới cho đô thị tương lai và là bản sắc định vị lợi thế cạnh tranh của Tập đoàn.
Để hiện thực hóa cam kết về chất lượng, Pi Group đã quy tụ một hệ sinh thái đối tác công nghệ và vật liệu hàng đầu thế giới. Sự đồng hành của thương hiệu tên tuổi như Otis (thang máy), ABB và Osram (thiết bị điện – chiếu sáng), Imudex (smarthome), Grohe (thiết bị vệ sinh), Adel (khóa điện tử) và Keenon Robotics (robot vận hành) chính là bảo chứng vững chắc, giúp nâng tầm chuẩn sống quốc tế cho mô hình đô thị số tại Việt Nam, tiệm cận với các chuẩn mực sống cao cấp của các mô hình đô thị tại các quốc gia phát triển trong khu vực.
Toàn bộ chiến lược này được dẫn dắt bởi triết lý nhất quán: “Lấy cư dân làm trung tâm – Lấy chất lượng làm nền tảng – Lấy công nghệ làm động lực phát triển”. Trong khuôn khổ sự kiện, Pi Group cũng công bố lộ trình triển khai mô hình này, bắt đầu với các dự án Picity Sky Park và Phân khu cao cấp nhất SkyZen trên trục đại lộ Phạm Văn Đồng, tập trung vào phong cách sống cân bằng giữa nghỉ dưỡng – công nghệ và sức khỏe.
Đặc biệt, dự án trọng điểm Picity Central Park (dự kiến ra mắt Quý I/2026) được định vị trở thành biểu tượng mới của đô thị số tại TP.HCM. Đây là minh chứng rõ nét cho sứ mệnh kiến tạo các sản phẩm bất động sản bền vững, khác biệt và mang tầm quốc tế mà Pi Group đang theo đuổi.
Lễ Ký kết Hợp tác Chiến lược lần này không chỉ là một cột mốc quan trọng của Pi Group trong hành trình kiến tạo Đô thị số Picity. Đây còn là một tuyên ngôn tiên phong, thể hiện bản lĩnh và tầm nhìn của một nhà phát triển đô thị đang dẫn dắt xu hướng.
Bằng việc ứng dụng công nghệ thực tiễn để nâng tầm chất lượng sống và kiến tạo giá trị bền vững, Pi Group không chỉ bổ sung nguồn cung chất lượng cho thị trường. Hơn thế nữa, đây là một bước đi chiến lược, góp phần thiết lập một chuẩn mực mới cho bất động sản công nghệ, thúc đẩy quá trình chuyển đổi số đô thị và đồng hành cùng mục tiêu thay đổi diện mạo đô thị Việt Nam ngày càng văn minh, hiện đại"
https://tienphong.vn/bat-dong-san-trung-tam-cang-tu-xu-huong-toan-cau-den-chien-luoc-phat-trien-tai-tphcm-post1791906.tpo,Bất động sản trung tâm cảng: Từ xu hướng toàn cầu đến chiến lược phát triển tại TP.HCM,"Bất động sản trung tâm cảng biển quốc tế TP.HCM đang dần trở thành một trong những phân khúc tiềm năng, không chỉ đáp ứng nhu cầu an cư mà còn mang ý nghĩa chiến lược trong quá trình hình thành phong cách sống – làm việc – kết nối toàn cầu. Đây là hướng phát triển tất yếu khi kinh tế hàng hải và dịch vụ logistics được xem là động lực tăng trưởng mới của khu vực phía Nam.","Trong bức tranh toàn cầu, những đô thị cảng như Singapore, Busan hay Rotterdam đều là hình mẫu cho sự phát triển bền vững – nơi giao thương, công nghệ và đời sống đô thị vận hành hài hòa. Điểm chung của các thành phố này là quy hoạch đồng bộ giữa hạ tầng cảng biển, khu thương mại – logistics và khu dân cư hiện đại, tạo nên những “trung tâm kép” vừa là nơi làm việc, vừa là không gian sống chất lượng cao. Nhờ đó, bất động sản trung tâm cảng được giới đầu tư quốc tế đánh giá cao về khả năng sinh lời ổn định và giá trị khai thác thực tế.
TP.HCM – tâm điểm mới của đô thị cảng quốc tế
Việc mở rộng không gian phát triển đô thị về phía Đông – Nam gắn với cụm cảng quốc tế Cái Mép – Thị Vải đang mở ra giai đoạn mới cho TP.HCM. Định hướng này không chỉ giúp thành phố tái cấu trúc mô hình tăng trưởng theo hướng gắn kết giao thương hàng hải, logistics và dịch vụ công nghiệp hỗ trợ, mà còn đặt nền móng cho hình thành một “đô thị cảng biển quốc tế” hiện đại của khu vực.
Hệ thống hạ tầng liên vùng đang được đẩy mạnh với các dự án trọng điểm như cao tốc Biên Hòa – Vũng Tàu, tuyến ven biển, sân bay quốc tế Long Thành cùng mạng lưới giao thông kết nối cảng – khu công nghiệp – đô thị. Theo Bộ Công Thương, ngành logistics Việt Nam duy trì tốc độ tăng trưởng trung bình 14–16% mỗi năm, trở thành nền tảng quan trọng để TP.HCM phát triển mô hình đô thị cảng, thu hút chuyên gia và doanh nghiệp toàn cầu đến sinh sống, làm việc.
Sức hút của bất động sản khu trung tâm cảng
Sự hình thành và phát triển của hệ sinh thái cảng biển đang kéo theo nhu cầu cư trú ngày càng tăng từ đội ngũ chuyên gia, kỹ sư và nhà đầu tư trong lĩnh vực logistics và thương mại quốc tế. Các khu vực trung tâm cảng vì thế trở thành điểm đến ưu tiên, không chỉ nhờ lợi thế giao thương mà còn bởi khả năng đáp ứng đồng thời nhu cầu ở thực, môi trường sống hiện đại và cơ hội kết nối nghề nghiệp bền vững.
Thực tế cho thấy, cácdự ánbất động sản tại khu trung tâm cảng thường ghi nhận biên độ tăng giá ổn định do quỹ đất hạn chế và sức cầu thực tế cao. Những sản phẩm được ưa chuộng gồm căn hộ, shophouse thương mại hay mô hình nhà ở kết hợp lưu trú, vừa bảo đảm tiện nghi sinh hoạt, vừa có khả năng khai thác cho thuê hiệu quả. Tại nhiều quốc gia, mô hình này đã hình thành các “vành đai đô thị chuyên gia” – điển hình như HarbourFront (Singapore) hay Marine City (Busan) – nơi cư dân vừa sinh sống, vừa kết nối trực tiếp với hệ thống việc làm và dịch vụ quốc tế.
Maison Grand – điểm nhấn giữa trung tâm cảng biển TP.HCM
Tại Việt Nam, Maison Grand do Tumys Homes phát triển được xem là một trong những dự án tiên phong theo định hướng “homebase chuyên gia”. Dự án tọa lạc tại trung tâm Phú Mỹ – khu vực được ví như “trái tim mới” của đô thị cảng phía Nam, nằm giữa trục giao thương – cảng biển – khu hành chính, đồng thời thừa hưởng hạ tầng kết nối hoàn thiện.
Maison Grand ghi dấu nhờ thiết kế linh hoạt, tối ưu công năng và phù hợp với phong cách sống chuyên nghiệp của nhóm cư dân hiện đại. Các căn hộ được bố trí đa dạng diện tích, ưu tiên không gian mở, ánh sáng tự nhiên và hệ tiện ích tinh gọn, mang lại trải nghiệm sống tiện nghi mà vẫn đảm bảo tính riêng tư. Đáng chú ý, với mức giá chỉ từ 33 triệu đồng/m² – thấp hơn đáng kể so với mặt bằng 50–70 triệu đồng/m² tại TP.HCM – Maison Grand được xem là lựa chọn đáng cân nhắc cho người mua tìm kiếm giá trị thật, cùng tiềm năng sinh lời bền vững.
Với pháp lý minh bạch, quy hoạch đồng bộ và định hướng phát triển dài hạn, Maison Grand không chỉ là dự án nhà ở mà còn đại diện cho xu hướng phát triển mới của đô thị TP.HCM – nơi bất động sản gắn liền với năng động, hội nhập và kết nối toàn cầu."
https://tienphong.vn/lao-cai-chap-thuan-dau-tu-du-an-nha-o-xa-hoi-gan-900-ty-dong-post1791852.tpo,Lào Cai chấp thuận đầu tư dự án nhà ở xã hội gần 900 tỷ đồng,"TPO - Ngày 30/10, UBND tỉnh Lào Cai ban hành Quyết định chấp thuận chủ trương đầu tư và giao Công ty Cổ phần Đầu tư Hacom Lào Cai làm chủ đầu tư Dự án Nhà ở xã hội Yên Ninh (phường Yên Bái, tỉnh Lào Cai).","Tổng diện tích dự án hơn 22.000 m², gồm 8.660 m² đất xây dựng nhà ở xã hội, 9.011 m² đất giao thông - hạ tầng kỹ thuật và 4.417 m² đất cây xanh. Dự kiến quy mô dân số khoảng 2.100 người.
Dự án gồm 5 tòa nhà chung cư, cung cấp khoảng 807 căn hộ với đầy đủ hành lang, thang máy, hệ thống phòng cháy chữa cháy, cấp thoát nước, thu gom rác thải...Hạ tầng kỹ thuậtđược đầu tư đồng bộ, gồm hệ thống giao thông nội bộ, cấp điện - chiếu sáng, thông tin liên lạc, trạm xử lý nước thải, khu tập kết rác, sân vườn, cây xanh và bãi đỗ xe, đảm bảo kết nối với hạ tầng khu vực.
Tổng mức đầu tư hơn 864 tỷ đồng, thời hạn hoạt động dự án 50 năm kể từ ngày được giao đất. Tiến độ thực hiện trong 30 tháng.
Công ty Cổ phần Đầu tư Hacom Lào Cai có trụ sở tại phường Lào Cai, do ông Phạm Ngọc Minh - Chủ tịch Hội đồng quản trị là người đại diện pháp luật."
