url,title,description,content
https://tienphong.vn/masteri-park-place-dau-an-moi-tiep-noi-vi-the-tien-phong-va-nang-luc-quoc-te-cua-masterise-homes-post1792108.tpo,Masteri Park Place: Dấu ấn mới tiếp nối vị thế tiên phong và năng lực quốc tế của Masterise Homes,"Khi nhu cầu sở hữu nhà ở thực và dòng tiền đầu tư dài hạn quay trở lại, thị trường chứng kiến sự lên ngôi của những sản phẩm bất động sản cao cấp, sự xuất hiện của những không gian sống hàng hiệu được quy hoạch chuyên nghiệp và bài bản. Đón đầu xu hướng này, Masterise Homes một lần nữa khẳng định vị thế tiên phong và năng lực dẫn dắt thị trường với việc ra mắt Masteri Park Place, kiến tạo một biểu tượng sống đầy năng lượng giữa lòng khu đô thị phức hợp biểu tượng The Global City.","Vị thế tiên phong trên hành trình kiến tạo chuẩn sống quốc tế
Trên hành trình kiến tạo những công trình biểu tượng, Masterise Homes đã ghi dấu ấn đậm nét là nhà phát triển bất động sản hàng hiệu tiên phong mang những chuẩn mực quốc tế vào thị trường Việt Nam. Định vị này không chỉ được xây dựng từ những tuyên ngôn, mà còn được chứng thực qua hợp tác chiến lược với các đối tác tên tuổi toàn cầu như Foster+Partners - “gã khổng lồ” của ngành kiến trúc, hay Marriott International - tập đoàn quản lý khách sạn hàng đầu thế giới. Sự kết hợp giữa tầm nhìn dài hạn, năng lực triển khai đáp ứng chuẩn mực quốc tế và tư duy kiến tạo phong cách sống khác biệt được xem là những yếu tố then chốt giúp các dự án của Masterise Homes luôn nhận được sự tin tưởng lựa chọn từ nhóm khách hàng cao cấp và thượng lưu.
Kết hợp tinh hoa quốc tế với chiều sâu văn hóa bản địa, vượt lên khỏi giới hạn của không gian sống đơn thuần, các dự án của Masterise Homes truyền cảm hứng cho những kết nối sâu sắc, nuôi dưỡng khát vọng vươn xa, đồng thời gìn giữ và xây dựng di sản bền vững cho thế hệ kế tiếp. Lumière Series và Masteri Collection là những ví dụ tiêu biểu. Đây đều là những dòng sản phẩm cao cấp với chất lượng chuẩn quốc tế, mang đến trải nghiệm sống khác biệt cùng định vị rõ ràng, nhất quán từ thiết kế kiến trúc, vật liệu, tiện ích cho đến tiêu chuẩn dịch vụ và vận hành. Trong đó, Masteri Collection là bộ sưu tập phong cách sống được Masterise Homes kiến tạo nhằm khơi gợi cảm xúc, nuôi dưỡng sự gắn kết của cư dân giữa lòng đô thị hiện đại. Trải nghiệm Masteri Collection là trải nghiệm cuộc sống thành thị giàu cảm xúc với ba giá trị cốt lõi: Sống tinh tế – Sống gắn kết – Sống đẳng cấp.
Với hàng ngàn căn hộ chuẩn quốc tế đã được bàn giao cùng đông đảo cư dân sinh sống tại Masteri Waterfront, Masteri West Heights hay Masteri Centre Point, đồng thời tiếp tục hành trình nâng tầm trải nghiệm với các dự án đang triển khai như Masteri Grand Avenue, Masteri Lakeside, Masteri Trinity Square (Hà Nội), Masteri Rivera Danang (Đà Nẵng) và Masteri Grand View (TP.HCM), Masteri Collection hiện thực hóa cộng đồng cư dân văn minh, nơi nâng tầm phong cách sống khác biệt, củng cố vững chắc vị thế dẫn đầu thị trường của Masterise Homes.
Masteri Park Place - Dấu ấn mới của Masteri Collection tại trungtâm khu đô thị biểu tượng The Global City
Tiếp nối hành trình nâng tầm phong cách sống, Masterise Homes chính thức giới thiệu Masteri Park Place, dự án cao tầng mới nhất, một dấu ấn đầy kiêu hãnh của Masteri Collection. Tọa lạc tại tâm điểm The Global City - khu đô thị phức hợp chuẩn quốc tế tại trung tâm thành phố Hồ Chí Minh, Masteri Park Place mang đến không gian sống thời thượng, nơi chuẩn sống tinh tế hòa nhịp cùng chất sống đô thị sôi động cho cư dân tương lai.
Sức hút của Masteri Park Place được hội tụ và cộng hưởng từ ba trụ cột giá trị vững chắc của Masteri Collection, giá trị độc bản của sản phẩm và giá trị sống xứng tầm tại The Global City.
Sở hữu những lợi thế vượt trội không thể sao chép, Masteri Park Place là phân khu cao tầng đầu tiên tại The Global City có vị trí đắt giá ven sông, với hai mặt giáp nước, mang lại nguồn năng lượng dồi dào, đầy cảm hứng sống. Tại trung tâm khu đô thị, dự án mang đến một tầm nhìn panorama không giới hạn, thu trọn vào tầm mắt vẻ đẹp thơ mộng của dòng sông, kênh đào và là nơi hoàn hảo để đón những tia nắng bình minh tinh khôi, khởi đầu một ngày mới tràn đầy năng lượng.
Hệ tiện ích và trải nghiệm đa tầng được thiết kế và quy hoạch bài bản, từ hệ tiện ích nội khu đặc quyền, công viên bờ sông, khu thể thao, đến không gian giải trí – làm việc – mua sắm của khu đô thị The Global City, tạo nên trải nghiệm sống rực rỡ mỗi ngày cho cộng đồng cư dân tương lai.
Với Masteri Park Place, Masterise Homes không chỉ mang đến một không gian sống, mà còn định hình một phong cách sống đầy năng lượng, tiếp sức cho hành trình chinh phục những đỉnh cao mới của cộng đồng cư dân ưu tú, thành đạt. Cuộc sống tại đây là sự tổng hòa hoàn hảo giữa giá trị sống thành thị giàu cảm xúc, cùng phong cách sống quốc tế mà khu đô thị biểu tượng The Global City đang kiến tạo, nơi chủ nhân tạo ra dấu ấn riêng và kết nối chia sẻ cùng cộng đồng cư dân toàn cầu. Đây chính là tuyên ngôn mạnh mẽ, tiếp tục khẳng định vị thế và năng lực vượt trội của nhà phát triển bất động sản hàng hiệu đẳng cấp quốc tế, luôn mang đến trải nghiệm xứng tầm cho khách hàng.
Tìm hiểu thêm về Masteri Park Place tạihttps://masterisehomes.com/the-global-city/masteri-park-place/"
https://tienphong.vn/bat-dong-san-front-row-tu-gia-tri-khan-hiem-den-bieu-tuong-song-toan-cau-post1792088.tpo,Bất động sản “Front Row”: Từ giá trị khan hiếm đến biểu tượng sống toàn cầu,"Trong lãnh địa bất động sản xa xỉ, những tọa độ “front row” bên bờ biển đang trở thành lựa chọn hàng đầu trong danh mục đầu tư phong cách sống của giới thượng lưu toàn cầu, những người tìm kiếm giá trị bền vững và biểu tượng khẳng định vị thế cá nhân.","Giới thượng lưu toàn cầu và phong cách sống “Front Row”
Tháng 4 vừa qua, thị trường BĐS tại Florida chứng kiến một kỷ lục mới được thiết lập với giá trị giao dịch 225 triệu USD cho một dinh thự ven biển xa hoa sở hữu gần 250 mét đường bờ biển, trở thành thương vụ đắt giá thứ hai trong lịch sử nước Mỹ. Cũng tại bang này, một biệt thự bên bờ biển Palm Beach nổi danh, được niêm yết với giá hơn 85 triệu USD lập tức thu hút sự chú ý của giới sưu tầm.
Theo New York Times, những tỷ phú ở đỉnh kim tự tháp tài sản toàn cầu, như ông trùm quỹ đầu tư Ken Griffin, cựu CEO Microsoft Steve Ballmer đang không ngừng mở rộng danh mục sở hữu bằng những bất động sản ven biển đắt giá, từ Palm Beach đến các vùng duyên hải tuyệt mỹ trên khắp thế giới.
“Không chỉ riêng nước Mỹ, những dải đất ven biển đẳng cấp thế giới là thứ không thể kiến tạo thêm, chỉ có thể nắm giữ. Và chính sự giới hạn ấy khiến chúng trở nên vô giá”, một chuyên gia đến từ hãng đấu giá danh tiếng Sotheby's lý giải.
Nhưng giá trị của BĐS “front row” không chỉ nằm ở con số mà còn là tuyên ngôn của tự do và phong cách sống vượt thời gian. Khi đã chạm đến những chuẩn mực xa xỉ nhất, từ siêu du thuyền, chuyên cơ riêng đến những dinh thự trên tầng không giữa các đô thị toàn cầu, những cá nhân ưu tú vẫn hướng về vị trí “hàng ghế đầu” bởi những giá trị cốt lõi: được sống trong sự tinh tế, riêng tư và kết nối gần nhất với những miền thiên nhiên di sản.
Sức hút từ “hàng ghế đầu” vịnh Hạ Long
Không nằm ngoài xu thế toàn cầu, giới thượng lưu tại Việt Nam cũng cho thấy sự quan tâm đến những không gian sống tọa lạc ở “hàng ghế đầu”, mà vùng đất di sản Hạ Long là một trong những điểm đến hàng đầu.
Kể từ khi được UNESCO công nhận là Di sản thiên nhiên thế giới, Hạ Long đã chứng kiến sự phát triển mạnh mẽ của du lịch và hạ tầng, kéo theo giá trị bất động sản ven vịnh bứt phá qua từng giai đoạn. Tuy nhiên, với địa hình và địa chất đặc thù, số lượng quỹ đất có thể phát triển dọc bờ vịnh khó có thể mở rộng, những vị trí “front row” tại Hạ Long ngày càng khan hiếm và trở thành biểu tượng của giá trị sống và đầu tư.
Soi chiếu vào những dự án đang hiện hữu trên những dải đất cận biển, trực vịnh hiếm hoi ấy, từ BĐS hàng hiệu (branded residences) như InterContinental Residences Halong Bay, hay các khu dinh thự “gated community” cao cấp như Grandbay Halong Villas, Lagoon Residences... Dù ở phương diện giá trị tài sản, vẻ đẹp kiến trúc, tiêu chuẩn dịch vụ hay phong cách sống, những mảnh ghép này đều nổi bật, khẳng định vị thế riêng trong danh mục sở hữu của cộng đồng ưu tú.
Giai đoạn 2021 - 2024, mặc dù thị trường BĐS chứng kiến nhiều tác động từ đại dịch Covid-10, những bộ sưu tập giới hạn này vẫn ghi nhận mức thanh khoản ấn tượng với giá trị giao dịch mỗi biệt thự tiệm cận, thậm chí vượt mức 100 tỷ đồng, và đến nay gần như toàn bộ đều đã tìm thấy chủ sở hữu.
Aria Bay – Biểu tượng mới tại “hàng ghế đầu” vịnh Hạ Long
Tại Hạ Long, BIM Land là một trong những chủ đầu tư tiên phong, đáp ứng những quy chuẩn nghiêm ngặt cả về tiêu chí quy hoạch, mật độ xây dựng và tối quan trọng là tôn vinh giá trị cảnh quan tự nhiên để từng bước phát triển quỹ đất trực vịnh có quy mô 248 ha, hình thành nên Khu đô thị vịnh biển Halong Marina.
Trong tầm nhìn phát triển của BIM Land, những vị trí đẹp nhất tại Halong Marina, nơi bãi biển ngay trước hiên nhà, tầm nhìn không chịu sự che chắn với những trải nghiệm tinh tế được tuyển chọn, sẽ được dành cho những biểu tượng sống “hàng ghế đầu” bên vịnh di sản, tạo nên những bộ sưu tập BĐS độc bản được định danh “Front Row Collection”.
Khởi đầu cho hành trình ấy là sự xuất hiện của Aria Bay, một trong số ít tòa tháp đôi tại Hạ Long sở hữu tầm nhìn panorama không giới hạn, ôm trọn vịnh - hồ - phố.
Đội ngũ kiến trúc sư hàng đầu thế giới như AEDAS (Anh), HBA (Mỹ), KUME (Nhật Bản) và Coopers Hill (Anh)... cùng bắt tay kiến tạo nên một kiến trúc biểu tượng, với những đường nét giật cấp độc đáo như những phím đàn Piano vươn cao trước biển.
Bề mặt ngoài Aria Bay được bao phủ bởi hệ kính hộp Low-E, vật liệu cao cấp được biết đến với khả năng chống chịu mạnh mẽ trước những tác động từ tự nhiên, đồng thời tạo nên những hiệu ứng thị giác ấn tượng từ mọi góc nhìn.
Từ những khách sạn và CLB giải ven biển thương hiệu quốc tế, các nhà hàng và quán bar signature, tổ hợp thương mại – dịch vụ cao cấp, phố đi bộ, cầu cảnh quan trình diễn ánh sáng – nghệ thuật... tất cả đều hiện diện xung quanh tòa tháp Aria Bay, trở thành nền tảng kiến tạo nên phong cách sống phóng khoáng và giàu cảm hứng của cộng đồng thời thượng.
Trong bối cảnh toàn cầu, khi giới thượng lưu không ngừng săn tìm những không gian sống độc bản tại các miền biển mang giá trị di sản, Aria Bay mở ra cơ hội hiếm có để không chỉ sở hữu BĐS vị trí “front row”, mà còn bước vào một chuẩn sống mới, tôn vinh cảm hứng sống giao hòa cùng thiên nhiên kỳ quan và niềm kiêu hãnh mang đậm dấu ấn cá nhân."
https://tienphong.vn/vina-land-mien-nam-tro-thanh-doi-tac-phan-phoi-chien-luoc-do-thi-so-picity-post1792092.tpo,Vina Land Miền Nam trở thành đối tác phân phối chiến lược Đô thị số Picity,"Tại Lễ Ký kết Hợp tác Chiến lược – Kiến tạo Đô thị số Picity do Pi Group tổ chức tại khách sạn Hilton Saigon (TP.HCM), Vina Land Miền Nam chính thức được vinh danh là Đối tác phân phối chiến lược. Sự kiện này đánh dấu mối quan hệ hợp tác mạnh mẽ giữa hai đơn vị uy tín, nhằm cùng kiến tạo chuẩn sống đô thị số tiện ích 5 sao chuẩn quốc tế tại Việt Nam.","Vina Land Miền Nam nổi bật với triết lý “Kiến tạo cộng đồng hưng vượng – sản phẩm cao cấp đáng sống và đầu tư”. Doanh nghiệp sở hữu đội ngũ nhân sự trẻ, chuyên môn cao, bên cạnh quản trị phân phối và tiếp thị hiện đại – góp phần xây dựng mạng lưới phân phối đồng bộ và hiệu quả. Với thế mạnh tiếp thị và phân phối dự án bất động sản cao cấp, Vina Land Miền Nam là lựa chọn chiến lược của Pi Group để tiếp cận và lan tỏa chuẩn sống Picity tới khách hàng.
Pi Group kiến tạo Picity với triết lý phát triển “Lấy cư dân làm trung tâm – Lấy chất lượng làm nền tảng – Lấy công nghệ làm động lực phát triển” – một tầm nhìn đưa công nghệ vào lõi đô thị, chuyển đổi không chỉ “nơi để ở” mà thành “trải nghiệm để sống”.
Picity vận hành dựa trên ba trụ cột chiến lược: Công nghệ vận hành toàn diện (AI – IoT – Blockchain): hệ thống Smart Parking, Smart Elevator, Smart Locker, cảm biến môi trường, smarthome, camera AI & Face ID, robot giao hàng, nền tảng Pi Care – tất cả xây dựng thành một mạng lưới vận hành thông minh, cá nhân hóa, minh bạch và an toàn.
Tiện ích 5 sao chuẩn quốc tế: Quy hoạch như resort 5 sao trong lòng đô thị – hồ bơi vô cực muối khoáng, phòng gym thương hiệu quốc tế Technogym, sky lounge, khu vui chơi công nghệ cho trẻ em, phim ngoài trời, golf 3D… mang đến trải nghiệm sống vượt kỳ vọng.
Thiết bị đồng bộ từ thương hiệu toàn cầu: Pi Group hợp tác chiến lược với các đối tác như Otis (Mỹ), ABB (Thụy Sĩ), Osram (Đức), Imudex (Đức), Grohe (Đức), Adel (Mỹ) và Keenon Robotics (Trung Quốc) để đảm bảo chất lượng, độ bền và đẳng cấp quốc tế cho toàn bộ hệ thống bàn giao.
Vina Land Miền Nam nằm trong hệ thống hơn 40 đại lý phân phối chiến lược được Pi Group trao chứng nhận. Năng lực triển khai thị trường và mạng lưới phân phối chuyên nghiệp của Vina Land Miền Nam là yếu tố then chốt kết nối giữa tầm nhìn của chủ đầu tư và nhu cầu khách hàng. Với vai trò này, Vina Land Miền Nam không chỉ bán sản phẩm mà truyền tải giá trị thương hiệu Picity – từ định vị quốc tế đến trải nghiệm sống thông minh.
Sự hợp tác giữa Pi Group và Vina Land Miền Nam kết nối hai yếu tố then chốt: tầm nhìn định hình đô thị số tương lai và năng lực phân phối chiến lược mạnh mẽ. Nhờ đó, khả năng tiếp cận khách hàng mục tiêu được mở rộng, hiệu quả kinh doanh được nâng cao và hình ảnh thương hiệu Picity được củng cố.
Trong giai đoạn hợp tác, Pi Group và Vina Land sẽ đồng hành triển khai các dự án nổi bật trong hệ sinh thái Picity: bao gồm Picity Sky Park với phân khu cao cấp SkyZen trên trục Phạm Văn Đồng – biểu tượng phong cách sống công nghệ và nghỉ dưỡng; và Picity Central Park, dự kiến ra mắt Quý I/2026, đặt mục tiêu trở thành điểm sáng mới của đô thị số tại TP.HCM.
Thông qua mạng lưới phân phối chiến lược như Vina Land và các thương hiệu công nghệ toàn cầu, Pi Group khẳng định tầm nhìn trở thành nhà phát triển đô thị số hàng đầu Việt Nam, mang đến những sản phẩm bất động sản khác biệt, bền vững và đạt chuẩn quốc tế.
Sự hợp tác giữa Pi Group và Vina Land không chỉ ghi dấu trong một sự kiện, mà là khởi đầu cho kỷ nguyên đô thị số tại Việt Nam. Mỗi sản phẩm Picity được phân phối đều là minh chứng cho cam kết về chất lượng, công nghệ và trải nghiệm sống hiện đại. Hai doanh nghiệp cùng hướng tới mục tiêu kiến tạo cộng đồng cư dân thông minh, an toàn và thịnh vượng – nơi mỗi khoảnh khắc sống đều là giá trị."
https://tienphong.vn/biet-thu-117m2-thiet-ke-thong-minh-uu-tien-khong-gian-cho-tre-nho-post1790256.tpo,Biệt thự 117m2 thiết kế thông minh ưu tiên không gian cho trẻ nhỏ,"TPO - Công trình giữa đô thị nổi bật như một ốc đảo xanh mát, nơi gia đình trẻ tìm về sau những giờ làm việc căng thẳng.","Với diện tích 117m² và kinh phí hạn chế, ngôi nhà được thiết kế thông minh, ưu tiên không gian cho trẻ nhỏ và các khu vực thư giãn.
Mặt tiền được thiết kế khá ấn tượng với màu trắng và đan xen các khu vực cây xanh.
Bên trong ấn tượng với khoảng sân trong dạng xẻ khe là nơi trồng cây xanh, uống trà thư giãn và sân chơi ngoài trời của trẻ em.
Phòng khách được thu hẹp, một số phòng ngủ được giảm bớt, và giường tầng được thiết kế cho hai bé, tạo ra không gian dư thừa để trồng cây xanh, xây hồ bơi và nhà trên cây cho các em vui chơi.
Nhờ vậy, công trình không chỉ là nơi ở, mà còn là không gian sống lý tưởng, hòa quyện giữa thiên nhiên và cuộc sống hiện đại."
