url,title,description,content
https://tienphong.vn/hanh-trinh-fpt-ket-noi-tri-thuc-so-den-lop-hoc-vung-xa-post1793271.tpo,Hành trình FPT kết nối tri thức số đến lớp học vùng xa,"Giữa nhịp sống hiện đại, khi công nghệ đã trở thành một phần quen thuộc trong từng tiết học ở thành phố, vẫn còn những đứa trẻ vùng xa ngày ngày đến lớp với ước mơ giản dị được nhìn thấy thế giới qua màn hình, được học bằng hình ảnh và được chạm tay vào công nghệ như bao bạn bè cùng trang lứa.","Khi công nghệ mở ra cánh cửa tri thức cho học sinh vùng khó
Sáng sớm ở điểm trường Đinh Trang Hòa II (tỉnh Lâm Đồng), khi sương còn giăng kín sân, lớp học nhỏ bỗng rộn ràng tiếng cười. Chiếc tivi mới bật sáng, mở ra bài giảng trực quan đầu tiên được truyền qua Internet tốc độ cao. Những ánh mắt trẻ thơ chăm chú dõi theo từng hình ảnh, nụ cười rạng rỡ xen lẫn thích thú là dấu hiệu của một hành trình mới, khi công nghệ thực sự bước vào lớp học vùng xa, mang đến cho các em cơ hội học tập bình đẳng hơn.
Ở những vùng núi xa xôi như Lâm Đồng, Sơn La, Điện Biên… hành trình đến trường của thầy trò vẫn còn nhiều trở ngại. Lớp học chật hẹp, thiết bị cũ kỹ, đường truyền Internet chập chờn khiến các tiết học Tin học hay tiếng Anh thường xuyên bị gián đoạn. Không ít em học sinh chưa từng chạm tay vào máy tính hay nhìn thấy bài giảng trình chiếu, điều vốn rất quen thuộc với bạn bè cùng trang lứa ở đô thị.
Từ những khoảng cách đó, FPT cùng LG đã khởi động hành trình “Nối tri thức – Vững tương lai”, mang Internet tốc độ cao và TV thông minh và thiết bị học tập đến 80 điểm trường vùng khó, gần 20.000 học sinh từ miền núi phía Bắc đến tận đồng bằng sông Cửu Long từ nay đã có thêm cơ hội tiếp cận công nghệ và tri thức số.
Thầy Lê Mạnh Thường, Hiệu trưởng Trường TH – THCS Đinh Trang Hòa II chia sẻ: “Thiết bị công nghệ thông tin của trường còn hạn chế, chưa đáp ứng được yêu cầu giảng dạy theo chương trình mới. Nhờ sự hỗ trợ của Tập đoàn FPT, thầy trò có thêm điều kiện đổi mới phương pháp dạy học. Các tiết học giờ trực quan, sinh động hơn, học sinh chủ động khám phá và đặt câu hỏi nhiều hơn trước”.
Để những buổi học của thầy trò và các em được tiếp cận với công nghệ và internet, đội ngũ kỹ thuật FPT đã vượt hàng nghìn cây số, băng qua đèo dốc kéo cáp kết nối tới từng điểm trường vùng khó. Trên những gương mặt rạng rỡ của thầy cô, học trò thấy rõ niềm vui khi từ nay công nghệ, một thứ tưởng chừng xa vời đang hiện diện ngay trong ngôi trường của mình.
Kiến tạo cơ hội học tập bình đẳng bằng hạ tầng số
FPT không chỉ mang thiết bị đến lớp học, mà còn đầu tư hạ tầng kết nối dài hạn cho các điểm trường. Với đường truyền Internet FPT tốc độ cao Wi-Fi7 trên nền tảng công nghệ XGS-PON, giúp đảm bảo chất lượng truy cập ổn định cho hoạt động dạy và học tại các điểm trường. Ngoài ra, thông qua kho phim ảnh và các chương trình học online trên FPT Play sẽ giúp các em học sinh vừa học vừa chơi, làm phong phú thêm tâm hồn trẻ thơ.
Nhờ đó, việc giảng dạy bằng video, hình ảnh hay các ứng dụng học tập trực tuyến trở nên thuận lợi hơn bao giờ hết. Ở nhiều điểm trường vùng xa, những tiết học trực tuyến đầu tiên được tổ chức trọn vẹn, thầy cô dễ dàng truy cập kho học liệu mở, còn học sinh được khám phá thế giới số ngay trong lớp học của mình.
Tại Trường Tiểu học Lý Nhơn (xã An Thới Đông, TP.HCM), nơi điều kiện cơ sở vật chất còn hạn chế, thầy Phan Xuân Đông, Giáo viên Tổng phụ trách Đội chia sẻ rằng việc dạy Tin học trước đây luôn là thử thách lớn: “Đường truyền không ổn định, thiết bị thì cũ, một mô-đun phải dùng cho nhiều lớp. Có những hôm lớp học đang thao tác thì màn hình tắt ngang, các em buồn lắm. Giờ có đường truyền và thiết bị mới, bài giảng trực quan và sinh động hơn hẳn, học sinh hứng thú hơn với từng tiết học”.
Gần ba thập kỷ qua, FPT không chỉ tạo dấu ấn bằng những thành tựu công nghệ, mà còn bền bỉ viết tiếp hành trình phụng sự cộng đồng. Từ “FoxSteps – Hành trình triệu bước chân vì cộng đồng” gây quỹ xây dựng 63 sân chơi miễn phí cho trẻ em, đến “Rạp phim trường em” đưa tri thức và niềm vui học tập đến học sinh vùng sâu, vùng xa… mỗi chương trình là một bước đi nhỏ nhưng mang ý nghĩa lớn, thể hiện khát vọng lan tỏa tri thức và nuôi dưỡng tương lai bằng công nghệ.
Không dừng lại ở những dự án sẻ chia, FPT hướng tới mục tiêu dài hạn là đồng hành cùng giáo dục Việt Nam trong kỷ nguyên số, nơi công nghệ trở thành cầu nối giúp thế hệ trẻ học tập, sáng tạo và phát triển toàn diện. Đó là cách FPT hiện thực hóa sứ mệnh “Công nghệ vì con người”, kiến tạo giá trị bền vững và góp phần xây dựng một tương lai tri thức cho đất nước.
Chi tiết liên hệ số hotline 1900 6600 hoặc truy cập vào website http://fpt.vn."
https://tienphong.vn/54-giao-vien-viet-nam-chiu-ap-luc-ve-thanh-tich-hoc-sinh-va-thay-doi-chuong-trinh-post1794017.tpo,54% giáo viên Việt Nam chịu áp lực về thành tích học sinh và thay đổi chương trình,"TPO - Theo thông tin từ Tổ chức Hợp tác và Phát triển Kinh tế (OECD), kết quả Khảo sát quốc tế về Dạy và Học (TALIS) chu kì 2024 cho thấy, mức độ căng thẳng nghề nghiệp của giáo viên Việt Nam ở mức thấp: chỉ 4% giá viên Việt Nam cho biết “rất căng thẳng” trong công việc, dù 54% thừa nhận chịu áp lực về thành tích học sinh.","Khảo sát TALIS 2024 với sự tham gia của 55 quốc gia và vùng lãnh thổ được OECD triển khai nhằm cung cấp bằng chứng so sánh quốc tế vềđội ngũ giáo viênvà hiệu trưởng THCS, qua đó phản ánh đặc điểm, quan điểm và kinh nghiệm nghề nghiệp của đội ngũ nhà giáo trong bối cảnh đổi mới giáo dục phổ thông và chuyển đổi số.
Tiếp nối chu kì 2018, Việt Nam tiếp tục tham gia với mẫu đại diện toàn quốc gồm 202 cơ sở giáo dục thuộc 58 tỉnh, thành phố, 202 hiệu trưởng và 4.410 giáo viên.
Toàn bộ quy trình được thực hiện trên máy tính theo tiêu chuẩn kĩ thuật và bảo mật nghiêm ngặt của OECD, đảm bảo kết quả khách quan và đáng tin cậy.
Kết quả TALIS 2024 cho thấy, đội ngũ nhà giáo Việt Nam được đánh giá là trẻ, nhiệt huyết, có năng lực công nghệ ngày càng tốt và mức độ hài lòng nghề nghiệp cao.
92% giáo viên Việt Nam cho rằng nghề giáo được xã hội coi trọng, tỉ lệ cao nhất trong toàn bộ các quốc gia tham gia khảo sát (trong khi mức trung bình của OECD chỉ là 22%).
87% giáo viên tin rằng ý kiến của họ được các nhà hoạch định chính sách lắng nghe và coi trọng, tăng 8% so với chu kì 2018; 97% giáo viên hài lòng với công việc của mình và chỉ 3% giáo viên dưới 30 tuổi có ý định nghỉ việc trong 5 năm tới; 58% giáo viên hài lòng với mức lương hiện tại, tăng 6% so với năm 2018.
Cũng theo kết quả khảo sát, mức độ căng thẳng nghề nghiệp của giáo viên Việt Nam khá thấp. Chỉ có 4%giáo viêncho biết “rất căng thẳng” trong công việc, dù 54% thừa nhận chịu áp lực về thành tích học sinh và thay đổi chương trình.
Theo Bộ GD&ĐT, kết quả TALIS 2024 khẳng định vị thế tích cực của đội ngũ giáo viên Việt Nam trong khu vực, nhất quán với thành tích của học sinh Việt Nam qua các chương trình PISA 2022 và SEA-PLM 2024. Tuy nhiên, báo cáo cũng nhấn mạnh yêu cầu cấp thiết phải đầu tư trọng tâm cho năng lực số, phát triển nghề nghiệp và quản trị thay đổi trong nhà trường.
Trong thời gian tới, Bộ GD&ĐT sẽ chỉ đạo phân tích sâu các báo cáo TALIS 2024 để xây dựng và điều chỉnh chính sách, tổ chức thực hiện đồng bộ ở T.Ư và địa phương, hướng tới mục tiêu phát triển bền vững hệ thống giáo dục Việt Nam giai đoạn 2025–2035."
https://tienphong.vn/tao-moi-truong-de-hoc-sinh-co-the-giao-tiep-su-dung-tieng-anh-post1794099.tpo,"Tạo môi trường để học sinh có thể giao tiếp, sử dụng tiếng Anh","TPO - Đưa tiếng Anh trở thành ngôn ngữ thứ hai trong trường học, cần phải tạo môi trường để học sinh có thể giao tiếp, sử dụng tiếng Anh hằng ngày là thông tin được các chuyên gia chia sẻ tại tọa đàm “Vai trò của tiếng Anh trong kỷ nguyên vươn mình” chiều 6/11.","Chương trình do SunUni Academy phối hợp cùng Báo Thanh Niên tổ chức nhằm công bố chương trình học bổng S80 (S80 International Education Scholarship) năm 2025 với chủ đề “Thế hệ S80, vươn mình cùng tri thức Việt”.
Tại tọa đàm, PGS.TS Nguyễn Thuý Hồng, nguyên Phó Cục trưởng Cục Nhà giáo, Bộ GD&ĐT cho biết, Nghị quyết 71 về phát triểnđột phá giáo dụcvà đào tạo đặt mục tiêu đưa Tiếng Anh thành ngôn ngữ thứ hai trong trường học. Chính phủ cũng đã phê duyệt Đề án “Đưa Tiếng Anh thành ngôn ngữ thứ hai trong trường học giai đoạn 2025-2035, tầm nhìn đến năm 2045”.
Đây là chủ trương đúng đắn, phù hợp với bối cảnh toàn cầu hoá và sẽ là cơ hội cho tất cả học sinhhọc tiếng Anh, làm thay đổi quan điểm giảng dạy bộ môn trong trường học.
Trước đây, tiếng Anh được dạy như ngoại ngữ và tới đây sẽ được sử dụng trong môi trường giao tiếp rộng rãi hơn, phổ biển hơn và từng bước tiến tới dạy các môn học bằng Tiếng Anh ở các nơi có đủ điều kiện. Tiếng Anh sẽ giúp dân tộc vươn ra toàn cầu.
Tuy nhiên, TS Nguyễn Thuý Hồng cũng cho rằng, để đạt được những mục tiêu như kỳ vọng, chúng ta đối mặt với nhiều thách thức về làm mới chương trình dạy học, chuẩn bị đội ngũ, cơ sở vật chất, điều kiện công nghệ để dạy tiếng Anh phổ biến tới học sinh, sinh viên, người đi làm.
""Tiếng Anh là một trong những môn học ứng dụng công nghệ thông tin rất tốt, đặc biệt trong kiểm tra, đánh giá với sự hỗ trợ của AI. Điều này đã làm thay đổi rõ rệt quá trình dạy học, từ khâu soạn đề, thiết kế nội dung đến cách thức đánh giá"", bà Hồng nói.
Bà Natalia Sasha Goodwin, Giám đốc Trung tâm phát triển học thuật, Đại học Anh Quốc Việt Nam nhấn mạnh những thách thức mà sinh viên Việt Nam phải đối mặt từ sự chuyển mình mạnh mẽ của tri thức, sự xuất hiện của AI. Thế hệ trẻ Việt Nam chủ động hơn, cởi mở hơn, sẵn sàng học hỏi hơn bao giờ hết tuy nhiên, năng lực quan trọng nhất để vượt qua sự thay đổi ấy chính là tính bền bỉ, sự kiên trì theo đuổi mục tiêu, kể cả khi phương pháp học, công cụ học hay môi trường học liên tục thay đổi.
Tham gia toạ đàm, nhạc sỹ Nguyễn Văn Chung kể câu chuyện, khi còn học sinh ở trường phổ thông, anh cũng gặp khó khăn về phát âm, sai ngữ pháp. Ngồi trong lớp học, thầy cô giảng nhưng anh không thể hiểu bài.
Sau đó, với sự kiên trì, nỗ lực bền bỉ, anh đã học tốt ngoại ngữ và thi đỗ ngôi trường mình mong muốn. Và kể cả khi trở thành nhạc sĩ, không có nhiều cơ hội làm việc trong môi trường giao tiếp bằng ngoại ngữ nhưng cũng từng có dịp trao đổi, hợp tác để đưa tác phẩm của mình được dịch sang tiếng Anh.
“Tôi cũng khuyến khích các con phải học tốt tiếng Anh, biết 2-3 ngoại ngữ càng tốt. Tôi nói, các con có thể thoải mái lựa chọn ngành nghề nhưng khi có ngoại ngữ, cơ hội việc làm, mức thu nhập cũng sẽ tương xứng”, nhạc sỹ Nguyễn Văn Chung chia sẻ.
Chương trình S80 International Education Scholarship tìm kiếm thí sinh có năng lực học thuật, tinh thần học hỏi, kỷ luật - bền bỉ, khả năng đóng góp cộng đồng và tiềm năng lãnh đạo; ưu tiên thí sinh có hoàn cảnh khó khăn nhưng biết vươn lên.
Dự kiến, Ban tổ chức sẽ trao 8.000 suất học bổng (toàn phần và bán phần, trong đó có học bổng bán phần lên tới 70%), áp dụng cho các chương trình từ nền tảng đến mục tiêu IELTS 7.5, phù hợp nhiều mức năng lực khác nhau của học sinh, sinh viên."
https://tienphong.vn/de-xuat-giao-cac-truong-dai-hoc-xet-cong-nhan-gspgs-post1794062.tpo,"Đề xuất giao các trường đại học xét công nhận GS,PGS","TP - Quy trình xét công nhận chức danh giáo sư, phó giáo sư (GS, PGS) hiện nay khá rườm rà. Trường đại học (ĐH) đề xuất nên thí điểm giao một số trường ĐH đủ năng lực có thể xét công nhận, bổ nhiệm các chức danh này.","Nên thí điểmở một số trường
Tại hội thảo khoa học quốc gia “Hiện đại hóa, nâng tầm giáo dục đại học Việt Nam, tạo đột phá phát triển nhân lực trình độ cao và nhân tài, dẫn dắt nghiên cứu, đổi mới sáng tạo”, do Ban Tuyên giáo và Dân vận T.Ư, Bộ GD&ĐT, ĐH Quốc gia TPHCM phối hợp tổ chức, vấn đề giao trường ĐH xét công nhận bổ nhiệm GS, PGS một lần nữa được đề cập.
PGS. TS Đỗ Phú Trần Tình, Viện trưởng Viện Phát triển chính sách ĐH Quốc gia TPHCM đề xuất cho phép thí điểm trong việc xét và công nhận chức danh GS, PGS tại một số trường ĐH trọng điểm, đa ngành, có uy tín và tiềm lực khoa học mạnh, hội tụ một số lượng lớn các nhà khoa học đầu ngành. Các cơ sở được tự xét công nhận đạt tiêu chuẩn và bổ nhiệm chức danh GS, PGS phải tuân thủ các tiêu chuẩn chung do Thủ tướng Chính phủ ban hành. Ông Tình cho rằng, kết quả công nhận tại các cơ sở này có giá trị pháp lí trên phạm vi toàn quốc. Cần linh hoạt hơn với các nhà khoa học có tài năng đặc biệt, thí điểm trong 3 năm.
Đây không phải lần đầu tiên ĐH Quốc gia TPHCM đề xuất giao các trường ĐH xét, công nhận, bổ nhiệm GS, PGS. Năm 2024, tại tọa đàm “Pháp luật về xét công nhận đạt tiêu chuẩn chức danh GS, PGS và đề xuất cơ chế thí điểm cho ĐH Quốc gia TPHCM”, PGS.TS Vũ Hải Quân (khi đó là Giám đốc ĐH Quốc gia TPHCM) cho biết, đơn vị có văn bản kiến nghị Thủ tướng một số chính sách vượt trội để đạt được mục tiêu trở thành ĐH trong nhóm hàng đầu châu Á, trong đó có đề xuất cho phép ĐH Quốc gia TPHCM thí điểm bổ nhiệm các chức danh GS, PGS và trợ lí GS.
Cách làm như hiện nay khiến các cơ sở giáo dục bị động trong chiến lược phát triển chương trình đào tạo và nghiên cứu mới. Một số ngành truyền thống có nguy cơ không còn GS đầu ngành. Việc phụ thuộc vào số lượng công bố trên các tạp chí khoa học quốc tế trong xét tiêu chuẩn chức danh GS, PGS như trong quy định hiện nay dẫn đến xu hướng thương mại hóa công tác xuất bản. Các tạp chí “săn mồi” (tạp chí rởm, muốn xuất bản bài báo phải trả tiền) xuất hiện, làm méo mó và giảm sút niềm tin của xã hội đối với giáo dục.
Cách đây 10 năm, Trường ĐH Tôn Đức Thắng (TPHCM) đã có chủ trương tự bổ nhiệm GS, PGS. Khi đó, nhà trường vấp phải sự phản đối dữ dội từ dư luận. Nhưng đến nay, đề xuất trường ĐH được xét, công nhận, bổ nhiệm GS, PGS đã nhận được sự đồng thuận của phần lớn giới học thuật.
Nhiều mâu thuẫncần giải quyết
Vừa qua, Hội đồng GS Nhà nước đã bỏ phiếu thông qua danh sách 900 ứng viên GS, PGS năm 2025. Sau 15 ngày, nếu không có đơn khiếu nại, những ứng viên này sẽ được Chủ tịch Hội đồng GS Nhà nước kí quyết định công nhận đạt tiêu chuẩn chức danh GS, PGS.
Trong số 900 ứng viên được thông qua, không ít người đang làm cán bộ quản lí tại các bệnh viện hoặc đang quản lí một tập đoàn lớn. Dư luận băn khoăn, với những người làm quản lí những tập đoàn như vậy, thời gian giảng dạy, thời gian nghiên cứu thực sự được triển khai như thế nào? Những trường hợp này, trường ĐH có thể tự xét, công nhận, bổ nhiệm. Đây là GS, hay PGS của trường, nhưng hiện nay là Nhà nước công nhận (dưới danh nghĩa là Hội đồng GS Nhà nước) nên không thực sự thuyết phục.
Chủ tịch một Hội đồng GS ngành khẳng định, việc các trường ĐH xét, công nhận, bổ nhiệm GS, PGS là xu thế chung của thế giới. Tuy nhiên ông lưu ý vai trò của cơ quan quản lí nhà nước về xây dựng tiêu chuẩn quy trình giám sát thực hiện, cần làm chặt chẽ, khoa học và có sự chuẩn bị.
Với thực tế Việt Nam đang thiếu đội ngũ GS, PGS, nếu không kiểm soát tốt chất lượng, khả năng cao xảy ra tình huống một số cơ sở xét, công nhận, bổ nhiệm cho đủ nhu cầu nội tại. “Tôi nhấn mạnh đến việc làm thế nào để đội ngũ nhà khoa học do các trường ĐH xét, công nhận là những người thực sự xứng đáng. Người được công nhận phải đảm bảo điều kiện đạo đức, tiêu chuẩn chuyên môn, tiêu chuẩn nghiên cứu khoa học”, vị chủ tịch Hội đồng GS ngành nói. Ông cho rằng, khi để các trường xét, công nhận, họ hiểu rất rõ ứng viên. Nhưng trở ngại lớn là xét “trong nhà”, có thể dễ dàng nới lỏng quy định.
Ở giai đoạn đầu thực hiện, vị giáo sư đầu ngành cho rằng, nên giao cho các trường ĐH thực sự uy tín thí điểm, sau đó mở rộng ra trường khác. Vị này cho biết, qua quá trình xét duyệt hồ sơ của các ứng viên thời gian qua, có những trường ĐH mang danh trọng điểm, trường lớn nhưng chất lượng ứng viên yếu hoặc ít ứng viên đủ tiêu chuẩn. Nên nếu giao thí điểm mà không có sự lựa chọn kĩ lưỡng, dễ dẫn đến tình trạng cơ sở đào tạo “chế biến” tiêu chuẩn phù hợp với năng lực đội ngũ và yêu cầu của trường.
Năm nay, có 900 ứng viên được Hội đồng GS Nhà nước bỏ phiếu thông qua chức danh GS, PGS; trong đó có 71 ứng viên GS và 829 ứng viên PGS.
Hội đồng GS Nhà nước cần lường trước được các vấn đề phát sinh khi sự công nhận giữa các trường, hoặc khi GS, PGS chuyển công tác sang trường khác. Một vấn đề băn khoăn khác của vị giáo sư đầu ngành này là trong số các ứng viên xét công nhận chức danh GS, PGS thời gian qua, không ít người có nhiều bài báo công bố quốc tế nhưng không phục vụ trực tiếp nhu cầu thực tế tại Việt Nam. Khoảng cách giữa thực tế và vấn đề nghiên cứu trong bài báo quốc tế của ứng viên khá xa. Ông mong các trường ĐH nhìn nhận được vấn đề để yêu cầu giảng viên vừa thực hiện nghiên cứu vấn đề thực tế, giải quyết bài toán cuộc sống đặt ra vừa chú trọng viết bài báo quốc tế."
https://tienphong.vn/nu-sinh-o-tphcm-lai-danh-nhau-tui-bui-trong-nha-ve-sinh-cua-truong-post1794102.tpo,Nữ sinh ở TPHCM lại đánh nhau túi bụi trong nhà vệ sinh của trường,"TPO - Sau vụ một nữ sinh bị cả nhóm hơn 10 nữ sinh cùng trường xúm vào đánh ""hội đồng"", mạng xã hội tiếp tục xôn xao với đoạn video ghi lại cảnh 2 nữ sinh đánh nhau túi bụi. Cả hai vụ việc đều diễn ra trong nhà vệ sinh của trường và những nữ sinh liên quan đều là học sinh trung học cơ sở (THCS) tại TPHCM.","Tối 6/11, mạng xã hội chia sẻ clip ghi lại cảnh hai nữ sinh đánh nhau trong khu vực nhà vệ sinh trường học, gây xôn xao dư luận.
Hình ảnh trong đoạn video cho thấy, hai nữ sinh túm tóc, vật nhau xuống sànnhà vệ sinh. Cả hai đấm liên tiếp vào người đối phương. Vụ đánh nhau kéo dài khoảng 3 phút trước sự chứng kiến của nhiều học sinh khác song không có em nào can ngăn.
Theo tìm hiểu của phóng viên, vụ việc xảy ra tại Trường THCS Phú An (phường Phú An, TPHCM).
Lãnh đạo UBNDphường Phú Anvà Hiệu trưởng Trường THCS Phú An xác nhận đã nắm thông tin về clip hai nữ sinh của trường đánh nhau. Hiện cơ quan chức năng địa phương đang vào cuộc xác minh vụ việc.
Trước đó,báo Tiền Phongđã đưa tin về việc mộtnữ sinh lớp 8, Trường THCS An Điền (phường Long Nguyên, TPHCM) bị nhóm gần 10 nữ sinh cùng trường lôi vào nhà vệ sinh của trường đánh đập. Nạn nhân bị đánh phải nhập viện trong tình trạng đa chấn thương, rạn nứt 3 xương sườn.
Ngày 6/11, Ban Giám hiệu Trường THCS An Điền đã làm việc với các học sinh liên quan và phụ huynh. Hiệu trưởng trường này nhận trách nhiệm vì để xảy ra vụ việc học sinh đánh nhau. Nhà trường cho biết, theo quy định, hiện nay không còn áp dụng hình thức kỷ luật đuổi học. Do đó, nhà trường sẽ xử lý hình thức phù hợp trong phạm vi cho phép. Đồng thời, nhà trường có biện pháp chấn chỉnh, tránh tái diễn vụ việc tương tự."
