url,title,description,content
https://tienphong.vn/tinh-trang-suc-khoe-nsnd-thanh-tuan-post1794727.tpo,Tình trạng sức khỏe NSND Thanh Tuấn,"TPO - Tối 8/11, NSND Thanh Tuấn được người nhà đưa nhập viện do xuất huyết bao tử. Sau khi được thăm khám và điều trị, sức khỏe nam nghệ sĩ hiện đã ổn định, tiếp tục được theo dõi tại bệnh viện.","Ngày 9/11, quản lý của NSND Thanh Tuấn cho biết nam nghệ sĩ dần bình phục sức khỏe sau một ngày nhập viện điều trị xuất huyết bao tử.
Ông được đưa vào bệnh viện tối 8/11 để kiểm tra do có dấu hiệu không ổn. Sau khi thăm khám, bác sĩ chẩn đoán không có vấn đề nghiêm trọng. Ông tiếp tục điều trị đến khi tình hình dạ dày ổn định.
Theo người quản lý, NSND Thanh Tuấn có một số bệnh nền, sức khỏe không ổn định nên phải thường xuyên vào viện kiểm tra.
Hiện, NSND Thanh Tuấn đứng lớp ở Trung tâm dạy nghệ thuật ca vọng cổ do ông sáng lập. Học trò ở trung tâm gửi nhiều lời hỏi thăm, mong ông sớm bình phục, trở lại công việc đào tạo thế hệ trẻ.
Năm qua là giai đoạn nhiều biến cố với giọng ca gạo cội, khi ông liên tiếp nhập viện vì bệnh tim và các biến chứng liên quan.
Cuối tháng 3, NSND Thanh Tuấn nhập viện cấp cứu và điều trị bằng phương pháp ECMO (tim phổi nhân tạo) tại Bệnh viện Chợ Rẫy. Sau ca phẫu thuật tim ngày 26/3, ông được các bác sĩ tận tình cứu chữa và qua cơn nguy kịch.
Sau một tuần nhập viện, tình trạng sức khỏe nam nghệ sĩ ổn định, có thể tự ăn, nhận ra người thân. Lúc đó, nhiều nghệ sĩ như NSND Bạch Tuyết, NSND Lệ Thủy, NSND Kim Cương, NSND Minh Vương… đến thăm, mong đồng nghiệp sớm xuất viện.
Trong thời gian NSND Thanh Tuấn nhập viện cuối tháng 3, nhiều ồn ào xảy ra buộc gia đình lên tiếng. Người thân cho biết họ không kêu gọi hỗ trợ tài chính, quyên góp trị bệnh cho Thanh Tuấn. Gia đình cảnh giác khán giả đề phòng kẻ xấu trục lợi.
NSND Thanh Tuấn là một trong những giọng ca kỳ cựu thuộc thế hệ vàng sân khấu cải lương miền Nam. Dù đi hát sau các thế hệ như Út Trà Ôn, Minh Cảnh, Tấn Tài, NSND Thanh Tuấn vẫn tìm được chỗ đứng nhờ trường phái ca vọng cổ riêng, chất giọng ấm, trầm, ngày nay được nhiều thế hệ học theo và gọi là ""trường phái Thanh Tuấn"".
Sau ngày đất nước thống nhất, NSND Thanh Tuấn tiếp tục khẳng định sức hút bền bỉ, với hàng loạt vở cải lương để đời. Trong đó, vai Huy Bình trong vởTìm lại cuộc đời(hát cùng NSƯT Mỹ Châu) được xem là vở hát kinh điển của cải lương miền Nam sau năm 1975.
Ông còn gây dấu ấn mạnh mẽ với hàng loạt bài tân cổ giao duyên, đến nay vẫn được yêu thích nhưCô gái tưới đậu(cùng NSND Thanh Kim Huệ),Dòng sông quê em(hát cùng NSND Lệ Thủy), những bài ca đơn nhưNhớ Nha Trang, Chuyến xe Tây Ninh..."
https://tienphong.vn/30-di-tich-o-hoi-an-bi-xuong-cap-sau-mua-lu-post1794722.tpo,30 di tích ở Hội An bị xuống cấp sau mưa lũ,"TPO - Chủ tịch UBND thành phố Đà Nẵng Phạm Đức Ấn nhấn mạnh các di tích không chỉ là dấu ấn văn hóa, lịch sử mà còn là nguồn lực quan trọng trong phát triển du lịch của thành phố. Ông đề nghị các sở, ngành liên quan rà soát đánh giá hiện trạng, đề xuất giải pháp bảo tồn và khai thác hiệu quả, góp phần phát triển kinh tế - xã hội bền vững.","Sáng 9/11, Chủ tịch UBND thành phố Đà Nẵng Phạm Đức Ấn dẫn đầu đoàn công tác kiểm tra thực tế cácdi tích ở Hội An.
Đợt mưa lớn kéo dài vừa qua khiến đô thị cổ Hội An ngập lụt nghiêm trọng. Nhằm đảm bảo an toàn cho hệ thống di tích thuộc Di sản văn hóa thế giới đô thị cổ Hội An, Trung tâm Bảo tồn Di sản văn hóa thế giới Hội An phối hợp với UBND các phường tổ chức rà soát, nắm bắt tình hình xuống cấp, đồng thời vận động người dân, chủ di tích chủ động kiểm tra, gia cố công trình hạn chế thiệt hại do tác động từ mưa bão còn đang diễn biến phức tạp.
Lãnh đạo Trung tâm Bảo tồn Di sản văn hóa thế giới Hội An cho biết qua kiểm tra, hiện có 30 di tích bị xuống cấp, trong đó 9 di tích xuống cấp nghiêm trọng, 14 di tích xuống cấp nặng.
Trung tâm Bảo tồn Di sản văn hóa thế giới Hội An hỗ trợ chống đỡ cho một di tích thuộc diện nguy cấp (nhà số 23 Tiểu La), 19 di tích được chủ di tích tự tổ chức chống đỡ, gia cố bổ sung (mức độ nguy cơ nhẹ) và 10 di tích được đề nghị tu bổ khẩn cấp hoặc hạ giải tạm thời trong trường hợp chưa có kinh phí.
Đa sốdi tích xuống cấp nghiêm trọng, hiện vẫn chưa có hồ sơ pháp lý rõ ràng về quyền sở hữu, quyền sử dụng. Ngoài ra kinh phí tu bổ đối với các di tích rất lớn trong khi với nhiều chủ di tích ở các kiệt, hẻm không có điều kiện kinh doanh dẫn đến việc bỏ ra số tiền lớn thực hiện tôn tạo tu bổ là khó khăn.
Chủ tịch UBND thành phố Đà Nẵng Phạm Đức Ấn nhấn mạnh di tích có vai trò quan trọng trong đời sống văn hóa, tinh thần của nhân dân, đặc biệt là vai trò của di tích trong phát triển du lịch.
Nhấn mạnh mục tiêu gìn giữ và phát huy giá trị văn hóa, lịch sử của các di tích, đồng thời khai thác hiệu quả tiềm năng du lịch, góp phần thúc đẩy phát triển kinh tế - xã hội bền vững của thành phố, ông đề nghị Sở Văn hóa Thể thao và Du lịch phối hợp với các sở, ngành và địa phương tiếp tục rà soát, thống kê, đánh giá cụ thể hiện trạng và công năng của từng di tích, từ đó đề xuất các phương án bảo tồn, tôn tạo khả thi, phù hợp..."
https://tienphong.vn/thong-tin-moi-ve-con-tau-co-troi-len-o-bo-bien-hoi-an-post1794662.tpo,Thông tin mới về con tàu cổ trồi lên ở bờ biển Hội An,TPO - Việc con tàu trồi hẳn lên sau bão giúp giới chuyên môn ghi nhận thêm nhiều thông tin quan trọng về di vật hiếm hoi này.,"Sáng 9/11, trao đổi với Tiền Phong, ông Phạm Phú Ngọc - Phó giám đốc Trung tâm Bảo tồn Di sản Văn hóa thế giới Hội An - cho biết cơ quan chức năng đã ghi nhận thêm nhiều thông tin quan trọng về contàu cổ trồi lên ở bờ biển Hội An.
Trong đợt mưa lũ lớn do chịu ảnh hưởng của cơn bão số 12 (bão Fengshen), sóng đánh gây sạt lở nghiêm trọng bờ biển đã làm xuất lộ lại con tàu sau thời gian bị mất dấu.
Sáng 8/11, Trung tâm Bảo tồn Di sản Văn hóa thế giới Hội An đã khảo sát và ghi nhận hiện trường cácchi tiết của tàu xuất lộkhá nhiều, chiều rộng tàu đo được hơn 5 m, chiều dài phần xuất lộ hiện đo được 17,4 m và kích thước chiều dài có thể chưa kết thúc do còn bị vùi lấp dưới cát, các chi tiết giang, ván be, vách ngăn, lô... thể hiện khá rõ.
Trước đó, di vật tàu đắm tại khu vực ven biển Thịnh Mỹ, phường Hội An Tây, thành phố Đà Nẵng đã được UBND tỉnh Quảng Nam (cũ) thống nhất chủ trương khai quật khẩn cấp tại công văn ngày 7/2/2024.
Năm 2024, Trung tâm Quản lý Bảo tồn Di sản Văn hóa Hội An (nay là Trung tâm Bảo tồn Di sản Văn hóa thế giới Hội An) đã phối hợp với Đại học Khoa học xã hội và Nhân văn, Đại học Quốc gia Thành phố Hồ Chí Minh, Bảo tàng tỉnh Quảng Nam (nay là Bảo tàng Đà Nẵng) thực hiện và hoàn thành khảo sát về di vật tàu đắm này.
Kết quả khảo sát và giám định mẫu vật bước đầu cho thấy tàu có kích thước lớn, cấu trúc mạnh mẽ, xây dựng từ loại gỗ có độ bền cao và khả năng chịu lực tốt là gỗ bằng lăng (săng lẻ), kiền kiền và gỗ thông, dùng chất xảm trét ngăn chặn sự xâm nhập của nước vào tàu. Cấu trúc tàu cho phép thực hiện những chuyến hải trình dài ngày như hoạt động thương mại trên biển hoặc hải chiến.
Tuy nhiên vì một số lý do khách quan, kết quả xác định niên đại tuyệt đối bằng C14 của tàu chưa cho kết quả, song với vị trí phát hiện con tàu từng nằm sâu trong đất liền, cùng sự tương đồng sâu sắc về các đặc điểm cấu trúc, kỹ thuật thi công cùng vật liệu xây dựng với các con tàu đắm truyền thống Biển Đông đã phát hiện trong vùng biển Đông Nam Á, cho thấy, khả năng cao con tàu có niên đại giữa cuối thế kỷ XIV đến thế kỷ XVI.
Từ sau giai đoạn xuất lộ đầu tiên, con tàu tiếp tục bị bồi lấp sâu dưới lớp cát biển. Vừa qua, trong đợt mưa lũ lớn do chịu ảnh hưởng của cơn bão số 12 sóng đánh gây sạt lở nghiêm trọng bờ biển đã làm xuất lộ lại con tàu.
Theo lãnh đạo Trung tâm Bảo tồn Di sản Văn hóa thế giới Hội An, hiện trạng vị trí con tàu, mực nước biển lên xuống theo ngày kéo theo việc con tàu cũng bị bồi lấp cát rồi xuất lộ thường xuyên. Trung tâm hiện đã có một số biện pháp bảo vệ tạm thời như cắm biển cấm vào khu vực vị trí con tàu, liên lạc một số người dân địa phương hỗ trợ trông coi diễn biến bồi lấp của con tàu để thông tin về Trung tâm.
Đồng thời đơn vị cũng có văn bản gửi UBND phường Hội An Tây đề nghị địa phương phối hợp theo dõi, có biện pháp bảo vệ, tuyên truyền, vận động người dân và du khách tham gia bảo vệ những vết tích đang phát lộ, không tự ý đào bới tại khu vực này.
""Trước tình hình bờ biển sạt lở nghiêm trọng, đồng thời việc dị vật thường xuyên xuất lộ chịu tác động của các yếu tố thời tiết bất lợi gây ra tình trạng hư hại nếu không có biện pháp bảo quản, vấn đề bảo vệ an toàn hiện trạng khi tàu xuất lộ cũng gặp nhiều khó khăn. Do đó, Trung tâm đề xuất thực hiện các thủ tục để tổ chứckhai quật khẩn cấpvà bảo quản bước đầu di vật này”, ông Ngọc cho biết."
https://tienphong.vn/jack-bi-cam-dien-toan-dien-khong-chi-o-ha-noi-post1794551.tpo,"Jack bị cấm diễn toàn diện, không chỉ ở Hà Nội","TPO - Sau buổi biểu diễn gây tranh cãi với ca khúc có ca từ dung tục trong chương trình tối 16/10, Jack bị Sở Văn hóa và Thể thao Hà Nội xử phạt 55 triệu đồng và đình chỉ hoạt động biểu diễn trong 9 tháng. Đại diện Sở khẳng định lệnh đình chỉ có hiệu lực trên phạm vi toàn quốc.","Sau khiTiền Phongphản ánh thông tin Sở Văn hóa Thể thao Hà Nội phạt Jack 55 triệu đồng và đình chỉ hoạt động 9 tháng, câu hỏi đặt ra là lệnh cấm biểu diễn nam ca sĩ có phạm vi ra sao? Jack chỉ bị cấm hoạt động tại Hà Nội hay trên toàn quốc?
Tiền Phongliên hệ, đặt vấn đề với đại diện Sở Văn hóa Thể thao Hà Nội. Trả lờiPV, bà Lê Thị Ánh Mai - Phó Giám đốc Sở Văn hóa và Thể thao Hà Nội - khẳng định Jack bị cấm biểu diễn trên phạm vi toàn quốc, không chỉ tại Hà Nội. Điều đó đồng nghĩa với việc trong thời hạn 9 tháng, Trịnh Trần Phương Tuấn (tên thật của Jack) không được tham gia bất kỳ hoạt động biểu diễn nghệ thuật nào tại Việt Nam.
Từ tối 7/11, việc Sở Văn hóa và Thể thao Hà Nội ra quyết định xử phạt Jack làm bùng nổ tranh luận. Vụ việc bắt nguồn từ đêm nhạc diễn ra tại Hà Nội tối 16/10. Trong chương trình, Jack biểu diễn ca khúc có câu hát “Fan thường kêu anh vì họ Lào - Lào gì cũng t**. Câu hát được khán giả cho là biến tấu từ câu nói lái dung tục, nội dung khiêu khích và đáp trả anti-fan.
Về lệnh cấm Jack bị phạt tiền và cấm hát 9 tháng phạm vi toàn quốc, dư luận nhìn chung ủng hộ mạnh mẽ. Nhiều ý kiến cho rằng đây là bước đi cần thiết để lập lại kỷ cương trong hoạt động biểu diễn, đặc biệt trong bối cảnh nhiều sản phẩm âm nhạc trên mạng có ngôn từ lệch chuẩn, dễ ảnh hưởng tiêu cực đến giới trẻ.
Một số ý kiến cho rằng án phạt 55 triệu đồng nhìn chung còn thấp so với thu nhập của ca sĩ - thông qua câu hát ""Anh hát chơi chơi hơn một kiếp của nó đi làm"", chưa đủ sức răn đe.
Không ít người đề nghị phải nâng khung phạt và kéo dài thời hạn đình chỉ lên một đến hai năm đối với những nghệ sĩ có hành vi tương tự. Dư luận cho rằng việc đánh mạnh vào kinh tế và danh tiếng mới có thể khiến nghệ sĩ cân nhắc trước khi đưa ra sản phẩm phản cảm.
“Những ai hoạt động trong lĩnh vực văn hóa, nghệ thuật mà có hành vi phản cảm hay bài hát phản cảm nên bị cấm hoạt động 1-2 năm mới đủ sức răn đe”, “Một lần hát bằng cả kiếp người khác đi làm. Phạt 55 triệu chẳng thấm gì. Phải cấm diễn ít nhất 12 tháng và nộp lại toàn bộ cát-xê mới công bằng”... khán giả bình luận.
Khắp các diễn đàn, nhiều phụ huynh có con nhỏ bày tỏ sự đồng tình. Họ cho rằng ở độ tuổi 13-15, giới trẻ rất dễ bắt chước thần tượng, từ cách ăn nói, trang phục đến ứng xử trên mạng. Việc cơ quan quản lý xử lý nghiêm trường hợp Jack là thông điệp cảnh báo nghệ sĩ không thể tùy tiện với hình ảnh của chính mình.
Một bộ phận khán giả lớn tuổi còn so sánh với các quy định văn hóa của những nước trong khu vực, cho rằng Việt Nam cần mạnh tay hơn, giống như cách Trung Quốc từng làm để bảo vệ nền tảng đạo đức và văn hóa truyền thống. Việc siết chặt là cần thiết trong giai đoạn nghệ thuật giải trí đang phát triển quá nhanh và thiếu kiểm soát.
Một nhóm nhỏ khán giả bày tỏ sự việc lần này là bài học lớn để Jack trưởng thành. Việc cơ quan quản lý ra quyết định xử phạt đã đủ để cảnh tỉnh, và điều quan trọng là nam ca sĩ có biết nhận sai, sửa sai hay không.
Tuy nhiên, quan điểm này là thiểu số. Phần lớn công chúng cho rằng nghệ sĩ không thể viện lý do “vô tình” cho những sai sót mang tính chuẩn bị kỹ lưỡng. Một bài hát được sáng tác, phối khí, luyện tập và phê duyệt trước khi lên sân khấu tức là quá trình có chủ đích, có ê-kíp, không thể coi là sơ suất. Dư luận cho rằng sự ngông nghênh trong ca từ là hệ quả của việc thiếu tôn trọng khán giả và xem nhẹ ranh giới văn hóa.
Khán giả phần đông vẫn nhận định lệnh cấm rõ ràng, đúng đối tượng là bước ngoặt cần thiết để chấn chỉnh hoạt động biểu diễn, đồng thời gửi thông điệp rằng tự do nghệ thuật phải song hành với trách nhiệm xã hội.
NhưTiền Phongđưa tin ngày 7/11, Sở Văn hóa và Thể thao Hà Nội ban hành Quyết định xử phạt vi phạm hành chính số 1491/QĐ-XPHC đối với ông Trịnh Trần Phương Tuấn (nghệ danh Jack) về hành vi biểu diễn nghệ thuật có sử dụng từ ngữ trái với thuần phong mỹ tục của dân tộc, gây tác động tiêu cực đến đạo đức, sức khỏe cộng đồng và tâm lý xã hội.
Việc xử phạt được áp dụng theo quy định tại Nghị định số 38/2021/NĐ-CP ngày 29/3/2021 của Chính phủ về xử phạt vi phạm hành chính trong lĩnh vực văn hóa và quảng cáo, cùng Nghị quyết số 26/2022/NQ-HĐND ngày 8/12/2022 của Hội đồng nhân dân thành phố Hà Nội quy định mức tiền phạt đối với một số hành vi vi phạm hành chính trong lĩnh vực văn hóa tại khu vực nội thành.
Trước đó, trong chương trình “Tuổi thơ dưới ánh trăng” (Moonlit Childhood) diễn ra ngày 16/10 tại phường Bạch Mai (quận Hai Bà Trưng, Hà Nội), phần biểu diễn của Jack bị khán giả và giới chuyên môn phản ánh vì có ca từ chưa phù hợp, gây bức xúc dư luận.
Ngay sau khi tiếp nhận thông tin, Sở Văn hóa và Thể thao Hà Nội đã tiến hành kiểm tra, xác minh và kết luận đơn vị tổ chức chương trình mời Jack biểu diễn ca khúc không nằm trong danh mục được cơ quan quản lý phê duyệt, trong đó có một số câu hát bị đánh giá là phản cảm, trái với thuần phong mỹ tục.
Ngày 4/11, Sở ban hành Quyết định số 1469/QĐ-XPHC, xử phạt Công ty TNHH Dịch vụ Giải trí The East 50 triệu đồng về hành vi tổ chức biểu diễn nghệ thuật không đúng nội dung ghi trong văn bản chấp thuận của cơ quan có thẩm quyền. Đại diện doanh nghiệp đã thừa nhận sai phạm, nhận trách nhiệm và cam kết khắc phục, không để xảy ra sự việc tương tự.
Đại diện Sở Văn hóa và Thể thao Hà Nội khẳng định việc xử lý được thực hiện nghiêm túc, đúng quy định pháp luật, đảm bảo tính răn đe và giáo dục đối với người hoạt động nghệ thuật.
Trong thời gian tới, Sở sẽ tăng cường phối hợp chặt chẽ với các cơ quan chức năng nhằm quản lý, giám sát hoạt động biểu diễn trên địa bàn, kiên quyết ngăn chặn, loại bỏ các tác phẩm có nội dung phản cảm, trái với thuần phong mỹ tục của dân tộc.
Cơ quan này đồng thời kêu gọi đội ngũ nghệ sĩ và những người hoạt động trong lĩnh vực nghệ thuật biểu diễn tại Hà Nội phát huy tinh thần trách nhiệm xã hội, lan tỏa tình yêu nước, niềm tự hào dân tộc và tình yêu Hà Nội thông qua các sản phẩm nghệ thuật văn minh, sáng tạo và nhân văn. Sở nhấn mạnh mục tiêu lâu dài là xây dựng Hà Nội trở thành thành phố sáng tạo, trung tâm tổ chức các sự kiện nghệ thuật tiêu biểu của Việt Nam và khu vực châu Á."
https://tienphong.vn/ran-luc-mat-hong-ngoc-va-nhung-anh-thien-nhien-hoang-da-dep-me-hon-post1794629.tpo,Rắn lục mắt hồng ngọc và những ảnh thiên nhiên hoang dã đẹp mê hồn,"TPO - Cuộc thi ảnh Thiên nhiên hoang dã Việt Nam 2025 do CLB Nhiếp ảnh thiên nhiên Việt Nam, Hội Nhiếp ảnh TPHCM và 2 tổ chức WildTour, BirdLife International đồng tổ chức đã kết thúc với 8 giải thưởng được trao. Ban tổ chức đã triển lãm những bức ảnh độc đáo, gây ấn tượng với người xem.","Nghệ sĩ Nhiếp ảnh (NSNA) Nguyễn Trường Sinh - Chủ nhiệm CLB Nhiếp ảnhthiên nhiên hoang dã,đại diện Ban tổ chức cuộc thi cho biết chỉ với hơn 40 ngày phát động (Từ 15/8/2025 tới 30/9/2025, Ban tổ chức đã nhận được 739 ảnh dự thi của 136 tác giả đến từ 18 tỉnh, thành trong cả nước. Các thể loại ảnh chụp cũng rất đa dạng với hơn 400 ảnh chụp chim hoang, gần 200 ảnh chụpthú hoang và loài lưỡng cư, hơn 100 ảnh các loài côn trùng.
Còn NSNA Hoàng Thế Nhiệm, thành viên Ban giám khảo lại cho cuộc thi năm nay nhận được rất nhiều ảnh đẹp, có chủ đề khá rõ ràng nên Ban giám khảo rất khó để chấm giải, lựa chọn những giải cao nhất. Ngoài tiêu chí ảnh đẹp, nêu bật được chủ đề, ban giám khảo còn chú trọng tới các yếu như màu sắc ảnh phải trung thực, việc chụp ảnh có làm ảnh hưởng, tổn hại đến sinh vật hay tác động xấu đến môi trường không hay không.
Sau quá trình chấm giải, Ban giám khảo cuộc thiThiên nhiên hoangđã thống nhất trao 8 giải thưởng gồm 4 giải nhất cho 4 thể loại và 4 giải ấn tượng. Trong đó:
-Giải Nhấtthể loại bò sát trao cho tác giả Trần Anh Tuấn với ảnhRắn lục mắt hồng ngọc.
-Giải Nhấtthể loại chim hoang dã thuộc về tác giả Lý Nguyễn Long với ảnhGiang sen.
-Giải Nhấtthể loại macro côn trùng vinh danh tác giả Hồ Tấn Thịnh vớiBộ Araneae.
-Giải Nhấtthể loại thú hoang dã thuộc về Phùng Quang Hưng vớiVoọc chà vá chân nâu.
Ngoài ra Ban tổ chức còn trao 4 giải Ấn tượng trao cho tác giả: Nguyễn Minh Mẫn vớiĐiêng điểng/Cổ rắn, Hoàng Thu Hương vớiRắn hổ đất nâu, Lê Minh Ngọc vớiCà kheovà Nguyễn Thị Thanh Hồng vớiẾch cây sần.
Chùm ảnh các bức ảnh giành giải Ấn tượng:
Cũng từ ngày 8/11, Ban tổ chức cuộc thi ảnh Thiên nhiên hoang dã 2025 còn tổ chức triển lãm ảnh tại tòa nhà SC VivoCity (TPHCM).
""Mỗi tác phẩm thiên nhiên hoang dã trình làng công chúng năm nay đều là những khoảnh khắc đặc biệt, những lát cắt đáng giá từ đời sống hoang dã phong phú và sống động. Các nhiếp ảnh gia hầu hết với máy ảnh, ống kính chuyên nghiệp kỳ công lưu giữ lại những vẻ đẹp mong manh vi diệu, có thể gây xuýt xoa kinh ngạc về môi trường sống của động vật hoang dã""-NSNA Trung Nghĩa"
