url,title,description,content
https://tienphong.vn/du-an-tru-so-bo-ngoai-giao-gay-lang-phi-so-von-nha-nuoc-da-chi-hon-4000-ty-dong-post1792351.tpo,Dự án trụ sở Bộ Ngoại giao gây lãng phí số vốn Nhà nước đã chi hơn 4.000 tỷ đồng,"TPO - Tối 31/10, Thanh tra Chính phủ đã thông tin toàn văn Kết luận thanh tra Dự án trụ sở Bộ Ngoại giao. Nội dung cho thấy, Bộ Ngoại giao đã chỉ định thầu trái quy định 20 gói thầu với tổng giá trị hơn 4.388 tỷ đồng, vượt 904 tỷ đồng so với tổng mức đầu tư ban đầu được phê duyệt. TTCP xác định, việc dự án dừng thi công (từng giai đoạn), kéo dài hơn 10 năm gây lãng phí số vốn Nhà nước đã chi cho dự án hơn 4.000 tỷ đồng.","Chitiết5 vụ việc chuyểnsang Bộ Công an điều tra
Theo kết luận, Thanh tra Chính phủ đã chuyển hồ sơ 5 vụ việc có dấu hiệu vi phạm pháp luật gây hậu quả nghiêm trọng liên quan đến Dự án xây dựng trụ sở Bộ Ngoại giao (đường Lê Quang Đạo, TP Hà Nội), sang Bộ Công an để điều tra.
Vụ việc thứ nhất liên quan đến vi phạm quy định đấu thầu phương án kiến trúc. Cụ thể, Hội đồng thi tuyển tự ý hạ điểm sàn từ 70 xuống 60 để “hợp thức hóa” phương án của một đơn vị tư vấn bị loại. Kết quả, một công ty Hàn Quốc chỉ đạt 68,3 điểm lại được chọn, trong khi đơn vị của Đức đạt 78,2 điểm bị loại. Hành vi này bị xác định vi phạm quy chế thi tuyển, gây hậu quả nghiêm trọng trong lựa chọn tư vấn thiết kế.
Bộ Ngoại giao còn chỉ định thầu trái quy định 20 gói thầu, với tổng giá trị hơn 4.388 tỷ đồng, vượt 904 tỷ đồng so với tổng mức đầu tư được phê duyệt ban đầu (3.484 tỷ đồng). Theo kết luận, hành vi này vi phạm nguyên tắc quản lý chi phí đầu tư, trái chỉ đạo của Thủ tướng, khiến dự án bị chậm tiến độ và phát sinh chi phí, tiềm ẩn nguy cơ thiệt hại ngân sách và vốn của nhà thầu.
Vụ việc thứ hai là, việc trình, thẩm tra và phê duyệt dự toán bị trùng lặp mục chi phí tư vấn giai đoạn 1, gây thiệt hại tạm tính 42,9 tỷ đồng.
Vụ việc thứ ba, Bộ Ngoại giao ký hợp đồng thuê tư vấn nước ngoài vượt thẩm quyền, gây thiệt hại ngân sách khoảng 79,2 tỷ đồng.
Vụ việc thứ tư, trong đàm phán và thanh toán chi phí giám sát tác giả, cơ quan thanh tra phát hiện thanh toán sai 5,4 tỷ đồng, gây thiệt hại ngân sách. Tổng cộng, giá trị thiệt hại và nguy cơ thất thoát từ bốn vụ việc trên lên tới 127,5 tỷ đồng.
Vụ việc thứ năm liên quan đến đánh giá hồ sơ và lập dự toán một số gói thầu thiết bị trái quy định. Giá trị hợp đồng thiết bị được phát hiện cao hơn giá nhập khẩu sau thuế từ 2 đến 13 lần. Cụ thể, trong tổng giá trị thiết bị 766,6 tỷ đồng, phần 183,7 tỷ đồng được xác định chênh lệch hơn 108 tỷ đồng, không phù hợp cơ chế thị trường, tiềm ẩn thất thoát lớn cho ngân sách.
Dự án từ hơn 3.000 tỷ đồng lên gần 7.000 tỷ đồng
Dự án trụ sở Bộ Ngoại giao ban đầu có tổng mức đầu tư 3.484 tỷ đồng, nhưng đến năm 2013 được trình điều chỉnh lên 6.988 tỷ đồng. Theo Thanh tra Chính phủ, việc điều chỉnh này thiếu căn cứ và không chứng minh được “tính chất đặc thù” của hạng mục phát sinh trị giá 1.584 tỷ đồng.
Kết luận còn nêu dấu hiệu cố ý lập tổng mức đầu tư ban đầu thấp để dễ được phê duyệt, sau đó nâng vốn khi triển khai. Việc dự án dừng thi công (từng giai đoạn), kéo dài hơn 10 năm gây lãng phí số vốn Nhà nước đã chi cho dự án hơn 4.000 tỷ đồng.
Thanh tra Chính phủ xác định trách nhiệm thuộc về Bộ trưởng, Thứ trưởng Bộ Ngoại giao phụ trách dự án, cùng Ban quản lý dự án, Cục Quản trị – Tài vụ và các tổ chức, cá nhân liên quan theo từng thời kỳ.
Tổng Thanh tra Chính phủ kiến nghị Thủ tướng chỉ đạo Bộ Ngoại giao kiểm điểm, xử lý trách nhiệm, đồng thời chuyển kết luận đến Ủy ban Kiểm tra Trung ương để xem xét cán bộ có liên quan. Trường hợp phát hiện vi phạm hình sự gây thất thoát tài sản, các cơ quan chức năng phải chuyển hồ sơ cho Bộ Công an điều tra theo quy định.
Trước đó, tại buổi công bố kết luận, Trưởng đoàn thanh tra Trần Kim Hậu cho biết, Thanh tra Chính phủ đã chuyển thông tin hồ sơ, tài liệu vụ việc có dấu hiệu vi phạm các quy định về đấu thầu gây hậu quả nghiêm trọng theo quy định tại Điều 222, vi phạm quy định về đầu tư xây dựng công trình gây hậu quả nghiêm trọng theo Điều 224, vi phạm về quản lý sử dụng tài sản nhà nước gây thất thoát lãng phí theo Điều 219 của Bộ luật Hình sự năm 2015 đến Bộ Công an để xem xét, xử lý theo thẩm quyền. Kết luận thanh tra cũng được Thanh tra Chính phủ chuyển đến Ủy ban Kiểm tra Trung ương để xem xét, xử lý cán bộ liên quan theo thẩm quyền."
https://tienphong.vn/dien-vien-truong-ngoc-anh-bi-bat-post1792356.tpo,Diễn viên Trương Ngọc Ánh bị bắt,"TPO - Tối 31/10, Cơ quan Cảnh sát điều tra (Phòng Cảnh sát kinh tế) Công an TP.HCM đã khởi tố vụ án, khởi tố bị can và bắt tạm giam diễn viên Trương Ngọc Ánh để điều tra về hành vi “Lạm dụng tín nhiệm chiếm đoạt tài sản” theo quy định của Bộ luật Hình sự.","Theo điều tra ban đầu, Trương Ngọc Ánh từng là Chủ tịch HĐQT kiêm Giám đốc Công ty CP Bất động sản Đất Rồng (trụ sở tại phường Đức Nhuận, TP.HCM). Bà Ánh bị tố đã chiếm đoạt hàng chục tỷ đồng của công ty và nhà đầu tư nước ngoài trong quá trình điều hành doanh nghiệp.
Cụ thể, năm 2007, bà Ánh kêu gọi ông P.G.M (quốc tịch Ireland) góp vốn 9,1 triệu USD để triển khai hai dự án bất động sản, trong đó có tòa nhà Indochine tại quận 3 (cũ).
Cơ quan điều tra xác định bà Ánh cùng một cá nhân khác đã đứng tên cá nhân mua đất, nâng khống giá trị, lập sổ sách gian dối nhằm chiếm đoạt phần chênh lệch và rút tiền công ty sử dụng cá nhân.
Hiện Công an TP.HCM đang mở rộng điều tra, làm rõ trách nhiệm của các cá nhân liên quan và thu hồi tài sản cho doanh nghiệp, nhà đầu tư bị hại."
https://tienphong.vn/chuoi-hanh-vi-gian-doi-cua-dien-vien-truong-ngoc-anh-post1792364.tpo,Chuỗi hành vi gian dối của diễn viên Trương Ngọc Ánh,"TPO - Kết quả điều tra ban đầu cho thấy, diễn viên Trương Ngọc Ánh đã có chuỗi hành vi gian dối, chiếm đoạt tài sản của doanh nghiệp và nhà đầu tư nước ngoài trong suốt quá trình điều hành Công ty Cổ phần Bất động sản Đất Rồng. Giá trị chiếm đoạt trị giá nhiều triệu USD.","Kêu gọi đầu tư triệu đô, rồi chiếm đoạt tiền chênh lệch
Tối 31/10, Cơ quan Cảnh sát điều tra (Phòng Cảnh sát kinh tế) Công an TP.HCM đã khởi tố vụ án, khởi tố bị can và bắt tạm giam diễn viên Trương Ngọc Ánh để điều tra về hành vi “Lạm dụng tín nhiệm chiếm đoạt tài sản” theo Điều 175 Bộ luật Hình sự.
Theo hồ sơ, Công ty CP Bất động sản Đất Rồng được thành lập năm 2007, do Trương Ngọc Ánh làm Giám đốc kiêm Chủ tịch HĐQT. Lợi dụng danh tiếng của mình trong giới nghệ sĩ và doanh nhân, bà Ánh đã kêu gọi ông P.G.M (quốc tịch Ireland) góp vốn tổng cộng 9,1 triệu USD (tương đương hơn 149 tỷ đồng) để triển khai hai dự án bất động sản cao cấp tại TP.HCM, trong đó có dự án tòa nhà Indochine ở 112 Nguyễn Thị Minh Khai, quận 3 (cũ).
Riêng dự án Indochine, ông M. đã chuyển cho Trương Ngọc Ánh 4,49 triệu USD (khoảng 72 tỷ đồng) theo hợp đồng đầu tư ký ngày 25/1/2008.
Tuy nhiên, cơ quan điều tra xác định ngay trước thời điểm ký kết, Trương Ngọc Ánh cùng N.M.H (sinh năm 1964, ngụ phường Tân Định) đã đứng tên cá nhân ký hợp đồng mua bán với 4 hộ dân trong khu đất dự án. Tổng giá trị thực tế chỉ 7.917,3 lượng vàng, nhưng bị can đã khai khống trên sổ sách công ty thành 12.917,7 lượng vàng – chênh lệch khoảng 5.000 lượng vàng.
Cơ quan điều tra xác định đây là hành vi gian dối, nâng khống giá trị dự án nhằm chiếm đoạt phần chênh lệch đầu tư từ nguồn vốn góp của đối tác nước ngoài.
Hạch toán khống để che giấu sai phạm
Trong quá trình điều hành, Trương Ngọc Ánh lợi dụng chức vụ người đại diện pháp luật để chỉ đạo kế toán lập bút toán khống, chỉnh sửa sổ sách, tạo chứng từ giả về việc đã thanh toán đủ 4.458 lượng vàng cho bên bán đất, trong khi thực tế mới chi 3.000 lượng.Số tiền chênh lệch được bị can rút ra khỏi tài khoản công ty, sử dụng cho mục đích cá nhân mà không thông qua Hội đồng quản trị hay báo cáo cổ đông.
Cơ quan điều tra xác định, các báo cáo tài chính của Công ty Đất Rồng trong giai đoạn 2007 – 2009 bị làm sai lệch có chủ đích, nhằm che giấu dòng tiền chiếm đoạt và hợp thức hóa phần vốn đầu tư giả mạo.
Đáng chú ý, tháng 12/2007, UBND TP.HCM ban hành quyết định thu hồi khu đất dự án Indochine để mở rộng Trường THPT Lê Quý Đôn. Thành phố đã chi trả hơn 26,1 tỷ đồng tiền bồi thường cho 4 hộ dân bị thu hồi đất. Sau đó, các hộ dân đã hoàn trả toàn bộ số tiền bồi thường này cho Trương Ngọc Ánh và N.M.H – hai người đứng tên hợp đồng mua bán.
Theo kết quả điều tra, bà Ánh chỉ chuyển về công ty và nhà đầu tư 3 tỷ đồng, còn hơn 10 tỷ đồng được sử dụng cá nhân, không báo cáo và không hạch toán. Hành vi này được xác định là cố ý chiếm đoạt tài sản của doanh nghiệp và nhà đầu tư, gây thiệt hại nghiêm trọng cho Công ty Đất Rồng."
https://tienphong.vn/bat-pho-tong-giam-doc-cong-ty-dau-khi-nam-song-hau-post1792228.tpo,Bắt Phó Tổng Giám đốc Công ty Dầu khí Nam Sông Hậu,"TPO - Công ty Cổ phần Đầu tư thương mại dầu khí Nam Sông Hậu (NSH Petro, cổ phiếu: PSH) vừa công bố thông tin bất thường về việc cơ quan công an bắt giữ ông Nguyễn Việt Anh - Giám đốc Công ty Acuity Funding Việt Nam, kiêm Phó Tổng Giám đốc phụ trách tài chính của NSH Petro.","Theo thông báo từCơ quan Cảnh sát điều tra(CSĐT) Bộ Công an về việc bắt bị can để tạm giam đối với Nguyễn Việt Anh (SN 1982, trú phường Tam Thắng, TPHCM) - Giám đốc Công ty Acuity Funding Việt Nam; Phó Tổng Giám đốc NSH Petro.
Ông Nguyễn Việt Anh bị bắt tạm giam vì có hành vi cùng ông Ranjit Prithviraj Thambyrajah (Tổng Giám đốc NSH Petro - đã bị bắt trước đó) cung cấp thông tin gian dối về việc Công ty Berhero Pty Limited (giao dịch với tên Acuity Funding), có khả năng cung cấp các khoản vay từ hàng trăm triệu đến hàng tỷ USD cho các công ty Việt Nam, đểchiếm đoạtcác khoản phí và hưởng lợi số tiền 81.000 USD.
Trước đó, ngày 15/10, Cơ quan CSĐTBộ Công anra thông báo về việc bắt tạm giam ông Ranjit Prithviraj Thambyrajah (SN 1960, quốc tịch Úc), Giám đốc Công ty Berhero Pty Limited, kiêm Tổng Giám đốc NSH Petro.
Ông Ranjit Prithviraj Thambyrajah bị bắt để điều tra về hành vicung cấp thông tin gian dốivề các khoản vay có thể cho các công ty tại Việt Nam vay vốn, để chiếm đoạt các khoản phí của các công ty này với tổng số tiền chiếm đoạt hơn 4,9 triệu USD.
Ngày 20/10, HĐQT NSH Petro công bố nghị quyết miễn nhiệm chức danh Phó Chủ tịch HĐQT kiêm Tổng Giám đốc đối với ông Ranjit Prithviraj Thambyrajah (quốc tịch Úc, người đại diện pháp luật). Đồng thời, quyết nghị tạm đình chỉ công việc đối với ông Nguyễn Việt Anh - Phó Tổng Giám đốc phụ trách tài chính, và bà P.T.N.T, thành viên Ban Kiểm soát.
HĐQT NSH Petro thống nhất giao ông Mai Văn Huy - Chủ tịch HĐQT kiêm người đại diện pháp luật điều hành hoạt động công ty trong thời gian chưa có Tổng Giám đốc.
Ngày 21/10, NSH Petro công bố thay đổigiấy chứng nhận đăng ký doanh nghiệplần thứ 21. Theo giấy chứng nhận, NSH Petro có trụ sở tại xã Châu Thành (Cần Thơ), vốn điều lệ gần 1.262 tỷ đồng. Người đại diện theo pháp luật của công ty là ông Mai Văn Huy – Chủ tịch HĐQT.
Được biết, tháng 2/2024, ông Ranjit Prithviraj Thambyrajah giới thiệu là Chủ tịch kiêm Giám đốc điều hành Công ty Berhero với thương hiệu Acuity Funding, đã ký kết thỏa thuận đồng ý cho NSH Petro vay 720 triệu USD để triển khai 8 dự án. Số vốn được giải ngân thành 2 giai đoạn, thời hạn vay lên tới 20 năm.
Sau đó, theo lý giải của NSH Petro, việc bổ nhiệm ông Ranjit Prithviraj Thambyrajah làm Tổng Giám đốc công ty (từ tháng 4/2024) xuất phát từ yêu cầu của người này, kèm yêu cầu bổ nhiệm trợ lý riêng là ông Nguyễn Việt Anh làm Phó Tổng Giám đốc NSH Petro. Với mục đích tạo sự tin tưởng với các đối tác quốc tế khi ông Ranjit Prithviraj Thambyrajah đứng ra đàm phán hợp tác hoặc gọi vốn và kiểm soát các khoản cho NSH Petro vay.
Công ty CP Thương mại Đầu tưDầu khí Nam Sông Hậu(mã cổ phiếu: PSH) cũng vừa công bố báo cáo tài chính hợp nhất quý 3/2025. Kết quả kinh doanh cho thấy, đây là quý thứ 2 liên tiếp công ty không phát sinh doanh thu, chi phí, lợi nhuận từ hoạt động sản xuất, kinh doanh.
Tính từ đầu năm tới hết quý 3, NSH Petro chỉ mang về doanh thu bán hàng hơn 15 tỷ đồng (trong khi cùng kỳ năm trước doanh thu hơn 644 tỷ đồng). Trong khi chi phí quản lý doanh nghiệp, trả lãi vay vẫn phải thực hiện, do đó, trong quý 3/2025, công ty lỗ gộp trước thuế hơn 150 tỷ đồng, lũy kế 9 tháng của năm lỗ hơn 472 tỷ đồng.
Tổng các khoản nợ của NSH Petro hơn 10.205 tỷ đồng, tăng nhẹ so với thời điểm cuối năm trước.
Mới đây, Sở Giao dịch chứng khoán Hà Nội đã có quyết định đưa vào diện hạn chế giao dịch với cổ phiếu PSH của NSH Petro từ ngày 27/10/2025, do chậm nộp báo cáo tài chính bán niên 2025 đã được soát xét (quá hạn công bố 45 ngày theo quy định). Cổ phiếu PSH chỉ được giao dịch vào phiên Thứ 6 hằng tuần trên sàn UPCoM, với điều kiện được đưa ra khỏi diện bị đình chỉ giao dịch (bị đình chỉ từ từ ngày 9/7/2025).
Trước năm 2024, dầu khí Nam Sông Hậu là cái tên “đình đám” trong những thương nhân đầu mối nhập khẩu, kinh doanh, phân phối xăng dầu tại khu vực Đồng bằng sông Cửu Long. Với thị phần cây xăng và đại lý lớn nhất vùng (chiếm 28% số cây xăng cả vùng), với hơn 550 đại lý và cửa hàng nhượng quyền, 30 thương nhân phân phối. Năm tài chính 2023, công ty này có doanh thu hơn 6.124 tỷ đồng, lãi trước thuế hơn 63 tỷ đồng."
https://tienphong.vn/cuu-pho-chu-nhiem-van-phong-quoc-hoi-khang-cao-xin-giam-nhe-hinh-phat-post1792300.tpo,Cựu Phó chủ nhiệm Văn phòng Quốc hội kháng cáo xin giảm nhẹ hình phạt,"TPO - Sau hơn một tháng tuyên án sơ thẩm, ông Phạm Thái Hà cùng ông Nguyễn Duy Hưng (Chủ tịch Tập đoàn Thuận An) đều có đơn kháng cáo xin giảm nhẹ hình phạt.","Xin giảm nhẹ hình phạt
TAND TP Hà Nội vừa gửi thông báo về kháng cáo, kháng nghị trong vụ án xảy ra tại Tập đoàn Thuận An, Bộ Giao thông Vận tải (cũ) và các tỉnh, thành phố.
Theo đó, sau phiên sơ thẩm, bị cáoNguyễn Duy Hưng(Chủ tịch Tập đoàn Thuận An) kháng cáo xin giảm nhẹ hình phạt, đề nghị xem xét lại hậu quả thiệt hại của Nhà nước tại các dự án xảy ra vi phạm và xem xét lại số tiền các bị cáo, những người có quyền lợi, nghĩa vụ liên quan đã nộp khắc phục hậu quả.
Cũng xin giảm nhẹ hình phạt có bị cáoPhạm Thái Hà(cựu Phó chủ nhiệm Văn phòng Quốc hội); Trần Viết Cương (cựu Giám đốc Ban quản lý dự án tỉnh Tuyên Quang) cùng 14 bị cáo khác.
Giữa tháng 9/2025, TAND TP Hà Nội tuyên phạt ông Phạm Thái Hà 5 năm 6 tháng tù về tội “Lợi dụng chức vụ, quyền hạn gây ảnh hưởng đối với người khác để trục lợi”
Bị cáo Lê Ô Pích (cựu Phó chủ tịch UBND tỉnh Bắc Giang) bị phạt 3 năm tù tội “Lợi dụng chức vụ, quyền hạn trong khi thi hành công vụ”.
Bị cáo Nguyễn Duy Hưng bị phạt 10 năm 6 tháng tù.
26 bị cáo bị phạt từ 24 tháng tù nhưng cho hưởng án treo đến 6 năm tù giam về tội “Vi phạm quy định về đấu thầu gây hậu quả nghiêm trọng”.
Hội đồng xét xử sơ thẩm đánh giá, hành vi phạm tội của các bị cáo ảnh hưởng đến sự phát triển kinh tế, uy tín của cơ quan Nhà nước, gây thiệt hại cho Nhà nước số tiền hơn 120 tỷ đồng.
Từ ""tác động"" của ông Phạm Thái Hà dẫn đến ""thông thầu""
Bản án sơ thẩm xác định, quá trình tham gia đấu thầu ở một số dự án giao thông, bị cáo Nguyễn Duy Hưng đã lợi dụng mối quan hệ thân thiết với một số cá nhân là lãnh đạo cấp cao trong cơ quan nhà nước, trong đó có bị cáo Phạm Thái Hà để nhờ giới thiệu, can thiệp, tác động đến lãnh đạo cấp tỉnh, Bộ Giao thông vận tải.
Qua đó, tạo điều kiện cho Tập đoàn Thuận An và liên danh các nhà thầu trúng thầu, thi công các gói thầu, hưởng lợi bất chính, gây thiệt hại tài sản Nhà nước hơn 120 tỷ đồng.
Theo tòa, sau khi được ông Phạm Thái Hà “mở đường”, Nguyễn Duy Hưng trực tiếp đến gặp, đặt vấn đề nhờ lãnh đạo Tỉnh ủy, UBND các tỉnh và lãnh đạo đơn vị thuộc Bộ Giao thông vận tải; đồng thời chỉ đạo nhân viên của Tập đoàn phối hợp với các công ty do Tập đoàn mời hoặc các công ty do các Ban Quản lý dự án giới thiệu, chỉ định để tạo liên danh rồi ""thông đồng, móc ngoặc"" với các cá nhân là lãnh đạo Ban Quản lý dự án các tỉnh, Ban Quản lý dự án 4 thuộc Bộ Giao thông vận tải cũ và đơn vị tư vấn để phối hợp, tham gia ngay từ giai đoạn khảo sát, lập hồ sơ thiết kế, kỹ thuật, dự toán.
Nguyễn Huy Hưng cũng chỉ đạo nhân viên của Tập đoàn mời các đơn vị này tham gia góp ý xây dựng hồ sơ mời thầu; cung cấp, tiếp nhận tài liệu, dữ liệu của hồ sơ mời thầu trước khi phát hành; gửi hồ sơ dự thầu để chấm trước; thỏa thuận chi tỷ lệ % tiền ""cơ chế"" cho các cá nhân có trách nhiệm trong việc chỉ đạo, thực hiện các gói thầu, dự án để các cá nhân này chỉ đạo cấp dưới và phối hợp, cùng thực hiện hành vi vi phạm Luật Đấu thầu.
Quá trình thực hiện, Hưng trực tiếp hoặc đưa lợi ích vật chất cho ông Phạm Thái Hà 750 triệu đồng; đưa ông Lê Ô Pích 4 tỷ đồng; đưa cựu Bí thư Bắc Giang Dương Văn Thái 900 triệu đồng; đưa cho lãnh đạo các Ban quản lý dự án từ vài chục triệu đến hàng tỷ đồng."
https://tienphong.vn/vu-nu-dai-gia-thuy-san-bi-cao-buoc-huy-hoai-tai-san-nu-dai-gia-bat-khoc-noi-loi-sau-cung-post1792357.tpo,Vụ nữ ‘đại gia’ thủy sản bị cáo buộc hủy hoại tài sản: Nữ đại gia bật khóc nói lời sau cùng,"TPO - Bà Âu Ngọc Vững bật khóc tại phiên tòa khi nói lời sau cùng, bà cho rằng mình chỉ dọn dẹp và cắm mốc bảo vệ ranh đất phần đất của ông cha mình để lại, không hủy hoại tài sản của ai.","Ngày 31/10, TAND khu vực I - tỉnh Cà Mau mở phiên sơ thẩm xét xử đối với bà Âu Ngọc Vững (57 tuổi, ngụ tỉnh Cà Mau), bị cáo buộc hủy hoại tài sản người khác. Bà Vững được biết đến là ""đại gia"" thủy sản có tiếng ở tỉnh Cà Mau và Bạc Liêu cũ.
Theo cáo trạng, ngày 18/4/2021, bà Vững đến phần đất tranh chấp với ông H.Q.C. ở phường 6, TP. Cà Mau cũ, và chỉ đạo người cháu và một số thanh niên chặt 3 cây dừa, 2 cây sao, đập gãy 2 trụ đá, 1 vách tường và 1 lối đi. Số tài sản trên được xác định của ông C. đang quản lý sử dụng.
Ngày 21/4/2021, bị cáo Vững tiếp tục chỉ đạo tài xế điều khiển xe cuốc san lập mặt bằng lối đi đập phá trước đó để cắm trụ bê tông.
Ngành chức năng xác định, tổng giá trị tài sản bị thiệt hại kể trên hơn 35 triệu đồng.
Vụ án từng được đưa ra xét xử hai lần năm 2024 và đều trả hồ sơ điều tra bổ sung, làm rõ giá trị tài sản thiệt hại.
Ở lần xét xử này, bị cáo Vững tiếp tục không thừa nhận hành vi phạm tội. Bà cho rằng mình chỉ nhờ người chặt 2 cây dừa ""thuộc đất ông bà để lại"", với mục đích phát quang, dọn dẹp và cắm mốc bảo vệ đất, không có ý định phá hoại tài sản của người khác.
Tại phiên toà, luật sư bào chữa phía bị cáo và đại diện Viện VKS khu vực 1 đã tranh luận khá lâu. Nội dung xung quanh việc có hay không vi phạm quy trình thủ tục tố tụng, cũng như việc định giá tài sản; ai là người cưa cây dừa thứ 3 và 2 cây sao, giá trị các cây bị chặt...
Đại diện Viện KSND khẳng định có đủ cơ sở chứng minh hành vi phạm tội của bị cáo, đề nghị tuyên phạt bị cáo Vững từ 1 - 2 năm cải tạo không giam giữ.
Trong lời trình bày cuối cùng trước tòa, bị cáo Vững vẫn cho rằng mình vô tội. “Bản thân tôi là người kinh doanh, đang quản lý 4 công ty và đóng góp cho an sinh xã hội và tạo công ăn việc làm cho hàng trăm lao động. Tôi mong HĐXX xử tôi vô tội để bản thân được trở lại sản xuất kinh doanh”, bị cáo Vững nói trong nước mắt.
Dự kiến HĐXX tuyên án vào chiều 3/11."
