url,title,description,content
https://tienphong.vn/khi-thay-co-bat-tay-voi-chatgpt-post1794732.tpo,Khi thầy cô 'bắt tay' với ChatGPT,"TPO - Từ những giờ tranh luận sôi nổi ở tiết Ngữ văn, đến những tiết Toán “học mà chơi, chơi mà học”, ngày càng nhiều thầy cô tại TPHCM đã tận dụng trí tuệ nhân tạo (AI) khiến việc học trở nên dễ hiểu, sinh động và gần gũi hơn với học sinh.","Một tiết học đặc biệt của học sinh lớp 10A5, Trường THPT Lương Thế Vinh (phường Cầu Ông Lãnh, TPHCM), được mở đầu bằng một video ngắn kể về câu chuyện ban giám khảo cuộc thi nhiếp ảnh trao giải cho một tác phẩm doAItạo ra. Tác giả bức ảnh sau đó từ chối nhận giải, với lý do muốn thử xem thế giới đã sẵn sàng chấp nhận tác phẩm của trí tuệ nhân tạo hay chưa.
Từ câu chuyện này, thầy Nguyễn Thiên Đông – giáo viên Ngữ văn đặt ra câu hỏi: “Các em có đồng tình với hành động của tác giả này không?”. Câu hỏi tưởng chừng đơn giản nhưng đã khơi dậy hàng loạt ý kiến. Phần lớn học sinh không đồng tình, cho rằng nghệ thuật chỉ thật sự có giá trị khi được sáng tạo bởi con người, bằng cảm xúc và lao động cá nhân.
Không dừng lại ở tranh luận miệng, thầy Đông chia lớp thành bốn nhóm, hai nhóm đồng tình và hai nhóm phản đối để cùng thảo luận chủ đề: “AI có thể thay thế con người hay không?”. Mỗi nhóm phải trình bày bằng slide, infographic, biểu đồ hoặc các phương tiện phi ngôn ngữ khác, đồng thời ghi âm bài nói để nhập vào ứng dụng VoiceGPT - công cụ AI có khả năng “chấm điểm” bài thuyết trình dựa trên các tiêu chí mà giáo viên thiết lập.
Điều thú vị là kết quả đánh giá của VoiceGPT trùng khớp với kết quả bình chọn của học sinh trong lớp. Ứng dụng còn đưa ra những nhận xét chi tiết như: luận điểm rõ ràng, có dẫn chứng cụ thể, ngôn ngữ học thuật, chỉ còn vài lỗi phát âm nhỏ...
Sau khi công bố kết quả, thầy Đông dành thời gian phân tích những yếu tố mà AI chưa thể nhận định chính xác như ánh mắt, cử chỉ, phong thái của người nói. “Quan trọng nhất không phải là kết quả AI đưa ra mà là cách chúng ta học được điều gì từ quá trình ấy. AI có thể chấm điểm ta, nhưng chính chúng ta mới là người tự đánh giá bản thân”, thầy Đông lưu ý.
Không chỉ ở bậc THPT, tại nhiều trường học ở TPHCM, các giáo viên bắt đầu tiếp cận AI và tìm cách để AI trở thành một trợ lý hiệu quả. Tại Trường Tiểu học Phú Thọ (phường Phú Thọ, TPHCM), thầy Nguyễn Hữu Trí - giáo viên chủ nhiệm lớp 4/4 là giáo viên tiên phong đưa ChatGPT và Gemini vào giảng dạy Toán học. Từ khi ứng dụng AI, tỷ lệ học sinh đạt loại giỏi môn Toán trong lớp của thầy Trí tăng hơn sau các giờ học. Bí quyết của thầy giáo này là “trò chơi hóa” môn Toán, biến những con số, phép tính khô khan thành trò chơi tương tác hấp dẫn.
Trong mỗi tiết học,ChatGPThoặc Gemini được dùng để tự động tạo trò chơi Toán học với mức độ khó tăng dần theo năng lực từng học sinh. Mỗi khi hoàn thành bài tập, các em được thưởng huy hiệu sao vàng – phần thưởng tuy nhỏ nhưng mang lại động lực lớn. Không chỉ dừng lại ở trò chơi, học sinh còn có thể hội thoại trực tiếp với AI như với một người bạn học.
Ở một số tiết học, thầy còn để học sinh tạo video hoặc truyện tranh minh họa cho bài toán, từ đó rèn kỹ năng thuyết trình và sáng tạo. Không chỉ học sinh được lợi, AI còn giúp giáo viên ""nhẹ"" việc hơn. Nếu trước đây thầy cô phải quan sát, ghi nhớ từng em thì nay nhờ khả năng phân tích dữ liệu làm bài theo thời gian thực, AI có thể tự động tạo báo cáo chi tiết về lỗi sai của từng học sinh, giúp giáo viên cá nhân hóa việc dạy học nhanh chóng, hiệu quả và chính xác hơn.
Trong khi nhiều trường mới bắt đầu thử nghiệm, Trường THPT chuyên Lê Hồng Phong đã đưa trí tuệ nhân tạo vào giảng dạy từ 7 năm trước. Ban đầu, chương trình chỉ có hai cấp độ phổ thông và nâng cao nhưng nay đã mở rộng thành ba cấp độ, từ kiến thức nền tảng đến chuyên sâu, dành cho học sinh định hướng theo ngành AI ở bậc đại học.
Theo cô Phạm Thị Bé Hiền, Hiệu trưởng Trường THPT chuyên Lê Hồng Phong, thách thức lớn nhất là thiếu đội ngũ giáo viên được đào tạo chuyên sâu vềAI. Vì vậy, trường đã mời các chuyên gia, kỹ sư AI đến giảng dạy và tổ chức các khóa bồi dưỡng cho giáo viên Tin học. Một số thầy cô hiện đã hướng dẫn học sinh làm đề tài nghiên cứu khoa học ứng dụng AI trong đời sống.
Hàng chục nghìn giáo viên TPHCM sẽ được bồi dưỡng về AI
Ông Nguyễn Văn Hiếu - Giám đốc Sở Giáo dục và Đào tạo TPHCM đánh giá, hiện nay một số trường học trên địa bàn đã thí điểm giảng dạy AI cho học sinh, tuy nhiên mới ở quy mô nhỏ. Ông mong muốn việc này sớm được triển khai chính quy, có định hướng dài hạn, chương trình bài bản và đội ngũ giáo viên được đào tạo chính thức.
Trong giai đoạn đầu, thành phố sẽ chưa thể triển khai đồng loạt ở hơn 3.500 trường học mà tập trung trước tại những đơn vị “đủ độ chín”, sau đó mở rộng dần.
Theo kế hoạch, giáo viên TPHCM sẽ được tham gia hai chương trình đào tạo trọng điểm:khóa phương pháp giảng dạy STEM trong Tiếng Anh (thời lượng 24 giờ) và khóa giảng dạy trí tuệ nhân tạo theo chuẩn quốc tế kéo dài 40 giờ.
Cả hai khóa học đều hướng đến việc trang bị cho giáo viên kiến thức nền tảng, kỹ năng sư phạm hiện đại và khả năng ứng dụng thực tế. Qua đó, giáo viên có thể tự tin tích hợp STEM vào môn tiếng Anh, đồng thời đưa các công cụ AI vào lớp học, góp phần nâng cao chất lượng giáo dục và thúc đẩy đổi mới sáng tạo trong dạy và học."
https://tienphong.vn/tu-ke-loi-vi-pham-cach-giao-duc-giao-thong-cham-toi-trai-tim-hoc-sinh-post1794637.tpo,"Tự kể lỗi vi phạm, cách giáo dục giao thông chạm tới trái tim học sinh",TPO - Học sinh tự kể lại lỗi vi phạm để bạn bè cùng rút kinh nghiệm. Đây là một cách làm mới mẻ và đầy ý nghĩa trong giáo dục an toàn giao thông ở Bắc Ninh.,"Theo Phòng CSGT tỉnh Bắc Ninh, mới đây, Trung tâm Giáo dục nghề nghiệp – Giáo dục thường xuyên Chũ đã phối hợp với Tổ CSGT Chũ và phụ huynh tổ chức buổi tuyên truyền, giáo dục pháp luật về trật tự an toàn giao thông (TTATGT) cho học sinh toàn trường.
Điểm đặc biệt của buổi tuyên truyền nằm ở chính cách tiếp cận gần gũi và giàu cảm xúc. Mỗi học sinhtự kểlại vi phạm của mình, chia sẻ bài học rút ra cho bản thân và bạn bè. Không còn là những lời răn đe khô khan, thay vào đó là những câuchuyện thật, cảm xúc thật, khiến cả lớp học lặng đi, rồi cùng suy ngẫm về trách nhiệm và sự an toàn.
Cán bộCSGTđã cùng các em phân tích nguyên nhân, chỉ rõ các hành vi vi phạm thường gặp như: không đội mũ bảo hiểm, chở quá số người quy định, điều khiển xe mô tô khi chưa đủ tuổi, không có giấy phép lái xe...
Đồng thời, cán bộ CSGT còn trực tiếp giải đáp thắc mắc của phụ huynh, giúp gia đình hiểu rõ hơn vai trò của mình trong việc đồng hành, giáo dục con em chấp hành nghiêmpháp luậtgiao thông.
Tại buổi tuyên truyền, câu chuyện về vụ tai nạn giao thông đau lòng xảy ra lúc 20h40 ngày 6/10/2025 tại ngã tư đường Lê Duẩn – Trần Phú, phường Chũ, khi hai học sinh điều khiển xe mô tô gây tai nạn, được nhắc lại như một lời cảnh tỉnh mạnh mẽ. Câu chuyện khiến nhiều học sinh nhận ra hậu quả nặng nề của sự chủ quan và liều lĩnh khi tham gia giao thông.
Với 1.640 học sinh toàn trường, việc có 31 em từng vi phạm là con số không lớn, nhưng mỗi trường hợp đều trở thành một bài học quý. Sự phối hợp chặt chẽ giữa công an, nhà trường và phụ huynh đã tạo nên một mô hình giáo dục hiệu quả, thiết thực, giúp nâng cao ý thức tự giác chấp hành pháp luật về an toàn giao thông.
Theo Phòng CSGT tỉnh Bắc Ninh, mỗi lỗi vi phạm không chỉ là sai lầm của cá nhân, mà còn là bài học để cả cộng đồng cùng nhìn lại, cùng thay đổi.
Buổi tuyên truyền khép lại trong tiếng vỗ tay của phụ huynh, sự đồng thuận của nhà trường và ánh mắt trầm lắng của những học sinh vừa kể lại lỗi của mình. Một buổi học đặc biệt — nơi những vi phạm được hóa thành bài học, nơi mỗi câu chuyện trở thành lời nhắc nhở về sự an toàn và tương lai phía trước."
https://tienphong.vn/nam-sinh-tu-vong-trong-truong-dai-hoc-khi-roi-tu-tang-8-post1794765.tpo,Nam sinh tử vong trong trường đại học khi rơi từ tầng 8,"TPO - Nam sinh được phát hiện tử vong dưới nền đất của tòa nhà B6 thuộc Đại học Quốc gia TPHCM. Bước đầu cơ quan chức năng nhận định, nạn nhân rơi từ tầng 8 xuống.","Ngày 9/11, Công an TPHCM đang điều tra làm rõ nguyên nhântử vongcủa một nam sinh trong trường đại học, vừa xảy ra trên địa bàn.
Theo thông tin ban đầu, đêm 8/11, một nam sinh được phát hiện nằm tử vong dưới nền đất tòa nhà B6 Đại học Quốc gia TPHCM (phường Đông Hòa).
Vụ việc sau đó được trình báo cơ quan chức năng địa phương. Nhận tin báo, Công an phường Đông Hòa cùng các đơn vị nghiệp vụ Công an TPHCM nhanh chóng đến khám nghiệm hiện trường, điều tra nguyên nhân.
Theo hình ảnh từ camera an ninh ghi lại,nam sinhđi vào trường, sau đó lên tầng 8 của tòa nhà B6.
Tại hiện trường trêntầng 8, công an tìm thấy đôi dép, túi xách, điện thoại và giấy tờ nạn nhân để lại ở sát khu vực lan can. Danh tính nạn nhân được xác định là P.A.H. (23 tuổi, quê Gia Lai).
Bước đầu cơ quan chức năng nhận định, nạn nhân tử vong do rơi từ tầng 8. Tuy nhiên, nguyên nhân vụ việc vẫn đang được công an điều tra làm rõ."
https://tienphong.vn/phat-10-trieu-dong-neu-ep-con-hoc-quy-dinh-mang-tinh-chat-ran-de-post1794587.tpo,Phạt 10 triệu đồng nếu ép con học: Quy định mang tính chất răn đe,"TPO - Nghị định 282/NĐ-CP có những nội dung mới phải bổ sung hành vi và nâng mức chế tài về phòng chống bạo lực gia đình là cần thiết để tăng tính chất răn đe, phòng ngừa đối với bạo lực gia đình.","Quy định có cơ sở thực tiễn
Điểm D, khoản 1, Điều 40 của nghị định đã quy định cụ thể là hành vi cưỡng ép thành viên trong gia đình học tập quá sức có thể bị phạt tới 10 triệu đồng. Đây là quy định mới và nghiêm khắc.
Mức phạt tiền này có thể bằng cả tháng lương của phụ huynh nếu như ép buộc con cái học tập quá sức. Quy định này không phải là không có cơ sở, bởi vì xuất phát từ thực tiễn không ít gia đình bố mẹ ép buộc con cái học tập quá sức dẫn đến nhiều trẻ em đã có phản ứng tiêu cực như: bỏ nhà đi, có những em trầm cảm, ảnh hưởng nghiêm trọng đến tâm lý và sức khoẻ, thậm chí có em tự tử.
Những hiện tượng gia đình mâu thuẫn, căng thẳng chỉ vì cha mẹ áp đặt và ép buộc việc học tập đối với con cái diễn ra phổ biến trong đời sống xã hội hiện nay.
Tuy nhiên, thực tế việc xử phạt vi phạm hành chính đối với cha mẹ do hành vi ép buộc con cái học tập quá sức sẽ gặp những khó khăn do con cái ít khi tố cáo cha mẹ. Chuyện cha mẹ yêu cầu, thậm chí ép buộc con học tập mà không có sự phản ánh, tố giác của người trong gia đình thì cơ quan chức năng cũng khó phát hiện để có biện pháp xử lý.
Ngoài ra, những mâu thuẫn và hành vi vi phạm xuất phát từ mối quan hệ giữa các thành viên trong gia đình sẽ nảy sinh tâm lý e ngại của cơ quan chức năng khi vào cuộc xử lý.
Về bản chất, việc xử lý vi phạm vừa để răn đe, đồng thời cũng bảo vệ mối quan hệ giữa các thành viên trong gia đình. Nếu việc xử lý vi phạm dẫn đến gia đình mâu thuẫn căng thẳng hơn, ảnh hưởng đến hạnh phúc thì cơ quan chức năng cũng sẽ cân nhắc có nên xử lý hay chỉ ở mức độ nhắc nhở, khuyên can.
Ngoài ra, quy định ép buộc học tập “quá sức” là quy định mang tính chất định tính, không định lượng, thế nào là “quá sức”. Mức độ, khả năng nhu cầu học tập của mỗi người là khác nhau… để xử lý vi phạm thì phải chứng minh được hai vấn đề gồm: có hành vi cưỡng ép thành viên trong gia đình học tập và có hay không việc “cưỡng ép” đó dẫn đến việc học tập “quá sức”. Trong khi đó, thực tế thì hầu hết các bậc phụ huynh đều yêu cầu, thậm chí mắng mỏ con cái vì lười học. Phụ huynh yêu cầu con cái học tập là chuyện hiển nhiên, cách biểu lộ thái độ cảm xúc của mỗi người cũng khác nên để chứng minh hành vi là “cưỡng ép học tập” là không dễ dàng trong thực tiễn.
Tính khả thi không cao
Bởi vậy, quy định này tính khả thi không cao, tuy nhiên cũng là cơ sở pháp lý để những thành viên trong gia đình được tôn trọng hơn về quyền học tập, bình đẳng lựa chọn mức độ học tập.
Quy định cũng là cơ sở để răn đe đối với các phụ huynh khi có hành vi bạo lực trong gia đình, thiếu tôn trọng, ép buộc các thành viên khác học tập. Mọi hành vi ép buộc, xúc phạm, có tính chất bạo lực trong gia đình đều không đáng xảy ra và phải được xoá bỏ. Bởi vậy những quy định này mặc dù có thể khó được áp dụng trên thực tế, tuy nhiên nó sẽ là cơ sở pháp lý để giữa các thành viên trong gia đình thấy được giới hạn, chuẩn mực trong sự can thiệp vào việc học tập của nhau.
Trong trường hợp hành vi ép buộc thành viên trong gia đình học tập có những chứng cứ cụ thể gây ra những áp lực không cần thiết, ảnh hưởng đến tâm lý sức khỏe thì việc can thiệp của cơ quan chức năng, chính quyền địa phương là cần thiết để tránh những mâu thuẫn không đáng có.
Đặc biệt, sự can thiệp kịp thời cũng có thể tránh những phản ứng tiêu cực từ người bị ép buộc như tự tử, bỏ nhà ra đi hoặc xảy ra những xung đột mâu thuẫn lớn trong gia đình, ảnh hưởng đến hạnh phúc, trật tự an toàn xã hội.
Quy định mới về xử lý vi phạm hành chính trong lĩnh vực an ninh trật tự, phòng chống bạo lực gia đình theo nghị định của Chính phủ cần phải được truyền thông rộng rãi để người dân nắm được, hiểu và nâng cao ý thức chấp hành pháp luật, nâng cao nhận thức.
Pháp luật được ban hành không chỉ để răn đe, xử lý vi phạm mà còn có chức năng giáo dục và phòng ngừa.
Khi các quy phạm pháp luật có hiệu lực thì vấn đề tuyên truyền, đưa các quy tắc, quy phạm đó vào đời sống xã hội là rất quan trọng. Những hành vi cố ý đi quá giới hạn, vượt qua khuôn khổ của pháp luật đương nhiên sẽ phải chịu chế tài để bảo vệ các quyền và lợi ích hợp pháp của công dân."
https://tienphong.vn/de-tai-cua-nu-sinh-vien-toc-nguoi-ruc-doat-giai-nhi-khoa-hoc-cap-toan-quoc-post1794650.tpo,Đề tài của nữ sinh viên tộc người Rục đoạt giải nhì khoa học cấp toàn quốc,"TPO - Là người đầu tiên của tộc người ở Rục ở xã Kim Phú, tỉnh Quảng Trị đậu đại học, bằng sự nỗ lực vượt bậc, Cao Thị Lệ Hằng không chỉ học giỏi mà còn luôn đau đáu với tinh thần cống hiến. Và đề tài vì cộng đồng trẻ em người Rục của Hằng đã đoạt giải nhì khoa học cấp toàn quốc.","Nghiên cứu vì sức khỏe trẻ em dân tộc mình
Sáng 8/11, tại Trường Đại học Nha Trang (Khánh Hòa), Bộ Giáo dục và Đào tạo, Bộ Khoa học và Công nghệ, Trung ương Đoàn TNCS Hồ Chí Minh và Quỹ Hỗ trợ sáng tạo kỹ thuật Việt Nam (VIFOTEC) phối hợp tổ chức lễ tổng kết và traoGiải thưởng khoa học - công nghệdành cho sinh viên trong các cơ sở giáo dục đại học năm 2025.
Trong hàng trăm công trình được vinh danh, đề tài của nhóm sinh viên Trường Đại học Quảng Bình gây chú ý đặc biệt khi giành giải Nhì toàn quốc, bởinhóm trưởng là Cao Thị Lệ Hằng– là người Rục đầu tiên đỗ đại học.
Sinh ra trong cộng đồng Rục – một nhánh nhỏ của dân tộc Chứt ở vùng núi rừng phía Tây tỉnh Quảng Trị, nơi điều kiện học tập còn nhiều thiếu thốn, Cao Thị Lệ Hằng đã vượt qua vô vàn khó khăn để theo đuổi con đường tri thức.
Từ những bước đi đầu tiên trên con đường học tập, Hằng luôn ý thức mình phải học để quay về giúp bản làng. Năm 2021, em trở thành nữ sinh người Rục đầu tiên trúng tuyển vào đại học, theo học ngành Giáo dục mầm non K64, Trường Đại học Quảng Bình.
Không chỉ nỗ lực học tập, Hằng còn được kết nạp vào Đảng, trở thành tấm gương tiêu biểu về tinh thần vượt khó vươn lên của sinh viên dân tộc thiểu số.
Đề tài đạt giải Nhì toàn quốc của Hằng mang tên: “Nghiên cứu thực trạng và đề xuất giải pháp nâng cao hiệu quả giáo dục về sức khỏe và vệ sinh cá nhân cho trẻ em tộc người Rục (dân tộc Chứt) tại tỉnh Quảng Bình”.
Với vai trò chủ nhiệm đề tài, Hằng cùng các thành viên Nguyễn Thị Cẩm Nhung, Nguyễn Thị Kim Oanh, Nguyễn Thị Thanh Thủy và Ngô Thị Hoài Ân, dưới sự hướng dẫn của Tiến sĩ Phạm Thị Yến, đã thực hiện quá trình khảo sát, thu thập dữ liệu và đề xuất giải pháp mang tính ứng dụng cao nhằm cải thiện sức khỏe, vệ sinh cá nhân chotrẻ em ở cộng đồng Rục.
“Em muốn đề tài không chỉ nằm trên giấy, mà có thể giúp trẻ em bản mình khỏe mạnh, tự tin hơn khi đến trường” – Hằng chia sẻ tại lễ trao giải.
Vinh danh trí tuệ trẻ và khát vọng vươn lên
Giải thưởng khoa học - công nghệ dành cho sinh viên là sân chơi học thuật uy tín cấp quốc gia, quy tụ 628 đề tài đến từ 112 trường đại học trên cả nước, chia theo 6 lĩnh vực nghiên cứu. Kết quả, 530 đề tài được trao giải, trong đó có 20 giải Nhất, 105 giải Nhì, 153 giải Ba và 252 giải Khuyến khích.
Đề tài của nhóm sinh viên Trường Đại học Quảng Bình, với nữ sinh người Rục làm nhóm trưởng, là một trong những điểm sáng nổi bật, thể hiện tinh thần nghiên cứu khoa học gắn với thực tiễn cộng đồng, đặc biệt trong lĩnh vực giáo dục và y tế học đường cho trẻ em dân tộc thiểu số.
Từ bản làng Rục heo hút giữa đại ngàn Minh Hóa đến lễ vinh danh sinh viên toàn quốc, Cao Thị Lệ Hằng đã viết tiếp câu chuyện đẹp về ý chí, tri thức và khát vọng cống hiến.
Giữa ánh sáng của tri thức hôm nay, hình ảnh nữ sinh người Rục nhỏ bé, khiêm nhường mà đầy nghị lực, là minh chứng sinh động cho sức mạnh của giáo dục và tinh thần vượt khó của thế hệ trẻ vùng cao Quảng Bình."
https://tienphong.vn/bac-ninh-trao-giai-cuoc-thi-tim-kiem-tai-nang-post1794659.tpo,Bắc Ninh trao giải cuộc thi 'Tìm kiếm tài năng',"Chiều 8/11, Tỉnh Đoàn Bắc Ninh phối hợp với Trường Trung học phổ thông Hàn Thuyên (phường Võ Cường) tổ chức chương trình Thanh niên thượng tôn pháp luật năm 2025 và vòng chung kết cuộc thi Tìm kiếm tài năng.","Với chuyên đề “Phòng chống ma túy và tác hại của thuốc lá điện tử”, chương trình đã thu hút sự tham gia sôi nổi của hơn 2.000 học sinh toàn trường. Thông qua hình thức tuyên truyền kết hợp trò chơi hỏi – đáp ngắn giữa học sinh và cán bộ Công an tỉnh, các nội dung pháp luật, kỹ năng phòng tránh tệ nạn xã hội được truyền tải sinh động, dễ hiểu và gần gũi.
Chương trình tập trung cảnh báo thực trạng học sinh, thanh thiếu niên bị lôi kéo sử dụng ma túy, thuốc lá điện tử, thuốc lá nung nóng đang có xu hướng gia tăng và diễn biến phức tạp, ảnh hưởng trực tiếp đến sức khỏe, việc học tập và tương lai của các em. Bên cạnh đó, cán bộ tuyên truyền cũng hướng dẫn phương pháp nhận biết, kỹ năng từ chối và bảo vệ bản thân trước các cám dỗ xấu.
Đây là hoạt động thiết thực của tuổi trẻ Bắc Ninh hưởng ứng Ngày Pháp luật Việt Nam (9/11), nhằm tôn vinh Hiến pháp, pháp luật, khẳng định vị trí, vai trò của pháp luật trong đời sống xã hội, góp phần xây dựng môi trường học đường an toàn, lành mạnh, không có tệ nạn.
Ngay sau chương trình tuyên truyền là vòng chung kết cuộc thi “Tìm kiếm tài năng” Trường THPT Hàn Thuyên năm 2025, với sự góp mặt của 10 đội thi xuất sắc đến từ các chi đoàn. Các tiết mục ca – múa – kịch được dàn dựng công phu, truyền tải thông điệp về tình yêu quê hương, đất nước, niềm tự hào dân tộc và tôn vinh giá trị văn hóa truyền thống.
Kết thúc cuộc thi, Ban tổ chức đã trao 2 giải A, 3 giải B, 5 giải C cùng giải Tiết mục có hiệu ứng lan tỏa giáo dục truyền thống cho các đội đạt thành tích cao.
Cuộc thi là một trong những hoạt động ý nghĩa do Tỉnh Đoàn Bắc Ninh chủ trì, nhằm đồng hành cùng thanh niên trong rèn luyện kỹ năng, phát triển thể chất và nâng cao đời sống tinh thần. Đây cũng là hoạt động thiết thực chào mừng Đại hội Đoàn TNCS Hồ Chí Minh tỉnh Bắc Ninh lần thứ I, nhiệm kỳ 2025 – 2030 và kỷ niệm Ngày Nhà giáo Việt Nam 20/11."
