url,title,description,content
https://tienphong.vn/nsut-kieu-hung-duoc-dua-ve-viet-nam-an-tang-post1794595.tpo,NSƯT Kiều Hưng được đưa về Việt Nam an táng,"TPO - Tâm nguyện lớn nhất của NSƯT Kiều Hưng trước khi mất là được trở về quê hương - nơi ông đã sinh ra, trưởng thành và cống hiến cho nghệ thuật. Đại diện gia đình nghệ sĩ chia sẻ với Tiền Phong về kế hoạch đưa tro cốt NSƯT Kiều Hưng về an táng tại Việt Nam.","Tối 8/11 theo giờ Việt Nam, gia đình NSƯT Kiều Hưng chia sẻ thông tin tang lễ của nhạc sĩ ở Đức. Lễ tưởng niệm và tiễn biệt NSƯT Kiều Hưng diễn ra lúc 10h sáng 14/11 tại Berlin (Đức). Anh Kiều Hoàng Hải - con trai cố nhạc sĩ - cho biết sau khi hỏa táng, gia đình sẽ đưa tro cốt NSƯT Kiều Hưng về nơi an nghỉ cuối cùng tại Việt Nam.
""Tâm nguyện lớn nhất của NSƯT Kiều Hưng trước khi mất là được trở về quê hương - nơi ông đã sinh ra, trưởng thành và cống hiến cho nghệ thuật. Gia đình đang chờ thủ tục, giấy tờ xuất nhập cảnh để xác định ngày về Việt Nam"", anh Hải nói vớiTiền Phong.
NSƯT Kiều Hưng qua đời rạng sáng 30/10 tại Bệnh viện Vivantes Friedrichshain (Đức), hưởng thọ 88 tuổi. Đại diện gia đình cho biết trước đó nam nghệ sĩ nhập viện trong tình trạng sức khỏe yếu nhưng tinh thần vẫn rất minh mẫn và bình thản. Giai điệubài hátTình ca(nhạc sĩ Hoàng Việt) đưa tiễn nghệ sĩ trong khoảnh khắc cuối đời.
NSƯT Kiều Hưng sinh ra tại Hà Nội, nổi tiếng nhờ những ca khúcHồ Chí Minh đẹp nhất tên người, Tiếng hát thành phố mang tên người, Âm thanh ngày mới, Rặng trâm bầu, Tình ca.Thời đi học, ông từng tham gia đội văn nghệ nghiệp dư của Thành đoàn Thanh niên Hà Nội. Năm 20 tuổi, ông được tuyển vào Đoàn văn công trung ương (sau này là Đoàn ca múa nhạc trung ương).
Nhà thơ Hồng Thanh Quang có nhiều kỷ niệm với NSƯT Kiều Hưng khi tham gia chương trìnhGiai điệu tự hàonăm 2014. Ông kể: ""Khi ấy, sức khỏe của Kiều Hưng đã yếu đi rõ rệt. Người vợ đi cùng ông rất chu đáo và tận tình chăm sóc. Sự xuất hiện của Kiều Hưng đã tạo nên một nỗi xúc động rất lớn cho chương trình.Những nghệ sĩ như Kiều Hưng không chỉ là ngôi sao nghệ thuật mà còn là biểu tượng cho một thời đại. Không ít giá trị tinh thần mà những người như mình có được là nhờ những ca khúc mà các nghệ sĩ như ông đã thể hiện"".
Nhà nghiên cứu Nguyễn Quang Long nhận định NSƯT Kiều Hưng là hình mẫu nghệ sĩ vừa có học thuật, vừa có hồn dân tộc. Ông biết kết hợp kỹ thuật thanh nhạc phương Tây với cảm xúc Việt Nam, hát bằng cả tâm hồn, bằng tình yêu đất nước và con người. Mỗi ca khúc qua giọng ông đều đầy khí thế, hào sảng mà vẫn đằm thắm, sâu lắng. Dù sau này sống xa quê hương nhưng tiếng hát ấy vẫn chan chứa nỗi nhớ và tình yêu hướng về Tổ quốc."
https://tienphong.vn/nhac-si-con-duong-den-truong-nguy-kich-post1794539.tpo,Nhạc sĩ 'Con đường đến trường' nguy kịch,"TPO - Theo thông tin từ MC Quỳnh Hoa, nhạc sĩ Phạm Đăng Khương hiện điều trị tại Khoa Cấp cứu hồi sức thuộc Bệnh viện Quân y 175 (TPHCM) với tình trạng sức khỏe xấu do mắc nhiều bệnh.","Quỳnh Hoa cho biết sức khỏe của nhạc sĩ Phạm Đăng Khương hiện nay khá xấu, theo gia đình cho biết cả tháng naynhạc sĩkhông ăn uống gì được mà phải đặt ống, bơm thức ăn trực tiếp vào dạ dày.
Hiện anh đang bị nhiều căn bệnh cùng lúc như viêm phổi, suy đa tạng, tiểu đường, huyết áp… Nhạc sĩ Phạm Đăng Khương hiện chỉ còn nặng hơn 30 kg.
Nhạc sĩ Phạm Đăng Khương là một trong những nhạc sĩ tài hoa tại TPHCM. Từ năm 1977, khi còn là sinh viên Khoa Toán, Trường ĐH Sư phạm TPHCM, ông đã theo học lớp sáng tác ca khúc ởNhà văn hóa Thanh NiênTPHCM. Sau đó ông trở thành hội viên của Câu lạc bộ Sáng tác trẻ Thành Đoàn. Ông tốt nghiệp bậc đại học - Nhạc viện TPHCM, Khoa Lý luận - Sáng tác - Chỉ huy (năm 1998).
Năm 1991, nhạc sĩ Phạm Đăng Khương làm Trưởng phòng Văn hóa nghệ thuật rồi Phó giám đốc Nhà văn hóa Thanh Niên cho đến khi nghỉ hưu vào năm 2017.
Trong sự nghiệp sáng tác, Phạm Đăng Khương đã để lại dấu ấn với nhiều ca khúc được người nghe yêu thích nhưNhư cơn gió vô tình, Khung trời mơ ước, Con đường đến trường, Gặp mùa xuân qua đây…
Nhiều ca khúc đã giành được những giải thưởng lớn nhưMãi mãi tuổi 20được trao Giải thưởng của Hội Nhạc sĩ Việt Nam,Chỉ có một con đườngđoạt giải A cuộc vận động sáng tác cho tuổi trẻ của Thành Đoàn TPHCM,Từ trái tim đến trái timgiải A trong cuộc thi ca khúc về đám cưới do Thành Đoàn TPHCM tổ chức.
Ngoài ra Phạm Đăng Khương đã tham gia biên tập và thực hiện nhiều đêm nhạc của các nhạc sĩ nổi tiếng như Văn Cao, Trịnh Công Sơn, Nguyễn Văn Thương, Xuân Hồng, Hoàng Hiệp, Phạm Trọng Cầu, Ngô Huỳnh, Diệp Minh Tuyền, Phạm Minh Tuấn, Thế Bảo, Tôn Thất Lập, Trần Long Ẩn... tại TPHCM gây tiếng vang lớn với người yêu nhạc.
Sau khi nghỉ hưu, nhạc sĩ Phạm Đăng Khương không ngừng nghỉ ngơi mà tiếp tục hoạt động sôi nổi trong nhiều lĩnh vực khác như làm các bộ phim du lịch trên đất Mỹ và nhiều nước châu Âu, xây dựng các dự án âm nhạc như tuyển tập bài hát thiếu nhi Mười hai con giáp, tuyển tập 50 ca khúc về lịch sử Việt Nam.
Nhạc sĩ còn tham gia viết sách và đã xuất bản được 2 cuốn sách là tập sách ảnh nghệ thuật Lang thang miền thùy dương (NXB Hội Nhà văn 2022) và tập du ký Chuyện trời ơi đất hỡi (NXB Hội Nhà văn 2017)."
https://tienphong.vn/8-cuoc-hon-nhan-cua-huyen-thoai-elizabeth-taylor-post1793424.tpo,8 cuộc hôn nhân của huyền thoại Elizabeth Taylor,TPO - Nhà thiết kế thời trang Vicky Tiel tiết lộ người chồng được Elizabeth Taylor yêu nhất.,"Vào đầu tháng 10, truyền thông Mỹ đưa tin Fox Nation, dịch vụ phát trực tuyến của Fox News, mua lại bộ phim tài liệuElizabeth Taylor: Rebel Superstar(tạm dịch là Elizabeth Taylor: Siêu sao nổi loạn) do Kim Kardashian hợp tác với Passion Pictures sản xuất.
Fox Nation giới thiệu: “Elizabeth Taylor: Rebel Superstar mang đến cái nhìn sâu sắc về cuộc đời của một trong những phụ nữ biểu tượng nhất thế kỷ 20, lột bỏ vẻ hào nhoáng bên ngoài để khám phá sức mạnh tự nhiên ẩn sau danh tiếng. Mỗi tập phim khám phá cách Taylor phá vỡ rào cản vô hình của Hollywood, xây dựng nên đế chế kinh doanh tỷ USD và thay đổi phong trào hoạt động của người nổi tiếng thông qua những nỗ lực tiên phong trong cuộc chiến chống lại HIV/AIDS”.
Tin tức này càng gây chú ý hơn khi được công bố vào cùng ngày Taylor Swift phát hành album mới,The Life of a Showgirl, trong đó có ca khúc mang tựa đềElizabeth Taylor.
Sau khi lên sóng vào ngày 6/10, phim tài liệu khơi lại sự quan tâm của công chúng đến đời sống tình cảm phức tạp của minh tinh huyền thoại.
Mỹ nhân sinh năm 1932 trải qua 8 cuộc hôn nhân. Trong đó, 7 cuộc hôn nhân kết thúc bằng ly hôn và một bị cắt ngắn do vụ tai nạn máy bay thảm khốc.
Nữ diễn viênCleopatrakết hôn lần đầu vào năm 18 tuổi với Conrad ""Nicky"" Hilton (lúc đó 23 tuổi), người thừa kế chuỗi khách sạn Hilton, vào ngày 6/5/1950. Tuy nhiên, họ tan vỡ chỉ sau 8 tháng. Trong cuốn tự truyệnElizabeth Takes Off(1988), bà tiết lộ người chồng đầu tiên bạo hành bà về cả thể xác lẫn tinh thần.
Họ ly hôn vào tháng 1/1951. Ông Hilton qua đời vào năm 1969 sau khi lên cơn đau tim.
Taylor tổ chức đám cưới lần 2 vào tháng 2/1952 với nam diễn viên người Anh Michael Wilding. Họ gặp nhau khi hợp tác trong bộ phimIvanhoe. Họ có với nhau hai con trai - Michael Jr. (sinh năm 1953) và Christopher (sinh năm 1955).
Họ chung sống trong 5 năm và chia tay trong hòa bình. Khi Wilding qua đời năm 1979, tờThe New York Timesđưa tin nữ diễn viên “rất buồn”. Trong cuộc phỏng vấn trên tạp chí People năm 2006, ngôi sao Hollywood ca ngợi chồng cũ quá cố là người cha tuyệt vời.
Người chồng thứ 3 là nhà sản xuất phim Mike Todd, hơn Taylor 25 tuổi. Theo Taylor, dưới sự chăm sóc yêu thương và nồng nhiệt của Mike, mọi thứ trong bà từ lòng tự trọng đến hình ảnh đều thăng hoa. Họ đến với nhau năm 1957, có chung con gái Liza.
Tuy nhiên, vụ tai nạn máy bay thảm khốc vào ngày 22/3/1958 đã cướp đi của Taylor người chồng mà bà mô tả là “mối tình lớn đầu tiên trong cuộc đời”.
Khi vẫn còn bàng hoàng về cái chết của Todd, Taylor tìm thấy niềm an ủi từ người bạn tốt của chồng quá cố, ca sĩ Eddie Fisher. Họ kết hôn vào ngày 12/5/1959.
Đây là cuộc hôn nhân tai tiếng nhất của Taylor vì lúc yêu nhau, Fisher còn trong cuộc hôn nhân với nữ diễn viên Debbie Reynolds - bạn thân kiêm phù dâu cho Taylor trong đám cưới với Todd.
Trong hồi ký, Taylor chia sẻ cảm thấy đau khổ khi bị gọi là kẻ phá hoại hạnh phúc gia đình người khác. Bà khẳng định Fisher và Reynolds đã trục trặc tình cảm trước khi bà phải lòng người chồng thứ 4.
Về phía Reynolds, trong cuộc phỏng vấn vớiPeoplenăm 1983, bà cho rằng Taylor chỉ lợi dụng Fisher để tìm quên, không hề thật lòng yêu ông.
Mối quan hệ của Taylor với Fisher tan vỡ khi bà phải lòng bạn diễn phimCleopatra(1963), tài tử xứ Wales Richard Burton. Họ ly hôn vào tháng 3/1964.
Cũng trong tháng đó, Taylor và Richard chính thức về chung một nhà. Họ nổi tiếng với lối sống xa hoa và cả những trận cãi vã nảy lửa. Họ xung đột từ những chủ đề vô thưởng vô phạt như thể thao đến do rượu và ghen tuông.
Sau gần một thập kỷ kết hôn và 11 bộ phim đóng chung, mối quan hệ đầy sóng gió của họ kết thúc vào tháng 6/1974. Họ có chung với nhau con gái Maria (SN 1961).
Tuy nhiên, nhờ sự vun vén của con gái, hai ngôi sao điện ảnh tái hôn vào ngày 10/10/1975. Hai người chỉ bên nhau thêm chưa đầy một năm.
Taylor đính hôn với John Warner, thành viên đảng Cộng hòa tại tiểu bang Virginia, vào tháng 9/1976 và kết hôn vào tháng 12 cùng năm. Có người vợ nổi tiếng giúp Warner được bầu vào Thượng viện Mỹ năm 1979.
Trên tờThe New York Timesvào năm 2002, Taylor cho biết họ có tình cảm nhưng không phải là tình yêu của đời nhau. Theo bà, hai người hợp nhau cho đến khi Warner quyết định trở thành chính trị gia.
Họ “đường ai nấy đi” vào năm 1982. Họ vẫn giữ tình bạn sau khi chia tay và cả lúc Taylor kết hôn lần nữa.
Sự ghép đôi cuối cùng là điều không tưởng khi chồng của minh tinh hàng đầu Hollywood lại là một công nhân xây dựng. Larry Fortensky không học hết trung học và ít hơn Taylor 20 tuổi. Địa điểm gặp nhau cũng không lý tưởng, trong trại cai nghiện.
Đám cưới vào ngày 6/10/1991 của cặp đôi cô - cháu do Michael Jackson chủ trì. Con trai cả Michael Wilding Jr. là người dắt tay mẹ vào lễ đường.
Họ ly hôn sau 5 năm sống chung. Fortensky không thích bị truyền thông theo dõi khắp mọi nơi, còn Taylor không chấp nhận một người chồng ăn bám.
Taylor và Fortensky vẫn là bạn sau khi chia tay. Họ thường xuyên nói chuyện với nhau cho đến khi Taylor qua đời vào năm 2011. Taylor đã thề không bao giờ kết hôn nữa sau Fortensky.
Trong cuộc phỏng vấn với tạp chíPeoplevào cuối tháng 10, nhà thiết kế thời trang Vicky Tiel, bạn thân lâu năm kiêm stylist cho Elizabeth Taylor, Richard Burton là người mà Taylor yêu sâu đậm nhất.
“Chắc chắn rồi. Không có gì phải nghi ngờ. Người tình trọn đời của bà ấy là Richard. Bà ấy vui tính. Bà ấy cũng dạy tôi nhiều điều, rằng nếu có chuyện gì không may xảy ra, tôi chỉ cần đảo mắt, mỉm cười và không lo lắng gì cả. Bà ấy luôn cười và vui vẻ”, bà Tiel nói.
Nhà thiết kế thời trang khẳng định dù không ở bên nhau đến cùng, tình yêu họ dành cho nhau vẫn bền chặt.
Nhớ lại cuộc trò chuyện với Burton ngay trước khi ông qua đời vì xuất huyết não vào tháng 8/1984 ở tuổi 58, bà Tiel kể nam diễn viên nhờ bà và chồng lúc đó, chuyên gia trang điểm Ron Berkeley, chuyển lời đến Taylor.
“Trước khi Richard mất, hình như hai ngày trước đó, anh ấy gọi điện cho tôi. Anh ấy nói, 'Anh nghĩ mình không còn sống được bao lâu nữa. Anh chỉ muốn em và Ron nói với Elizabeth rằng anh luôn yêu cô ấy nhất. Anh yêu cô ấy mãi mãi. Anh nhớ và yêu cô ấy bằng cả trái tim mình’”, theo bà Tiel.
Không lâu sau khi Burton qua đời, bà Tiel đến thăm Taylor tại nhà riêng ở khu dân cư Bel-Air (Los Angeles, Mỹ). Nhà thiết kế thấy cảnh nữ diễn viên nằm trong bồn tắm được bao quanh bởi hàng chục bức ảnh của Taylor và Richard.
Trong cuốn sáchFurious Love: Elizabeth Taylor, Richard Burton, and the Marriage of the Century(2011) - tổng hợp những bức thư Burton viết cho Taylor, minh tinh huyền thoại tiết lộ sau khi ly hôn lần hai, cả bà và chồng cũ đều tin họ sẽ tái hôn lần ba.
Taylor giữ cho riêng mình lá thư cuối cùng Burton gửi cho bà trước khi ông qua đời vào năm 1984. Trong thư, ông bày tỏ hạnh phúc nhất khi họ ở bên nhau và tự hỏi liệu còn có cơ hội nào cho cả hai không."
https://tienphong.vn/thap-co-o-hue-bi-ngam-nuoc-tung-xac-lap-ky-luc-the-gioi-post1794464.tpo,Tháp cổ ở Huế bị ngâm nước từng xác lập kỷ lục thế giới,"TPO - Tháp Phú Diên ở Huế là di tích lịch sử, văn hóa độc đáo, được các nhà khảo cổ học tìm thấy vào năm 2001. Di tích này từng xác lập kỷ lục thế giới, hiện bị ngâm trong nước do mưa lớn liên tục tại Huế hơn một tuần qua.","Tháp Chăm Phú Diên - di tích hơn 1.000 năm tuổi ở Huế - bị ngâm nhiều ngày trong nước do mưa lớn liên tục hơn một tuần qua.
Theo các nhà nghiên cứu, những di tích thành trì, cổ tháp, hiện vật và văn hóa phi vật thể mang đậm dấu ấn Champa Huế ở chính là những cứ liệu quan trọng để nghiên cứu và phát triển các giá trị văn hóa, lịch sử nơi đây.
Tháp Phú Diên từng xác lập hai kỷ lục là tháp Chăm cổ chìm sâu dưới cồn cát ven biển được khai quật và bảo tồn đầu tiên tại Việt Nam (do Tổ chức kỷ lục Việt Nam công nhận) và tháp Chăm cổ bằng gạch chìm sâu dưới cồn cát ven biển được khai quật và bảo tồn đầu tiên trên thế giới (do Liên minh kỷ lục thế giới công nhận).
Tháp Phú Diên là di tích lịch sử, văn hóa độc đáo được các nhà khảo cổ học tìm thấy vào năm 2001 (do trước đó bị cát phủ lấp) ở xã Phú Vinh (TP Huế). Ngôi tháp có cấu trúc nguyên khối đất nung, không có mái và có vị trí đơn lẻ, khác xa các di tích tháp Chàm khác.
Đế tháp có hình chữ nhật cắt góc, cao 0,29 m gồm 4 lớp gạch xây liền khít tạo nền vững chắc cho thân tháp. Chân tháp cao 1,25 m, kể cả phần thân và phần vòm cửa giả với nhiều lớp trang trí khác nhau. Thân tháp cao 1,36 m. Lòng tháp hình chữ nhật hướng Đông - Tây, dài 3,9 m, rộng 3,3 m. Giữa có bệ thờ cao 0,73 m, trên bệ có Yoni bằng sa thạch.
Cách 5 m phía trước cửa chính của tháp có một bệ thờ được xây hình khối vuông bằng chất liệu gạch với kỹ thuật mài xếp liền khít, chính giữa bệ còn một lỗ tròn đường kính 0,19 m. Các nhà nghiên cứu cho rằng trước kia đây là nơi đặt tượng thờ.
Dù trải qua khoảng thời gian dài nhưng tháp Phú Diên vẫn có màu gạch đỏ hồng và xốp. Theo nghiên cứu, gạch được làm từ đất sét và nung trong nhiệt độ thấp dưới 800-900 độ C. Tháp được xây bằng kỹ thuật mài chập kết hợp nhớt cây ô dước cùng với nước để tạo sự kết dính. Tại khu vực khai quật, các nhà khoa học còn phát hiện một số đồ cúng tế như hộp gốm, chân đèn.
Nhìn tổng thể, tháp Chăm Phú Diên là khối kiến trúc hình chữ nhật. Càng lên cao càng giật cấp thu nhỏ dần với các thành phần khác nhau như móng tháp, chân đế tháp, thân và diềm mái tháp, dưới móng tháp là lớp đá sạn cuội làm nền cho đế tháp. Theo các chuyên gia nghiên cứu, tháp Chăm Phú Diên là một trong những công trình kiến trúc gạch Champa sớm nhất còn lại ở khu vực miền Trung, khoảng thế kỷ 8.
Trải qua hơn 10 thế kỷ, tháp bị vùi lấp trong cát. Công trình hiện được bảo tồn tại chỗ trong một kiến trúc nhà kính nhằm hạn chế tối đa những tác động tiêu cực của môi trường thiên nhiên.
Năm 2001, di tích này được Bộ Văn hóa - Thông tin (nay là Bộ Văn hóa, Thể thao và Du lịch) quyết định xếp hạng Di tích kiến trúc nghệ thuật cấp quốc gia. Di tích sau đó cũng được trùng tu với các hạng mục như dựng phần mái, vách nhà kính bảo vệ tháp, quét phụ gia chống ăn mòn bề mặt tháp, xây dựng hệ thống thu gom nước xung quanh tháp.
Không chỉ có giá trị lịch sử, tháp Phú Diên còn là địa điểm quan trọng trên bản đồ du lịch địa phương. Việc tháp Chăm Phú Diên được xác lập hai kỷ lục giúp địa phương quảng bá hình ảnh một di tích cũng như hệ thống bãi biển gần đó được nhiều người biết đến hơn. Từ đó mở ra cơ hội, góp phần thúc đẩy phát triển du lịch địa phương.
Trong đợt mưa lũ lịch sử từ ngày 27/10 ở Huế, di tích này bị ngâm lâu ngày trong nước. Có thời điểm phần thân tháp bị ngập nước gần một nửa. Do nằm dưới cồn cát và thấp hơn mực nước biển, nước mưa dồn ứ không thể thoát, toàn bộ khu vực di tích biến thành hố nước tù đọng.
Thứ trưởng Bộ Văn hóa, Thể thao và Du lịch (VHTTDL) Hoàng Đạo Cương đã ký công văn gửi UBND TP Huế về ứng phó và khắc phục thiên tai đối với di tích, bảo tàng tại địa phương.
Lãnh đạo Bộ VHTTDL đề nghị UBND TP Huế chỉ đạo Sở VH - TT TP Huế phối hợp với các cơ quan chuyên môn trên địa bàn xây dựng kế hoạch quản lý nguy cơ thảm họa, nhằm chủ động hơn nữa trong công tác nhận diện, phòng ngừa, ứng phó, giảm thiểu và phục hồi sau rủi ro thiên tai cho các di tích trên địa bàn."
