url,title,description,content
https://tienphong.vn/dien-vien-ly-hung-quyen-gop-tien-cho-van-nghe-si-lon-tuoi-post1794270.tpo,Diễn viên Lý Hùng quyên góp tiền cho văn nghệ sĩ lớn tuổi,"TPO - Thông qua giải Mai Vàng, diễn viên Lý Hùng, NSƯT Võ Minh Lâm, đạo diễn Minh Nguyệt ủng hộ hàng chục triệu đồng tri ân các thế hệ văn nghệ sĩ, nhà trí thức, cách mạng lão thành. Nhiều năm qua, giải thưởng này kết hợp với các chương trình tri ân, hỗ trợ hàng nghìn văn nghệ sĩ có hoàn cảnh khó khăn khắp cả nước.","Sáng 7/11, chương trình giao lưu nghệ thuật hướng đến giải Mai Vàng lần thứ 31 được tổ chức tại TPHCM. Nhiều nghệ sĩ nổi tiếng có mặt và giao lưu với khán giả tại chương trình như NSND Trần Minh Ngọc, NSƯT Ca Lê Hồng, NSND Quế Trân, NSƯT Kim Tử Long, diễn viên Lý Hùng, Bình Minh.
Ông Bùi Thanh Liêm - Trưởng ban tổ chức giải Mai Vàng lần thứ 31, năm 2025 - cho biết trải qua ba thập kỷ, giải thưởng không chỉ tôn vinh những nghệ sĩ có nhiều cống hiến mà còn mở rộng sứ mệnh qua hai hợp phần giàu ý nghĩa làMai Vàng nhân áivàMai Vàng tri ân.Đây là hai hạng mụctôn vinh thế hệ văn nghệ sĩ, những nhà trí thức, cách mạng lão thành, đội ngũ y bác sĩ, nhà giáo đã dành cả cuộc đời cống hiến cho đất nước.
Mai Vàng tri ânđược trao cho nhà thơ Lê Minh Quốc,Mai Vàng nhân áiđược trao cho nghệ sĩ Trang Bích Liễu. Nhà thơ Lê Minh Quốc sinh năm 1959 tại Đà Nẵng. Năm 1977, ông nhập ngũ và trở thành quân tình nguyện hoạt động tại chiến trường Campuchia. Ra quân năm 1983 và trở thành sinh viên khoa Ngữ Văn Đại học Tổng hợp TPHCM. Ông hiện là Chủ tịch Hội đồng thơ Hội Nhà văn TPHCM (nhiệm kỳ 2020-2025).
Nghệ sĩ Trang Bích Liễu tốt nghiệp Trường quốc gia Kịch nghệ Sài Gòn (nay là Nhạc viện TPHCM), được giới chuyên môn đánh giá là ""cô đào trẻ của đợt sóng mới"". Các vai diễn dành cho bà đều để lại ấn tượng đậm nét trong các tác phẩmHòn đảo Thần Vệ Nữ,Đôi mắt tình yêu, Màu xanh mái tóc.
Trong phần giao lưu, các nghệ sĩ chia sẻ kỷ niệm với giải Mai Vàng. Diễn viên Lý Hùng - người từng nhận giải nhờ vai diễn trongTây Sơn hào kiệt -chia sẻ: ""Khi nhận giải Mai Vàng, tôi cảm thấy vô cùng hạnh phúc. Giải Mai Vàng có thêm chương trình trao quà cho các văn nghệ sĩ cao tuổi, đây là hoạt động rất ý nghĩa. Gia đình tôi thường tặng quà cho các văn nghệ sĩ lớn tuổi dịp lễ, Tết, tham gia sửa chữa viện dưỡng lão"".
Nam diễn viên ủng hộ 30 triệu đồng đến quỹ giải thưởngMai Vàng nhân ái.NSƯT Võ Minh Lâm cũng ủng hộ 20 triệu đồng, đạo diễn Minh Nguyệt ủng hộ 10 triệu đồng.
Với NSND Quế Trân, giải thưởng này đánh dấu bước ngoặt quan trọng trong sự nghiệp. Nữ nghệ sĩ từng nhận giải Mai Vàng cùng cha là cố NSND Thanh Tòng. ""Lúc đó tôi còn rất trẻ, non nớt. Khi bước ra sân khấu tại công viên Đầm Sen trước hàng nghìn khán giả, tôi cảm thấy choáng ngợp. Tôi diễn trích đoạnCông Chúa Phi Longvới tất cả niềm đam mê. Giải thưởng này giúp tôi và nhiều nghệ sĩ khác khẳng định giá trị bản thân trong nghề"", NSND Quế Trân nói.
Năm 2025 đánh dấu 6 năm chương trìnhMai Vàng nhân áivàMai Vàng tri ânsong hành với giải Mai Vàng. Đây là giải thưởng thường niên do bạn đọc báoNgười lao độngđề cử và bầu chọn, vinh danh cá nhân, tập thể nghệ sĩ, tác phẩm, chương trình truyền hình được yêu thích nhất trong năm.
Trong 6 năm qua, giải thưởng này kết hợp với các chương trình tri ân, hỗ trợ gần 900 văn nghệ sĩ có hoàn cảnh khó khăn ở 27 tỉnh, thành. Trong đại dịch COVID-19, chương trình là nguồn động viên lớn cho đội ngũ văn nghệ sĩ cả nước."
https://tienphong.vn/tiep-nhan-tai-lieu-quy-cua-nhac-si-an-thuyen-va-vo-vang-post1794255.tpo,Tiếp nhận tài liệu quý của nhạc sĩ An Thuyên và Võ Vang,"TPO - Ngày 7/11, Trung tâm Lưu trữ quốc gia III (Cục Văn thư và Lưu trữ Nhà nước) tổ chức Lễ giới thiệu và tiếp nhận tài liệu của nhạc sĩ An Thuyên và nhạc sĩ Võ Vang - hai gương mặt tiêu biểu của nền âm nhạc Việt Nam hiện đại, đã được tặng giải thưởng Nhà nước về Văn học nghệ thuật.","Đến dự lễ tiếp nhận tài liệu có đại diện gia đình cố nhạc sĩ An Thuyên, nhạc sĩ Võ Vang cùng một số người thân, bạn bè, học trò của hai nhạc sĩ.
Bà Trần Việt Hoa - Giám đốc Trung tâm Lưu trữ Quốc gia III - đại diện Trung tâm tiếp nhận các tài liệu từ năm 1975-2025, bao gồm các tư liệu sáng tác, hợp xướng, khí nhạc và tài liệu tiểu sử của hai nhạc sĩ An Thuyên và Võ Vang.
Thiếu tướng, nhạc sĩ An Thuyên (1949-2015) sinh tại Nghệ An, là một trong những tên tuổi lớn, có ảnh hưởng sâu rộng trong nền âm nhạc Việt Nam hiện đại. Trước 1967, ông tốt nghiệp trường Văn hóa nghệ thuật Nghệ An, sau đó về công tác ở Ty Văn hóa Nghệ An. Năm 1975, nhạc sĩ An Thuyên nhập ngũ, rồi công tác ở Đoàn Văn công Quân khu 4 với vai trò nhạc công.
Năm 1981-1988, ông học tại Nhạc viện Hà Nội (nay là Học viện Âm nhạc Quốc gia Việt Nam), chuyên ngành Sáng tác âm nhạc bậc đại học, sau đó về công tác Phòng Văn nghệ Quân đội.
Năm 1992, ông chuyển về công tác tại Trường Đại học Văn hóa - Nghệ thuật Quân đội, giữ chức Hiệu trưởng từ 1993-2008.
Nhạc sĩ An Thuyên nổi tiếng với những sáng tác giàu âm hưởng dân ca, đặc biệt là dân ca Nghệ Tĩnh, mang tính trữ tình sâu lắng. Các ca khúc tiêu biểu của nhạc sĩ nhưCa dao em và tôi, Neo đậu bến quê, Đêm nghe hát đò đưa nhớ Bác, Hà Tĩnh mình thương, Huế thương, Em chọn lối này…
Ông còn sáng tác nhiều kịch hát, nhạc phim, khí nhạc (như Concerto cho sáo và dàn nhạc giao hưởng) và phần âm nhạc cho khoảng 60 vở kịch nói, tuồng, chèo. Năm 2007, ông được tặng Giải thưởng Nhà nước về Văn học Nghệ thuật với các tác phẩmEm chọn lối này, Đêm nghe hát đò đưa nhớ Bác, Hành quân lên Tây Bắc, Khi xe tăng qua miền quan họ,thanh xướng kịchNguyễn Công Trứ.
Nhạc sĩ Võ Vang tên thật là Vũ Văn Vang, sinh năm 1952 tại tỉnh Thái Bình (nay là tỉnh Hưng Yên). Năm 1970, Võ Vang nhập ngũ. Sau khóa huấn luyện, ông cùng đơn vị được điều vào chiến đấu trong các chiến trường từ Trị Thiên đến Lào và Campuchia. Năm 1971, ông được Quân khu Trị Thiên điều ra Bắc học lớp sử dụng đàn phong cầm cấp tốc để trở lại chiến trường phục vụ các đơn vị quân giải phóng.
Đến năm 1993, ông học Đại học sáng tác tại Nhạc viện Hà Nội. Sau khi tốt nghiệp, ông nhận công tác tại Đoàn Nghệ thuật Quân chủng Phòng không - Không quân với cương vị phó trưởng đoàn phụ trách chuyên môn. Năm 2005, ông làm Giám đốc Trung tâm Văn hóa Thể thao quận Thanh Xuân, Hà Nội. Năm 2012, ông nghỉ hưu và sống tại Hà Nội.
Trưởng thành từ quân đội, nhạc sĩ Võ Vang đã cống hiến trọn đời cho âm nhạc, để lại một sự nghiệp sáng tác phong phú, đặc biệt là dòng nhạc mang tính sử thi, cách mạng và thính phòng. Nhạc sĩ nổi tiếng với khả năng kiến tạo những tác phẩm có quy mô lớn, giàu cảm xúc và sự nghiêm cẩn trong cấu trúc.
Ông có nhiều tác phẩm nổi tiếng nhưDấu chân mẹ(Violon, Cello, Piano),Nơi mặt trăng mặt trời gặp nhau, hợp xướngBiển trời linh thiêng,Mãi mãi là bộ đội Cụ Hồ, ca khúc thiếu nhiMỗi khi nhìn lên ảnh Bác. Nhạc sĩ còn là tác giả của nhiều hợp xướng và tác phẩm khí nhạc thính phòng quan trọng, trong đó nổi bật là hợp xướngBiển trời linh thiêng, thể hiện sự tâm huyết với chủ đề lịch sử và chủ quyền dân tộc. Ông cũng là một trong những tác giả tham gia sáng tác và đạo diễn chương trình nghệ thuật đồ sộ và hoành tráng kỷ niệm 1.000 năm Thăng Long - Hà Nội.
Năm 2022, nhạc sĩ vinh dự nhận Giải thưởng Nhà nước về Văn học nghệ thuật với các tác phẩmNơi mặt trăng mặt trời gặp nhau, Ngẫu hứng Huếvà Hợp xướngBiển trời linh thiêngvà nhiều giải thưởng cao quý khác.
Việc giới thiệu và tiếp nhận tài liệu của hai nhạc sĩ An Thuyên và Võ Vang không chỉ góp phần bảo tồn các giá trị văn hóa, nghệ thuật đương đại mà còn là dịp để tôn vinh những đóng góp của hai nhạc sĩ cho nền âm nhạc Việt Nam."
https://tienphong.vn/noi-dai-tuong-vo-nguyen-giap-quan-sat-tran-dia-dien-bien-phu-post1794237.tpo,Nơi Đại tướng Võ Nguyên Giáp quan sát trận địa Điện Biên Phủ,"TPO - Đài quan sát Pú Tó Cọ nằm ở độ cao 1.700 m trên đỉnh đồi Pú Tó Cọ, thuộc bản Khá, xã Mường Phăng, là vị trí chiến lược nơi Đại tướng Võ Nguyên Giáp từng quan sát chiến trường, đưa ra những quyết định quan trọng làm nên chiến thắng Điện Biên Phủ năm 1954. Hiện di tích này thuộc quần thể Di tích quốc gia đặc biệt chiến trường Điện Biên Phủ và đang được tỉnh Điện Biên định hướng khai thác trở thành sản phẩm du lịch lịch sử - văn hóa.","Di tích này mới được Sở Văn hóa Thể thao và du lịch tỉnh Điện Biên công bố thông tin vào ngày 6/11. Trước đó, Sở Văn hóa, Thể thao và Du lịch tỉnh Điện Biên tổ chức Đoàn công tác gồm hơn 30 thành viên tiến hành khảo sát tuyến tham quan Di tích Đài quan sát Chiến dịch Điện Biên Phủ trên đỉnh Pú Tó Cọ, xã Mường Phăng. Hoạt động nằm trong chương trình công tác năm 2025, hướng tới phát triển sản phẩm du lịch đặc thù gắn với Di tích quốc gia đặc biệt Chiến trường Điện Biên Phủ.
Theo tiếng dân tộc Thái, “Pú Tó Cọ” có nghĩa là “Núi con rồng”, gắn liền với truyền thuyết của địa phương. Nơi đây không chỉ mang giá trị lịch sử mà còn sở hữu cảnh quan hùng vĩ, rừng nguyên sinh xen lẫn bản làng dân tộc Thái, Khơ Mú, tạo điều kiện thuận lợi để phát triển du lịch sinh thái - cộng đồng. Từ đỉnh Pú Tó Cọ, du khách có thể nhìn bao quát toàn cảnh lòng chảo Điện Biên, thấy rõ sân bay Mường Thanh, hồ Pá Khoang cùng những bản làng dưới chân núi.
Đài quan sát Pú Tó Cọ là một phần của hệ thống Di tích Chiến trường Điện Biên Phủ - nơi đã được xếp hạng Di tích quốc gia đặc biệt theo Quyết định số 2367/QĐ-TTg ngày 23/12/2015. Những năm qua, di tích nhận được sự quan tâm đầu tư từ trung ương và địa phương.
Cụ thể, năm 2024, UBND tỉnh Điện Biên phê duyệt quy hoạch phân khu tỷ lệ 1/2.000 quần thể đô thị - dịch vụ - cáp treo Điện Biên Phủ, định hướng xây dựng khu chức năng trong khu du lịch quốc gia gắn với di tích lịch sử, văn hóa và hệ sinh thái tự nhiên đa dạng. Điều này, tạo tiền đề quan trọng để Pú Tó Cọ trở thành hạt nhân trong phát triển du lịch tổng hợp: văn hóa - lịch sử - sinh thái - nghỉ dưỡng.
Mới đây, Sở Văn hóa, Thể thao và Du lịch tỉnh Điện Biên đã tổ chức Đoàn công tác tiến hành khảo sát tuyến tham quan Di tích Đài quan sát Chiến dịch Điện Biên Phủ trên đỉnh Pú Tó Cọ nhằm đánh giá tiềm năng, định hướng khai thác du lịch lịch sử của di tích này. Hoạt động nằm trong chương trình công tác năm 2025, hướng tới phát triển sản phẩm du lịch đặc thù gắn với Di tích quốc gia đặc biệt Chiến trường Điện Biên Phủ.
Kết quả khảo sát sẽ là cơ sở để Sở Văn hóa, Thể thao và Du lịch nghiên cứu, đề xuất giải pháp khai thác, phát triển tuyến du lịch gắn với sinh thái, trải nghiệm và giáo dục truyền thống cách mạng.
Thời gian tới, tỉnh Điện Biên sẽ xây dựng tour Theo dấu chân Đại tướng, tái hiện chiến dịch bằng công nghệ thực tế ảo 3D, tổ chức hoạt động giáo dục truyền thống, kết hợp tham quan các điểm như hầm Đờ Cát, đồi A1, hồ Pá Khoang.
Hiện nay, Đài quan sát Pú Tó Cọ trở thành điểm đến mới của du khách trong và ngoài nước, những người yêu thích trekking, nghiên cứu lịch sử. Chính vì vậy, khai thác du lịch tại Đài quan sát Pú Tó Cọ không chỉ là câu chuyện nâng tầm một di tích lịch sử, mà còn là cơ hội để tỉnh Điện Biên xây dựng Đài quan sát Pú Tó Cọ trở thành biểu tượng mới của du lịch Điện Biên."
https://tienphong.vn/hoi-an-co-nguy-co-mat-danh-hieu-thanh-pho-sang-tao-post1793802.tpo,Hội An có nguy cơ mất danh hiệu thành phố sáng tạo,"TPO - Chuyên gia cảnh báo nguy cơ Hội An mất tư cách pháp nhân độc lập - yếu tố then chốt để duy trì vị thế trong mạng lưới các thành phố sáng tạo của UNESCO, đồng thời đề xuất nhiều giải pháp nhằm củng cố năng lực quản lý và phát triển như thành lập các trung tâm điều phối hoặc trung tâm công nghiệp văn hóa.","Hội thảo khoa họcCơ sở lý luận và kinh nghiệm quốc tế về hoàn thiện thể chế phát triển các ngành công nghiệp văn hóa nhằm góp phần tạo động lực phát triển nhanh và bền vững đất nước trong điều kiện mớido Viện Văn hóa, Nghệ thuật, Thể thao và Du lịch Việt Nam phối hợp với UBND phường Cửa Nam thực hiện vào ngày 4/11 tại Hà Nội.
Hội thảo được tổ chức nhằm góp phần cung cấp luận cứ khoa học, kinh nghiệm quốc tế và các khuyến nghị chính sách cho xây dựng hoàn thiện thể chế phát triển công nghiệp văn hoá của Việt Nam.
""Hội An - thành phố sáng tạo thuộc lĩnh vực thủ công và nghệ thuật dân gian được UNESCO công nhận từ năm 2023, là trường hợp tiêu biểu cho việc được quốc tế thừa nhận như một thực thể sáng tạo trong mạng lưới sáng tạo UNESCO"", PGS.TS Nguyễn Thị Thu Phương nêu.
Vì vậy, đối với những thành phố như Đà Lạt, Hội An, nếu không có cơ chế đặc thù, tư cách pháp nhân đô thị sáng tạo - yếu tố cốt lõi để duy trì tư cách thành viên chính thức của Mạng lưới các thành phố sáng tạo của UNESCO có thể sẽ không còn tồn tại.
Bên cạnh thể chế liên quan đến tư cách pháp nhân trong sân chơi quốc tế, những thể chế liên quan tới đầu tư và tài trợ công cho văn hóa cũng chịu nhiều tác động. Theo TS. Đỗ Quang Minh - Phó Tổng Giám đốc CTCP Trung tâm Triển lãm Việt Nam, việc chuyển giao thiết chế văn hóa có thể phát sinh vướng mắc về hồ sơ pháp lý, định giá tài sản hoặc trách nhiệm quản lý.
Từ trường hợp của Hội An, PGS.TS Nguyễn Thị Thu Phương đề xuất hình thành một mô hình thể chế trung gian để các đô thị sáng tạo như Hội An hay Đà Lạt có thể vừa tuân thủ cấu trúc hành chính hai cấp, vừa duy trì tư cách đại diện và năng lực hành động độc lập trong lĩnh vực sáng tạo.
Theo đó, với Hội An, mô hình thể chế trung gian đó có thể mang hình thức một trung tâm điều phối sáng tạo Hội An. Về mặt hành chính, đơn vị này có thể trực thuộc UBND TP Đà Nẵng hoặc một cơ quan chuyên trách trong lĩnh vực văn hóa. Về mặt sáng tạo, nó vận hành theo cơ chế bán tự chủ, tương tự các trung tâm điều phối sáng tạo ở Jeonju (Hàn Quốc).
Tuy nhiên, chỉ thiết kế một trung tâm điều phối là chưa đủ. Việt Nam cần một thể chế sáng tạo được cả trong nước và quốc tế ghi nhận. Vì vậy, chuyên gia này cho rằng Việt Nam cần đề xuất UNESCO mở rộng phạm vi công nhận từ ""creative city"" (thành phố sáng tạo) sang ""urban creative entity"" (tạm dịch: thực thể sáng tạo đô thị). Đây cũng là bước tiến từ câu chuyện của một đô thị cụ thể sang đóng góp của Việt Nam vào tư duy thể chế văn hóa toàn cầu.
Bên cạnh đó, các chuyên gia cũng đề xuất thành lập trung tâm công nghiệp văn hóa tại nhiều khu vực có đặc thù về lịch sử, thương mại, di sản. Ngoài ra, các chuyên gia cho rằng cần nghiên cứu thành lập các quỹ đầu tư cho di sản và công nghiệp văn hóa, nhằm huy động nguồn lực xã hội hóa, khuyến khích doanh nghiệp và các tổ chức cùng tham gia bảo tồn, phát huy giá trị di sản gắn với sáng tạo và phát triển kinh tế văn hóa."
https://tienphong.vn/gia-dinh-nhac-si-tran-hoan-hien-tang-ky-vat-quy-ve-bac-ho-post1794204.tpo,Gia đình nhạc sĩ Trần Hoàn hiến tặng kỷ vật quý về Bác Hồ,"TPO - Gia đình nhạc sĩ Trần Hoàn đã hiến tặng Bảo tàng Hồ Chí Minh các bản thảo nhạc và lời một số bài hát về Chủ tịch Hồ Chí Minh do nhạc sĩ Trần Hoàn sáng tác. Việc hiến tặng thể hiện sự trân trọng và mong muốn các tài liệu, hiện vật được bảo quản, phát huy giá trị lâu dài tại Bảo tàng Hồ Chí Minh - nơi lưu giữ và lan tỏa di sản vô giá về Người.","Ngày 6/11, tại Hà Nội, Bảo tàng Hồ Chí Minh tổ chức lễ tiếp nhận gần 100 tài liệu, hiện vật quan trọng. Dịp này, bảo tàng tiếp nhận 63 đầu tài liệu, ảnh, tranh do 17 chủ hiện vật hiến tặng. Trong đó có nhiều hiện vật nổi bật như ảnh chụp Chủ tịch Hồ Chí Minh và một số thành viên Chính phủ, ảnh hoạt động của Bộ trưởng Bộ Y tế Hoàng Tích Trí và một số cán bộ ngành y tại chiến khu Việt Bắc, bản sao Tuyên ngôn Độc lập.
Gia đình nhạc sĩ Trần Hoàn hiến tặng các bản thảo nhạc và lời một số bài hát về Chủ tịch Hồ Chí Minh do nhạc sĩ Trần Hoàn sáng tác. Ông Nguyễn Phú Cường (Hà Nội) trao tặng bức ảnh chụp Chủ tịch Hồ Chí Minh và đại diện một số tổ chức, đoàn thể đến chúc mừng sinh nhật lần thứ 60 của Người tại Việt Bắc - Thủ đô kháng chiến năm 1950.
Ngoài ra, Bảo tàng Hồ Chí Minh còn tiếp nhận các bức tranh cổ động đạt giải trong cuộc thi sáng tác tranh cổ động kỷ niệm 135 năm ngày sinh Chủ tịch Hồ Chí Minh.
Tại buổi lễ, đại diện các gia đình và họa sĩ bày tỏ niềm vinh dự và ý nghĩa khi được hiến tặng những tài liệu, hiện vật về Chủ tịch Hồ Chí Minh cho Bảo tàng Hồ Chí Minh. Tất cả thể hiện sự trân trọng và mong muốn các tài liệu, hiện vật được bảo quản, phát huy giá trị lâu dài tại Bảo tàng Hồ Chí Minh - nơi lưu giữ và lan tỏa di sản vô giá về Người.
TS Vũ Mạnh Hà - Giám đốc Bảo tàng Hồ Chí Minh Vũ - nhấn mạnh Chủ tịch Hồ Chí Minh đã để lại di sản đồ sộ cả về tư tưởng, đạo đức, phong cách và tấm gương sống của Người, trong đó có hệ thống tài liệu, hiện vật vô giá, gắn liền với những chặng đường lịch sử của dân tộc.
Việc sưu tầm, gìn giữ, nghiên cứu, phát huy giá trị những tài liệu, hiện vật gắn với cuộc đời, sự nghiệp cách mạng, tư tưởng, đạo đức và phong cách của Chủ tịch Hồ Chí Minh là trách nhiệm thiêng liêng của mỗi tổ chức, cá nhân trước lịch sử, trước nhân dân và các thế hệ mai sau."
https://tienphong.vn/mua-roi-nuoc-viet-nam-diem-sang-tai-le-hoi-quoc-te-sithan-2025-thai-lan-post1794196.tpo,Múa rối nước Việt Nam - Điểm sáng tại Lễ hội Quốc tế Sithan 2025 Thái Lan,"Từ ngày 3 đến 5/11, Lễ hội Sithan 2025 diễn ra tại Đại học Khon Kaen, được xem là sự kiện văn hóa quốc tế lớn nhất khu vực Đông Bắc Thái Lan. Lễ hội năm nay quy tụ hàng chục đoàn nghệ thuật truyền thống trong và ngoài nước tham gia diễu hành, biểu diễn ca múa nhạc và giới thiệu nhiều loại hình văn hóa đặc sắc.","Trong ba ngày, sự kiện thu hút hơn 300.000 lượt khán giả đến trải nghiệm và thưởng thức không gian văn hóa đa dạng của các quốc gia trong khu vực.
Lần đầu tiên tham gia Liên hoan Múa rối quốc tế trong khuôn khổ Lễ hội quốc tế Sithan 2025, đoàn nghệ sĩ Nhà hát Múa rối Việt Nam đã mang đến chương trình biểu diễn thành công, để lại ấn tượng sâu sắc về nghệ thuật sân khấu dân gian, một trong những sản phẩm đặc trưng của nền văn hóa lúa nước Việt Nam.
Các tiết mục múa rối nước kể những câu chuyện mộc mạc về đời sống đồng quê qua chuyển động uyển chuyển của những con rối gỗ trên mặt nước. Khán giả Thái Lan, kiều bào và bạn bè quốc tế như được dẫn dắt vào thế giới sinh động với hình ảnh chú Tễu hóm hỉnh, cảnh đánh cá, cấy lúa, hội làng và những vũ điệu dân gian rộn rã. Nhiều người lần đầu được trải nghiệm loại hình nghệ thuật độc đáo, nơi mặt nước hóa sân khấu và đôi tay nghệ sĩ khéo léo kể nên câu chuyện dân gian bằng ngôn ngữ của rối.
Bên cạnh múa rối nước, các tiết mục rối cạn hiện đại kết hợp ánh sáng, âm nhạc và kỹ thuật sân khấu đã cho thấy sức sống của nghệ thuật múa rối Việt Nam trong dòng chảy đương đại. Những màn biểu diễn như “Vui hội ngày mùa”, “Trẩy hội mùa Xuân” hay “Vũ điệu tâm linh” tạo nên cầu nối hài hòa giữa truyền thống và hiện đại, thể hiện tinh thần sáng tạo, hội nhập của nghệ sĩ Việt.
Chương trình là kết quả hợp tác giữa Tổng lãnh sự quán Việt Nam tại Khon Kaen, Trường Đại học Khon Kaen và Nhà hát Múa rối Việt Nam, thể hiện sinh động vai trò của ngoại giao văn hóa trong việc thúc đẩy quan hệ hữu nghị, hợp tác Việt Nam-Thái Lan. Lãnh đạo Trường Đại học Khon Kaen và Ban Tổ chức đánh giá cao, hoan nghênh sự tham gia của đoàn Việt Nam. Sự chủ động tích cực, thể hiện đậm nét văn hoá truyền thống của Việt Nam đã góp phần làm Lễ hội Sithan 2025 thêm phong phú, hấp dẫn, đồng thời phản ánh tinh thần chủ động hợp tác, giao lưu văn hóa của Việt Nam với các nước trong khu vực.
Đối với cộng đồng người Việt tại Thái Lan, chương trình của Nhà hát Múa rối Việt Nam không chỉ là dịp thưởng thức nghệ thuật quê hương mà còn khơi dậy niềm tự hào về truyền thống văn hóa dân tộc – dòng chảy thiêng liêng kết nối bà con kiều bào với Tổ quốc."
