url,title,description,content
https://tienphong.vn/pham-xuan-an-nhung-dieu-khong-ghi-trong-sach-post1794369.tpo,Phạm Xuân Ẩn - Những điều không ghi trong sách,"TP - Ấn bản kỷ niệm của Phạm Xuân Ẩn – tên người như cuộc đời vừa ra mắt, nhiều bạn đọc gọi đó là “huyền thoại trở lại”. Qua hơn hai thập kỷ, cuốn sách vẫn giữ tròn vai một ấn phẩm “hot” về cuộc đời Thiếu tướng, nhà tình báo, nhà báo Phạm Xuân Ẩn. Nó là cuốn sách duy nhất viết về Phạm Xuân Ẩn được in khi ông còn sống.","Để hoàn thành 20 chương sách, tác giả Nguyễn Thị Ngọc Hải đã kiên trì “đeo bám” nhân vật trong suốt 10 năm. Thực chất, đây cũng là một hành trình không khác gì một nhiệm vụ “điệp báo” theo nghĩa riêng của nghề viết.
“Trước đó tôi không biết gì về ông Ẩn”
Tám mươi tuổi, nhà báo Nguyễn Thị Ngọc Hải vẫn viết và học tiếng Anh hàng ngày. Kết thúc chuyến chơi nhà bà ở Sài Gòn, tôi và TS Hoàng Tố Mai tổng kết: cuộc này thực chất cũng là một tua. Vì những câu chuyện thâm cung bí sử của làng văn luôn được bà Hải kể lại với một giọng hài hước hiếm có.
“Tôi không thể đủ điều kiện viết về ông theo cách chuẩn xác của những điệp vụ. Càng không muốn liệt kê theo các bản khai lý lịch đơn thuần. Tôi muốn tìm ra cái chất “Người Việt trầm lặng” mà Morley hình dung, hoặc là chất honor (phẩm chất danh dự) trong cuộc đời ông mà Peter Ross Range đề nghị. Nhưng sau hết, tôi muốn mọi người Việt Nam được đón lấy những gì dịu dàng nhất, can đảm nhất, yêu thương con người nhất, từ cuộc đời của một con người cao gầy, mỏng manh như cây sậy. Sức mạnh của con người được lấy từ mỏ năng lượng quý báu và thần diệu nào đã ban cho? Cuốn sách là một phần chân dung để chúng ta tự hiểu hình ảnh người Việt cao quý giống như chúng ta đang vẽ ra bản đồ của một tâm hồn”. Nhà báo Nguyễn Thị Ngọc Hải
Trong mấy chục năm làm nghề, bà Hải đã phỏng vấn và viết về hơn 500 nhân vật, trong đó có rất nhiều yếu nhân như Mai Chí Thọ, Hoàng Đạo, Trần Quốc Hương, Phạm Xuân Ẩn… Bà viết nhiều, viết khỏe, và mưu sinh toàn thời gian bằng nghề viết. Trong số hàng chục đầu sách đã xuất bản gồm đủ thể loại: truyện ngắn, tiểu thuyết, ký sự nhân vật, phiếm đàm…, bà bảo tâm đắc nhất là cuốnTôi chết bắt đầu một thếgiới sống nhưng Phạm XuânẨn tên người như cuộc đờimới là tác phẩm mang lại cho bà nhiều tiền bạc nhất. Nhiều tiền bạc ở đây theo nghĩa đen là nhuận bút của số lượng sách đã xuất bản, tái bản.
Kể về cái duyên gặp gỡ với nhà tình báo vĩ đại, bà Hải bảo: “Trước đó tôi không biết gì về ông Ẩn hết. Năm 1992, một người bạn của tôi là bác sĩ Lâm đã giới thiệu ông cho tôi. Mặc dù bảo là “tôi dắt bà đến” nhưng đúng lúc ông Lâm bận, là tôi tự tìm đến nhà ông Ẩn. Tôi gõ cửa và nói lại về cơ duyên biết được ông, ông Ẩn từ chối ngay. Lúc ấy không phải chỉ tôi đâu, ai đến ông ấy cũng chối ngoài cửa hết. Ông ấy bảo: “Tôi đã im lặng nhiều năm rồi nên không có gì để viết cả. Và cái đồ này nó khó nói lắm”. Lúc ấy tôi đã nghĩ có lẽ khó mà moi được gì từ “bố già” của nghề báo. Nhưng tôi vẫn đến nhà ông đều đặn. Tôi chỉ muốn hiểu một con người”.
Thế là bắt đầu từ lý do “Em không biết gì về nghề của anh cả, bây giờ anh có thể giảng cho em nghe không? Để em hiểu thôi”. Rất may ông Ẩn bảo được. Rồi tuần nào bà Hải cũng vác máy ghi âm, vác sổ tới nhà ông ngồi học như một học trò thực thụ. Thế nào là điệp báo, thế là là tình báo, thế nào là tình báo chiến lược… Trong suốt 10 năm đó, những cuộc trò chuyện của bà Hải với ông Ẩn thường bắt đầu vào 9 giờ sáng và kết thúc vào giờ cơm trưa. Cũng có những ngày ông Ẩn gọi điện thoại nói chuyện, trao đổi với bà về những chuyện bình thường trong đời sống của ông. Nhưng thường thấy nhất là ông cứ kể lại rồi bắt dừng: “Cái này không viết được”, hoặc “chuyện này chưa nên nói”.
Khi giải thích cái từ kỹ thuật nghề nghiệp của người tình báo hoạt động độc lập và cô đơn mà thuật ngữ nghề nghiệp Anh - Mỹ gọi là “Lone Wolf” (chó sói cô đơn) ông Ẩn có một thoáng cười hài hước tự trào của người già thông thái: Trong bầy sói thường có con sói đầu đàn dũng mãnh xông pha. Nhưng khi về già, nó không theo kịp bầy đàn nữa, mà thường tách ra, đi một mình kiếm ăn cho qua đời.
Bà Hải bình luận: “Cái hài hước về thân phận người, không chua chát. Có vẻ gì đó ung dung của một người thông minh chấp nhận quy luật của thiên nhiên”.
Không ai nghĩ sách sẽ được in
Khi bản thảo đầu tiên hoàn thành, không ai nghĩ nó sẽ được in. Ngay cả chính tác giả. Bà cất xấp giấy vào ngăn bàn. Nếu không có người bạn tình cờ “đọc trộm” rồi lẳng lặng gửi dự thi, cuốn sách có lẽ đã nằm đó mãi. Vậy là đúng 10 năm kể từ cuộc gặp đầu tiên với Phạm Xuân Ẩn, năm 2002, cuốn sách của Nguyễn Thị Ngọc Hải mới chính thức đưa câu chuyện của nhà tình báo lỗi lạc này “ra ánh sáng”.
Không lâu sau đó, cuốn sách được trao giải A cuộc vận động viết về “Vì an ninh Tổ quốc”, rồi Giải A Văn học 10 năm (1995–2005). Sau đó, bản in lan ra giới nghiên cứu trong và ngoài nước. Giáo sư Larry Berman, tác giảX6 Điệp viên hoàn hảo Phạm XuânẨn(2007) thừa nhận: “Cuốn sách của bà đã mở đường cho tất cả chúng tôi”. Nhà nghiên cứu Thomas Bass, khi viếtKẻthù tuyệt vời của nước Mỹ(2009), cũng dựa vào nhiều gợi mở từ cách kể của bà. Theo tiết lộ của bà Hải,Phạm XuânẨn tên người như cuộc đờihiện đã được mua bản quyền chuyển ngữ sang tiếng Nhật và sẽ phát hành tại xứ sở mặt trời mọc trong thời gian tới.
Dường như không có một lúc nào dễ dàng trong đời ông Ẩn. “Giai đoạn nào gay go nhất trong đời”, bà Hải hỏi, vì biết rằng muốn viết về một cao trào nào đó thì được còn viết về cả cuộc đời ông Ẩn là một điều khó thực hiện. Ông ngẫm nghĩ như rà soát nhanh lại đời mình và bảo: “Nhỏ tới lớn, lúc nào cũng gay go hết”.
Trong rất nhiều cuộc trò chuyện, bà Hải có lần hỏi Phạm Xuân Ẩn vì sao ông chọn nghề báo và giữa nghề báo với công việc tình báo, hai cái đó liên quan thế nào? Ông giải thích nghề báo là một bình phong hoạt động, nói theo kiểu nghề nghiệp của tình báo, nhưng nghề báo đối với ông không phải cái vỏ, không là sự đội lốt trá hình, không phải sự ngụy trang bên ngoài. Phải thực sự sống bằng nghề đó một cách trong sạch, sống mãn đời nghề mới mong tiếp cận được mọi điều. Đó là cả một nghệ thuật sống.
Ông bảo thật ra làm báo rất dễ bị theo dõi, vì báo chí thời đó bị cảnh sát theo dõi dữ lắm. Cách cả cây số có mùi nó rồi. Cứ nghi là chắc. Nó chuyên phủ định, negative, moi móc cái tiêu cực. Xã hội lúc đó giàu và quyền thế áp bức dân nghèo. Nghề báo cần đổ cái tiêu cực của đám quyền thế đó ra. Ông còn kể nhiều chuyện của cán bộ ta coi bình phong chỉ là thứ nghề giả tạo mà không giỏi thật sự, “chết như không”.
Thời kỳ làm báo, ông Ẩn có nhiều “tít” vô cùng vì ông thạo rất nhiều thứ. Bạn bè gọi ông là “chuyên viên đảo chính” vì chuyên viết về các cuộc đảo chính, quân sự; là “tiến sĩ cách mạng” vì viết về thay đổi thời cuộc; là “giảng viên sinh lý, giáo sư sexology” vì hay viết về các cô gái điếm, vũ nữ; là “bác sĩ chó” vì biết chữa bệnh cho chó của các bà bạn đầm. Phạm Xuân Ẩn là nhà báo Việt Nam duy nhất được dự các buổi thuyết trình hạn chế của phái bộ Mỹ.
Làm nghề báo, ông cũng gặp những tình huống nguy hiểm. Để đưa được những tin tức nóng nhất, nhanh nhất cho báo chí, có nhiều phen ông bị gọi lên truy hỏi nguồn tin. Tùy viên báo chí của sứ quán Mỹ cũng tìm cách gạn hỏi ông với tư cách bạn bè: “Ẩn, tao nói thiệt, chắc mày có đọc”? “Đúng”. “Ai đưa”? “Mày biết chính người Mỹ dạy tao làm báo rất kỹ: thà mất việc chứ không nói ra nguồn tin”. “Nguyên tắc nghề nghiệp chính Mỹ dạy, mong anh thông cảm”.
Sau này, các nhà báo phương Tây trở lại Việt Nam đều đến thăm ông, dù biết ông là anh hùng tình báo. Ông nhắn với Frank Mc Culloh, Giám đốc văn phòng tuần báo Time tại Sài Gòn ngày ấy: “Hãy nói với anh ấy tôi không hề là thành viên của chiến dịch đưa tin sai lạc. Những người bạn tốt nhất của tôi trong đời làm báo đều ở Time”. Mc Culloh trả lời rằng: “Tôi không bao giờ giận gì ông Ẩn bởi nếu như tình thế đảo ngược lại thì tôi cũng sẽ làm như ông Ẩn làm khi đất nước bị xâm chiếm. Ông ấy là một người bạn tốt và đáng kính trọng”."
https://tienphong.vn/jack-bi-cam-dien-9-thang-post1794356.tpo,Jack bị cấm diễn 9 tháng,TPO - Ca sĩ Jack (tên thật Trịnh Trần Phương Tuấn) bị Sở Văn hóa và Thể thao Hà Nội xử phạt 55 triệu đồng và cấm diễn 9 tháng do biểu diễn bài hát có ca từ trái với thuần phong mỹ tục tại Hà Nội. Quyết định được Sở ban hành sau quá trình xác minh phản ánh từ khán giả và báo chí về phần trình diễn gây bức xúc của nam ca sĩ.,"Ngày 7/11, Sở Văn hóa và Thể thao Hà Nội ban hành Quyết định xử phạt vi phạm hành chính số 1491/QĐ-XPHC đối với ông Trịnh Trần Phương Tuấn (ca sĩ Jack) về hành vi biểu diễn nghệ thuật có sử dụng từ ngữ trái với thuần phong mỹ tục của dân tộc, gây tác động tiêu cực đến đạo đức, sức khỏe cộng đồng và tâm lý xã hội. Jack bị phạt tiền 55 triệu đồng và đình chỉ hoạt động biểu diễn thời hạn 9 tháng.
Trong chương trình Tuổi thơ dưới ánh trăng (Moonlit Childhood) diễn ra tại phường Bạch Mai, Hà Nội ngày 16/10, phần biểu diễn của Jack được cho là ""gây bức xúc trong dư luận vì có ca từ chưa phù hợp"".
Sau khi nhận được phản ánh từ khán giả và báo chí, Sở Văn hoá và Thể thao Hà Nội khẩn trương vào cuộc xác minh. Kết quả cho thấy công ty mời Jack đưa vào chương trình bài hát không có trong danh mục được Sở chấp thuận, trong đó có một số ca từ bị phản ánh là không phù hợp với thuần phong, mỹ tục. Đại diện công ty thừa nhận sai phạm, nhận trách nhiệm và cam kết khắc phục, không để xảy ra sự việc tương tự.
Đối với cá nhân Jack, Sở đã hai lần mời làm việc. Ngày 29/10, Jack ủy quyền mẹ là bà Trần Thị Cẩm Loan đến Sở làm việc theo giấy mời lần hai. Tại buổi làm việc, bà Loan cho biết bà và ca sĩ Jack “nhận thức rõ ràng, sâu sắc được vi phạm khi biểu diễn bài hát có nội dung ca từ không phù hợp, trái với thuần phong mỹ tục của dân tộc, gây tác động tiêu cực đến cộng đồng xã hội”.
Bà cũng cam kết Jack không tái phạm, đồng thời mong muốn được các cơ quan tạo điều kiện để nam ca sĩ có cơ hội sửa sai và tiếp tục hoạt động biểu diễn, tuân thủ nghiêm túc các quy định của pháp luật.
Sở Văn hóa và Thể thao Hà Nội khẳng định việc xử lý vi phạm được thực hiện theo quy định tại Nghị định 38/2021/NĐ-CP của Chính phủ và Nghị quyết 26/2022/NQ-HĐND của Hội đồng nhân dân thành phố Hà Nội.
Cơ quan này cho biết sẽ tiếp tục tăng cường phối hợp với các đơn vị chức năng để quản lý hoạt động nghệ thuật biểu diễn trên địa bàn, kiên quyết loại bỏ và ngăn chặn những tác phẩm có nội dung trái với thuần phong mỹ tục.
Sở cũng kêu gọi các nghệ sĩ và người hoạt động trong lĩnh vực nghệ thuật biểu diễn tại Hà Nội lan tỏa tinh thần yêu nước, niềm tự hào dân tộc, tình yêu Hà Nội thông qua các hoạt động nghệ thuật văn minh, sáng tạo và nhân văn, hướng tới xây dựng Hà Nội trở thành thành phố sáng tạo và trung tâm tổ chức các sự kiện tiêu biểu của Việt Nam và khu vực châu Á.
Ngày 4/11, Sở Văn hóa và Thể thao Hà Nội ra Quyết định số 1469/QĐ-XPHC, xử phạt Công ty TNHH Dịch vụ Giải trí The East 50 triệu đồng về hành vi tổ chức biểu diễn nghệ thuật không đúng nội dung ghi trong văn bản chấp thuận của cơ quan có thẩm quyền.
Tối 30/10, Công ty J97 Promotion thông báo tạm dừng toàn bộ hoạt động truyền thông và biểu diễn của ca sĩ Jack (Trịnh Trần Phương Tuấn) để “nhìn lại và định hướng con đường sắp tới một cách cẩn trọng hơn”, sau ồn ào liên quan đến bài hát có ca từ phản cảm trong đêm nhạc tại Hà Nội.
Tối 29/10, Jack cho biết đã làm việc với Sở Văn hóa và Thể thao Hà Nội, nhận trách nhiệm và gửi lời xin lỗi công chúng vì “việc sử dụng ngôn từ gây hiểu lầm”. Nam ca sĩ nói sự việc giúp anh ý thức hơn về trách nhiệm văn hóa của người nghệ sĩ, đồng thời cam kết rà soát nội dung sáng tạo và tuân thủ thuần phong mỹ tục trong các sản phẩm sau này."
https://tienphong.vn/ho-ngoc-ha-ung-ho-13-ty-dong-hoa-minzy-gop-15-ty-dong-post1794312.tpo,"Hồ Ngọc Hà ủng hộ 1,3 tỷ đồng, Hòa Minzy góp 1,5 tỷ đồng","TPO - Chỉ trong thời gian ngắn, nhiều nghệ sĩ như Hà Anh Tuấn, Hòa Minzy, Hồ Ngọc Hà, Đức Phúc… ủng hộ hàng tỷ đồng hỗ trợ bà con các vùng ảnh hưởng bão lũ, thiên tai.","Trong đêm nhạc ở Hà Nội tối 6/11, Hồ Ngọc Hà công bố ủng hộ 500 triệu đồng cho đồng bào chịu ảnh hưởng cơn bão số 13.
Nữ ca sĩ chia sẻ: ""Tôi là người con của miền Trung. Tôi biết những đóng góp của mình trong thời gian qua vẫn chưa đủ và muốn được đóng góp nhiều hơn nữa. Trên đường đến show diễn, tôi biết cơn bão số 13 đã đi qua nhiều địa phương của nước ta, tôi cầu nguyện cho mọi người bình an. Với tôi, cuộc sống như bây giờ đã đủ. Còn bản thân tôi từ lâu không còn màng đến những điều khác, chỉ mong giữ được những gì mình đang có, thật dài lâu. Vì thế, trong buổi tối này, lương của tôi sẽ chia cho nhiều người hơn, như ban nhạc, ê-kíp và đặc biệt tôi xin được trích một phần là 500 triệu đồng dành cho người dân chịu ảnh hưởng bởi bão số 13”.
Trước đó, Hồ Ngọc Hà góp 500 triệu đồng cho đồng bào khắc phục hậu quả cơn bão Bualoi thông qua Ủy ban Mặt trận Tổ quốc Việt Nam TPHCM. Sau đó, cô ủng hộ 100 triệu đồng cho người dân Huế sau trận lụt lịch sử ngày 30/10.
Ngày 4/11, Hồ Ngọc Hà tiếp tục gửi thêm 200 triệu đồng hỗ trợ người dân Đà Nẵng và Huế.
Như vậy, chỉ trong vòng một tháng, Hồ Ngọc Hà ủng hộ tổng số tiền 1,3 tỷ đồng cho người dân chịu ảnh hưởng bởi bão lũ, thiên tai.
Hôm 31/10, ca sĩ Hà Anh Tuấn và công ty Việt Vision đã đồng hành với T.Ư Đoàn, ủng hộ 500 triệu đồng hỗ trợ đồng bào bị ảnh hưởng bão lũ tại Quảng Trị, Huế và Đà Nẵng. Đầu tháng 10, nam ca sĩ góp 50.000 USD (tương đương hơn 1,3 tỷ đồng) cho người dân khắc phục hậu quả sau cơn bão Bualoi.
Tương tự, ca sĩ Hòa Minzy góp số tiền 1,5 tỷ đồng cho đồng bào ảnh hưởng thiên tai trong thời gian qua. Cụ thể, cô gửi 500 triệu đồng tới Ủy ban Mặt trận Tổ quốc tỉnh Bắc Ninh, 100 triệu đồng đến tỉnh Thái Nguyên, 100 triệu đồng cho Cao Bằng, 100 triệu đồng cho Huế, 100 triệu đồng cho Đà Nẵng, 300 triệu đồng cho người dân bị ảnh hưởng bởi cơn bão Bão Bualoi và 300 triệu đồng cho bà con tại tỉnh Nghệ An - nơi chịu thiệt hại từ cơn bão số 3.
Không chỉ chuyển tiền, Hòa Minzy liên tục cập nhật tình hình cơn bão kèm lời động viên, nhắc nhở người dân giữ an toàn, cách liên hệ cơ quan chức năng trong tình huống khẩn cấp.
“Tình hình cơn bão sao rồi hả mọi người ơi? Thiên tai diễn biến phức tạp quá, hy vọng người dân luôn trong tâm thế sẵn sàng ứng phó với bão lũ. Ưu tiên bảo vệ tính mạng trước, còn người còn của. Không chủ quan ngay cả những nơi quen với bão lũ. Ngay khi có yêu cầu của các cấp chính quyền về việc di dời, mong bà con nghe theo chỉ đạo và dời khỏi nơi ở nếu nhà mình không đảm bảo khi bão tới. Đặc biệt các ngôi nhà ở tạm, gần sông suối ao hồ và không có tầng cao, không kiên cố. Còn các gia đình có 2-3 tầng nhà thì chuẩn bị sẵn nước sạch, nước lọc và bếp ga mini, gạo và mắm muối, mỳ tôm, lương thực dễ nấu nướng, đèn pin, sạc dự phòng hay có máy tích điện càng tốt. Mỗi nhà hãy chuẩn bị áo phao cá nhân là phương án tốt nhất, đừng chờ ai tới phát. Cầu trời cho bão tan không ảnh hưởng đến đất liền nước ta, mong bà con mình bình an”, dòng trạng thái của Hòa Minzy ngày 5/11.
Ngoài ra, nhiều nghệ sĩ ủng hộ đồng bào chịu ảnh hưởng bão lũ, thiên tai số tiền lớn như Đức Phúc (1,4 tỷ đồng), Mỹ Tâm (1,4 tỷ đồng), Tùng Dương và những người bạn (một tỷ đồng), Trấn Thành (700 triệu đồng)…"
https://tienphong.vn/viet-nam-eu-chon-yen-tu-lam-diem-hen-van-hoa-post1794305.tpo,Việt Nam - EU chọn Yên Tử làm điểm hẹn văn hóa,"TPO - Ngày 7/11, tại Khu di tích danh thắng Yên Tử, Bộ Ngoại giao phối hợp với UBND tỉnh Quảng Ninh và Phái đoàn Liên minh châu Âu (EU) tại Hà Nội tổ chức Ngày Việt Nam - EU với chủ đề Việt Nam - EU: Nhịp cầu văn hoá vì tương lai bền vững, nhân kỷ niệm 35 năm thiết lập quan hệ ngoại giao Việt Nam - EU.","Phát biểu tại sự kiện, Thứ trưởng Bộ Ngoại giao Lê Thị Thu Hằng nhấn mạnh 35 năm qua, quan hệ Việt Nam - EU đãphát triển toàn diệntừ chính trị, ngoại giao, kinh tế, thương mại đến giáo dục, văn hóa, đặc biệt được củng cố sau khi hai bên thiết lập quan hệ Đối tác và hợp tác toàn diện năm 2012.
Bà khẳng định giao lưu văn hóa,giao lưu nhân dânluôn là một trong những trụ cột quan trọng, góp phần tăng cường hiểu biết, tin cậy và gắn kết giữa nhân dân Việt Nam và các nước thành viên EU, trong đó có hợp tác hỗ trợ bảo tồn di sản, bảo vệ môi trường và gìn giữ bản sắc văn hóa, nhất là văn hóa cộng đồng dân tộc thiểu số.
Thay mặt lãnh đạo tỉnh Quảng Ninh, Phó Chủ tịch UBND tỉnh Nguyễn Văn Công gửi lời chúc mừng tới Chính phủ vànhân dân các nước EU, đồng thời giới thiệu Quảng Ninh là địa phương sở hữu hai Di sản thế giới là vịnh Hạ Long và Quần thể Yên Tử - Vĩnh Nghiêm - Côn Sơn, Kiếp Bạc, cùng hàng trăm di sản văn hoá vật thể, phi vật thể.
Quảng Ninh xác địnhvăn hóa là nền tảngvà động lực cho phát triển bền vững, tiên phong chuyển đổi mô hình tăng trưởng từ “nâu” sang “xanh”, phát triển công nghiệp văn hoá, du lịch di sản và ứng dụng công nghệ số trong quảng bá hình ảnh. Tỉnh bày tỏ mong muốn mở rộng hợp tác với EU trong các lĩnh vực năng lượng tái tạo, giáo dục, bảo tồn di sản và du lịch bền vững.
Ngày Việt Nam - EU là sáng kiến do Bộ Ngoại giao khởi xướng, đang dần trở thành hoạt động thường niên có sức lan tỏa, góp phần nâng cao nhận thức cộng đồng về ứng xử có trách nhiệm với môi trường,di sản thiên nhiênvà văn hóa, qua đó thắt chặt hơn nữa quan hệ Việt Nam - EU hướng tới tương lai phát triển xanh, bao trùm và bền vững.
Trong khuôn khổ sự kiện, các đại biểu EU và khách mời tham quan chùa Hoa Yên, tìm hiểu không gian thiền phái Trúc Lâm Yên Tử - một trong những điểm nhấn của Quần thể Yên Tử - Vĩnh Nghiêm - Côn Sơn, Kiếp Bạc vừa được UNESCO công nhận là Di sản văn hóa thế giới."
