url,title,description,content
https://tienphong.vn/khu-dat-du-an-do-thi-moi-o-gia-lai-bi-chiem-dung-duoc-giai-cuu-post1791812.tpo,Khu đất dự án đô thị mới ở Gia Lai bị chiếm dụng được 'giải cứu',"TPO - Một lượng lớn phương tiện, thiết bị từng “vây ráp” khu đất của dự án Khu Đô thị mới Long Vân đã được di dời, công trình tạm bợ cũng được tháo dỡ để trả mặt bằng.","Liên quan đến tình trạng đất thuộcKhu đô thị mới Long Vân(phường Quy Nhơn Bắc, tỉnh Gia Lai) bị một số cá nhân chiếm dụng làm bãi đậu xe, tập kết thiết bị trái phép, ngày 30/10, qua ghi nhận việc di dời đã được thực để trả lại mặt bằng dự án.
Trước đó, nhưTiền Phongphản ánh, một diện tích đất nằm trong dự án Khu đô thị mới Long Vân đang bị các cá nhân chiếm dụng mặt bằng để làm bãi đậu xe, sửa xe, tập kết thiết bị.
Khu đô thị mới Long Vân đượcquy hoạch trở thành trung tâm phát triển mới, góp phần tạo diện mạo mới cho TP. Quy Nhơn, tỉnh Bình Định cũ (nay thuộc phường Quy Nhơn Bắc, tỉnh Gia Lai). Khu đất hiện đang thuộc Trung tâm Phát triển quỹ đất tỉnh Gia Lai quản lý, đang thực hiện giải phóng mặt bằng.
Theo lãnh đạo Trung tâm Phát triển quỹ đất tỉnh Gia Lai, tình trạng chiếm dụng trái phép nêu trên đã diễn ra nhiều năm trước. Sau sáp nhập, trung tâm mới tiếp nhận dự án.
Vừa qua, thực hiện chỉ đạo của UBND tỉnh Gia Lai về việc khẩn trương triển khai phương án giải quyết vướng mắc 8dự án tồn đọngkéo dài (trong đó có công trình Hạ tầng kỹ thuật Khu Đô thị mới Long Vân), để chuẩn bị tiếp tục triển khai thi công hoàn thiện, qua kiểm tra hiện trường Trung tâm Phát triển quỹ đất tỉnh này phát hiện một số cá nhân chiếm dụng mặt bằng khu đất để làm bãi đậu xe và tập kết hàng hoá gây mất mỹ quan và cản trở việc thi công.
Trung tâm Phát triển quỹ đất tỉnh Gia Lai sau đó đã có đề nghị UBND phường Quy Nhơn Bắc phối hợp giải quyết.
Theo UBND phường Quy Nhơn Bắc, sau khi tiếp nhận thông tin và báo chí phản ánh, đơn vị đã chỉ đạo các cơ quan kiểm tra thực tế và phát hiện 6 trường hợp đang chiếm dụng đất tại đây.
Liên quan sự việc này, ngày 15/10, ông Nguyễn Hữu Quế - Phó Chủ tịch UBND tỉnh Gia Lai, cũng đi kiểm tra hiện trường. Theo đó, ông Quế giao UBND phường Quy Nhơn Bắc chủ trì, phối hợp với Trung tâm Phát triển quỹ đất và các cơ quan, đơn vị có liên quan tổ chức làm việc, tuyên truyền, vận động các hộ dân đangchiếm dụngmặt bằng khẩn trương di dời công trình tạm, máy móc, thiết bị ra khỏi phạm vi giải phóng mặt bằng dự án.
Trường hợp các hộ dân cố tình không chấp hành, UBND phường Quy Nhơn Bắc chủ trì, phối hợp với các cơ quan liên quan rà soát, hoàn thiện hồ sơ, thực hiện các biện pháp cưỡng chế, tháo dỡ, di dời theo đúng quy định pháp luật; hoàn thành việc bàn giao mặt bằng sạch cho Trung tâm Phát triển quỹ đất tỉnh trước ngày 30/10.
Lãnh đạo UBND tỉnh Gia Lai cũng yêu cầu Trung tâm Phát triển quỹ đất tỉnh khẩn trương đẩy nhanh tiến độ thi công, hoàn thiện xây dựng hạ tầng kỹ thuật Khu đô thị mới Long Vân theo dự án đã được phê duyệt; sớm hoàn thành, đưa công trình vào sử dụng đúng tiến độ, đồng thời tổ chức bàn giao cho đơn vị quản lý, sử dụng theo quy định.
Hiện Trung tâm Phát triển quỹ đất tỉnh Gia Lai đang trình Sở Xây dựng để thẩm định khối lượng lại của dự án Hạ tầng kỹ thuật Khu Đô thị mới Long Vân để tiếp tục triển khai thi công hoàn thiện."
https://tienphong.vn/nha-dau-tu-phia-bac-do-xo-vao-nam-mua-bat-dong-san-post1791627.tpo,Nhà đầu tư phía Bắc 'đổ xô' vào Nam mua bất động sản,"TPO - Dòng vốn của nhà đầu tư Hà Nội chuyển hướng vào TPHCM và vùng phụ cận không chỉ để săn giá rẻ mà để đa dạng hóa danh mục đầu tư, tối ưu giá trị khai thác thực và hiệu quả sử dụng vốn.","Báo cáo của Hội Môi giới Bất động sản Việt Nam (VARS) cho thấy, thị trường bất động sản đang chứng kiến một làn sóng dịch chuyển vốn đầu tư mạnh mẽ từ khu vực phía Bắc vào các thị trường trọng điểm phía Nam, đặc biệt là TPHCM và các tỉnh lân cận.
Theo VARS, dù nguồn cung mới gia tăng, giá nhà đất tại Hà Nội vẫn liên tục lập đỉnh trong suốt thời gian qua. Dữ liệu nghiên cứu của Viện nghiên cứu đánh giá thị trường BĐS Việt Nam (VARS IRE) cũng cho thấy, trong 9 tháng đầu năm 2025, thị trường Hà Nội ghi nhận khoảng 22.000 căn hộ mở bán mới, tương đương 64% tổng nguồn cung của năm 2024 và là mức cao nhất cùng kỳ giai đoạn 2019 - 2025. Trong đó, căn hộ chung cư tiếp tục nắm vai trò chủ đạo, chiếm tới 76% tổng nguồn cung mới.
Tuy nhiên, giá bán không hề hạ nhiệt, thậm chí “nóng” hơn khi các dự án mở bán mới có mức giá trên 100 triệu đồng/m2 ngày càng phổ biến. Chỉ số giá chung cư hiện tại so với quý I/2019 đã tăng hơn 96% và gấp 1,7 lần mức tăng của TPHCM cũ cùng giai đoạn.
Giá nhà “neo” cao khiến biên độ tăng giá thu hẹp, giảm sức hấp dẫn với dòng vốn đầu tư. Đồng thời, giá trị vốn cũng vượt xa khả năng tài chính của nhiều nhà đầu tư, khiến dòng tiền bắt đầu dịch chuyển ra khỏi Hà Nội để tìm kiếm cơ hội mới tại các thị trường có mức giá hợp lý và dư địa tăng trưởng cao hơn.
Đáng chú ý, báo cáo của VARS chỉ ra, ngoài tập trung tại các tỉnh vùng ven Hà Nội có hạ tầng kết nối hoàn thiện, dòng tiền đang dịch chuyển mạnh mẽ vào khu vực miền Nam.
Ông Nguyễn Thái Bình, Tổng giám đốc Đông Tây Land kiêm Phó tổng Thư ký VARS cho biết, thống kê sơ bộ từ một số chủ đầu tư cho thấy, khách hàng miền Bắc chiếm khoảng 20% tổng giao dịch tại phía Nam trong nửa đầu năm nay, gấp đôi cùng kỳ năm ngoái. Đến cuối quý III/2025, tỷ lệ này đã đạt 30%, gần bằng giai đoạn sôi động 2016 - 2020.
Theo đó, khu vực miền Nam thu hút dòng vốn nhờ mặt bằng giá duy trì ở mức tích lũy suốt 3 năm qua, tạo dư địa tăng trưởng và biên lợi nhuận hấp dẫn cho nhà đầu tư. Một số khu vực vùng ven TPHCM cũ, bao gồm các địa phương sáp nhập, mặt bằng giá còn thấp hơn Hà Nội 30 - 40%, trong khi hạ tầng kết nối và tốc độ đô thị hóa tăng mạnh.
Chẳng hạn, với 2 - 4 tỷ đồng, tại Hà Nội chỉ có thể mua căn hộ 1 phòng ngủ hoặc 1+1, thì tại TPHCM, nhà đầu tư có thể lựa chọn đa dạng hơn, từ căn hộ đến nhà đất riêng lẻ. Đáng chú ý, giá một số dự án mở bán mới tại khu vực vùng ven TPHCM hiện chỉ bằng 2/3 so với các khu vực ven đô Hà Nội, giúp biên độ tăng giá trong trung và dài hạn hấp dẫn hơn.
Dòng vốn nhà đầu tư Hà Nội chuyển hướng vào TPHCM và vùng phụ cận không chỉ để săn giá rẻ mà để đa dạng hóa danh mục đầu tư, tối ưu giá trị khai thác thực và hiệu quả sử dụng vốn. So với Hà Nội, thị trường bất động sản TPHCM có sự phân hóa rõ nét về phân khúc hơn, với các sản phẩm căn hộ hàng hiệu, có pháp lý hoàn chỉnh, vị trí đắc địa, không gian sống xa hoa cùng hệ thống tiện ích thượng lưu.
“Đây là dòng sản phẩm phù hợp với các nhà đầu tư có tiềm lực tài chính mạnh, có nhu cầu tích lũy tài sản lâu dài, khi mang lại giá trị sinh lời kép, vừa có tiềm năng tăng giá trong dài hạn, vừa khai thác cho thuê hiệu quả với tỷ suất sinh lời tốt hơn Hà Nội”, đại diện VARS nói.
Xu hướng “Nam tiến” còn được thúc đẩy bởi sự trở lại của hàng loạt các chủ đầu tư lớn tại miền Nam sau khi được tháo gỡ pháp lý, cùng các chiến dịch truyền thông mạnh mẽ. Đặc biệt, nhiều nhà đầu tư cá nhân từ Hà Nội có xu hướng đi cùng các chủ đầu tư quen thuộc khi họ mở rộng dự án về phía Nam, tận dụng lợi thế hiểu rõ về thương hiệu và năng lực triển khai.
Một yếu tố quan trọng khác giúp củng cố sức hút đầu tư là chính sách phát triển hạ tầng và động lực quy hoạch vùng sau sáp nhập hành chính TPHCM mới. Nhiều dự án mới hiện nay bám sát các tuyến metro, đường vành đai, trục giao thông huyết mạch, nâng cao khả năng kết nối liên vùng và gia tăng giá trị tài sản trong tương lai, đặc biệt hấp dẫn nhà đầu tư Hà Nội.
VARS IRE cho rằng, làn sóng Nam tiến của dòng tiền đầu tư bất động sản đang ngày càng mạnh mẽ. Miền Nam, đặc biệt là khu vực TPHCM đang dần trở thành điểm đến mới nhờ mặt bằng giá hợp lý, hạ tầng bứt tốc và khung pháp lý được cải thiện.
Tuy nhiên, nhà đầu tư cần chọn lọc kỹ phân khúc, đánh giá khả năng tài chính và ưu tiên chiến lược dài hạn (thay vì kỳ vọng lợi nhuận nhanh) để đảm bảo an toàn và hiệu quả trong bối cảnh thị trường đang tái cấu trúc."
https://tienphong.vn/bds-can-tho-soi-dong-9-thang-dau-2025-nam-long-ii-central-lake-khang-dinh-vi-the-do-thi-trung-tam-voi-phap-ly-chuan-post1791445.tpo,"BĐS Cần Thơ sôi động 9 tháng đầu 2025, Nam Long II Central Lake khẳng định vị thế đô thị trung tâm với pháp lý chuẩn","Theo báo cáo quý 3/2025 của Property Guru, thị trường BĐS Cần Thơ tiếp tục trở thành một trong những khu vực được quan tâm hàng đầu tại miền Nam. Trong đó, Nam Long II Central Lake trở thành tâm điểm khi ra mắt tiếp quỹ đất nền và shophouse với pháp lý hoàn chỉnh, mang đến giải pháp an cư – đầu tư bền vững cho khách hàng dịp cuối năm.","Cần Thơ nằm trong Top 4 thị trường bất động sản sôi động nhất miền Nam
Báo cáo quý 3/2025 của Property Guru cho thấy mức độ quan tâm đến bất động sản tăng mạnh so với quý trước, đánh dấu quý thứ ba liên tiếp thị trường phục hồi tích cực. Bên cạnh đó, sự phát triển đồng bộ của hạ tầng, chiến lược quy hoạch liên vùng sau sáp nhập cùng mặt bằng lãi suất thấp và dòng vốn đầu tư quay trở lại đã tiếp thêm niềm tin cho thị trường các tháng cuối năm.
Trong bức tranh chung của thị trường, Cần Thơ gây chú ý khi nằm trong Top 4 thị trường được quan tâm nhất tại miền Nam sau TP.HCM mở rộng (có Bình Dương và Bà Rịa Vũng Tàu), Đồng Nai và Long An . Chỉ trong ba năm, giá bất động sản tại nhiều khu vực trọng điểm tại Cần Thơ đã tăng từ 10 - 40% , phản ánh xu hướng dịch chuyển dân cư và dòng vốn đầu tư.
Sau khi hợp nhất với Hậu Giang và Sóc Trăng, Cần Thơ mở rộng địa giới lên hơn 6.360 km², dân số đạt 4,2 triệu người – chính thức trở thành đô thị trung tâm vùng ĐBSCL, giữ vai trò cửa ngõ giao thương quốc tế và là hạt nhân kết nối kinh tế nội vùng.
Các chuyên gia nhận định, việc triển khai khu hành chính mới quy mô 20 ha tại Nam Cần Thơ trở thành động lực mới thúc đẩy thị trường bất động sản tăng trưởng mạnh mẽ. Đây hiện là nơi quy tụ nhiều khu dân cư và công trình hạ tầng xã hội được quy hoạch bài bản, trong đó Nam Long II Central Lake – khu đô thị tích hợp 43,8 ha do Tập đoàn Nam Long phát triển, được xem là điểm nhấn kiến tạo diện mạo đô thị hiện đại cho thành phố.
Nam Long II Central Lake dẫn đầu thị trường Cần Thơ nhờ nguồn cung pháp lý chuẩn
Nam Long II Central Lake khẳng định vị thế đô thị đáng sống bậc nhất tại Cần Thơ, nơi cư dân có thể sống – làm việc – học tập – vui chơi – giải trí trong không gian được quy hoạch theo tiêu chuẩn quốc tế. Dự án dành hơn 60% diện tích cho cây xanh, mặt nước và tiện ích công cộng, với hơn 30 tiện ích gồm hồ trung tâm rộng 3ha, công viên, tuyến dạo bộ ven hồ, cụm sân thể thao với 11 sân pickleball, trường học, khu thương mại… tất cả cùng kiến tạo nên một môi trường sống năng động, an toàn và phù hợp cho mọi thế hệ.
Bên cạnh đó, khu đô thị kết nối nhanh chóng đến khu hành chính mới, trung tâm thương mại, trường học và các tuyến cao tốc trọng điểm trong khu vực.
Ở góc độ đầu tư, Nam Long II Central Lake hội tụ đầy đủ các yếu tố của một tài sản đầu tư an toàn, bền vững: quy hoạch theo mô hình tích hợp với hệ tiện ích đồng bộ, pháp lý hoàn chỉnh, chủ đầu tư uy tín, hạ tầng hiện hữu với tiềm năng khai thác thực tế. Quỹ hàng mới gồm đất nền và shophouse xây sẵn sắp mở bán nhanh chóng trở thành tâm điểm của thị trường.
Toàn bộ đất nền đã có sổ hồng, sẵn sàng giao dịch và chuyển nhượng, phù hợp với nhóm khách hàng tìm kiếm tài sản đầu tư chắc chắn hoặc tích lũy dài hạn. Các căn shophouse đã sẵn sàng bàn giao ngay phục vụ nhu cầu ở hoặc khai thác kinh doanh. Hai dòng sản phẩm này đáp ứng cùng lúc ba yếu tố: pháp lý rõ ràng - đa công năng - tiềm năng sinh lời cao, được đánh giá là hạng mục đầu tư “hàng hiếm” tại Cần Thơ.
Chính sách bán hàng đặc biệt củA Nam Long II Central Lake
Ưu đãi dành riêng dịp cuối năm
• Tặng gói hoàn thiện cơ bản trị giá đến 500 triệu đồng, áp dụng cho 33 căn shophouse đầu tiên
• Chiết khấu hấp dẫn đến 11%
• Ưu đãi lãi suất 0% trong 18 tháng
• Hỗ trợ vay ngân hàng tối đa 65% giá trị sản phẩm
Ưu đãi tri ân đặc biệt – Kỷ niệm 33 năm Nam Long
• Chiết khấu thêm 3,3% dành riêng cho khách hàng trong dịp kỷ niệm
• Tặng 24 tháng miễn phí phí quản lý vận hành"
https://tienphong.vn/nha-pho-100m2-thiet-ke-khong-phong-khach-post1790309.tpo,Nhà phố 100m2 thiết kế không phòng khách,"TPO - Một ngôi nhà phố hai tầng, xây trên khu đất 100 m² ở khu đô thị mới tại Đà Nẵng, được thiết kế với triết lý bỏ hẳn phòng khách truyền thống thay vào đó, khu bếp liền bàn ăn và sân sau trở thành điểm kết nối chính của gia đình 4 thành viên.","Căn nhà có mặt tiền hướng Đông - Tây, chịu nhiều ảnh hưởng khí hậu miền Trung, được xử lý bằng các hình khối đơn giản, các mảng tường đặc–rỗng, giúp điều tiết ánh sáng và thông gió hiệu quả.
Không gian tầng một là khu sinh hoạt mở: từ bếp-ăn nối thẳng sân sau, ánh sáng và gió tự nhiên len lỏi khắp nơi.
Các tầng trên được thiết kế mở, dễ kết nối giữa các khu vực, tạo cảm giác rộng rãi hơn cả khi diện tích thực tế khá khiêm tốn."
https://tienphong.vn/lo-ngai-bang-gia-dat-tang-day-gia-nha-tang-doanh-nghiep-them-nang-ganh-post1791667.tpo,"Lo ngại bảng giá đất tăng đẩy giá nhà tăng, doanh nghiệp thêm nặng gánh","TPO - VNREA lo ngại, nếu tăng giá đất sẽ làm giá nhà thương mại tiếp tục tăng, ảnh hưởng đến cơ hội tiếp cận nhà ở của người có nhu cầu ở thực; ngoài ra, có thể tạo thêm ""gánh nặng kép"" đối với doanh nghiệp.","Lo giá đất tăng, giá nhà sẽ tiếp tục neo cao
Hiệp hội Bất động sản Việt Nam (VNREA) vừa có văn bản kiến nghị gửi UBND TP Hà Nội về 8 điểm tác động cần xem xét khi điều chỉnh Bảng giá đất áp dụng từ ngày 1/1/2026.
Theo VNREA, Sở Tài nguyên và Môi trường Hà Nội đang xây dựng Bảng giá đất mới để trình UBND TP xem xét thông qua. Hiệp hội nhận thấy việc xác định giá đất, hoàn thiện khung pháp lý về đất đai, bảo đảm minh bạch và phản ánh đúng giá trị quyền sử dụng đất là rất cần thiết.
Tuy nhiên, việc điều chỉnh cần được thực hiện thận trọng, có lộ trình để tránh những hệ lụy lan tỏa tới nền kinh tế, doanh nghiệp và người dân.
Thứ nhất, theo VNREA, đất đai là tư liệu sản xuất đầu vào quan trọng của sản xuất kinh doanh và giá đất là yếu tố trực tiếp cấu thành chi phí giá thành của các sản phẩm thông qua tiền sử dụng đất, tiền thuê đất, chi phí bồi thường giải phóng mặt bằng của địa phương và doanh nghiệp, nhà đầu tư cũng như người dân.
Việc giá đất theo bảng giá đất sẽ tác động đến cơ hội tiếp cận đất đai của các doanh nghiệp, nhà đầu tư và chi phí đầu vào của doanh nghiệp, giá thành sản phẩm, sức cạnh tranh của doanh nghiệp.
Do đó, việc xác định giá đất cần nhằm mục tiêu tăng cường cơ hội tiếp cận đất đai, mặt bằng sản xuất kinh doanh, kiểm soát biến động giá đất, đặc biệt là giá đất sản xuất kinh doanh, phi nông nghiệp vì tác động đến kế hoạch đầu tư, sản xuất - kinh doanh của doanh nghiệp và phát triển kinh tế thành phố.
Thứ hai, đất đai còn là nguồn lực phát triển quan trọng, có vai trò dẫn dắt nhiều ngành kinh tế. Trong đó, riêng khu vực bất động sản và các ngành liên quan đã đóng góp khoảng 10% GDP, giữ vai trò then chốt trong tăng trưởng, tạo việc làm cho hàng triệu lao động và nguồn thu lớn cho ngân sách.
Trong bối cảnh Chính phủ đặt mục tiêu tăng trưởng 2 con số từ năm 2026, riêng Hà Nội, phấn đấu tăng trưởng GRDP bình quân giai đoạn 2026 - 2030 đạt từ 11%/năm trở lên, việc điều chỉnh bảng giá đất cần cân nhắc, nếu tăng sẽ làm tăng chi phí sản xuất, đầu tư, ảnh hưởng đến tiến độ triển khai dự án và sức cạnh tranh của nền kinh tế.
Hệ quả dây chuyền từ giá đất tăng còn có thể khiến thị trường bất động sản chững lại, tác động tiêu cực đến các lĩnh vực liên quan như xây dựng, vật liệu, tài chính, ngân hàng... qua đó ảnh hưởng đến mục tiêu tăng trưởng và ổn định kinh tế vĩ mô. Nếu xác định giá hợp lý sẽ góp phần tăng trưởng GRDP.
Thứ ba, việc điều chỉnh tăng mạnh giá đất cũng sẽ tạo áp lực lớn lên chi phí đầu tư công và tiến độ các dự án hạ tầng. Khi chi phí đất đai tăng, các dự án hạ tầng trọng điểm của thành phố có nguy cơ đội vốn, vượt dự toán, gây khó khăn cho cân đối ngân sách.
Đồng thời, quá trình thương thảo, bồi thường kéo dài có thể làm chậm tiến độ thực hiện, ảnh hưởng đến hiệu quả đầu tư công và mục tiêu phát triển hạ tầng đồng bộ mà thành phố Hà Nội đang ưu tiên thúc đẩy trong giai đoạn sắp tới.
Thứ tư, việc giá đất và chi phí đầu vào phù hợp sẽ góp phần giảm giá bất động sản, trong đó có nhà ở. Chính phủ, các bộ, ngành cùng các địa phương đang tìm những giải pháp giảm giá bất động sản trên thị trường. Một trong các giải pháp hữu hiệu là giảm chi phí đầu vào cấu thành giá bán bất động sản.
Tuy nhiên, việc giá đất tăng sẽ tác động đến giá thành, từ đó ảnh hưởng đến cơ hội tiếp cận nhà ở của người có nhu cầu ở thực. Đối với nhà ở thương mại, nếu tăng giá đất sẽ ảnh hưởng tính khả thi dự án, làm giá nhà tiếp tục tăng...
Áp lực tài chínhvới người dân, doanh nghiệp
Thứ năm, giá đất theo bảng giá đất nếu tăng cao sẽ dẫn đến chi phí giá nhà ở tăng cao, làm giảm sự hấp dẫn đầu tư, đặc biệt là việc đầu tư các dự án bất động sản tại các khu vực ngoại thành.
Việc thiếu hụt các dự án đầu tư sẽ làm ảnh hưởng đến kế hoạch phát triển nhà ở của thành phố tại các khu vực ngoại thành nhằm mục đích giãn dân. Từ đó, nguồn cung nhà ở trên thị trường sẽ tiếp tục giảm, gây khó khăn cho việc ổn định an sinh xã hội trên địa bàn.
Thứ sáu, việc giá đất theo bảng giá đất tăng cao sẽ gây ra áp lực tài chính đối với người dân và các doanh nghiệp sử dụng đất do các nghĩa vụ tài chính tăng mạnh (tiền thuế sử dụng đất, tiền chuyển mục đích sử dụng đất, các khoản phí, lệ phí liên quan đến đất).
Đồng thời, cũng sẽ làm tăng gánh nặng ngân sách nhà nước khi thực hiện việc bồi thường, hỗ trợ, tái định cư.
Thứ bảy, hiện nay, thị trường bất động sản đang trong quá trình phục hồi mong manh, nhiều doanh nghiệp phải tái cấu trúc, dòng vốn còn hạn chế nếu việc tăng giá đất lúc này có thể tạo thêm ""gánh nặng kép"" làm chậm đà phục hồi của thị trường.
Cuối cùng, nếu tăng giá đất cũng sẽ tạo ra mặt bằng giá thuê nhà tăng theo. Hiện nay, giá cho sinh viên thuê ở gần các trường đại học... đã tăng lên khoảng 30%. Như vậy, khả năng sẽ tăng giá cho thuê, khó khăn cho sinh viên...
Vì những lý do trên, Hiệp hội đề xuất kiến nghị UBND TP Hà Nội xem xét trong quá trình điều chỉnh giá đất trong Bảng giá đất, nhằm bảo đảm hài hòa lợi ích Nhà nước, người dân và doanh nghiệp."
