url,title,description,content
https://tienphong.vn/cap-tau-vu-tru-gia-re-chuan-bi-thuc-hien-hanh-trinh-chua-tung-thay-den-sao-hoa-post1794688.tpo,Cặp tàu vũ trụ giá rẻ chuẩn bị thực hiện hành trình chưa từng thấy đến sao Hoả,"TPO - Hai tàu vũ trụ song sinh chuẩn bị cất cánh để thực hiện hành trình quanh co chưa từng có tiền lệ đến sao Hỏa, nhằm tìm hiểu lý do vì sao hành tinh đỏ cằn cỗi mất đi bầu khí quyển hàng tỷ năm trước.","Sứ mệnh mang tên EscaPADE sẽ hướng đến một quỹ đạo quỹ đạo chưa từng được thử nghiệm trước đây, hãng hàng không vũ trụ Advanced Space, đơn vị hỗ trợ dự án, cho biết. Nếu thành công, đây có thể là một nghiên cứu quan trọng, tạo đà cho các sứ mệnh khoa học hành tinh trong tương lai.
EscaPADE dự kiến ​​sẽ mất 1 năm để bay trên quỹ đạo trước khi hướng đến đích.
Dự án này là một phần của chương trình SIMPLEx, còn gọi là Sứ mệnh khám phá hành tinh nhỏ của NASA, nhằm thúc đẩy các nhà nghiên cứu và công ty tìm ra cách sử dụng tàu vũ trụ nhỏ để thực hiện sứ mệnh khoa học với chi phí thấp.
EscaPADE - do Đại học California Berkeley dẫn đầu, là một trong những dự án tham vọng nhất.
“Chúng tôi không dùng từ ‘rẻ’. Chúng tôi nói ‘giá trị cao’”, Jeff Parker, giám đốc công nghệ tại Advanced Space có trụ sở tại Colorado, đơn vị đang tham gia dự án cùng với Rocket Lab có trụ sở tại California, nói đùa.
“Chúng tôi muốn tạo nên nền tảng khoa học ở mức độ tương đương các sứ mệnh tốn kém hàng trăm triệu đô la, nhưng với ngân sách thấp”, ông cho biết thêm.
EscaPADE tốn chưa đến 100 triệu USD, trong khi các tàu của NASA đang bay quanh sao Hoả tiêu tốn 300 - 600 triệu USD.
Hai tàu vũ trụ EscaPADE dự kiến ​​sẽ cất cánh bằng tên lửa New Glenn của Blue Origin vào chiều 9/11, từ cảng vũ trụ Cape Canaveral ở Florida.
Thông thường, tàu vũ trụ định hướng đến sao Hỏa sẽ đợi cho đến khi hành tinh này thẳng hàng với Trái đất trong một khoảng thời gian được gọi là cửa sổ chuyển tiếp, giúp tàu có thể nhanh tiến vào quỹ đạo của hành tinh đỏ.
Khi mới lên kế hoạch, EscaPADE dự kiến ​​sẽ đi theo đường thẳng. Nhưng một loạt chậm trễ khiến con tàu bỏ lỡ giai đoạn thuận lợi nhất vào cuối năm 2024.
Thay vì chờ đợi giai đoạn cửa sổ tiếp theo vào năm 2026, các nhà thiết kế sứ mệnh đã chọn cách để EscaPADE cất cánh vào bất kỳ ngày nào trong năm và vẫn có thể đến sao Hỏa với lượng nhiên liệu dự trữ.
“Ý tưởng là phóng bất cứ lúc nào, nán lại cho đến khi các hành tinh thẳng hàng hoàn hảo, rồi sau đó khởi hành chuyến đi liên hành tinh đến sao Hỏa”, ông Parker giải thích.
Sau khi cất cánh, tàu vũ trụ đôi EscaPADE sẽ bay vào không gian sâu thẳm. Nhưng thay vì hướng về sao Hỏa, cặp tàu sẽ hướng đến Điểm Lagrange 2, hay L2 - điểm cân bằng vũ trụ cách Trái đất khoảng 1,5 triệu km.
Điểm Lagrange đặc biệt vì chúng hoạt động như những giếng hấp dẫn, tại đó lực kéo của Mặt trời và Trái đất cân bằng hoàn hảo, cho phép tàu vũ trụ dừng lại mà không bị kéo đi.
Điểm L2 cũng là nơi có môi trường bức xạ tốt trong không gian vũ trụ, cho phép tàu vũ trụ ở trên một quỹ đạo rất cao bên ngoài vành đai bức xạ.
Sau đó, tàu vũ trụ sẽ bay trên quỹ đạo hình hạt đậu quanh L2 cho đến khi cửa sổ chuyển tiếp sao Hỏa mở ra vào năm sau. Cặp tàu EscaPADE sẽ quay trở lại Trái đất trong một thời gian ngắn vào tháng 11/2026, sau đó thực hiện hành trình đến sao Hỏa.
Hai con tàu dự kiến sẽ đi vào quỹ đạo sao Hỏa vào tháng 9/2027.
Các sứ mệnh chi phí thấp khác được thực hiện theo chương trình SIMPLEx của NASA đã thất bại do một loạt trục trặc, trong đó Lunar Trailblazer gặp sự cố về liên lạc; LunaH-Map bị hoãn phóng vì chưa đạt được trạng thái tối ưu.
Nếu thành công, EscaPADE có thể là điểm sáng đầu tiên trong chiến dịch của NASA nhằm tiến hành các sứ mệnh khoa học hành tinh với chi phí thấp."
https://tienphong.vn/chan-dong-gioi-thien-van-ho-den-sieu-khong-lo-xe-toac-roi-nuot-tron-ngoi-sao-post1794711.tpo,Chấn động giới thiên văn: Hố đen siêu khổng lồ xé toạc rồi nuốt trọn ngôi sao,"Một hố đen siêu khổng lồ đã xé toạc rồi nuốt trọn một ngôi sao, tạo ra vụ bùng phát ánh sáng chói lòa được mô tả là sáng bằng 10 nghìn tỷ Mặt Trời.","Phát hiện này được công bố trong nghiên cứu đăng trên tạp chíNature Astronomy, đánh dấu hiện tượng bùng sáng hố đen lớn nhất mà các nhà khoa học từng ghi nhận.
Theo trangSpace, vụ bùng phát ánh sáng này – trong thiên văn học gọi là flare – là hiện tượng sáng nhất từng được quan sát liên quan đến một hố đen.
“Đây thực sự là một đối tượng một trong một triệu,” Matthew Graham, tác giả chính của nghiên cứu và giáo sư ngành thiên văn tại Viện Công nghệ California (Caltech), nói với NBC News. Ông là một trong các trưởng nhóm của hệ thống quan sát Zwicky Transient Facility (ZTF) – dự án đóng vai trò phát hiện ra sự kiện này.
Vụ bùng phát được nhìn thấy từ rìa vũ trụ
Hiện tượng cực “khủng” này được phát hiện nhờ Zwicky Transient Facility - hệ thống quan sát chuyên theo dõi các vật thể biến đổi độ sáng trên bầu trời. Ánh sáng bùng phát xuất phát từ một hố đen siêu khối lượng nằm sâu trong nhân thiên hà hoạt động (AGN – Active Galactic Nucleus). Đây là khu vực trung tâm của các thiên hà, nơi hố đen liên tục hút và nuốt vật chất xung quanh.
Hố đen này thuộc thiên hà có mã hiệu J2245+3743, nằm cách Trái Đất khoảng 10 tỷ năm ánh sáng. Nghĩa là ánh sáng của sự kiện mà chúng ta nhìn thấy hôm nay thực chất đã xảy ra từ khi vũ trụ mới chỉ khoảng một phần ba tuổi hiện nay.
Hố đen ở trung tâm thiên hà này có khối lượng gấp 500 triệu lần Mặt Trời – một con số vượt xa trí tưởng tượng khi nghĩ về sức mạnh hấp dẫn của nó.
Ngôi sao xấu số bị kéo vào “vùng chết”
Theo các nhà nghiên cứu, sự kiện bùng sáng này bắt đầu khi một ngôi sao có kích thước bất thường lớn bị lệch khỏi quỹ đạo vốn ổn định của nó. Khi nó tiến quá gần hố đen, lực hấp dẫn khủng khiếp đã xé toạc ngôi sao thành từng mảnh.
Các nhà khoa học gọi đây là một sự kiện gián đoạn thủy triều (tidal disruption event – TDE). Hình ảnh dễ hình dung nhất là như việc sóng lớn nghiền nát mọi thứ khi tiếp cận.
Khi vật chất từ ngôi sao bị kéo vào hố đen, nó tạo ra một lượng nhiệt khổng lồ, làm bùng phát ánh sáng mạnh đến mức vượt mọi quan sát trước đây.
“Hiện tượng này không giống bất kỳ AGN nào mà chúng tôi từng thấy,” Graham nói. “Nó sáng gấp 30 lần mọi vụ bùng sáng trước đó.”
Tỏa sáng suốt 7 năm, đi ngược quy luật
Trong vũ trụ, những vụ bùng sáng kiểu này thường diễn ra nhanh, sáng rực rồi tắt lịm chỉ trong vài tháng. Nhưng vụ việc lần này phá vỡ mọi khuôn mẫu. Nó đã sáng liên tục suốt 7 năm và vẫn chưa tắt hẳn.
Graham mô tả: “Ánh sáng của nó đang mờ dần, như thể hố đen vẫn đang tiếp tục nuốt phần còn lại của ngôi sao, giống một con cá mới chỉ nửa chừng trong cổ họng cá voi.”
So sánh này cho thấy vật chất từ ngôi sao vẫn đang tiếp tục bị kéo vào và quá trình phát sáng sẽ chỉ dừng lại khi hố đen nuốt trọn tất cả.
Sự kiện gây chấn động giới thiên văn
ZTF lần đầu tiên phát hiện sự kiện này vào năm 2018. Ban đầu, các nhà thiên văn chỉ mô tả nó là một “đối tượng đặc biệt sáng”, nhưng không có đủ dữ liệu để hiểu nó đặc biệt như thế nào.
Mọi thứ thay đổi vào năm 2023, khi các phép đo chi tiết hơn từ Đài quan sát W. M. Keck ở Hawaii xác định chính xác khoảng cách của thiên hà J2245+3743.
Graham kể lại khoảnh khắc nhóm nghiên cứu nhận ra tầm vóc của hiện tượng: “Đột nhiên, chúng tôi nhận ra: ‘Ồ, nó thật sự ở rất xa.” Và nếu nó ở xa như vậy mà vẫn sáng chói đến mức đó, thì năng lượng phát ra phải lớn đến mức nào?”
Câu hỏi ấy mở ra hướng nghiên cứu mới và cũng là lý do khiến sự kiện này gây chấn động giới thiên văn.
Khám phá thay đổi cách hiểu về hố đen
Trước đây, giới khoa học thường xem hố đen siêu khối lượng ở trung tâm thiên hà là một thực thể “lặng lẽ”, ăn vật chất đều đặn theo thời gian mà không gây biến động đáng kể. Nhưng sự kiện khổng lồ lần này cho thấy điều ngược lại.
“Chúng tôi từng nghĩ hầu hết các thiên hà đều có một hố đen siêu khối lượng ở giữa và nó chỉ... nằm đó,” Graham nói. “Giờ chúng ta biết môi trường đó năng động hơn nhiều và chúng ta mới chỉ bắt đầu khám phá bề mặt của vấn đề.”
Khám phá này giúp các nhà khoa học hiểu rõ hơn: cách hố đen siêu khối lượng “ăn” vật chất; cách thiên hà tiến hóa và tại sao một số hố đen bùng phát mạnh bất thường.
Một hố đen - biểu tượng của bóng tối tuyệt đối - lại trở thành nguồn sáng mạnh nhất từng được con người ghi nhận. Sự kiện này không chỉ lập kỷ lục về độ sáng, mà còn khiến giới khoa học phải xem lại những gì từng tin là “chân lý” về hố đen.
Vũ trụ vẫn còn quá nhiều bí ẩn và ngay cả những vật thể được xem là lạnh lùng và tối tăm nhất cũng có lúc bùng sáng rực rỡ, đủ để chiếu sáng cả thiên hà.
Link bài gốc: https://vietnamnet.vn/chan-dong-gioi-thien-van-ho-den-sieu-khong-lo-xe-toac-roi-nuot-tron-ngoi-sao-2460894.html"
https://tienphong.vn/phat-hien-40-lo-tho-bat-thuong-duoi-day-bien-nam-cuc-chuyen-gia-noi-trai-dat-co-the-lam-nguy-post1794710.tpo,"Phát hiện 40 'lỗ thở' bất thường dưới đáy biển Nam Cực, chuyên gia nói: Trái Đất có thể lâm nguy","Dưới lớp băng dày hàng nghìn năm, đáy biển Nam Cực bất ngờ xuất hiện hàng chục ""lỗ thở"" đáng sợ.","Một nhóm các nhà khoa học quốc tế vừa phát hiện hơn 40 ""lỗ thở"" đáng sợ dưới đáy biển Nam Cực, khu vực từng được xem là ổn định nhất hành tinh. Phát hiện này được ví như hồi chuông báo động đối với toàn cầu, khi các chuyên gia cảnh báo: Trái Đất có thể đang bước vào giai đoạn nguy hiểm.
Theo nghiên cứu công bố trênNature Communications, nhóm chuyên gia đã sử dụng thiết bị lặn điều khiển từ xa để khảo sát vùng Ross Sea, nơi từng được thăm dò nhiều năm mà chưa từng ghi nhận hoạt động địa chất đặc biệt. Ở độ sâu chỉ từ 5 – 240 m, họ phát hiệnhơn 40 ""lỗ thở"" hay còn gọi là điểm rò rỉ khí methane, một con số được cho là ""chưa từng có tiền lệ"".
Một nhóm các nhà khoa học quốc tế vừa phát hiện hơn 40 ""lỗ thở"" đáng sợ dưới đáy biển Nam Cực. (Ảnh: Polar Journal)
Điều khiến giới khoa học choáng váng là phần lớn các điểm này nằm ở vùng nước nông, nơi bong bóng khí gần như không kịp hòa tan và có thể thoát trực tiếp lên khí quyển. Trong 20 năm đầu tiên tồn tại, methane có khả năng giữ nhiệt gấp khoảng 80 lần carbon dioxide, khiến chỉ một lượng nhỏ thoát ra cũng đủ để làm biến đổi cân bằng năng lượng toàn cầu.
Bà Sarah Seabrook, nhà khoa học thuộc Earth Sciences New Zealand, cho biết trước đây toàn bộ Nam Cực chỉ có một điểm rò rỉ methane được xác nhận (năm 2011, vùng McMurdo Sound). ""Giờ đây, hiện tượng từng được cho là cực hiếm lại đang trở nên phổ biến. Đó có thể là dấu hiệu của một sự thay đổi căn bản trong hệ thống địa chất và sinh học dưới đáy biển Nam Cực,"" bà nói trên trangEarth Sciences NZ.
Các nhà nghiên cứu nhận định, hiện tượng nàycó liên quan trực tiếp đến biến đổi khí hậu. Việc nhiệt độ toàn cầu tăng khiến băng tan nhanh, làm giảm áp lực đè lên trầm tích đáy biển, cho phép khí methane tích tụ lâu năm thoát ra qua các khe nứt mới hình thành.
Giáo sư Andrew Thurber (Đại học Oregon State, Mỹ) cảnh báo trênGreek Reporter:""Nếu sự ấm lên tiếp diễn, Nam Cực có thể chuyển từ một vùng nghiên cứu độc đáo thành khu vực rủi ro cao cho bất ổn khí hậu toàn cầu.""
Các nhà nghiên cứu nhận định, hiện tượng này có liên quan trực tiếp đến biến đổi khí hậu. (Ảnh: SciTechDaily)
Theo ông, các điểm rò rỉ mới hình thành có thể đặc biệt nguy hiểm vì vi sinh vật tiêu thụ methane chưa kịp phát triển, khiến lượng khí phát thải gần như nguyên vẹn đi thẳng vào khí quyển.
Bài phân tích trênGreek Reportercũng dẫn lời các chuyên gia cho rằng hiện tượng này có thể tạo ra ""vòng phản hồi nguy hiểm"": băng tan làm thoát methane, methane khiến Trái Đất nóng hơn, và nhiệt độ tăng lại khiến băng tan nhanh hơn. Nếu vòng phản hồi này tiếp diễn, Trái Đất có thể lâm nguy do bước vào chuỗi tự khuếch đại không thể đảo ngược của biến đổi khí hậu.
Không chỉ các nhà khoa học New Zealand và Mỹ, một nhóm nghiên cứu khác do các nhà địa chất Tây Ban Nha dẫn đầu cũng ghi nhận cáccột methane khổng lồ cao tới 700 mở vùng biển ngoài khơi Nam Cực. Họ gọi đó là""phát thải khổng lồ có thể là quả bom môi trường cho khí hậu hành tinh"", theoEl País English Edition.
Một nhóm nghiên cứu khác do các nhà địa chất Tây Ban Nha dẫn đầu cũng ghi nhận các cột methane khổng lồ cao tới 700 m ở vùng biển ngoài khơi Nam Cực. (Ảnh: CSIC)
Từ những dữ kiện đó, giới khoa học lo ngại Nam Cực đang mất dần vai trò vùng đệm tự nhiên của hệ thống khí hậu toàn cầu. Sự xuất hiện của hàng chục điểm rò rỉ mới trong cùng một khu vực nhỏ cho thấy quá trình địa hóa dưới đáy biển đang biến đổi nhanh hơn dự đoán, và lượng methane thoát ra có thể chưa được tính đầy đủ trong các mô hình dự báo hiện nay.
""Chúng ta đang chứng kiến một biến động hiếm có trong hệ thống hành tinh,"" giáo sư Thurber nhấn mạnh.""Và điều đáng sợ nhất là nó xảy ra ở nơi từng được xem là tĩnh lặng nhất trên Trái Đất."""
https://tienphong.vn/de-tai-cua-nu-sinh-vien-toc-nguoi-ruc-doat-giai-nhi-khoa-hoc-cap-toan-quoc-post1794650.tpo,Đề tài của nữ sinh viên tộc người Rục đoạt giải nhì khoa học cấp toàn quốc,"TPO - Là người đầu tiên của tộc người ở Rục ở xã Kim Phú, tỉnh Quảng Trị đậu đại học, bằng sự nỗ lực vượt bậc, Cao Thị Lệ Hằng không chỉ học giỏi mà còn luôn đau đáu với tinh thần cống hiến. Và đề tài vì cộng đồng trẻ em người Rục của Hằng đã đoạt giải nhì khoa học cấp toàn quốc.","Nghiên cứu vì sức khỏe trẻ em dân tộc mình
Sáng 8/11, tại Trường Đại học Nha Trang (Khánh Hòa), Bộ Giáo dục và Đào tạo, Bộ Khoa học và Công nghệ, Trung ương Đoàn TNCS Hồ Chí Minh và Quỹ Hỗ trợ sáng tạo kỹ thuật Việt Nam (VIFOTEC) phối hợp tổ chức lễ tổng kết và traoGiải thưởng khoa học - công nghệdành cho sinh viên trong các cơ sở giáo dục đại học năm 2025.
Trong hàng trăm công trình được vinh danh, đề tài của nhóm sinh viên Trường Đại học Quảng Bình gây chú ý đặc biệt khi giành giải Nhì toàn quốc, bởinhóm trưởng là Cao Thị Lệ Hằng– là người Rục đầu tiên đỗ đại học.
Sinh ra trong cộng đồng Rục – một nhánh nhỏ của dân tộc Chứt ở vùng núi rừng phía Tây tỉnh Quảng Trị, nơi điều kiện học tập còn nhiều thiếu thốn, Cao Thị Lệ Hằng đã vượt qua vô vàn khó khăn để theo đuổi con đường tri thức.
Từ những bước đi đầu tiên trên con đường học tập, Hằng luôn ý thức mình phải học để quay về giúp bản làng. Năm 2021, em trở thành nữ sinh người Rục đầu tiên trúng tuyển vào đại học, theo học ngành Giáo dục mầm non K64, Trường Đại học Quảng Bình.
Không chỉ nỗ lực học tập, Hằng còn được kết nạp vào Đảng, trở thành tấm gương tiêu biểu về tinh thần vượt khó vươn lên của sinh viên dân tộc thiểu số.
Đề tài đạt giải Nhì toàn quốc của Hằng mang tên: “Nghiên cứu thực trạng và đề xuất giải pháp nâng cao hiệu quả giáo dục về sức khỏe và vệ sinh cá nhân cho trẻ em tộc người Rục (dân tộc Chứt) tại tỉnh Quảng Bình”.
Với vai trò chủ nhiệm đề tài, Hằng cùng các thành viên Nguyễn Thị Cẩm Nhung, Nguyễn Thị Kim Oanh, Nguyễn Thị Thanh Thủy và Ngô Thị Hoài Ân, dưới sự hướng dẫn của Tiến sĩ Phạm Thị Yến, đã thực hiện quá trình khảo sát, thu thập dữ liệu và đề xuất giải pháp mang tính ứng dụng cao nhằm cải thiện sức khỏe, vệ sinh cá nhân chotrẻ em ở cộng đồng Rục.
“Em muốn đề tài không chỉ nằm trên giấy, mà có thể giúp trẻ em bản mình khỏe mạnh, tự tin hơn khi đến trường” – Hằng chia sẻ tại lễ trao giải.
Vinh danh trí tuệ trẻ và khát vọng vươn lên
Giải thưởng khoa học - công nghệ dành cho sinh viên là sân chơi học thuật uy tín cấp quốc gia, quy tụ 628 đề tài đến từ 112 trường đại học trên cả nước, chia theo 6 lĩnh vực nghiên cứu. Kết quả, 530 đề tài được trao giải, trong đó có 20 giải Nhất, 105 giải Nhì, 153 giải Ba và 252 giải Khuyến khích.
Đề tài của nhóm sinh viên Trường Đại học Quảng Bình, với nữ sinh người Rục làm nhóm trưởng, là một trong những điểm sáng nổi bật, thể hiện tinh thần nghiên cứu khoa học gắn với thực tiễn cộng đồng, đặc biệt trong lĩnh vực giáo dục và y tế học đường cho trẻ em dân tộc thiểu số.
Từ bản làng Rục heo hút giữa đại ngàn Minh Hóa đến lễ vinh danh sinh viên toàn quốc, Cao Thị Lệ Hằng đã viết tiếp câu chuyện đẹp về ý chí, tri thức và khát vọng cống hiến.
Giữa ánh sáng của tri thức hôm nay, hình ảnh nữ sinh người Rục nhỏ bé, khiêm nhường mà đầy nghị lực, là minh chứng sinh động cho sức mạnh của giáo dục và tinh thần vượt khó của thế hệ trẻ vùng cao Quảng Bình."
https://tienphong.vn/lo-ro-hinh-hai-tau-co-tren-bien-hoi-an-sau-mua-bao-post1794458.tpo,Lộ rõ hình hài tàu cổ trên biển Hội An sau mưa bão,"TPO - Sau đợt mưa bão vừa qua, sóng lớn đánh vào bờ làm lộ rõ con tàu cổ được phát hiện trước đó trên bờ biển Hội An (TP. Đà Nẵng).","Ngày 8/11, ông Bùi Văn Dũng - Chủ tịch UBND phường Hội An Tây, TP. Đà Nẵng, cho biết đã chỉ đạo lực lượng chức năng triển khai việc khoanh vùng để bảo vệtàu cổđược phát hiện trước đó tại địa bàn.
Đồng thời, lực lượng chức năng cũng tăng cường phổ biến các quy định pháp luật về bảo vệDi sản dưới nướcđến người dân địa phương.
Theo đó, sau đợt mưa gió vừa qua, sóng lớn đánh vào bờ biển đã tiếp tục lộ rõ một phần contàu cổ được phát hiệnhồi tháng 12/2023, tại khu vực khối phố Thịnh Mỹ (thuộc phường Hội An Tây, TP. Đà Nẵng).
Tại thời điểm được phát hiện, xác tàu chỉ lộ một phần cọc gỗ trên bãi cát. Chính quyền TP. Hội An (lúc bấy giờ) đã chỉ đạo cơ quan liên quan phối hợp với các cơ quan chuyên môn tiến hành lấy mẫu đồng vị cacbon để xác định niên đại con tàu này.
Đến tháng 1/2024, do thời tiết biển động, sóng lớn, triều cường đánh mạnh khiến một lượng lớn cát vùi lấp con tàu xuống lại mặt biển.
Sở Văn hóa, Thể thao và Du lịch tỉnh Quảng Nam (cũ) giao UBND TP. Hội An (cũ) chỉ đạo các cơ quan liên quan tiến hành thủ tục đề xuất khai quật khẩn cấp xác tàu.
Trung tâm Quản lý bảo tồn di sản văn hóa Hội An phối hợp với Trường Đại học khoa học xã hội và nhân văn (Đại học Quốc gia TPHCM) thực hiện việc nghiên cứu con tàu.
Quá trình điền dã dân tộc học và khảo cổ học cho thấy vị trí tàu trên bờ biển Cẩm An xưa kia nằm dưới một đồi cát ven biển, cạnh con đường đất đỏ được người Pháp xây dựng. Dấu vết con đường này hầu như không còn do hiện tượng biển xâm thực.
Thông qua các bản đồ, ảnh vệ tinh trong nhiều thời kỳ và ký ức của người dân địa phương, vị trí con tàu xưa kia không chỉ nằm sâu dưới đồi cát mà vào năm 1905 có thể con tàu cách mép nước khoảng 700 - 800m.
Theo nhận định, tàu đắm là tàu có thiết kế truyền thống Biển Đông. Đây là kiểu tàu tích hợp kỹ thuật đóng tàu truyền thống Đông Nam Á và truyền thống Trung Quốc. Đến nay, ở vùng biển Đông Nam Á đã phát hiện hơn 20 con tàu đắm được xác định là kiểu tàu truyền thống Biển Đông, hay còn gọi là tàu lai, có niên đại giữa thế kỷ XIV đến thế kỷ XVI..."
