url,title,description,content
https://vietnamnet.vn/vu-xe-con-bi-vo-nat-o-ninh-binh-cac-yeu-to-giup-tai-xe-thoat-nan-ky-dieu-2460720.html,Không tìm thấy,,"Sáng 8/11, đoạn video ghi lại cảnh chiếc ô tô con bị bẹp dúm, biến dạng hoàn toàn sau va chạm liên hoàn trên Quốc lộ 1A, đoạn qua Tam Điệp (Ninh Bình) được lan truyền chóng mặt trên mạng xã hội.
Nhiều người không khỏi rùng mình khi thấy cả thân xe bị “vò nát” như đống sắt vụn, song tài xế lại bình tĩnh mở cửa kính, tự trèo ra ngoài trong tình trạng tỉnh táo.
Theo thông tin từ cơ quan chức năng, vụ việc xảy ra vào khoảng 6h30 sáng. Khi đó, xe tải bật tín hiệu rẽ trái, bất ngờ va chạm với ô tô con hiệu KIA Morning BKS 35C-164.XX do tài xế Nguyễn Quý D. (SN 1988, trú xã Yên Mô, Ninh Bình) điều khiển lưu thông cùng chiều.
Chưa dừng lại đó, hai xe ô tô trên còn tiếp tục va chạm với xe đầu kéo chạy cùng. Cú đâm liên hoàn khiến ô tô con bị ép giữa hai phương tiện lớn, phần đầu vỡ nát, thân xe biến dạng nghiêm trọng. Dù vậy, tài xế chiếc Morning là anh Nguyễn Quý D. vẫn sống sót kỳ diệu và trèo ra qua đường cửa kính bên phụ, trên xe không có thêm hành khách nào.
Vậy điều gì đã giúp anh may mắn thoát chết trong gang tấc?
Trao đổi nhanh với VietNamNet, kỹ sư ô tô Dương Trung Kiên - Giám đốc Công ty TNHH Thương mại và dịch vụ ô tô Kiên Phong (Cầu Giấy, Hà Nội), việc tài xế xeKIA Morningbình an vô sự trong tình huống này là hết sức hy hữu. Điều này đến từ cả yếu tố kỹ thuật của xe lẫn may mắn về hướng và lực va chạm.
Theo anh Kiên, đầu tiên phải kể đến khả năng hấp thụ xung lực của ô tô khi bị đâm va. Khi có lực tác động mạnh, các vùng của khung, thân vỏ bị biến dạng mạnh, nhưng đồng thời sẽ tự hấp thụ năng lượng lớn, giúp khoang lái ở giữa ít bị xâm lấn.
""Nhìn bên ngoài có thể rất kinh hoàng vì gần như toàn bộ thân vỏ bị vò nát, nhưng khung chịu lực bên trong vẫn đủ bảo vệ người lái”, ông Kiên phân tích.
Theo kỹ sư Kiên, dù chưa có video cụ thể về vụ việc nhưng góc va chạm đóng vai trò quyết định trong tình huống tai nạn liên hoàn này.
""Thay vì bị đâm trực diện, xe con có thể đã bị đâm từ đuôi bên phụ khiến xe bị ép chéo vào sườn xe tải, khiến lực tác động không đi thẳng vào vị trí người lái mà dồn chủ yếu vào 2 góc của xe. Nếu cú đâm đánh trực diện trước vô lăng theo kiểu ""dồn toa"", khả năng bị thương là cao hơn nhiều"", chuyên gia này nhận định.
Ngoài ra, yếu tố tốc độ cũng ảnh hưởng lớn. Anh Kiên cho rằng, thời điểm xảy ra va chạm vào buổi sáng, lưu lượng xe đông, nên tốc độ của cả ba phương tiện có thể không quá cao. Xe tải ở khá gần điểm xa chạm nên có thể tài xế đã kịp thời phanh lại. Nhờ vậy, lực va chạm được giảm bớt, hạn chế chấn thương nghiêm trọng.
Một yếu tố khác ít được chú ý là kính lái an toàn. Kỹ sư Kiên cho rằng, dòng xe này sử dụng loại kính nhiều lớp (laminated), khi vỡ không bung thành mảnh sắc mà vẫn bám dính trên lớp keo, giúp lái xe không bị thương khi đâm mạnh.
Các chuyên gia cho rằng, vụ việc là lời nhắc nhở về tầm quan trọng của việc giữ khoảng cách an toàn. Khi di chuyển phía sau xe tải hoặc đầu kéo, người lái xe con cần tăng khoảng cách, tránh rơi vào điểm mù và luôn chủ động phanh sớm khi phát hiện tín hiệu rẽ hoặc chuyển hướng.
“Không một chiếc xe hay sự may mắn nào có thể bảo vệ con người một cách tuyệt đối. Chỉ có lái xe cẩn trọng, tuân thủ tuyệt đối các quy tắc an toàn mới là lá chắn an toàn nhất,” kỹ sư Dương Trung Kiên nhấn mạnh.
Bạn có góc nhìn thế nào về nội dung trên? Hãy để lại bình luận bên dưới hoặc chia sẻ bài viết về Báo VietNamNet theo email: otoxemay@vietnamnet.vn. Các nội dung phù hợp sẽ được đăng tải. Xin cảm ơn!"
https://vietnamnet.vn/nguon-cung-bung-no-gia-xe-may-moi-du-bao-giam-sau-dip-cuoi-nam-2460539.html,Không tìm thấy,,"Theo báo cáo vừa được Cục Thống kê (Bộ Tài chính) công bố, các doanh nghiệp trong nước ước tính đã xuất xưởng khoảng 312.400 chiếcxe máymới trong tháng 10 vừa qua, tăng mạnh 22,1% so với tháng trước (với 255.900 chiếc) và tăng 13,8% so với tháng 10/2024. Đây là tháng có sản lượng cao nhất từ đầu năm đến nay.
Cũng theo Cục Thống kê, tổng cộng trong 10 tháng đầu năm 2025 đã có 2.757.400 chiếc xe máy mới được xuất xưởng, tăng 6,6% so với cùng kỳ năm ngoái.
Giới chuyên gia nhận định, với nguồn cung dồi dào, thị trường xe máy trong nước khó xảy ra tình trạng “sốt” giá trước Tết Nguyên đán. Trái lại, nhiều hãng còn chủ động tung ưu đãi và giảm giá sâu để kích cầu trong giai đoạn cao điểm cuối năm.
Hiện, Hiệp hội Các nhà sản xuất xe máy Việt Nam (VAMM), gồm 5 thành viên: Honda Việt Nam, Piaggio Việt Nam, Việt Nam Suzuki, SYM Việt Nam và Yamaha Motor Việt Nam. Các thương hiệu thuộc VAMM có lượng sản xuất lớn, ước tính chiếm xấp xỉ 70% lượng xe máy bán ra, trong đó, một số hãng đã bắt đầu sản xuất các dòng xe máy điện như Honda, Yamaha...
Bên cạnh các thành viên kể trên, nhiều doanh nghiệp ngoài khối, đặc biệt trong lĩnh vực xe máy điện cũng đang tăng tốc đáng kể. Nổi bật nhất trong số này là VinFast với danh mục sản phẩm xe điện đa dạng, đáp ứng nhiều phân khúc người dùng từ bình dân đến cao cấp.
Ngoài ra, các thương hiệu như Pega, Yadea, DatBike, Dibao, Detech hay BF... cũng liên tục mở rộng quy mô sản xuất, đẩy mạnh sản lượng nhằm đáp ứng nhu cầu ngày càng cao đối với các dòng xe máy điện.
Sự sôi động của thị trường không chỉ giúp người tiêu dùng có thêm nhiều lựa chọn, mà còn góp phần thúc đẩy mạnh mẽ xu hướng chuyển dịch sang các dòng phương tiện xanh – xu hướng đang ngày càng rõ nét tại Việt Nam.
Bạn có góc nhìn nào về nội dung trên? Hãy để lại ý kiến dưới phần bình luận. Mời bạn đọc cộng tác, gửi tin bài về Báo VietNamNet theo email: otoxemay@vietnamnet.vn. Các nội dung phù hợp sẽ được đăng tải. Xin cảm ơn!"
https://vietnamnet.vn/co-nen-mua-xe-tra-gop-lai-suat-va-chi-phi-an-khi-vay-mua-o-to-la-gi-2460470.html,Không tìm thấy,,"Tôi năm nay 29 tuổi, là nhân viên văn phòng, thu nhập ổn định khoảng 22-25 triệu đồng/tháng. Gần đây, tôi dự định mua chiếc ô tô đầu tiên để phục vụ việc đi làm và chở gia đình nhỏ. Tuy nhiên, do chưa tích lũy đủ tiền nên tôi đang tính đến phương ánmua xe trả góp, trả trước khoảng 30% và vay phần còn lại qua ngân hàng hoặc công ty tài chính của đại lý.
Khi tìm hiểu, tôi thấy nhiều quảng cáo “mua xe trả góp lãi suất 0%”, “thủ tục nhanh, nhận xe ngay”, nhưng khi hỏi kỹ thì lại có thêm hàng loạt chi phí như phí hồ sơ, phí quản lý khoản vay, bảo hiểm thân vỏ bắt buộc… khiến tổng số tiền thực tế tăng lên khá nhiều. Tôi cũng lo lắng về lãi suất sau ưu đãi – vì nghe nói sau vài tháng đầu, ngân hàng sẽ điều chỉnh lãi theo thị trường, có thể tăng rất mạnh.
Qua VietNamNet, tôi mong muốn được các chuyên gia tài chính giải đáp rõ hơn: Mua xe trả góp hiện nay có thực sự lợi hay không? Lãi suất “0%” có phải là thật? Và ngoài tiền gốc, người vay còn phải chịu những khoản phí nào khác khi sở hữu chiếc xe đầu tiên của mình?
Xin cảm ơn!
Độc giả Hùng Vũ (Hà Nội)
Bạn có nhận định thế nào về câu chuyện trên? Hãy để lại bình luận bên dưới hoặc chia sẻ bài viết về Báo VietNamNet theo email: otoxemay@vietnamnet.vn. Các nội dung phù hợp sẽ được đăng tải. Xin cảm ơn!"
https://vietnamnet.vn/dai-gia-gay-sot-khi-tau-chiec-rolls-royce-thu-12-2460643.html,Không tìm thấy,,"Mẫu xe mới nhất ông sở hữu là Phantom VIII, dòng sedan siêu sang được mệnh danh là “đỉnh cao của sự xa xỉ”.
Đoạn video bàn giao được đại lý Big Boy Toyz – một thương hiệu nổi tiếng trong lĩnh vực kinh doanh xe sang đã qua sử dụng – chia sẻ trên Instagram, cho thấy ông Roy vui vẻ trò chuyện về việc mua xe. “Đây là chiếc Rolls-Royce thứ 12 trong đời tôi,” ông nói khi nhận bàn giao.
Xem video:
Chiếc Phantom VIII màu trắng ngọc trai được vận chuyển bằng xe chuyên dụng, phủ tấm vải nhung sang trọng. Ông Roy đến địa điểm nhận xe bằng Mercedes-Maybach màu trắng, sau đó tự tay kéo tấm phủ, chính thức ra mắt chiếc xe mới trong tiếng vỗ tay của nhân viên và bạn bè. Doanh nhân này cũng gửi lời cảm ơn đến Jatin Ahuja, người sáng lập Big Boy Toyz, vì “trải nghiệm mua xe tuyệt vời”.
Theo công bố, Rolls-Royce Phantom VIII thế hệ thứ 8 có giá khởi điểm hơn 10 crore rupee (tương đương khoảng 29 tỷ đồng) cho bản tiêu chuẩn, chưa tính các tùy chọn cá nhân hóa. Ông Roy cho biết chiếc Rolls-Royce đầu tiên của mình được mua từ năm 2008, và trong số 12 xe từng sở hữu, “nhiều chiếc đã rời đi sau thời gian dài phục vụ.”
Ra mắt tại Ấn Độ từ năm 2018, Phantom VIII được phát triển trên nền tảng khung nhôm Architecture of Luxury, giúp xe nhẹ hơn và êm ái hơn so với thế hệ trước. Mẫu sedan siêu sang này trang bị động cơ V12 6.75 lít tăng áp kép, cho công suất 571 mã lực, mô-men xoắn 900 Nm, kết hợp hộp số tự động 8 cấp.
Bên trong, nội thất của Phantom VIII mang đậm dấu ấn cá nhân hóa với tùy chọn “Gallery”, tấm kính trong suốt kéo dài toàn bộ bảng táp-lô, cho phép chủ xe trưng bày tác phẩm nghệ thuật riêng. Xe còn có trần “Starlight” mô phỏng bầu trời sao, tủ lạnh rượu champagne, ly pha lê, cửa đóng mở điện và khả năng cách âm gần như tuyệt đối – khiến Phantom được xem là “chiếc xe yên tĩnh nhất thế giới”.
Phantom VIII là dòng sedan chạy xăng (ICE) cao cấp nhất của Rolls-Royce hiện nay. Với chiều dài 5,7 mét (và gần 6 mét ở bản trục cơ sở kéo dài), không gian bên trong xe cực kỳ rộng rãi và sang trọng  xứng đáng với vị thế của vị tỷ phú kiêm Lãnh sự danh dự Cộng hòa Slovakia tại bang Karnataka và Kerala.
Theo Cartoq
Tin bài cộng tác gửi về email: otoxemay@vietnamnet.vn. Các nội dung phù hợp sẽ được đăng tải. Xin cảm ơn!"
https://vietnamnet.vn/tai-xe-18-tuoi-lai-mercedes-benz-c-class-lao-xuong-bien-xe-hu-hong-nang-2460640.html,Không tìm thấy,,"Vụ việc gây chú ý khi đoạn video ghi lại cảnh xe sang được cẩu lên từ mặt nước lan truyền mạnh trên mạng xã hội.
Xem video:
Theo tờ Gujarat Samachar, chiếc sedan màu bạc bị ngập gần như hoàn toàn trong nước biển trước khi được lực lượng cứu hộ dùng cần cẩu kéo lên bờ. Trong video, có thể thấy một người đàn ông đứng cạnh chiếc xe ngập nước, giữ dây đai cố định để hỗ trợ quá trình trục vớt, trong khi nhiều người hiếu kỳ đứng xem trên bãi biển.
Điều tra ban đầu cho biết tài xế Shehjan Salim, 18 tuổi, là người điều khiển chiếc xe khi sự cố xảy ra. Dù được người dân cảnh báo không nên lái xe gần mép nước, Salim vẫn phớt lờ và lao thẳng xuống khu vực có thủy triều dâng. Cảnh sát sau đó đã bắt giữ tài xế trẻ tuổi và cho biết sẽ gửi báo cáo vụ việc đến công ty bảo hiểm để bác bỏ mọi yêu cầu bồi thường của chủ xe.
Các chuyên gia nhận định, thiệt hại trong trường hợp này là rất nghiêm trọng. Xe bị ngập nước biển thường chịu ăn mòn nhanh, hỏng hệ thống điện, nước xâm nhập buồng đốt gây thủy kích, khiến tay biên cong, piston nứt và trục khuỷu hư hại. Trong nhiều trường hợp, xe cần phải thay toàn bộ động cơ và hệ thống dây điện, với chi phí ước tính từ 10–12 lakh rupee (tương đương khoảng 290–350 triệu đồng), gần bằng giá trị hiện tại của chiếc C-Class cũ.
Dù không ít vụ việc tương tự từng xảy ra, các tài xế trẻ ở Ấn Độ vẫn thường liều lĩnh lái xe lên bãi biển để “check-in” hoặc quay video. Cảnh sát địa phương khuyến cáo, hành vi này không chỉ nguy hiểm mà còn có thể bị xử phạt nặng, đặc biệt khi gây thiệt hại tài sản hoặc ảnh hưởng đến môi trường ven biển.
Theo Cartoq
Tin bài cộng tác gửi về email: otoxemay@vietnamnet.vn. Các nội dung phù hợp sẽ được đăng tải. Xin cảm ơn!"
https://vietnamnet.vn/xe-moi-tiep-tuc-duoc-bom-manh-thi-truong-o-to-nong-tung-ngay-dip-cuoi-nam-2460473.html,Không tìm thấy,,"Theo báo cáo công bố ngày 7/11 của Cục Thống kê - Bộ Tài chính, trong tháng 10/2025 ước tính có tổng cộng 56.865 chiếc ô tô mới, bao gồm cả xe sản xuất trong nước và xe nhập khẩu được bổ sung chothị trườngViệt Nam. Con số này tăng tới 10,9% so với tháng 9 (với 51.295 chiếc).
Trong đó, sản lượngô tô sản xuất, lắp ráp trong nướctháng 10 ước đạt 39.900 chiếc, tăng 17,4% so với tháng 9 nhưng vẫn giảm nhẹ 2,9% so với tháng 10/2024. Đây là tháng có sản lượng xuất xưởng cao thứ hai trong năm 2025, chỉ sau tháng 6 (với hơn 43.000 chiếc).
Tổng cộng trong 10 tháng đầu năm, các nhà sản xuất ô tô trong nước xuất xưởng ước đạt 373.600 chiếc, tăng tới 42,2% so với cùng kỳ năm 2024. Đây là con số rất cao, thể hiện nỗ lực của các nhà sản xuất ô tô trong nước trong 10 tháng vừa qua.

Vớiô tô nhập khẩunguyên chiếc, ước tính có 16.965 xe được nhập về Việt Nam trong tháng 10 vừa qua với tổng giá trị 431 triệu USD. Con số này giảm nhẹ 1,9% về lượng nhưng lại tăng 7,2% về giá trị so với tháng 9 (với 17.295 chiếc, trị giá 402 triệu USD).
Cộng dồn trong 10 tháng đầu năm 2025, ước tính đã có 172.012 chiếc ô tô được nhập khẩu nguyên chiếc vào Việt Nam với giá trị ước đạt 3,8148 tỷ USD; tăng 20,5% về lượng và 31,0% về giá trị so với cùng kỳ năm 2024.
Điều này cho thấy, các nhà nhập khẩu ô tô đang chú trọng đưa về nước những mẫu xe có giá trị cao hơn trong thời gian gần đây, thay vì tập trung vào các dòng xe giá rẻ, giá trị thấp.
Thị trường ô tô Việt Nam đã bước vào Quý 4 – thời gian cao điểm mua sắm cuối năm, cũng là thời kỳ chứng kiến làn sóng giảm giá mạnh nhất từ trước đến nay.
Dù nhu cầu sắm xe Tết tăng, nguồn cung dồi dào và áp lực tồn kho lớn khiến các hãng buộc phải tung ưu đãi sâu để kích cầu. Giới chuyên môn nhận định, đây là “thời điểm vàng” để người tiêu dùng mua xe với mức giá hấp dẫn nhất.
Bạn có góc nhìn nào về nội dung trên? Hãy để lại ý kiến dưới phần bình luận. Mời bạn đọc cộng tác, gửi tin bài về Báo VietNamNet theo email: otoxemay@vietnamnet.vn. Các nội dung phù hợp sẽ được đăng tải. Xin cảm ơn!"
https://vietnamnet.vn/nong-dan-lai-may-keo-den-showroom-nhan-xe-land-rover-defender-tien-ty-2460651.html,Không tìm thấy,,"
Xem video:
Đoạn video được tài khoản Manju Som đăng tải trên Instagram cho thấy, trước khi khởi hành, người nông dân cùng gia đình làm lễ cầu may tại nhà. Sau đó, ông tự mình cầm lái chiếc máy kéo màu xanh dương, dẫn đầu đoàn xe gồm Toyota Fortuner, Mahindra Thar ba cửa và hai chiếc Innova Crysta, di chuyển đến showroom Land Rover trong tiếng hò reo của người thân.
Khi đoàn xe đến nơi, nhân viên đại lý đón tiếp nồng nhiệt. Chiếc Defender 110 mới tinh được phủ bằng tấm vải đỏ nổi bật, đặt trang trọng giữa sảnh trưng bày. Sau khi hoàn tất thủ tục, vị nông dân cùng gia đình kéo tấm phủ, chính thức nhận bàn giao xe trong tiếng vỗ tay và lời chúc mừng. Nhân viên đại lý còn tặng cha ông chiếc khăn choàng truyền thống và mũ turban theo phong tục địa phương, trong khi các con cắt bánh mừng.
Chiếc Land Rover Defender 110 mà người nông dân này mua thuộc phiên bản 2.0 X-Dynamic, sơn màu Fuji White, nội thất phối hai tông đen – nâu, trang bị mâm hợp kim 5 chấu màu xám đậm. Xe có hệ thống thông tin giải trí Pivi Promàn hình 10 inch, bảng đồng hồ kỹ thuật số 12,3 inch, điều hòa tự động 3 vùng, hiển thị thông tin trên kính lái (HUD), âm thanh Meridian Surround, camera 360 độ và cảm biến đỗ xe.
Dưới nắp ca-pô, Defender 110 X-Dynamic sử dụng động cơ xăng tăng áp 2.0L, sản sinh công suất 300 mã lực và mô-men xoắn 400 Nm, kết hợp hộp số tự động 8 cấp và hệ dẫn động 4 bánh toàn thời gian (AWD). Xe còn có hệ thống treo khí nén điện tử và công nghệ Terrain Response 2, giúp tối ưu hiệu suất trên mọi địa hình.
Theo Cartoq
Tin bài cộng tác gửi về email: otoxemay@vietnamnet.vn. Các nội dung phù hợp sẽ được đăng tải. Xin cảm ơn!"
https://vietnamnet.vn/kia-sonet-roi-tu-cao-toc-xuong-vuc-sau-9-met-ca-gia-dinh-thoat-chet-than-ky-2460649.html,Không tìm thấy,,"Theo chia sẻ của chủ xe, người dùng Reddit có tên “diabolicalwit”, anh mua chiếc Sonet HTK Plus chỉ ba ngày trước khi tai nạn xảy ra. Đây là chiếc ô tô đầu tiên của anh, được mua lại từ thị trường xe cũ bằng toàn bộ số tiền tiết kiệm.
Trên hành trình từ Delhi đi Mumbai, khi xe đến khu vực Ratlam, thời tiết đột ngột chuyển xấu, sương mù dày đặc khiến tầm nhìn giảm mạnh. Lúc đó, xe di chuyển với tốc độ khoảng 90 km/h – thấp hơn mức giới hạn 120 km/h. Chủ xe cho biết anh cố gắng giảm tốc, nhưng đoạn đường bất ngờ kết thúc trong khi phía trước lại không có rào chắn hoặc lan can thép bảo vệ.
Chiếc Sonet mất lái, va mạnh vào khối bê tông ở cuối cầu rồi bị hất văng khỏi mặt đường, rơi xuống lòng sông khô bên dưới. Toàn bộ túi khí bung ra, giúp các hành khách thoát nạn trong gang tấc. “Mọi thứ tối sầm lại, chỉ vài giây sau tôi mới nhận ra tất cả vẫn còn sống. Mẹ tôi bị chảy máu ở vai và mặt, còn tôi và bố thì bàng hoàng, em gái thì khóc thét,” chủ xe kể lại.
Người dân địa phương nhanh chóng có mặt hỗ trợ và đưa các nạn nhân đến cơ sở y tế gần nhất. Họ cho biết khu vực này thường xuyên xảy ra tai nạn tương tự do thiếu biển cảnh báo, đèn phản quang và đặc biệt là không có lan can an toàn, đã có ít nhất 9 người thiệt mạng tại đây.
Dù thân xe bị biến dạng nặng ở phần đầu, mui và đuôi, trụ chịu lực của Sonet vẫn giữ nguyên, góp phần bảo vệ khoang lái. Chiếc xe sau đó được cẩu lên và đưa về trung tâm dịch vụ Kia gần đó. Chủ xe cho biết anh đã mua bảo hiểm toàn phần, bao gồm cả gói “mất toàn bộ” và “không khấu hao”, nên hy vọng được bồi thường đầy đủ.
Vụ việc một lần nữa cho thấy tầm quan trọng của hệ thống hạ tầng và cảnh báo an toàn trên các tuyến cao tốc, đồng thời cũng chứng minh khả năng bảo vệ hành khách đáng ghi nhận của mẫu Kia Sonet.
Theo Cartoq
Tin bài cộng tác gửi về email: otoxemay@vietnamnet.vn. Các nội dung phù hợp sẽ được đăng tải. Xin cảm ơn!"
