url,title,description,content
https://vietnamnet.vn/giam-diem-truong-le-gieo-chu-vung-vang-tu-truong-dan-toc-noi-tru-lien-cap-2454544.html,Không tìm thấy,,"Từ năm 2018 đến nay, việc sắp xếp điểm trường lẻ được đẩy mạnh trong cả nước, nhất là ở vùng đồng bào dân tộc thiểu số (DTTS) và miền núi. Đây là một giải pháp quan trọng nhằm triển khai hiệu quả Chương trình giáo dục phổ thông (GDPT) 2018.
Mặc dù đã đạt được một số kết quả nhưng việc sắp xếp điểm trường lẻ ở vùng núi, khu vực biên giới vẫn đang là một bài toán khó của ngành giáo dục. Địa hình chia cắt, giao thông đi lại khó khăn, tâm lý phụ huynh lo con nhỏ phải học xa nhà là những rào cản cho nỗ lực sắp xếp, giảm điểm trường lẻ.
Vì vậy, việc xây dựng các trường nội trú liên cấp khu vực biên giới là giải pháp góp phần giảm điểm trường lẻ, đảm bảo chất lượng dạy học và tạo môi trường học tập, sinh hoạt an toàn, thuận lợi cho học sinh vùng đồng bào DTTS và miền núi.
Điểm trường lẻ “níu chân” trẻ vùng khó
Nghệ An là một trong những địa phương triển khai khá hiệu quả quy hoạch mạng lưới trường lớp. Theo báo cáo của Sở Giáo dục và Đào tạo (GD&ĐT) Nghệ An, giai đoạn 2020-2025, toàn tỉnh giảm 200 điểm trường lẻ.
Tuy nhiên, ở vùng núi của tỉnh, mạng lưới trường lớp vẫn “rải mành mành”. Số liệu tại phiên họp thường kỳ tháng 5/2025 của Thường trực HĐND tỉnh Nghệ An cho thấy, toàn tỉnh hiện vẫn còn 882 điểm trường lẻ, tập trung ở khu vực miền núi.
Ở những điểm trường lẻ ở khu vực biên giới, việc có được lớp học kiên cố vốn đã khó thì để có đủ trang thiết bị dạy học theo Chương trình GDPT 2018 càng gian nan gấp bội. Ở nhiều điểm trường lẻ của Nghệ An, học sinh phải “học chay” một số môn, nhất là Tin học.
Trường Phổ thông Dân tộc bán trú (DTBT) Tiểu học Mỹ Lý 2, xã biên giới Mỹ Lý, tỉnh Nghệ An, có 202 học sinh, theo học tại 1 điểm trường chính và 4 điểm trường lẻ ở các bản dọc biên giới Việt-Lào. Theo ông Trần Sỹ Hà, Hiệu trưởng nhà trường, ở các điểm trường lẻ, cơ sở vật chất rất tạm bợ, không đáp ứng yêu cầu dạy học.
“Nhất là ở điểm trường bản Cha Nga, cách trung tâm xã khoảng 30km. Điểm trường này gần như không có hạ tầng giáo dục tối thiểu” - ông Hà cho biết.
Ông Hà thông tin thêm, bản Cha Nga và một số bản khác có điểm lẻ của Trường PTDTBT Tiểu học Mỹ Lý 2 không có điện lưới, không sóng điện thoại và internet... Từ năm học 2022-2023 đến nay, nhà trường chỉ duy trì lớp 1, lớp 2 ở điểm lẻ; còn từ lớp 3 đến lớp 5, HS phải học ở điểm trường chính.
“Nhưng cơ sở vật chất của trường hiện chưa đáp ứng được nhu cầu bán trú của toàn bộ HS từ lớp 3 đến lớp 5. Trường hiện chỉ có 89/202 HS được ăn ở bán trú”, ông Hà chia sẻ.
Dù rất chật vật nhưng nhà trường vẫn phải “thắt lưng buộc bụng”. Thực hiện Chương trình GDPT 2018, học sinh lớp 3 phải học môn Tin học, chưa nói tới phương tiện, thiết bị thì việc ở các điểm trường không có điện lưới đã là một thách thức không thể vượt qua.
“Điểm trường chính có 22 bộ máy tính, cơ bản đáp ứng nhu cầu dạy học môn Tin học cho học sinh. Nhưng mưa lũ do hoàn lưu bão số 5 đã vùi lấp toàn bộ, cùng với 1,7 tấn gạo dự trữ và sách vở, đồ dùng cá nhân của học sinh bán trú cũng như chăn màn, giường tủ của giáo viên” - ông Hà thông tin thêm.
Gian nan “gom lớp”, “dồn trường”
Không riêng Nghệ An mà hiện nhiều địa phương vùng đồng bào DTTS và miền núi, hệ thống trường lớp “rải mành mành” đang là lực cản trong việc nâng cao chất lượng giáo dục, nhất là trong thực hiện Chương trình GDPT 2018.
Tại Thanh Hóa, báo cáo tham luận tại Đại hội đại biểu Đảng bộ tỉnh lần thứ XX, nhiệm kỳ 2025-2030 (diễn ra ngày 16/10), Quyền Giám đốc Sở GD&ĐT Tạ Hồng Lựu cho biết, giai đoạn 2021-2025, toàn tỉnh  giảm 59 cơ sở giáo dục và 368 điểm trường.
“Việc sắp xếp, giảm điểm trường lẻ đã giúp tiết kiệm nguồn lực đầu tư, nâng cao chất lượng dạy học và thuận lợi trong triển khai Chương trình GDPT 2018 trên địa bàn tỉnh” - ông Lựu nói.
Mặc dù đã đạt được một số kết quả, nhưng theo Quyền Giám đốc Sở GD&ĐT tỉnh Thanh Hóa, công tác sắp xếp, quy hoạch mạng lưới trường lớp vẫn còn nhiều khó khăn, nhất là việc giảm điểm trường lẻ ở khu vực miền núi, biên giới.
Trường Tiểu học Sơn Thủy là ngôi trường xa trung tâm nhất của huyện Quan Sơn (cũ), tiền thân là Trường THCS Sơn Thủy, được thành lập năm 1984. Quy mô của trường khoảng 400 học sinh, trong đó có gần 200 học sinh thực hiện chính sách bán trú.
Theo Hiệu trưởng Hoàng Văn Sáu, nhà trường hiện vẫn phải duy trì 04 điểm lẻ tại các bản: Xía Nọi, Mùa Xuân, Khà, Hiết. Trong đó, có điểm trường cách xa điểm chính hơn 30km.
“Những năm qua, nhà trường đã phối hợp với địa phương vận động đưa học sinh về điểm chính. Nhưng do khoảng cách quá xa, giao thông cách trở, việc dồn lớp, dồn trường vẫn gặp khó khăn”, ông Sáu cho biết.
Ông Sáu cho biết thêm, hiện cơ sở vật chất nhà trường cơ bản đáp ứng được yêu cầu dạy học 2 buổi/ngày và thực hiện chính sách bán trú. Năm 2022, trường đã được đầu tư xây thêm 9 phòng học; nhà bán trú gồm 20 phòng ở cho học sinh được xây khép kín.
Giải pháp “kép” cho mục tiêu đầy thách thức
Với sự quan tâm của Nhà nước, cơ sở vật chất trường lớp ở vùng đồng bào DTTS và miền núi không ngừng được đầu tư. Theo báo cáo của Bộ GD&ĐT, đến năm 2025, toàn vùng có hơn 20.000 trường học, tăng 1.500 trường so với năm 2015.
Công tác quy hoạch mạng lưới trường lớp, theo chủ trương tăng cường củng cố điểm chính, giảm dần điểm lẻ, cũng được triển khai tích cực. Tuy nhiên, kết quả vẫn chưa được như mong đợi. Theo số liệu của Bộ GD&ĐT, cả nước vẫn còn khoảng 18 nghìn điểm trường lẻ ở bậc mầm non và hơn 15 nghìn điểm trường lẻ ở bậc tiểu học.
Từ năm học 2025 - 2026, mở rộng thực hiện Chương trình GDPT 2018, nhiều trường sẽ dồn học học sinh từ lớp 3 đến lớp 5 về điểm trường chính để bảo đảm dạy học. Nhưng khoảng cách địa lý xa, học sinh nhỏ tuổi không thể đi lại hàng ngày khiến việc “gom” trò rất khó khăn.
Tại Trường Tiểu học Trung Lý 2, tỉnh Thanh Hóa, theo Hiệu trưởng Nguyễn Văn Hảo, năm học 2025 - 2026, nhà trường có 392 học sinh, phân bố tại 5 điểm trường, một số điểm cách điểm trường chính 15km, giao thông đi lại rất khó khăn.
“Ở các điểm trường lẻ, rất khó để tổ chức học 2 buổi/ngày, rèn luyện kỹ năng sống và hoạt động tập thể cho học sinh; giáo viên ở điểm lẻ ít có điều kiện tập huấn, sinh hoạt chuyên môn định kỳ. Do đó, giải pháp căn cơ nhất là xây dựng trường nội trú tại điểm chính” – ông Hảo cho biết.
Vấn đề này đã được đại diện Bộ GD&ĐT, Bộ Dân tộc và Tôn giáo, Hội đồng Dân tộc của Quốc hội, Ủy ban Văn hóa Giáo dục của Quốc hội thảo luận kỹ tại Hội thảo quốc gia “Đổi mới và nâng cao chất lượng giáo dục và đào tạo ở vùng đồng bào DTTS và miền núi; thực trạng, thách thức và giải pháp”, ngày 26/8/2025.
Tại hội thảo này, Phó Thủ tướng Chính phủ Lê Thành Long đã đề nghị tính toán, quy hoạch lại mạng lưới trường lớp khoa học, hợp lý, đặc biệt gắn với chính quyền địa phương 2 cấp. Theo Phó Thủ tướng, trường lớp có nơi thừa, cũng có những nơi thiếu, có những chỗ thì cơ sở vật chất chưa bảo đảm.
“Chúng ta hãy xem xét, chỗ nào thiếu thì xây mới, chỗ nào có sẵn thì nâng cấp để có một hệ thống trường, lớp đảm bảo yêu cầu”, Phó Thủ tướng nhấn mạnh.
Trong bối cảnh ngành giáo dục đang loay hoay sắp xếp, giảm điểm trường lẻ thì chủ trương đầu tư, xây dựng trường dân tộc nội trú liên cấp ở khu vực biên giới được xem là giải pháp “lưỡng dụng”; vừa “gom” được trường lớp, vừa huy động, tập trung được nguồn lực đầu tư phát triển giáo dục vùng khó khăn.
Theo kế hoạch, từ nay đến hết tháng 8/2026, 100 trường dân tộc nội trú liên cấp sẽ được đầu tư xây mới hoặc cải tạo, nâng cấp; sau đó sẽ nhân rộng tại 248 xã biên giới trên đất liền trong vài năm tới. Chiến dịch “thần tốc” xây trường liên cấp cho học sinh khu vực biên giới đã được khởi động, đem lại niềm tin mới cho giáo viên, học sinh và đồng bào các dân tộc ở vùng “phên dậu”."
https://vietnamnet.vn/thu-truong-nguyen-hai-trung-dang-huong-tuong-niem-danh-nhan-do-khac-chung-2455586.html,Không tìm thấy,,"Sáng nay, tại đền thờ danh nhân Đỗ Khắc Chung (xã Sơn Đông, tỉnh Phú Thọ), chính quyền và nhân dân địa phương đã tổ chức lễ dâng hương tưởng niệm 695 năm ngày mất danh nhân Đỗ Khắc Chung - người thầy nổi tiếng đặt nền móng truyền thống hiếu học cho vùng đất Sơn Đông.
Dự lễ dâng hương có Thứ trưởng Bộ Dân tộc và Tôn giáo Nguyễn Hải Trung, đại diện lãnh đạo UBND, sở, ngành của tỉnh Phú Thọ.
Trong không gian linh thiêng của ngôi đền 360 năm tuổi, tiếng trống, chiêng rền vang, khói hương lan tỏa, hòa cùng lời đọc chúc văn trang trọng của các bậc cao nhân xã Sơn Đông tưởng nhớ công lao người thầy xưa.
Sau nghi thức tế lễ, Thứ trưởng Nguyễn Hải Trung cùng lãnh đạo địa phương, các thầy cô giáo, học sinh và đông đảo nhân dân trong vùng đã dâng hương, hoa, lễ vật tưởng niệm danh nhân Đỗ Khắc Chung và bày tỏ lòng biết ơn sâu sắc với người đặt nền móng cho truyền thống hiếu học quê hương.
Phát biểu tại buổi lễ, Phó chủ tịch UBND tỉnh Phú Thọ Phùng Thị Kim Nga khẳng định đây là dịp để nhân dân tri ân và tôn vinh người thầy giáo tiêu biểu của quê hương, đồng thời cũng là dịp để có những định hướng, giải pháp bảo tồn và phát huy giá trị di sản văn hoá liên quan đến danh nhân Đỗ Khắc Chung và vùng đất Sơn Đông.
Danh nhân Đỗ Khắc Chung (1247-1330), quê ở xã Giáp Sơn (nay thuộc TP Hải Phòng), là bậc nho sinh uyên bác, nổi tiếng bởi học rộng, đức độ và tinh thần truyền dạy không mệt mỏi.
Khi về vùng Quan Tử (Sơn Đông ngày nay), ông mở lớp dạy chữ, rèn người, gieo mầm hiếu học và đạo nghĩa cho dân làng. Chính từ ngọn đèn học ấy, Sơn Đông trở thành vùng đất “địa linh nhân kiệt”, sản sinh nhiều nhân tài, khoa bảng qua các triều đại.
Sau khi đỗ đạt, ông làm quan trong triều đình suốt gần 50 năm (từ năm 1280 đến năm 1329) dưới 4 triều vua Trần. Trong cuộc đời làm quan, ông đã có những cống hiến lớn và đạt được nhiều vinh hiển trong quan trường.
Danh nhân Đỗ Khắc Chung không chỉ có công lớn với triều đình, dân tộc, mà còn với dân làng Quan Tử. Trước khi ra làm quan, ông mở trường dạy học ở làng và trở thành người thầy đầu tiên, thổi bùng lên tinh thần hiếu học cho lớp thanh thiếu niên vùng phía Nam Lập Thạch.
Với truyền thống hiếu học, tôn sư trọng đạo, trong suốt chiều dài lịch sử đất nước, xã Sơn Đông luôn có đội ngũ trí thức đông đảo, nhiều người có đóng góp lớn cho quê hương, đất nước."
https://vietnamnet.vn/can-co-chinh-sach-dai-ngo-xung-dang-voi-co-do-thon-ban-2454827.html,Không tìm thấy,,"Thôn Nậm Cài, xã Bảo Nhai, tỉnh Lào Cai là nơi sinh sống chủ yếu của đồng bào Mông, Dao; trước đây, hầu hết phụ nữ đều sinh con tại nhà; khi gia đình có người ốm, đồng bào chỉ mời thầy mo, thầy cúng về chữa bệnh chứ hầu như không đến trạm y tế thăm khám.
Là cô đỡ thôn bản đã hơn 10 năm nay, chị Triệu Thị Lai không nhớ nổi đã bao nhiêu lần phải bật dậy, vượt qua đêm tối để đến hỗ trợ các ca sinh tại nhà. Với chuyên môn của mình, chị Lai cũng chỉ có thể cố gắng giúp “mẹ tròn con vuông” chứ chưa thể chăm sóc đầy đủ cho phụ nữ trước, trong và sau sinh.
Theo chị Lai, trước đây, chị em phụ nữ trong thời kỳ mang thai hầu như không đi khám thai bao giờ. Nhiều chị em thiếu dinh dưỡng, ốm yếu, sinh con còi cọc nên chị đã quyết tâm vận động các gia đình trong thôn, chị em phụ nữ ốm đau đến trạm y tế; khi mang thai đi khám định kỳ để mẹ khỏe, con khỏe.
“Lúc đầu cũng khó khăn lắm, vì bà con quen với việc mang thai thì sinh đẻ tự nhiên, ốm đau thì có thầy cúng rồi. Mình cứ kiên trì vận động, lâu rồi bà con cũng nghe; đến nay, tình trạng sinh con tại nhà đã giảm hẳn; trong đó, riêng phụ nữ Dao không còn sinh con tại nhà; tỷ lệ trẻ em được tiêm chủng đạt trên 90%”, chị Lai chia sẻ.
Hiện nay, toàn tỉnh Lào Cai có 152 cô đỡ thôn bản; trong những năm qua, đóng góp của đội ngũ “nhân viên y tế đặc biệt” này là vô cùng quan trọng. Từ một tỉnh có tỷ suất tử vong mẹ và tử vong trẻ em dưới 1 tuổi, dưới 5 tuổi cao nhất (gấp 2-3 lần so với trung bình cả nước); tỷ lệ bà mẹ được chăm sóc trong tuần đầu sau sinh mới đạt khoảng 76% và con số này còn thấp hơn rất nhiều ở các vùng đồng bào DTTS; đến nay, các chỉ tiêu chuyên môn về chăm sóc trước, trong và sau sinh tại Lào Cai đều tăng đáng kể so với năm 2021.
“Cụ thể, các chỉ tiêu giảm tỷ suất tử vong trẻ em dưới 1 tuổi, dưới 5 tuổi, giảm tỷ suất tử vong ở mẹ năm 2025 đã đạt và vượt so với chỉ tiêu Chính phủ giao trong Chiến lược quốc gia bảo vệ, chăm sóc và nâng cao sức khỏe nhân dân giai đoạn đến năm 2030”, ông Nguyễn Thành Sinh, Phó Chủ tịch UBND tỉnh Lào Cai cho biết.
Tuy nhiên, hiện nay sau khi thực hiện mô hình chính quyền địa phương hai cấp, tổ chức sáp nhập xã, phường, địa bàn phụ trách của các cô đỡ thôn bản cũng rộng hơn, vất vả hơn; vì vậy cần có cơ chế hỗ trợ, thù lao xứng đáng.
Điển hình như trường hợp của chị Triệu Thị Lai, sau sắp xếp đơn vị hành chính, chị được giao phụ trách 3 thôn gồm Nậm Cài, Nậm Bó và Tống Thượng. Với đặc thù vùng cao, bà con sinh sống thưa thớt, đường xá đi lại khó khăn nên để hoàn thành nhiệm vụ là cả một sự cố gắng lớn của chị.
Trước đây, chị Lai chỉ phụ trách một thôn, bây giờ phụ trách ba thôn nghĩa là công việc cũng tăng gấp ba lần. Chị Lai chia sẻ, gắn bó được với nghề cũng là vì trách nhiệm với bà con thôn bản và niềm yêu nghề; chứ phụ cấp không đáng là bao. Hiện nay, mỗi tháng chị được phụ cấp khoảng 1,2 triệu đồng với việc quản lý tư vấn chăm sóc 9 bà mẹ. Khoản phụ cấp này, cũng chỉ đủ xăng xe đi lại. Nhiều khi gặp hoàn cảnh các bà mẹ khó khăn cũng phải bỏ tiền túi ra để mua tã lót tặng các chị.
“Bản thân tôi cũng chỉ mong muốn có thêm các dự án hỗ trợ để tăng nguồn kinh phí hoạt động, bảo đảm chăm sóc sức khỏe bà mẹ trẻ em tốt hơn ngay từ tuyến thôn bản, hạn chế ca chuyển tuyến gây nguy hiểm tính mạng”, chị Lai tâm sự.
Ở vùng sâu, vùng xa, đội ngũ cô đỡ thôn bản có nhiệm vụ chuyên trách chăm sóc sức khỏe bà mẹ và trẻ em, đội ngũ được xem như “cánh tay nối dài” của ngành y tế địa phương; qua đó, góp phần nâng cao chất lượng chăm sóc, bảo vệ và nâng cao sức khỏe nhân dân nói chung; nâng cao chất lượng chăm sóc sức khỏe sinh sản nói riêng.
Để phát huy hơn nữa vai trò của đội ngũ cô đỡ thôn bản, ngoài chính sách theo quy định chung, thiết nghĩ các cấp chính quyền cơ sở cũng cần quan tâm xem xét, có thêm những chính sách hỗ trợ xứng đáng để họ yên tâm gắn bó lâu dài với công việc của mình."
https://vietnamnet.vn/nu-dang-vien-k-ho-gieo-chu-chuyen-doi-so-o-buon-lang-tay-nguyen-2453421.html,Không tìm thấy,,"Chị K’Điệp là một gương mặt quen thuộc và được yêu mến tại thôn Thực Nghiệm, xã Nam Ban Lâm Hà, tỉnh Lâm Đồng.
Đây là địa bàn có 210 hộ với hơn 950 khẩu, trong đó đồng bào dân tộc thiểu số chiếm trên 75%. Với vai trò là Phó bí thư chi bộ, Trưởng Ban công tác Mặt trận và Bí thư chi đoàn thôn, chị K’Điệp đã tạo những dấu ấn sâu sắc trong cộng đồng.
Từ cô bé nhút nhát đến người truyền lửa
Ngay từ khi còn nhỏ, K'Điệp đã tích cực tham gia các hoạt động thiện nguyện và bảo vệ môi trường, giúp đỡ những hoàn cảnh khó khăn trong thôn, buôn. Chính những hoạt động này đã giúp cô bé người K'Ho nhút nhát trở thành một thanh niên giàu nhiệt huyết, được cộng đồng tin yêu và chính quyền ghi nhận. Tháng 3/2020, chị vinh dự được đứng trong hàng ngũ của Đảng.
Là một đảng viên gương mẫu đồng thời là một con chiên kính Chúa, yêu nước, chị K’Điệp luôn tìm cách dung hòa và lan tỏa lối sống ""tốt đời, đẹp đạo"". Với sự năng động, am hiểu tâm lý đồng bào, chị đã tìm ra những phương pháp hiệu quả để truyền đạt chủ trương của Đảng, pháp luật của Nhà nước đến người dân một cách hấp dẫn, dễ hiểu.
Khi đã tin yêu người cán bộ, bà con trong thôn sẵn lòng đóng góp công sức xây dựng đường làng, lối xóm xanh, sạch, đẹp, góp phần vun đắp khối đại đoàn kết toàn dân tộc tại cơ sở.
Sinh ra và lớn lên ở vùng sâu, vùng xa, chị K'Điệp thấu hiểu sự thiệt thòi của những đứa trẻ không có điều kiện đến trường hoặc gặp khó khăn do chưa thông thạo tiếng phổ thông. Do vậy, dù chưa từng qua trường lớp sư phạm, nhưng từ năm 2020 đến nay, chị đã tự nguyện mở lớp dạy chữ, bồi dưỡng Toán và Tiếng Việt cho khoảng 500 lượt thiếu nhi dân tộc thiểu số trong mỗi dịp hè. Chị cũng thường xuyên dạy miễn phí cho các em học sinh từ lớp 1 đến lớp 9 có hoàn cảnh khó khăn.
Khi phong trào “Bình dân học vụ số” được triển khai, chị K'Điệp tiếp tục là người tiên phong, “đi từng ngõ, đến từng nhà, hướng dẫn từng người”. Chị tận dụng các nền tảng mạng xã hội như Zalo, Facebook để kết nối cộng đồng, lan tỏa các giá trị văn hóa truyền thống, cập nhật thông tin về an ninh trật tự, phòng chống dịch bệnh, đồng thời kịp thời đấu tranh với các thông tin sai sự thật.
Chị tâm niệm: “Công cuộc chuyển đổi số sẽ góp phần đưa Mặt trận đến gần dân, sát dân, kịp thời lắng nghe tâm tư nguyện vọng của nhân dân”.
Với hơn 15 năm làm công tác y tế thôn bản và nhiều vai trò khác nhau trong các tổ chức đoàn thể, chị K'Điệp đã tạo ra một mạng lưới kết nối cộng đồng vô cùng hiệu quả.
Những nỗ lực không ngừng nghỉ của chị đã được các cấp ghi nhận. Chị từng được Tỉnh đoàn Lâm Đồng tặng danh hiệu “Thanh niên tiên tiến làm theo lời Bác” giai đoạn 2022-2024, Hội Liên hiệp Phụ nữ tỉnh tặng bằng khen “Hội viên xuất sắc trong học tập và làm theo tư tưởng, đạo đức, phong cách Hồ Chí Minh” giai đoạn 2021-2024. UBND xã Nam Ban Lâm Hà cũng vừa trao tặng chị giấy khen vì có thành tích xuất sắc trong phong trào thi đua yêu nước giai đoạn 2020-2025.
Chị K’Điệp là một điển hình tiêu biểu cho lớp đảng viên trẻ người dân tộc thiểu số, trở thành cầu nối vững chắc giúp xây dựng hệ thống chính trị cơ sở ngày càng vững mạnh."
