url,title,description,content
https://vietnamnet.vn/nong-tren-duong-tang-ga-vuot-au-thanh-nien-di-xe-may-nga-song-soai-giua-duong-2460526.html,Không tìm thấy,,"Dưới đây là một sốtình huốngđáng chú ý được ghi nhận trong thời gian qua:
Thanh niên chuyển làn bất cẩn, tạt ngã cô gái rồi thản nhiên bỏ đi
(Nguồn video: Ban Mai)
Tình huống diễn ra vào ngày 4/11 ở trước lối vào hầm chui Thanh Xuân (Hà Nội) theo hướng đi Ngã Tư Sở và đượccamera hành trìnhcủa một ô tô ghi lại.
Theo đó, xe máy đi ở làn sát dải phân cách đã chuyển qua 3 làn liên tiếp, đè vạch xương cá để rẽ phải, tạt đầu một cô gái đi xe máy cùng chiều khiến người này ngã đập mặt xuống đường cực kỳ nguy hiểm. Sau đó, nam thanh niên đã phóng xe bỏ đi luôn khiến những người chứng kiến không khỏi bức xúc.
Hai học sinh đi xe máy tạt đầu ô tô
(Nguồn video: Ngọc Toàn)
Tình huống xảy ra vào trưa ngày 6/1 tại nút giao giữa đường Xuân Phương và TL70 (Hà Nội) và được camera hành trình của ô tô con ghi lại.
Khi đèn giao thông chuyển đỏ, xe có gắn camera hành trình di chuyển ra gần giữa ngã tư thì bất ngờ hai cậu bé trạc tuổi học sinh phóng xe máy điện cắt ngang qua đầu xe để chuyển hướng rẽ trái. May mắn lái xe đang di chuyển chậm nên tránh được va chạm. Đáng nói, cậu bé cầm lái không đội mũ bảo hiểm, xe không có tín hiệu xin đường.
Vượt ẩu, thanh niên đi xe máy ngã sõng soài khi gặp ô tô sang đường
(Nguồn video: OFFB)
Tình huống được cho là diễn ra vào ngày 5/11 trên đường Phan Đình Phùng (phường Phan Đình Phùng, tỉnh Thái Nguyên).
Theo camera hành trình của ô tô con đi cùng chiều, chiếc xe máy đã chạy lấn sang làn ngược chiều, phóng như bay để vượt lên trước. Nhưng bất ngờ phía trước xuất hiện một chiếc ô tô con quay đầu sang đường chặn lại, khiến thanh niên không phản ứng kịp, tông vào đuôi ô tô ngã nhào.
Xe máy lao cắm vào ôtô đang quay đầu
(Nguồn video: Trần Vĩ)
Vụ tai nạn xảy ra vào tối ngày 6/11 tại quốc lộ 56, thuộc TPHCM (Bà Rịa Vũng Tàu cũ). Tại đoạn đường giới hạn tốc độ 50 km/h, một người đàn ông phóngxe máytốc độ rất cao đâm thẳng vào hông ô tô đang quay đầu.
Chiếc xe máy vỡ nát bốc khói văng sang làn đường ngược chiều, còn người đàn ông chui vào trong gầm, chưa rõ thương vong.
Tài xế xe ôm công nghệ ngã lăn ra đường vì quá mải gọi điện thoại
(Nguồn video: Otofun)
Tình huống xảy ra vào trưa 30/10 tại đường Hồ Tùng Mậu, đoạn gần cổng trường ĐH Thương Mại (Hà Nội). Thời điểm trên trời có mưa, đường đông ô tô xung quanh, nhiều người đi xe máy mặc áo mưa tầm nhìn hạn chế.
Người đàn ông vừa điều khiển xe máy vừa dùng điện thoại thì bất ngờ vướng tay lái vào chiếc xe máy chở hàng cồng kềnh đi bên cạnh, khiến ông mất thăng bằng ngã nhào ra đường, chiếc điện thoại vẫn còn trên tay.
(Tổng hợp)
Bạn đã từng gặp tình huống thót tim khi lái xe? Hãy chia sẻ video, thông tin tới Báo VietNamNet theo email: otoxemay@vietnamnet.vn. Các nội dung phù hợp sẽ được đăng tải. Xin cảm ơn!"
https://vietnamnet.vn/xe-sieu-sang-bentley-gia-15-ty-sap-lot-xac-bi-che-mat-chat-sang-2460992.html,Không tìm thấy,,"Nhiều hãng xe đang xem xét lại tương lai điện hóa, và Bentley không ngoại lệ khi tạm dừng kế hoạch chuyển đổi hoàn toàn dải sản phẩm sang xe điện. Thương hiệu xe sang Anh quốc đang kéo dài lộ trình, hướng tới danh mục sản phẩm thuần điện vào năm 2035, thay vì mục tiêu sớm hơn trước đó.
Bentley sẽ tiếp tục sản xuất xe dùng động cơ đốt trong, đồng thời giới thiệu thêm các mẫu xe dùng động cơ hybrid để đáp ứng nhu cầu thị trường và những yêu cầu pháp lý đang thay đổi.
Thế hệ tiếp theo của Bentley Flying Spur là minh chứng cho chiến lược này. Dự kiến, mẫusedan siêu sangsẽ có các phiên bản hybrid, plug-in hybrid và thuần điện. Dù thông tin về mẫu Bentley cỡ lớn vẫn còn khá hạn chế, song một trang tin về xe tại Mỹ đã tổng hợp tất cả những gì họ được biết, bao gồm cả mô phỏng thiết kế của xe.
Đầu năm nay, thương hiệu xe sang Anh quốc đã ra mắt concept EXP 15 dạng fastback, mang đến ngôn ngữ thiết kế tương lai cho các mẫu EV của hãng. Với định hướng đó, có thể một số chi tiết của concept này sẽ dùng trên mẫu Flying Spur thế hệ mới.
Phần đầu xe cách điệu từ hình chữ nhật, với lưới tản nhiệt đứng kiểu đặc trưng của Bentley, đi kèm họa tiết mắt lưới cùng màu thân xe và có thể phát sáng như lưới tản nhiệt của Rolls-Royce. Cụm đèn hình oval không còn, thay vào đó là đèn pha LED dạng dọc mảnh, nhấn mạnh phong thái góc cạnh và bệ vệ hơn.
Nắp ca-pô dài và phần mui dốc về phía sau của mẫu concept có khả năng sẽ được đưa vào xe thương mại. Cửa kính không viền giúp ngoại hình thêm thanh thoát. Tuy nhiên, do các quy định an toàn mới, hãng xe Anh quốc chỉ trang bị tay nắm cửa truyền thống thay vì tay nắm cửa ẩn trong thân xe.
Phía đuôi xe là cụm đèn hậu OLED dạng “halo” mảnh đặt trong một mặt phẳng, kết hợp với bộ khuếch tán tối giản và các chi tiết khí động học chủ động. Nắp cốp tạo hình nổi và cánh gió nhỏ tinh tế làm tăng vẻ thể thao cho chiếc sedan sang trọng.
Bên trong, khoang cabin nhiều khả năng áp dụng phong cách của Bentley EXP 15. Kính chắn gió nối liền với mui xe, có thể điều chỉnh độ trong suốt. Bảng táp-lô ốp gỗ veneer nhưng được tạo hiệu ứng phát sáng bề mặt, kết hợp với cụm màn hình OLED cùng các núm điều khiển kim loại chế tác tinh xảo. Tuy nhiên, thiết kế nội thất gây tranh cãi khi có phần rườm rà như một số xe sang Trung Quốc.
Các công nghệ nổi bật khác có thể bao gồm màn hình HUD kích thước 87 inch và hệ thống điều khiển giọng nói dựa trên AI. Hàng ghế sau được trang bị đầy đủ tiện nghi: ghế massage chỉnh điện, đèn nội thất, bàn picnic cùng các màn hình riêng điều chỉnh tính năng trên xe.
Về hệ truyền động, Bentley có thể tiếp tục bán phiên bản động cơ đốt trong thuần bên cạnh bản plug-in hybrid và thuần điện. Bản ICE dự kiến dùng động cơ V8 tăng áp kép, công suất từ 600–700 mã lực, mô-men xoắn trên 900 Nm. Bản PHEV được cho là sẽ dùng động cơ V8 kết hợp mô-tơ điện đặt sau, đi cùng pin 25,9 kWh. Cấu hình này có thể cho tổng công suất hơn 771 mã lực và 1.000 Nm.
Chung nền tảng với Porsche Cayenne EV sắp ra mắt, bản thuần điện của Flying Spur có thể đạt công suất tới 1.000 mã lực, dùng pin 113 kWh cho phạm vi hoạt động gần 595 km.
Là mẫu sedan siêu sang cạnh tranh ở phân khúc xe sang cao cấp nhất, Flying Spur nhắm tới nhóm khách hàng siêu giàu. Đối thủ của mẫu xe này gồm “đồng hương Rolls-Royce Ghost, Mercedes-Maybach S-Class và thậm chí cả Maextro S800 mới của Huawei tại Trung Quốc.
Tại Việt Nam, Bentley Flying Spur được nhiều đại gia lựa chọn kể từ khi hãng xe Anh quốc khai tử mẫu Mulsanne, với giá niêm yết chỉ từ 14,8 tỷ đồng. Ngoài giá bán rẻ hơn “đàn anh” Mulsanne, thiết kế sang trọng, gọn gàng và nhiều tiện nghi giúp xe được giới nhà giàu ưa chuộng hơn cả.
Theo Carscoops
Bạn có góc nhìn (hoặc có trải nghiệm) nào về vấn đề trên? Hãy để lại bình luận bên dưới hoặc chia sẻ bài viết về Ban Ô tô xe máy theo email: otoxemay@vietnamnet.vn. Các nội dung phù hợp sẽ được đăng tải. Xin cảm ơn!"
https://vietnamnet.vn/di-xe-sang-mercedes-amg-g-63-13-ty-dai-gia-sai-gon-manh-tay-chi-tien-ty-do-lai-2460902.html,Không tìm thấy,,"Mercedes-AMG G 63 từ lâu đã được nhiều đại gia Việt ưa chuộng, với số lượng lên tới trăm chiếc nhập khẩu về nước ta thông qua đơn vị tư nhân và đại lý chính hãng. Không ít xe trong số đó nâng cấp các gói độ đến từ một số thương hiệu nổi tiếng, riêng hãng độ Brabus được ưa chuộng hơn cả.
Chiếc G 63 này đặc biệt hơn khi được chủ xe chọn nâng cấp bộ bodykit đến từ thương hiệu của Nga - TopCar Design. Theo tìm hiểu của phóng viên báo VietNamNet, chiếc xe thuộc đời 2021, nhập khẩu tư nhân và có giá lăn bánh hơn 13 tỷ đồng khi mua mới. Chủ nhân đầu tiên của xe là một người hoạt động trong lĩnh vực kinh doanh xe motor phân khối lớn, đồng thời là người bỏ tiền độ lại xe.
Đây là một trong số vài chiếc G 63 hiếm hoi ở nước ta nâng cấp gói độ TopCar, với giá trị lên tới gần 1 tỷ đồng. Tất cả các chi tiết đều làm bằng sợi carbon, giúp tăng tính thẩm mỹ hơn cho chiếc xe. Tính thêm một số phụ kiện khác, tổng số tiền chủ xe chi ra để nâng cấp cho xe lên tới hơn 1,3 tỷ đồng, tương đương giá bán lẻ một chiếc SUV cỡ D như Ford Everest, Hyundai Santa Fe hay Toyota Fortuner.
Phần đầu xe trở nên hầm hố hơn với bộ líp cản trước kèm các khe gió chia nhỏ. Hai miếng ốp trên cản trước cũng thay từ loại bằng nhựa sang loại làm từ chất liệu carbon. Nắp ca-pô thay mới hoàn toàn, mang thiết kế gân guốc hơn, đi kèm các khe hút gió nhỏ. Riêng ba phụ kiện này đã có giá hơn 350 triệu đồng.
Đuôi xe thay đổi nhẹ nhàng với bộ líp cản sau tích hợp bộ khuếch tán, tạo hình hốc gió giả nằm hai bên. Tương tự cản trước, hai miếng ốp nhỏ trên cản sau cũng thay sang loại làm bằng sợi carbon. Bên trên phần mui, chủ xe chỉ chọn trang bị thêm cánh gió và không có bộ đèn LED như nhiều chiếc G 63 thường độ, giúp xe thêm phần thể thao.
Để tạo dấu ấn cho gói độ, TopCar Design đã thêm logo của hãng trên ốp ngoài bánh xe dự phòng bằng sợi carbon: biểu tượng con cá mập. Chi tiết này được hãng đưa làm tùy chọn logo trên mặt ca-lăng. Hai chi tiết này có giá quy đổi gần 80 triệu đồng, ngang ngửa giá “đập hộp” một chiếc Honda SH 125i bản tiêu chuẩn.
Ốp gương và thanh ốp trên trụ C do hãng độ nước Nga sản xuất cũng đắt đỏ không kém, với giá niêm yết 1.500 Euro (khoảng 46 triệu đồng). Ngoài ra, các chi tiết khác trong nội thất làm bằng sợi carbon có giá lên tới 4.000 Euro (hơn 121 triệu đồng).
Bộ mâm 5 chấu nguyên bản trên chiếc SUV thể thao thay bằng bộ la-zăng đa chấu kích thước 23 inch, sơn màu vàng đồng bắt mắt và sản xuất bởi thương hiệu Avant Garde. Tham khảo trên một trong web tại Mỹ, giá bán bộ mâm này có giá lên tới hơn 10.000 USD (tương đương khoảng 260 triệu đồng). Bên trong nổi bật với cùm phanh màu đỏ.
Hệ thống ống xả tiêu chuẩn của xe vốn cho ra âm thanh khá trầm. Vì vậy, chủ xe chọn cách nâng cấp lên ống xả thể thao do hãng ống xả Akrapovic trứ danh sản xuất, cho ra âm thanh đanh thép và uy lực hơn, đồng thời giảm trọng lượng 9,9 kg so với ống xả “zin”. Trong bảng tùy chọn của TopCar, món đồ này có giá 11.250 Euro (quy đổi gần 350 triệu đồng).
“Trái tim” của Mercedes-AMG G 63 là cỗ máy V8 tăng áp kép, dung tích 4.0 lít, sản sinh công suất tối đa 577 mã lực và mô-men xoắn cực đại 850 Nm, đi kèm hệ dẫn động 4 bánh 4Matic cùng hộp số tự động 9 cấp. Xe có thể tăng tốc 0-100 km/h trong 4,5 giây trước khi đạt vận tốc tối đa 240 km/h.
Theo công bố của nhà sản xuất, mức tiêu hao nhiên liệu trên mẫu SUV thể thao này ở mức 13,1 lít/100 km đường hỗn hợp và tăng lên 16,8 lít/100 km đường đô thị. Thực tế, khi xe di chuyển trong phố có thể tốn tới gần 20 lít/100 km.
Mercedes-AMG G 63không chỉ được các đại gia Việt ưa chuộng. Nhiều ca, nghệ sĩ đã từng và đang sở hữu mẫu SUV hạng sang này như ca sĩ Sơn Tùng M-TP, ca sĩ Tuấn Hưng, ca sĩ Hiền Hồ, ca sĩ Đoàn Di Băng,… Một số người chơi xe có tiếng cũng sử dụng G 63, có thể kể đến doanh nhân Nguyễn Quốc Cường (tức Cường Đô la), doanh nhân Phạm Trần Nhật Minh (tức Minh “Nhựa”),…
Bạn đang sở hữu một chiếc xe độc hay bản độ siêu đẹp? Hãy chia sẻ bài viết cảm nhận, hình ảnh về Ban Ô tô xe máy theo email: otoxemay@vietnamnet.vn. Các nội dung phù hợp sẽ được đăng tải. Xin cảm ơn!"
https://vietnamnet.vn/thi-truong-o-to-cuoi-nam-xe-mpv-7-cho-giam-gia-xuong-muc-khong-the-re-hon-2460481.html,Không tìm thấy,,"Thị trường ô tôViệt Nam đang bắt đầu giai đoạn sôi động nhất trong năm.Giữa bức tranh tăng trưởng sôi động của thị trường xe, phân khúc MPV cỡ nhỏ đang trở thành tâm điểm cạnh tranh mới.
Với ưu thế linh hoạt, đáp ứng tốt cả nhu cầu di chuyển gia đình lẫn chạy dịch vụ, dòng xe 7 chỗ này đang được các hãng đua nhau tung ưu đãi nhằm giành thị phần.
Theo ghi nhận của PV VietNamNet, bước sang tháng 11, tất cả các mẫuxe MPVcỡ nhỏ đang góp mặt trên thị trường đều được tăng ưu đãi với mức giảm phổ biến từ 40-75 triệu đồng.
Điều này đã kéo giá thực tế của nhiều mẫu MPV xuống mức thấp kỷ lục. Thậm chí có những xe cấu hình 7 chỗ ngồi chỉ còn dưới 500 triệu đồng, ngang với phiên bản thấp của một số mẫu xe SUV cỡ A.
Mitsubishi Xpander – “vua doanh số” phân khúc MPV cỡ nhỏ ghi nhận mức giảm 50-100% lệ phí trước bạ - mức ưu đãi mạnh tay nhất từ đầu năm đến nay.
Trong đó, Xpander MT (bản tiêu chuẩn số sàn) thuộc form đời cũ, sản xuất năm 2024 vừa được nâng mức hỗ trợ lệ phí trước bạ từ 50% lên 100%. Ưu đãi này quy đổi thành mức giảm 56 triệu đồng, cùng một số quà tặng từ đại lý có thể quy đổi thêm thành 8-9 triệu đồng.
Như vậy, khách hàng chấp nhận ""thiệt"" 1 đời để mua Mitsubishi Xpander MT VIN 2024 sẽ chỉ phải bỏ ra khoảng 495 triệu đồng trong thời gian này.
Với phiên bản cao nhất là Xpander Cross với giá niêm yết 699 triệu đồng được nhiều đại lý tiếp tục duy trì mức giảm 100% lệ phí trước bạ, tương đương với 70 triệu trong tháng 11, đưa giá bán thực tế xuống 629 triệu đồng. Phiên bản Xpander AT Premium (giá niêm yết 659 triệu đồng) giảm với mức tương tự, tương đương 66 triệu, đưa giá bán còn khoảng 593 triệu đồng.
Tương tự đối thủ Mitsubishi Xpander, hai mẫu MPV của Toyota là Veloz Cross (giá niêm yết 648-688 triệu) và Avanza Premio (giá niêm yết 548-588 triệu) tiếp tục được hãng xe Nhật Bản miễn toàn bộ lệ phí trước bạ cùng một số quà tặng hiện vật, tương đương ưu đãi tối đa là 64-75 triệu đồng.
Sau giảm, giá của Veloz Cross chỉ còn khoảng 575–614 triệu đồng tuỳ địa phương đăng ký, trong khi Avanza Premio có giá thực tế khoảng 490–528 triệu đồng. Đáng chú ý, phiên bản Avanza số sàn thậm chí còn thấp hơn đối thủ Xpander MT.
Nếu xét về giá bán trong phân khúc này, Hyundai Stargazer mới là cái tên có giá thấp nhất. Mẫu xe 7 chỗ này hiện cũng được các đại lý của Hyundai giảm trực tiếp 50 triệu đồng, kéo giá bán thực tế xuống chỉ còn 439–549 triệu đồng. Đáng chú ý, bản ""base"" Stargazer 1.5 còn có giá ngang hoặc thấp hơn các phiên bản sử dụng số tự động của mẫu xe hatchback cỡ A như KIA Morning (439-469 triệu đồng) hay của chính ""người anh em"" Hyundai Grand i10 (435-455 triệu đồng).
Trong khi đó, mẫu MPV lai SUV nhập khẩu Suzuki XL7 Hybrid nổi bật với công nghệ mild-hybrid tiết kiệm nhiên liệu cũng được giảm 100% lệ phí trước bạ, tương đương 60 triệu đồng, đưa giá thực tế còn khoảng 540 triệu đồng - mức giá bán rẻ nhất từ khi mẫu xe này ra mắt vào tháng 8/2024 đến nay.
Ở nhóm MPV giá cao hơn, Honda BR-V và KIA Carens cũng không đứng ngoài cuộc đua giảm giá nhằm tạo sức hút cho thời gian cao điểm cuối năm. Trong đó, KIA Carens đang được các đại lý THACO-KIA duy trì mức giảm giá khoảng 25-35 triệu đồng.
Cụ thể, KIA Carens phiên bản 1.5G IVT được giảm 35 triệu đồng còn 599 triệu đồng, và phiên bản 1.5G Luxury giảm 25 triệu đồng còn 644 triệu đồng.
Sáng tháng 11, Honda Việt Nam không giảm tiền mặt 25 triệu đồng như tháng trước mà đã điều chỉnh giảm 50-100% lệ phí trước bạ cho mẫu BR-V. Theo đó, BR-V bản L (giá niêm yết 705 triệu) được giảm 100% tương đương với 70 triệu đồng, đưa giá bán xuống còn 635 triệu; còn bản G (giá niêm yết 609 triệu) được giảm với mức 30 triệu, đưa giá bán xuống 579 triệu đồng.
Theo giới chuyên gia, việc các hãng xe đồng loạt giảm giá ""kịch sàn"" không chỉ là động thái kích cầu đơn thuần mà là chiến lược dài hơi nhằm giữ đà bán hàng trong giai đoạn cao điểm cuối năm.
Sau thời gian trầm lắng, các hãng buộc phải điều chỉnh giá và cấu hình sản phẩm để duy trì sức hút giữa sức ép cạnh tranh ngày càng lớn.
Nếu trước đây MPV chỉ phải đối đầu trong nội bộ phân khúc, thì nay thị trường đang chứng kiến cuộc “bao vây” từ cả hai hướng: nhóm SUV đô thị cỡ A-B với lợi thế thiết kế hiện đại, gầm cao, kích thước nhỏ gọn phù hợp đi trong phố và các mẫu MPV điện với chi phí sử dụng rẻ, tiếp tục tạo áp lực lên nhóm xe truyền thống.
Trong bức tranh cạnh tranh khốc liệt ấy, người tiêu dùng Việt là bên hưởng lợi rõ rệt – khi chỉ với tầm giá khoảng nửa tỷ đồng đã có thể lựa chọn giữa hàng loạt mẫu xe 7 chỗ tiện nghi, thực dụng và phù hợp nhiều nhu cầu khác nhau.
Bạn có góc nhìn nào về những mẫu xe trên? Hãy để lại bình luận bên dưới hoặc chia sẻ bài viết về Báo VietNamNet theo email: otoxemay@vietnamnet.vn. Các nội dung phù hợp sẽ được đăng tải."
https://vietnamnet.vn/hon-1-trieu-xe-toyota-lexus-va-subaru-bi-trieu-hoi-vi-cung-mot-loi-2460686.html,Không tìm thấy,,"Hơn 1 triệu xe thuộc ba thương hiệu này vừa bị triệu hồi trên phạm vi toàn cầu do lỗi phần mềm liên quan đến camera lùi, tiềm ẩn nguy cơ mất an toàn khi vận hành. Đây là đợttriệu hồi xecó quy mô lớn nhất từ đầu năm 2025 đến nay, ảnh hưởng đến cả những mẫu xe điện mới nhất.
Nguyên nhân dẫn đến đợt triệu hồi quy mô lớn
Theo Cơ quan An toàn giao thông đường cao tốc quốc gia Mỹ (NHTSA), lỗi phần mềm trong hệ thống điều khiển có thể khiến camera chiếu hậu không hoạt động khi xe vào số lùi (số R). Điều này làm giảm tầm nhìn phía sau, tăng nguy cơ va chạm khi lùi, đồng thời khiến xe không đạt tiêu chuẩn an toàn bắt buộc theo quy định của Liên bang Mỹ (FMVSS).
Về bản chất, đây là lỗi phần mềm ô tô khá nghiêm trọng, vì camera lùi Toyota là trang bị bắt buộc trên mọi mẫu xe mới bán ra từ năm 2018. Khi hệ thống không hoạt động, người lái buộc phải quan sát thủ công, gây bất tiện và tiềm ẩn rủi ro, đặc biệt trong khu vực đông đúc hoặc không gian hẹp.
Đợt triệu hồi lần này ảnh hưởng đến hơn 1.024.000 xe, trải dài trên gần 40 mẫu xe của Toyota và Lexus từ năm 2022-2026, bao gồm những dòng phổ biến nhưToyota Camry, RAV4, Highlander, Corolla Cross, LX, RX, ES, LS, NX…
Đáng chú ý, Subaru Solterra là mẫuxe điệnphát triển chung với Toyota bZ4X cũng nằm trong danh sách. Điều này không bất ngờ, vì hai mẫu xe này dùng chung nền tảng và hệ thống phần mềm.
Theo Toyota, các đại lý sẽ tiến hành cập nhật phần mềm miễn phí để khắc phục lỗi, không cần thay thế linh kiện hay sửa chữa phần cứng. Chủ xe sẽ nhận được thông báo chính thức qua đường bưu điện bắt đầu từ giữa tháng 12/2025.
Đáng chú ý, đây không phải lần đầu Toyota phải triệu hồi xe vì lỗi camera lùi. Trước đó, gần 400.000 xe Tundra và Sequoia cũng gặp lỗi phần mềm tương tự. Tuy nhiên, Toyota khẳng định quy trình khắc phục lần này sẽ đơn giản và nhanh chóng hơn.
Vấn đề phần mềm: “cơn đau đầu” của ô tô hiện đại
Các chuyên gia đánh giá, trong kỷ nguyên xe điện thông minh, phần mềm ngày càng chiếm vai trò quan trọng. Một lỗi nhỏ trong mã lệnh cũng có thể khiến triệu hồi xe Toyota hoặc Lexus diễn ra trên quy mô hàng trăm nghìn chiếc.
Giải pháp tối ưu là các hãng nên đẩy mạnh cập nhật OTA (Over-The-Air), công nghệ này cho phép người dùng cập nhật phần mềm từ xa mà không cần mang xe đến đại lý. Tesla đã chứng minh hiệu quả của phương thức này.
Do đó, việc Toyota, Lexus và Subaru đầu tư mạnh hơn vào công nghệ cập nhật OTA sẽ giúp các hãng xe tiết kiệm chi phí, giảm thiểu rủi ro lỗi phần mềm an toàn ô tô, đồng thời nâng cao trải nghiệm người dùng.
(Theo Motortrend)
Bạn có góc nhìn (hoặc có trải nghiệm) nào về vấn đề trên? Hãy để lại bình luận bên dưới hoặc chia sẻ bài viết về Báo VietNamNet theo email: otoxemay@vietnamnet.vn. Các nội dung phù hợp sẽ được đăng tải. Xin cảm ơn!"
