url,title,description,content
https://vietnamnet.vn/dong-bao-dan-toc-thieu-so-o-nghe-an-thay-doi-nep-nghi-vuon-len-lam-giau-2457762.html,Không tìm thấy,,"Những tiêu chí cơ bản đảm bảo
Nếu so hiện tại với đầu nhiệm kỳ (năm 2021) thì điều dễ nhận thấy nhất là đời sống vật chất, tinh thần người dân vùng đồng bào DTTS&MN Nghệ An đã có rất nhiều chuyển biến. Những thay đổi ấy đến từ nhiều con số mà ngành chức năng thống kê và thực tế cuộc sống người dân đang thụ hưởng.
Bắt đầu từ hạ tầng cơ sở, những tuyến giao thông huyết mạch, trọng điểm của vùng miền núi đã được đầu tư, nâng cấp, đáp ứng tốt hơn nhu cầu giao thương, đi lại của người dân trong vùng. Nhìn từ câu chuyện của hàng ngàn hộ dân ở các bản làng vùng lòng hồ thủy điện Bản Vẽ, thuộc các xã Nhôn Mai và Hữu Khuông lâu nay cách núi, cách rừng sẽ thấy rất rõ.
Dự án mở đường trị giá hơn 428 tỷ đồng nối các xã đã xóa thế cô lập của một vùng đất là nơi cư ngụ của cộng đồng người Mông, Thái, Khơ mú… Bí thư Đảng ủy xã Hữu Khuông Lô Văn Giáp vui vẻ cho biết, sắp tới việc giao thương ra vùng ngoài, xã ngoài sẽ thuận tiện hơn. Đó là cơ hội tốt để mở ra hướng phát triển kinh tế - xã hội cho người dân.
Với bà con Đan Lai, nhóm dân tộc thiểu số với một số khó khăn đặc thù, cuộc sống đã có những chuyển biến rõ ràng. Các bản Búng, Cò Phạt ở xã Môn Sơn rộn rã khí thế dựng nhà, lợp mái, xây trường, bắc cầu... Từ nguồn kinh phí của Chương trình MTQG phát triển kinh tế xã hội vùng đồng bào DTTS&MN giai đoạn 2021-2025 (Chương trình MTQG 1719), đã có 6 dự án được đầu tư cho người Đan Lai như xây dựng đường giao thông, kè sạt lở, điện thắp sáng, nước sinh hoạt, xây trường học… Anh La Văn Bốn, người dân ở Co Phạt (xã Môn Sơn) hồ hởi chia sẻ: ""Nhà tôi đã chắc chắn rồi, kín trên bền dưới rồi. Nhờ cả vào sự quan tâm, hỗ trợ của Đảng và Nhà nước"".
Theo tổng hợp của tỉnh Nghệ An, Chương trình MTQG 1719 đã hoàn thành hàng trăm công trình hạ tầng cơ sở, đáp ứng tốt hơn nhu cầu hưởng thụ, sinh hoạt của người dân. Cụ thể, có 149 công trình giao thông, 2 công trình điện, 65 trường học, 19 trạm y tế, 98 thiết chế văn hóa, 21 công trình nước sinh hoạt tập trung, 24 công trình  thủy lợi, 7 đài truyền thanh, 10 chợ nông thôn đã hoàn thành. Toàn tỉnh có 632 hộ dân được hỗ trợ xây dựng và sửa chữa nhà ở, 31 hộ dân được hỗ trợ đất ở, 1.340 hộ dân được hỗ trợ đất sản xuất, 3.641 hộ dân được hỗ trợ chuyển đổi nghề… từ chương trình MTQG 1719.
Từ những đầu tư ấy, nhiều chỉ tiêu cơ bản đã được thay đổi đáng kể. Đó là: tỷ lệ hộ nghèo các xã vùng đồng bào DTTS&MN đã giảm từ 27,71% vào năm 2021 xuống còn 17,34% vào cuối năm 2024; thu nhập bình quân đầu người mỗi năm đến cuối 2024 cũng đã đạt hơn 38 triệu đồng. Cũng đến cuối năm 2024, tỷ lệ lao động trong độ tuổi được đào tạo nghề phù hợp với nhu cầu, điều kiện của người DTTS và đặc thù vùng đồng bào DTTS&MN đạt hơn 51,5%...
Giải quyết tốt nhiều vấn đề xã hội
Nhờ Chương trình MTQG mà điều kiện kết cấu, cơ sở hạ tầng tại vùng đồng bào DTTS&MN được tăng cường, góp phần quan trọng vào việc giải quyết nhiều vấn đề xã hội đang tồn tại, cuộc sống sinh hoạt sản xuất và giao thương phát triển; mức độ tiếp cận các dịch vụ xã hội cơ bản như giáo dục, y tế của cộng đồng người dân vùng thay đổi tích cực.
Thông qua tập huấn, việc triển khai các mô hình, chuyển giao kỹ thuật chăn nuôi, trồng trọt, chăm sóc, bảo vệ và phát triển rừng; hỗ trợ thiết bị máy móc vào sản xuất nông nghiệp, hỗ trợ phát triển sản xuất theo chuỗi giá trị… đã góp phần thay đổi phương thức phát triển sản xuất tại địa phương, tạo việc làm và tăng thu nhập, cải thiện nâng cao đời sống cho hộ dân tham gia dự án, nhằm mục đích giúp các hộ nghèo từng bước thoát nghèo bền vững.
Các vấn đề xã hội khác như tảo hôn và hôn nhân cận huyết thống, bất bình đẳng giới… cũng đã được giải quyết tốt hơn từ việc  đối thoại chính sách, xây dựng các tổ nhóm, câu lạc bộ hoạt động tại cộng đồng, mô hình làng bản không tảo hôn, làng bản không bạo lực gia đình...
Phó chủ tịch UBND tỉnh Nghệ An Phùng Thành Vinh đánh giá: Những chính sách của Chương trình MTQG 1719 ở Nghệ An đã được triển khai tương đối đồng bộ, theo tiến độ thực hiện của Trung ương. Chương trình đã đem lại những tác động tích cực, thiết thực, góp phần thay đổi nếp nghĩ, cách làm, nâng cao nhận thức của người dân vùng DTTS&MN về phát triển kinh tế, vươn lên làm giàu; nâng cao ý thức bảo vệ môi trường sinh thái, xây dựng nông thôn mới và cộng đồng, thôn, bản ngày một phát triển. Việc thực hiện Chương trình MTQG 1719 đồng thời cũng góp phần ổn định tình hình an ninh chính trị, giữ vững quốc phòng, an ninh trên địa bàn."
https://vietnamnet.vn/thu-truong-nong-thi-ha-tham-tang-qua-nguoi-dan-vung-lu-cao-bang-va-lang-son-2457436.html,Không tìm thấy,,"Xem video:
Ngày 27/10, sau khi dự Hội nghị tổng kết Chương trình xóa nhà tạm, nhà dột nát giai đoạn 2021-2025 của tỉnh Cao Bằng, Thứ trưởng Bộ Dân tộc và Tôn giáo Nông Thị Hà đã dẫn đầu đoàn công tác đến thăm và tặng quà cho các gia đình bị ảnh hưởng nặng nề bởi hai cơn bão số 10 và 11 gây ra mưa lũ tại hai xã Cần Yên và Thông Nông (tỉnh Cao Bằng).
Thiệt hại nặng nề do mưa lũ lịch sử
Đợt mưa lũ lịch sử đầu tháng 10/2025 đã gây thiệt hại nghiêm trọng cho tỉnh Cao Bằng: hàng chục nghìn ngôi nhà bị đổ sập, tốc mái, sụt nền, ngập nước; lúa, hoa màu và cây trồng bị ngập úng, gãy đổ, vùi lấp; nhiều khu vực dân cư bị chia cắt, cô lập; hệ thống giao thông, trường học, cơ sở y tế, công trình thủy lợi, điện, nước… bị hư hỏng nặng nề. Tổng thiệt hại về kinh tế ước tính hơn 3.000 tỷ đồng.
Trong đó, Cần Yên và Thông Nông là hai địa phương chịu thiệt hại nặng nhất. Nhiều hộ gia đình rơi vào cảnh mất nhà, mất kế sinh nhai, rất cần sự chung tay giúp đỡ.
Tại xã Cần Yên, có 87 căn nhà bị hư hỏng, cuốn trôi; 263 căn bị ngập nước; 8 trường, điểm trường bị ngập và hư hỏng; 13 tuyến đường giao thông bị sạt lở; 17 công trình thủy lợi và 3 công trình cấp nước bị ảnh hưởng; 219,19 ha lúa và hoa màu bị thiệt hại, tổng giá trị ước hàng chục tỷ đồng.
Còn tại xã Thông Nông, có 139 hộ dân bị thiệt hại về nhà ở, trong đó nhiều hộ bị lũ cuốn trôi, sạt lở hoàn toàn; hơn 298 ha cây trồng bị thiệt hại; 2,54 ha thủy sản mất trắng; gần 1.000 gia súc, gia cầm bị chết, tổng thiệt hại ước khoảng 49,2 tỷ đồng.
Thứ trưởng Nông Thị Hà: “Sớm hỗ trợ bà con ổn định cuộc sống”
Sau khi nghe lãnh đạo hai xã báo cáo tình hình và tận mắt chứng kiến cảnh hoang tàn sau lũ, Thứ trưởng Nông Thị Hà đã chia sẻ, động viên bà con vượt qua khó khăn, ổn định tinh thần để khôi phục cuộc sống.
Thứ trưởng ghi nhận nỗ lực của cấp ủy, chính quyền địa phương trong công tác khắc phục hậu quả thiên tai, đồng thời đề nghị các cấp, các ngành nhanh chóng hỗ trợ người dân khôi phục sản xuất, ổn định nơi ở và sinh kế.
Trong chuyến công tác, đoàn đã trao tặng 200 suất quà (mỗi suất gồm 1.000.000 đồng và nhu yếu phẩm) cho các hộ dân bị ảnh hưởng bởi thiên tai, cùng 24 suất quà (mỗi suất 2.000.000 đồng) cho Người có uy tín trong đồng bào dân tộc thiểu số.
Báo VietNamNet trao 200 triệu đồng ủng hộ người dân Cao Bằng
Ngày 28/10, tại trụ sở Ủy ban MTTQ Việt Nam tỉnh Cao Bằng, Thứ trưởng Nông Thị Hà đã trao tặng 200 triệu đồng – món quà của bạn đọc Báo VietNamNet gửi tới người dân Cao Bằng chịu thiệt hại trong đợt mưa lũ vừa qua.
Ông Vũ Khắc Quang, Phó Chủ tịch Thường trực Ủy ban MTTQ Việt Nam tỉnh Cao Bằng, gửi lời cảm ơn sâu sắc tới sự quan tâm, sẻ chia của Bộ Dân tộc và Tôn giáo cùng Báo VietNamNet.
“Từ số tiền vận động được, Ủy ban MTTQ tỉnh sẽ tiếp tục phối hợp với chính quyền các địa phương để triển khai hỗ trợ đúng đối tượng, đúng quy định và hiệu quả nhất”, ông Quang nhấn mạnh.
Cũng trong ngày 28/10, đoàn công tác đã trao 296 phần quà cho Người có uy tín bị ảnh hưởng bởi thiên tai trên địa bàn tỉnh; đồng thời đến thăm, tặng quà cho 2 hộ khó khăn bị thiệt hại nặng ở phường Thục Phán, mỗi suất trị giá 5.000.000 đồng và nhu yếu phẩm.
Lan tỏa tinh thần sẻ chia tới đồng bào Lạng Sơn
Tại tỉnh Lạng Sơn, mưa lớn kéo dài do ảnh hưởng của cơn bão số 11 cũng gây thiệt hại nặng nề, với tổng thiệt hại toàn tỉnh ước hơn 1.050 tỷ đồng.
Tiếp tục chương trình công tác, Thứ trưởng Nông Thị Hà đã đến hai xã Thất Khê và Tràng Định để trao quà ủng hộ người dân bị ảnh hưởng bởi mưa bão.
Đoàn đã trao 32 suất quà, mỗi suất 2.000.000 đồng cho Người có uy tín bị ảnh hưởng bởi thiên tai tại hai xã; đồng thời tặng 350 suất quà, tổng trị giá 350 triệu đồng (gồm tiền mặt và nhu yếu phẩm thiết yếu) cho các hộ dân bị ảnh hưởng trong đợt mưa lũ.
Phát biểu tại chương trình, bà Trần Thanh Nhàn, Phó Chủ tịch UBND tỉnh Lạng Sơn, trân trọng cảm ơn sự quan tâm, sẻ chia kịp thời của Bộ Dân tộc và Tôn giáo.
“Mưa lũ đã gây mất mát và ảnh hưởng lớn đến đời sống bà con. Những món quà ý nghĩa, kịp thời từ Bộ Dân tộc và Tôn giáo là nguồn động viên to lớn giúp người dân sớm vượt qua khó khăn, ổn định cuộc sống, lao động và sản xuất”, bà Nhàn nhấn mạnh.
Dịp này, đoàn công tác cũng đã đến thăm, tặng quà cho hai hộ gia đình có hoàn cảnh khó khăn bị ảnh hưởng nặng bởi bão lũ là ông Lục Văn Nủn và ông Lục Văn Nguyên (thôn Cắp Kẻ, xã Thất Khê), mỗi suất quà trị giá 5.000.000 đồng.
Những phần quà, lời thăm hỏi và sự hiện diện của đoàn công tác Bộ Dân tộc và Tôn giáo tại các vùng bị thiên tai không chỉ mang giá trị vật chất, mà còn là nguồn động viên tinh thần to lớn, tiếp thêm nghị lực để bà con vùng cao sớm ổn định cuộc sống, khôi phục sản xuất sau mưa lũ."
https://vietnamnet.vn/kham-cap-thuoc-mien-phi-cho-dong-bao-dan-toc-thieu-so-2456479.html,Không tìm thấy,,"Trong những ngày qua, hưởng ứng tháng hành động vì người cao tuổi Việt Nam, Trạm Y tế xã Quảng Trực đã tổ chức khám lưu động và cấp phát thuốc miễn phí cho gần 400 người trên 60 tuổi, trong đó chủ yếu là người đồng bào DTTS sinh sống ở vùng biên giới.
Tại các buổi khám, đội ngũ y bác sĩ của Trạm Y tế Quảng Trực đã tiến hành khám tổng quát, đo huyết áp, kiểm tra đường huyết, tư vấn chế độ dinh dưỡng, và đặc biệt là cấp thuốc điều trị các bệnh thường gặp ở người cao tuổi như tim mạch, tăng huyết áp, đái tháo đường...
Ông Đào Văn Dưỡng (73 tuổi) - người dân tộc thiểu số ở bon Bu Dăr xúc động cho biết, bà con hầu hết ở xa trung tâm xã, đường sá đi lại khó khăn nên việc tiếp cận các dịch vụ y tế, chăm sóc sức khỏe là vô cùng khó khăn.
""Chúng tôi rất vui mừng và biết ơn vì trong thời gian qua, cán bộ y tế đã tận tình đến khám bệnh, tư vấn sức khỏe ngay tại thôn bon. Điều này thể hiện sự quan tâm, chăm lo thiết thực, thường xuyên của Đảng, Nhà nước đối với đời sống bà con vùng biên giới"", ông Dưỡng nói.
Ông Lang Minh Tín – Trưởng Trạm Y tế xã Quảng Trực cho biết, xã Quảng Trực có tỷ lệ người cao tuổi chiếm gần 10% dân số, phần lớn là đồng bào DTTS, đời sống còn nhiều khó khăn. Việc khám chữa bệnh lưu động này giúp người dân được tiếp cận dịch vụ y tế ngay tại địa phương, kịp thời phát hiện, điều trị và tư vấn phòng ngừa bệnh tật, từ đó góp phần nâng cao chất lượng cuộc sống và bảo vệ sức khỏe cộng đồng.
""Hoạt động ý nghĩa này không chỉ thể hiện tình cảm, trách nhiệm và y đức của đội ngũ cán bộ y tế cơ sở cùng sự đồng hành của Ủy ban Mặt trận Tổ quốc Việt Nam xã Quảng Trực, mà còn lan tỏa thông điệp nhân văn sâu sắc “Sức khỏe là vốn quý, chăm lo cho người cao tuổi là chăm lo cho tương lai cộng đồng"", ông Lang Minh Tín nói.
Ông Nguyễn Văn Anh - Chủ tịch UBND xã Quảng Trực đánh giá, đây là những hoạt động thiết thực để chăm lo sức khỏe cho người DTTS vùng biên giới, đồng thời khẳng định vai trò của Trạm Y tế là điểm tựa tin cậy của nhân dân vùng biên, góp phần củng cố khối đại đoàn kết, xây dựng vùng biên giới ngày càng ấm no, khỏe mạnh và vững chắc.
Quảng Trực là một trong những xã biên giới trọng điểm của tỉnh Lâm Đồng mới với đường biên dài 41,6km giáp nước bạn Campuchia.
Xã Quảng Trực có diện tích tự nhiên 55.878ha, trong đó có hơn 40.000ha rừng. Dân số của xã là hơn 11.200 người, sinh sống tại 11 bon, với 26 dân tộc cùng chung sống."
https://vietnamnet.vn/ra-soat-cac-noi-dung-dau-tu-cho-vung-dan-toc-thieu-so-giai-doan-2026-2035-2457289.html,Không tìm thấy,,"Chiều nay 28/10, Bộ Dân tộc và Tôn giáo tổ chức cuộc họp thống nhất nội dung hợp phần phát triển kinh tế - xã hội vùng đồng bào dân tộc thiểu số và miền núi (thuộc Chương trình MTQG xây dựng nông thôn mới, giảm nghèo bền vững và phát triển kinh tế - xã hội vùng đồng bào dân tộc thiểu số và miền núi).
Ủy viên dự khuyết Ban Chấp hành Trung ương Đảng, Thứ trưởng Y Vinh Tơr chủ trì cuộc họp, tham dự còn có lãnh đạo các vụ, đơn vị liên quan của Bộ Dân tộc và Tôn giáo.
Giữ đúng mục tiêu, địa bàn, nâng hiệu quả đầu tư
Việc tích hợp 3 Chương trình MTQG: Xây dựng nông thôn mới, giảm nghèo bền vững, phát triển kinh tế - xã hội vùng đồng bào dân tộc thiểu số và miền núi thành một Chương trình MTQG chung đã được Phó Thủ tướng Thường trực Chính phủ Nguyễn Hòa Bình kết luận, tại Thông báo số 560/TB-VPCP ngày 17/10/2025.
Phó Thủ tướng chỉ đạo Bộ Dân tộc và Tôn giáo, Bộ Nông nghiệp và Môi trường khẩn trương rà soát, hoàn thiện báo cáo đề xuất chủ trương đầu tư Chương trình MTQG chung, hoàn thành hồ sơ, báo cáo Chính phủ trước ngày 1/11/2025 để báo cáo Quốc hội tại kỳ họp thứ 10.
Phát biểu tại cuộc họp, Thứ trưởng Y Vinh Tơr cho biết, Chương trình MTQG chung gồm 2 hợp phần và thống nhất tên gọi là Chương trình MTQG xây dựng nông thôn mới, giảm nghèo bền vững và phát triển kinh tế - xã hội vùng đồng bào dân tộc thiểu số và miền núi giai đoạn 2026 - 2035.
Trong đó, Bộ Nông nghiệp và Môi trường chủ trì hợp phần thứ nhất: Xây dựng nông thôn mới và giảm nghèo bền vững; Bộ Dân tộc và Tôn giáo chủ trì hợp phần thứ hai: Phát triển kinh tế - xã hội vùng đồng bào dân tộc thiểu số và miền núi.
“Văn bản số 560/TB-VPCP đã nêu rõ kết luận của Phó Thủ tướng Thường trực Chính phủ là đối với hợp phần phát triển kinh tế - xã hội vùng đồng bào dân tộc thiểu số và miền núi, khi tích hợp thì vẫn bảo đảm nguyên tắc giữ vững mục tiêu, địa bàn”, Thứ trưởng Y Vinh Tơr nhấn mạnh.
Theo Thứ trưởng, Bộ Dân tộc và Tôn giáo là cơ quan chủ quản Chương trình MTQG phát triển kinh tế - xã hội vùng đồng bào dân tộc và miền núi giai đoạn 2021 - 2025; tới đây tiếp tục là cơ quan chủ trì hợp phần thứ hai trong Chương trình MTQG chung giai đoạn 2026 - 2035.
“Để giữ vững mục tiêu, địa bàn của chương trình trong giai đoạn tới, phải rà soát kỹ lưỡng các nội dung đầu tư, bảo đảm tính khả thi trong thực hiện giai đoạn 2”, Thứ trưởng Y Vinh Tơr nêu rõ.
Rà soát kỹ các nội dung đầu tư của giai đoạn 1
Tại cuộc họp, đại diện các vụ, đơn vị đã giải trình, thảo luận làm rõ những vướng mắc trong thực hiện một số nội dung đầu tư trong giai đoạn 1. Trong đó, khó khăn trong giải ngân vốn đầu tư công ở một số dự án đã được phân tích kỹ.
Đơn cử với nội dung đầu tư các trường dự bị dân tộc, theo ông Nguyễn Văn Đức - Giám đốc Ban quản lý dự án chuyên ngành xây dựng - thì trước đây, các trường này thuộc Bộ Giáo dục và Đào tạo; các dự án đầu tư, nâng cấp các trường do Bộ Giáo dục và Đào tạo chủ trì.
Theo ông, hiện các dự án đã có giấy phép xây dựng nhưng thời gian thực hiện còn lại quá ngắn. Do đó, Ban Quản lý dự án chuyên ngành xây dựng đề xuất Bộ điều chỉnh chủ trương về vốn của các dự án, hoặc điều chỉnh kéo dài thời gian thực hiện sang năm 2026.
“Nếu điều chỉnh chủ trương nội bộ thì thuộc thẩm quyền của lãnh đạo Bộ. Còn nếu điều chỉnh vốn kéo dài sang năm 2026 thì thuộc thẩm quyền Quốc hội và Chính phủ”, ông Đức nói.
Vướng mắc trong thực hiện đầu tư cho Báo Dân tộc và Phát triển trước đây (từ tháng 6/2025 sáp nhập với Báo VietNamNet thành Báo VietNamNet) và Tạp chí Dân tộc (nay là Tạp chí nghiên cứu Dân tộc và Tôn giáo) cũng được đại diện 2 cơ quan báo chí thuộc Bộ làm rõ.
Theo bà Bùi Thị Hạ, Phó Tổng biên tập Báo VietNamNet, công tác truyền thông vô cùng quan trọng trong lĩnh vực dân tộc và tôn giáo. Giai đoạn 1 chủ trương đầu tư cho Báo Dân tộc và Phát triển đã có trong Quyết định số 1719/QĐ-TTg nhưng không thực hiện được.
Phó Tổng biên tập VietNamNet Bùi Thị Hạ đề nghị tiếp tục đầu tư cho cơ quan báo chí của Bộ về chuyển đổi số, trong đó có đầu tư cho Báo VietNamNet xây dựng, phát triển nền tảng truyền thông số về công tác dân tộc và tôn giáo; hình thành chuyên trang, ứng dụng đa ngữ để đồng bào dễ tiếp cận chính sách...
Đánh giá cao tinh thần trách nhiệm của các vụ, đơn vị, Thứ trưởng Y Vinh Tơr khẳng định, việc giải quyết những tồn tại trong giai đoạn 1 là đặc biệt quan trọng để tổ chức thực hiện các chính sách đầu tư phát triển vùng đồng bào dân tộc thiểu số và miền núi tốt hơn ở giai đoạn 2.
“Các vụ, đơn vị khẩn trương phối hợp với Văn phòng Quốc gia về dân tộc và miền núi rà soát lại các nội dung thuộc trách nhiệm, nhiệm vụ của mình, từ đó để giải quyết những tồn tại, hạn chế; đề xuất các nội dung đầu tư trong giai đoạn tới, phải làm rõ các căn cứ của đề xuất và phải thật kỹ lưỡng trong quá trình xây dựng chính sách”, Thứ trưởng Y Vinh Tơr lưu ý."
