url,title,description,content
https://vietnamnet.vn/truoc-them-ra-mat-forester-moi-subaru-tung-loat-uu-dai-khung-2460968.html,Không tìm thấy,,"Theo VAMA, năm 2024 các dòng gầm cao chiếm hơn 55% doanh số xe du lịch trong nước, thể hiện xu hướng chuyển dịch mạnh của các gia đình. Trong xu hướng đó, không thể thiếu Subaru - thương hiệu hơn 70 năm tuổi với triết lý “Confidence in Motion” – Tự tin trong từng chuyển động - đã góp phần tạo dựng tiêu chuẩnSUVan toàn, bền bỉ và thực dụng trên khắp thế giới. Subaru luôn nằm trong Top 3 thương hiệu có độ tin cậy cao nhất theo Consumer Reports và J.D. Power. Các mẫu xe đời mới của Subaru đều đạt chứng nhận Top Safety Pick+ - tiêu chuẩn an toàn cao nhất của Viện Bảo hiểm An toàn Giao thông Mỹ (IIHS).
Subaru còn đồng thời là hãng Nhật tiên phong áp dụng hệ dẫn động bốn bánh toàn thời gian (AWD) cùng động cơ Boxer đối xứng lên xe dân dụng. Với những ai yêu thích kỹ nghệ luyện kim Nhật Bản, tháng 11 này là “cơ hội vàng” để sở hữu cho hai mẫu SUV mang ADN đặc trưng của Subaru với ưu đãi lớn nhất năm 2025.
Subaru Forester - “Người Rừng” canh giữ những giá trị bền lâu
Tại Việt Nam, Forester luôn là mẫu xe biểu tượng của Subaru. Xe sử dụng động cơ Boxer 2.0L mang lại độ cân bằng tối ưu, hạn chế rung động và giúp trọng tâm thấp hơn để bám đường vững chắc. Nền tảng khung gầm toàn cầu Subaru Global Platform (SGP) bằng thép cường lực trên Forester còn chịu được độ cứng xoắn tốt hơn, giúp hấp thụ va chạm hiệu quả và bảo vệ tối đa khoang hành khách.
Cùng với hệ dẫn động bốn bánh toàn thời gian đối xứng SAWD - công nghệ cốt lõi giúp phân bổ mô-men xoắn tức thời tới từng bánh - Forester cho cảm giác lái an toàn, ổn định ở mọi điều kiện địa hình. Gói an toàn chủ động EyeSight 4.0 hỗ trợ người lái với phanh tự động, giữ làn và kiểm soát hành trình chủ động, mang lại trải nghiệm “như có thêm đôi mắt thứ hai”.
Nội thất rộng, tầm nhìn thoáng và cách bố trí tinh tế khiến Forester tiếp tục được đánh giá là chiếc SUV gia đình cân bằng giữa tiện nghi, độ tin cậy và khả năng vận hành. Đặc biệt, Subaru Việt Nam đang triển khai gói ưu đãi lên tới 308 triệu đồng - mức cao nhất từ trước đến nay, bao gồm: 5 năm bảo hành, 5 năm bảo dưỡng miễn phí (không quy đổi tiền mặt), 5 năm bảo hiểm thân vỏ, hỗ trợ toàn bộ lệ phí trước bạ và đăng ký xe. Đây là cơ hội vàng để sở hữu mẫu SUV này trước khi thế hệ mới được nhập nguyên chiếc từ Nhật ra mắt.
Subaru Crosstrek - linh hoạt trên mọi địa hình đến đô thị hiện đại
Nếu Forester đại diện cho sự vững chãi, thì Subaru Crosstrek mang tinh thần trẻ trung, năng động. Dù thuộc phân khúc B-SUV, Crosstrek vẫn được trang bị hệ dẫn động bốn bánh toàn thời gian SAWD tiêu chuẩn - điều hiếm thấy ở các đối thủ.
Crosstrek sử dụng nền tảng SGP cải tiến hơn so với Forester, giúp giảm rung, tăng độ cứng vững và khả năng cách âm tốt hơn hẳn, một phần cũng đến từ yếu tố nhập Nhật. Cấu trúc đối xứng giữa động cơ - hộp số - trục truyền động giúp xe phân phối lực kéo tức thời, giữ quỹ đạo ổn định khi mặt đường trơn trượt. Kích thước gọn gàng (dài hơn 4,4m, gầm cao 220mm) giúp Crosstrek linh hoạt trong đô thị nhưng vẫn tự tin khi off-road.
Crosstrek cũng được trang bị gói công nghệ an toàn chủ động EyeSight 4.0 với nâng cấp camera đơn góc rộng, giúp nhận diện tốt hơn người đi bộ và xe đạp trong môi trường phức tạp. Các tính năng như kiểm soát hành trình thích ứng, giữ làn chủ động và hỗ trợ đánh lái khẩn cấp thể hiện tinh thần đặt sự an nguy của người lái làm trọng tâm trên mọi hành trình của Subaru.
Đặc biệt, Crosstrek còn là mẫu SUV AWD hybrid duy nhất trong phân khúc - kết hợp hiệu quả giữa tiết kiệm nhiên liệu, thân thiện môi trường và cảm giác lái thể thao chuẩn Nhật. Với ưu đãi đến 258 triệu đồng, bao gồm 5 năm bảo hành không giới hạn số km cùng bộ cốp điện tiện ích, Crosstrek hiện đang ở mức giá dễ tiếp cận nhất kể từ khi ra mắt, là lựa chọn lý tưởng để gia nhập “thế giới Subaru”.
Bích Đào"
https://vietnamnet.vn/dong-co-3-xi-lanh-tren-o-to-xu-huong-tat-yeu-va-nhung-gioi-han-kho-tranh-2460093.html,Không tìm thấy,,"Nếu 10 năm trước,động cơ 3 xi-lanhchỉ là lựa chọn bất đắc dĩ trên những mẫu xe hạng A giá rẻ thì ngày nay, nó xuất hiện ở khắp mọi nơi. Từ các mẫu xe phổ thông (Ford Focus, Nissan Almera) đến các thương hiệu cao cấp (BMW, Volvo) và cả xe hybrid. Tuy nhiên, phía sau sự gọn nhẹ và tiết kiệm ấy là không ít thách thức về độ bền, độ ồn và khả năng vận hành.
Vì sao động cơ 3 xi-lanh ngày càng phổ biến?
Trước hết, lợi thế lớn nhất của động cơ 3 xi-lanh nằm ở khả năngtiết kiệm nhiên liệuvà giảm phát thải CO2. Theo nghiên cứu của Đại học Công nghệ Chalmers (Thụy Điển), loại động cơ này có thể giúp giảm tiêu thụ nhiên liệu từ 6-14% so với động cơ 4 xi-lanh truyền thống, và mức tiết kiệm có thể lên tới 23,5% nếu kết hợp cùng công nghệ ngắt xi-lanh biến thiên.
Bên cạnh đó, lượng khí thải CO2 cũng giảm tới 22%, một con số rất đáng kể đối với các nhà sản xuất ô tô trong bối cảnh các quy định khí thải ngày càng nghiêm ngặt.
Do chỉ có ba piston và ba thanh truyền, động cơ này có ít bộ phận chuyển động hơn, giúp giảm ma sát và tổn thất năng lượng cơ học, đồng thời giảm trọng lượng tổng thể của xe. Điều này không chỉ góp phần cải thiện khả năng tăng tốc mà còn giúp phân bổ trọng lượng xe hợp lý hơn, đồng thời mang lại cảm giác lái linh hoạt, đặc biệt hữu ích trong đô thị.
Quan trọng hơn, kích thước nhỏ gọn của động cơ 3 xi-lanh cho phép các kỹ sư dễ dàng bố trí thêm một mô-tơ điện, biến chiếc xe thành một hệ thống hybrid (HEV) hoặc hybrid sạc điện ngoài (PHEV) mà không cần thay đổi quá nhiều thiết kế khung gầm.
Ngoài ra, việc có ít bugi, kim phun, van và trục cam hơn cũng đồng nghĩa với chi phí sản xuất thấp hơn. Về lâu dài, chi phí bảo trì và thay thế phụ tùng cho người dùng cũng có xu hướng ""dễ thở"" hơn.
Đáng chú ý, khi kết hợp cùngturbo tăng áp, động cơ 3 xi-lanh hoàn toàn có thể đạt công suất vượt xa kỳ vọng, thậm chí còn mang lại âm thanh thể thao đầy phấn khích. Hai ví dụ điển hình là Toyota GR Yaris sử dụng động cơ 3 xi-lanh 1.6L tăng áp có công suất lên tới 276 mã lực. Hay như siêu xe hybrid BMW i8 với khối động cơ 3 xi-lanh 1.5L tăng áp, tạo ra 231 mã lực (chưa kể mô-tơ điện).
Những vấn đề cố hữu và cái giá của sự tinh gọn
Tuy nhiên, không có sự tinh gọn nào là miễn phí. Việc loại bỏ một xi-lanh mang đến những thách thức kỹ thuật không nhỏ. Vấn đề lớn nhất của động cơ 3 xi-lanh chính là độ rung và tiếng ồn. Do thiếu một xi-lanh so với cấu hình cân bằng tự nhiên của động cơ 4 xi-lanh, loại động cơ này dễ bị mất cân bằng mô-men xoắn, khiến xe rung rõ rệt ở vòng tua thấp hoặc khi tăng tốc mạnh.
Các nhà sản xuất thường khắc phục bằng trục cân bằng quay ngược chiều trục khuỷu hoặc giá đỡ động cơ cải tiến, nhưng điều này làm tăng chi phí và phức tạp trong thiết kế. Một điểm yếu khác là độ trễ tăng áp (turbo lag), đặc biệt rõ trên các động cơ dung tích nhỏ. Việc phụ thuộc nhiều vào nạp cưỡng bức khiến phản ứng chân ga đôi khi kém mượt mà, nhất là ở các mẫu xe đô thị giá rẻ.
Ngoài ra, do chỉ có ba piston, mỗi xi-lanh phải chịu tải trọng cao hơn, dẫn đến độ bền và tuổi thọ động cơ có thể bị ảnh hưởng nếu vận hành trong điều kiện khắc nghiệt hoặc bảo dưỡng kém. Trường hợp của động cơ Ford EcoBoost 1.0L là ví dụ điển hình, từng bị phản ánh về hiện tượng rò rỉ dung dịch làm mát và hỏng gioăng mặt máy do hoạt động ở nhiệt độ cao.
Giải pháp thông minh nhưng không dành cho mọi người
Không thể phủ nhận rằng động cơ 3 xi-lanh là bước tiến hợp lý trong xu hướng tiết kiệm năng lượng và thân thiện môi trường. Với ưu điểm nhỏ gọn, tiết kiệm, chi phí thấp và dễ tích hợp công nghệ hybrid, đây là lựa chọn lý tưởng cho những ai thường xuyên di chuyển trong đô thị, đề cao kinh tế và không quá chú trọng sức mạnh động cơ.
Tuy nhiên, với những ai yêu thích cảm giác lái mượt mà, khả năng tăng tốc mạnh mẽ hoặc thường xuyên di chuyển xa, cấu hình 4 xi-lanh dung tích lớn vẫn là lựa chọn hợp lý hơn. Suy cho cùng, giống như mọi công nghệ khác, động cơ 3 xi-lanh vẫn là một sự thỏa hiệp giữa hiệu quả và trải nghiệm, điều mà mỗi người lái phải tự mình cân nhắc.
Bạn có bình luận thế nào về góc nhìn trên? Hãy để lại bình luận bên dưới hoặc chia sẻ bài viết về Báo VietNamNet theo email: otoxemay@vietnamnet.vn. Các nội dung phù hợp sẽ được đăng tải. Xin cảm ơn!"
https://vietnamnet.vn/mazda-cx-5-the-he-moi-sap-ra-mat-dong-nam-a-cuoc-dua-phan-khuc-c-suv-them-nong-2460370.html,Không tìm thấy,,"TheoPaultan,Mazda CX-5thế hệ thứ ba vừa được hé lộ sẽ sớm ra mắt tại thị trường Đông Nam Á, mở màn tại Malaysia trong năm 2026. Nếu được đưa về nước, mẫu SUV ăn khách của thương hiệu Nhật Bản được kỳ vọng sẽ tiếp tục duy trì vị thế vững chắc tại Việt Nam – nơi CX-5 đang là “ông vua doanh số” trong phân khúcSUV/crossover cỡ C.
Theo kế hoạch, Mazda CX-5 thế hệ mới sẽ được phân phối tại Malaysia dưới dạng nhập khẩu nguyên chiếc (CBU) vào Quý 3/2026, trước khi chuyển sang lắp ráp trong nước (CKD) vào năm 2027.
Mazda CX-5 thế hệ thứ ba được kỳ vọng mang đến nhiều thay đổi về thiết kế và công nghệ. Xe có kích thước lớn hơn, cửa sau mở rộng, khoang hành lý dài và cao hơn, giúp tăng khả năng chứa đồ. Hãng cũng hạ thấp độ cao sàn khoang chứa, giúp việc xếp dỡ hành lý thuận tiện hơn.
Dưới nắp capo, CX-5 mới sử dụng động cơ xăng 4 xi-lanh 2.5L, kết hợp hệ thống mild-hybrid 24V, truyền động cầu trước qua hộp số tự động 6 cấp. So với bản hiện tại, thế hệ mới có thể sẽ loại bỏ tùy chọn động cơ 2.0L, hướng đến hiệu năng vận hành mạnh mẽ và tiết kiệm nhiên liệu hơn.
Đáng chú ý, thế hệ cũ của CX-5 vẫn được duy trì song song nhằm đáp ứng đa dạng nhu cầu khách hàng, đồng thời giữ giá bán linh hoạt hơn cho từng phân khúc người dùng.
Chiến lược bán song song hai thế hệ được đánh giá là bước đi khôn ngoan của Mazda, vừa giúp duy trì lượng khách hàng truyền thống, vừa mở rộng tệp khách hàng muốn trải nghiệm dòng xe mới. Ngoài Malaysia, Mazda CX-5 từng được xác nhận sẽ ra mắt thị trường Indonesia vào cuối năm sau.
Hiện chưa rõ thời điểm xe được bán ở Việt Nam nhưng có lẽ ngày ra mắt cũng không quá xa so với các thị trường Đông Nam Á khác.
Tại Việt Nam, Mazda CX-5 do THACO lắp ráp và phân phối nhiều năm liền là mẫu SUV/CUV bán chạy nhất thị trường. Trong 9 tháng đầu năm 2025 vừa qua, mẫu xe này ghi nhận 11.306 chiếc giao tới khách Việt, bỏ khá xa các đối thủ như Ford Territory (8.156 chiếc), Hyundai Tucson (5.910 chiếc), Honda CR-V (4.155 chiếc) hay KIA Sportage (1.505 chiếc)...
Với riêng thương hiệu Mazda, một mình CX-5 này chiếm tới 51,9% tổng lượng xe THACO-Mazda bàn giao tới tay khách Việt trong 9 tháng đầu năm. Không quá để nói Mazda CX-5 chính là nhân vật ""gánh"" doanh số cho cả hãng xe Nhật Bản tại Việt Nam.
Trong bối cảnh người tiêu dùng trong nước ngày càng chú trọng đến thiết kế, tiện nghi và khả năng vận hành, Mazda CX-5 mới – với sự cải tiến toàn diện – hứa hẹn vẫn là lựa chọn hàng đầu của nhóm khách hàng trẻ, năng động và yêu thích phong cách lái thể thao.
Dù vậy, với việc chỉ còn sử dụng động cơ 2.5L và bổ sung hệ thống mild-hybrid, CX-5 thế hệ mới nhiều khả năng sẽ có giá bán cao hơn đáng kể so với phiên bản hiện tại. Đây vừa là cơ hội để Mazda nâng tầm hình ảnh sản phẩm, nhưng cũng là thách thức lớn trong việc duy trì lợi thế cạnh tranh khi giá bán vẫn luôn là “vũ khí” hiệu quả nhất giúp CX-5 giữ ngôi vương suốt nhiều năm qua.
(Tổng hợp)
Bạn có bình luận thế nào về mẫu xe trên? Hãy để lại bình luận bên dưới hoặc chia sẻ bài viết về Báo VietNamNet theo email: otoxemay@vietnamnet.vn. Các nội dung phù hợp sẽ được đăng tải. Xin cảm ơn!"
https://vietnamnet.vn/honda-cb125t-doi-1993-zin-det-chu-xe-van-giu-hoa-don-mua-bang-11-5-cay-vang-2457740.html,Không tìm thấy,,"Mới đây, anh Đỗ Quang Tú (trú tại Phùng Hưng, Hà Nội) - người được giới chơi mô tô gọi với cái tên Tú Xiếc, khiến cộng đồng mê xe xuýt xoa khi chia sẻ trên trang cá nhân hình ảnh một chiếc Honda CB125T được giữ gìn rất cẩn thận và còn siêu mới.
Chiếc xeHondamang màu sơn ghi đen ""nòng súng"" khá đặc trưng, cùng vẻ ngoài ""zin"" đến từng chi tiết khiến nhiều người không khỏi trầm trồ, ví đây như “báu vật” gợi nhớ thời hoàng kim của những mẫu mô tô Nhật Bản cổ điển.
Chia sẻ với PV VietNamNet, anh Đỗ Quang Tú cho biết, dòng Honda CB125T được coi là ""huyền thoại"" mô tô, xuất hiện tại Việt Nam từ khoảng những năm 1980. Chiếc xe này đăng ký lần đầu năm 1993 tại TPHCM, vẫn được giữ nguyên biển 4 số.
""Tôi mua chiếc xe này từ năm ngoái từ một người chủ ở Sài Gòn. Trước đó, xe ""phủ bụi"" đã khá lâu, qua 32 năm mới chỉ lăn bánh 1.800km, tất cả phụ tùng trên xe đều nguyên bản và rất mới. Trên thị trường hiện nay khó có thể tìm được một chiếc Honda CB125T thứ 2 có số km lăn bánh thấp và chất xe tốt như vậy. Ngay khi chốt mua được, tôi đã chuyển về Hà Nội qua đường tàu hoả"", anh Tú kể.
Chiếc Honda CB 125T của anh Tú có ngoại thất màu đen ""nòng súng"" còn sáng bóng. Xe sở hữu thiết kế kiểu naked bike với các đường nét góc cạnh theo xu hướng thiết kế chung của thập niên 80, đồng thời lấy cảm hứng trực tiếp từ đàn anh cao cấp Honda CB750F ở thời điểm đó.
Những mảng thân xe hình khối giúp tổng thể thiết kế trở nên mạnh mẽ, cá tính. Ở bên dưới bình xăng, CB125T lại sở hữu hệ khung thép gióng đơn rất chắc chắn. Toàn bộ các chi tiết từ đôi gương, cặp lốp đều nguyên bản theo xe từ năm 1993.
""Năm 1993, chính chủ ở Sài Gòn phải bỏ ra đến 11,5 cây vàng để mua chiếc xe này. Hoá đơn mua bán hiện vẫn được giữ cho đến ngày nay và tôi ép plastic treo luôn trên xe"", anh Tú kể.
Chia sẻ lý do sở hữu chiếc xe đặc biệt này, anh Tú tâm sự rằng Honda CB125T chính là ""giấc mơ dang dở” từ thời thanh xuân - thuở mà anh cùng nhiều chàng trai Hà thành chỉ biết ngẩn ngơ ngắm nhìn chiếc xe ấy vụt qua phố.
""Những năm 1990, thanh niên 25-30 tuổi nào cưỡi lên chiếc CB125 này ra phố thì gái theo hàng đàn, cả Hà Nội đếm trên đầu ngón tay. Nhưng không biết bây giờ cưỡi lên xe này có cô gái nào theo nữa không..."", anh Tú hài hước.
Năm tháng trôi qua, dù đã có trong tay nhiều mẫu mô tô cổ quý hiếm, nhưng trong lòng anh vẫn luôn đau đáu một nỗi nhớ, một khát khao được chạm tay vào “huyền thoại hai máy” từng khiến bao thế hệ mê mẩn này. Giờ đây, khi giấc mơ năm xưa đã thành hiện thực, với anh, đó không chỉ là một chiếc xe, mà là một phần ký ức tuổi trẻ được sống lại.
Cũng theo chủ xe này, đã có nhiều người đến hỏi mua xe với giá trên 400 triệu nhưng anh chưa bán. Lý do được anh đưa ra là ""phải tìm được người phù hợp, có tình yêu mãnh liệt với xe cộ chứ không đơn giản chỉ là người có khả năng tài chính"".
Honda CB125T là mẫu mô tô côn tay cỡ nhỏ ra mắt từ năm 1982, được coi là phiên bản với thiết kế hiện đại và thể thao hơn của những người anh em Rebel 125, CD hay CM125. Trong thập niên 1990, Honda CB125T được nhập nguyên chiếc từ Nhật Bản về nước và được khá nhiều người ưa thích vì động cơ bền bỉ, trường dáng.
Bạn đang sở hữu một chiếc xe độc hay bản độ siêu đẹp? Hãy chia sẻ bài viết cảm nhận, hình ảnh về Báo VietNamNet theo email: otoxemay@vietnamnet.vn. Các nội dung phù hợp sẽ được đăng tải. Xin cảm ơn!"
