url,title,description,content
https://vietnamnet.vn/toyota-va-bmw-chung-minh-nganh-cong-nghiep-o-to-da-qua-voi-vang-voi-dien-khi-hoa-2459314.html,Không tìm thấy,,"Thực tế, cả BMW và Toyota không chống lại sự tiến bộ của ngành công nghiệp ô tô mà chỉ đơn giản là không tin rằngxe điện(EV) là ""con đường duy nhất"" dẫn đến tương lai bền vững. Giờ đây, khi sự hưng phấn ban đầu lắng xuống và doanh số xe điện toàn cầu có dấu hiệu chững lại, sự thận trọng của họ không còn giống như bảo thủ, mà là một nước cờ chiến lược khôn ngoan.
Cơn sốt điện khí hóa và cú phanh ""két"" của thực tế
Chỉ vài năm trước, một hồi kết có vẻ như rất sớm được viết chođộng cơ đốt trong(ICE). Volvo tuyên bố chỉ bán xe điện sau năm 2030. Ford châu Âu, Jaguar, và Bentley đều ấn định ngày ""khai tử"" động cơ xăng. Liên minh châu Âu (EU) cũng ra lệnh cấm bán xe ICE mới từ năm 2035.
Nhà đầu tư hồ hởi, truyền thông thì tung hô “tương lai không khói xăng dầu”. Cơ quan Năng lượng Quốc tế (IEA) thậm chí còn dự đoán rằng khoảng một nửa số xe mới có thể là xe điện vào đầu những năm 2030.
Nhưng thực tế đã sớm ""phũ phàng"" khi các rào cản cốt lõi như mạng lưới trạm sạc pin tại nhiều quốc gia thiếu đồng bộ và thưa thớt, chi phí pin dù đã giảm nhưng vẫn còn cao để xe điện có thể tiếp cận đại chúng một cách thực sự.
Kết quả là tăng trưởng chậm lại. Năm 2024, xe điện chỉ chiếm hơn 20% doanh số toàn cầu (thấp hơn nhiều so với dự báo) và chỉ 9% ở Mỹ. Trong khi đó, các thị trường đang phát triển như Nam Mỹ, Ấn Độ hay Đông Nam Á vẫn lệ thuộc vào xăng và diesel, vì hạ tầng sạc gần như chưa tồn tại.
Lúc này, thế giới bắt đầu đối mặt với thực tế về xe điện và nhận ra rằng quan điểm “đa dạng năng lượng” mà Toyota và BMW kiên định từ đầu bỗng trở nên sáng suốt một cách đáng ngạc nhiên.
Khó có thể nói BMW là một hãng xe bảo thủ. Nhưng thay vì đặt cược toàn bộ tương lai vào một công nghệ duy nhất, hãng xe sang Đức đã chọn cách phát triển một nền tảng có thể linh hoạt lắpđộng cơ xăng, hybrid, hybrid sạc điện hoặc xe điện hoàn toàn.
Điều đó cho phép BMW có thể kết hợp sản xuất các dòng xe khác nhau và điều chỉnh sản lượng ngay lập tức dựa trên nhu cầu thực tế của từng thị trường, thay vì bị trói buộc vào một giải pháp duy nhất.
BMWkhông xem động cơ đốt trong là “tội lỗi”. Họ tiếp tục tinh chỉnh các khối V8 (S68) V8 và I6 (B58) trứ danh để đạt chuẩn khí thải Euro 7, đồng thời thử nghiệm nhiên liệu tổng hợp và hydro (dự án iX5 Hydrogen hợp tác cùng Toyota).
Nếu BMW thực dụng, Toyota cho thấy sự điềm tĩnh của kẻ dẫn đầu thị trường. Từng tiên phong điện hóa từ năm 1997 với chiếc Prius hybrid, Toyota có nhiều trải nghiệm điện khí hóa thực tế hơn bất kỳ công ty nào khác, từ đó hiểu rõ thị trường toàn cầu không đồng nhất.
Thay vì dồn toàn lực cho xe điện thuần túy, Toyota chọn chiến lược “tiếp cận đa chiều"" để trung hòa carbon bằng cách kết hợpxe hybrid(HEV), hybrid sạc điện (PHEV), xe điện (EV) và xe chạy hydro (FCEV) trong một chiến lược toàn diện. Các động cơ xăng thế hệ mới của Toyota được thiết kế nhỏ gọn, hiệu suất nhiệt cao, có thể vận hành bằng nhiều loại nhiên liệu.
Ngoài ra, Toyota cùng Mazda và Subaru đang nghiên cứu nhiên liệu điện tổng hợp (e-fuel) và xăng sinh học, những giải pháp không cần cơ sở hạ tầng sạc tốn kém.
Không chỉ nói,Toyotacòn chứng minh bằng hành động khi những nguyên mẫu GR Yaris H2 và GR Corolla H2 đã chạy thử nghiệm bằng hydro đốt trong thực tế,chứng minh động cơ đốt trong vẫn có thể ""xanh"" nếu được áp dụng công nghệ phù hợp.
Đồng thời, Toyota vẫn tập trung một phần vào xe điện khi đầu tư mạnh vàopin thể rắnvới tham vọng quãng đường di chuyển 1.200 km mỗi lần sạc.
Lợi nhuận không nói dối
Năm 2024, những con số đã nói lên tất cả. BMW bán được 427.000 xe thuần điện, song doanh số xe xăng và hybrid vẫn vượt 2 triệu chiếc. Còn Toyota bán tới 4,1 triệu xe hybrid, 150.000 xe điện, nhiều hơn bất kỳ hãng nào khác mà vẫn giữ lợi nhuận ổn định. Ngược lại, Ford, GM và Volkswagen đồng loạt phải trì hoãn hoặc cắt giảm hàng tỷ USD đầu tư vào các dự án EV do nhu cầu chậm hơn dự báo.
Cả BMW và Toyota đều chọn thực dụng thay vì duy ý chí. Họ xây dựng chiến lược dựa trên kỹ thuật và hành vi người dùng, chứ không phải dựa trên áp lực chính trị hay dư luận. Sự linh hoạt này đã bảo vệ họ khỏi những biến động thị trường mà các hãng khác đang phải trả giá đắt.
Bài học về sự kiên nhẫn
Thập niên 2020 không phải là hồi kết của động cơ đốt trong, mà là thời điểm ngànhcông nghiệp ô tôhọc được bài học về sự kiên nhẫn. Điện khí hóa chắc chắn là một phần của tương lai, nhưng không phải là tương lai duy nhất.
Khi BMW và Toyota chọn giữ cái đầu lạnh giữa cơn sốt toàn cầu, họ không chỉ cứu lấy lợi nhuận, mà còn định nghĩa lại ý nghĩa của sự đổi mới. Họ không chạy theo trào lưu mà hiểu rõ giới hạn của thực tế. Sự kiên định ấy đang khiến cả ngành công nghiệp phải nhìn lại. Có lẽ, trong cuộc đua này, người chậm mới là kẻ nhìn xa nhất.
Theo CarBuzz, BMW, Toyota
Bạn có bình luận thế nào về góc nhìn trên? Hãy để lại bình luận bên dưới hoặc chia sẻ bài viết về Báo VietNamNet theo email: otoxemay@vietnamnet.vn. Các nội dung phù hợp sẽ được đăng tải. Xin cảm ơn!"
https://vietnamnet.vn/gia-dinh-di-o-to-bi-4-thanh-nien-di-xe-may-truy-duoi-gay-han-giua-duong-cao-toc-2459222.html,Không tìm thấy,,"Các vụ va chạm giao thông (road rage) đang có xu hướng gia tăng tại Ấn Độ trong vài năm trở lại đây. Không ít người đã đăng tải video về các tình huống nguy hiểm lên mạng xã hội, giúp cảnh sát có thêm căn cứ xử lý. Thành phố Bengaluru, nơi thường xuyên xảy ra các vụ việc dạng này, mới đây lại chứng kiến một vụ tấn công khiến dư luận phẫn nộ: một gia đình người miền Bắc Ấn Độ bị nhóm thanh niên đi xe máy chặn đầu, đập cửa xe giữa đường.
Xem video:
Đoạn video do kênh YouTube của Prateek Singh chia sẻ, được cho là do chính nạn nhân gửi đến. Camera hành trình trên xe ghi lại toàn bộ sự việc: chiếc ô tô chở gia đình đang lưu thông đúng tốc độ trên tuyến đường hai làn, vượt qua vài người đi xe máy phía trước mà không có gì bất thường. Tuy nhiên, chỉ sau chừng một cây số, nhóm thanh niên đi xe máy bất ngờ tăng tốc đuổi theo, áp sát và ra hiệu yêu cầu tài xế dừng xe.
Trên đoạn đường vắng, tài xế ô tô do dự nhưng vẫn dừng lại để xem chuyện gì xảy ra. Ngay lập tức, bốn người đàn ông đi xe máy nhảy xuống, bao vây chiếc SUV, lớn tiếng cãi cọ và cố mở cửa xe. Gia đình trong xe gồm phụ nữ và trẻ nhỏ hoảng loạn, tưởng rằng sắp bị cướp giữa ban ngày. Tài xế ô tô lập tức nhấn ga bỏ chạy, nhưng xe nhanh chóng bị kẹt lại trong dòng phương tiện phía trước, khiến nhóm người kia đuổi kịp.
Trong video, có thể nghe rõ tiếng gõ mạnh vào cửa xe cùng tiếng hét hoảng sợ của những người bên trong. Tài xế liên tục bóp còi, tìm cách yêu cầu các phương tiện khác nhường đường. Khi chiếc xe tải phía trước di chuyển, anh lập tức tăng tốc nhập vào đường cao tốc, thoát khỏi nhóm truy đuổi.
Theo phán đoán của người chia sẻ video, nhiều khả năng vụ việc bắt nguồn từ mâu thuẫn nhỏ khi chiếc ô tô vượt quá gần nhóm xe máy trước đó, khiến họ nổi giận và hành xử thiếu kiềm chế. Tuy nhiên, việc đuổi theo, đập phá xe và đe dọa người khác là hành vi nguy hiểm, có thể bị xử lý hình sự.
Các chuyên gia giao thông khuyến cáo, nếu gặp tình huống tương tự, người lái xe nên giữ bình tĩnh, khóa chặt cửa, không ra ngoài đối đầu và ngay lập tức gọi cảnh sát. Mọi phản ứng nóng nảy có thể khiến sự việc vượt ngoài tầm kiểm soát. Đáng tiếc, trong trường hợp này, tài xế cho biết đã cố gắng liên hệ với cảnh sát nhưng không nhận được phản hồi.
Vụ việc hiện đang thu hút sự chú ý trên mạng xã hội, với nhiều ý kiến kêu gọi cơ quan chức năng sớm truy tìm nhóm thanh niên gây rối để răn đe, đảm bảo an toàn cho người tham gia giao thông.
Tin bài cộng tác gửi về email: otoxemay@vietnamnet.vn. Các nội dung phù hợp sẽ được đăng tải. Xin cảm ơn!"
https://vietnamnet.vn/binh-xang-o-to-cu-bi-gi-set-nen-son-lai-di-tam-hay-bo-tien-thay-moi-2459615.html,Không tìm thấy,,"Tôi đang sử dụng một chiếc xe sedan cũ đời 2010. Gần đây, xe xuất hiện tình trạng rung giật và máy yếu rõ rệt. Khi kiểm tra, thợ phát hiện bên trongbình xăngcó nhiều cặn bẩn và gỉ sét do sử dụng lâu năm.
Theo kỹ thuật viên ở gara, lớp gỉ này bong ra mạt sắt, cùng với các loại cặn bẩn theo dòng nhiên liệu đi vào bơm xăng và kim phun, khiến hệ thống nhiên liệu hoạt động kém, động cơ không còn ổn định và hao xăng hơn trước.
Phía gara đưa ra lời khuyên nên thay một bình xăng mới với giá khoảng 6,5 triệu đồng. Tuy nhiên cũng gợi ý có thể tháo ra vệ sinh, tẩy gỉ sét và sơn lại cả trong lẫn ngoài với chi phí chỉ dưới 1 triệu, mềm hơn rất nhiều so với thay thế.
Hiện tôi đang phân không biết nên xử lý tạm thời cho tiết kiệm hay thay cả một bình đựng xăng mới để yên tâm sử dụng lâu dài. Và nếu tẩy gỉ, sơn lại thì có được bền hay không?
Rất mong nhận được ý kiến tư vấn từ các chuyên gia và người có kinh nghiệm sử dụngô tô cũ. Xin cảm ơn!
Độc giả Văn Xuân (Hoài Đức, Hà Nội)
Bạn có góc nhìn thế nào về nội dung trên? Hãy để lại bình luận bên dưới hoặc chia sẻ bài viết về Báo VietNamNet theo email: otoxemay@vietnamnet.vn. Các nội dung phù hợp sẽ được đăng tải. Xin cảm ơn!"
https://vietnamnet.vn/dan-xe-volkswagen-co-cuc-dep-va-quy-hiem-noi-bat-giua-vung-nong-thon-yen-binh-2459218.html,Không tìm thấy,,"Giữa vùng nông thôn yên bình ở miền Tây nước Anh, một người đàn ông đã biến chuồng gà cũ của gia đình thành “thánh địa” dành cho những chiếc Volkswagen cổ hiếm có. Với hơn chục mẫu xe được gìn giữ và phục chế cẩn thận, bộ sưu tập này được giới mê xe ví như “kho báu nước Đức giữa lòng nước Anh”.
Xem video:
Chuồng gà hóa bảo tàng xe cổ
Theo kênh The Late Brake Show trên YouTube, chủ nhân bộ sưu tập là một người đam mê Volkswagen từ thuở nhỏ. Gia đình ông từng làm đại lý nhập khẩu xe hơi, và chính từ đó tình yêu với thương hiệu Đức đã bén rễ. Sau nhiều năm sưu tầm, hiện ông đang sở hữu hơn 10 chiếc Volkswagen quý hiếm, tất cả đều được bảo quản trong một nhà kho từng là chuồng gà cũ.
Một trong những “viên ngọc quý” là Volkswagen Variant Type 3 1600 đời 1966, mẫu wagon cổ điển mang thiết kế đặc trưng của thập niên 60. Không chỉ để trưng, chủ nhân còn thường xuyên lái chiếc xe này vào mùa hè để chở những chú chó cưng dạo chơi quanh vùng.
“Bọ trắng” California và chiếc bán tải độc nhất vô nhị
Bên cạnh đó, bộ sưu tập còn có một Volkswagen Beetle mui trần nhập từ California, nổi bật với phong cách “triple white” sơn trắng, nội thất trắng và mui trắng. Dù toát lên vẻ thanh lịch hiếm có, chủ nhân tiết lộ đây cũng là “cơn ác mộng” khi giữ sạch, đặc biệt là sau lần… một con chim mòng biển để lại “dấu ấn” màu tím của quả mâm xôi trên mui xe.
Không chỉ có xe nhỏ xinh, bộ sưu tập còn sở hữu một chiếc Volkswagen Type 2 double-cab 1965, mẫu bán tải hai cabin cổ điển được phục chế toàn diện.
Xe có giá nóc, thùng chở hàng nhỏ và thậm chí cả khu bếp mini để pha trà hay chuẩn bị đồ ăn khi đi đường dài. Dù mang dáng dấp xe cổ, chiếc Type 2 vẫn được nâng cấp với hệ thống lái trợ lực và hộp số Beetle tỉ số cao, giúp xe dễ dàng di chuyển ở tốc độ 100 km/h.
Không chỉ có Volkswagen
Ngoài dàn Volkswagen huyền thoại, trong nhà kho đặc biệt này còn xuất hiện hai mẫu Morgan cổ điển biểu tượng của phong cách Anh quốc cùng vài chiếc mô tô độc đáo.Chủ nhân hiện sở hữu một chiếc Vespa hai thì cổ, một BMW R12 Special mang phong cách hoài cổ, và cả Honda CRF 300 chuyên off-road.
Bộ sưu tập này không chỉ thể hiện niềm đam mê với những cỗ máy bốn bánh, mà còn là minh chứng cho tình yêu bất tận dành cho văn hóa xe cổ châu Âu. Với người đàn ông vùng West Country, mỗi chiếc Volkswagen trong kho không đơn thuần là phương tiện, mà là một mảnh ký ức, một phần lịch sử còn sống động.
Theo Hotcars
Tin bài cộng tác gửi về email: otoxemay@vietnamnet.vn. Các nội dung phù hợp sẽ được đăng tải. Xin cảm ơn!"
https://vietnamnet.vn/di-5-van-km-khong-thay-dau-chu-xe-hyundai-tucson-o-ha-noi-nhan-hoa-don-khung-2459232.html,Không tìm thấy,,"Xe Tucson phải bổ máy vì ông chủ lười thay dầu
Anh Đình T. (Cầu Diễn, Hà Nội) vừa gặp sự cố hy hữu với chiếcHyundai Tucsonđời 2018 sau gần một năm mua và sử dụng. Vào tuần trước, chiếc xe sau khi khởi động đã phát ra tiếng kêu rất to ở động cơ, đèn Check Engine và đèn báo dầu trên bảng đồng hồ bật sáng, xe không thể di chuyển, buộc phải kéo vềgaraquen để xử lý.
Kể với PV VietNamNet, anh Đình T. cho biết đã mua chiếc Hyundai Tucson 2018 vào giữa năm ngoái với mục đích phục vụ cho công việc và những chuyến đi cùng gia đình. Lúc mua, đồng hồ xe hiển thị đã lăn bánh khoảng 60.000km. Trong một năm qua, anh chạy khoảng hơn 40.000km, tức trung bình hơn 3.000km mỗi tháng, con số khá cao so với mức sử dụng thông thường.
""Thời gian đầu, chiếc xe vận hành ổn định, nhưng gần đây tôi nhận thấy động cơ bắt đầu ì, tăng tốc chậm, máy nóng nhanh. Khi dừng lâu ở đèn đỏ, quạt gió kêu to, nhiệt độ nước làm mát có lúc tăng cao bất thường. Nhưng do đặc thù công việc bận liên tục phải di chuyển đi các tỉnh nên tôi cũng mặc kệ"", anh T. nói.
Kỹ sư Lê Hồng Đại, Giám đốc Công ty TNHH Phát triển thương mại ô tô Đại Linh (Đan Phượng, Hà Nội) - nơi tiếp nhận chiếc Hyundai Tucson này cho biết, sau khi xe được kéo về, kỹ thuật viên kiểm tra thì phát hiện xe bị bó máy nặng, dầu máy đã không còn, lọc dầu cũng đen kịt và tắc nghẽn. Tiếp tục tháo các-te, lớp cặn dầu dày bám quanh thành, có chỗ đã cháy sém do nhiệt cao.
""Khi hỏi anh T. đã bao lâu chưa thay dầu, tôi khá bất ngờ khi chủ xe này nói từ lúc mua đến giờ chưa thay lần nào. Tình trạng xe cho thấy, chiếc xe trên thực tế có thể đã đi trên 50.000km (5 vạn km) mà chưa được thay dầu máy, bao gồm cả số km của xe do chủ cũ sử dụng và số km mà anh T. cầm lái về sau"", kỹ sư Đại nhận định.
Được sự đồng ý của anh T., phía gara đã quyết định đại tu toàn bộ phần động cơ. Khi ""bổ máy"", cả chủ xe cũng như các kỹ thuật viên đều tá hoả khi toàn bộ bộ phận bên trong dầu máy bám đặc như...socola, có những vị trí bị cháy đen, đặc quánh. Các chi tiết như trục cam, bạc biên, xu-páp chịu mài mòn nặng đến mức không thể khắc phục.
Theo báo giá sơ bộ, chiếc Hyundai Tucson của anh T. sẽ phải khắc phục trong thời gian khoảng 2 tuần với chỉ phí xấp xỉ 50 triệu đồng - cái giá quá đắt cho sự lơ đễnh, thiếu kiến thức và kinh nghiệm sử dụng xe của anh T.
Bài học cho người mua xe cũ
Theo kỹ sư ô tô Lê Hồng Đại, dầu nhớt là “mạch máu” của động cơ, giúp bôi trơn, làm mát và bảo vệ các chi tiết kim loại khỏi mài mòn. Khi dầu nhớt bị xuống cấp, không chỉ mất khả năng bảo vệ mà còn sinh ra cặn carbon, làm tắc đường dẫn dầu và tăng ma sát trong khoang động cơ.
Ngoài ra, trong dầu máy còn có các chất phụ gia làm mát động cơ. Các chất này khi sử dụng nhiều hoặc để lâu ngày sẽ bị mất tác dụng, khiến động cơ dễ bị quá nhiệt, cong vênh dẫn tới phá huỷ các chi tiết máy,… rất tốn kém để khắc phục.
Theo vị chuyên gia này, dầu máy cần được thay định kỳ theo đúng khuyến cáo của hãng.
Thông thường đối với xe mới là 1.000km đầu tiên và mỗi 5.000km tiếp theo. Một số hãng xe của châu Âu sử dụng các loại dầu máy có thể đi được 10.000km mới phải thay thế.
Kỹ sư Đại cũng lưu ý, với những xe ít sử dụng, nên thay dầu định kỳ hàng năm mà không cần phải chờ đi được 5.000 km. Nên chú ý thay cả lọc dầu sau 10.000 km.
Đồng thời, cần thường xuyên kiểm tra mức dầu máy. Nếu xe có hiện tượng ăn dầu (hao dầu), cần đưa đến các gara uy tín để tìm nguyên nhân và xử lý ngay.
Từ câu chuyện của anh Đình T. ở trên, các chuyên gia về kỹ thuật ô tô khuyến nghị người mua xe đã qua sử dụng cần đặc biệt lưu ý đến hồ sơ bảo dưỡng và lịch thay dầu của xe. Khi mới nhận xe, nên hỏi lại kỹ chủ cũ và để chắc chắn có thể thay dầu nhớt, lọc dầu ngay, đồng thời ghi lại số ODO để kiểm tra, thay thế định kỳ.
Việc quên thay dầu tưởng nhỏ nhưng có thể gây hậu quả nghiêm trọng, khiến động cơ xuống cấp nhanh chóng và chi phí sửa chữa gấp nhiều lần so với tiền thay dầu định kỳ.
Bạn có góc nhìn thế nào về nội dung trên? Hãy để lại bình luận bên dưới hoặc chia sẻ bài viết về Báo VietNamNet theo email: otoxemay@vietnamnet.vn. Các nội dung phù hợp sẽ được đăng tải. Xin cảm ơn!"
https://vietnamnet.vn/dan-sieu-xe-ferrari-cuc-hiem-sap-duoc-ban-dau-gia-co-chiec-50-nam-moi-di-400km-2459248.html,Không tìm thấy,,"Bộ sưu tậpsiêu xegồm 48 chiếc Ferrari trải dài qua hơn nửa thế kỷ – từ thập niên 1950 đến 2010 – đại diện cho những tinh hoa trong lịch sử thương hiệu xe thể thao Ý đã được lên lịch bán đấu giá vào tháng 1/2026 tại Mecum (Mỹ).
Nhiều mẫu xe mang cấu hình đặc biệt, thể hiện gu thẩm mỹ tinh tế của người sưu tầm, đồng thời phản ánh niềm đam mê sâu sắc vớiFerrari. Đây được xem là cơ hội hiếm hoi cho những ai mơ ước sở hữu “ngựa chồm” Maranello trong tình trạng gần như mới xuất xưởng.
Chủ nhân của bộ sưu tập ấn tượng này là Phil Bachman, doanh nhân Mỹ thành đạt đã qua đời hồi tháng 8 vừa qua. Ông từng điều hành nhiều đại lý xe hơi bao gồm các thương hiệu từ Pontiac, Cadillac đến Nissan, Jeep, Renault, Ram và cả DeLorean.
Phil Bachman mua chiếc Ferrari đầu tiên vào năm 1984 và suốt hàng chục năm sau đó, ông kiên trì gây dựng nên một “gia tài” xe độc đáo, được bảo quản tỉ mỉ gần như hoàn hảo.
Chiếc xe cổ nhất trong bộ sưu tập là Ferrari 166 MM/53 Vignale Spyder đời 1953, đã chạy hơn 37.000 km. Tiếp đến là hai chiếc siêu xe của thập niên 1960: 250 GT/L Berlinetta Lusso và 275 GTB/4 Alloy, được xem là kiệt tác khi có sự cân bằng trong thiết kế.
Bộ sưu tập có thêm 11 chiếc xe của thệp niên 1970, trong đó đáng chú ý nhất là chiếc Ferrari 365 GT4 BB đời 1975 chỉ mới lăn bánh 443 km. Nhưng đó chưa phải chiếc xe sử dụng ít nhất. Trong bộ sưu tập này, một chiếc Testarossa sản xuất năm 1989 mới chỉ lăn bánh vỏn vẹn 413 km và một chiếc F50 chạy đúng 404 km.
Không thể không nhắc đến hai chiếc Ferrari F40 đời 1992, cùng mang màu đỏ đặc trưng Rosso Corsa. Một chiếc mới đi 734 km, chiếc còn lại chỉ 1.392 km – cả hai được kỳ vọng sẽ đạt giá hơn 3 triệu USD mỗi chiếc khi đấu giá.
Ngoài ra, bộ sưu tập có một chiếc Enzo chạy được 1.038 km và hai chiếc 360 Challenge Stradale đều chạy dưới 644 km.
Góp phần làm tăng thêm sự hiếm có là chiếc Ferrari FXX màu vàng duy nhất được sơn nguyên bản từ trước đến nay, cùng với một chiếc 430 Scuderia và 16M Spider tương tự với số km lăn bánh thấp.
Danh sách xe tiếp tục với một chiếc 599 GTO đã chạy 166 km và một chiếc 599 SA Aperta đã chạy 277 km. Cuối cùng, bộ sưu tập được hoàn thiện với chiếc LaFerrari Coupe đã đi được 253 km và chiếc LaFerrari Aperta thậm chí còn hiếm hơn với số quãng đường lăn bánh là 154 km.
Có thể nói, đây là bộ sưu tập xe hơi tư nhân ""có một không hai"" trên thế giới. Mỗi chiếc xe là một lát cắt lưu giữ quá trình phát triển của Ferrari, được bảo quản trong tình trạng gần như hoàn hảo. Tất cả hợp lại, tạo nên một di sản ô tô phi thường, hứa hẹn sẽ trở thành tâm điểm của giới sưu tầm toàn cầu vào đầu năm tới.
Một số hình ảnh khác của bộ sưu tập này:
(Theo Carscoops)
Bạn có góc nhìn thế nào về nội dung trên? Hãy để lại bình luận bên dưới hoặc chia sẻ bài viết về Báo VietNamNet theo email: otoxemay@vietnamnet.vn. Các nội dung phù hợp sẽ được đăng tải. Xin cảm ơn!"
