url,title,description,content
https://vietnamnet.vn/viet-nam-lao-campuchia-tang-cuong-lan-toa-gia-tri-tot-dep-cua-phat-giao-2457088.html,Không tìm thấy,,"Hội nghị là hoạt động hợp tác quan trọng giữa Bộ Lễ nghi và Tôn giáo cùng Hội đồng Tăng già Tối cao Campuchia; Bộ Dân tộc và Tôn giáo cùng Giáo hội Phật giáo Việt Nam; Bộ Nội vụ và Giáo hội Phật giáo Lào. Các bên đã thống nhất tổ chức hội nghị theo cơ chế luân phiên, thể hiện tinh thần gắn kết và hợp tác bền chặt giữa Phật giáo ba nước.
Tham dự lễ khai mạc, về phía Campuchia có bà Men Sam An, Cố vấn tối cao của Quốc vương, Chủ tịch Hội đồng Mặt trận Đoàn kết phát triển Tổ quốc Campuchia, Phó Chủ tịch Đảng Nhân dân Campuchia; ông Chay Borin, Bộ trưởng Bộ Lễ nghi và Tôn giáo Campuchia cùng các vị Trưởng đoàn, chư Tăng đại diện Phật giáo ba nước Campuchia, Việt Nam, Lào.
Phía Việt Nam, Thứ trưởng Bộ Dân tộc và Tôn giáo Nguyễn Hải Trung tham dự và phát biểu.
Thay mặt Chính phủ Hoàng gia Campuchia, Thủ tướng Samdech Moha Borvor Thipadei Hun Manet đã gửi thông điệp chúc mừng hội nghị.
Thông điệp nhấn mạnh, Hội nghị Thượng đỉnh Phật giáo lần này có ý nghĩa quan trọng đối với Campuchia, Lào và Việt Nam. Hội nghị không chỉ tiếp tục củng cố và phát huy tình đoàn kết hữu nghị truyền thống, phù hợp với phương châm “Láng giềng tốt đẹp, hữu nghị truyền thống, hợp tác toàn diện và ổn định lâu dài”, mà còn là dịp để tôn vinh và khẳng định vai trò của Phật giáo trong đời sống của ba nước, nhấn mạnh những đóng góp thiết thực của đạo Phật đối với phát triển kinh tế, xã hội, giáo dục và văn hóa.
Hội nghị Thượng đỉnh Phật giáo Việt Nam - Lào - Campuchia lần thứ 3 không chỉ thể hiện bước tiến trong việc tôn trọng và thực hành Phật pháp, mà còn là cơ hội để tăng cường sự đoàn kết giữa tăng ni, Phật tử ba nước trong công cuộc xây dựng hòa bình và hòa hợp xã hội. Tại Hội nghị, đại biểu đã lắng nghe đại diện các đoàn trình bày tham luận và thảo luận một số vấn đề liên quan tới chủ đề “Hài hòa Phật giáo vì hòa bình và phát triển bền vững”
Tại hội nghị, các đại biểu khẳng định Phật giáo không chỉ là di sản tinh thần quý báu, phản ánh bản sắc văn hóa và lịch sử của mỗi dân tộc, mà còn là giá trị tinh thần chung, góp phần hình thành những nền tảng đạo đức, nhân văn vững chắc cho sự hòa bình và phát triển bền vững trong khu vực.
Việc gìn giữ và phát huy các giá trị từ bi, trí tuệ, hòa hợp của Phật giáo không chỉ nâng cao đời sống tinh thần của cộng đồng, mà còn củng cố sự gắn kết, tăng cường tình hữu nghị và hợp tác giữa ba dân tộc Việt Nam – Lào – Campuchia. Đây là một minh chứng rõ ràng cho vai trò then chốt của Phật giáo trong việc kiến tạo một khu vực ổn định, thịnh vượng, nơi lợi ích của nhân dân từng quốc gia hòa quyện với mục tiêu chung vì hòa bình và tiến bộ của toàn khu vực.
Phát biểu tham luận tại hội nghị, ông Nguyễn Hải Trung, Thứ trưởng Bộ Dân tộc và Tôn giáo nhấn mạnh: Việt Nam đánh giá cao chủ đề của hội nghị năm nay. Khi thế giới đang tồn tại những cuộc xung đột vũ trang để hai từ “hòa bình” vẫn còn là khát vọng; khi xã hội một số nơi còn bất ổn, bất định để “sự hòa hợp” giữa con người với con người, giữa con người với thiên nhiên còn là “niềm mơ ước”… thì việc cùng nhau hội họp để bàn thảo đưa ra các giải pháp, biến khát vọng, ước mơ của mọi người dân trên trái đất trở thành hiện thực, biến hậu quả trở thành kết quả trong các công cuộc phát triển, kiến thiết là một việc làm có ý nghĩa hết sức thiết thực và đáng được tôn vinh…
Để đảm bảo các mục tiêu của Hội nghị Thượng đỉnh Phật giáo Việt Nam - Lào - Campuchia được triển khai hiệu quả, Thứ trưởng Nguyễn Hải Trung cho biết, Bộ Dân tộc và Tôn giáo Việt Nam đề xuất định hướng phối hợp với Campuchia và Lào xây dựng phương án hỗ trợ Phật giáo triển khai hoạt động tại mỗi nước, tăng cường kết nối ba nước theo chủ đề “Sự hòa hợp Phật giáo vì hòa bình và phát triển bền vững”.
Bộ cũng sẽ tạo điều kiện thuận lợi để Giáo hội Phật giáo Việt Nam hợp tác với Phật giáo Campuchia và Lào. Đồng thời, Thứ trưởng đề nghị tổ chức Phật giáo ba nước xây dựng chương trình hành động chung, thúc đẩy hòa hợp, hòa bình, lan tỏa giá trị tốt đẹp của Phật giáo và tham gia hiệu quả các chương trình vì cuộc sống ấm no, hạnh phúc cho nhân dân.
Theo chương trình hội nghị, buổi chiều các đoàn sẽ tiếp tục tiến hành thảo luận và ký kết tuyên bố chung của Hội nghị. Sau đó, đại diện đoàn đại biểu Lào sẽ tiếp nhận đăng cai tổ chức Hội nghị Thượng đỉnh Phật giáo lần thứ 4."
https://vietnamnet.vn/tuyen-dung-nhan-su-ban-quan-ly-du-an-chuyen-nganh-xay-dung-2457508.html,Không tìm thấy,,"Ban Quản lý dự án được Bộ Dân tộc và Tôn giáo giao nhiệm vụ chủ đầu tư của các dự án: Dự án Đầu tư xây dựng Học viện Dân tộc, dự án Đầu tư xây dựng trường Dự bị Đại học Dân tộc trung ương Nha Trang, dự án Đầu tư cơ sở vật chất cho 5 trường chuyên biệt.
Với khối lượng công việc đang triển khai rất lớn, Ban Quản lý dự án có kế hoạch tuyển dụng lao động. Cụ thể: 2 viên chức gồm kế toán trưởng và kế toán viên; 4 lao động hợp đồng gồm: 1 người ở vị trí hành chính văn phòng, 1 thẩm kế viên và 2 vị trí quản lý dự án.
Điều kiện: Người có đủ điều kiện không phân biệt dân tộc, nam hay nữ, thành phần xã hội, tín ngưỡng, tôn giáo được phép nộp hồ sơ dự tuyển: Là công dân có quốc tịch Việt Nam, đủ 18 tuổi trở lên, có lý lịch rõ ràng, đủ sức khỏe để thực hiện công việc, đáp ứng yêu cầu chuyên môn nghiệp vụ, kinh nghiệm phù hợp với vị trí việc làm tuyển dụng.
Phương thức tuyển dụng: Thông qua hình thức xét tuyển hồ sơ, phỏng vấn và thử việc tại đơn vị.
Hồ sơ dự tuyển: Đơn xin đăng ký tuyển dụng theo mẫu quy định; sơ yếu lý lịch; 4 tấm hình 3x4; bản sao CCCD; các bản sao văn bằng/chứng chỉ đào tạo; lý lịch tư pháp.
Thời gian cuối cùng nộp hồ sơ: 17h ngày 11/11/2025 hoặc cho đến khi tuyển dụng đủ vị trí việc làm theo yêu cầu.
Địa chỉ: Ban Quản lý dự án đầu tư chuyên ngành xây dựng, tầng 14 trụ sở Bộ Dân tộc và Tôn giáo, số 349 Đội Cấn, phường Ngọc Hà, thành phố Hà Nội. Liên hệ: Ông Nguyễn Đình Đại – chuyên viên phòng Hành chính – Kế toán, số điện thoại:0988233181."
https://vietnamnet.vn/bo-dan-toc-va-ton-giao-du-hoi-nghi-thuong-dinh-phat-giao-tai-campuchia-2456892.html,Không tìm thấy,,"Chuyến công tác diễn ra theo lời mời của Bộ trưởng Bộ Lễ nghi và Tôn giáo Campuchia. Hội nghị chính thức diễn ra trong 2 ngày từ 28 - 29/10 với chủ đề “Hài hòa Phật giáo vì hòa bình và phát triển bền vững”.
Đón Đoàn tại sân bay quốc tế Phnom Penh có bà Min Chandyneth, Quốc vụ khanh, Thứ trưởng Bộ Lễ nghi và Tôn giáo Campuchia, cùng đại diện lãnh đạo các vụ, cục của Bộ.
Ngay sau khi đến Phnom Penh, Đoàn đã đến chào xã giao ngài Chay Borin, Bộ trưởng Bộ Lễ nghi và Tôn giáo Campuchia.
Tại buổi tiếp, hai bên trao đổi thân mật, cởi mở về tình hình hợp tác trong lĩnh vực dân tộc và tôn giáo, đánh giá cao những kết quả đạt được trong thời gian qua, đặc biệt là việc triển khai Bản ghi nhớ hợp tác giai đoạn 2022–2026 giữa hai Bộ.
Thay mặt Bộ Dân tộc và Tôn giáo Việt Nam, Thứ trưởng Nguyễn Hải Trung trân trọng chuyển lời chào và lời cảm ơn của Bộ trưởng Đào Ngọc Dung tới ngài Chay Borin về lời mời tham dự Hội nghị. Thứ trưởng đồng thời trân trọng mời ngài Chay Borin sang thăm và làm việc tại Việt Nam, đặc biệt là tại Bộ Dân tộc và Tôn giáo, nhằm tiếp tục trao đổi kinh nghiệm và thúc đẩy hợp tác hiệu quả giữa hai Bộ trong thời gian tới.
Thứ trưởng Nguyễn Hải Trung khẳng định, Hội nghị Thượng đỉnh Phật giáo Việt Nam - Lào - Campuchia lần thứ 3 là sự kiện có ý nghĩa quan trọng, góp phần tăng cường giao lưu tôn giáo và thắt chặt tình đoàn kết giữa nhân dân ba nước. Với tinh thần trách nhiệm và tình cảm gắn bó, Đoàn Việt Nam sẽ tích cực tham gia, đóng góp thiết thực cho thành công của Hội nghị.
Thứ trưởng nhấn mạnh, quan hệ hữu nghị truyền thống Việt Nam - Campuchia thời gian qua không ngừng được củng cố và phát triển ở mọi lĩnh vực, trong đó có hợp tác giữa Bộ Dân tộc và Tôn giáo Việt Nam và Bộ Lễ nghi và Tôn giáo Campuchia. Hai bên đã phối hợp tổ chức nhiều đoàn công tác, hội thảo, chương trình trao đổi kinh nghiệm về quản lý nhà nước trong lĩnh vực tôn giáo và dân tộc, đồng thời hỗ trợ đồng bào dân tộc thiểu số sinh sống dọc biên giới hai nước ổn định cuộc sống, giữ gìn bản sắc văn hóa và tăng cường tinh thần đoàn kết, hữu nghị.
Cùng với đó, sự gắn kết giữa các tổ chức Phật giáo Việt Nam và Campuchia, đặc biệt là Phật giáo Nam tông Khmer, ngày càng bền chặt thông qua các hoạt động giao lưu, thăm viếng, trao đổi tăng ni, góp phần củng cố nền tảng tinh thần, văn hóa và tình cảm tốt đẹp giữa nhân dân hai nước.
Thứ trưởng Nguyễn Hải Trung cũng chia sẻ, Luật Tín ngưỡng, Tôn giáo của Việt Nam, có hiệu lực từ năm 2016 thể hiện sự quan tâm đặc biệt của Đảng và Nhà nước Việt Nam đối với lĩnh vực này. Hiện nay, Việt Nam đang tiến hành tổng kết, hoàn thiện Luật nhằm đáp ứng yêu cầu thực tiễn mới. Trên cơ sở đó, Bộ Dân tộc và Tôn giáo Việt Nam sẵn sàng chia sẻ kinh nghiệm trong công tác dân tộc và tôn giáo với Bộ Lễ nghi và Tôn giáo Campuchia trên tinh thần tin cậy, hữu nghị và cùng phát triển.
Cảm ơn Thứ trưởng Nguyễn Hải Trung và Đoàn công tác Việt Nam, Bộ trưởng Chay Borin đánh giá cao kết quả hợp tác giữa hai Bộ trong thời gian qua, bày tỏ mong muốn tiếp tục tăng cường phối hợp chặt chẽ hơn nữa trong triển khai các chương trình, hoạt động cụ thể, nhằm nâng cao hiệu quả công tác dân tộc và tôn giáo. Ngài Chay Borin khẳng định, Campuchia luôn coi trọng và sẵn sàng hợp tác với Việt Nam trên tinh thần đoàn kết, hữu nghị và hiểu biết lẫn nhau.
Trên cơ sở đó, hai bên thống nhất duy trì cơ chế trao đổi đoàn, chia sẻ thông tin, tăng cường giao lưu giữa các tổ chức tôn giáo và cộng đồng dân tộc hai nước, góp phần củng cố quan hệ hợp tác bền chặt, tăng cường sự hiểu biết, tin cậy giữa hai Bộ, hai Chính phủ, vì ổn định, phát triển và thịnh vượng chung của hai quốc gia Việt Nam - Campuchia.
Chiều cùng ngày, Đoàn công tác Bộ Dân tộc và Tôn giáo Việt Nam do Thứ trưởng Nguyễn Hải Trung dẫn đầu đã đến thăm và tặng quà cán bộ, nhân viên Đại sứ quán Việt Nam tại Campuchia.
Tại buổi gặp, Thứ trưởng Nguyễn Hải Trung chúc mừng những kết quả quan trọng mà Đại sứ quán đạt được trong thời gian qua, đồng thời chia sẻ, động viên cán bộ, nhân viên vượt qua khó khăn, tiếp tục phát huy tinh thần trách nhiệm và tình cảm, phát triển hơn nữa quan hệ hữu nghị truyền thống Việt Nam - Campuchia."
https://vietnamnet.vn/cao-bang-co-ban-hoan-thanh-xoa-nha-tam-nha-dot-nat-2456729.html,Không tìm thấy,,"XEM CLIP:
Ngày 27/10, Ban Chỉ đạo triển khai xóa nhà tạm, nhà dột nát tỉnh Cao Bằng tổ chức Hội nghị tổng kết thực hiện hỗ trợ xóa nhà tạm, nhà dột nát trên địa bàn tỉnh giai đoạn 2021 - 2025.
Dự hội nghị có bà Nông Thị Hà, Thứ trưởng Bộ Dân tộc và Tôn giáo; ông Bế Thanh Tịnh, Phó Bí thư Thường trực Tỉnh ủy Cao Bằng; ông Vũ Hồng Quang, Phó Bí thư Tỉnh ủy, Trưởng ban Chỉ đạo triển khai xóa nhà tạm, nhà dột nát tỉnh Cao Bằng; đại diện Bộ Công an, Bộ Quốc phòng, Bộ Xây dựng…
Tại hội nghị, Phó Bí thư Tỉnh ủy Cao Bằng Vũ Hồng Quang cho biết: Quá trình triển khai chương trình gặp nhiều khó khăn, nhất là nguồn lực để thực hiện. Nhưng ngay từ những năm đầu, Đảng bộ tỉnh đã xác định xóa nhà tạm là một trong các nhiệm vụ trọng tâm, bằng mọi cách phải hoàn thành.
“Sau hơn 4 năm triển khai, với sự chỉ đạo quyết liệt, sâu sát của Tỉnh ủy, HĐND, UBND tỉnh sự vào cuộc đồng bộ của cả hệ thống chính trị từ tỉnh đến cấp cơ sở. Đặc biệt là sự hưởng ứng chung tay, đồng hành của các tầng lớp Nhân dân, các cơ quan doanh nghiệp, lực lượng vũ trang và các nhà hảo tâm. Chương trình đã đạt được kết quả nổi bật, toàn diện và hết sức đáng tự hào; không chỉ là hoạt động hỗ trợ nhà ở, mà là cuộc vận động lớn về nhận thức tinh thần xã hội”, Phó Bí thư Tỉnh ủy Cao Bằng cho hay.
Theo Phó Bí thư Tỉnh ủy Vũ Hồng Quang, trong công cuộc thực hiện chương trình, tỉnh Cao Bằng đã tạo dấu ấn với nhiều cách làm sáng tạo. Một số xã trên địa bàn tỉnh, chính quyền địa phương đã tổ chức làm việc trực tiếp với các công ty xây dựng, hợp tác xã cơ khí và tổ xây dựng tại địa phương đảm bảo thi công hiệu quả, giá rẻ. Đặc biệt tại một số xã, Ban chỉ đạo trực tiếp tiến hành tham gia hỗ trợ, chuẩn bị động thổ, khởi công đồng loạt các nhà trong cùng một xóm.
Phát biểu tại Hội nghị, bà Nông Thị Hà - Thứ trưởng Bộ Dân tộc và Tôn giáo - khẳng định: Cao Bằng đã hoàn thành xóa nhà tạm trên địa bàn toàn tỉnh đúng tiến độ chung của cả nước. Thành quả này một lần nữa khẳng định tinh thần đại đoàn kết, truyền thống “lá lành đùm lá rách”, tạo nên sức mạnh to lớn của nhân dân ta, đồng thời thấy được vai trò, trách nhiệm của các cấp, các ngành, qua đó củng cố niềm tin của nhân dân đối với Đảng, Nhà nước.
“Việc hoàn thành xóa nhà tạm là chúng ta đã hoàn thành một nhiệm vụ quan trọng. Nhưng điều cốt lõi vẫn là nâng cao chất lượng sống cho nhân dân. Xóa nhà tạm chỉ là bước khởi đầu, điều quan trọng hơn là phải giúp người dân thực sự vươn lên trong cuộc sống”, bà Hà nhấn mạnh.
Theo rà soát cuối năm 2020, toàn tỉnh Cao Bằng có 48.479 hộ nghèo, cận nghèo, chiếm tỷ lệ 37,31% số hộ trên địa bàn tỉnh. Trong đó có 6.602 hộ nghèo, hộ chính sách đang ở trong những căn nhà tạm, nhà dột nát - đây là “lõi nghèo” cần được quan tâm đặc biệt để “an cư lạc nghiệp”.
Xuất phát từ thực tiễn đó, Ban Thường vụ Tỉnh ủy đã ban hành Nghị quyết số 04 ngày 15/7/2021 về lãnh đạo thực hiện Chương trình hỗ trợ xóa nhà tạm, nhà dột nát trên địa bàn tỉnh, xác định đây là nhiệm vụ chính trị trọng tâm, thường xuyên.
Trong giai đoạn 2021 – 2025, toàn tỉnh đã triển khai thực hiện xóa nhà tạm, nhà dột nát cho 19.067/20.013 hộ nghèo, hộ cận nghèo, hộ gia đình chính sách; trong đó, xây mới 13.719 hộ, sửa chữa 5.322 hộ; nhà lắp ghép 26 hộ, đạt 95,3% kế hoạch, đạt 100% so với nhu cầu người dân. Như vậy, đến hết ngày 29/8/2025, tỉnh đã cơ bản hoàn thành kế hoạch đề ra.
Nhân dịp này, Ban tổ chức đã trao Bằng khen của Chủ tịch UBND tỉnh cho 21 tập thể, 14 cá nhân có thành tích xuất sắc trong thực hiện Chương trình xóa nhà tạm, nhà dột nát trên địa bàn tỉnh."
https://vietnamnet.vn/bo-nhiem-chanh-van-phong-pho-chanh-van-phong-dang-uy-bo-dan-toc-va-ton-giao-2456711.html,Không tìm thấy,,"Cùng dự có đồng chí Y Vinh Tơr, Ủy viên Dự khuyết Trung ương Đảng, Phó Bí thư Thường trực Đảng ủy, Thứ trưởng Bộ Dân tộc và Tôn giáo; đồng chí Cầm Văn Thanh, Phó Bí thư chuyên trách Đảng ủy Bộ Dân tộc và Tôn giáo; các Ủy viên Ban Thường vụ; đại diện lãnh đạo các vụ, đơn vị thuộc Bộ.
Tại Hội nghị, ông Hà Trọng Nghĩa, Phó Trưởng Ban Tổ chức Đảng ủy, đã công bố: Quyết định số 16-QĐ/ĐU của Đảng ủy Bộ Dân tộc và Tôn giáo về việc điều động, bổ nhiệm ông Đào Xuân Quy - Phó Vụ trưởng Vụ Chính sách, Bộ Dân tộc và Tôn giáo giữ chức Chánh Văn phòng Đảng ủy Bộ Dân tộc và Tôn giáo, kể từ ngày 1/11/2025; Quyết định số 15-QĐ/ĐU của Đảng ủy Bộ Dân tộc và Tôn giáo về việc bổ nhiệm ông Trịnh Văn Tân - Chuyên viên Văn phòng Đảng ủy Bộ Dân tộc và Tôn giáo giữ chức Phó Chánh Văn phòng Đảng ủy Bộ Dân tộc và Tôn giáo, kể từ ngày 1/11/2025.
Trao quyết định và phát biểu chỉ đạo tại Hội nghị, Bộ trưởng Bộ Dân tộc và Tôn giáo Đào Ngọc Dung chúc mừng các đồng chí được nhận quyết định bổ nhiệm và nhấn mạnh, đây là sự kiện quan trọng của Đảng ủy Bộ trong việc kịp thời kiện toàn bộ máy.
Nhấn mạnh vị trí, vai trò quan trọng của Văn phòng Đảng ủy Bộ, Bí thư Đảng ủy, Bộ trưởng Đào Ngọc Dung đánh giá: Ông Đào Xuân Quy là cán bộ năng động, được đào tạo bài bản, có kinh nghiệm, trải nghiệm trong thực tiễn công việc ở các vị trí khác nhau. Ông Trịnh Văn Tân là cán bộ trẻ, trưởng thành từ ngành Quân đội, có nhiệt huyết, thận trọng, kỹ càng trong công việc. Hai cán bộ được bổ nhiệm rất xứng đáng với yêu cầu, vị trí công việc và quy trình bổ nhiệm được tiến hành chặt chẽ.
Bộ trưởng Đào Ngọc Dung đánh giá cao Văn phòng Đảng ủy, các Ban Đảng, Vụ Chính sách trong thời gian qua đã hoàn thành tốt chức trách, nhiệm vụ, cũng như tham mưu trong công tác bổ nhiệm cán bộ.
Giao nhiệm vụ cho các cán bộ được bổ nhiệm, Bí thư Đảng ủy, Bộ trưởng Đào Ngọc Dung lưu ý, để Văn phòng Đảng ủy phát huy vai trò trong công tác tham mưu đúng, trúng, kịp thời, nâng cao hiệu quả hoạt động của Bộ, thì lãnh đạo Văn phòng Đảng ủy phải có tinh thần trách nhiệm cao, mẫn cán, tận tụy với công việc; phải đổi mới phương thức tham mưu, đề xuất nội dung, giải pháp rõ ràng; phát huy tính chủ động của Văn phòng Đảng ủy với tinh thần “nói ít, nói ngắn, viết ngắn, nhưng chất lượng, tham mưu kịp thời”.
Bộ trưởng cũng đề nghị các lãnh đạo Văn phòng Đảng ủy cần thể hiện tốt vai trò đầu mối phối hợp công việc, cải tiến phương thức hoạt động của Văn phòng, phải đặc biệt quan tâm đến nguyên tắc làm việc, chỉn chu và thận trọng.
Phát biểu tại Hội nghị, tân Chánh Văn phòng Đảng ủy Đào Xuân Quy bày tỏ xúc động và vinh dự khi nhận nhiệm vụ mới.
""Tôi nhận thức rõ, Văn phòng Đảng ủy có vai trò đặc biệt quan trọng, là cơ quan tham mưu, giúp việc Đảng ủy; trực tiếp và thường xuyên là Ban Thường vụ, Thường trực Đảng ủy trong tổ chức điều hành công việc lãnh đạo, chỉ đạo, phối hợp hoạt động các cơ quan chuyên trách tham mưu, giúp việc Đảng ủy; là trung tâm thông tin tổng hợp phục vụ sự lãnh đạo, chỉ đạo của Đảng ủy”, tân Chánh Văn phòng Đảng ủy Đào Xuân Quy cho biết.
Cũng tại Hội nghị, ông Trịnh Văn Tân - tân Phó Chánh Văn phòng Đảng ủy - bày tỏ niềm vinh dự và trọng trách trên cương vị mới.
Hai cán bộ được bổ nhiệm hứa sẽ cố gắng hết mình, cùng tập thể Văn phòng Đảng ủy phát huy truyền thống đoàn kết, kỷ luật, chủ động, sáng tạo trong thực hiện nhiệm vụ; mong muốn tiếp tục nhận được sự quan tâm chỉ đạo của Bộ trưởng, các lãnh đạo Đảng ủy, Ban Thường vụ, Ban Chấp hành Đảng ủy và toàn thể cán bộ, đảng viên trong Bộ, để hoàn thành tốt mọi nhiệm vụ được giao."
