url,title,description,content
https://vietnamnet.vn/truong-lao-hoa-thuong-chau-ty-viet-tiep-cau-chuyen-phat-phap-va-van-hoa-dan-toc-2456550.html,Không tìm thấy,,"Nép mình dưới chân núi Tô, chùa Soài So (tỉnh An Giang) là nơi lưu giữ một trong những giá trị văn hóa tâm linh độc đáo của đồng bào Khmer Nam Bộ, nhất là nghệ thuật khắc kinh trên lá buông. Giữa đời sống hiện đại với nhịp sống hối hả, Trưởng lão Hòa thượng Chau Ty, vị cao tăng ở tuổi 84, vẫn ngày ngày lặng lẽ truyền dạy cho các tăng sinh khắc từng dòng kinh Pali như đang viết tiếp câu chuyện của Phật pháp và văn hóa dân tộc.
Nghệ thuật khắc kinh lá buông (Satra), không chỉ là một nghề thủ công, mà còn là pháp môn tu tập. Người thực hiện khắc phải giữ tâm thanh tịnh, tập trung tuyệt đối, từng nét chữ được tạo nên bằng sự tôn kính và lòng tin sâu sắc đối với Đức Phật. Bởi vậy, mỗi bản kinh không chỉ mang giá trị tôn giáo, mà còn thể hiện chiều sâu của trí tuệ, lòng kiên nhẫn và đức tin của người Khmer Nam Bộ.
Với Trưởng lão Hòa thượng Chau Ty, mỗi bản kinh lá buông không chỉ chứa đựng lời Phật dạy, mà còn là linh hồn văn hóa của người Khmer. Đó là ký ức, là tri thức, là đạo lý được truyền qua bao thế hệ.
Nhân dịp Lễ Sen Dolta năm 2025, Trưởng lão Hòa thượng đã chia sẻ về nguồn gốc của kinh lá buông ở chùa Soài So. Theo đó, năm 1964, khi mới 24 tuổi, Hòa thượng có duyên gặp cụ ông Chau Riếng, người nổi tiếng trong vùng Soài So với tài khắc kinh lá buông, Hòa thượng mời cụ về chùa để truyền dạy.
Trong vài buổi thực hành, nắm được các kỹ thuật quan trọng, từ khâu chọn lá, kẻ hàng, chế mực đến khắc chữ, Hòa thượng bắt đầu thực hành với bản kinh đầu tay như một lời nguyện từ tâm gửi đến Đức Phật.
Theo Hoà thượng, để tạo ra một bản kinh hoàn chỉnh, phải trải qua nhiều công đoạn, như: Chọn lá buông không quá già, có độ dài/rộng đủ để viết được 5 hàng chữ. Lá được phơi nắng, phơi sương, luộc, ép từ 6 - 7 lần để đạt độ dẻo và bền...
Khi khắc phải dùng bút Dek-cha - loại bút bằng gỗ gắn lưỡi kẽm nhỏ, khắc từng nét mảnh. Sau đó, mực được chà lên lá bằng hỗn hợp than và dầu hỏa để chữ nổi rõ. Cuối cùng, các lá kinh được xâu lại thành bộ, bảo quản cẩn thận để dùng trong giảng pháp và tụng đọc.
“Công việc khắc kinh không đơn thuần là sao chép lời kinh, mà là một hành trình tu dưỡng tâm hồn. Người khắc kinh phải giữ tâm tĩnh, lòng thành. Nếu vội vàng, chữ sẽ sai; nếu tâm chưa tịnh, lời Phật sẽ không hiện rõ”, Trưởng lão Hòa thượng nói chậm, như là lời dặn dò rất cẩn thận.
Lòng kiên định gìn giữ di sản văn hóa dân tộc Khmer
Trên những giá kệ cổ của chùa Soài So, hàng trăm bộ kinh lá buông được cất giữ cẩn trọng. Mỗi bộ là một phần ký ức văn hóa của người Khmer, là minh chứng cho sự gắn bó giữa đạo pháp và đời sống cộng đồng. Tuy nhiên, theo Trưởng lão Hòa thượng Chau Ty, điều đáng lo ngại là nghề khắc kinh đang đứng trước nguy cơ mai một.
Năm 2013, Sở Văn hóa và Thông tin tỉnh An Giang phối hợp mở lớp dạy khắc kinh lá buông cho các vị sư trẻ trong tỉnh. Lớp có 14 học viên, do chính Trưởng lão Hòa thượng giảng dạy. Thế nhưng, sau khóa học chỉ còn 1 người tiếp tục gắn bó với loại hình nghệ thuật này.
Theo sự tìm hiểu của ông Danh Phúc - Giám đốc Sở Dân tộc và Tôn giáo, thế hệ trẻ ngày nay ít kiên nhẫn với công việc tỉ mỉ mà loại hình nghệ thuật này nếu không có lòng đam mê và tâm tĩnh lặng thì rất khó duy trì.
“Khó khăn còn nằm ở nguyên liệu. Lá buông hiện rất khan hiếm do cây khó trồng, thường chết sau khi ra trái. Phần lớn, nguyên liệu hiện nay phải nhập từ Campuchia với chi phí cao. Dù đã thử nghiệm trồng cây ở nhiều nơi nhưng vẫn chưa thành công vì điều kiện khí hậu và đất trồng không phù hợp”, ông Danh Phúc chia sẻ.
Còn Trưởng lão Hòa thượng Chau Ty lại trăn trở nhất là thiếu người kế tục. Năm 2017, tri thức và kỹ thuật viết chữ trên lá buông của người Khmer An Giang đã được công nhận là Di sản văn hóa phi vật thể quốc gia. Thành tựu ấy có sự góp sức to lớn của Trưởng lão Hòa thượng Chau Ty, người được nhìn nhận là cầu nối giữa thế hệ nghệ nhân xưa và lớp người kế thừa hôm nay.
“Khắc kinh lá buông là cách tôi tu và cũng là cách tôi tri ân dân tộc mình”, Trưởng lão Hòa thượng bộc bạch.
Giữa đời sống hiện đại, hình ảnh vị Trưởng lão Hòa thượng bên phiến lá buông vẫn lặng lẽ tỏa sáng với lòng kiên định và của tinh thần gìn giữ di sản văn hóa dân tộc Khmer mãi trường tồn.
Bà Trần Thị Thanh Hương - Phó Bí thư Tỉnh ủy, Chủ tịch Ủy ban MTTQ Việt Nam tỉnh An Giang ghi nhận: Trưởng lão Hòa thượng Chau Ty ngoài công tác Phật sự ngài còn là người có uy tín trong đồng bào Khmer, là tấm gương sáng trong xây dựng khối đại đoàn kết dân tộc, hòa hợp tôn giáo.
Trên cương vị Phó Pháp chủ Hội đồng Chứng minh Trung ương Giáo hội Phật giáo Việt Nam, ngài luôn tích cực gắn kết giữa hệ phái Nam tông và Bắc tông, giữa Phật giáo và các tôn giáo khác, giữa đồng bào Khmer với các dân tộc khác trên địa bàn.
Nhiều năm qua, Hòa thượng cũng là cầu nối giữa Giáo hội, chính quyền và đồng bào, góp phần quan trọng trong việc xây dựng đời sống văn hóa, củng cố niềm tin và khuyến khích bà con thực hiện tốt chủ trương, chính sách của Đảng, pháp luật của Nhà nước."
https://vietnamnet.vn/mien-trung-khoi-dong-hanh-trinh-moi-cho-giao-duc-vung-bien-2454629.html,Không tìm thấy,,"Mỗi sáng sớm, nhiều học sinh Cơ Tu ở xã Tây Giang (Đà Nẵng) vẫn phải vượt rừng hàng chục km để đến lớp. Đây là xã biên giới xa xôi của thành phố, nơi hơn 46% hộ dân thuộc diện nghèo, sống phân tán trên địa bàn rộng lớn. Toàn xã có hơn 2.500 học sinh, với 9 trường học từ mầm non đến trung học cơ sở và 30 điểm trường nằm rải rác khắp các thôn, bản.
Chỉ trong hơn một năm nữa, các em sẽ được học tập trong ngôi trường nội trú khang trang, quy mô hơn 7ha, có thư viện, sân thể thao, khu ở, nhà ăn và phòng văn hóa…
Không chỉ riêng Tây Giang, hàng chục xã biên giới khác thuộcĐà Nẵng,Quảng Ngãi,Gia Lai,Đắk Lắk… cũng đang chuẩn bị về mặt bằng, quy hoạch và thiết kế để sẵn sàng cho một “cuộc cách mạng giáo dục vùng biên”.
Tất cả bắt nguồn từ chủ trương củaBộ Chính trị: Xây dựng hệ thống trường phổ thông nội trú liên cấp tại 248 xã biên giới đất liền, nhằm đưa tri thức đến gần hơn với con em dân tộc thiểu số, để người dân bám làng, củng cố thế trận biên cương bằng nền tảng giáo dục vững chắc.
Bước đột phá trong chính sách giáo dục
Tại lễ khởi công trường Phổ thông nội trú, bán trú Tiểu học và THCS xã Tây Giang ngày 16/10,Thủ tướng Phạm Minh Chínhkhẳng định: Đảng và Nhà nước luôn xác định giáo dục và đào tạo là quốc sách hàng đầu, gắn với mục tiêu nâng cao dân trí, bồi dưỡng nhân tài và phát triển toàn diện hệ thống giáo dục từ mầm non đến đại học.
Thủ tướng nhấn mạnh, phát triển nhanh phải đi đôi với phát triển bền vững; tăng trưởng kinh tế phải gắn với bảo đảm an sinh xã hội, nhất là ở khu vực miền núi, biên giới và vùng đồng bào dân tộc thiểu số.
“Không hy sinh tiến bộ, công bằng, an sinh để chạy theo tăng trưởng đơn thuần. Không để ai bị bỏ lại phía sau trong quá trình phát triển”, Thủ tướng nhấn mạnh.
Theo Thủ tướng, cùng với các nghị quyết chiến lược khác, Nghị quyết 71 và 72 của Bộ Chính trị về giáo dục, đào tạo và y tế là những trụ cột nhằm bảo đảm công bằng và phát triển đồng đều giữa các vùng, miền. Chủ trương xây dựng trường phổ thông nội trú liên cấp chính là bước cụ thể hóa cho mục tiêu đó.
Thủ tướng kêu gọi toàn xã hội chung tay thực hiện với tinh thần “ai có công góp công, ai có của góp của, ai có ít góp ít, ai có nhiều góp nhiều”, phát huy mạnh mẽ “tình dân tộc, nghĩa đồng bào” để chính sách đi vào cuộc sống một cách hiệu quả và bền vững.
Các địa phương ráo riết triển khai
Tại Đà Nẵng, trong năm 2025, thành phố sẽ triển khai xây dựng 6 trường học tại các xã biên giới, với tổng số kinh phí hơn 1.500 tỷ đồng.
Thủ tướng yêu cầu công trình tại Tây Giang phải hoàn thành trước tháng 6/2026 và các trường còn lại trong năm 2026, đồng thời chuẩn bị phương án giai đoạn hai nếu nhu cầu học tập tiếp tục tăng.
Quảng Ngãi cũng đang tích cực triển khai giai đoạn đầu tư 2025-2027 cho các xã giáp Lào và Campuchia.
UBND tỉnh đã đề xuất Trung ương hỗ trợ 775 tỷ đồng để xây dựng 5 trường trong giai đoạn đầu. Trong đó, hai trường dự kiến hoàn thành năm 2026. Đây là các khu vực địa hình hiểm trở, nơi đồng bào Xơ Đăng, Ba Na, Gié Triêng sinh sống, nhiều học sinh phải đi bộ hàng giờ để đến trường.
Ở Đắk Lắk, nơi có 73km đường biên giới giáp Campuchia - 5 trường nội trú liên cấp đang được đầu tư tại các xã Ea Bung, Ia Rvê, Ia Lốp, Buôn Đôn và Ea Rốk, với tổng kinh phí hơn 485 tỷ đồng. Mỗi trường có quy mô từ 980 - 1.300 học sinh.
Ông Nguyễn Duy Khang - Trưởng thôn Trung (xã Ia Lốp) chia sẻ thực tế: Do chưa có trường liên cấp nên học sinh trong thôn phải đi học cách nhà 12km. Hơn nữa, học sinh phải học cả ngày nhưng sáng đi, trưa phải về gây khó khăn cho phụ huynh trong việc đưa đón. Nếu có trường mới, các em sẽ được ở lại bán trú, phụ huynh an tâm làm ăn, phát triển kinh tế.
Tại Gia Lai, 7 xã biên giới phía tây của tỉnh hiện có hơn 10.000 học sinh, trong đó khoảng 7.000 em có nhu cầu học bán trú và nội trú. Địa phương dự kiến đầu tư hơn 1.211 tỷ đồng để xây dựng hệ thống trường nội trú liên cấp tại bảy xã này.
Từ tháng 7/2025, Sở GD-ĐT tỉnh này đã phối hợp với các địa phương khảo sát thực địa. Các ban quản lý dự án đang khẩn trương hoàn thiện thủ tục để sẵn sàng khởi công. Một số công trình dự kiến được triển khai ngay cuối năm nay.
Trong năm 2025, Gia Lai sẽ ưu tiên nâng cấp hai trường tại xã Ia Púch và Ia Mơ lên mô hình nội trú liên cấp - nơi có đến 75% học sinh là người dân tộc thiểu số, mỗi ngày phải vượt quãng đường 8-20km đến lớp. Dự án có kinh phí khoảng 100 tỷ đồng, dự kiến đưa vào sử dụng trong năm học 2026-2027.
Những ngôi trường nội trú khang trang giữa núi rừng không chỉ là “mái nhà thứ hai” của học sinh đồng bào thiểu số, mà còn mở ra cơ hội rút ngắn khoảng cách tri thức giữa vùng sâu, vùng xa và khu vực phát triển.
Ông Bhling Mia - Bí thư Đảng ủy, Chủ tịch HĐND xã Tây Giang chia sẻ, việc khởi công trường phổ thông nội trú liên cấp hôm nay là bước ngoặt quan trọng, mở ra cơ hội học tập tốt hơn cho con em vùng cao. Đồng thời là minh chứng cho sự quan tâm của Đảng, Nhà nước, Chính phủ và các cấp chính quyền đối với sự nghiệp trồng người.
Còn ông Nguyễn Văn Hiếu - Chủ tịch UBND xã Ia Lốp (Đắk Lắk) kỳ vọng, việc đầu tư trường liên cấp sẽ giúp học sinh miền núi tiếp cận môi trường học tập chuyên nghiệp, nhanh chóng rút ngắn khoảng cách về kiến thức, trình độ giữa học sinh vùng khó khăn và vùng phát triển."
https://vietnamnet.vn/dan-toc-thai-2456296.html,Không tìm thấy,,"Từ thất bại tìm ra hướng đi mới
Con đường độc đạo men theo suối Nậm Giải đưa tôi qua Chà Lâu, bản Pòng, bản Pục, xã Quế Phong, tỉnh Nghệ An. Điểm cuối dừng chân là bản Pục, nơi có chàng trai dân tộc Thái Quang Văn Trung, người được bà thân mật gọi là “vua” gà bản.
Chuyện bắt đầu từ năm 2017, chàng trai người dân tộc Thái Quang Văn Trung (1994) khởi nghiệp với mô hình nuôi gà khi đưa giống từ dưới xuôi lên bản. Thế nhưng trong lần khởi nghiệp này, anh Trung vẫn chưa thực hiện được khát khao thoát nghèo.
Lứa gà đầu tiên, toàn bộ vốn liếng mà anh đầu tư vào gà gần như mất trắng. “Thất bại ấy khiến tôi nhận ra, con gà dưới xuôi không phù hợp với khí hậu ở vùng cao Nậm Giải nói chung và ở bản Pục nói riêng”, anh kể.
Sau thời gian tìm hiểu, anh Trung nhận thấy giống gà bản địa của dân tộc Thái có sức đề kháng tốt, thịt thơm ngon, thích hợp với điều kiện khí hậu của địa phương. Hơn nữa con gà bản địa lại rất được người tiêu dùng ưa chuộng, giá bán lại rất cao.
Năm 2019, anh quyết tâm khởi nghiệp lần hai với mô hình nuôi gà bản địa. Ban đầu, anh Trung đi gom gà giống trong bản về nuôi, nhân đàn. Nhờ kiên trì học hỏi kỹ thuật và chú trọng phòng bệnh, đàn gà phát triển ổn định và nhân giống nhanh.
Đến năm 2023, anh Trung xuất bán hơn 2.000 con gà với giá trung bình 130.000 đồng/kg. Từ thành công ban đầu, anh bắt đầu mở rộng quy mô nuôi gà bản địa trên diện tích 3ha đất vườn.
Chuồng trại, hệ thống lưới vây để nuôi gà cũng được anh Trung đầu tư xây dựng bài bản. Năm 2024 và những tháng đầu năm 2025, anh duy trì đàn lên đến hơn 3.000 con gà bản địa.
Từ 2 bàn tay trắng khởi nghiệp ở bản nghèo, chàng trai dân tộc Thái Quang Văn Trung đã vươn lên trở thành người làm kinh tế gia đình giỏi nhất bản Pục. Đồng bào Thái ở địa phương đã quen gọi anh với cái tên thân thương là “vua” gà bản địa.
Liên kết cùng dân bản, làm giàu tập thể
Để đáp ứng nhu cầu về gà bản địa của thị trường, anh Trung vận động và liên kết với 17 gia đình dân tộc Thái ở bản Pục cùng nuôi theo mô hình gà bản địa. Để hỗ trợ bà con nuôi gà cho sản lượng cao, anh Quang Văn Trung đã hướng dẫn kỹ thuật, cách phòng chống bệnh trên đàn gà.
Hiện nay toàn bộ mô hình nuôi gà bản địa của 17 hộ dân tộc Thái ở bản Pục xuất bán khoảng 15-16 tấn gà thương phẩm mỗi năm, mỗi hộ có lãi từ 80-100 triệu đồng/năm. Đây là nguồn thu nhập lớn đối với người dân tộc Thái ở bản Pục.
Chị Ngân Thị Phương, Trưởng bản Pục cho biết: “Anh Trung là tấm gương tiêu biểu của thanh niên dân tộc Thái khởi nghiệp thành công, trở thành người phát triển kinh tế gia đình giỏi nhất bản"".
Lan tỏa tinh thần tự lực vùng cao
Không dừng lại ở đó, anh Trung còn đầu tư đào ao khoảng 3.000 mét vuông để thả cá trắm, cá mè... Gia đình anh có thêm thu nhập từ 40 - 50 triệu đồng từ nuôi cá.
Trên diện tích 3ha đất vườn, anh Trung trồng 2.000 gốc quế. Đến nay, cây quế đã cho thu hoạch bói từ việc cắt tỉa cành lá. Dự kiến khoảng 3 năm nữa, quế trong vườn anh Trung sẽ cho khai thác vỏ.
Mới đây, anh Trung còn mạnh dạn đầu tư nuôi thử nghiệm 1.000 con cá tầm và theo đánh giá của anh thì cá phát triển và sinh trưởng tốt. Đây là loài cá có giá trị cao, nếu thành công sẽ tạo ra một mô hình sinh kế mới để bà con dân tộc Thái ở bản Pục thực hiện theo, từ đó phát triển kinh tế hộ gia đình.
Anh Quang Văn Trung cho biết ""gà, cá, quế"" là ba trụ cột sinh kế gắn kết chặt chẽ, tận dụng hiệu quả nguồn lực sẵn có. ""Phân gà bón cho quế, nước ao cá tưới cây, còn lá quế lại giúp xua côn trùng cho chuồng trại"", anh giải thích.
Từ một chàng trai nghèo nếm trải thất bại, Quang Văn Trung đã trở thành tấm gương điển hình của thanh niên người dân tộc Thái vùng cao Nghệ An. Với tính cách dám nghĩ, dám làm, dám thay đổi để vươn lên làm giàu chính đáng, anh Trung đã truyền cảm hứng mạnh mẽ cho giới trẻ tự lực vươn lên làm giàu trên chính bản làng của mình."
https://vietnamnet.vn/le-cung-ban-vuong-cua-nguoi-dao-do-o-ho-thau-2455144.html,Không tìm thấy,,"Truyền thuyết người Dao kể rằng Bàn Vương còn được gọi là Bàn Hồ. Nhờ lập được công lao to lớn khi đánh bại Cao Vương xâm lược nước Bình Vương, ông được vua Bình Vương trọng thưởng và gả công chúa cho. Bàn Vương cùng công chúa sinh được 6 trai, 6 gái và Bình Vương ban cho mỗi người một họ, trở thành 12 họ đầu tiên của người Dao. Khi Bình Vương qua đời, Bàn Vương lên làm vua của người Dao.
Ở những bản làng Dao khu vực phía Tây Bắc tỉnh Tuyên Quang vẫn lưu truyền câu chuyện về Bàn Vương: Dù đã lên ngôi vua, ông vẫn giữ lối sống giản dị và thường truyền dạy người Dao cách trồng trọt, dệt vải và săn bắn. Một lần vào tháng 2 âm lịch, Bàn Vương lên núi săn sơn dương, nhưng chẳng may bị con vật húc ngã vào cây gù hương và qua đời. Kể từ đó, người Dao làm lễ cúng giỗ Bàn Vương vào tháng 2 âm lịch hàng năm.
Ngày nay, lễ cúng Bàn Vương được người dân tái hiện và trở thành một dịp để du khách tìm hiểu văn hóa đặc sắc của cộng đồng Dao."
https://vietnamnet.vn/lang-kon-bah-hoi-sinh-nha-rong-sau-hoa-hoan-2455197.html,Không tìm thấy,,"Với đồng bào Ba Na, nhà rông không chỉ là ""linh hồn"" của làng, mà còn là nơi họp làng, truyền dạy con cháu đánh cồng chiêng, các giá trị văn hóa truyền thống và những câu chuyện đời thường, kinh nghiệm sống; là nơi con trai, con gái làng Kon Băh và các làng khác gặp gỡ, hoạt động thể thao mỗi ngày. Vì thế, mái nhà rông sừng sững ấy đã trở thành nơi gắn kết cộng đồng Ba Na ở vùng đất Ia Khươl.
Già làng Hyưuh kể lại: “Vào tháng 8/2024, nhà rông của làng bất ngờ bị ngọn lửa thiêu rụi. Do mái nhà rông làm bằng chất liệu nứa, gỗ, cỏ tranh xếp lớp dày, cao, cộng hưởng gió lớn, nên bùng phát cháy dữ dội, đã làm toàn bộ kết cấu của nhà rông bị sụp đổ, vật dụng bị hư hỏng nặng nề. Bà con ai cũng buồn, tiếc nuối mái nhà chung của làng. Sau nhiều lần họp làng, ai cũng mong muốn phải làm nhà mới và quyết tâm dựng lại nhà rông của làng”...
Ngày 20/6/2025, dân làng bắt tay vào hồi sinh nhà rông. Ngày nối ngày, làng Kon Băh luôn nhộn nhịp không khí lao động. Sáng sớm, phụ nữ lên núi cắt cỏ tranh, đàn ông vào rừng tìm dây mây, tre nứa... Vào thứ Sáu, thứ Bảy, người làng lại tập trung bên bãi đất rộng, cùng nhau ghép tranh, dựng cột, đan liếp. Người già truyền kinh nghiệm, người trẻ góp sức.
Mọi trái tim cùng hướng về ngôi nhà mới đang dần thành hình. Rút kinh nghiệm từ vụ cháy trước, lần này, làng mời thợ điện về lắp đặt hệ thống chiếu sáng bài bản, an toàn.
Ông Mao - Trưởng thôn làng Kon Băh, cho hay: Sau vụ cháy, chỉ còn 8 cột gỗ trắc từ nhà rông cũ có thể tận dụng lại. Còn lại, mọi vật liệu đều phải thay mới. Làng có 139 hộ, trong đó có 135 hộ người Ba Na, 4 hộ người Kinh cùng nhau dựng lại mái nhà chung.
Quỹ làng còn hơn 50 triệu đồng, bà con góp thêm trên 80 triệu, một doanh nghiệp hỗ trợ 100 triệu để dựng nhà. Nhưng lớn hơn cả, chính là hàng ngàn lượt ngày công của dân làng, thứ không thể quy đổi bằng bất cứ giá trị vật chất nào, để dựng nên căn nhà biểu tượng văn hóa Ba Na này.
Sau 3 tháng trời chung sức, nhà rông làng Kon Băh đã hoàn thành trong niềm hân hoan của bà con. Ngày về nhà rông mới, gương mặt ai cũng rạng rỡ, tự hào.
Dưới mái nhà chung này, từng sợi mây, từng thanh gỗ, lớp tranh đều thấm đẫm mồ hôi và hơi ấm bàn tay của người làng. Đó không chỉ là một công trình văn hóa, mà còn là biểu tượng của tình yêu thủy chung, cố kết, trách nhiệm của mỗi con người đối với làng, với cộng đồng.
Chị Kưn phấn khởi nói: “Mình đi lấy tranh, nứa về lợp mái. Nguyên liệu giờ ngày càng khó tìm nên mình phải tranh thủ đi vào sâu trong rừng để lấy về. Tuy rất vất vả nhưng hôm nay được đứng trong nhà mới, mình thấy vui, tự hào lắm”.
Mừng nhà rông mới, làng đã mổ một con trâu, một một con heo để làm lễ. Bên cạnh đó, còn có những món ăn truyền thống của đồng bào Ba Na như cơm lam, thịt nướng, cháo tơ pung, đọt mây rừng, canh rau dớn nấu cua suối, đọt chuối rừng đùm cá suối, các món chế biến từ măng rừng… tạo nên một bữa tiệc ẩm thực đầy phong vị.
Chung vui cùng bà con trong ngày trọng đại, bà Rơ Châm H’Phik, Bí thư Đảng ủy xã, xúc động nói: “Để dựng được ngôi nhà rông to đẹp bằng vật liệu tự nhiên trong thời buổi này là điều không dễ. Nhưng chính khó khăn ấy, đã làm sáng lên sự đồng lòng, đoàn kết, ý thức giữ gìn văn hóa của người làng Kon Băh. Chỉ có tinh thần ấy mới có thể hồi sinh mái nhà rông truyền thống trong bối cảnh hiện nay”.
Từ đống tro tàn, làng Kon Băh không chỉ hồi sinh mái nhà rông, mà còn làm sống lại cả ký ức và bản sắc văn hóa. Có lẽ, khởi phát từ những giá trị ấy, đồng bào Ba Na nơi đây vẫn giữ cho mình vẻ đẹp văn hóa đặc sắc, quyến rũ riêng biệt.
Nhấp ngụm rượu ghè thơm nồng trong ngày về nhà rông mới, già làng Hyưuh xúc động chia sẻ: ""Tôi đã bao lần cùng dân làng dựng và sửa nhà rông, nhưng lần này, thật đặc biệt. Bởi dù lửa có thiêu rụi nhà rông, nhưng không làm mất đi tinh thần đoàn kết, quyết tâm của bà con trong việc khôi phục mái nhà chung. Chúng tôi nhắc nhau thường xuyên giữ nhà rông như giữ trái tim của làng, không để điều đáng tiếc xảy ra thêm lần nào nữa""."
