url,title,description,content
https://vnexpress.net/bon-du-an-giao-thong-duoc-khoi-cong-dip-19-12-4963452.html,Bốn dự án giao thông được khởi công dịp 19/12,"Bộ Xây dựng dự kiến khởi công 4 dự án gồm mở rộng hai cao tốc TP HCM - Trung Lương - Mỹ Thuận, Cam Lộ - La Sơn, hầm Thần Vũ và xây mới đường sắt Lào Cai - Hà Nội - Hải Phòng vào ngày 19/12.","Dự án đường sắtLào Cai - Hà Nội - Hải Phòngcó điểm đầu tại vị trí nối ray qua biên giới (tỉnh Lào Cai); điểm cuối tại ga Lạch Huyện (TP Hải Phòng), dài 419 km, tổng mức đầu tư hơn 203.200 tỷ đồng (tương đương 8,37 tỷ USD). Tuyến có 18 nhà ga, bao gồm 15 ga hỗn hợp đón tàu khách, hàng và 3 ga lập tàu.
Tuyến đường sắt có tốc độ thiết kế 160 km/h đoạn ga Lào Cai - ga cảng Lạch Huyện, 80 km/h cho đoạn Lào Cai - các đoạn tuyến nhánh, 120 km/h đối với đoạn đi qua Hà Nội và đi trùng với đường sắt vành đai phía đông.
Dự án bao gồm 10 thành phần, trong đó dự án thành phần 1 đầu tư hạ tầng kết nối các ga và quảng trường ga, tổng mức đầu tư gần 2.300 tỷ đồng, khởi công ngày 19/12. Dự án thành phần 2 xây dựng công trình đường sắt, tổng mức đầu tư 155.500 tỷ đồng, khởi công cuối năm 2026 và hoàn thành năm 2030.
Ngoài hai dự án xây dựng công trình còn có 7 dự án giải phóng mặt bằng và một dự án di dời hạ tầng điện.
Cao tốcTP HCM - Trung Lương - Mỹ Thuậngiai đoạn 2 có tổng đầu tư hơn 41.370 tỷ đồng, dự kiến khởi công ngày 19/12, hoàn thành năm 2028, theo phương thức hợp tác công tư, loại hợp đồng BOT (xây dựng - kinh doanh - chuyển giao).
Dự án dài hơn 96 km, điểm đầu tại nút giao Chợ Đệm, huyện Bình Chánh, TP HCM; điểm cuối tại đầu phía bắc cầu Mỹ Thuận 2, tỉnh Đồng Tháp (Tiền Giang cũ). Trong đó đoạn TP HCM - Trung Lương sẽ mở rộng từ 4 lên 8 làn xe với vận tốc 120 km/h, đoạn Trung Lương - Mỹ Thuận từ 4 lên 6 làn xe, vận tốc 100 km/h.
Tuyến cao tốc nhằm giải quyết tình trạng quá tải lưu lượng xe hiện nay, hình thành mạng lưới giao thông hoàn chỉnh trong vùng kinh tế trọng điểm phía Nam và Đồng bằng sông Cửu Long.
Hầm đường bộ Thần Vũnằm trên tuyến cao tốc Bắc Nam, đoạn qua xã Tân Châu đến xã Thần Lĩnh, tỉnh Nghệ An, với tổng chiều dài 8,2 km.
Dự án mở rộng hầm Thần Vũ khởi công ngày 19/12, gồm hoàn thiện ống hầm nhánh trái (hướng Bắc - Nam) quy mô ba làn xe, điều chỉnh hệ thống an toàn giao thông của nhánh phải hiện có, đồng thời xây cầu và đường dẫn kết nối để đạt 6 làn xe, vận tốc thiết kế 80-100 km/h. Tổng mức đầu tư 2.155 tỷ đồng từ nguồn vốn ngân sách. Công trình dự kiến đưa vào khai thác năm 2027.
Hầm Thần Vũ là một trong những công trình phức tạp nhất trên tuyến cao tốc Bắc Nam đoạn Diễn Châu - Bãi Vọt, đã được đầu tư gồm hai ống hầm song song, mỗi hầm rộng 13,8 m; hầm trái dài 1.087 m, hầm phải dài 1.130 m, khoảng cách giữa hai tim hầm là 45 m.
Tuy nhiên, giai đoạn 1 mới có ống hầm bên phải được hoàn thiện, khai thác 2 làn xe. Ống hầm còn lại mới thi công phần vỏ để bảo vệ kết cấu và làm đường tạm phục vụ cứu hộ, thoát hiểm.
Dự án mở rộng cao tốcCam Lộ - La Sơnđi qua tỉnh Quảng Trị và TP Huế dài khoảng 98 km, điểm đầu kết nối với điểm cuối dự án đường bộ cao tốc đoạn Vạn Ninh - Cam Lộ thuộc Quảng Trị, điểm cuối kết nối với điểm đầu dự án La Sơn - Hòa Liên thuộc TP Huế.
Dự án bao gồm mở rộng nền, mặt đường và các công trình trên tuyến từ 2 lên 4 làn xe, tổng mức đầu tư hơn 6.480 tỷ đồng từ ngân sách.
Cao tốc Cam Lộ - La Sơn hiện có hai làn xe, cách khoảng 10 km lại có đoạn vượt 1-1,5 km bốn làn xe, có làn dừng khẩn cấp. Ôtô được chạy 60-80 km/h tại đoạn hai làn, tối đa 80 km/h tại đoạn bốn làn. Thời gian qua, tuyến đường này xảy ra một số vụ tai nạn nghiêm trọng liên quan đến xe tải nặng và xe khách.
Việc đầu tư mở rộng sẽ đảm bảo tính đồng bộ về quy mô toàn tuyến cao tốc Bắc Nam phía đông, giải quyết nhu cầu vận tải tăng cao, đảm bảo an toàn giao thông.
Ngoài khởi công các dự án vào 19/12, ngành xây dựng còn thông xe nhiều dự án cao tốc như Hữu Nghị - Chi Lăng, Đồng Đăng - Trà Lĩnh, Quảng Ngãi - Hoài Nhơn, Hoài Nhơn - Quy Nhơn, Quy Nhơn - Chí Thạnh, Chí Thạnh - Vân Phong, Cần Thơ - Hậu Giang, Hậu Giang - Cà Mau.
Đoàn Loan"
https://vnexpress.net/giai-phap-phat-trien-cong-nghiep-duong-sat-toc-do-cao-4963221.html,Giải pháp phát triển công nghiệp đường sắt tốc độ cao,"Các chuyên gia cho rằng Việt Nam đang có cơ hội hình thành ngành công nghiệp đường sắt hiện đại, nhưng cần chính sách hỗ trợ doanh nghiệp và thu hút đối tác quốc tế chuyển giao công nghệ.","Tại tọa đàm về phát triển công nghiệp đường sắt ngày 12/11, ông Trần Thiện Cảnh, Cục trưởng Đường sắt Việt Nam, cho biết Quy hoạch phát triển đường sắt đến năm 2030 đặt mục tiêu nâng cấp 7 tuyến hiện có và xây mới 2 tuyến đường sắt tốc độ cao; đến năm 2050 hướng tới 25 tuyến với tổng chiều dài hơn 6.300 km.
Trong đó, dự án đường sắt tốc độ cao Bắc Nam dài hơn 1.500 km đi qua 15 tỉnh, tổng mức đầu tư trên 67 tỷ USD, đang được nghiên cứu khả thi, dự kiến hoàn thành toàn tuyến vào năm 2035. Tuyến Lào Cai - Hà Nội - Hải Phòng dài 390 km có tổng vốn 8,4 tỷ USD, mục tiêu đưa vào khai thác trước 2030. Hà Nội và TP HCM cũng quy hoạch hệ thống đường sắt đô thị dài hơn 500 km mỗi thành phố.
Các dự án trên mở ra cơ hội phát triển ngành công nghiệp đường sắt trong nước trong 10 năm tới. Quốc hội đã thông qua 19 cơ chế, chính sách đặc thù nhằm rút ngắn thủ tục, ưu đãi đầu tư, huy động nguồn lực xã hội và đào tạo nhân lực. Song song đó, Luật Đường sắt (sửa đổi) tiếp tục thể chế hóa các chính sách về quy hoạch, đất đai, lựa chọn nhà đầu tư và chuyển giao công nghệ.
Cần sớm ban hành chính sách khuyến khích đầu tư
Ông Võ Tá Lương, Tổng giám đốc Vĩnh Hưng JSC, cho rằng 10 năm tới là giai đoạn vàng của ngành đường sắt Việt Nam với tổng nhu cầu đầu tư có thể lên tới 150 tỷ USD. Tuy nhiên, sau hơn một thế kỷ hình thành, cơ sở công nghiệp đường sắt trong nước vẫn chưa được đầu tư đúng mức, trình độ sản xuất còn thấp so với thế giới.
Theo ông Lương, công nghệ đường sắt tốc độ cao đòi hỏi kỹ thuật rất cao trong khi phần lớn doanh nghiệp Việt Nam còn hạn chế về năng lực, quản lý chất lượng và tiêu chuẩn. Nếu không có chính sách hỗ trợ mạnh, Việt Nam sẽ bỏ lỡ cơ hội nội địa hóa. Vì thế Nhà nước cần ban hành chính sách khuyến khích đầu tư để doanh nghiệp trong nước sớm sản xuất linh kiện, vật tư, thiết bị phục vụ đường sắt tốc độ cao, tham gia sâu hơn vào chuỗi giá trị toàn cầu.
Đón đầu cơ hội, Vĩnh Hưng đã mở rộng nhà máy, liên kết với đối tác nước ngoài để nhận chuyển giao công nghệ, thay vì tự nghiên cứu phát triển. ""Chúng tôi có thể sản xuất gối cầu, phụ kiện, thiết bị hạ tầng yêu cầu kỹ thuật cao, nhưng cần sớm có tổ hợp công nghiệp đường sắt quốc gia để tạo hệ sinh thái cho doanh nghiệp cùng phát triển"", ông nói.
Chuẩn hóa tiêu chuẩn kỹ thuật
Theo ông Võ Tá Lương, ngành đường sắt hiện thiếu hệ thống tiêu chuẩn đồng bộ. Các tuyến metro ở Hà Nội và TP HCM đang áp dụng tiêu chuẩn khác nhau của Nhật Bản, Pháp, Trung Quốc, dẫn đến khó thống nhất công nghệ và chuỗi cung ứng. Các cơ quan chuyên môn cần sớm nghiên cứu, ban hành bộ tiêu chuẩn kỹ thuật thống nhất để tạo thị trường đủ lớn cho doanh nghiệp đầu tư dài hạn.
Chuyên gia Thilo Weigel, Công ty LogoMotive GmbH (Đức), cảnh báo nhiều dự án đường sắt quốc tế thất bại do thiếu đồng bộ giữa thiết kế, tiêu chuẩn và thiết bị. ""Ngay cả trong châu Âu, tàu Đức muốn chạy ở Pháp vẫn phải điều chỉnh kỹ thuật. Việt Nam cần xác định tiêu chuẩn quốc gia ngay từ đầu, kiểm tra kỹ thiết kế và tham số kỹ thuật của nhà thầu"", ông nói.
Ông Weigel đề xuất Việt Nam nên áp dụng tiêu chuẩn châu Âu, vì đây là hệ thống mở, linh hoạt, có thể mở rộng theo năng lực quốc gia, giúp đa dạng nguồn cung thiết bị và lựa chọn tư vấn, nhà thầu.
Ông Nilanjan Sen Gupta, Tập đoàn DB (Đức), cũng cho rằng cần bảo đảm nghiên cứu khả thi tuyến đường sắt tốc độ cao Bắc Nam đạt chất lượng cao, xây dựng cấu trúc dự án hợp lý, chuẩn hóa kỹ thuật, minh bạch cơ chế hợp đồng để thu hút vốn đầu tư quốc tế.
Huy động nguồn lực quốc tế
Đại diện Phòng Thương mại và Công nghiệp Đức (AHK), ông Bjoen Koslowkhi, cho biết Đức có hơn 39.000 km đường sắt, vận chuyển 1,2 tỷ lượt khách mỗi năm, tạo 54.000 việc làm với doanh thu 16 tỷ euro. Đức sẵn sàng chia sẻ kinh nghiệm, hỗ trợ Việt Nam về công nghệ, tài chính và đào tạo nhân lực.
Từ Hàn Quốc, ông Kong Myongsang, đại diện Hyundai Rotem, giới thiệu công nghệ tàu KTX thế hệ mới đạt tốc độ 370 km/h, giảm 12% lực cản không khí, giảm tiếng ồn dưới 72 dB, tiết kiệm năng lượng và tăng lợi nhuận vận hành. Hyundai Rotem đề xuất mô hình chuyển giao công nghệ ba giai đoạn: đào tạo kỹ sư Việt Nam tại Hàn Quốc, hỗ trợ sản xuất tại Việt Nam, sau đó để Việt Nam tự bảo trì và làm chủ công nghệ.
Đại diện Tập đoàn CRSC (Trung Quốc) cam kết chia sẻ công nghệ số hóa, điều khiển thông minh, giảm rung và phát thải carbon cho hệ thống đường sắt tốc độ cao.
Theo Thứ trưởng Xây dựng Nguyễn Danh Huy, với dự án đường sắt tốc độ cao, Việt Nam không tìm công nghệ đắt nhất mà là công nghệ phù hợp nhất - tiên tiến, đã được kiểm chứng, bảo đảm an toàn, hiệu quả và có khả năng chuyển giao. Việt Nam sẽ ưu tiên các giải pháp thông tin tín hiệu, tự động hóa, vật liệu mới, năng lượng xanh và công nghệ thi công thông minh.
""Chúng tôi mong các tập đoàn quốc tế khi đến Việt Nam sẽ kéo theo doanh nghiệp trong nước, hợp tác chuyển giao công nghệ, tạo điều kiện để doanh nghiệp Việt tham gia sâu vào chuỗi cung ứng toàn cầu"", ông Huy nói.
Đoàn Loan"
https://vnexpress.net/tp-hcm-lam-hai-duong-gom-giam-un-tac-khu-vuc-cau-kenh-te-4963053.html,TP HCM làm hai đường gom giảm ùn tắc khu vực cầu Kênh Tẻ,Đường gom đầu cầu Kênh Tẻ được xây dựng nối tuyến Trần Xuân Soạn và Nguyễn Hữu Thọ giúp người dân thuận tiện đi lại trên trục huyết mạch cửa ngõ phía Nam.,"Theo Trung tâm Quản lý Hạ tầng giao thông đường bộ (Sở Xây dựng TP HCM), đây là gói thầu số 9 thuộc dự án tăng cường năng lực khai thác và đảm bảo an toàn giao thông trên địa bàn thành phố.
Hạng mục chính gồm hai đường gom song song, nằm hai bên đầu cầu Kênh Tẻ (phía quận 7 cũ), kết nối đường Trần Xuân Soạn đến nút giao Nguyễn Hữu Thọ - Ngô Thị Bì. Tổng mức đầu tư gần 52 tỷ đồng từ ngân sách thành phố.
Mỗi đường gom rộng khoảng 5 m, trong đó một bên dài 750 m, bên còn lại 425 m. Công trình được thi công trên phần đất đã giải tỏa, không phải di dời nhà dân. Hiện, nhà thầu đã dọn dẹp mặt bằng, huy động thiết bị, vật tư để thi công các hạng mục chính, dự kiến hoàn thành ngày 8/3/2026.
Theo Trung tâm, khi hoàn thành, hai tuyến gom sẽ tăng năng lực khai thác cho trục Trần Xuân Soạn - Nguyễn Hữu Thọ, đồng thời tạo lối đi thuận tiện cho người dân sống ven kênh Tẻ di chuyển về hướng Nhà Bè (cũ) hoặc vào trung tâm TP HCM, thay vì phải qua các hẻm nhỏ, góp phần giảm ùn tắc và đảm bảo an toàn giao thông.
Cầu Kênh Tẻ, nằm trên trục Nguyễn Hữu Thọ kết nối quận 7 và 4 (cũ), là một trong những tuyến cửa ngõ quan trọng của khu nam, thường xuyên kẹt xe giờ cao điểm. Để giảm áp lực khu vực này, TP HCM sắp khởi công dự áncầu - đườngNguyễn Khoái, tổng chiều dài khoảng 5 km, vốn đầu tư hơn 3.700 tỷ đồng, kết nối quận 7, 4 và 1. Dự án dự kiến hoàn thành quý IV/2027.
Ngoài ra, thành phố đang nghiên cứu triển khai các dự án lớn khác ở khu Nam như: mở rộngđường Nguyễn Tất Thành(vốn gần 3.000 tỷ đồng) và nâng cấpđường Tôn Thất Thuyếtven kênh Tẻ (hơn 5.600 tỷ đồng), hướng tới đồng bộ hạ tầng giao thông và chỉnh trang đô thị khu vực.
Giang Anh"
https://vnexpress.net/truc-thang-dien-tap-cuu-nan-o-bien-gioi-viet-nam-campuchia-4963556.html,Trực thăng diễn tập cứu nạn ở biên giới Việt Nam – Campuchia,"Tây NinhQuân đội Việt Nam – Campuchia lần đầu diễn tập ứng phó thiên tai, thảm họa với sự tham gia của trực thăng, trong khuôn khổ Giao lưu hữu nghị quốc phòng biên giới, ngày 13/11.","Sáng 13/11, chương trình Giao lưu hữu nghị quốc phòng biên giới Việt Nam – Campuchia lần hai diễn ra tại cửa khẩu Mộc Bài, Tây Ninh.
Điểm nhấn của chương trình là lần đầu tiên quân y hai nước phối hợp cùng y tế địa phương diễn tập trong tình huống sập đổ công trình sau mưa lũ kéo dài. Nội dung gồm chỉ huy liên hợp, cấp cứu, phân loại, điều trị tại chỗ và vận chuyển nạn nhân về tuyến sau.
Hai trực thăng vận tải cứu hộ cùng nhiều xe cứu thương được huy động, kịp thời đưa người bị nạn đến trạm dã chiến khi giao thông đường bộ và đường thủy bị chia cắt.
Quân y Việt Nam vận chuyển nữ nạn nhân giả định lên xe cứu thương để đến nơi chữa trị.
Quân y Việt Nam vận chuyển nữ nạn nhân giả định lên xe cứu thương để đến nơi chữa trị.
Quân y hai nước phối hợp diễn tập vận chuyển nạn nhân bằng cáng, cấp cứu tại bệnh viện dã chiến cách hiện trường khoảng một km.
Những năm qua, hợp tác quân y Việt Nam – Campuchia được thể hiện qua việc hai bên tích cực tham gia các hoạt động nhân đạo, cứu trợ thảm họa trong khu vực và thế giới, như tại Thổ Nhĩ Kỳ, Myanmar, cũng như thường xuyên tổ chức diễn tập ứng phó thiên tai, thảm họa và dịch bệnh.
Bên trong bệnh viện dã chiến, quân y hai nước phối hợp chăm sóc y tế và hỗ trợ tâm lý cho các nạn nhân.
Trước buổi diễn tập một ngày, lực lượng quân đội hai nước cùng ngành y tế địa phương đã tham gia tổng duyệt để bảo đảm chương trình diễn ra thành công.
Sau khi được sơ cứu tại chỗ, các nạn nhân được quân y hai nước đánh giá, phân loại; những ca nặng sẽ được chuyển bằng xe cứu thương và trực thăng lên bệnh viện tuyến trên tiếp tục điều trị.
Sau khi được sơ cứu tại chỗ, các nạn nhân được quân y hai nước đánh giá, phân loại; những ca nặng sẽ được chuyển bằng xe cứu thương và trực thăng lên bệnh viện tuyến trên tiếp tục điều trị.
Quân y Việt Nam - Campuchia diễn tậpVideo trực thăng diễn tập đưa nạn nhân đi cấp cứu.
Hàng chục lều dã chiến của quân đội hai nước được dựng lên để phục vụ buổi diễn tập.
Hồi tháng 5/2022, quân đội hai nước đã lần đầu tổ chức giao lưu hữu nghị tại tỉnh Bình Phước (cũ) và tỉnh Kratie.
Hàng chục lều dã chiến của quân đội hai nước được dựng lên để phục vụ buổi diễn tập.
Hồi tháng 5/2022, quân đội hai nước đã lần đầu tổ chức giao lưu hữu nghị tại tỉnh Bình Phước (cũ) và tỉnh Kratie.
Trước buổi diễn tập diễn ra, Đại tướng Phan Văn Giang, Bộ trưởng Quốc phòng đón tiếp đoàn đại biểu Campuchia do Đại tướng Tea Seiha, Phó thủ tướng, Bộ trưởng Quốc phòng dẫn đầu.
Trước buổi diễn tập diễn ra, Đại tướng Phan Văn Giang, Bộ trưởng Quốc phòng đón tiếp đoàn đại biểu Campuchia do Đại tướng Tea Seiha, Phó thủ tướng, Bộ trưởng Quốc phòng dẫn đầu.
Sau đó, Đại tướng Phan Văn Giang hội đàm với Đại tướng Tea Seiha.
Dự kiến ngày mai, chương trình sẽ chuyển sang tỉnh Svay Rieng (Campuchia), gồm tuần tra chung giữa lực lượng bảo vệ biên giới hai nước, thăm trụ sở Bộ Tư lệnh Hiến binh tỉnh; tô son cột mốc chủ quyền 171.
Đường biên giới Việt Nam – Campuchia bắt đầu từ ngã ba biên giới Việt Nam – Lào – Campuchia và kết thúc tại cột mốc số 314 (biên giới Kiên Giang cũ với Kampot). Nơi này địa hình phức tạp, đan xen từ rừng núi hiểm trở đến khu dân cư đông đúc.
Sau đó, Đại tướng Phan Văn Giang hội đàm với Đại tướng Tea Seiha.
Dự kiến ngày mai, chương trình sẽ chuyển sang tỉnh Svay Rieng (Campuchia), gồm tuần tra chung giữa lực lượng bảo vệ biên giới hai nước, thăm trụ sở Bộ Tư lệnh Hiến binh tỉnh; tô son cột mốc chủ quyền 171.
Đường biên giới Việt Nam – Campuchia bắt đầu từ ngã ba biên giới Việt Nam – Lào – Campuchia và kết thúc tại cột mốc số 314 (biên giới Kiên Giang cũ với Kampot). Nơi này địa hình phức tạp, đan xen từ rừng núi hiểm trở đến khu dân cư đông đúc.
Thanh Tùng"
https://vnexpress.net/rac-bien-vung-tau-4963463.html,Rác ngập bờ biển dọc công viên nghìn tỷ ở Vũng Tàu,"TP HCMHàng trăm tấn rác nhựa, lục bình và gốc cây trôi dạt phủ dày hơn 3 km bờ biển Bãi Sau - tháp Tam Thắng, khiến công nhân phải gom thành từng đống vì không thể dọn kịp.","Sáng 13/11, rác chất thành từng đống nối dài trên bãi biển Bãi Sau, trải ra hai bên tháp Tam Thắng.
Bốn ngày trước, từng mảng rác lớn ngoài khơi theo sóng dạt vào bờ lúc thủy triều dâng. Những ngày sau đó, hiện tượng này tiếp tục lặp lại, khiến lượng rác ngày càng dồn ứ.
Sáng 13/11, rác chất thành từng đống nối dài trên bãi biển Bãi Sau, trải ra hai bên tháp Tam Thắng.
Bốn ngày trước, từng mảng rác lớn ngoài khơi theo sóng dạt vào bờ lúc thủy triều dâng. Những ngày sau đó, hiện tượng này tiếp tục lặp lại, khiến lượng rác ngày càng dồn ứ.
Trước đó, công nhân Công ty cổ phần Dịch vụ Môi trường và Công trình Đô thị Vũng Tàu đã gom rác lại nhưng chưa kịp vận chuyển. Đến tối qua, sóng tiếp tục đánh thêm một lớp rác mới tràn vào bờ, khiến lượng rác dồn ứ nhiều hơn.
Lục bình, chai nhựa lẫn trong thân dừa nước, cây lớn, cả nệm và bạt trôi dạt vào bờ.
Ông Tấn, cư dân phường Vũng Tàu, cho biết hơn 20 năm tắm biển Bãi Sau mỗi ngày nhưng chưa từng thấy lượng rác nhiều như lần này. Theo ông, rác không chỉ làm bãi biển nhếch nhác mà còn khiến nước gần bờ đục, lợn cợn, mất hẳn cảm giác thoải mái khi tắm.
Nhóm bạn trẻ phải len lỏi giữa những đống rác mới xuống được biển.
Chị Trần Thu Phương, ở phường Sài Gòn, nói buồn và tiếc khi bãi biển quen thuộc để thư giãn nay phủ đầy rác, khiến chị phải quay lên bờ chỉ sau vài phút tắm.
Nhóm bạn trẻ phải len lỏi giữa những đống rác mới xuống được biển.
Chị Trần Thu Phương, ở phường Sài Gòn, nói buồn và tiếc khi bãi biển quen thuộc để thư giãn nay phủ đầy rác, khiến chị phải quay lên bờ chỉ sau vài phút tắm.
Người đàn ông ngồi hít thở, người khác nằm phơi nắng bên những đống rác cao cả mét.
Hàng năm, các bãi biển Vũng Tàu thường hứng 2-3 đợt rác dạt vào trong 5-7 ngày. Tuy nhiên năm nay, rác đại dương xuất hiện nhiều đợt và khối lượng lớn hơn.
Ông Nguyễn Xuân Hậu, Phó tổng giám đốc Công ty CP Dịch vụ Môi trường và Công trình Đô thị Vũng Tàu, cho rằng mưa bão kết hợp triều cường có thể làm ""bể các bè rác"" ở sông khu vực TP HCM và miền Tây, trôi ra biển rồi theo dòng hải lưu dạt vào Bãi Sau.
Bà Lê Thị Sáu (70 tuổi, áo xanh) cùng người thân phải cào rác thành đống để đặt ghế phục vụ khách. Hơn 40 năm kinh doanh trên bãi biển, bà nói chưa từng chứng kiến rác dồn ứ nghiêm trọng như những ngày qua. ""Rác hôm trước vừa dọn, hôm sau lại chất đống, bốc mùi, khiến việc buôn bán ế ẩm"", bà nói.
Hơn 30 công nhân cùng gần 20 phương tiện cơ giới như xe cuốc, xe xúc, xe sàng rác biển và 12 xe tải 10-15 tấn được huy động thu gom hơn 400 tấn rác.
Ông Nguyễn Xuân Hậu, Phó tổng giám đốc Công ty CP Dịch vụ Môi trường và Công trình Đô thị Vũng Tàu, cho biết đợt rác dạt vào Bãi Sau lần này bất thường và lớn nhất từ đầu mùa.
Hơn 30 công nhân cùng gần 20 phương tiện cơ giới như xe cuốc, xe xúc, xe sàng rác biển và 12 xe tải 10-15 tấn được huy động thu gom hơn 400 tấn rác.
Ông Nguyễn Xuân Hậu, Phó tổng giám đốc Công ty CP Dịch vụ Môi trường và Công trình Đô thị Vũng Tàu, cho biết đợt rác dạt vào Bãi Sau lần này bất thường và lớn nhất từ đầu mùa.
Xe cơ giới hoạt động liên tục để xử lý rác khi thủy triều rút ra xa bờ.
Theo lãnh đạo Công ty CP Dịch vụ Môi trường và Công trình Đô thị Vũng Tàu, ước tính tổng khối lượng rác đợt này lên đến cả nghìn tấn. Việc dọn dẹp phụ thuộc lớn vào thủy triều. Khi nước dâng, xe cơ giới không thể xuống bãi, còn lượng rác tồn đọng quá nhiều nên không thể thu gom thủ công. Dự kiến khoảng hai ngày nữa, Bãi Sau sẽ được dọn sạch.
Xe cơ giới hoạt động liên tục để xử lý rác khi thủy triều rút ra xa bờ.
Theo lãnh đạo Công ty CP Dịch vụ Môi trường và Công trình Đô thị Vũng Tàu, ước tính tổng khối lượng rác đợt này lên đến cả nghìn tấn. Việc dọn dẹp phụ thuộc lớn vào thủy triều. Khi nước dâng, xe cơ giới không thể xuống bãi, còn lượng rác tồn đọng quá nhiều nên không thể thu gom thủ công. Dự kiến khoảng hai ngày nữa, Bãi Sau sẽ được dọn sạch."
