url,title,description,content
https://vnexpress.net/ky-vong-ty-do-tu-nen-kinh-te-voi-thiet-bi-bay-tai-viet-nam-4963906.html#box_comment_vne,Kỳ vọng tỷ đô từ nền kinh tế với thiết bị bay tại Việt Nam,"Các chuyên gia nhận định, nền kinh tế tầm thấp tại Việt Nam, liên quan đến các thiết bị bay, hệ thống quản lý không phận, có thể đạt 2-3 tỷ USD vào năm 2030, góp phần đảm bảo an ninh.","Tại Diễn đàn tổ chức ngày 14/11 tại Hà Nội, giới chuyên môn đặt nhiều kỳ vọng vào kinh tế tầm thấp. Theo đó nền kinh tế tầm thấp được hiểu là các hoạt động kinh tế diễn ra ở độ cao dưới 1.000 m, có thể mở rộng đến dưới 5.000 m tùy theo nhu cầu thực tế của từng quốc gia. Các hoạt động này sử dụng công nghệ bay có và không người lái như UAV, thiết bị bay thẳng đứng, cùng hạ tầng, hệ thống quản lý. Các lĩnh vực có thể áp dụng gồm: nông nghiệp, logistics, giám sát môi trường, giao thông, truyền thông và giải trí.
Tại Việt Nam, các công nghệ về thiết bị bay không người lái được xếp vào nhóm công nghệ hàng không, vũ trụ, là một trong 11 nhóm công nghệ chiến lược mà Việt Nam đặt mục tiêu làm chủ.
Theo ông Vũ Anh Tú, Giám đốc công nghệ Tập đoàn FPT, một trong những thành viên tiên phong của Liên minh Kinh tế tầm thấp (LAE), Việt Nam đang có cơ hội lớn trong lĩnh vực này. Ông đưa ra ước tính nền kinh tế này có thể đạt 2-3 tỷ USD vào năm 2030, hướng tới mục tiêu 10 tỷ USD doanh thu và tạo ra một triệu việc làm vào năm 2035.
""Xa hơn, Việt Nam có thể trở thành trung tâm sản xuất, dịch vụ LAE của khu vực"", ông Tú nói.
Dẫn một số thống kê trên thế giới, ông Tú cho biết thị trường UAV và các dịch vụ liên quan trên thế giới đạt quy mô hàng trăm tỷ USD, tăng trưởng trên 30%/năm. Nhiều quốc gia như Mỹ, Trung Quốc, UAE... coi đây là ngành chiến lược, được ứng dụng trong nhiều hoạt động như giao hàng bằng drone, taxi bay đô thị, nông nghiệp chính xác, giám sát hạ tầng, cứu hộ cứu nạn.
Theo CTO FPT, Việt Nam cũng đã có những bước đi đầu tiên với kết quả tích cực trong lĩnh vực này. Chẳng hạn trong các đợt thiên tai gần đây, các thiết bị bay đã hỗ trợ tích cực trong việc cứu hộ, vận chuyển hàng vào nơi khó tiếp cận.
Trong nông nghiệp, riêng khu vực đồng bằng sông Cửu Long đang có trên 3.000 drone hoạt động phục vụ cho 1,5 triệu ha. Thị trường UAV và robot nông nghiệp được dự báo đạt 363,7 triệu USD vào 2030, tăng 4,76%/năm. ""Thị trường này đã đủ lớn để hình thành công nghiệp hỗ trợ, dịch vụ vận hành, bảo trì, đào tạo"", ông Tú nói, nhấn mạnh đến vai trò của các thiết bị bay không chỉ trong lĩnh vực kinh tế, mà còn có giá trị về an ninh quốc phòng, cứu hộ cứu nạn, đô thị thông minh.
""Những ví dụ này chứng minh nền kinh tế tầm thấp đã hiện diện. Câu hỏi không còn là 'có làm hay không', mà là làm thế nào biến các mảnh ghép thành một bức tranh chiến lược quốc gia"", ông Tú nói.
Đồng tình quan điểm này, ông Trần Anh Tuấn, CEO Mạng lưới Hàng không, Vũ trụ và Thiết bị bay không người lái Việt Nam, đánh giá LAE có vai trò chiến lược với Việt Nam, bởi ""đây không chỉ là một xu hướng công nghệ, mà còn là chiến lược phát triển quốc gia, hội tụ ba giá trị cốt lõi, gồm: đổi mới sáng tạo, năng suất cao và phát triển bền vững"".
Có nhiều năm kinh nghiệm trong lĩnh vực này, ông Tuấn đánh giá kinh tế tầm thấp sẽ là không gian kinh tế mới của thế kỷ 21. Chúng sẽ không chỉ là các thiết bị bay, mà còn bao gồm các nhóm ngành như sản xuất phần cứng, công nghiệp phụ trợ, công nghệ lõi về phần mềm, AI và hệ thống quản lý không phận.
Các giải pháp phát triển kinh tế tầm thấp
Để lĩnh vực này phát triển tại Việt Nam, ông Trần Anh Tuấn đề xuất năm định hướng và giải pháp, gồm: Xây dựng hành lang pháp lý linh hoạt cho không phận tầm thấp; tập trung đầu tư R&D trong nước; phát triển cụm công nghiệp LAE và trung tâm thử nghiệm; đào tạo và phát triển nhân lực chất lượng cao; và xây dựng hệ sinh thái kết nối toàn diện.
Còn theo ông Vũ Anh Tú, LAE là một lĩnh vực đặc biệt và ""không một bên nào có thể tự mình làm được"", vì vậy cần kết hợp đa chiều giữa Nhà nước - Doanh nghiệp và viện, trường, người dân.
Ông đề xuất Nhà nước là kiến trúc sư về thể chế và hạ tầng, đưa ra các khung pháp lý cho không phận tầm thấp, cơ chế sandbox cho thử nghiệm, các chính sách ưu đãi R&D, và là ""khách hàng tiên phong"" trong nông nghiệp, quốc phòng, cứu hộ.
Trong khi đó, doanh nghiệp sẽ đầu tư công nghệ, thiết kế thiết bị, phát triển nền tảng quản lý; triển khai dịch vụ theo ngành. Viện, trường, hiệp hội cung cấp tri thức, chuẩn mực và nhân lực; cộng đồng người dùng sẽ là thước đo cho sự thành công khi chấp nhận, sử dụng và được hưởng lợi từ LAE mang lại.
Tại sự kiện, Phó giám đốc Trung tâm Đổi mới sáng tạo Quốc gia (NIC) Võ Xuân Hoài đánh giá đây là lĩnh vực quan trọng, khi nhiều nước trên thế giới đã xem hàng không vũ trụ và UAV là các ngành công nghệ chiến lược, đồng thời nền kinh tế tầm thấp đang trở thành xu thế phát triển nổi bật.
Ghi nhận nhiều đề xuất chính sách từ các doanh nghiệp, đại diện NIC, đơn vị bảo trợ cho sự kiện, cho biết sẽ cùng các đơn vị trong việc xây dựng khung chính sách thử nghiệm, phát triển hạ tầng quản lý không phận tầm thấp, và đẩy mạnh nghiên cứu, sản xuất thiết bị bay không người lái tại Việt Nam.
Lưu Quý"
https://vnexpress.net/phi-hanh-doan-trung-quoc-tro-ve-an-toan-sau-su-co-4964176.html,Phi hành đoàn Trung Quốc trở về an toàn sau sự cố,Khoang tàu chở phi hành đoàn Thần Châu 20 hạ cánh xuống bãi đáp Dongfeng ở khu tự trị Nội Mông lúc 16h40 hôm nay (15h40 giờ Hà Nội).,"Phi hành đoàn của tàu Thần Châu 20 gồm Wang Jie, Chen Zhongrui và Chen Dong, sống trên trạm vũ trụ Thiên Cung từ ngày 24/4 và dự kiến trở về Trái Đất ngày 5/11. Tuy nhiên, Cơ quan Vũ trụ có người lái Trung Quốc (CMSA) đã hoãn lịch bay do nghi ngờ khoang tàu chở phi hành đoàn về bị mảnh rác vũ trụ nhỏ đâm trúng.
Wang Jie, Chen Zhongrui và Chen Dong tạm thời ở lại trạm cùng phi hành đoàn Thần Châu 21 mới đến hôm 31/10. Chuyến trở về được dời đến hôm nay, sử dụng tàu Thần Châu 21 thay cho tàu Thần Châu 20.
Khoảng 14h49 (13h49 giờ Hà Nội), Trung tâm Kiểm soát Chuyến bay Hàng không vũ trụ Bắc Kinh phát lệnh trở về thông qua các trạm theo dõi mặt đất. Tàu Thần Châu 21 mang theo ba phi hành gia bắt đầu tách khỏi trạm Thiên Cung, lao xuống Trái Đất.
Sau khi động cơ khai hỏa để giảm tốc, khoang chở người tách khỏi module đẩy và hạ cánh thành công xuống bãi đáp Dongfeng. Đội tìm kiếm cứu nạn nhanh chóng định vị khoang tàu và tới hỗ trợ. Đến 17h21 (16h21 giờ Hà Nội), cả ba phi hành gia đều rời khỏi khoang tàu an toàn, được nhân viên y tế xác nhận là tình trạng sức khỏe tốt.
Wang Jie, Chen Zhongrui và Chen Dong đã sống 204 ngày trên quỹ đạo, lập kỷ lục về thời gian sống ngoài không gian lâu nhất của một phi hành đoàn Trung Quốc. Chen Dong, chỉ huy phi hành đoàn, người đầu tiên ra ngoài sau khi khoang tàu hạ cánh, là phi hành gia Trung Quốc đầu tiên có tổng thời gian sống trên quỹ đạo vượt 400 ngày.
Trong thời gian thực hiện nhiệm vụ, phi hành đoàn Thần Châu 20 hoàn thành bốn chuyến đi bộ không gian và nhiều hoạt động vận chuyển hàng hóa. Họ cũng phối hợp chặt chẽ với các nhà nghiên cứu dưới mặt đất để tiến hành nhiều thí nghiệm khoa học về vật lý vi trọng lực, khoa học vật liệu vũ trụ, khoa học sự sống, y học và công nghệ vũ trụ.
Thu Thảo(TheoCGTN, Xinhua)"
https://vnexpress.net/su-tro-lai-cua-motorola-tai-viet-nam-sau-10-nam-4963521.html#box_comment_vne,Sự trở lại của Motorola tại Việt Nam sau 10 năm,"Giữa tháng 11, Motorola thực hiện chiến dịch truyền thông rầm rộ trên mạng xã hội cho dấu mốc quay lại thị trường Việt Nam sau một thập kỷ.","Khẩu hiệu lần này là ""Hello Vietnam, Hello Moto"", gợi nhớ ""Hello Moto"" gắn với thời kỳ vàng son của hãng trên toàn cầu khi những chiếc Razr V3 siêu mỏng trở thành biểu tượng thời trang của ngành công nghiệp di động những năm 2000.
Tại sự kiện ở TP HCM chiều 12/11, hãng công bố 5 mẫu điện thoại mới với giá từ 2,9 triệu đến 19 triệu đồng, gồm Razr 60, Edge 60 Fusion, G86 Power, G35 5G và G06 Power.
Sự trùng hợp là tròn 10 năm trước, tháng 11/2015, Motorola đánh dấu việc ""đổi chủ"" từ Google sang Lenovo tại Việt Nam với việc giới thiệu 5 smartphone cũng ở phân khúc từ giá rẻ 2,59 triệu đến cận cao cấp 13,3 triệu đồng. Các mẫu máy này gồm Moto G, Moto E, Moto X, Moto X Play và X Style, đều được đánh giá cao về cấu hình, giá bán so với các thương hiệu nổi bật ở Việt Nam khi đó như Samsung, Asus, Oppo. Tuy nhiên, chúng nhanh chóng trôi vào quên lãng do khó thay đổi thói quen người dùng và một thời gian sau, công ty chấm dứt sự hiện diện tại thị trường Việt Nam.
Sau 10 năm, Motorola trở lại với vị thế mới khi đang thành công tại một số thị trường lớn, sự hậu thuẫn mạnh mẽ của Lenovo cùng ""màn chào sân"" thể hiện rõ tham vọng.
Một Motorola nay đã khác
Khi nhạc hiệu ""Hello Moto"" vang lên, Motorola trong ký ức thế hệ 7x, 8x là những chiếc điện thoại cao cấp, thời trang được nhiều người mong muốn sở hữu. Nhưng 20 năm sau đỉnh cao, phần lớn sản phẩm hãng bán ra trên thế giới ở phân khúc giá rẻ. Ba trong số 5 phiên bản bán ở Việt Nam cũng thuộc phân khúc trên dưới 5 triệu đồng.
Từ năm 2007, tương tự Nokia, Motorola cũng gặp nhiều khó khăn trước các đối thủ mới như Samsung, Apple, HTC trong bối cảnh thiết bị di động bước sang kỷ nguyên màn hình cảm ứng đa chạm. Năm 2012, Google chi 12,5 tỷ USD mua lại Motorola Mobility, chủ yếu để nắm giữ hàng chục nghìn bằng sáng chế của công ty nhằm tránh gặp rắc rối với các vụ kiện bản quyền, thay vì ý định vực dậy gã khổng lồ một thời.
Việc kinh doanh tiếp tục thua lỗ khiến Motorola bị Google rao bán, sau đó về tay Lenovo với giá 2,91 tỷ USD năm 2014, bằng 1/20 giá trị vốn hóa của công ty ở thời đỉnh cao 2005. TheoPhoneArena, tình thế bi đát của Motorola không khác Nokia, nhưng vẫn may mắn hơn. HMD ""đầu tư nửa vời"", tức chỉ mua quyền sở hữu thương hiệu Nokia năm 2016, còn Lenovo mua lại hoàn toàn hãng điện thoại Mỹ và cho phép hoạt động độc lập như một công ty con.
Dưới sự hậu thuẫn của Lenovo, Motorola có chiến lược rõ ràng trong giai đoạn 2015-2020 khi tập trung vào phân khúc tầm trung, giá rẻ tại các thị trường mà thương hiệu này vốn được ưa chuộng như Mỹ Latinh, Bắc Mỹ. Chiến lược cấu hình mạnh so với giá bán và thương hiệu quen thuộc của Lenovo giúp Motorola gặt hái nhiều thành công sau đó. Tại thị trường Mỹ Latinh, theo thống kê của hãng nghiên cứu IDC, điện thoại Motorola luôn bán chạy thứ hai sau Samsung, trên Apple, Xiaomi. Brazil và Argentina được coi là ""pháo đài"" của hãng khi thị phần luôn đạt trên 20% và bản thân Motorola cũng luôn ưu tiên ra mắt các dòng sản phẩm mới nhất tại đây.
Số liệu của hai công ty nghiên cứu Counterpoint Research và TechInsights cũng cho thấy Motorola đang đứng thứ ba ở Mỹ, sau Apple và Samsung với thị phần 11% trong quý I/2025. Moto G Play (100 USD) là ""con gà đẻ trứng vàng"" khi chiếm 23% tổng doanh số của Motorola tại thị trường Bắc Mỹ năm 2024.
Motorola cũng tạo ấn tượng khi tăng trưởng doanh thu smartphone 25% vào quý I/2025 so với cùng kỳ năm trước đó. Trong giai đoạn thị trường smartphone gặp nhiều khó khăn sau Covid-19, đây là một trong những hãng điện thoại có mức tăng trưởng mạnh nhất.
Tuy nhiên, tính chung trên toàn cầu, hãng còn nhiều việc cần làm khi chưa thể trở lại top 5. Trong quý IV/2024, Motorola bán được 15,3 triệu máy, đạt 5% thị phần, đứng vị trí thứ 8. Họ tập trung nâng cấp thương hiệu, như tái sinh dòng Razr, phát triển Moto Edge... nhưng chưa thu được thành tựu đáng kể.
Lợi thế và thách thức khi trở lại Việt Nam
""Thuận lợi của Motorola là người dùng Việt Nam đã quen thuộc với thương hiệu, đó là một phần ký ức của nhiều người. Motorola giới thiệu sản phẩm mới, không chỉ gợi lại phần ký ức tươi đẹp đó mà còn mở ra kỷ nguyên mới khi kết hợp giữa di sản với đột phá"", ông La Hồng Hưng, Giám đốc chiến lược sản phẩm của Motorola chia sẻ.
Tuy nhiên, ông Hưng cũng cho rằng thị trường smartphone tại Việt Nam nhiều sự cạnh tranh sẽ là thách thức lớn. Motorola phải tạo được sự khác biệt cũng như tập trung chiến lược để tiếp cận được thế hệ trẻ GenZ.
So với lần xuất hiện chớp nhoáng năm 2015, Motorola được đánh giá đã có sự chuẩn bị kỹ hơn khi trở lại lần này. Với tiềm lực tài chính mạnh mẽ từ hãng máy tính lớn nhất thế giới Lenovo, Motorola không chỉ đầu tư nhiều vào nghiên cứu phát triển các dòng máy cao cấp giai đoạn 2020-2025 mà còn thực hiện các chiến dịch truyền thông, bán hàng rầm rộ.
Lợi thế thứ ba, theo giới kinh doanh smartphone trong nước, là người dùng Việt đã ""mở lòng"" hơn với các thương hiệu điện thoại đến từ Trung Quốc. Tuy nhiên, đây cũng được coi là thách thức bởi những hãng có mặt sớm như Xiaomi, Oppo, Vivo đã khẳng định được chỗ đứng vững chắc bên cạnh các thương hiệu tên tuổi như Apple, Samsung.
Chiến lược sản phẩm của Motorola khi trở lại Việt Nam khá giống 2015 với các mẫu tầm trung, giá rẻ. Tuy nhiên, ưu điểm ""cấu hình so với giá bán"" hiện không đáng kể so với các đối thủ Trung Quốc khác. Ông Phạm Văn Anh, đại diện một hệ thống bán lẻ, cho biết bài toán khó cần giải nằm ở mức độ nhận diện thương hiệu và chiến lược tư vấn bán hàng tại các cửa hàng, thay vì để sản phẩm ""hữu xạ tự nhiên hương"".
""Nghĩ đến Motorola là nghĩ đến điện thoại nắp gập"", độc giả Nguyễn Trường Giangbình luậntrênVnExpressvà được ông Văn Anh đánh giá đại diện cho suy nghĩ của nhiều người tiêu dùng tại Việt Nam. Theo ông, thương hiệu Motorola mạnh trong quá khứ với sản phẩm cao cấp dạng nắp gập như dòng Razr, còn đa số model mới hướng đến phân khúc khách hàng hoàn toàn khác, thêm rằng thất bại của 10 năm trước tại Việt Nam cũng một phần đến từ sự không rõ ràng trong chiến lược sản phẩm, tiếp thị.
Trong khi đó, chuyên gia công nghệ Nguyễn Thành Dương cho rằng chất lượng sản phẩm đóng vai trò quyết định khi tiến vào phân khúc giá rẻ. Phần mềm ổn định, pin tốt, độ bền cao sau một thời gian dài hoạt động sẽ dần được người dùng đón nhận. Ngược lại, giá máy rẻ nhưng kém ổn định cũng ""sẽ sớm bị đào thải bởi người Việt không thiếu các lựa chọn ở tầm giá này"", ông đánh giá.
Ông Hoàng Tùng, đại diện một hệ thống phân phối thiết bị di động, nhận định Motorola cũng sẽ gặp thách thức khi vào Việt Nam đúng giai đoạn đi xuống của thị trường. Doanh số smartphone 2025 được dự báo giảm ít nhất 10% so với năm trước, khiến cơ hội cho các thương hiệu mới ít hơn, vấp phải sự cạnh tranh lớn hơn khi bản thân các hãng hiện có cũng phải giảm giá, đẩy mạnh hoạt động để tăng doanh số trong bối cảnh khó khăn.
Tuấn Hưng"
