url,title,description,content
https://vnexpress.net/phat-voucher-de-nguoi-dan-dung-san-pham-make-in-viet-nam-4958344.html#box_comment_vne,Phát voucher để người dân dùng sản phẩm Make in Viet Nam,"Phát phiếu hỗ trợ tài chính (voucher) cho người dùng là chính sách mới, nhằm giúp sản phẩm Make in Viet Nam bước chân từ phòng thí nghiệm ra thị trường.","Chính sách này được quy định trong Nghị định 268 ban hành ngày 14/10, hướng dẫn việc thi hành Luật Khoa học, công nghệ và đổi mới sáng tạo. Đây là hướng tiếp cận chưa từng có trong các chương trình hỗ trợ đổi mới sáng tạo trước đây.
Theo đó, Nhà nước sử dụng phiếu hỗ trợ tài chính (voucher) để khuyến khích người dùng trải nghiệm sản phẩm, dịch vụ mới, tạo điều kiện cho doanh nghiệp đưa sản phẩm Việt ra thị trường. Voucher được cấp thông qua Quỹ Đổi mới công nghệ quốc gia và quỹ phát triển khoa học, công nghệ của bộ, ngành, địa phương. Những sản phẩm được lựa chọn tham gia phải đáp ứng tiêu chuẩn kỹ thuật, có yếu tố mới về công nghệ, tính năng hoặc mô hình kinh doanh; ưu tiên các công nghệ cao, công nghệ chiến lược và có khả năng nhân rộng.
Tại họp báo ngày 31/10 của Bộ Khoa học và Công nghệ, ông Chu Thúc Đạt, Phó cục trưởng Đổi mới sáng tạo, cho biết chính sách cùng với hoạt động hỗ trợ lãi suất vay là điểm nổi bật của Nghị định 268. ""Đây là các biện pháp được kỳ vọng hỗ trợ trực tiếp, giúp doanh nghiệp đổi mới sáng tạo, khởi nghiệp và thúc đẩy văn hóa sáng tạo trong khu vực tư nhân"", ông nói.
Theo Cục Đổi mới sáng tạo, hiểu một cách đơn giản, voucher là cơ chế hỗ trợ tài chính ""kép"". Thay vì đưa tiền trực tiếp cho nhà sản xuất, Nhà nước cấp phiếu mua hàng cho người tiêu dùng hoặc doanh nghiệp.
Cơ chế vận hành của chương trình được thiết kế theo hướng minh bạch, chỉ chi ngân sách khi có giao dịch thực tế. Quỹ Đổi mới công nghệ quốc gia sẽ xây dựng chương trình voucher cho từng lĩnh vực ưu tiên, chọn sản phẩm, dịch vụ đã sẵn sàng thương mại hóa. Người dùng hoặc doanh nghiệp có nhu cầu sẽ được nhận voucher để mua sản phẩm, sau đó doanh nghiệp cung cấp sản phẩm sẽ hoàn lại phiếu cho Quỹ để nhận hỗ trợ.
""Đây là cú hích kép, vừa hỗ trợ bên cung, vừa kích thích bên cầu"", đại diện Cục nói, thêm rằng chính sách sẽ giải quyết bài toán con gà - quả trứng trong thương mại hóa công nghệ. ""Nhiều sản phẩm Make in Viet Nam có chất lượng tốt nhưng lại chật vật để có được những khách hàng đầu tiên, vì người dùng ngại rủi ro khi thử sản phẩm mới. Voucher phá vỡ rào cản này, giúp sản phẩm vượt qua 'thung lũng chết' để ra thị trường"", ông phân tích.
Ngoài voucher, Nghị định 268 còn tạo một ""bộ công cụ tài chính đa dạng"", mỗi công cụ nhắm đến một giai đoạn, giải một ""nút thắt"" khác nhau trong hành trình đổi mới sáng tạo. Giai đoạn nghiên cứu, phát triển ban đầu, doanh nghiệp có thể nhận tài trợ hoặc đặt hàng, khi mở rộng sản xuất họ được hỗ trợ lãi suất vay, và voucher là mảnh ghép cuối cùng, để hỗ trợ thâm nhập thị trường, khi sản phẩm sẵn sàng thương mại hóa.
Mỗi công cụ đi kèm cơ chế sàng lọc riêng: muốn được tài trợ phải chứng minh ý tưởng vượt trội; muốn được hỗ trợ lãi suất phải thuyết phục ngân hàng; còn để tham gia chương trình voucher, sản phẩm phải đủ tốt để thị trường chấp nhận.
Theo Cục Đổi mới sáng tạo, việc kết hợp các công cụ sẽ giúp hình thành một hệ sinh thái mở và cạnh tranh, nơi doanh nghiệp ở mọi giai đoạn, từ ý tưởng, nghiên cứu đến thương mại hóa, ""đều có một 'cánh cửa' phù hợp để tìm kiếm sự hỗ trợ của Nhà nước"".
Nghị định 268 kiến tạo một hệ thống hỗ trợ liền mạch, từ phòng thí nghiệm ra thị trường. ""Bằng cách trao cho doanh nghiệp không chỉ một mà nhiều công cụ phù hợp, chúng tôi tin sẽ khơi dậy nội lực, thúc đẩy sự cạnh tranh lành mạnh và hình thành hệ sinh thái đổi mới sáng tạo năng động, đủ sức tạo ra những sản phẩm công nghệ chinh phục cả thị trường trong nước và quốc tế"", đại diện Cục chia sẻ.
Luật Khoa học, công nghệ và đổi mới sáng tạo do Bộ Khoa học và Công nghệ chủ trì soạn thảo và được Quốc hội thông qua hồi tháng 6. Luật cụ thể hóa tinh thần Nghị quyết 57, thể hiện tầm nhìn, khát vọng đưa Việt Nam trở thành quốc gia hùng cường bằng phát triển khoa học, công nghệ, đổi mới sáng tạo. Đây là lần đầu ""đổi mới sáng tạo"" được đặt ngang hàng với khoa học công nghệ, thể hiện sự thay đổi căn bản trong tư duy phát triển.
Trọng Đạt"
https://vnexpress.net/hom-nay-dong-cong-binh-chon-may-loc-nuoc-cong-nghe-ion-kiem-4957966.html#vn_source=Home&vn_campaign=Box-TechAwards2025&vn_medium=Item-1&vn_term=Desktop,Hôm nay đóng cổng bình chọn máy lọc nước công nghệ ion kiềm,"Số bình chọn thứ 7 của Sản phẩm tôi yêu 2025, với chủ đề Máy lọc nước có công nghệ ion kiềm ấn tượng, sẽ đóng vào cuối ngày 31/10.","Hạng mục có 6 sản phẩm đề cử gồm Karofi SA9 Premium, Toshiba TWP-WA3SVN(K), Sunhouse UltraX SHA76656LA, Korihome WPK-965, Mutosi MP-S129H, Hòa Phát HPA886.
Các sản phẩm trang bị công nghệ điện phân tạo nước ion kiềm giàu hydrogen, giúp tăng hàm lượng hydrogen chống oxy hóa. Nhiều mẫu kết hợp tính năng nóng lạnh nguội tiện dụng và lớp kháng khuẩn (nano silver) để giữ vệ sinh bình chứa, nâng cao an toàn sử dụng cho gia đình.
Kết quả bình chọn được tính hoàn toàn dựa trên lượt đánh giá của độc giả. Sản phẩm đoạt giải sẽ được trao chứng nhận trong Lễ trao giải Tech Awards 2025, dự kiến tổ chức vào tháng 1/2026 tại TP HCM.
Tham gia bình chọn
Sản phẩm tôi yêulà hoạt động khởi động cho Tech Awards, diễn ra từ giữa tháng 7 đến 11 với 10 số bình chọn. Mỗi số kéo dài 10 ngày với chủ đề khác nhau liên quan đến sản phẩm gia dụng, thiết bị và phụ kiện điện tử.
Chương trình đã đi qua 6 số bình chọn gồm Máy lau nhà khô ướt được yêu thích nhất, Máy hút ẩm kiêm lọc khí cao cấp, Điện thoại thông minh được yêu thích, Máy lọc nước có công nghệ ấn tượng, Tai nghe True Wireless được yêu thích nhất, Máy lọc không khí có công nghệ ấn tượng. Chiến thắng lần lượt thuộc về Tineco Floor One S9 Artist Steam, Lumias D6 series, Garmin Forerunner 970, Amway - New eSpring và AirPods Pro 3, Atmosphere Mini.
Tech Awardslà chương trình bình chọn thường niên từ 2012 củaVnExpress, dành cho các sản phẩm và thương hiệu công nghệ nổi bật, được bán chính hãng trong năm tại thị trường Việt Nam. Năm nay, chương trình có 17 hạng mục, chia thành bốn nhóm bình chọn. Trong đó một số hạng mục mới và độc giả, doanh nghiệp có thể chủ động đề cử, tạo nên diện mạo mới cho chương trình.
Gửi đề cử Tech Awards 2025
Thái Anh"
https://vnexpress.net/hom-nay-dong-cong-binh-chon-may-loc-nuoc-cong-nghe-ion-kiem-4957966.html#box_comment_vne,Hôm nay đóng cổng bình chọn máy lọc nước công nghệ ion kiềm,"Số bình chọn thứ 7 của Sản phẩm tôi yêu 2025, với chủ đề Máy lọc nước có công nghệ ion kiềm ấn tượng, sẽ đóng vào cuối ngày 31/10.","Hạng mục có 6 sản phẩm đề cử gồm Karofi SA9 Premium, Toshiba TWP-WA3SVN(K), Sunhouse UltraX SHA76656LA, Korihome WPK-965, Mutosi MP-S129H, Hòa Phát HPA886.
Các sản phẩm trang bị công nghệ điện phân tạo nước ion kiềm giàu hydrogen, giúp tăng hàm lượng hydrogen chống oxy hóa. Nhiều mẫu kết hợp tính năng nóng lạnh nguội tiện dụng và lớp kháng khuẩn (nano silver) để giữ vệ sinh bình chứa, nâng cao an toàn sử dụng cho gia đình.
Kết quả bình chọn được tính hoàn toàn dựa trên lượt đánh giá của độc giả. Sản phẩm đoạt giải sẽ được trao chứng nhận trong Lễ trao giải Tech Awards 2025, dự kiến tổ chức vào tháng 1/2026 tại TP HCM.
Tham gia bình chọn
Sản phẩm tôi yêulà hoạt động khởi động cho Tech Awards, diễn ra từ giữa tháng 7 đến 11 với 10 số bình chọn. Mỗi số kéo dài 10 ngày với chủ đề khác nhau liên quan đến sản phẩm gia dụng, thiết bị và phụ kiện điện tử.
Chương trình đã đi qua 6 số bình chọn gồm Máy lau nhà khô ướt được yêu thích nhất, Máy hút ẩm kiêm lọc khí cao cấp, Điện thoại thông minh được yêu thích, Máy lọc nước có công nghệ ấn tượng, Tai nghe True Wireless được yêu thích nhất, Máy lọc không khí có công nghệ ấn tượng. Chiến thắng lần lượt thuộc về Tineco Floor One S9 Artist Steam, Lumias D6 series, Garmin Forerunner 970, Amway - New eSpring và AirPods Pro 3, Atmosphere Mini.
Tech Awardslà chương trình bình chọn thường niên từ 2012 củaVnExpress, dành cho các sản phẩm và thương hiệu công nghệ nổi bật, được bán chính hãng trong năm tại thị trường Việt Nam. Năm nay, chương trình có 17 hạng mục, chia thành bốn nhóm bình chọn. Trong đó một số hạng mục mới và độc giả, doanh nghiệp có thể chủ động đề cử, tạo nên diện mạo mới cho chương trình.
Gửi đề cử Tech Awards 2025
Thái Anh"
https://vnexpress.net/ten-lua-tai-su-dung-blue-origin-lan-dau-ha-canh-thanh-cong-4963894.html,Tên lửa tái sử dụng Blue Origin lần đầu hạ cánh thành công,Tầng thứ nhất của tên lửa New Glenn do Blue Origin chế tạo hạ cánh thẳng đứng xuống tàu trên biển sau khi đưa hai tàu NASA lên không gian.,"Tên lửa New Glenn rời bệ phóng tại Căn cứ Lực lượng Vũ trụ Cape Canaveral, Florida, lúc 15h45 ngày 13/11 (3h45 ngày 14/11 theo giờ Hà Nội), mang theo hai tàu vũ trụ Sao Hỏa của NASA và một thiết bị thử nghiệm công nghệ cho công ty liên lạc vệ tinh Viasat. Khoảng ba phút sau, động cơ chính tắt và tên lửa bắt đầu tách tầng theo đúng kế hoạch.
Sau khi chia tách, tầng tên lửa thứ hai tiếp tục đưa bộ đôi tàu NASA lên không gian, trong khi tầng đầu tiên thực hiện nhiều lần khai hỏa động cơ nhằm giảm tốc độ rơi, chuẩn bị đáp xuống tàu Jacklyn của Blue Origin đang chờ trên Đại Tây Dương.
New Glenn từng thử hạ cánh trong lần phóng đầu tiên hồi tháng 1 nhưng thất bại. Khi đó, Blue Origin cũng không kỳ vọng tên lửa đáp trúng đích mà chỉ muốn thu thập dữ liệu để tăng khả năng thành công cho các chuyến bay trong tương lai. Dữ liệu này đã mang đến kết quả tốt cho vụ phóng hôm nay, khi tầng đẩy của tên lửa đáp thẳng đứng xuống tàu Jacklyn.
""Một tên lửa quỹ đạo đã hạ cánh. Đây đúng là một ngày tuyệt vời cho Blue Origin, cho ngành công nghiệp vũ trụ"", Ariane Cornell, Phó chủ tịch về hệ thống không gian của Blue Origin, nhận xét.
Thành tựu mới đưa Blue Origin trở thành công ty thứ hai trong lịch sử thu hồi tên lửa trong một chuyến bay thực sự. Công ty đầu tiên đạt cột mốc này là SpaceX.
Tuy nhiên, đưa tầng đẩy hạ cánh không phải mục tiêu chính của vụ phóng hôm nay mà là đưa bộ đôi tàu vũ trụ trong nhiệm vụ Escapade của NASA lên không gian. Mục tiêu này cũng thành công khi hai tàu bay lên đúng vị trí khoảng 33 phút sau khi phóng.
Escapade là nhiệm vụ đầu tiên đưa hai tàu thăm dò do tư nhân chế tạo tới Sao Hỏa, nghiên cứu quá trình hành tinh này mất khí quyển và trở thành hành tinh khô cằn như ngày nay. Bộ đôi tàu do công ty Rocket Lab chế tạo, có chi phí ước tính dưới 100 triệu USD - thấp hơn nhiều so với các nhiệm vụ sao Hỏa then chốt trước đây của NASA, thường tốn khoảng 300-600 triệu USD. Hai tàu dự kiến tiến vào quỹ đạo Sao Hỏa tháng 9/2027.
New Glenn là tên lửa tái sử dụng hai tầng cao 98 m. Với khả năng chở 50 tấn lên quỹ đạo Trái Đất thấp (LEO), nó có sức mạnh gần bằng tên lửa Falcon Heavy của SpaceX và gần gấp đôi tên lửa Vulcan Centaur mới của United Launch Alliance. Theo thiết kế, tầng thứ nhất của New Glenn có khả năng thực hiện ít nhất 25 chuyến bay. Thành công hôm nay đưa mẫu tên lửa này tiến gần hơn tới mục tiêu thực hiện các hợp đồng vận chuyển giá trị lớn cho Lực lượng Vũ trụ Mỹ và Văn phòng Trinh sát Quốc gia Mỹ.
Thu Thảo(TheoSpace, CNN)"
https://vnexpress.net/ky-vong-ty-do-tu-nen-kinh-te-voi-thiet-bi-bay-tai-viet-nam-4963906.html,Kỳ vọng tỷ đô từ nền kinh tế với thiết bị bay tại Việt Nam,"Các chuyên gia nhận định, nền kinh tế tầm thấp tại Việt Nam, liên quan đến các thiết bị bay, hệ thống quản lý không phận, có thể đạt 2-3 tỷ USD vào năm 2030, góp phần đảm bảo an ninh.","Tại Diễn đàn tổ chức ngày 14/11 tại Hà Nội, giới chuyên môn đặt nhiều kỳ vọng vào kinh tế tầm thấp. Theo đó nền kinh tế tầm thấp được hiểu là các hoạt động kinh tế diễn ra ở độ cao dưới 1.000 m, có thể mở rộng đến dưới 5.000 m tùy theo nhu cầu thực tế của từng quốc gia. Các hoạt động này sử dụng công nghệ bay có và không người lái như UAV, thiết bị bay thẳng đứng, cùng hạ tầng, hệ thống quản lý. Các lĩnh vực có thể áp dụng gồm: nông nghiệp, logistics, giám sát môi trường, giao thông, truyền thông và giải trí.
Tại Việt Nam, các công nghệ về thiết bị bay không người lái được xếp vào nhóm công nghệ hàng không, vũ trụ, là một trong 11 nhóm công nghệ chiến lược mà Việt Nam đặt mục tiêu làm chủ.
Theo ông Vũ Anh Tú, Giám đốc công nghệ Tập đoàn FPT, một trong những thành viên tiên phong của Liên minh Kinh tế tầm thấp (LAE), Việt Nam đang có cơ hội lớn trong lĩnh vực này. Ông đưa ra ước tính nền kinh tế này có thể đạt 2-3 tỷ USD vào năm 2030, hướng tới mục tiêu 10 tỷ USD doanh thu và tạo ra một triệu việc làm vào năm 2035.
""Xa hơn, Việt Nam có thể trở thành trung tâm sản xuất, dịch vụ LAE của khu vực"", ông Tú nói.
Dẫn một số thống kê trên thế giới, ông Tú cho biết thị trường UAV và các dịch vụ liên quan trên thế giới đạt quy mô hàng trăm tỷ USD, tăng trưởng trên 30%/năm. Nhiều quốc gia như Mỹ, Trung Quốc, UAE... coi đây là ngành chiến lược, được ứng dụng trong nhiều hoạt động như giao hàng bằng drone, taxi bay đô thị, nông nghiệp chính xác, giám sát hạ tầng, cứu hộ cứu nạn.
Theo CTO FPT, Việt Nam cũng đã có những bước đi đầu tiên với kết quả tích cực trong lĩnh vực này. Chẳng hạn trong các đợt thiên tai gần đây, các thiết bị bay đã hỗ trợ tích cực trong việc cứu hộ, vận chuyển hàng vào nơi khó tiếp cận.
Trong nông nghiệp, riêng khu vực đồng bằng sông Cửu Long đang có trên 3.000 drone hoạt động phục vụ cho 1,5 triệu ha. Thị trường UAV và robot nông nghiệp được dự báo đạt 363,7 triệu USD vào 2030, tăng 4,76%/năm. ""Thị trường này đã đủ lớn để hình thành công nghiệp hỗ trợ, dịch vụ vận hành, bảo trì, đào tạo"", ông Tú nói, nhấn mạnh đến vai trò của các thiết bị bay không chỉ trong lĩnh vực kinh tế, mà còn có giá trị về an ninh quốc phòng, cứu hộ cứu nạn, đô thị thông minh.
""Những ví dụ này chứng minh nền kinh tế tầm thấp đã hiện diện. Câu hỏi không còn là 'có làm hay không', mà là làm thế nào biến các mảnh ghép thành một bức tranh chiến lược quốc gia"", ông Tú nói.
Đồng tình quan điểm này, ông Trần Anh Tuấn, CEO Mạng lưới Hàng không, Vũ trụ và Thiết bị bay không người lái Việt Nam, đánh giá LAE có vai trò chiến lược với Việt Nam, bởi ""đây không chỉ là một xu hướng công nghệ, mà còn là chiến lược phát triển quốc gia, hội tụ ba giá trị cốt lõi, gồm: đổi mới sáng tạo, năng suất cao và phát triển bền vững"".
Có nhiều năm kinh nghiệm trong lĩnh vực này, ông Tuấn đánh giá kinh tế tầm thấp sẽ là không gian kinh tế mới của thế kỷ 21. Chúng sẽ không chỉ là các thiết bị bay, mà còn bao gồm các nhóm ngành như sản xuất phần cứng, công nghiệp phụ trợ, công nghệ lõi về phần mềm, AI và hệ thống quản lý không phận.
Các giải pháp phát triển kinh tế tầm thấp
Để lĩnh vực này phát triển tại Việt Nam, ông Trần Anh Tuấn đề xuất năm định hướng và giải pháp, gồm: Xây dựng hành lang pháp lý linh hoạt cho không phận tầm thấp; tập trung đầu tư R&D trong nước; phát triển cụm công nghiệp LAE và trung tâm thử nghiệm; đào tạo và phát triển nhân lực chất lượng cao; và xây dựng hệ sinh thái kết nối toàn diện.
Còn theo ông Vũ Anh Tú, LAE là một lĩnh vực đặc biệt và ""không một bên nào có thể tự mình làm được"", vì vậy cần kết hợp đa chiều giữa Nhà nước - Doanh nghiệp và viện, trường, người dân.
Ông đề xuất Nhà nước là kiến trúc sư về thể chế và hạ tầng, đưa ra các khung pháp lý cho không phận tầm thấp, cơ chế sandbox cho thử nghiệm, các chính sách ưu đãi R&D, và là ""khách hàng tiên phong"" trong nông nghiệp, quốc phòng, cứu hộ.
Trong khi đó, doanh nghiệp sẽ đầu tư công nghệ, thiết kế thiết bị, phát triển nền tảng quản lý; triển khai dịch vụ theo ngành. Viện, trường, hiệp hội cung cấp tri thức, chuẩn mực và nhân lực; cộng đồng người dùng sẽ là thước đo cho sự thành công khi chấp nhận, sử dụng và được hưởng lợi từ LAE mang lại.
Tại sự kiện, Phó giám đốc Trung tâm Đổi mới sáng tạo Quốc gia (NIC) Võ Xuân Hoài đánh giá đây là lĩnh vực quan trọng, khi nhiều nước trên thế giới đã xem hàng không vũ trụ và UAV là các ngành công nghệ chiến lược, đồng thời nền kinh tế tầm thấp đang trở thành xu thế phát triển nổi bật.
Ghi nhận nhiều đề xuất chính sách từ các doanh nghiệp, đại diện NIC, đơn vị bảo trợ cho sự kiện, cho biết sẽ cùng các đơn vị trong việc xây dựng khung chính sách thử nghiệm, phát triển hạ tầng quản lý không phận tầm thấp, và đẩy mạnh nghiên cứu, sản xuất thiết bị bay không người lái tại Việt Nam.
Lưu Quý"
https://vnexpress.net/ten-lua-tai-su-dung-blue-origin-lan-dau-ha-canh-thanh-cong-4963894.html#box_comment_vne,Tên lửa tái sử dụng Blue Origin lần đầu hạ cánh thành công,Tầng thứ nhất của tên lửa New Glenn do Blue Origin chế tạo hạ cánh thẳng đứng xuống tàu trên biển sau khi đưa hai tàu NASA lên không gian.,"Tên lửa New Glenn rời bệ phóng tại Căn cứ Lực lượng Vũ trụ Cape Canaveral, Florida, lúc 15h45 ngày 13/11 (3h45 ngày 14/11 theo giờ Hà Nội), mang theo hai tàu vũ trụ Sao Hỏa của NASA và một thiết bị thử nghiệm công nghệ cho công ty liên lạc vệ tinh Viasat. Khoảng ba phút sau, động cơ chính tắt và tên lửa bắt đầu tách tầng theo đúng kế hoạch.
Sau khi chia tách, tầng tên lửa thứ hai tiếp tục đưa bộ đôi tàu NASA lên không gian, trong khi tầng đầu tiên thực hiện nhiều lần khai hỏa động cơ nhằm giảm tốc độ rơi, chuẩn bị đáp xuống tàu Jacklyn của Blue Origin đang chờ trên Đại Tây Dương.
New Glenn từng thử hạ cánh trong lần phóng đầu tiên hồi tháng 1 nhưng thất bại. Khi đó, Blue Origin cũng không kỳ vọng tên lửa đáp trúng đích mà chỉ muốn thu thập dữ liệu để tăng khả năng thành công cho các chuyến bay trong tương lai. Dữ liệu này đã mang đến kết quả tốt cho vụ phóng hôm nay, khi tầng đẩy của tên lửa đáp thẳng đứng xuống tàu Jacklyn.
""Một tên lửa quỹ đạo đã hạ cánh. Đây đúng là một ngày tuyệt vời cho Blue Origin, cho ngành công nghiệp vũ trụ"", Ariane Cornell, Phó chủ tịch về hệ thống không gian của Blue Origin, nhận xét.
Thành tựu mới đưa Blue Origin trở thành công ty thứ hai trong lịch sử thu hồi tên lửa trong một chuyến bay thực sự. Công ty đầu tiên đạt cột mốc này là SpaceX.
Tuy nhiên, đưa tầng đẩy hạ cánh không phải mục tiêu chính của vụ phóng hôm nay mà là đưa bộ đôi tàu vũ trụ trong nhiệm vụ Escapade của NASA lên không gian. Mục tiêu này cũng thành công khi hai tàu bay lên đúng vị trí khoảng 33 phút sau khi phóng.
Escapade là nhiệm vụ đầu tiên đưa hai tàu thăm dò do tư nhân chế tạo tới Sao Hỏa, nghiên cứu quá trình hành tinh này mất khí quyển và trở thành hành tinh khô cằn như ngày nay. Bộ đôi tàu do công ty Rocket Lab chế tạo, có chi phí ước tính dưới 100 triệu USD - thấp hơn nhiều so với các nhiệm vụ sao Hỏa then chốt trước đây của NASA, thường tốn khoảng 300-600 triệu USD. Hai tàu dự kiến tiến vào quỹ đạo Sao Hỏa tháng 9/2027.
New Glenn là tên lửa tái sử dụng hai tầng cao 98 m. Với khả năng chở 50 tấn lên quỹ đạo Trái Đất thấp (LEO), nó có sức mạnh gần bằng tên lửa Falcon Heavy của SpaceX và gần gấp đôi tên lửa Vulcan Centaur mới của United Launch Alliance. Theo thiết kế, tầng thứ nhất của New Glenn có khả năng thực hiện ít nhất 25 chuyến bay. Thành công hôm nay đưa mẫu tên lửa này tiến gần hơn tới mục tiêu thực hiện các hợp đồng vận chuyển giá trị lớn cho Lực lượng Vũ trụ Mỹ và Văn phòng Trinh sát Quốc gia Mỹ.
Thu Thảo(TheoSpace, CNN)"
