url,title,description,content
https://vnexpress.net/ky-su-viet-phat-trien-ban-do-so-4958446.html,Kỹ sư Việt phát triển bản đồ số,Hà NộiBản đồ số Digimap do kỹ sư Việt phát triển giúp người tham quan tìm nhanh đường đến hàng trăm khu vực mong muốn tại nơi tổ chức Hội chợ Mùa Thu.,"Hội chợ Mùa Thu 2025 diễn ra từ 25/10 đến 04/11 tại Trung tâm Triển lãm Việt Nam, Đông Anh, Hà Nội. Ban tổ chức cho biết bản đồ số được cung cấp trên trang vec.digimap.ai. Đây là bản đồ từng được dùng trong Triển lãm 80 năm thành tựu đất nước, nhưng được bổ sung thêm nhiều tính năng để đáp ứng nhu cầu của hội chợ.
Hội chợ Mùa Thu năm nay thu hút khoảng 3.000 gian hàng chia vào 6 phân khu, trên diện tích trưng bày trên 130.000 m2, dự kiến đón tới 500.000 lượt khách mỗi ngày. Một trong những thách thức với không gian lớn là việc tìm đường đến đúng gian hàng và khu vực mong muốn.
Ở phiên bản mới, hệ thống được bổ sung tính năng dẫn đường đa điểm (multi-direction). Người dùng chọn điểm xuất phát và chọn các điểm đến mong muốn, bản đồ sẽ cho ra lộ trình nhanh nhất hoặc quãng đường ngắn nhất, xem theo dạng 2D hoặc 3D.
Ngoài ra, bản đồ này cũng bắt đầu cung cấp chatbot để hỗ trợ tra cứu nhanh, cung cấp thông tin về lịch trình, khu vực tiện ích, gian hàng nổi bật và các hoạt động theo chủ đề. Đồng thời giao diện được tối ưu theo hướng trực quan hơn, cho phép người tham dự dễ dàng xác định vị trí, tìm tuyến đi tối ưu và khám phá theo danh sách điểm đến mong muốn.
""Nền tảng cũng được tối ưu tốc độ tải để vận hành ổn định trong điều kiện mật độ khách cao và phạm vi không gian rộng"", đại diện đơn vị phát triển cho biết.
Đây cũng là sản phẩm bản đồ hiếm hoi do kỹ sư Việt phát triển, nhắm tới phân khúc bản đồ trong nhà, từng được sử dụng tại một số sự kiện lớn tại Nhật Bản, Việt Nam.
Đại diện đơn vị phát triển cho biết một trong những thách thức của việc lập bản đồ số trong các triển lãm là cần tìm đúng vị trí đến và đi, trong bối cảnh các giải pháp như GPS sẽ khó chính xác với gian hàng nhỏ và đặt trong nhà. Để giải quyết bài toán đó, đơn vị phát triển cần tìm ra cách định vị khác, như xây dựng bộ dữ liệu về thông tin của gian hàng để người dùng có thể tìm khi gõ. Ngoài ra, ở một số vị trí nhất định trong triển lãm, họ sẽ đặt các mã QR. Người dùng mở website, quét mã là có thể tìm ra vị trí của mình trên bản đồ.
""Mật độ khách di chuyển liên tục tại hội chợ sẽ đặt ra yêu cầu cao về độ ổn định. Chúng tôi kế thừa công nghệ đã vận hành tại Triển lãm hồi tháng 9, đồng thời tối ưu thuật toán định vị và xử lý bản đồ để đảm bảo trải nghiệm tốt cả trong giờ cao điểm"", đại diện Digimap cho biết.
Theo ban tổ chức, việc áp dụng bản đồ số không chỉ giúp khách tham quan điều hướng thuận tiện hơn, mà còn hỗ trợ quản lý dòng khách, theo dõi mật độ di chuyển và phân bổ dịch vụ phù hợp. Đây cũng được xem là bước tiến trong định hướng xây dựng mô hình sự kiện thông minh, kết hợp giá trị văn hóa truyền thống với công nghệ hiện đại.
""Trong thời gian tới, ứng dụng sẽ tiếp tục tối ưu công nghệ điều hướng trong nhà, bổ sung khả năng dẫn đường đa điểm và các tiện ích tìm kiếm nhanh"", đơn vị này cho biết.
Lưu Quý"
https://vnexpress.net/trung-tam-du-lieu-ai-mot-gigawatt-tri-gia-35-ty-usd-co-gi-4958085.html,Trung tâm dữ liệu AI một gigawatt trị giá 35 tỷ USD có gì?,"Công suất một gigawatt được xem là tiêu chuẩn mới của trung tâm dữ liệu AI với nhiều thành phần, trong đó chi phí lớn nhất dành cho GPU của Nvidia.","Theo phân tích của ngân hàng đầu tư TD Cowen (Mỹ), một gigawatt (GW) là chuẩn mực mới cho các trung tâm dữ liệu AI thế hệ tiếp theo, như Colossus 2 của xAI ở Memphis, Prometheus của Meta ở Ohio, Hyperion ở Louisiana, Stargate của OpenAI ở Texas và dự án Mount Rainier của Amazon ở Indiana.
Trong khi đó, phân tích từ Bernstein Research cho thấy xây dựng trung tâm dữ liệu AI cỡ gigawatt cần khoảng 35 tỷ USD. ""Mỗi gigawatt công suất không chỉ là thước đo năng lượng, mà còn đại diện cho hệ sinh thái công nghiệp mới nổi trải dài từ chất bán dẫn, thiết bị mạng, hệ thống điện, xây dựng đến sản xuất năng lượng"", Bernstein Research bình luận.
Kết hợp các nguồn dữ liệu, TD Cowen và Bernstein Research ước tính 39% chi phí, tức khoảng 13,65 tỷ USD, là dành cho chip AI - những GPU được tối ưu hóa cho tác vụ trí tuệ nhân tạo. Chúng có khả năng xử lý song song mạnh mẽ, thực hiện hàng nghìn phép tính đồng thời, giúp tăng tốc đáng kể tác vụ như đào tạo mô hình học sâu, phân tích dữ liệu lớn, vận hành ứng dụng AI phức tạp.
Nvidia thống trị thị trường, khi kiểm soát khoảng 90% thị phần GPU cho trung tâm dữ liệu, theo hãng phân tích IDC. Dữ liệu của TD Cowen cho thấy mỗi GW tương đương hơn một triệu GPU được sử dụng. Thậm chí, TSMC, đối tác sản xuất chip của Nvidia, cũng kiếm được 1,3 tỷ USD trên mỗi gigawatt từ việc sản xuất linh kiện này.
""Không ngạc nhiên khi Nvidia được định giá 5.000 tỷ USD"",Business Insiderbình luận.
Trong khi đó, mạng lưới hệ thống (networking) - các mạch giúp kết nối GPU với nhau, chủ yếu là thiết bị mạng như bộ chuyển mạch tốc độ cao và kết nối quang - chiếm 13%, tương đương 4,5 tỷ USD. Arista Networks, Broadcom và Marvell là những nhà cung cấp thiết bị chuyển mạch hàng đầu được lựa chọn. Amphenol và Luxshare cung cấp cáp và đầu nối, trong khi InnoLight, Eoptolink và Coherent chuyên sản xuất bộ thu phát quang cũng là những cái tên hưởng lợi.
Chi phí cho đất đai và xây dựng các tòa nhà đặt máy chủ chiếm khoảng 11%, tương đương 3,85 tỷ USD. Cơ sở hạ tầng và vật chất khác là 8%, tức 2,8 tỷ USD.
Tuy nhiên, năng lượng là vấn đề lớn đối với trung tâm dữ liệu AI. Theo tính toán, riêng việc sử dụng điện năng chiếm 10% chi phí, hay 3,5 tỷ USD. Các hệ thống như turbine khí và máy phát điện diesel chiếm 6% (2,1 tỷ USD) còn nguồn điện dự phòng chiếm 5% (1,75 tỷ USD). Tổng cộng, chi phí cho điện năng của trung tâm dữ liệu AI công suất một gigawatt vào khoảng 21% (7,35 tỷ USD).
Hạ tầng điện tại Mỹ hiện nay được đánh giá chưa đáp ứng nhu cầu cho trung tâm dữ liệu. Tuy nhiên, nhiều công ty đã bắt đầu xây dựng những hệ thống lớn. Theo các đơn vị chuyên cung cấp thiết bị xây dựng hạ tầng năng lượng như Siemens Energy, GE Vernova và Mitsubishi Heavy, lượng đơn đặt hàng turbine phát điện và thiết bị hạ tầng lưới điện tăng vọt trong bối cảnh các công ty điện ở Mỹ đang nỗ lực đảm bảo nguồn điện đáng tin cậy ở quy mô lớn.
Ngoài ra, trung tâm dữ liệu AI công suất một gigawatt cũng cần 4% chi phí cho quản lý nhiệt, tương đương 1,4 tỷ USD. Việc vận hành liên tục khiến máy móc phát ra lượng nhiệt khổng lồ, buộc phải giảm nhiệt bằng các hệ thống làm mát chủ yếu bằng không khí và chất lỏng. Các chi phí khác như CPU, bộ lưu trữ, hay nhân lực vận hành chiếm thêm khoảng 4%.
Bảo Lâm(theoBusiness Insider, Bernstein Research)"
https://vnexpress.net/trung-tam-du-lieu-ai-mot-gigawatt-tri-gia-35-ty-usd-co-gi-4958085.html#box_comment_vne,Trung tâm dữ liệu AI một gigawatt trị giá 35 tỷ USD có gì?,"Công suất một gigawatt được xem là tiêu chuẩn mới của trung tâm dữ liệu AI với nhiều thành phần, trong đó chi phí lớn nhất dành cho GPU của Nvidia.","Theo phân tích của ngân hàng đầu tư TD Cowen (Mỹ), một gigawatt (GW) là chuẩn mực mới cho các trung tâm dữ liệu AI thế hệ tiếp theo, như Colossus 2 của xAI ở Memphis, Prometheus của Meta ở Ohio, Hyperion ở Louisiana, Stargate của OpenAI ở Texas và dự án Mount Rainier của Amazon ở Indiana.
Trong khi đó, phân tích từ Bernstein Research cho thấy xây dựng trung tâm dữ liệu AI cỡ gigawatt cần khoảng 35 tỷ USD. ""Mỗi gigawatt công suất không chỉ là thước đo năng lượng, mà còn đại diện cho hệ sinh thái công nghiệp mới nổi trải dài từ chất bán dẫn, thiết bị mạng, hệ thống điện, xây dựng đến sản xuất năng lượng"", Bernstein Research bình luận.
Kết hợp các nguồn dữ liệu, TD Cowen và Bernstein Research ước tính 39% chi phí, tức khoảng 13,65 tỷ USD, là dành cho chip AI - những GPU được tối ưu hóa cho tác vụ trí tuệ nhân tạo. Chúng có khả năng xử lý song song mạnh mẽ, thực hiện hàng nghìn phép tính đồng thời, giúp tăng tốc đáng kể tác vụ như đào tạo mô hình học sâu, phân tích dữ liệu lớn, vận hành ứng dụng AI phức tạp.
Nvidia thống trị thị trường, khi kiểm soát khoảng 90% thị phần GPU cho trung tâm dữ liệu, theo hãng phân tích IDC. Dữ liệu của TD Cowen cho thấy mỗi GW tương đương hơn một triệu GPU được sử dụng. Thậm chí, TSMC, đối tác sản xuất chip của Nvidia, cũng kiếm được 1,3 tỷ USD trên mỗi gigawatt từ việc sản xuất linh kiện này.
""Không ngạc nhiên khi Nvidia được định giá 5.000 tỷ USD"",Business Insiderbình luận.
Trong khi đó, mạng lưới hệ thống (networking) - các mạch giúp kết nối GPU với nhau, chủ yếu là thiết bị mạng như bộ chuyển mạch tốc độ cao và kết nối quang - chiếm 13%, tương đương 4,5 tỷ USD. Arista Networks, Broadcom và Marvell là những nhà cung cấp thiết bị chuyển mạch hàng đầu được lựa chọn. Amphenol và Luxshare cung cấp cáp và đầu nối, trong khi InnoLight, Eoptolink và Coherent chuyên sản xuất bộ thu phát quang cũng là những cái tên hưởng lợi.
Chi phí cho đất đai và xây dựng các tòa nhà đặt máy chủ chiếm khoảng 11%, tương đương 3,85 tỷ USD. Cơ sở hạ tầng và vật chất khác là 8%, tức 2,8 tỷ USD.
Tuy nhiên, năng lượng là vấn đề lớn đối với trung tâm dữ liệu AI. Theo tính toán, riêng việc sử dụng điện năng chiếm 10% chi phí, hay 3,5 tỷ USD. Các hệ thống như turbine khí và máy phát điện diesel chiếm 6% (2,1 tỷ USD) còn nguồn điện dự phòng chiếm 5% (1,75 tỷ USD). Tổng cộng, chi phí cho điện năng của trung tâm dữ liệu AI công suất một gigawatt vào khoảng 21% (7,35 tỷ USD).
Hạ tầng điện tại Mỹ hiện nay được đánh giá chưa đáp ứng nhu cầu cho trung tâm dữ liệu. Tuy nhiên, nhiều công ty đã bắt đầu xây dựng những hệ thống lớn. Theo các đơn vị chuyên cung cấp thiết bị xây dựng hạ tầng năng lượng như Siemens Energy, GE Vernova và Mitsubishi Heavy, lượng đơn đặt hàng turbine phát điện và thiết bị hạ tầng lưới điện tăng vọt trong bối cảnh các công ty điện ở Mỹ đang nỗ lực đảm bảo nguồn điện đáng tin cậy ở quy mô lớn.
Ngoài ra, trung tâm dữ liệu AI công suất một gigawatt cũng cần 4% chi phí cho quản lý nhiệt, tương đương 1,4 tỷ USD. Việc vận hành liên tục khiến máy móc phát ra lượng nhiệt khổng lồ, buộc phải giảm nhiệt bằng các hệ thống làm mát chủ yếu bằng không khí và chất lỏng. Các chi phí khác như CPU, bộ lưu trữ, hay nhân lực vận hành chiếm thêm khoảng 4%.
Bảo Lâm(theoBusiness Insider, Bernstein Research)"
https://vnexpress.net/mang-di-dong-dau-tien-cho-kich-hoat-sim-qua-vneid-4958429.html,Mạng di động đầu tiên cho kích hoạt sim qua VNeID,Mạng di động FPT cho biết đã trở thành nhà mạng đầu tiên triển khai quy trình kích hoạt sim chính chủ qua VNeID thay cho thẻ căn cước.,"Cụ thể, người dùng sau khi mua sim sẽ đăng nhập vào ứng dụng của nhà mạng và chọn mục ""Kích hoạt sim"". Tại đây, ứng dụng cho phép lựa chọn kích hoạt bằng tài khoản định danh điện tử VNeID để xác thực thông tin định danh.
""Ứng dụng FPT Shop sẽ tự động liên kết với ứng dụng VNeID để xác thực dữ liệu và hoàn tất đăng ký kích hoạt"", đại diện nhà mạng cho biết ngày 31/10, thêm rằng điều này giúp thuê bao được xác nhận chính chủ ngay sau khi hoàn tất các bước đăng ký.
Việc kích hoạt sim online được thông qua tại Việt Nam cuối năm 2024, sau khiNghị định 163, quy định một số điều và biện pháp thi hành Luật Viễn thông, được ban hành. Theo đó, ngoài hình thức kích hoạt trực tiếp tại điểm giao dịch của nhà mạng, người dùng có thể đăng ký trực tuyến qua ứng dụng của doanh nghiệp cung cấp dịch vụ và xác thực bằng thẻ CCCD hoặc tài khoản định danh VNeID.
Đến nay, các nhà mạng đã hỗ trợ người dùng kích hoạt sim qua ứng dụng, nhưng chủ yếu sử dụng thẻ CCCD. Mạng di động FPT là đơn vị đầu tiên hỗ trợ xác thực bằng VNeID. Điều kiện cần là tài khoản VNeID đã được định danh điện tử mức 2.
Theo đại diện nhà mạng, việc này giúp người dùng chủ động thực hiện toàn bộ quy trình đăng ký và kích hoạt sim trực tuyến, tiết kiệm thời gian và không cần đến cửa hàng hay mang theo căn cước công dân bản cứng.
""Hình thức mới cũng loại bỏ nguy cơ giả mạo giấy tờ, bởi thông tin người dùng đã được định danh, góp phần chuẩn hóa thuê bao di động và ngăn chặn tình trạng sim rác trên thị trường"", người này cho biết.
Thời gian qua, hàng loạt dịch vụ tại Việt Nam cho phép xác thực qua VNeID, như hồ sơ sức khỏe, ngân hàng, hàng không, chữ ký số, ví điện tử.
Lưu Quý"
https://vnexpress.net/mang-di-dong-dau-tien-cho-kich-hoat-sim-qua-vneid-4958429.html#box_comment_vne,Mạng di động đầu tiên cho kích hoạt sim qua VNeID,Mạng di động FPT cho biết đã trở thành nhà mạng đầu tiên triển khai quy trình kích hoạt sim chính chủ qua VNeID thay cho thẻ căn cước.,"Cụ thể, người dùng sau khi mua sim sẽ đăng nhập vào ứng dụng của nhà mạng và chọn mục ""Kích hoạt sim"". Tại đây, ứng dụng cho phép lựa chọn kích hoạt bằng tài khoản định danh điện tử VNeID để xác thực thông tin định danh.
""Ứng dụng FPT Shop sẽ tự động liên kết với ứng dụng VNeID để xác thực dữ liệu và hoàn tất đăng ký kích hoạt"", đại diện nhà mạng cho biết ngày 31/10, thêm rằng điều này giúp thuê bao được xác nhận chính chủ ngay sau khi hoàn tất các bước đăng ký.
Việc kích hoạt sim online được thông qua tại Việt Nam cuối năm 2024, sau khiNghị định 163, quy định một số điều và biện pháp thi hành Luật Viễn thông, được ban hành. Theo đó, ngoài hình thức kích hoạt trực tiếp tại điểm giao dịch của nhà mạng, người dùng có thể đăng ký trực tuyến qua ứng dụng của doanh nghiệp cung cấp dịch vụ và xác thực bằng thẻ CCCD hoặc tài khoản định danh VNeID.
Đến nay, các nhà mạng đã hỗ trợ người dùng kích hoạt sim qua ứng dụng, nhưng chủ yếu sử dụng thẻ CCCD. Mạng di động FPT là đơn vị đầu tiên hỗ trợ xác thực bằng VNeID. Điều kiện cần là tài khoản VNeID đã được định danh điện tử mức 2.
Theo đại diện nhà mạng, việc này giúp người dùng chủ động thực hiện toàn bộ quy trình đăng ký và kích hoạt sim trực tuyến, tiết kiệm thời gian và không cần đến cửa hàng hay mang theo căn cước công dân bản cứng.
""Hình thức mới cũng loại bỏ nguy cơ giả mạo giấy tờ, bởi thông tin người dùng đã được định danh, góp phần chuẩn hóa thuê bao di động và ngăn chặn tình trạng sim rác trên thị trường"", người này cho biết.
Thời gian qua, hàng loạt dịch vụ tại Việt Nam cho phép xác thực qua VNeID, như hồ sơ sức khỏe, ngân hàng, hàng không, chữ ký số, ví điện tử.
Lưu Quý"
https://vnexpress.net/phat-voucher-de-nguoi-dan-dung-san-pham-make-in-viet-nam-4958344.html,Phát voucher để người dân dùng sản phẩm Make in Viet Nam,"Phát phiếu hỗ trợ tài chính (voucher) cho người dùng là chính sách mới, nhằm giúp sản phẩm Make in Viet Nam bước chân từ phòng thí nghiệm ra thị trường.","Chính sách này được quy định trong Nghị định 268 ban hành ngày 14/10, hướng dẫn việc thi hành Luật Khoa học, công nghệ và đổi mới sáng tạo. Đây là hướng tiếp cận chưa từng có trong các chương trình hỗ trợ đổi mới sáng tạo trước đây.
Theo đó, Nhà nước sử dụng phiếu hỗ trợ tài chính (voucher) để khuyến khích người dùng trải nghiệm sản phẩm, dịch vụ mới, tạo điều kiện cho doanh nghiệp đưa sản phẩm Việt ra thị trường. Voucher được cấp thông qua Quỹ Đổi mới công nghệ quốc gia và quỹ phát triển khoa học, công nghệ của bộ, ngành, địa phương. Những sản phẩm được lựa chọn tham gia phải đáp ứng tiêu chuẩn kỹ thuật, có yếu tố mới về công nghệ, tính năng hoặc mô hình kinh doanh; ưu tiên các công nghệ cao, công nghệ chiến lược và có khả năng nhân rộng.
Tại họp báo ngày 31/10 của Bộ Khoa học và Công nghệ, ông Chu Thúc Đạt, Phó cục trưởng Đổi mới sáng tạo, cho biết chính sách cùng với hoạt động hỗ trợ lãi suất vay là điểm nổi bật của Nghị định 268. ""Đây là các biện pháp được kỳ vọng hỗ trợ trực tiếp, giúp doanh nghiệp đổi mới sáng tạo, khởi nghiệp và thúc đẩy văn hóa sáng tạo trong khu vực tư nhân"", ông nói.
Theo Cục Đổi mới sáng tạo, hiểu một cách đơn giản, voucher là cơ chế hỗ trợ tài chính ""kép"". Thay vì đưa tiền trực tiếp cho nhà sản xuất, Nhà nước cấp phiếu mua hàng cho người tiêu dùng hoặc doanh nghiệp.
Cơ chế vận hành của chương trình được thiết kế theo hướng minh bạch, chỉ chi ngân sách khi có giao dịch thực tế. Quỹ Đổi mới công nghệ quốc gia sẽ xây dựng chương trình voucher cho từng lĩnh vực ưu tiên, chọn sản phẩm, dịch vụ đã sẵn sàng thương mại hóa. Người dùng hoặc doanh nghiệp có nhu cầu sẽ được nhận voucher để mua sản phẩm, sau đó doanh nghiệp cung cấp sản phẩm sẽ hoàn lại phiếu cho Quỹ để nhận hỗ trợ.
""Đây là cú hích kép, vừa hỗ trợ bên cung, vừa kích thích bên cầu"", đại diện Cục nói, thêm rằng chính sách sẽ giải quyết bài toán con gà - quả trứng trong thương mại hóa công nghệ. ""Nhiều sản phẩm Make in Viet Nam có chất lượng tốt nhưng lại chật vật để có được những khách hàng đầu tiên, vì người dùng ngại rủi ro khi thử sản phẩm mới. Voucher phá vỡ rào cản này, giúp sản phẩm vượt qua 'thung lũng chết' để ra thị trường"", ông phân tích.
Ngoài voucher, Nghị định 268 còn tạo một ""bộ công cụ tài chính đa dạng"", mỗi công cụ nhắm đến một giai đoạn, giải một ""nút thắt"" khác nhau trong hành trình đổi mới sáng tạo. Giai đoạn nghiên cứu, phát triển ban đầu, doanh nghiệp có thể nhận tài trợ hoặc đặt hàng, khi mở rộng sản xuất họ được hỗ trợ lãi suất vay, và voucher là mảnh ghép cuối cùng, để hỗ trợ thâm nhập thị trường, khi sản phẩm sẵn sàng thương mại hóa.
Mỗi công cụ đi kèm cơ chế sàng lọc riêng: muốn được tài trợ phải chứng minh ý tưởng vượt trội; muốn được hỗ trợ lãi suất phải thuyết phục ngân hàng; còn để tham gia chương trình voucher, sản phẩm phải đủ tốt để thị trường chấp nhận.
Theo Cục Đổi mới sáng tạo, việc kết hợp các công cụ sẽ giúp hình thành một hệ sinh thái mở và cạnh tranh, nơi doanh nghiệp ở mọi giai đoạn, từ ý tưởng, nghiên cứu đến thương mại hóa, ""đều có một 'cánh cửa' phù hợp để tìm kiếm sự hỗ trợ của Nhà nước"".
Nghị định 268 kiến tạo một hệ thống hỗ trợ liền mạch, từ phòng thí nghiệm ra thị trường. ""Bằng cách trao cho doanh nghiệp không chỉ một mà nhiều công cụ phù hợp, chúng tôi tin sẽ khơi dậy nội lực, thúc đẩy sự cạnh tranh lành mạnh và hình thành hệ sinh thái đổi mới sáng tạo năng động, đủ sức tạo ra những sản phẩm công nghệ chinh phục cả thị trường trong nước và quốc tế"", đại diện Cục chia sẻ.
Luật Khoa học, công nghệ và đổi mới sáng tạo do Bộ Khoa học và Công nghệ chủ trì soạn thảo và được Quốc hội thông qua hồi tháng 6. Luật cụ thể hóa tinh thần Nghị quyết 57, thể hiện tầm nhìn, khát vọng đưa Việt Nam trở thành quốc gia hùng cường bằng phát triển khoa học, công nghệ, đổi mới sáng tạo. Đây là lần đầu ""đổi mới sáng tạo"" được đặt ngang hàng với khoa học công nghệ, thể hiện sự thay đổi căn bản trong tư duy phát triển.
Trọng Đạt"
