url,title,description,content
https://vnexpress.net/giun-dat-bo-day-dac-o-khu-dan-cu-4963943.html,Giun đất bò dày đặc ở khu dân cư,"Quảng NgãiGiun từ bãi cỏ ngoi lên mặt đất rồi bò lên dày đặc 20 m vỉa hè khu dân cư Phú Mỹ, sáng 14/11.","Khoảng 5h40, hàng nghìn giun từ bãi cỏ rộng hàng nghìn m2 bò lổn nhổn lên vỉa hè trước cổng khu dân cư rộng hơn 120 ha, nằm ven quốc lộ 1, phường Cẩm Thành (TP Quảng Ngãi cũ). Nhiều người dân đi thể dục lúc sáng sớm lúc đầu tưởng rác, sau đó nhìn kỹ mới biết giun đất.
Một số cư dân tò mò lấy điện thoại quay hiện tượng lạ. Có người dùng thùng nước và bao tải hốt giun về cho gia súc, gia cầm ăn. Đến trưa, trời nắng gắt khiến phần lớn giun chết khô.
Ông Nguyễn Thích, Quản lý Đội bảo vệ Khu dân cư Phú Mỹ, cho hay làm ở chung cư 6 năm nhưng đây là lần đầu tiên thấy cảnh tượng như vậy. Giun chỉ xuất hiện ở khu vực bãi cỏ phía nam cổng khu dân cư.
TS Lê Thị Mỹ Diệp, Phó chủ tịch thường trực Hội Bảo vệ Thiên nhiên và Môi trường Quảng Ngãi, cho biết giun hô hấp qua da nhờ lượng không khí trong các khe đất. Khi mưa lớn, nước tràn vào làm giảm oxy, giun phải bò ra ngoài hô hấp.
Ngoài ra, một số lý do khiến giun bò lên mặt đất nhiều là khi sinh sản, môi trường xáo trộn, đất bị ô nhiễm...
Trước đó, địa bàn Quảng Ngãi mưa to do ảnh hưởng bão Kalmaegi, sau đó thời tiết nắng nóng.
Cuối năm 2024, ở Vũng Tàu cũng xảy ra sự việchàng nghìn giun đấtbò lên tường nhà dân sau mưa lớn.
Phạm Linh"
https://vnexpress.net/chay-chuong-cop-o-khu-tap-the-cu-ha-noi-4963935.html,Cháy 'chuồng cọp' ở khu tập thể cũ Hà Nội,"Phần ban công cơi nới của căn hộ tầng 5 nhà tập thể cũ Trung Tự, phường Kim Liên, bốc cháy sáng 14/11, không gây thiệt hại về người.","Khoảng 10h, lửa bốc lên từ phần ban công cơi nới, được rào kín bằng khung sắt, quây tôn (còn gọi là ""chuồng cọp"") của một hộ dân sống trên tầng 5 nhà A2 tập thể Trung Tự.
Chỉ sau ít phút, lửa đã bao trùm ""chuồng cọp"" hướng ra phố Phạm Ngọc Thạch, khói đen bốc lên ngùn ngụt. Người dân sống trong khu tập thể chủ động di tản xuống dưới đường.
Gần 10 phút kể từ khi lửa bùng lên, Đội chữa cháy và cứu nạn, cứu hộ khu vực số 10 điều hai xe cứu hỏa tới hiện trường. Từ dưới lòng đường, cảnh sát dùng súng phun nước trên nóc xe từ khoảng cách 20 m. Nhóm khác dẫn vòi nước theo cầu thang bộ tiếp cận căn hộ.
Đám cháy được dập tắt sau khoảng 15 phút, không gây thiệt hại về người, nhưng nhiều đồ đạc trong căn hộ đã bị hư hỏng.
Khu tập thể Trung Tự gồm nhiều tòa nhà, thiết kế 4-5 tầng xen kẽ những khối nhà 2-3 tầng, được xây dựng từ những năm 1970-1980 nên đều xuống cấp. Chính quyền dự kiến tái thiết khu tập thể bằng hai tòa nhà 25 và 45 tầng.
Khoảng 8h cùng ngày, một vụ cháy khác xảy ra tại nhà số 12 nằm sâu trong ngõ 13/94/54 đường Lĩnh Nam, quận Hoàng Mai cũ. Do ngõ sâu, cứu hỏa phải sử dụng nước từ một cơ sở sản xuất gần đó để dập lửa. Thời điểm cháy, trong nhà có một cụ ông, may mắn thoát ra ngoài.
Việt An"
https://vnexpress.net/sat-lo-keo-sap-quay-bar-cuon-phang-bai-cat-50-m-4963874.html,"Sạt lở kéo sập quầy bar, cuốn phăng bãi cát 50 m","Đà NẵngCác cơn bão đổ vào miền Trung trong tháng 10 kèm mưa lớn, nước biển dâng đã gây xói lở gần 8 km bờ biển từ Cửa Đại, Tân Thịnh đến An Bàng, dọc tuyến Nguyễn Phan Vinh và Lạc Long Quân.","Sạt lở làm hư hại nhiều công trình của doanh nghiệp và người dân. Đầu tháng 11, quầy bar rộng hàng trăm m2 của một khu du lịch trên đường Lạc Long Quân bị sóng biển đánh sập. Điểm sạt lở mới xuất hiện trên dải bờ biển này trong năm nay.
Sạt lở làm hư hại nhiều công trình của doanh nghiệp và người dân. Đầu tháng 11, quầy bar rộng hàng trăm m2 của một khu du lịch trên đường Lạc Long Quân bị sóng biển đánh sập. Điểm sạt lở mới xuất hiện trên dải bờ biển này trong năm nay.
Biển ăn sâu vào bờ, kéo sập phần đế công trình. Nhân viên khu du lịch cho biết trước đây từ quầy bar ra mép nước khoảng 40-50 m.
Biển ăn sâu vào bờ, kéo sập phần đế công trình. Nhân viên khu du lịch cho biết trước đây từ quầy bar ra mép nước khoảng 40-50 m.
Phía dưới công trình kiên cố này, sóng đã cuốn cát ra biển. Nhiều khối bêtông vất vưởng sát mép nước.
Khu du lịch đã tạm ngừng phục vụ khu vực quầy bar, thuê người dọn dẹp, đưa những khối bêtông, gạch, đá, gỗ, sắt thép hư hỏng ra khỏi bãi biển.
Khu du lịch đã tạm ngừng phục vụ khu vực quầy bar, thuê người dọn dẹp, đưa những khối bêtông, gạch, đá, gỗ, sắt thép hư hỏng ra khỏi bãi biển.
Dọc bãi biển từ An Bàng đến Cửa Đại, nhiều nhà hàng và điểm lưu trú bị ảnh hưởng do biển xâm thực. Sóng đánh mạnh tạo thành vách đứng cao 6-7 m phía sau dãy nhà hàng, homestay, quán cà phê trên đường Nguyễn Phan Vinh.
Tại khu vực biển An Bàng và Cửa Đại, sạt lở xuất hiện ở nhiều vị trí, tiếp tục đe dọa các cơ sở kinh doanh.
Dọc bãi biển từ An Bàng đến Cửa Đại, nhiều nhà hàng và điểm lưu trú bị ảnh hưởng do biển xâm thực. Sóng đánh mạnh tạo thành vách đứng cao 6-7 m phía sau dãy nhà hàng, homestay, quán cà phê trên đường Nguyễn Phan Vinh.
Tại khu vực biển An Bàng và Cửa Đại, sạt lở xuất hiện ở nhiều vị trí, tiếp tục đe dọa các cơ sở kinh doanh.
Bà Nguyễn Thị Hà, 67 tuổi, chủ nhà nghỉ Vườn Tân Thành, cho biết trong 20 năm qua đã chi khoảng 3 tỷ đồng để làm kè bằng các bao cát lớn, song không chống chọi được với sóng mạnh và triều cường. Vài năm gần đây, sạt lở nghiêm trọng hơn, cuốn đi khoảng 50 m bãi cát hướng vào bờ.
""Gần một năm nay, khu homestay hơn 10 phòng của gia đình không còn khách thuê, vì khách nước ngoài thường muốn trải nghiệm bãi biển nhưng nơi này đã không còn"", bà Hà nói.
Sau nhiều lần chống sạt lở bất thành, gia đình chị Nguyễn Thị Loan, 43 tuổi, dùng rọ đá kè quanh căn nhà vốn là điểm kinh doanh bán đồ lưu niệm, ăn uống cho du khách.
Chị Loan cho biết đợt sạt lở lần này, bãi cát xung quanh bị cuốn phăng hàng chục mét, riêng ngôi nhà đã được kè đá còn nguyên vẹn, nhìn trên cao như chiếc mỏ neo ra biển.
Sau nhiều lần chống sạt lở bất thành, gia đình chị Nguyễn Thị Loan, 43 tuổi, dùng rọ đá kè quanh căn nhà vốn là điểm kinh doanh bán đồ lưu niệm, ăn uống cho du khách.
Chị Loan cho biết đợt sạt lở lần này, bãi cát xung quanh bị cuốn phăng hàng chục mét, riêng ngôi nhà đã được kè đá còn nguyên vẹn, nhìn trên cao như chiếc mỏ neo ra biển.
Một số hộ dân trong khu vực đã học theo cách làm kè này, bỏ tiền mua đá hoặc làm kè bêtông về gia cố bãi biển.
Một số hộ dân trong khu vực đã học theo cách làm kè này, bỏ tiền mua đá hoặc làm kè bêtông về gia cố bãi biển.
Những ngày qua, nhiều hộ kinh doanh, nhà dân được quân đội hỗ trợ ""vá"" tạm bãi biển sạt lở bằng việc dùng các bao cát để gia cố bờ biển, trong khi chờ chính quyền có những giải pháp căn cơ hơn.
Người dân ở biển Tân Thành đã gửi đơn kiến nghị lên lãnh đạo TP Đà Nẵng khẩn trương có giải pháp cứu bờ biển; đồng thời mời các chuyên gia có kinh nghiệm, nghiên cứu những mô hình, công nghệ tiên tiến để giải quyết vấn đề này hiệu quả hơn.
Những ngày qua, nhiều hộ kinh doanh, nhà dân được quân đội hỗ trợ ""vá"" tạm bãi biển sạt lở bằng việc dùng các bao cát để gia cố bờ biển, trong khi chờ chính quyền có những giải pháp căn cơ hơn.
Người dân ở biển Tân Thành đã gửi đơn kiến nghị lên lãnh đạo TP Đà Nẵng khẩn trương có giải pháp cứu bờ biển; đồng thời mời các chuyên gia có kinh nghiệm, nghiên cứu những mô hình, công nghệ tiên tiến để giải quyết vấn đề này hiệu quả hơn.
Lực lượng chức năng đã đặt nhiều bảng cảnh báo khu vực sạt lở, cấm tắm để người dân, du khách không lại gần.
Đầu năm 2025, tỉnh Quảng Nam (cũ) khởi công dự án chống xói lở bờ biển Hội An trị giá hơn 982 tỷ đồng, sử dụng vốn vay AFD, viện trợ EU và ngân sách địa phương, dự kiến hoàn thành năm 2026. Dự án xây dựng đê chắn sóng ngầm cách bờ 250 m, kết hợp bù cát để khôi phục bãi biển. Tuy nhiên, theo người dân, do dự án chưa hoàn thành, trong đợt mưa bão vừa qua sóng biển đã thay đổi dòng chảy, làm sạt lở khu vực xung quanh.
Lực lượng chức năng đã đặt nhiều bảng cảnh báo khu vực sạt lở, cấm tắm để người dân, du khách không lại gần.
Đầu năm 2025, tỉnh Quảng Nam (cũ) khởi công dự án chống xói lở bờ biển Hội An trị giá hơn 982 tỷ đồng, sử dụng vốn vay AFD, viện trợ EU và ngân sách địa phương, dự kiến hoàn thành năm 2026. Dự án xây dựng đê chắn sóng ngầm cách bờ 250 m, kết hợp bù cát để khôi phục bãi biển. Tuy nhiên, theo người dân, do dự án chưa hoàn thành, trong đợt mưa bão vừa qua sóng biển đã thay đổi dòng chảy, làm sạt lở khu vực xung quanh.
Mưa lũ cũng làm hư hỏng nhiều công trình giao thông ở khu vực Hội An. Trong ảnh, cầu Bà Ngân nối Hội An với khu vực thị xã Điện Bàn (cũ) bị sập một số nhịp cầu, giao thông khu vực này tê liệt. Thành phố đang lên phương án chi 200 tỷ đồng xây mới cầu này.
Mưa lũ cũng làm hư hỏng nhiều công trình giao thông ở khu vực Hội An. Trong ảnh, cầu Bà Ngân nối Hội An với khu vực thị xã Điện Bàn (cũ) bị sập một số nhịp cầu, giao thông khu vực này tê liệt. Thành phố đang lên phương án chi 200 tỷ đồng xây mới cầu này.
Nguyễn Đông"
https://vnexpress.net/hai-nguoi-tu-vong-sau-va-cham-xe-tai-4963907.html,Hai người tử vong sau va chạm xe tải,"TP HuếVa chạm với xe tải trên quốc lộ 1, đoạn qua xã Phú Lộc, anh Vinh và chị Hà bị văng khỏi xe máy và tử vong tại chỗ, sáng 14/11.","Khoảng 8h30, anh Đặng Xuân Vinh, 37 tuổi, lái xe máy chở chị Nguyễn Thị Lâm Hà, 45 tuổi, cùng trú xã Vinh Lộc, trên quốc lộ 1 theo hướng Đà Nẵng - Huế. Khi đến gần cây xăng trước hầm Phước Tượng, xã Phú Lộc, xe máy va chạm với ôtô tải biển TP HCM do tài xế Ngô Trọng Trí, 29 tuổi, quê Quảng Ngãi cầm lái, đi hướng ngược lại.
Cú va chạm khiến xe máy văng vào lề đường hư hỏng, anh Vinh và chị Hà ngã xuống, tử vong tại chỗ. Cảnh sát giao thông đã bảo vệ hiện trường, phân luồng và điều tra nguyên nhân tai nạn.
Đoạn quốc lộ 1 nơi xảy tai nạn hơi uốn cong, có bốn làn xe, mặt đường êm thuận.
Võ Thạnh"
https://vnexpress.net/cong-chuc-hai-phong-duoc-tang-thu-nhap-theo-hieu-qua-cong-viec-4963732.html,Công chức Hải Phòng được tăng thu nhập theo hiệu quả công việc,"Cán bộ, công chức, viên chức tại TP Hải Phòng sẽ được hưởng thu nhập tăng thêm tối đa 0,8 lần, tùy theo mức độ hoàn thành nhiệm vụ.","Chiều 13/11, tại kỳ họp thứ 31, HĐND TP Hải Phòng thông qua nghị quyết về mức chi thu nhập bình quân tăng thêm cho cán bộ, công chức, viên chức làm việc trong các cơ quan Đảng, chính quyền, đoàn thể, hội được giao nhiệm vụ và biên chế do thành phố quản lý.
Theo nghị quyết, cán bộ, công chức hoàn thành tốt nhiệm vụ trở lên được hưởng hệ số thu nhập tăng thêm 0,8; hoàn thành nhiệm vụ là 0,6. Với viên chức, hai mức tương ứng là 0,6 và 0,4. Chính sách này được xây dựng trên cơ sở đánh giá hiệu quả công việc tại cơ quan, đơn vị.
Ví dụ, công chức thuộc Thành ủy TP Hải đang hưởng lương 13 triệu đồng, theo quyết định này, hệ số thu nhập tăng thêm 0,8 nên sẽ được thêm 10,4 triệu mỗi tháng; giáo viên mầm non lương tháng 8,2 triệu đồng, được hưởng hệ số 0,6, mỗi tháng sẽ nhận thêm 4,92 triệu.
Thời gian chi trả thu nhập tăng thêm từ ngày 1/7/2025 đến hết 31/12/2026, sử dụng nguồn kinh phí từ phần cải cách tiền lương còn dư của thành phố. Riêng 6 tháng đầu năm 2025 (trước sáp nhập với Hải Dương), việc chi trả thu nhập tăng thêm được áp dụng theo nghị quyết đã ban hành năm 2023.
Theo thống kê của Sở Nội vụ, Hải Phòng có khoảng 12.000 cán bộ, công chức và khoảng 65.000 viên chức làm việc trong các cơ quan nhà nước trên địa bàn, dự kiến cần hơn 4.600 tỷ đồng để thực hiện nghị quyết trong năm 2025-2026.
Đề án về thu nhập của cán bộ, công chức, viên chức của TP Hải Phòng được xây dựng từ năm 2022, căn cứ vào chính sách tiền lương, ngân sách và đặc biệt là Nghị quyết số 35/2021 của Quốc hội về thí điểm một số cơ chế, chính sách đặc thù phát triển TP Hải Phòng. Chính sách này được duy trì khi Quốc hội thông qua Nghị quyết 226/2025 về thí điểm một số cơ chế, chính sách đặc thù phát triển thành phố.
Cụ thể, sau khi ngân sách thành phố bảo đảm đủ nguồn thực hiện cải cách tiền lương và các chính sách an sinh xã hội do Trung ương ban hành, HĐND TP Hải Phòng được sử dụng nguồn cải cách tiền lương còn dư của ngân sách thành phố và cho phép ngân sách cấp dưới sử dụng nguồn cải cách tiền lương còn dư để chi thu nhập bình quân tăng thêm cho cán bộ, công chức, viên chức. Mức chi không quá 0,8 lần mức lương ngạch bậc, chức vụ hoặc mức lương theo vị trí việc làm, chức danh, chức vụ lãnh đạo.
Với nghị quyết này, cán bộ, công chức, viên chức Hải Phòng có thêm khoản tiền không nhỏ để chi tiêu. Trước Hải Phòng, TP HCM đã ban hành nghị quyết về vấn đề này từ năm 2018, Hà Nội từ năm 2024, TP Đà Nẵng đang xây dựng.
Lê Tân"
https://vnexpress.net/san-bay-gia-binh-se-tai-cau-truc-mang-luoi-hang-khong-vung-thu-do-4963793.html,'Sân bay Gia Bình sẽ tái cấu trúc mạng lưới hàng không vùng Thủ đô',"Bộ trưởng Xây dựng cho biết sân bay Gia Bình sẽ tạo cực tăng trưởng mới phía Đông Hà Nội, giảm tải cho Nội Bài và tái cấu trúc mạng lưới hàng không vùng Thủ đô.","Sáng 14/11, thừa ủy quyền Thủ tướng, Bộ trưởng Xây dựng Trần Hồng Minh trình Quốc hội chủ trương đầu tư Cảng hàng không quốc tế Gia Bình, đặt tại các xã Gia Bình, Lương Tài, Nhân Thắng, Lâm Thao của tỉnh Bắc Ninh.
Sân bay được xây dựng theo tiêu chuẩn cấp 4F của Tổ chức Hàng không dân dụng Quốc tế (ICAO), đáp ứng nhu cầu khai thác khoảng 30 triệu hành khách mỗi năm và 1,6 triệu tấn hàng hóa đến năm 2030; khoảng 50 triệu hành khách mỗi năm và 2,5 triệu tấn hàng hóa đến năm 2050.
Tổng vốn đầu tư sân bay khoảng 196.378 tỷ đồng, gồm 141.236 tỷ đồng giai đoạn một và 55.142 tỷ đồng giai đoạn hai, sử dụng vốn của nhà đầu tư, gồm vốn chủ sở hữu và vốn huy động hợp pháp.
Bộ trưởngTrần Hồng Minhnhấn mạnh đây là công trình mang tính biểu tượng quốc gia và đã được Bộ Chính trị chấp thuận chủ trương. Dự án giữ vai trò thúc đẩy cực tăng trưởng mới phía Đông Hà Nội, đáp ứng nhu cầu vận chuyển ngày càng tăng của vùng kinh tế trọng điểm phía Bắc.
Ông cũng cho biết sân bay Gia Bình là bước đi chiến lược góp phần tái cấu trúc mạng lưới hàng không vùng Thủ đô theo mô hình trung tâm kép, tương tự một số đô thị lớn như London (Anh) hay Tokyo (Nhật Bản). Sân bay sẽ hỗ trợ Nội Bài đang quá tải nhưng chưa thể mở rộng, đồng thời là một trong các công trình hạ tầng phục vụ Hội nghị Cấp cao APEC 2027.
Sân bay giữ vai trò bổ trợ chiến lược cho Nội Bài, phát huy lợi thế về không gian, kết nối và hạ tầng; tạo động lực phát triển cho công nghiệp, logistics, thương mại điện tử, du lịch và dịch vụ. Dự án đồng thời có ý nghĩa quan trọng với quốc phòng, an ninh và các sự kiện đối ngoại.
Chính phủ định hướng Gia Bình đáp ứng chuẩn mực quốc tế, trở thành cảng hàng không thông minh, xanh, bền vững; phục vụ khai thác lưỡng dụng, đạt tiêu chuẩn dịch vụ 5 sao và hướng tới nhóm 10 cảng hàng không 5 sao hàng đầu thế giới theo đánh giá của Skytrax.
Sân bay phấn đấu nằm trong nhóm có trải nghiệm hành khách xuất sắc theo Hội đồng sân bay quốc tế, là cửa ngõ hàng không miền Bắc và trung chuyển hành khách, hàng hóa, đồng thời là cơ sở bảo dưỡng, sửa chữa máy bay của khu vực châu Á - Thái Bình Dương.
Gia Bình được quy hoạch hai cặp đường cất hạ cánh song song, cách nhau 1.800 m để bảo đảm khả năng cất hạ cánh độc lập. Giai đoạn đến năm 2030 xây dựng sân đỗ máy bay trước nhà ga VIP, nhà ga hành khách, nhà ga hàng hóa và khu bảo dưỡng đáp ứng khoảng 83 vị trí đỗ. Giai đoạn đến năm 2050 mở rộng khu đỗ của nhà ga hành khách và hàng hóa, đáp ứng khoảng 123 vị trí.
Nhà ga hành khách được thiết kế theo tiêu chuẩn 5 sao, tối ưu công năng khai thác và tổ chức không gian hợp lý nhằm phục vụ lưu lượng lớn. Sân bay sẽ kết nối đồng bộ với hệ thống giao thông quốc gia, vùng và tỉnh; Hà Nội kết nối trực tiếp qua đường cao tốc, đường sắt đô thị và đường sắt quốc gia. Dự án cần gần 1.900 ha đất, dự kiến ảnh hưởng khoảng 7.100 hộ dân.
Ủy ban Kinh tế và Tài chính nhất trí sự cần thiết của dự án nhưng đề nghị làm rõ tính khả thi của mô hình ""sân bay kép"", đặc biệt về phân bổ lưu lượng hành khách, hàng hóa và quản lý vùng trời bay.
Cơ quan thẩm tra cũng đồng tình với đề xuất cơ chế đặc biệt để di dời di tích lịch sử - văn hóa, đồng thời yêu cầu làm rõ việc công nhận lại di tích sau di dời, bảo đảm yếu tố gốc và giá trị lịch sử văn hóa.
Bên cạnh đó, Ủy ban đề nghị Chính phủ quy định rõ trách nhiệm, thời hạn, cơ chế báo cáo và hậu kiểm đối với UBND tỉnh Bắc Ninh trong quá trình triển khai thủ tục đất đai, bồi thường, hỗ trợ, tái định cư để bảo đảm minh bạch.
Quốc hội sẽ thảo luận ở hội trường về chủ trương đầu tư Dự án đầu tư xây dựng Cảng hàng không quốc tế Gia Bình vào 5/12 và dự kiến thông qua ngày 11/12.
Sơn Hà"
https://vnexpress.net/hoc-sinh-tu-tin-hon-khi-co-nha-ve-sinh-moi-4963691.html,Học sinh 'tự tin hơn' khi có nhà vệ sinh mới,"Quảng TrịTừ tâm lý e ngại, học sinh trở nên tự tin khi đi vệ sinh ở trường sau khi được Quỹ Hy vọng và Opella tài trợ xây công trình mới đạt chuẩn.",Duy Phong
https://vnexpress.net/hoc-sinh-tu-tin-hon-khi-co-nha-ve-sinh-moi-4963691.html#box_comment_vne,Học sinh 'tự tin hơn' khi có nhà vệ sinh mới,"Quảng TrịTừ tâm lý e ngại, học sinh trở nên tự tin khi đi vệ sinh ở trường sau khi được Quỹ Hy vọng và Opella tài trợ xây công trình mới đạt chuẩn.",Duy Phong
