url,title,description,content
https://znews.vn/3-ngan-hang-lon-nhat-viet-nam-lai-gan-3-3-ty-usd-post1598687.html,"3 ngân hàng lớn nhất Việt Nam lãi gần 3,3 tỷ USD","Khép lại 3 quý kinh doanh của năm 2025, BIDV, VietinBank, Vietcombank - bộ 3 ngân hàng lớn nhất Việt Nam - đã lãi tổng cộng hơn 86.000 tỷ đồng, tương đương gần 3,3 tỷ USD quy đổi.","Vietcombank, VietinBank, BIDV lãi trước thuế hơn 86.000 tỷ đồng sau 9 tháng kinh doanh. Ảnh:Nam Khánh.
Theo báo cáo tài chính quý III/2025 mới công bố, bộ 3 ngân hàng quốc doanh gồmVietcombank, VietinBank vàBIDVđều ghi nhận tăng trưởng lợi nhuận dương, song chất lượng tăng trưởng tại bộ 3 này lại cho thấy sự phân hóa rõ rệt.
Trong khi VietinBank bứt tốc mạnh mẽ nhờ tiết giảm chi phí dự phòng rủi ro tín dụng, Vietcombank duy trì nền tảng ổn định, BIDV lại đang chịu sức ép từ chất lượng tài sản.
Ngân hàng TMCP Ngoại Thương Việt Nam - Vietcombank (HoSE: VCB) tiếp tục cho thấy khả năng sinh lời ổn định. Trong quý gần nhất, nhà băng này ghi nhận hơn11.239 tỷ đồnglợi nhuận trước thuế, tăng 5% so với cùng kỳ năm trước.
Trong đó, thu nhập lãi thuần vẫn là động lực tăng trưởng chính, đạt14.657 tỷ đồng, tăng 8%.
Một số mảng hoạt động khác của Vietcombank cũng ghi nhận kết quả tích cực trong quý này như lãi mua bán chứng khoán kinh doanh tăng 3 lần; lãi hoạt động khác tăng 68%; thu nhập từ góp vốn, mua cổ phần cũng tăng gấp 3 cùng kỳ năm trước.
Đồng thời, ngân hàng quản trị chi phí vận hành tương đối hiệu quả khi chi phí hoạt động chỉ tăng nhẹ 4%, giúp lợi nhuận thuần từ hoạt động kinh doanh tăng 9%.
Bất chấp việc chi phí dự phòng rủi ro tín dụng quý III của Vietcombank đã tăng gấp đôi so với cùng kỳ, nhờ đà tăng trưởng ở các chỉ tiêu lãi thuần kể trên, ngân hàng vẫn ghi nhận lợi nhuận tăng trưởng dương quý gần nhất.
Lũy kế 9 tháng, Vietcombank đạt lợi nhuận trước thuế gần33.133 tỷ đồng, tăng 5%, tiếp tục dẫn đầu hệ thống ngân hàng.
Tính đến ngày 30/9, tổng tài sản của Vietcombank đạt gần2,38 triệu tỷ đồng, tăng 14% so với đầu năm. Dư nợ cho vay khách hàng đạt gần 1,63 triệu tỷ (+12%), trong khi tiền gửi khách hàng đạt khoảng 1,61 triệu tỷ (+6%). Tỷ lệ nợ xấu/tổng dư nợ tăng nhẹ từ 0,96% hồi đầu năm lên 1,03% vào cuối quý III.
Báo cáo tài chính quý III của Ngân hàng TMCP Công Thương Việt Nam - VietinBank (HoSE: CTG) cho thấy kết quả tăng trưởng cao nhờ tiết giảm đáng kể chi phí dự phòng.
Theo đó, lợi nhuận trước thuế quý gần nhất của nhà băng này đã đạt10.614 tỷ đồng, tăng tới 62% so với cùng kỳ năm 2024 và là mức tăng mạnh nhất trong nhóm 3 ngân hàng quốc doanh.
Động lực tăng trưởng lợi nhuận của VietinBank đến từ 2 nguồn chính gồm tăng trưởng thu nhập lãi thuần 10%, đạt17.176 tỷ đồngvà tiết giảm chi phí dự phòng rủi ro tín dụng 37% so với cùng kỳ.
Trong quý III, mảng đầu tư chứng khoán của Ngân hàng Công Thương cũng khởi sắc, với lãi thuần chứng khoán kinh doanh tăng 13 lần, lãi thuần chứng khoán đầu tư lãi14 tỷ đồng, trong khi cùng kỳ năm trước lỗ hơn 200 tỷ.
Ngược lại, lãi thuần từ dịch vụ giảm 12%, còn lãi thuần từ kinh doanh ngoại hối giảm 10%.
Lũy kế 9 tháng, chi phí dự phòng rủi ro tín dụng của VietinBank giảm 33% còn16.900 tỷ đồng, góp phần đưa lợi nhuận trước thuế hợp nhất của ngân hàng đạt29.500 tỷ đồng, tăng 51%.
Tính đến ngày 30/9, tổng tài sản của VietinBank đạt2,76 triệu tỷ đồng, tăng 16% so với đầu năm. Dư nợ cho vay khách hàng đạt1,9 triệu tỷ đồng(+16%), còn tiền gửi khách hàng đạt 1,7 triệu tỷ (+11%).
Về chất lượng tài sản, tỷ lệ nợ xấu/tổng dư nợ của ngân hàng đã giảm còn 1,09%, trong khi tỷ lệ bao phủ nợ xấu đạt 177%.
Ngân hàng TMCP Đầu tư và Phát triển Việt Nam - BIDV (HoSE: BID) - tiếp tục duy trì vị thế là ngân hàng thương mại có tài sản lớn nhất Việt Nam. Tại ngày 30/9, tổng tài sản của ngân hàng đã đạt hơn3,07 triệu tỷ đồng, tăng 11% so với đầu năm.
Về kết quả kinh doanh, riêng quý III, BIDV thu về7.594 tỷ đồnglợi nhuận trước thuế, tăng 17% so với cùng kỳ năm 2024. Mảng thu ngoài lãi của ngân hàng có bước cải thiện đáng kể, nổi bật là lãi từ dịch vụ tăng 18%, lãi từ kinh doanh ngoại hối tăng 32%, và lãi từ hoạt động khác tăng 70%.
Tuy nhiên, chi phí hoạt động trong quý của BIDV lại tăng 17% lên7.374 tỷ đồng, đặc biệt chi phí dự phòng tăng tới 39% ngốn gần6.200 tỷ đồng, ảnh hưởng đáng kể đến tăng trưởng quý III của ngân hàng.
Lũy kế 9 tháng đầu năm, BIDV ghi nhận lợi nhuận trước thuế hơn23.632 tỷ đồng, tăng 7%.
Tại thời điểm ngày 30/9, dư nợ cho vay khách hàng của BIDV đạt gần2,24 triệu tỷ đồng(+9% so với đầu năm), trong khi tiền gửi khách hàng đạt2,08 triệu tỷ đồng(+7%). Tỷ lệ nợ xấu/tổng dư nợ tăng lên 1,87%, cũng là mức cao nhất trong nhóm 3 ngân hàng quốc doanh đã công bố kết quả kinh doanh.
Trong môi trường kinh tế hiện nay, đầu tư trở thành khái niệm phổ biến. Để độc giả có thể tiếp cận những xu hướng đầu tư mới nhất,Tri Thức - Znewsxây dựng chủ đềĐầu tư qua sách- nơi ghi lại những cuốn sách, câu chuyện, xu hướng đầu tư đã và đang diễn ra trong nước và thế giới. Không chỉ tập trung vào các lĩnh vực đầu tư phổ biến như bất động sản, chứng khoán, trái phiếu, ngoại hối, tiền ảo... Đầu tư qua sách còn bao gồm các kiến thức về quản lý gia sản, tài chính cá nhân.

Tại ngày 30/9, tổng tài sản Vingroup đã đạt1,087 triệu tỷ đồng, tăng 30% so với đầu năm và là doanh nghiệp tư nhân (ngoài ngân hàng) đầu tiên của Việt Nam cán mốc triệu tỷ tài sản.
23 giờ trước

SHB dự kiến tăng vốn thêm7.500 tỷ đồngthông qua phát hành 750 triệu cổ phiếu, nâng vốn điều lệ lên53.442 tỷ đồng, qua đó lọt top 4 ngân hàng tư nhân lớn nhất.
25:1525 hôm qua

ACB cho biết đang làm việc với NHNN, kỳ vọng nằm trong nhóm ngân hàng đầu tiên được ra mắt thương hiệu vàng miếng riêng ngay trong tháng 11 tới.
35:2116 hôm qua"
https://znews.vn/ong-pham-nhat-vuong-mat-hon-2-ty-usd-trong-mot-tuan-post1598700.html,Ông Phạm Nhật Vượng mất hơn 2 tỷ USD trong một tuần,"Cú lao dốc mạnh của cổ phiếu VIC khiến vốn hóa Vingroup giảm khoảng 100.000 tỷ đồng, kéo tài sản ròng của ông Phạm Nhật Vượng giảm hơn 2 tỷ USD xuống còn 18 tỷ USD.","Tài sản ròng của tỷ phú Phạm Nhật Vượng thu hẹp còn 18 tỷ USD. Ảnh:VIC.
Thị trường chứng khoán Việt Nam tiếp tục chứng kiến một     phiên giao dịch ảm đạm trong ngày 31/10 khi làn sóng bán tháo bao trùm hầu khắp     các nhóm ngành. Ngay từ những phút đầu mở cửa, VN-Index đã chìm trong sắc đỏ và     nhanh chóng lao dốc trước áp lực thoái lui mạnh mẽ của giới đầu tư.
Đà giảm lan rộng từ nhóm cổ phiếu tài chính - ngân hàng sang     bất động sản và đầu tư công - xây dựng, khiến thị trường gần như không còn lực     đỡ. Dòng tiền bắt đáy vốn mỏng yếu cũng không tạo được bất kỳ phản ứng đáng kể     nào, khiến phe bán dễ dàng chiếm ưu thế tuyệt đối.
Trong phần lớn thời gian của phiên chiều, chỉ số liên tục bị     kéo xuống và rơi sâu gần 30 điểm, xóa sạch nỗ lực phục hồi mong manh ghi nhận     trong 2 phiên giữa tuần. Tâm lý thận trọng và dè dặt của nhà đầu tư thể hiện rõ     qua các nhịp hồi yếu ớt, nhanh chóng bị dập tắt bởi lực bán chủ động.
Thanh khoản thị trường có cải thiện nhẹ, tăng hơn 15% so với     phiên liền trước, đạt khoảng30.100 tỷ đồng. Tuy nhiên, con số này vẫn ở mức thấp     so với bình quân giai đoạn đầu tháng, phản ánh trạng thái phòng thủ rõ rệt của     dòng tiền.
Kết phiên, VN-Index giảm 29,92 điểm (-1,8%) xuống còn     1.639,65 điểm; HNX-Index cũng giảm 1,11 điểm (-0,4%) còn 265,85 điểm. Ngược lại,     UPCoM-Index đi ngược xu hướng chung khi nhích nhẹ 0,04 điểm (+0,1%) lên 113,46     điểm.
Sắc đỏ áp đảo toàn thị trường với 435 mã giảm (trong đó có     21 mã giảm sàn), trong khi chỉ có 375 mã tăng giá (45 mã tăng trần) và 791 mã đứng     giá. Riêng rổ VN30 - thước đo của các cổ phiếu vốn hóa lớn - chứng kiến 21 mã     giảm, 8 mã tăng và chỉ duy nhất PLX giữ giá tham chiếu. Chỉ số VN30 vì vậy cũng     lao dốc mạnh gần 40 điểm, dừng tại 1.885 điểm.
Toàn cảnh phiên giao dịch cho thấy tâm lý thị trường vẫn     chưa tìm được điểm tựa rõ ràng, trong khi lực cầu bắt đáy yếu ớt khiến nhịp điều     chỉnh có thể còn kéo dài sang đầu tháng 11.
VN-Index tiếp tục quán tính đi xuống. Ảnh:TradingView.
Tác nhân chính kéo VN-Index giảm sâu trong phiên hôm nay đến     từ nhóm cổ phiếu ""họ Vin"", đặc biệt là VIC (-6,4%) và VHM (-4,6%). Chỉ 2 mã này     đã khiến VN-Index giảm hơn 15 điểm.
Đáng chú ý, VIC trải qua giai đoạn điều chỉnh mạnh chỉ sau     vài phiên lập đỉnh lịch sử hôm 28/10. So với mức cao nhất từng đạt, thị giá cổ     phiếu này đã lao dốc 13%, tương đương mức vốn hóa bốc hơi khoảng100.000 tỷ đồng,     xuống còn741.000 tỷ đồng. Dù vậy,Vingroupvẫn giữ vững vị thế doanh nghiệp     niêm yết có giá trị lớn nhất thị trường Việt Nam.
Theo thống kê mới nhất từForbes, khối tài sản ròng của Chủ     tịch VingroupPhạm Nhật Vượngcũng chịu tác động đáng kể từ đợt sụt giảm cổ phiếu     này. Đơn vị này ước tính đến ngày 31/10, ông Vượng sở hữu18 tỷ USD, giảm hơn2 tỷ USDso với     thời điểm đỉnh cao trong tháng 10, qua đó tụt xuống vị trí thứ 138 trong danh     sách tỷ phú thế giới.
Không chỉ ""họ Vin"", nhóm tài chính và hàng không cũng góp phần     gia tăng sức nặng cho đà giảm của chỉ số. Các mã như VCB (-1,7%), VJC (-4,4%), HDB     (-4,2%), TCB (-1,7%), HVN (-4,2%), VPB (-1,7%), LPB (-2,5%) và BID (-1,3%) đồng     loạt chìm trong sắc đỏ.
Ở chiều ngược lại, một số cổ phiếu vốn hóa trung bình và     nhóm năng lượng cố gắng đóng vai trò ""phòng thủ"" cho thị trường như GAS (+3,2%),     GVR (+2,5%), ACB (+1,6%), FPT (+1,2%), VNM (+0,9%), DGC (+2,6%),PVD(tăng trần),     REE (+1,4%), MSN (+0,4%) và CTD (+3,5%). Tuy nhiên, nỗ lực của nhóm này không đủ để kìm hãm đà giảm sâu của VN-Index.
Khối ngoại bắt đầu quay lại giải ngân, song quy mô mua ròng     vẫn còn hạn chế. Tổng giá trị mua - bán ròng trong ngày ghi nhận âm hơn 500 tỷ     đồng, trong đó lực bán tập trung chủ yếu ở VIC (-234 tỷ đồng), VHM (-138 tỷ đồng)     và CTG (-124 tỷ đồng).
Trong khi đó, VIX được khối ngoại mua ròng107 tỷ đồng, KDH (+81     tỷ đồng).

Ông Tô Hải xin từ nhiệm chức vụ Tổng giám đốc và người đại diện theo pháp luật của Chứng khoán Vietcap với lý do cá nhân. Bà Tôn Minh Phương sẽ thay thế vị trí với nhiệm kỳ 5 năm.
12 giờ trước

Mảng nông nghiệp tiếp tục là “điểm sáng” trong bức tranh tài chính quý III/2025 của Hòa Phát khi mang về1.297 tỷ đồnglợi nhuận sau thuế, tăng gần 90% so với cùng kỳ.
12 giờ trước

Thị trường chứng khoán Việt Nam khép lại phiên 30/10 trong sắc đỏ khi VN-Index giảm hơn 16 điểm, tiếp tục lỡ hẹn với cột mốc 1.700 điểm trước sức ép của cổ phiếu vốn hóa lớn.
31:1850 hôm qua
Trong môi trường kinh tế hiện nay, đầu tư đã trở thành khái niệm không mấy xa lạ với hầu hết mọi người. Để độc giả có thể tiếp cận những xu hướng đầu tư mới nhất,Tri Thức - Znewsxây dựng chủ đềĐầu tư qua sách- nơi ghi lại những cuốn sách, câu chuyện, xu hướng đầu tư đã và đang diễn ra. Trong đó, các lĩnh vực đầu tư phổ biến bao gồm bất động sản, chứng khoán, ngoại hối và tiền ảo... Ngoài các câu chuyện về đầu tư, Đầu tư qua sách còn bao gồm các kiến thức về quản lý gia sản, tài chính cá nhân."
https://znews.vn/xay-dung-hoa-binh-mien-nhiem-ceo-ong-le-viet-hieu-tam-dieu-hanh-post1483555.html,"Xây dựng Hòa Bình miễn nhiệm CEO, ông Lê Viết Hiếu tạm điều hành","Sau khi ông Lê Văn Nam rút lui, Xây dựng Hòa Bình giao Phó tổng giám đốc thường trực Lê Viết Hiếu - con trai Chủ tịch Lê Viết Hải - tạm thời đảm nhiệm vai trò điều hành doanh nghiệp.","Ông Lê Viết Hiếu (trái) cùng ông Lê Viết Hải (phải). Ảnh:HBC.
CTCP Tập đoàn Xây dựng Hòa Bình (UPCoM: HBC) vừa thông báo miễn nhiệm chức vụ Tổng giám đốc đối với ông Lê Văn Nam kể từ ngày 31/10.
Theo nghị quyết của HĐQT, ông Lê Viết Hiếu, Phó tổng giám đốc thường trực, được giao phụ trách điều hành hoạt động công ty kể từ ngày 31/10 cho đến khi có quyết định bổ nhiệm Tổng giám đốc mới.
Trong thời gian này, ông Hiếu được toàn quyền xử lý các công việc thuộc phạm vi quyền hạn của Tổng giám đốc theo Điều lệ và quy định pháp luật.
Ông Nam sinh năm 1976, tốt nghiệp chuyên ngành kỹ sư xây dựng tại Đại học Bách khoa TP.HCM. Năm 2001, ông làm việc ở Xây dựng Hòa Bình với vị trí kỹ sư giám sát, sau đó thăng tiến lên chỉ huy phó, chỉ huy trưởng, giám đốc dự án, phó tổng giám đốc phụ trách khu vực miền Bắc.
Sau một thời gian rời công ty, ông quay lại và được bổ nhiệm làm Tổng giám đốc cách đây hai năm.
Đến tháng 6 năm nay, ông bất ngờ đăng ký bán toàn bộ 123.700 cổ phiếu HBC đang nắm giữ, với lý do ""đáp ứng nhu cầu tài chính cá nhân"". Trước đó ít ngày, ông cũng bán 500.000 cổ phiếu, khi mã HBC giao dịch quanh vùng giá 6.500 đồng/cổ phiếu. Sau hai giao dịch thoái vốn thành công, ước tính ông Nam đã thu về khoảng4 tỷ đồng.
Trong khi đó, ông Lê Viết Hiếu sinh năm 1992, là con trai của ông Lê Viết Hải - Chủ tịch HĐQT CTCP Tập đoàn Xây dựng Hòa Bình. Ông Hiếu tốt nghiệp chuyên ngành Tài chính doanh nghiệp tại Mỹ, có 2 năm làm việc tại ngân hàng Shinhan trước khi đảm nhận các vị trí cao tại doanh nghiệp của gia đình.
Tại Xây dựng Hòa Bình, ông Hiếu từng giữ vai trò Giám đốc Phát triển thị trường nước ngoài, Phó tổng giám đốc đối ngoại khu vực miền Bắc và thành viên HĐQT.
Tháng 7/2020, ông Hiếu được bổ nhiệm vào vị trí Tổng giám đốc, thay cha mình là ông Lê Viết Hải. Tuy nhiên đến tháng 7/2022, ông bị miễn nhiệm khỏi chức vụ này để đảm nhận vai trò Phó tổng giám đốc thường trực, rồi được bầu làm Phó chủ tịch HĐQT vào tháng 8/2022.
Chia sẻ với báo chí khi đó, Chủ tịch Lê Viết Hải cho biết việc ông Hiếu rời vị trí Tổng giám đốc là do vướng quy định pháp luật về kiêm nhiệm. Theo ông Hải, trên thực tế ông Hiếu vẫn là người lèo lái công ty vượt qua khó khăn do đại dịch và tác động của xung đột Nga - Ukraine.
Về tình hình kinh doanh, trong quý III/2025, Xây dựng Hòa Bình ghi nhận doanh thu thuần đạt1.122 tỷ đồng, tăng 15% so với cùng kỳ năm trước.
Đáng chú ý, doanh thu tài chính tăng đột biến hơn 1.100%, đạt gần230 tỷ đồng, chủ yếu từ khoản lãi chậm thanh toán theo phán quyết của tòa án. Nhờ đó, lợi nhuận sau thuế của doanh nghiệp đạt188,3 tỷ đồng, tăng 138% so với quý III/2024.

Sau khi bán nửa triệu cổ phiếu vào cuối tháng 5, ông Lê Văn Nam - Tổng giám đốc Tập đoàn Xây dựng Hòa Bình - vừa đăng ký bán hết số cổ phiếu còn lại để giảm sở hữu về 0%.
19:14 4/6/2025

Nhà thầu của Chủ tịch Lê Viết Hải đạt chưa đến700 tỷ đồngdoanh thu trong 3 tháng đầu năm, đánh dấu quý kinh doanh kém hiệu quả nhất 11 năm qua. Lãi ròng cũng giảm mạnh còn5 tỷ đồng.
19:14 7/5/2025

Với backlog hơn51.000 tỷ đồng, Coteccons kỳ vọng mảng hạ tầng sẽ trở thành một trong những động lực chính giúp doanh nghiệp đạt doanh thu30.000 tỷ đồng.
19:45 20/10/2025
Tri Thức - Znewsgiới thiệu độc giảTủ sách kiến thức kinh tếvới đa dạng cuốn sách, câu chuyện trong lĩnh vực kinh doanh, kinh tế. Là nguồn tư liệu cho những người quan tâm và muốn nâng cao kiến thức trong lĩnh vực kinh tế. Những cuốn sách, câu chuyện trong Tủ sách không chỉ đơn thuần là những tác phẩm của tri thức mà còn chứa đựng bí quyết, kinh nghiệm quý báu từ các tác giả, nhà quản lý có uy tín và kinh nghiệm lâu năm trong ngành.
Đọc sách không chỉ giúp người đọc tiếp cận những kiến thức mới mà còn giúp mở rộng tầm nhìn và phát triển bản thân. Tủ sách kiến thức kinh tế mong muốn lan tỏa tri thức trong lĩnh vực kinh doanh, đồng thời phát triển văn hóa đọc cho người Việt."
https://znews.vn/viet-nam-se-co-hai-tuyen-duong-sat-toc-do-cao-truoc-nam-2030-post1598664.html,Việt Nam sẽ có hai tuyến đường sắt tốc độ cao trước năm 2030,"Ngoài tuyến đường sắt tốc độ cao trên trục Bắc - Nam, Chính phủ quy hoạch thêm tuyến Hà Nội - Quảng Ninh dài 124 km, lộ trình đầu tư trước năm 2030.","Việt Nam quy hoạch thêm tuyến đường sắt tốc độ cao Hà Nội - Quảng Ninh, đầu tư trước năm 2030. Ảnh:Bộ Xây dựng.
Phó thủ tướngTrần Hồng Hàvừa phê duyệt điều chỉnh Quy hoạch mạng lưới đường sắt thời kỳ 2021-2030, tầm nhìn đến năm 2050. Bên cạnh tuyến đường sắt tốc độ cao trên trục Bắc - Nam từ ga Ngọc Hồi đến ga Thủ Thiêm dài 1.541 km, Chính phủ bổ sung quy hoạch thêm tuyếnHà Nội-Quảng Ninh.
Tuyến này bắt đầu từ ga Cổ Loa (kết nối với tuyến metro số 4 của Hà Nội), qua ga Gia Bình tại Cảng hàng không quốc tế Gia Bình (Bắc Ninh), đến điểm cuối là ga Hạ Long Xanh (Quảng Ninh), kết nối với tuyến đường sắt Hải Phòng - Hạ Long - Móng Cái.
Hồi tháng 7, Tập đoànVingroupđề xuất đầu tư xây dựng Hà Nội - Quảng Ninh với tốc độ thiết kế 350 km/h, khai thác tàu khách, khổ đường 1.435 mm, điện khí hóa. Tổng vốn đầu tư hơn133.000 tỷ đồng, mục tiêu hoàn thành vào năm 2030.
Về hướng tuyến cụ thể, Vingroup đề xuất điểm đầu từ ga Cổ Loa (Hà Nội), đi theo đường nối tới sân bay Gia Bình (Bắc Ninh), qua Hải Phòng tới Yên Tử (Quảng Ninh), điểm cuối là khu công viên rừng (Quảng Ninh).
Trên địa bàn Hà Nội, Vingroup đề xuất hai phương án tuyến. Với phương án 1, tuyến đi dọc theo đường nối cầu Tứ Liên và đường nối sân bay Gia Bình. Còn theo phương án 2, tuyến đi dọc theo đường nối cầu Tứ Liên, sau đó rẽ phải đi theo tuyến đường sắt hiện hữu, qua ga Yên Viên, theo hành lang tuyến metro số 9, vượt qua sông Đuống và đi theo đường nối sân bay Gia Bình.
Tuyến đường sắt Hà Nội - Quảng Ninh dự kiến có 4 ga gồm Cổ Loa, Gia Bình, Yên Tử và Hạ Long. Nếu thực hiện phương án 2 thì tuyến có thêm ga Yên Viên.
Trong Quy hoạch mạng lưới đường sắt thời kỳ 2021-2030, tầm nhìn đến năm 2050, Chính phủ còn điều chỉnh quy mô, lộ trình đầu tư một số tuyến.
Chính phủ quyết định điều chỉnh không đưa vào quy hoạch tuyến Thủ Thiêm - Long Thành và chuyển thành đường sắt đô thị; giao TP.HCM và tỉnh Đồng Nai cập nhật vào quy hoạch tỉnh và các quy hoạch liên quan.
Đồng thời, Chính phủ bổ sung các tuyến đường sắt kết nối quốc tế, bao gồm kết nối với đường sắt Trung Quốc tại cửa khẩu Móng Cái qua tuyến đường sắt Hải Phòng - Hạ Long - Móng Cái; kết nối với Campuchia tại cửa khẩu Mộc Bài thông qua tuyến đường sắt TP.HCM - Mộc Bài (Tây Ninh).
Đối với tuyến Hải Phòng - Hạ Long - Móng Cái, dự án sẽ được đầu tư trước năm 2030. Còn tuyến TP.HCM - Mộc Bài (Tây Ninh) sẽ được đầu tư sau năm 2030. Mức đầu tư của hai dự án đều ở mức1.435 tỷ đồng.
Trong số các dự án đường sắt có khu đầu mối là TP.HCM, Chính phủ thực hiện điều chỉnh định hướng kết nối đường sắt với hai cảng biển là Nghi Sơn (Thanh Hóa), Hiệp Phước (TP.HCM) và các sân bay Tân Sơn Nhất (TP.HCM), Long Thành (Đồng Nai), sân bay thứ hai Hà Nội, sân bay Gia Bình (Bắc Ninh), các cảng cạn Văn Lâm (Hưng Yên), cảng Gia Bình.

Bộ Xây dựng phối hợp Bộ Khoa học và Công nghệ hoàn thiện dự thảo 37 bộ tiêu chuẩn Việt Nam tương đương ISO, không liên quan trực tiếp đến công nghệ lõi đường sắt tốc độ cao.
19:46 21/10/2025

Chính phủ yêu cầu xây dựng, thẩm định, công bố các tiêu chuẩn, quy chuẩn đối với đường sắt tốc độ cao, theo đúng quy trình, thủ tục, thẩm quyền và quy định, hoàn thành trong tháng 10.
18:10 7/9/2025

Tuyến đường sắt tốc độ cao kết nối trung tâm TP.HCM - Cần Giờ sẽ bắt đầu từ khu vực chợ Bến Thành, thay vì phường Tân Thuận (quận 7 cũ) như phương án trước đây.
14:12 29/10/2025
Tri Thức - Znewsgiới thiệu độc giảTủ sách kiến thức kinh tếvới đa dạng cuốn sách, câu chuyện trong lĩnh vực kinh doanh, kinh tế. Là nguồn tư liệu cho những người quan tâm và muốn nâng cao kiến thức trong lĩnh vực kinh tế. Những cuốn sách, câu chuyện trong Tủ sách không chỉ đơn thuần là những tác phẩm của tri thức mà còn chứa đựng bí quyết, kinh nghiệm quý báu từ các tác giả, nhà quản lý có uy tín và kinh nghiệm lâu năm trong ngành.
Đọc sách không chỉ giúp người đọc tiếp cận những kiến thức mới mà còn giúp mở rộng tầm nhìn và phát triển bản thân. Tủ sách kiến thức kinh tế mong muốn lan tỏa tri thức trong lĩnh vực kinh doanh, đồng thời phát triển văn hóa đọc cho người Việt."
