url,title,description,content
https://znews.vn/de-xuat-tang-luong-co-so-ngay-dau-nam-2026-post1598040.html,Đề xuất tăng lương cơ sở ngay đầu năm 2026,"Đại biểu Quốc hội cho rằng mức lương cơ sở 2,34 triệu/tháng không còn phù hợp, kiến nghị Chính phủ và Quốc hội xem xét tăng ngay từ 1/1/2026, thay vì chờ tới giữa năm.","Đại biểu Quốc hội tỉnh Vĩnh Long Trần Quốc Tuấn phát biểu trước Quốc hội. Ảnh:Quochoi.
Phát biểu tại phiên thảo luận ở hội trường Quốc hội sáng nay (29/10), đại biểu Trần Quốc Tuấn (đoàn Vĩnh Long) đề xuất Đảng, Nhà nước quan tâm hơn đến chính sách tiền lương và đời sống của đội ngũ cán bộ, công chức, viên chức, coi đây là yếu tố then chốt để bảo toàn động lực, nâng cao hiệu quả phục vụ nhân dân.
Theo đại biểu Tuấn, sau gần 4 tháng triển khai mô hình chính quyền địa phương 2 cấp, bộ máy hành chính tuy gọn hơn về đầu mối nhưng khối lượng công việc lại tăng nặng. Ở nhiều địa phương, đặc biệt là cấp cơ sở, cán bộ phải đi làm xa hơn, đảm nhận nhiều phần việc hơn nhưng thu nhập không tăng, tạo áp lực lớn trong sinh hoạt.
Theo báo cáo tổng hợp kiến nghị cử tri gửi đến kỳ họp này, cử tri tại Bình Thuận, Vĩnh Long, Quảng Trị… phản ánh sau khi sáp nhập, nhiều cán bộ xã phải di chuyển 10-15 km mỗi ngày tới trụ sở mới, trong khi phụ cấp đi lại và công vụ chưa được điều chỉnh.
Tại các tỉnh Nghệ An, Lâm Đồng, Đồng Tháp, cử tri đề nghị Chính phủ có chính sách hỗ trợ, khuyến khích cán bộ vùng sáp nhập, vì chi phí đi lại, thuê nhà, sinh hoạt tăng khiến thu nhập thực tế của công chức giảm 10-12% so với trước đây.
Nhiều địa phương như Bắc Kạn, Cần Thơ và một số tỉnh đồng bằng sông Cửu Long cũng ghi nhận tình trạng cán bộ cơ sở phải kiêm nhiệm thêm nhiều phần việc do tinh giản biên chế, nhưng chính sách thu nhập chưa thay đổi, ảnh hưởng đến tâm lý, động lực và hiệu quả công tác.
“Những con số này không chỉ là dữ liệu thống kê, mà là tiếng lòng của đội ngũ công chức, viên chức cơ sở, những người đang gánh phần việc nặng nề nhất của bộ máy Nhà nước. Nếu đời sống của họ không được đảm bảo, hiệu quả thực thi chính sách sẽ khó đáp ứng được yêu cầu”, ông Tuấn nhấn mạnh.
Theo báo cáo của Chính phủ và các ủy ban của Quốc hội, chỉ số giá tiêu dùng (CPI) bình quân 9 tháng đầu năm 2025 tăng khoảng 3,27% so với cùng kỳ năm trước. Giá nhiều nhóm hàng thiết yếu như lương thực, thực phẩm, nhà ở, điện nước, học phí, xăng dầu và chi phí thuê nhà đều tăng mạnh, gây sức ép lớn lên đời sống người làm công ăn lương.
Đặc biệt, thu nhập thực tế của cán bộ, công chức, viên chức bị ảnh hưởng rõ rệt khi mức lương cơ sở chưa được điều chỉnh tương ứng, trong khi chi phí đi lại và sinh hoạt tăng cao sau khi triển khai mô hình chính quyền hai cấp. Dù chưa đến mức báo động, song thực tế này đang trực tiếp bào mòn thu nhập của những người thực thi công vụ.
Đại biểu cho rằng mức lương cơ sở 2,34 triệu đồng/tháng, áp dụng từ 1/7/2024, đã không còn phù hợp với mặt bằng giá sinh hoạt hiện nay. Tại các đô thị, chi phí sinh hoạt tối thiểu (ăn uống, đi lại, điện nước, học phí con cái…) đã lên tới 4,5-5 triệu đồng/người/tháng, vượt xa khả năng chi trả của nhiều công chức trẻ.
“Với mức lương cơ sở 2,34 triệu đồng/tháng dù có nhân với hệ số cao hơn thì thu nhập thực tế của nhiều công chức trẻ chỉ đủ chi tiêu từ đầu tháng tới ngày 20 của tháng và 10 ngày cuối tháng phải chạy bằng niềm tin và mì gói”, đại biểu Tuấn nhấn mạnh.
Theo báo cáo của Ủy ban Trung ương Mặt trận Tổ quốc Việt Nam, đời sống của một bộ phận cán bộ, công chức, viên chức và người lao động trong khu vực Nhà nước vẫn còn nhiều khó khăn, đặc biệt là sau quá trình tinh giản biên chế, sáp nhập địa phương, trong khi giá cả leo thang.
Trước tình hình đó, đại biểu Trần Quốc Tuấn kiến nghị Chính phủ và Quốc hội cần xem xét điều chỉnh tăng lương cơ sở ngay từ ngày 1/1/2026, thay vì chờ tới giữa năm như các giai đoạn trước.
Cùng quan điểm, đại biểu Dương Văn Phước (đoàn thành phố Đà Nẵng), cũng chỉ ra bất cập trong cơ chế ngân sách cấp xã. Nguồn kinh phí phân bổ hiện chậm, thiếu và chưa tương ứng với khối lượng công việc tăng gấp 2-3 lần so với trước, khiến chính sách tiền lương chưa đủ động viên cán bộ yên tâm công tác.
Ông Phước đề nghị Bộ Nội vụ sớm khảo sát thực tế, xây dựng vị trí việc làm và khung biên chế tối thiểu làm cơ sở định biên cho cấp xã, đồng thời tham mưu Chính phủ ban hành cơ chế tiền lương phù hợp để khuyến khích cán bộ công chức cấp cơ sở gắn bó với công việc, nhất là tại các vùng có điều kiện kinh tế khó khăn.
Tri Thức - Znewsgiới thiệu độc giảTủ sách kiến thức kinh tếvới đa dạng cuốn sách, câu chuyện trong lĩnh vực kinh doanh, kinh tế. Những cuốn sách, câu chuyện trong Tủ sách không đơn thuần là những tác phẩm của tri thức mà còn chứa đựng bí quyết, kinh nghiệm quý báu từ các tác giả, nhà quản lý có uy tín và kinh nghiệm lâu năm trong ngành.
Đọc sách không chỉ giúp tiếp cận những kiến thức mới mà còn giúp mở rộng tầm nhìn và phát triển bản thân. Tủ sách kiến thức kinh tế mong muốn lan tỏa tri thức trong lĩnh vực kinh doanh, đồng thời phát triển văn hóa đọc cho người Việt.

Đại biểu Nguyễn Thị Yến Nhi (đoàn Vĩnh Long) cho hay bắt cóc online là thách thức mới của thời đại số, chỉ khi Nhà nước, xã hội và mỗi công dân cùng chung tay mới có thể ngăn chặn.
10:31 29/10/2025

Sau phiên thảo luận của các đại biểu về môi trường, Bộ trưởng NN&MT đã giải trình trước Quốc hội những hạn chế còn tồn tại trong lĩnh vực này, và đề xuất giải pháp đột phá.
18:29 28/10/2025

Để thị trường tín chỉ carbon thành động lực cho nền kinh tế xanh, đại biểu Quốc hội đề xuất hoàn thiện khung pháp lý theo hướng bổ sung điều kiện thuận lợi cho nhà đầu tư.
15:49 28/10/2025"
https://znews.vn/nang-muc-giam-tru-gia-canh-hang-trieu-gia-dinh-co-them-khoan-chi-tieu-post1596523.html,Nâng mức giảm trừ gia cảnh: Hàng triệu gia đình có thêm khoản chi tiêu,"Việc nâng mức giảm trừ gia cảnh lên 15,5 triệu đồng/tháng (người nộp thuế) và 6,2 triệu đồng/tháng (người phụ thuộc) đáp ứng mong mỏi nhiều năm qua của người dân.","Ròng rã đóng thuế thu nhập cá nhân (TNCN) ở bậc thấp nhất nhiều năm nay, chị Thu Ngân (Hà Nội) khấp khởi khi nghe tin mức giảm trừ gia cảnh tăng từ kỳ tính thuế năm 2026. Theo chị Ngân, trong 2 năm gần đây, chi phí sinh hoạt không ngừng tăng. Đủ mặt hàng từ thực phẩm (rau, thịt, cá) đến trứng, sữa, dầu ăn,... đều tăng giá.
“Bó rau ngoài chợ từ 7.000 đồng tăng lên 15.000-17.000 đồng. Các loại sữa tươi, sữa bột đều tăng 10%, từ 50.000-70.000 đồng mỗi hộp sữa. Chi phí sinh hoạt tăng mạnh trong khi thu nhập giảm dần, tôi phải co kéo mới đủ chi tiêu”, chị Ngân chia sẻ.
Với mức thu nhập khoảng 15 triệu đồng/tháng, từ đầu năm 2026 chị Ngân sẽ không phải đóng thuế. Mỗi năm chị sẽ tiết kiệm vài triệu đồng tiền thuế, có thêm khoản để tăng chi tiêu cho gia đình.
Theo quy định cũ, anh Lê Xuân (Hà Nội) sau khi giảm trừ gia cảnh (bố mẹ già, con nhỏ), anh vẫn phải nộp thuế. Với mức tăng giảm trừ gia cảnh mới nhất, sắp tới anh Xuân sẽ không phải đóng thuế TNCN.
“Việc giảm vài triệu đồng tiền thuế TNCN sẽ giúp gia đình tôi có thêm chi phí mua sắm cho con nhỏ, mua thuốc cho bố mẹ già. Cơ quan chức năng nâng mức giảm trừ gia cảnh thể hiện việc lắng nghe kiến nghị nhiều năm nay của người làm công ăn lương như chúng tôi”, anh Xuân nói.
Theo quy định mới, mức giảm trừ cho bản thân người nộp thuế từ 11 triệu đồng/tháng lên 15,5 triệu/tháng (tăng khoảng 40,9 % so với mức hiện hành); mức giảm trừ cho mỗi người phụ thuộc tăng từ 4,4 triệu đồng/tháng lên khoảng 6,2 triệu đồng/tháng.
Mức giảm trừ này căn cứ vào tốc độ tăng thu nhập bình quân đầu người và GDP bình quân đầu người năm 2025 so với năm 2020. Theo đó, biến động về thu nhập bình quân đầu người và GDP bình quân đầu người từ năm 2020 đến nay khoảng 40-42%.
Mức giảm trừ mới giúp người thu nhập trên 17 triệu đồng/tháng (bản thân người nộp thuế) và người có hai người phụ thuộc phải có thu nhập trên 27,9 triệu đồng/tháng mới phải nộp thuế. Điều này đáp ứng mong mỏi của người dân nhiều năm qua, cũng là phản ánh từ nhiều đoàn đại biểu Quốc hội của TPHCM, Hà Nội, Vĩnh Long, Hà Tĩnh, Sơn La...
Người nộp thuế thu nhập cá nhân phấn khởi nhờ nâng mức giảm trừ gia cảnh. Ảnh:Như Ý.
Bộ Tài chính tính toán, mức giảm trừ mới giúp khoảng 2,18 triệu người (gần 50% số người bậc 1 chuyển sang diện không phải nộp thuế). Số người còn lại phải nộp thuế chỉ còn khoảng 2,21 triệu người. Dự kiến ngân sách nhà nước giảm khoảng21.000 tỷ đồng/năm so với mức thu và số lượng người nộp thuế theo quy định hiện hành.
Chuyên gia thuế Nguyễn Văn Được, Tổng giám đốc Công ty TNHH Kế toán và Tư vấn thuế Trọng Tín cho biết, thu nhập của người lao động và chi phí sinh hoạt thay đổi nhanh hơn chính sách thuế. Nếu không có cơ chế cập nhật thường xuyên, mức giảm trừ sẽ nhanh chóng lạc hậu, khiến người dân chịu gánh nặng thuế không hợp lý. Bên cạnh việc tăng mức giảm trừ gia cảnh, Nhà nước cần xây dựng cơ chế điều chỉnh linh hoạt hơn trong tương lai.
Lũy kế 9 tháng năm 2025, nguồn thu thuế thu nhập cá nhân đạt177.474 tỷ đồng, bằng 98,4% so với dự toán năm. So với cùng kỳ năm 2024, số thuế thu nhập cá nhân 9 tháng vượt 24,6%.
Theo ông Được, mức giảm trừ nên được điều chỉnh định kỳ theo biến động chỉ số giá tiêu dùng, hoặc thu nhập bình quân đầu người, thay vì chờ nhiều năm mới sửa một lần như hiện nay.
PGS.TS Phạm Thế Anh (Đại học Kinh tế Quốc dân) cho rằng, tiêu dùng bị kìm hãm bởi thuế thu nhập cá nhân cao so với thu nhập trung bình, giá nhà cao, lãi vay mua nhà lớn. Nếu điều chỉnh thuế thu nhập cá nhân hợp lý, tăng mức giảm trừ gia cảnh, giảm thuế suất cho thu nhập trung bình thấp, sức mua sẽ được giải phóng, tạo động lực tăng trưởng.
“Thuế thu nhập cá nhân cần được thiết kế lại theo hướng ưu tiên cho người lao động, giảm gánh nặng chi tiêu sinh hoạt, đồng thời điều tiết hành vi đầu cơ tài sản gây bong bóng giá và rủi ro cho hệ thống tài chính. Nếu làm được điều này, tiêu dùng trong nước sẽ được khơi thông, doanh nghiệp có thêm thị trường”, ông Thế Anh cho biết.
Thứ trưởng Bộ Tài chính Nguyễn Đức Chi cho biết, việc nâng mức giảm trừ gia cảnh là cần thiết trong bối cảnh giá cả, chi phí sinh hoạt và thu nhập bình quân đầu người đã tăng mạnh so với thời điểm năm 2020.
Chính sách mới giúp đảm bảo công bằng, hợp lý và kịp thời chia sẻ khó khăn với người lao động sau nhiều năm đời sống tăng nhưng ngưỡng giảm trừ vẫn giữ nguyên. Đây không chỉ là điều chỉnh kỹ thuật về thuế, mà còn là một thông điệp an sinh, thể hiện sự chia sẻ của Nhà nước với người dân.
Sáng 17/10, Ủy ban Thường vụ Quốc hội biểu quyết thông qua Nghị quyết về điều chỉnh mức giảm trừ gia cảnh của thuế TNCN. Theo đó, mức giảm trừ đối với đối tượng nộp thuế là 15,5 triệu đồng/tháng (186 triệu đồng/năm). Mức giảm trừ đối với mỗi người phụ thuộc là 6,2 triệu đồng/tháng. Nghị quyết này sẽ áp dụng từ kỳ tính thuế năm 2026.
Theo TS Nguyễn Đức Kiên, ở góc độ kinh tế vĩ mô, đây là bước tiến tiếp tục trong quá trình hình thành, phát triển thị trường nội địa. Khi người dân có thu nhập tốt, tiêu dùng nội địa sẽ tăng. Như vậy, doanh nghiệp Việt Nam mới có thị trường đủ lớn để đảm bảo điểm hòa vốn của doanh nghiệp, trước khi vươn ra khu vực và thế giới.
Bà Nguyễn Thị Cúc, Chủ tịch Hội Tư vấn thuế Việt Nam cho biết, việc nâng giảm trừ gia cảnh sẽ khiến thu ngân sách từ sắc thuế này giảm xuống. Tuy nhiên, điều kiện thu thuế hợp lý sẽ khuyến khích tính tuân thủ của người nộp thuế tăng. Mức thu thuế hợp lý, tình trạng né thuế, trốn thuế giảm thiểu, người dân tích cực nộp thuế.
Trước mắt, số thuế thu nhập cá nhân giảm. Về lâu dài kích thích tiêu dùng mua sắm, tổng nguồn thu không thay đổi nhiều.

Ủy ban Thường vụ Quốc hội quyết định tăng mức giảm trừ gia cảnh cho người nộp thuế lên 15,5 triệu đồng và người phụ thuộc 6,2 triệu đồng, áp dụng từ kỳ tính thuế 2026.
12:25 17/10/2025

Dự thảo Luật Dân số quy định ưu tiên mua hoặc thuê nhà ở xã hội đối với phụ nữ sinh đủ 2 con, hoặc nam giới có 2 con đẻ mà không có vợ hoặc vợ đã chết.
12:47 23/10/2025

Dù nằm ở khu vực ngoại thành, dự án nhà ở xã hội (NOXH) tại xã Đông Anh, Hà Nội vẫn thu hút rất đông người dân tới nộp hồ sơ mua nhà.
16:43 22/10/2025"
https://znews.vn/ca-nha-mat-ngu-vi-trung-doc-dac-vietlott-gan-37-ty-dong-post1595466.html,Cả nhà mất ngủ vì trúng độc đắc Vietlott gần 37 tỷ đồng,"Anh N.V.M ở Thanh Hóa bất ngờ trúng giải Jackpot 1 Power 6/55 trị giá 36,7 tỷ đồng của Vietlott. Sau khi chia sẻ với gia đình, anh cho biết cả nhà đã mất ngủ vì vui.","Anh N.V.M (áo xanh đen bên trái) nhận giải Jackpot 1 Power 6/55 và anh P.Đ.L (áo trắng bên phải) nhận giải độc đắc Lotto 5/35. Ảnh:Vietlott.
Công ty Xổ số Điện toán Việt Nam (Vietlott) mới đây đã tiến     hành trao giải đến 2 thuê bao Viettel may mắn trúng giải Jackpot 1 xổ số tự chọn     Power 6/55 trị giá36,7 tỷ đồngvà giải độc đắc xổ số tự chọn Lotto 5/35 trị giá10,2 tỷ đồng.
Qua kiểm tra trên hệ thống, Vietlott xác định anh N.V.M -     thuê bao Viettel đăng ký tham gia dự thưởng tại tỉnhThanh Hóa- đã trúng Jackpot     1 Power 6/55 kỳ quay thứ 1.253 và anh P.Đ.L trúng giải độc đắc xổ số tự chọn     Lotto 5/35 kỳ quay 209.
Anh N.V.M hiện sinh sống và kinh doanh tự do tại Thanh Hóa. Người     may mắn cho biết dãy số trúng thưởng là dãy số ngẫu nhiên anh chọn cho ngày hôm     đó.
Khi trên đường đi công việc về, anh M. nhận được tin nhắn     trúng thưởng nhưng đang trên đường đi nên anh không     để ý đến giá trị trúng. Về đến nhà, anh kiểm tra tin nhắn và dãy số trúng thưởng     thì biết mình đã trúng Jackpot 1 Power 6/55.
“Lúc đấy, tôi không kìm nổi xúc động vì vui nhưng vẫn chưa     dám thông báo cho người nhà biết. Chỉ đến sáng hôm sau, khi Vietlott thông báo     trên fanpage chính thức và gọi lên tổng đài Vietlott kiểm tra thì tôi mới chính     thức thông tin đến gia đình. Người nhà lúc đầu cũng không tin, nhưng sau khi     tôi đi lên làm hồ sơ nhận thưởng thì cũng đã tin là giải thưởng có thật. Gia     đình ai cũng vui đến mất ngủ cả đêm đó”, anh M. tiết lộ.
Với số tiền trúng thưởng, anh M. dự định dành để chăm lo cuộc     sống cho bố mẹ, sau đó sẽ cân đối chi tiêu để không ảnh hưởng đến cuộc sống của     mọi người trong gia đình. Đồng thời, dành một phần để thực hiện các hoạt động     an sinh xã hội để chia sẻ may mắn đến cộng đồng.
Trong khi đó, anh P.Đ.L đang sinh sống và làm trong lĩnh vực     xây dựng tại tỉnh Hà Tĩnh. Anh có kế hoạch sử dụng số tiền trúng thưởng để mở rộng     kinh doanh và chia sẻ may mắn đến cộng đồng
Tại buổi lễ trao thưởng, 2 người trúng thưởng đã trao tặng tổng     số tiền 550 triệu đồng để hỗ trợ các vùng bị ảnh hưởng bởi lũ lụt, thiên tai     thông qua quỹ Tâm Tài Việt.
Theo quy định, anh N.V.M có nghĩa vụ nộp thuế thu nhập cá     nhân tại nơi đăng ký tham gia dự thưởng là tỉnh Thanh Hóa với tổng giá trị hơn3,6 tỷ đồngvà anh P.Đ.L nộp thuế hơn1 tỷ đồng(10% phần giá trị vượt trên 10     triệu đồng) và được khấu trừ ngay khi nhận thưởng.

Một tấm vé số Power 6/55 vừa mang lại giải Jackpot hơn179 tỷ đồngcho người chơi may mắn. Công ty xổ số cũng tìm ra 2 tấm vé trúng Jackpot 2 với tổng trị giá7,5 tỷ đồng.
19:44 30/9/2025

Thế Giới Di Động vừa thông qua kế hoạch mua lại tối đa 10 triệu cổ phiếu với tổng giá trị có thể lên tới2.000 tỷ đồng, gấp đôi mức dự kiến trước đây.
14:05 19/10/2025

Bộ Tư pháp đề xuất nâng mức tiền đặt trước khi đấu giá quyền sử dụng đất lên tối thiểu 20%, tối đa 50% giá khởi điểm, đồng thời xem xét cấm người bỏ cọc tham gia đấu giá.
09:37 19/10/2025
Trong môi trường kinh tế hiện nay, đầu tư đã trở thành khái niệm không mấy xa lạ với hầu hết mọi người. Để độc giả có thể tiếp cận những xu hướng đầu tư mới nhất,Tri Thức - Znewsxây dựng chủ đềĐầu tư qua sách- nơi ghi lại những cuốn sách, câu chuyện, xu hướng đầu tư đã và đang diễn ra. Trong đó, các lĩnh vực đầu tư phổ biến bao gồm bất động sản, chứng khoán, ngoại hối và tiền ảo... Ngoài các câu chuyện về đầu tư, Đầu tư qua sách còn bao gồm các kiến thức về quản lý gia sản, tài chính cá nhân."
https://znews.vn/vietjet-lai-hon-2000-ty-dong-sau-9-thang-post1598627.html,Vietjet lãi hơn 2.000 tỷ đồng sau 9 tháng,"Vietjet đã đạt 97% kế hoạch kinh doanh năm 2025 chỉ sau 9 tháng, hãng hàng không này dự kiến chi 1.183 tỷ đồng để trả cổ tức cho cổ đông với tỷ lệ 20%.","Vietjet đã gần hoàn thành kế hoạch lợi nhuận cả năm 2025. Ảnh:VJC.
Công ty Cổ phần Hàng không Vietjet (HoSE: VJC) vừa công bố kết quả kinh doanh quý III/2025 với doanh thu vận tải hàng không trong kỳ đạt16.728 tỷ đồng, lợi nhuận trước thuế đạt393 tỷ đồng.
Lũy kế 9 tháng đầu năm, hãng bay của tỷ phúNguyễn Thị Phương Thảođạt52.329 tỷ đồngdoanh thu,1.987 tỷ đồnglợi nhuận trước thuế, tăng 28% so với cùng kỳ năm 2024.
Nếu tính doanh thu hợp nhất toàn hệ thống 9 tháng, hãng bay này đã thu về đạt52.769 tỷ đồngvà đạt kết quả lợi nhuận2.051 tỷ đồng, tăng 17%.
Đáng chú ý, doanh thu phụ trợ của hãng đạt6.893 tỷ đồng, chiếm 41% tổng doanh thu vận tải, tăng 19% so với cùng kỳ.
Đến hết tháng 9, Vietjet khai thác đội tàu bay 98 chiếc, với 219 đường bay (169 quốc tế, 50 nội địa), vận chuyển 21,5 triệu lượt khách, hệ số sử dụng ghế 86% và độ tin cậy kỹ thuật 99,72%.
Vừa qua, HĐQT Vietjet đã thông qua phương án chia cổ tức 20% bằng cổ phiếu (cổ đông sở hữu 100 cổ phiếu nhận 20 cổ phiếu mới), tương ứng công ty sẽ phát hành hơn 118,3 triệu cổ phiếu, tổng giá trị theo mệnh giá hơn1.183 tỷ đồng.
Trong quý IV, Vietjet dự kiến tiếp tục đầu tư cho Trung tâm Bảo dưỡng tàu bay tại Long Thành, phát triển nhiên liệu hàng không bền vững (SAF), và mở rộng đào tạo nhân lực chất lượng cao tại Học viện Hàng không Vietjet.

Tính đến cuối quý III/2025, vốn chủ sở hữu của Vietnam Airlines đã đạt mức dương gần6.400 tỷ đồng, chấm dứt 14 quý liên tục âm vốn chủ sở hữu.
17 giờ trước

Sau thời gian bay hiệu chuẩn, sân bay Long Thành được chuyên gia quốc tế đánh giá hội tụ đủ điều kiện khai thác thương mại ở cấp độ khu vực, quốc tế.
29:1713 hôm qua

Vietnam Airlines vừa thông báo triển khai chính sách thu phí hành lý xách tay quá tiêu chuẩn (quá cước) tại cửa ra tàu bay, bắt đầu áp dụng từ ngày 3/11.
14:51 29/10/2025
Tri Thức - Znewsgiới thiệu độc giảTủ sách kiến thức kinh tếvới đa dạng cuốn sách, câu chuyện trong lĩnh vực kinh doanh, kinh tế. Là nguồn tư liệu cho những người quan tâm và muốn nâng cao kiến thức trong lĩnh vực kinh tế. Những cuốn sách, câu chuyện trong Tủ sách không chỉ đơn thuần là những tác phẩm của tri thức mà còn chứa đựng bí quyết, kinh nghiệm quý báu từ các tác giả, nhà quản lý có uy tín và kinh nghiệm lâu năm trong ngành.
Đọc sách không chỉ giúp người đọc tiếp cận những kiến thức mới mà còn giúp mở rộng tầm nhìn và phát triển bản thân. Tủ sách kiến thức kinh tế mong muốn lan tỏa tri thức trong lĩnh vực kinh doanh, đồng thời phát triển văn hóa đọc cho người Việt."
