url,title,description,content
https://znews.vn/vung-troi-duoi-1000-m-co-the-thanh-mo-vang-10-ty-usd-cua-viet-nam-post1602826.html,Vùng trời dưới 1.000 m có thể thành 'mỏ vàng' 10 tỷ USD của Việt Nam,"Công nghệ bay và hạ tầng tầm thấp đang mở ra cơ hội hình thành một ngành kinh tế mới trị giá 10 tỷ USD, đưa Việt Nam tiến gần vị thế trung tâm công nghiệp tầm thấp của khu vực.","Quy mô kinh tế tầm thấp tại Việt Nam có thể lên tới 10 tỷ USD. Ảnh:Shiprocket.
Dưới sự bảo trợ của Trung tâm Đổi mới sáng tạo Quốc gia     (NIC) thuộc Bộ Tài chính, Mạng lưới Hàng không, vũ trụ, thiết bị bay không người     lái (AUVS VN) phối hợp với Tập đoàn FPT, Liên minh Kinh tế tầm thấp Việt Nam và     các Mạng lưới Đổi mới sáng tạo Việt Nam tại nước ngoài đã tổ chức Diễn đàn quốc     tế Kinh tế tầm thấp Việt Nam 2025.
Nền kinh tế tầm thấp bao gồm các hoạt động kinh tế diễn ra     dưới độ cao 1.000 m, có thể mở rộng lên dưới 5.000 m tùy theo nhu cầu của từng     quốc gia. Mô hình này tận dụng công nghệ bay có người lái và không người lái, mạng     thông minh tầm thấp để phát triển hạ tầng, sản xuất phương tiện bay, dịch vụ và     đảm bảo an toàn bay.
Các ứng dụng trải rộng ở nông nghiệp, logistics, giám sát     môi trường, giao thông, truyền thông và giải trí… Đây được xem là một không     gian kinh tế mới, khai thác tầng không khí thấp vốn chưa được tận dụng hiệu quả     nhằm tạo ra giá trị thông qua công nghệ tiên tiến.
Diễn đàn đề cập các cơ hội của Việt Nam trong việc ứng dụng     công nghệ hàng không, vũ trụ và thiết bị bay không người lái nhằm phát triển     các mô hình kinh tế tầm thấp.
Phát biểu khai mạc, ông Võ Xuân Hoài, Phó giám đốc NIC, cho     biết nhiều nước trên thế giới đã xem hàng không vũ trụ và UAV là các ngành công     nghệ chiến lược.
“Với sự bùng nổ của công nghệ hàng không, vũ trụ và thiết bị     bay không người lái, mô hình kinh tế mới cụ thể là nền ‘kinh tế tầm thấp’ đang     trở thành xu thế phát triển nổi bật trên toàn cầu”, ông nhấn mạnh.
Phó giám đốc NIC cho biết kinh tế tầm thấp là xu huớng phát triển nổi bật hiện nay. Ảnh:BTC.
Theo chia sẻ của các chuyên gia tại sự kiện ra mắt Liên minh         Kinh tế tầm thấp (LAE) cách đây không lâu, chỉ riêng ngành hàng không tầm thấp có thể đạt         quy mô toàn cầu khoảng700 tỷ USDvào năm 2035.
Tại Việt Nam, tiềm năng kinh tế tầm thấp được đánh giá có thể     đạt10 tỷ USD. Với lợi thế về địa chính trị, chính sách khuyến khích đổi mới     sáng tạo cùng lực lượng lao động trẻ và năng động, Việt Nam được nhận định đang     đứng trước “cơ hội nghìn năm có một” để trở thành trung tâm công nghiệp tầm thấp     của khu vực và thế giới.
Ông Vũ Anh Tú, Giám đốc Công nghệ Tập đoàn FPT và thành viên     mạng lưới AUVS VN, cho biết: “Nắm bắt cơ hội và đầu tư LAE, chúng ta đang thúc     đẩy 3 trụ cột của thời đại mới gồm kinh tế số, kinh tế xanh, kinh tế tri thức, đồng     thời đánh thức tiềm năng sáng tạo của đội ngũ kỹ sư, nhà khoa học Việt Nam,     mang lại dịch vụ tốt hơn cho người dân vùng sâu, vùng xa, hải đảo và khẳng định     vị thế của Việt Nam trên bản đồ công nghệ toàn cầu”.
Theo bà Nguyễn Thị Hải Hằng, Phó chủ tịch Mạng lưới AUVS VN     kiêm Giám đốc Học viện Hàng không Việt Nam, kinh tế tầm thấp không đơn thuần chỉ     là về phương tiện bay, mà đó là một sự dịch chuyển chiến lược nhằm mở ra không     phận thấp như một không gian kinh doanh mới, thúc đẩy tăng trưởng kinh tế thông     qua đổi mới công nghệ.
Nhận định về những lợi thế của Việt Nam, ông Trần Anh Tuấn,     Phó chủ tịch Mạng lưới AUVS VN kiêm CEO Saolatek, tin rằng Việt Nam có thể trở     thành trung tâm kinh tế tầm thấp nhờ vị trí địa lý và chính trị ổn định, tiềm     năng làm chủ công nghệ lõi (phần mềm, AI và hệ thống UTM), năng lực sản xuất phần     cứng và hệ sinh thái các ngành công nghiệp phụ trợ đã hoàn thiện.
Ông đồng thời đề xuất xây dựng hành lang pháp lý, phát triển     các trung tâm R&D và khu công nghiệp LAE trong nước, đào tạo nhân lực chất     lượng cao, xây dựng hệ sinh thái kết nối toàn diện và thúc đẩy hợp tác quốc tế.

Đà hồi phục mạnh của thị trường chứng khoán trong phiên 12/11 kéo tài sản của loạt tỷ phú Việt như ông Phạm Nhật Vượng, ông Hồ Hùng Anh và ông Trương Gia Bình tăng vọt.
18:25 12/11/2025

Sau 7 năm thành lập, Be Group lần đầu tiên thông báo đạt lợi nhuận EBITDA dương trên toàn công ty trong năm 2025.
18:03 11/11/2025

Thứ trưởng Bộ Công Thương Nguyễn Sinh Nhật Tân cho biết chủ sàn thương mại điện tử phải có trách nhiệm kiểm soát nguồn gốc hàng hóa để bảo vệ người tiêu dùng.
17:19 8/11/2025
Trong môi trường kinh tế hiện nay, đầu tư đã trở thành khái niệm không mấy xa lạ với hầu hết mọi người. Để độc giả có thể tiếp cận những xu hướng đầu tư mới nhất,Tri Thức - Znewsxây dựng chủ đềĐầu tư qua sách- nơi ghi lại những cuốn sách, câu chuyện, xu hướng đầu tư đã và đang diễn ra. Trong đó, các lĩnh vực đầu tư phổ biến bao gồm bất động sản, chứng khoán, ngoại hối và tiền ảo... Ngoài các câu chuyện về đầu tư, Đầu tư qua sách còn bao gồm các kiến thức về quản lý gia sản, tài chính cá nhân."
https://znews.vn/gianh-mua-can-ho-200-trieu-dongm2-tai-khu-do-thi-dat-nhat-ha-noi-post1602761.html,Giành mua căn hộ 200 triệu đồng/m2 tại khu đô thị đắt nhất Hà Nội,"Với giá 175-200 triệu đồng/m2, tương đương 8-23 tỷ đồng/căn, toàn bộ 284 căn hộ tại dự án The Prime được khớp chủ chỉ trong hơn một giờ mở bán.","The Prime nằm trong khu đô thị Starlake, có giá bán cao top đầu thị trường Hà Nội. Ảnh:Việt Linh.
Chị Lan Hương (37 tuổi, sống tại phường Cầu Giấy) là một trong những khách hàng đăng ký mua căn hộ tại dự án chung cư The Prime (thuộc khu đô thị Starlake, phường Xuân Đỉnh) từ tháng 10 qua một công ty môi giới, giá bán ước tính ban đầu khoảng8 tỷ đồngcho một căn hộ 46 m2, tương đương gần 174 triệu đồng/m2. Tuy nhiên, vào ngày mở bán chính thức dự án hôm 12/11 vừa qua, chị Hương không được khớp mua.
""Phía sàn cho biết nhu cầu lớn nên họ ưu tiên cho khách VIP, còn tôi không thuộc diện này. Khách thông thường có thể mua hàng chuyển nhượng nhưng buộc phải trả chênh 400-500 triệu đồng, và nguồn cung cũng không có nhiều, do đó tôi bỏ cuộc"", chị Hương nói.
Trong khi đó, ông Nguyễn Sơn, một khách được xếp vào nhóm ""VIP"" vì từng chi hơn150 tỷ đồngmua 2 căn biệt thự tại Starlake cùng nhiều bất động sản khác, cũng chỉ mua được một căn hộ thay vì 2 căn như mong muốn.
Nói vớiTri Thức - Znews, bà T - Giám đốc kinh doanh một công ty môi giới - cho hay mỗi sàn được phân phối 20-30 căn trong đợt mở bán này, trong khi lượng khách đăng ký lên đến hàng trăm người. Vì vậy, sàn thường ưu tiên khách hàng thân thiết hoặc khách VIP. Thực tế này khiến toàn bộ 284 căn hộ tại dự án The Prime có chủ sau hơn 1 giờ mở bán, với mức giá 175-200 triệu đồng/m2.
""Toàn bộ các căn phân phối qua sàn đều đã được đặt chỗ từ trước ngày mở bán chính thức diễn ra. Nên đến ngày 12/11, phía sàn và chủ đầu tư chỉ tiến hành khớp căn và thông báo cho khách hàng"", theo bà T.
The Prime được khởi công từ tháng 10 năm ngoái, dự kiến bàn giao vào giữa năm 2027. Ảnh:ITN.
Cũng theo bà T, trong lần mở bán này, khách mua The Prime có 30% là người nước ngoài, còn lại là khách hàng trong nước mua để ở, mua tặng con cái, cũng có người mua để đầu tư.
Theo ghi nhận, 2 ngày sau sự kiện mở bán, trên thị trường, một số căn hộ The Prime được rao chuyển nhượng với giá chênh 500-800 triệu đồng, thậm chí có căn rao chênh hơn1 tỷ đồng.
The Prime được động thổ từ tháng 10 năm ngoái trên khu đất K8HH1 thuộc khu đô thị Starlake, do Công ty TNHH Phát triển THT (thuộc Tập đoàn Hàn Quốc Daewoo E&C) làm chủ đầu tư. Khu đất xây dự án rộng gần 1,6 ha, mật độ xây dựng 31,95%, gồm 3 tòa tháp cao 26 tầng: 2 tòa căn hộ E và F, một tòa văn phòng và 15 căn shophouse.
Tổng thể dự án Starlake rộng 186 ha, hiện là một trong những khu đô thị có giá đất cao nhấtHà Nội, lên đến hơn 113 triệu đồng/m2. Các dự án tại đây đều thuộc phân khúc cao cấp với mức giá top đầu thị trường. Chẳng hạn, chung cư Starlake giai đoạn 1 hiện có giá chuyển nhượng khoảng 160-200 triệu đồng/m2, trong khi shophouse và biệt thự có giá 500-600 triệu đồng/m2.
Lần này, giá niêm yết của mỗi căn hộ The Prime dao động từ 8 tỷ đến hơn23 tỷ đồng, tiếp tục thuộc nhóm cao cấp nhất tại thị trường Thủ đô. Sức mua tại sự kiện mở bán vừa qua của dự án này cho thấy phân khúc căn hộ cao cấp vẫn duy trì sức hút.
Thực tế không riêng The Prime, nhiều dự án căn hộ cao cấp ở Hà Nội vẫn được chủ đầu tư cho biết ghi nhận số lượng giao dịch tích cực tại thời điểm mở bán. Dữ liệu thị trường của CBRE cho thấy trong quý III, tại thị trường Thủ đô, nguồn cung căn hộ cao cấp đang chiếm ưu thế, với mức giá chào bán từ 120 triệu đồng/m2 trở lên. Nguồn cung mới đạt hơn 10.000 căn hộ, trong khi số căn bán được lên tới hơn 11.000 căn.
""Chúng tôi chưa nhìn thấy dấu hiệu bất ổn nào liên quan đến thanh khoản thị trường"", bà Nguyễn Hoài An, Giám đốc cấp cao CBRE chi nhánh Hà Nội, cho biết.
Nói về nguyên nhân của hiện tượng này, bà An cho rằng phần lớn người mua hiện nay là người mua cho tương lai, lựa chọn các sản phẩm bàn giao sau 2-3 năm. ""Những người này cùng chủ đầu tư xây dựng ngôi nhà tương lai của mình, chứ không chỉ là đầu cơ ngắn hạn"", bà nói.
Một yếu tố quan trọng giúp thị trường duy trì thanh khoản tốt là mặt bằng lãi suất thấp, tạo điều kiện cho người mua tiếp cận tín dụng dễ dàng hơn. Ngoài ra, trong bối cảnh các kênh đầu tư khác biến động mạnh, bất động sản vẫn được xem là kênh tích lũy ổn định và ít rủi ro hơn.
""Giá vàng trong nước đã tăng tới 65% chỉ từ đầu năm đến nay. Đà tăng giá mạnh của các kênh tài sản khác cũng góp phần định hình kỳ vọng giá bất động sản, khi người mua coi nhà ở là tài sản bảo toàn giá trị lâu dài"", bà phân tích.
Ngoài ra, bà Nguyễn Hoài An khẳng định nhu cầu mua căn hộ vẫn duy trì nhờ ưu điểm của sản phẩm chung cư: vừa có thể khai thác kinh doanh, vừa bảo toàn giá trị tài sản. Với nhiều người, đầu tư vào chung cư cao cấp được xem là kênh an toàn, đặc biệt trong bối cảnh lãi suất ngân hàng thấp và các kênh tài sản khác biến động mạnh.

CBRE dự báo giá nhà ở Hà Nội vẫn đi lên trong trung hạn, song mức độ cạnh tranh giữa các chủ đầu tư sẽ gia tăng và thanh khoản có thể giảm dần.
06:17 23/10/2025

Giá NƠXH tại Hà Nội leo thang chóng mặt. Nhiều căn hộ qua sử dụng được rao ngang ngửa chung cư thương mại trung cấp. Mức rao bán lên tới 90 triệu/m2, gấp 4-5 lần so với giá khi mở bán.
22:52 10/11/2025

Theo Savills Việt Nam, căn hộ cao cấp và siêu sang TP.HCM vẫn tiêu thụ tốt dù chiếm tỷ trọng lớn trong nguồn cung, trong khi người mua ở thực ngày càng khó tìm sản phẩm phù hợp.
06:07 31/10/2025
Trong môi trường kinh tế hiện nay, đầu tư trở thành khái niệm phổ biến. Để độc giả có thể tiếp cận những xu hướng đầu tư mới nhất,Tri Thức - Znewsxây dựng chủ đềĐầu tư qua sách- nơi ghi lại những cuốn sách, câu chuyện, xu hướng đầu tư đã và đang diễn ra trong nước và thế giới. Không chỉ tập trung vào các lĩnh vực đầu tư phổ biến như bất động sản, chứng khoán, trái phiếu, ngoại hối, tiền ảo... Đầu tư qua sách còn bao gồm các kiến thức về quản lý gia sản, tài chính cá nhân."
https://znews.vn/co-phieu-hoang-anh-gia-lai-va-novaland-dat-tay-nhau-tang-tran-post1602775.html,Cổ phiếu Hoàng Anh Gia Lai và Novaland 'dắt tay nhau' tăng trần,"NVL và HAG đồng loạt tăng trần, trở thành tâm điểm kéo VN-Index hồi phục trong phiên 14/11, giúp thị trường lấy lại sắc xanh sau nửa đầu ngày chìm trong bi quan.","Hoàng Anh Gia Lai của Chủ tịch Đoàn Nguyên Đức có kế hoạch niêm yết các công ty thành viên trong những năm tới. Ảnh:Quang Thịnh.
Thị trường chứng khoán Việt Nam khép lại phiên 14/11 với nhịp     hồi đáng chú ý sau giai đoạn giao dịch trầm lắng của ngày hôm trước. Ngay từ đầu     phiên sáng, VN-Index mở cửa trong sắc đỏ khi lực bán chiếm ưu thế, còn dòng tiền     bắt đáy vẫn đứng ngoài. Tâm lý thận trọng bao trùm khiến chỉ số liên tục dao động     dưới tham chiếu suốt cả buổi sáng và kéo dài sang đầu giờ chiều.
Đến phiên chiều, trạng thái thị trường bắt đầu thay đổi khi     lực cầu quay trở lại ở một số nhóm cổ phiếu có câu chuyện riêng. Đáng chú ý nhất     là NVL và HAG, 2 mã ghi nhận giao dịch đột biến cả về khối lượng lẫn biên độ     giá. Những chuyển động mạnh ở các cổ phiếu này góp phần giải tỏa sự thận trọng     của nhà đầu tư, tạo xung lực giúp VN-Index dần thu hẹp mức giảm và sau đó vượt     lên trên tham chiếu.
Dù sự hồi phục diễn ra tương đối thuyết phục, thanh khoản vẫn     là điểm hạn chế của phiên hôm nay. Giá trị khớp lệnh toàn thị trường chỉ đạt     khoảng23.300 tỷ đồng, giảm 4% so với phiên trước. Diễn biến này cho thấy dòng     tiền lớn vẫn chưa trở lại mạnh mẽ và thị trường hiện chủ yếu vận hành nhờ lực đẩy     từ một số nhóm cổ phiếu mang tính câu chuyện.
Kết phiên, VN-Index tăng 4,02 điểm (+0,3%) lên 1.635,46 điểm.     HNX-Index tăng 1,32 điểm (0,5%) lên 267,61 điểm; UPCoM-Index nhích 0,05 điểm     (+0,1%) và dừng ở 120,09 điểm.
Độ rộng thị trường cho thấy sự phân hóa rõ rệt: toàn thị trường     ghi nhận 389 mã tăng giá, trong đó có 32 mã tăng trần; 852 mã đứng giá và 361     mã giảm, với 19 mã giảm sàn.
VN-Index nỗ lực tạo đáy. Ảnh:TradingView.
Nhóm cổ phiếu vốn hóa lớn cũng không tạo được sự đồng thuận     khi rổ VN30 ghi nhận 11 mã tăng, 6 mã đứng giá và 13 mã giảm. Tuy vậy, lực kéo     từ một số cổ phiếu dẫn dắt vẫn đủ để giúp chỉ số VN30 tăng hơn 7 điểm, lên     1.871 điểm, qua đó hỗ trợ đáng kể cho nhịp hồi của thị trường chung.
Động lực kéo VN-Index đi lên hôm nay rải rác khắp nhiều nhóm     ngành. Những cái tên tiêu biểu nhất gồm TCX (+3%), LPB (+2%), HPG (+1,3%), VHM     (+0,6%), VNM (+1,6%), NVL (tăng trần), MWG (+1,6%), FPT (+1,1%), VCB (+0,3%) và     HAG (tăng trần).
Trong đó, cả NVL củaNovalandvà HAG của Hoàng AnhGia Laicùng     diễn biến khởi sắc sau khi đón loạt tin vui liên quan đến hoạt động đầu tư -     kinh doanh.
Sự bứt phá của NVL diễn ra sau khi doanh nghiệp đón thêm tín     hiệu tích cực từ các dự án tại Đồng Nai. Sở Xây dựng tỉnh này vừa xác nhận 204     căn nhà thấp tầng tại phân khu Ever Green 1, thuộc đại dự án Aqua City (phường     Long Hưng, TP Biên Hòa), đủ điều kiện đưa vào kinh doanh. Theo cơ quan quản lý,     các sản phẩm nói trên đã đáp ứng đầy đủ yêu cầu pháp lý, đất đai, hạ tầng và     quy hoạch chi tiết 1/500 sau điều chỉnh.
Tính đến cuối tháng 10, Aqua City đã có gần 2.400 căn được     phép ký hợp đồng mua bán. Trước đó, Sở Xây dựng Đồng Nai cũng đã lần lượt chấp     thuận 874 căn tại River Park 2, 576 căn tại Sun Harbor 2, 561 căn tại Sun     Harbor 3 và 171 căn thuộc Ever Green 1 đủ điều kiện mở bán.
Bên cạnh việc tháo gỡ pháp lý dự án, Novaland đang đẩy mạnh     tiến độ bàn giao sổ hồng cho cư dân. Doanh nghiệp đã hoàn tất hơn 550 sổ hồng tại     dự án The Sun Avenue (TP Thủ Đức), đồng thời hàng nghìn trường hợp khác đang     trong quá trình hoàn thiện thủ tục để bàn giao mạnh từ nay đến cuối năm.
Ở chiều song song, HAG tăng trần trong bối cảnh doanh nghiệp     của Chủ tịch Đoàn Nguyên Đức công bố kế hoạch mở rộng quy mô đầu tư cùng lộ     trình đưa các công ty thành viên lên sàn.Hoàng Anh Gia Laidự kiến đưa Công ty     TNHH Hưng Thắng Lợi Gia Lai lên sàn vào năm 2026 và CTCP Gia Súc Lơ Pang vào     năm 2027. Song song, tập đoàn đang thúc đẩy chiến lược nông nghiệp với trọng     tâm là cây cà phê và sầu riêng.
Chiều ngược lại, nhóm cản bước thị trường là những bluechip     quen thuộc như CTG (-0,6%), VPL (-1,2%), MSN (-1,3%), STB (-1,3%), ACB (-0,6%),     VIC (-0,1%), SSB (-0,9%), BCM (-0,6%), GVR (-0,4%) và SAB (-0,6%).

VinMetal bất ngờ nâng vốn điều lệ lên15.000 tỷ đồngvà thay tổng giám đốc. Lãnh đạo mới của doanh nghiệp là một nhân sự cấp cao của Thép Pomina.
13 giờ trước

Cổ phiếu DGC của Hóa chất Đức Giang tăng trần lên 100.000 đồng sau khi được Hà Nội phê duyệt dự án bất động sản hơn4.500 tỷ đồng.
32:1932 hôm qua

Tỷ phú Thái Lan Charoen Sirivadhanabhakdi - chủ sở hữu Thaibev, tập đoàn nắm quyền chi phối Sabeco - đã nhận tổng cộng hơn15.400 tỷ đồngcổ tức từ công ty bia của Việt Nam.
38:2309 hôm qua
Trong môi trường kinh tế hiện nay, đầu tư đã trở thành khái niệm không mấy xa lạ với hầu hết mọi người. Để độc giả có thể tiếp cận những xu hướng đầu tư mới nhất,Tri Thức - Znewsxây dựng chủ đềĐầu tư qua sách- nơi ghi lại những cuốn sách, câu chuyện, xu hướng đầu tư đã và đang diễn ra. Trong đó, các lĩnh vực đầu tư phổ biến bao gồm bất động sản, chứng khoán, ngoại hối và tiền ảo... Ngoài các câu chuyện về đầu tư, Đầu tư qua sách còn bao gồm các kiến thức về quản lý gia sản, tài chính cá nhân."
