url,title,description,content
https://znews.vn/chua-den-nguong-nop-thue-co-can-tu-quyet-toan-thue-thu-nhap-post1601182.html,Chưa đến ngưỡng nộp thuế có cần tự quyết toán thuế thu nhập,Người dân băn khoăn về việc có phải tự quyết toán thuế thu nhập cá nhân trong trường hợp thu nhập chưa đến ngưỡng phải nộp thuế.,"Trả lời câu hỏi này, Cục Thuế cho biết: Tại điểm d.3 Khoản 6 Điều 8 Nghị định số 126/2020/NĐ-CP quy định cá nhân cư trú có thu nhập từ tiền lương, tiền công trực tiếp khai quyết toán thuế thu nhập cá nhân với cơ quan thuế trong các trường hợp sau:
Cá nhân có số thuế phải nộp thêm hoặc có số thuế nộp thừa đề nghị hoàn hoặc bù trừ vào kỳ khai thuế tiếp theo, trừ các trường hợp cá nhân có số thuế phải nộp thêm sau quyết toán của từng năm từ 50.000 đồng trở xuống.
Cá nhân có số thuế phải nộp nhỏ hơn số thuế đã tạm nộp mà không có yêu cầu hoàn thuế hoặc bù trừ vào kỳ khai thuế tiếp theo.
Chưa đến ngưỡng phải nộp thuế, có cần phải tự quyết toán thuế thu nhập cá nhân.
Cá nhân có thu nhập từ tiền lương, tiền công ký hợp đồng lao động từ 3 tháng trở lên tại một đơn vị, đồng thời có thu nhập vãng lai ở các nơi khác bình quân tháng trong năm không quá 10 triệu đồng và đã được khấu trừ thuế thu nhập cá nhân theo tỷ lệ 10% nếu không có yêu cầu thì không phải quyết toán thuế đối với phần thu nhập này.
Căn cứ quy định trên, trường hợp trong năm tính thuế, cá nhân có thu nhập tiền lương, tiền công tại một nơi ký hợp đồng lao động từ 3 tháng trở lên được ủy quyền cho tổ chức trả thu nhập quyết toán thay mà không phải trực tiếp quyết toán thuế, kể cả trường hợp đến ngưỡng thu nhập nộp thuế hay chưa đến ngưỡng thu nhập nộp thuế.
Trường hợp trong năm tính thuế, cá nhân có thu nhập tiền lương tiền công tại một nơi ký hợp đồng lao động từ 3 tháng trở lên, đồng thời có thu nhập vãng lai ở các nơi khác bình quân tháng trong năm không quá 10 triệu đồng và đã được khấu trừ thuế thu nhập cá nhân theo tỷ lệ 10% nếu không có yêu cầu quyết toán thuế đối với phần thu nhập này thì được ủy quyền cho tổ chức trả thu nhập quyết toán thay mà không phải trực tiếp quyết toán thuế.
Quy định này áp dụng với cả trường hợp tại nơi ký hợp đồng lao động từ 3 tháng trở lên có thu nhập đến ngưỡng nộp thuế hay chưa đến ngưỡng nộp thuế.
Trường hợp cá nhân có từ 2 nguồn thu nhập trở lên trong năm tính thuế mà có tổng thu nhập trong năm chưa đến ngưỡng nộp thuế thì không được ủy quyền quyết toán và cũng không phải tự quyết toán thuế thu nhập cá nhân.
Tuy nhiên, nếu cá nhân này đã được tổ chức trả thu nhập khấu trừ thuế TNCN trong năm (tức là cá nhân có số thuế nộp thừa) thì nếu cá nhân không có đề nghị hoàn hoặc không yêu cầu bù trừ vào kỳ khai thuế tiếp theo thì không phải tự khai quyết toán thuế thu nhập cá nhân.

Cơ quan thuế cho biết trường hợp cá nhân vừa làm việc tại cơ quan nhà nước vừa có thêm thu nhập tại doanh nghiệp, việc đăng ký giảm trừ gia cảnh cho bản thân và người phụ thuộc chỉ được thực hiện tại một nơi.
19:06 8/11/2025

Theo Cục Thuế, việc yêu cầu và nhận hóa đơn đầu vào giúp hộ kinh doanh bảo vệ quyền lợi chính đáng, phòng tránh rủi ro pháp lý, thể hiện chuyên nghiệp, minh bạch trong kinh doanh.
15:59 7/11/2025

Nhiều người băn khoăn về quy trình, thời gian xử lý hoàn thuế thu nhập cá nhân.
19:14 6/11/2025"
https://znews.vn/trinh-quoc-hoi-chu-truong-dau-tu-du-an-san-bay-gia-binh-post1602422.html,Chính thức trình Quốc hội dự án sân bay Gia Bình top 10 thế giới,"Sáng 14/11, Chính phủ đã chính thức gửi tờ trình về việc chấp thuận chủ trương đầu tư dự án Cảng hàng không quốc tế Gia Bình tới Quốc hội.","Phối cảnh Cảng hàng không quốc tế Gia Bình. Ảnh:ACV.
Thừa ủy quyền của Thủ tướng, Bộ trưởng Xây dựng Trần Hồng Minh vừa gửi tờ trình về chủ trương đầu tư Dự án xây dựng Cảng hàng không quốc tế Gia Bình tới Quốc hội.
Bộ trưởng Minh cho biết Cảng hàng không quốc tế Nội Bài hiện nay là cửa ngõ hàng không quốc tế chính của Thủ đô và vùng kinh tế trọng điểm Bắc Bộ. Tuy nhiên, sân bay này đang khai thác vượt quá công suất thiết kế đồng thời còn một số hạn chế về chất lượng dịch vụ, tiện ích, công nghệ so với các sân bay trong khu vực.
Bộ trưởng Xây dựng Trần Hồng Minh trình Quốc hội tờ trình về việc chấp thuận chủ trương đầu tư dự án Cảng hàng không quốc tế Gia Bình. Ảnh:Quochoi.vn.
Dù sân bay Nội Bài đã có nghiên cứu, quy hoạch mở rộng nhưng gặp nhiều khó khăn do hạn chế về quỹ đất, giải phóng mặt bằng và cần thời gian để hoàn thành.
Trong bối cảnh đó, việc đầu tư xây dựng Cảng hàng không quốc tế Gia Bình là bước đi chiến lược, mang tính đột phá, góp phần tái cấu trúc mạng lưới hàng không Vùng Thủ đô theo mô hình “trung tâm kép” đã được nhiều đô thị lớn trên thế giới áp dụng thành công như London (Anh), Tokyo (Nhật Bản).
Sân bay Gia Bình sẽ giữ vai trò bổ trợ chiến lược cho sân bay Nội Bài, phát huy lợi thế về không gian, kết nối và hạ tầng, đồng thời tạo đà phát triển cho các ngành công nghiệp, logistics, thương mại điện tử, du lịch và dịch vụ. Dự án đồng thời có ý nghĩa đặc biệt trong bảo đảm quốc phòng, an ninh và phục vụ các sự kiện đối ngoại quan trọng, đặc biệt là Hội nghị cấp cao APEC năm 2027 (APЕС 2027).
Tờ trình củaChính phủcũng cho biết việc đầu tư dự án phù hợp với các quy hoạch tổng thể thời kỳ 2021-2030, tầm nhìn đến năm 2050. Sân bay sẽ được đầu tư theo các chuẩn mực quốc tế, trở thành cảng hàng không thông minh, xanh, bền vững, thế hệ mới; đạt tiêu chuẩn dịch vụ cảng hàng không quốc tế 5 sao, thuộc nhóm 10 cảng hàng không 5 sao hàng đầu thế giới theo tiêu chí của Skytrax…
Sân bay Gia Bình được quy hoạch với tổng diện tích khoảng 1.960 ha, rộng hơn sân bay Nội Bài và Tân Sơn Nhất (khoảng 1.500 ha), chỉ đứng sau sân bay Long Thành (5.000 ha). Ảnh:Đinh Hà.
Theo kế hoạch, nhu cầu sử dụng đất của dự án vào khoảng 1.885 ha, tổng vốn đầu tư khoảng196.378 tỷ đồng, trong đó giai đoạn 1 dự kiến đầu tư 141.236 tỷ và giai đoạn 2 khoảng 55.142 tỷ. Thời gian hoạt động dự án là 70 năm, từ 2025 đến năm 2095.
Sân bay Gia Bình sẽ được đầu tư với quy mô cấp 4F theo tiêu chuẩn của Tổ chức Hàng không dân dụng Quốc tế (ICAO); đáp ứng nhu cầu khai thác khoảng 30 triệu lượt khách/năm và 1,6 triệu tấn hàng hóa/năm giai đoạn đến năm 2030 và nâng lên khoảng 50 triệu lượt khách/năm và 2,5 triệu tấn hàng hóa/năm tầm nhìn đến năm 2050.
Theo thiết kế ban đầu, sân bay Gia Bình sẽ có 2 cặp đường cất hạ cánh song song, mỗi cặp gồm 2 đường cất hạ cánh; khoảng cách giữa hai cặp đường cất hạ cánh là 1.800 m. Chiều dài đường cất hạ cánh là 3.500-4.000 m, đáp ứng khả năng khai thác đối với tất cả loại máy bay thân rộng, tầm xa thế hệ mới hiện nay.
Trong giai đoạn đến năm 2030, sân bay sẽ bao gồm 83 vị trí đỗ máy bay, và tăng lên 123 vị trí đến năm 2050.
Về hạ tầng kết nối, sân bay Gia Bình sẽ được kết nối đồng bộ với hệ thống giao thông cấp quốc gia, cấp vùng, cấp tỉnh. Trong đó, khu vực Hà Nội được kết nối trực tiếp thông qua tuyến đường bộ cao tốc, đường sắt đô thị và đường sắt quốc gia.
Do sân bay Gia Bình cách sân bay Nội Bài chỉ 43 km và nằm trên hướng khởi hành chính của sân bay Nội Bài nên 2 sân bay nằm chung vùng trời hoạt động bay. Vì vậy, tư vấn và các chuyên gia chuyên ngành quản lý bay đã tuân thủ theo 6 nguyên tắc để thiết kế sơ bộ vùng trời và phương thức bay nhằm bảo đảm khai thác chung vùng trời tối ưu, an toàn và hiệu quả.
Thẩm tra tờ trình của Chính phủ, Chủ nhiệm Ủy ban Kinh tế và Tài chính Phan Văn Mãi cho biết Ủy ban nhất trí với sự cần thiết đầu tư sân bay Gia Bình. Tuy nhiên, cơ quan thẩm tra đề nghị cần lượng hóa rõ các mục tiêu của dự án (tiêu chuẩn 5 sao Skytrax, top 10 thế giới, Net Zero…), xác định lộ trình và tính khả thi.
Chủ nhiệm Ủy ban Kinh tế và Tài chính Phan Văn Mãi trình bày báo cáo thẩm tra về việc chấp thuận chủ trương đầu tư dự án sân bay Gia Bình. Ảnh:Quochoi.vn.
Đồng thời, cơ quan soạn thảo cần làm rõ phương án đầu tư hệ thống giao thông kết nối đa phương thức đồng bộ với tiến độ hoàn thành dự án; đánh giá tính khả thi trong việc hoàn thành dự án để đáp ứng tiến độ phục vụ APEC năm 2027, trong bối cảnh còn nhiều vướng mắc về bồi thường, hỗ trợ, tái định cư và điều kiện địa chất phức tạp.
Ngoài ra, Ủy ban Kinh tế và Tài chính cũng đề nghị phân tích cơ sở xác định thời gian hoạt động của dự án là 70 năm; cần xác định dựa trên thời gian thu hồi vốn thực tế và quy định giám sát định kỳ 5 năm/lần để cập nhật doanh thu, chi phí, lợi nhuận và điều chỉnh linh hoạt, nhằm bảo đảm hài hòa lợi ích giữa Nhà nước, nhà đầu tư và người sử dụng.
Cơ quan thẩm tra cũng yêu cầu làm rõ hơn về căn cứ tính toán suất đầu tư, so sánh suất đầu tư với các dự án sân bay tương đương trong khu vực và điều chỉnh theo giá địa phương để lựa chọn mức chi phí phù hợp, tối ưu; nguồn vốn, khả năng thu hồi vốn và trả nợ vốn vay.

Các đơn vị đã ứng chi trả tiền bồi thường giải phóng mặt bằng dự án Cảng hàng không quốc tế Gia Bình gần2.000 tỷ đồngcho khoảng 4.054 hộ dân.
00:14 12/11/2025

Ủy ban Thường vụ Quốc hội cho ý kiến về chủ trương đầu tư dự án xây dựng Cảng hàng không quốc tế Gia Bình (tỉnh Bắc Ninh).
19:18 6/11/2025
Tri Thức - Znewsgiới thiệu độc giảTủ sách kiến thức kinh tếvới đa dạng cuốn sách, câu chuyện trong lĩnh vực kinh doanh, kinh tế. Những cuốn sách, câu chuyện trong Tủ sách không đơn thuần là những tác phẩm của tri thức mà còn chứa đựng bí quyết, kinh nghiệm quý báu từ các tác giả, nhà quản lý có uy tín và kinh nghiệm lâu năm trong ngành.
Đọc sách không chỉ giúp tiếp cận những kiến thức mới mà còn giúp mở rộng tầm nhìn và phát triển bản thân. Tủ sách kiến thức kinh tế mong muốn lan tỏa tri thức trong lĩnh vực kinh doanh, đồng thời phát triển văn hóa đọc cho người Việt."
https://znews.vn/sep-flc-thay-ong-le-thai-sam-lam-chu-tich-bamboo-airways-post1602438.html,Sếp FLC thay ông Lê Thái Sâm làm Chủ tịch Bamboo Airways,Ông Bùi Quang Dũng giữ chức vụ Chủ tịch HĐQT Bamboo Airways nhiệm kỳ 2023-2028 thay ông Lê Thái Sâm.,"Bamboo Airways hướng đến giai đoạn phát triển mới khi trở về dưới quyền quản trị của Tập đoàn FLC. Ảnh:BAV.
Ngày 12/11, HĐQTBamboo Airwaysđã thống nhất bầu ông Bùi Quang Dũng giữ chức vụ Chủ tịch nhiệm kỳ 2023-2028 thay cho ông Lê Thái Sâm.
""Đây là động thái quan trọng của Bamboo Airways nhằm kiện toàn Hội đồng Quản trị, hướng đến giai đoạn phát triển mới sau khi trở về dưới quyền quản trị của Tập đoànFLC"", đại diện hãng bay cho biết.
Ông Bùi Quang Dũng là Thạc sĩ Quản trị Kinh doanh, Đại học Southern Columbia (Mỹ) và có hơn 15 năm kinh nghiệm trong lĩnh vực quản lý đầu tư, kinh doanh bất động sản.
Ông Bùi Quang Dũng, tân Chủ tịch HĐQT Bamboo Airways. Ảnh:BAV.
Ông từng đảm nhiệm nhiều vị trí cấp cao tại các doanh nghiệp lớn như Colliers International, BIM Group, Empire Group... và hiện giữ chức vụ Phó tổng giám đốc Tập đoàn FLC.
Tại Bamboo Airways, trước quyết định bổ nhiệm mới, ông Dũng đảm nhiệm vai trò Phó chủ tịch HĐQT kiêm Phó tổng giám đốc thường trực. Giai đoạn 2019-2022, ông giữ chức Phó tổng giám đốc tại hãng bay này.
Việc ông Bùi Quang Dũng - người đại diện Tập đoàn FLC - đảm nhiệm vai trò Chủ tịch được kỳ vọng sẽ tạo nên sự gắn kết vững chắc giữa Bamboo Airways và FLC, đảm bảo sự đồng bộ trong chiến lược tái cơ cấu, xây dựng lại hệ thống vận hành và định hướng phát triển lâu dài của hãng.
Theo nghị quyết cùng ngày, ông Lê Thái Sâm chính thức thôi giữ chức vụ Chủ tịch HĐQT và tiếp tục đồng hành với Bamboo Airways trên cương vị Thành viên HĐQT.
Hiện nay, HĐQT Bamboo Airways gồm 6 thành viên: Ông Bùi Quang Dũng, ông Lê Thái Sâm, ông Nguyễn Ngọc Trọng, ông Lê Bá Nguyên, ông Trương Phương Thành và bà Phùng Thị Thu Thảo.
Động thái thay đổi nhân sự cấp cao diễn ra trong bối cảnh Bamboo Airways chính thức trở về dưới sự quản trị trực tiếp của Tập đoàn FLC theo đề xuất từ nhóm nhà đầu tư cũ, đại diện cho ông Dương Công Minh.
Được biết ngay sau khi tiếp quản, FLC đã xây dựng kế hoạch phát triển mới cho Bamboo Airways trong giai đoạn 2026-2030 với mục tiêu tái cơ cấu hệ thống vận hành, mở rộng quy mô khai thác đội bay, củng cố mạng đường bay...
Trước mắt, Bamboo Airways đang cấp tập hoàn tất các công tác chuẩn bị để nhận thêm 1 tàu bay, phục vụ tăng cường tải cho giai đoạn cao điểm cuối năm. Đồng thời, hãng dự kiến tiếp tục bổ sung tàu bay để tăng quy mô đội bay ngay trước thềm Tết Nguyên đán 2026.
Trước đó, Bamboo Airways cũng thông báo tổ chức tuyển dụng tiếp viên hàng không quy mô lớn, phục vụ cho kế hoạch tăng trưởng trong dài hạn cũng như tiếp tục nâng cao chất lượng dịch vụ và trải nghiệm hành khách.
Bước vào giai đoạn 2026-2030, Bamboo Airways cùng FLC định hướng phát triển hệ sinh thái hàng không thông minh, kết hợp đa lĩnh vực: Dịch vụ bay, logistics, bảo dưỡng kỹ thuật, đào tạo nhân lực, suất ăn hàng không. Bên cạnh đó là chuỗi liên kết du lịch - nghỉ dưỡng - golf trên nền tảng công nghệ đồng bộ.
Tại các sân bay trọng điểm như Nội Bài, Tân Sơn Nhất, Long Thành, Phù Cát..., hãng cho biết sẽ phát triển các trung tâm dịch vụ phụ trợ hiện đại, tạo động lực tăng trưởng cho toàn hệ sinh thái FLC.
Tại Đại hội đồng cổ đông bất thường diễn ra sáng 11/11, Tổng giám đốc Tập đoànFLCBùi Hải Huyền cho biết chủ trương tiếp nhận lại quyền sở hữu, quản lý và điều hành Bamboo Airways được tập đoàn đưa ra trên cơ sở cân nhắc thận trọng, toàn diện và tuân thủ đầy đủ các quy định pháp luật.
Quyết định này xuất phát từ đề nghị của ông Lê Thái Sâm, Chủ tịch Bamboo Airways, và FLC đã đồng ý tiếp nhận quyền sở hữu, quản lý cũng như điều hành hãng hàng không.
Tuy nhiên, bà lưu ý chủ trương này được xây dựng dựa trên các nguyên tắc cốt lõi là không làm gián đoạn hay ảnh hưởng đến tiến trình tái cấu trúc của tập đoàn; triển khai theo lộ trình phù hợp với năng lực tài chính và nhân sự hiện có; đồng thời kiểm soát rủi ro chặt chẽ để đảm bảo an toàn và bền vững cho FLC.
""Chúng tôi cũng nhận thức được việc tiếp nhận Bamboo Airways trong bối cảnh tập đoàn đang tái cấu trúc toàn diện là một quyết định không hề dễ dàng"", bà Huyền nói thêm.

Tổng giám đốc FLC cho biết chủ trương tiếp nhận lại Bamboo Airways được tập đoàn đưa ra trên cơ sở cân nhắc thận trọng, tuân thủ đầy đủ các quy định pháp luật.
16:16 11/11/2025

Tập đoàn FLC nhận tiếp quản lại Bamboo Airways sau 2 năm, hãng bay này đứng trước thách thức khôi phục quy mô và tìm hướng đi mới giữa thị trường cạnh tranh đầy khốc liệt.
06:17 26/9/2025

Ông Lê Thái Sâm, Chủ tịch HĐQT Bamboo Airways đã đề nghị Tập đoàn FLC xem xét tiếp nhận quyền sở hữu, quản lý và điều hành hãng hàng không này.
12:17 25/9/2025
Tri Thức - Znewsgiới thiệu độc giảTủ sách kiến thức kinh tếvới đa dạng cuốn sách, câu chuyện trong lĩnh vực kinh doanh, kinh tế. Là nguồn tư liệu cho những người quan tâm và muốn nâng cao kiến thức trong lĩnh vực kinh tế. Những cuốn sách, câu chuyện trong Tủ sách không chỉ đơn thuần là những tác phẩm của tri thức mà còn chứa đựng bí quyết, kinh nghiệm quý báu từ các tác giả, nhà quản lý có uy tín và kinh nghiệm lâu năm trong ngành.
Đọc sách không chỉ giúp người đọc tiếp cận những kiến thức mới mà còn giúp mở rộng tầm nhìn và phát triển bản thân. Tủ sách kiến thức kinh tế mong muốn lan tỏa tri thức trong lĩnh vực kinh doanh, đồng thời phát triển văn hóa đọc cho người Việt."
https://znews.vn/trai-tim-san-bay-long-thanh-don-loat-thiet-bi-quan-trong-post1602287.html,'Trái tim' sân bay Long Thành đón loạt thiết bị quan trọng,"Các thiết bị lớn, quan trọng tại nhà ga hành khách sân bay Long Thành đã được vận chuyển đến công trường, lắp đặt đồng loạt.","Công nhân lát đá sàn tầng 1 nhà ga hành khách sân bay Long Thành. Ảnh:Công Phong/TTXVN.
Tổng công ty Cảng hàng không Việt Nam (ACV) cho biết thời gian gần đây, các thiết bị lớn, quan trọng tại nhà ga hành khách - nơi được xem như ""trái tim"" của sân bay Long Thành - đã được vận chuyển đến công trường, lắp đặt đồng loạt. Đến nay, nhiều trang thiết bị đã cơ bản lắp đặt xong.
Tới đây, các đơn vị sẽ tập trung nguồn lực hoàn thiện những hạng mục ưu tiên, đẩy nhanh lắp đặt trang thiết bị, sẵn sàng đón chuyến bay kỹ thuật đầu tiên đáp xuống sân bay Long Thành vào ngày 19/12.
Những ngày qua, bộ cầu ống lồng đầu tiên trong 64 bộ cầu ống lồng tại nhà ga hành khách đã được đưa đến công trường. Trước khi lắp đặt, các cầu ống lồng sẽ được đội ngũ chuyên gia, kỹ sư nhà thầu kiểm tra kỹ lưỡng, đảm bảo đáp ứng các tiêu chuẩn kỹ thuật.
Để thực hiện nâng, lắp đặt các cầu ống lồng, nhà thầu đã huy động đến công trường 2 cần cẩu với tải trọng 140 tấn. Việc nâng cầu ống lồng để lắp đặt sẽ được tiến hành theo từng giai đoạn.
Ở mỗi độ cao được nâng lên, nhóm chuyên gia, kỹ sư sẽ tiếp tục thực hiện việc kiểm tra các yếu tố kỹ thuật. Khi được nâng lên độ cao phù hợp, các cầu ống lồng sẽ được khớp nối, lắp ráp với phần cabin.
Sau khi các hệ thống được lắp ráp, kết nối đồng bộ, các cầu ống lồng sẽ được lắp đặt vào hệ thống kết cấu thép khu cầu ống lồng đã được thi công trước đó.
Tại khu vực nhà ga hành khách, các nhà thầu cũng đang đẩy nhanh việc lắp đặt, hoàn thiện hệ thống xử lý hành lý; thang cuốn, thang bộ hành; thang máy.
Trong lúc này, các máy soi chiếu hành lý cũng đã được nhà thầu đưa đến công trường, chuẩn bị lắp đặt. Hệ thống dẫn đậu tàu bay đã hoàn tất gia công chế tạo, vận chuyển đến công trường.
Đồng thời, tháp không lưu - ""bộ não"" của sân bay Long Thành - đã cơ bản hoàn thành phần kết cấu xây dựng, đang trong giai đoạn lắp đặt, hoàn thiện thiết bị bên trong.
Các hạng mục phụ trợ như nhà kỹ thuật, nhà VIP, trạm nguồn và cảnh quan khu ATC cũng đang được khẩn trương triển khai.
Ban quản lý dự án sân bay Long Thành và Công ty Quản lý bay miền Nam đang tích cực phối hợp với các nhà thầu nước ngoài để lắp đặt hệ thống thiết bị chuyên ngành quản lý bay, bảo đảm sẵn sàng cho chuyến bay kỹ thuật dự kiến vào ngày 15/12.

Tháp không lưu tại sân bay Long Thành đã cơ bản hoàn thành phần kết cấu xây dựng, đang trong giai đoạn lắp đặt, hoàn thiện thiết bị bên trong.
04:11 12/11/2025

Phó thủ tướng Trần Hồng Hà chỉ đạo triển khai đầu tư ngay đường băng thứ 3 cần dựa trên việc đánh giá kỹ lưỡng về sự cần thiết, tính khả thi, hiệu quả khai thác...
20:27 9/11/2025

Sau hơn 4 năm khởi công, sân bay Long Thành lộ rõ hình hài với các hạng mục tháp kiểm soát không lưu, đường băng, trụ sở các cơ quan quản lý nhà nước, nhà ga sân bay Long Thành.
06:17 7/11/2025
Tri Thức - Znewsgiới thiệu độc giảTủ sách kiến thức kinh tếvới đa dạng cuốn sách, câu chuyện trong lĩnh vực kinh doanh, kinh tế. Là nguồn tư liệu cho những người quan tâm và muốn nâng cao kiến thức trong lĩnh vực kinh tế. Những cuốn sách, câu chuyện trong Tủ sách không chỉ đơn thuần là những tác phẩm của tri thức mà còn chứa đựng bí quyết, kinh nghiệm quý báu từ các tác giả, nhà quản lý có uy tín và kinh nghiệm lâu năm trong ngành.
Đọc sách không chỉ giúp người đọc tiếp cận những kiến thức mới mà còn giúp mở rộng tầm nhìn và phát triển bản thân. Tủ sách kiến thức kinh tế mong muốn lan tỏa tri thức trong lĩnh vực kinh doanh, đồng thời phát triển văn hóa đọc cho người Việt."
